ปตร.คลองลาดพร้าว,ต.วังทองหลาง อ.วังทองหลาง จ.กรุงเทพมหานคร,00:00 น.,0.5,13.794322588090221,100.58932900428772
บ้านแม่เหล็ก,ต.ทาขุมเงิน อ.แม่ทา จ.ลำพูน,00:00 น.,0.5,18.31773036096034,98.97199988365173
บ้านห้วยหินลับ,ต.วังกวาง อ.น้ำหนาว จ.เพชรบูรณ์,00:00 น.,0.5,16.87848579415515,101.63400113582611
บ้านห้วยยาบ,ต.ทาเหนือ อ.แม่ออน จ.เชียงใหม่,00:00 น.,0.5,18.653467708083664,99.30000185966492
บ้านหวายหนิม*,ต.น้ำหัก อ.คีรีรัฐนิคม จ.สุราษฎร์ธานี,00:00 น.,0.5,9.137128514335346,98.95732283592224
จุดวัด ค.บึงใหญ่-วัดทองสัมฤทธิ์,ต.แสนแสบ อ.มีนบุรี จ.กรุงเทพมหานคร,00:00 น.,0.5,13.800449111269785,100.7882684469223
จุดวัด ค.ลำผักชี-รร.ลำผักชี,ต.ลำผักชี อ.หนองจอก จ.กรุงเทพมหานคร,00:00 น.,0.5,13.792051148769437,100.8352392911911
จุดวัด ค.ประเวศฯ-ถ.ร่วมพัฒนา,ต.ขุมทอง อ.ลาดกระบัง จ.กรุงเทพมหานคร,17:00 น.,0.5,13.700972241564019,100.85105895996094
บ้านหน้าเขา,ต.นาหลวงเสน อ.ทุ่งสง จ.นครศรีธรรมราช,16:00 น.,0.5,8.22619714368523,99.70099747180939
เชียงราย,ต.บ้านดู่ อ.เมืองเชียงราย จ.เชียงราย,16:00 น.,0.5,19.961389284128593,99.88138675689697
ปตร.คลองขุนศรีฯ-ค.มหาสวัสดิ์,ต.ศาลาธรรมสพน์ อ.ทวีวัฒนา จ.กรุงเทพมหานคร,00:00 น.,0.5,13.802439154674646,100.37070214748383
บ้านขุนวาง,ต.แม่วิน อ.แม่วาง จ.เชียงใหม่,00:00 น.,1.5,18.62290312248171,98.51999938488007
บ้านม่วงชุม,ต.ครึ่ง อ.เชียงของ จ.เชียงราย,19:00 น.,0.5,20.101241439494185,100.4039990901947
บ้านมูเซอ,ต.ม่อนจอง อ.อมก๋อย จ.เชียงใหม่,00:00 น.,0.5,17.56889992340133,98.52200031280518
บ้านยางครก,ต.ยางเปียง อ.อมก๋อย จ.เชียงใหม่,00:00 น.,0.5,17.795878167152015,98.4630024433136
บ้านมะหินหลวง,ต.อมก๋อย อ.อมก๋อย จ.เชียงใหม่,05:00 น.,0.5,17.899953673179937,98.3180022239685
บ้านสันหลวง,ต.แม่เปา อ.พญาเม็งราย จ.เชียงราย,18:00 น.,0.5,19.843853671779794,100.13200163841248
บ้านเขาวงพระจันทร์,ต.หนองฝ้าย อ.เลาขวัญ จ.กาญจนบุรี,17:00 น.,0.5,14.712120583016896,99.64299738407135
บ้านตะเคียนงาม,ต.บ้านเก่า อ.เมืองกาญจนบุรี จ.กาญจนบุรี,00:00 น.,0.5,13.812956930013955,99.1700005531311
บ้านไทยประจัน,ต.ยางหัก อ.ปากท่อ จ.ราชบุรี,00:00 น.,0.5,13.277722497637203,99.55999910831451
บ้านหนองสองห้อง,ต.ห้วยแห้ง อ.แก่งคอย จ.สระบุรี,00:00 น.,0.5,14.459677518392946,101.03799819946289
บ้านโคกแสมสาร,ต.โคกแสมสาร อ.โคกเจริญ จ.ลพบุรี,00:00 น.,0.5,15.3367687808151,100.83199918270111
บ้านห้วยแห้ง,ต.ขะเนจื้อ อ.แม่ระมาด จ.ตาก,00:00 น.,1,17.10296069056762,98.41899812221527
บ้านเจ้าพ่อเขาตก,ต.พุกร่าง อ.พระพุทธบาท จ.สระบุรี,18:00 น.,0.5,14.69904506976545,100.78500151634216
บ้านน้ำม้าเหนือ,ต.สถาน อ.เชียงของ จ.เชียงราย,16:00 น.,0.5,20.20574285081291,100.36999940872192
บ้านแม่แมะ,ต.แม่แรม อ.แม่ริม จ.เชียงใหม่,00:00 น.,0.5,18.900551638858527,98.88200104236603
บ้านเชิงผา,ต.กลางดง อ.ทุ่งเสลี่ยม จ.สุโขทัย,00:00 น.,0.5,17.31861307323008,99.51100051403046
บ้านห้วยตม,ต.บ้านตึก อ.ศรีสัชนาลัย จ.สุโขทัย,00:00 น.,0.5,17.669156298409597,99.92999911308289
บ้านแม่เทินเหนือ,ต.แม่สิน อ.ศรีสัชนาลัย จ.สุโขทัย,00:00 น.,0.5,17.75894540313445,99.7869998216629
บ้านตลิ่งชัน,ต.ตลิ่งชัน อ.บ้านด่านลานหอย จ.สุโขทัย,00:00 น.,0.5,17.144004459800207,99.39500033855438
บ้านเด่นวัวน้ำทิพย์,ต.เชียงทอง อ.วังเจ้า จ.ตาก,22:00 น.,0.5,16.623408585338982,99.18799817562103
บ้านแม่ฮู้,ต.แม่สิน อ.ศรีสัชนาลัย จ.สุโขทัย,23:00 น.,0.5,17.70472267516475,99.73300158977509
บ้านแม่เชียงรายบน,ต.พระบาทวังตวง อ.แม่พริก จ.ลำปาง,00:00 น.,0.5,17.36182082182149,99.1450023651123
บ้านตามูล,ต.ทรายขาว อ.สอยดาว จ.จันทบุรี,00:00 น.,11,13.081176476715976,102.26099967956543
บ้านขุนห้วยแม่ต้าน,ต.แม่ต้าน อ.ท่าสองยาง จ.ตาก,00:00 น.,0.5,17.271742840279448,98.23699951171875
บ้านกะเหรี่ยงน้ำตก,ต.คลองลานพัฒนา อ.คลองลาน จ.กำแพงเพชร,23:00 น.,0.5,16.1269381467577,99.30700242519379
บ้านแก่น,ต.นายาง อ.สบปราบ จ.ลำปาง,00:00 น.,0.5,17.9327894987897,99.27499830722809
บ้านท่าทองแดง,ต.นาโบสถ์ อ.วังเจ้า จ.ตาก,00:00 น.,0.5,16.673699004928665,99.14199829101562
บ้านทรายขาวออก,ต.ทรายขาว อ.โคกโพธิ์ จ.ปัตตานี,00:00 น.,0.5,6.67340961641929,101.10561668872833
บ้านกิ่วลม,ต.บ่อหลวง อ.ฮอด จ.เชียงใหม่,00:00 น.,0.5,18.138878075907297,98.36900174617767
บ้านเมืองนะ,ต.แม่นะ อ.เชียงดาว จ.เชียงใหม่,00:00 น.,0.5,19.73432025766,98.89699995517731
ชุมชนกุนุงจนอง,ต.เบตง อ.เบตง จ.ยะลา,00:00 น.,0.5,5.785340924659716,101.05644106864929
บ้านก้อทุ่ง,ต.ก้อ อ.ลี้ จ.ลำพูน,00:00 น.,0.5,17.62727412248003,98.79000127315521
บ้านทับศิลา,ต.ช่องสะเดา อ.เมืองกาญจนบุรี จ.กาญจนบุรี,16:00 น.,0.5,14.233618339579902,99.15554881095886
บ้านหุบเฉลา ,ต.เขากระปุก อ.ท่ายาง จ.เพชรบุรี,00:00 น.,0.5,12.66132215461291,99.65457916259766
ที่ทำการน้ำตกนางรอง,ต.นาหินลาด อ.ปากพลี จ.นครนายก,00:00 น.,0.5,14.333358417064783,101.3209980726242
บ้านมะค่าสี่ซอง,ต.หนองพลับ อ.หัวหิน จ.ประจวบคีรีขันธ์,18:00 น.,0.5,12.585831924747025,99.67787146568298
บ้านเขาเลื่อมใต้,ต.คลองหาด อ.คลองหาด จ.สระแก้ว,00:00 น.,0.5,13.406297663471925,102.30465531349182
บ้านแม่ป๋ามนอก,ต.ปิงโค้ง อ.เชียงดาว จ.เชียงใหม่,00:00 น.,0.5,19.443451300028936,99.02900218963623
บ้านดอยปุย,ต.สุเทพ อ.เมืองเชียงใหม่ จ.เชียงใหม่,00:00 น.,3,18.816612513420566,98.88349771499634
บ้านห้วยข่อยหล่อย,ต.บ้านแซว อ.เชียงแสน จ.เชียงราย,17:00 น.,0.5,20.195754512069573,100.24100124835968
บ้านโป่งคอม,ต.ด่านช้าง อ.ด่านช้าง จ.สุพรรณบุรี,17:00 น.,0.5,14.764331800550265,99.56600189208984
บ้านขุนยวม,ต.ขุนยวม อ.ขุนยวม จ.แม่ฮ่องสอน,00:00 น.,0.5,18.81796318160443,97.93499886989594
บ้านอมพาย,ต.ป่าแป๋ อ.แม่สะเรียง จ.แม่ฮ่องสอน,00:00 น.,24.5,18.298250094472394,98.17199885845184
บ้านขนงพระใต้,ต.ขนงพระ อ.ปากช่อง จ.นครราชสีมา,00:00 น.,1,14.618426605705274,101.44399881362915
บ้านห้วยหลวง,ต.บ้านกาศ อ.แม่สะเรียง จ.แม่ฮ่องสอน,19:00 น.,0.5,18.22875519913082,97.92200088500977
บ้านนาหนอง,ต.หนองกะท้าว อ.นครไทย จ.พิษณุโลก,00:00 น.,0.5,17.085291549498148,100.76199889183044
บ้านห้วยโป่ง,ต.ห้วยโป่ง อ.เมืองแม่ฮ่องสอน จ.แม่ฮ่องสอน,00:00 น.,0.5,19.02632812448323,97.98399746417999
บ้านทุ่ง,ต.อ่าวนาง อ.เมืองกระบี่ จ.กระบี่,23:00 น.,0.5,8.050455037175501,98.80316019058228
บ้านสะพานหิน,ต.สลุย อ.ท่าแซะ จ.ชุมพร,00:00 น.,0.5,10.835049955444164,99.25776779651642
บ้านดอน,ต.ปอ อ.เวียงแก่น จ.เชียงราย,20:00 น.,0.5,20.01004850024978,100.48899829387665
บ้านห้วยหยวกป่าโซ,ต.แม่สลองใน อ.แม่ฟ้าหลวง จ.เชียงราย,16:00 น.,0.5,20.250908915976584,99.58100080490112
บ้านสันติคีรี,ต.แม่สลองนอก อ.แม่ฟ้าหลวง จ.เชียงราย,16:00 น.,0.5,20.16505045956637,99.62499976158142
บ้านขาแหย่ง,ต.เทอดไทย อ.แม่ฟ้าหลวง จ.เชียงราย,16:00 น.,0.5,20.27403803858642,99.61599826812744
บ้านทุ่งกระทิงทอง,ต.คุริง อ.ท่าแซะ จ.ชุมพร,23:00 น.,0.5,10.724991252486674,99.13499772548676
บ้านแพะแม่แฝกใหม่,ต.แม่แฝกใหม่ อ.สันทราย จ.เชียงใหม่,00:00 น.,0.5,18.99434001911395,98.99199843406677
ทต.สวนผึ้ง,ต.สวนผึ้ง อ.สวนผึ้ง จ.ราชบุรี,17:00 น.,0.4,13.544890536882551,99.33835744857788
อบต.พังทุย,ต.พังทุย อ.น้ำพอง จ.ขอนแก่น,00:00 น.,0.4,16.748218597898543,102.92319416999817
หน่วยพิทักษ์อุทยานแห่งชาติที่ ทล.๑๑ (ไทยสามัคคี),ต.ไทยสามัคคี อ.วังน้ำเขียว จ.นครราชสีมา,00:00 น.,0.4,14.322968508030826,101.93308353424072
อบต.โนนแดง,ต.โนนแดง อ.บรบือ จ.มหาสารคาม,00:00 น.,0.4,15.891219804898268,103.07812929153442
อบต.เขาพระ,ต.เขาพระ อ.รัตภูมิ จ.สงขลา,00:00 น.,1.2,7.080179347082024,100.18832266330719
รร.บ้านลำปลอกเหนือ,ต.ในควน อ.ย่านตาขาว จ.ตรัง,00:00 น.,9.4,7.354901490150456,99.81480896472931
ท้ายฝายยางบ้านตะลุง,ต.หนองเรือ อ.ชุมพลบุรี จ.สุรินทร์,00:00 น.,0.4,15.292878394722711,103.54234457015991
อบต.บ้านเสด็จ,ต.บ้านเสด็จ อ.เคียนซา จ.สุราษฎร์ธานี,00:00 น.,0.4,8.763590476449355,99.0646380186081
พิพิธภัณฑ์ธรรมชาติบ้านห้วยปลาหลด,ต.ด่านแม่ละเมา อ.แม่สอด จ.ตาก,00:00 น.,0.4,16.78369558987052,98.89484882354736
เชียรใหญ่,ต.การะเกด อ.เชียรใหญ่ จ.นครศรีธรรมราช,00:00 น.,0.2,8.089487752082738,100.12787640094757
รร.บ้านวาน้อย,ต.วาใหญ่ อ.อากาศอำนวย จ.สกลนคร,00:00 น.,0.4,17.622483607997985,103.93653273582458
ท้ายฝายยางกะฮาด,ต.กะฮาด อ.เนินสง่า จ.ชัยภูมิ,00:00 น.,1.4,15.638416108522208,102.04003393650055
เชียงดาว,ต.เชียงดาว อ.เชียงดาว จ.เชียงใหม่,00:00 น.,0.6,19.367267796102457,98.96888315677643
หน่วยพิทักษ์อุทยานแห่งชาติที่ รค.๒ (คลองสวน),ต.บ้านด่าน อ.บ้านด่านลานหอย จ.สุโขทัย,00:00 น.,0.4,17.026960225135902,99.62327241897583
ปากรอ,ต.ปากรอ อ.สิงหนคร จ.สงขลา,00:00 น.,0.4,7.261430318310761,100.42434632778168
หน่วยศึกษาการพัฒนาการอนุรักษ์ต้นน้ำผาเวียง,ต.แม่สิน อ.ศรีสัชนาลัย จ.สุโขทัย,00:00 น.,0.2,17.730170363683325,99.57424700260162
หน่วยจัดการต้นน้ำดอยตุง,ต.แม่ฟ้าหลวง อ.แม่ฟ้าหลวง จ.เชียงราย,16:00 น.,0.4,20.323701653440978,99.78436052799225
รพสต.บ่อวิน,ต.บ่อวิน อ.ศรีราชา จ.ชลบุรี,00:00 น.,27,13.055022897626808,101.09784364700317
สว่างแดนดิน,ต.โพนสูง อ.สว่างแดนดิน จ.สกลนคร,00:00 น.,0.2,17.594709413418677,103.3844643831253
ชุมชนบ้านโคกพะยอม,ต.ละงู อ.ละงู จ.สตูล,00:00 น.,0.4,6.818721728450893,99.8093318939209
หนองพลับ สกษ.,ต.หนองพลับ อ.หัวหิน จ.ประจวบคีรีขันธ์,16:00 น.,0.4,12.583334571993838,99.73333418369293
องครักษ์,ต.องครักษ์ อ.องครักษ์ จ.นครนายก,00:00 น.,2.4,14.113654645109856,101.01957142353058
สวนผึ้ง,ต.สวนผึ้ง อ.สวนผึ้ง จ.ราชบุรี,00:00 น.,0.4,13.560128909477825,99.36227202415466
ทต.เวียงพางคำ,ต.เวียงพางคำ อ.แม่สาย จ.เชียงราย,16:00 น.,0.4,20.40354959463141,99.88572657108307
ประจันตคาม (KGT7A),ต.ประจันตคาม อ.ประจันตคาม จ.ปราจีนบุรี,00:00 น.,0.2,14.070912207380376,101.5189129114151
สวี 1,ต.นาโพธิ์ อ.สวี จ.ชุมพร,00:00 น.,3,10.231240489947684,99.09843385219574
อบต.เขากระปุก,ต.เขากระปุก อ.ท่ายาง จ.เพชรบุรี,00:00 น.,0.4,12.719914941318901,99.73544239997864
สกลนคร,ต.ธาตุเชิงชุม อ.เมืองสกลนคร จ.สกลนคร,22:00 น.,0.5,17.150001854597125,104.13333177566528
ทต.แม่นะ,ต.แม่นะ อ.เชียงดาว จ.เชียงใหม่,00:00 น.,0.4,19.341247850877675,98.96128714084625
อบต.เวียง,ต.เวียง อ.ฝาง จ.เชียงใหม่,00:00 น.,0.4,19.94114883979092,99.21811401844025
อุตรดิตถ์,ต.ป่าเซ่า อ.เมืองอุตรดิตถ์ จ.อุตรดิตถ์,22:00 น.,0.4,17.6166652892981,100.09999752044678
เทศบาลตำบลเหนือ,ต.เหนือ อ.เมืองกาฬสินธุ์ จ.กาฬสินธุ์,00:00 น.,0.4,16.42524392225359,103.55971992015839
อบต.ท่าแยก,ต.ท่าแยก อ.เมืองสระแก้ว จ.สระแก้ว,00:00 น.,17.6,13.907689234112915,102.09394633769989
บ้านน้ำเย็น,ต.หินแก้ว อ.ท่าแซะ จ.ชุมพร,00:00 น.,6.4,10.588749729144034,99.03128206729889
อบต.พุ่มแก,ต.พุ่มแก อ.นาแก จ.นครพนม,00:00 น.,0.4,16.908831620177732,104.61868822574615
ชุมชนบ้านเหมือง,ต.อัยเยอร์เวง อ.เบตง จ.ยะลา,00:00 น.,0.4,5.923805427155755,101.12602293491364
สะพานวังแก่ง,ต.เขาเพิ่ม อ.บ้านนา จ.นครนายก,17:00 น.,0.4,14.364831861152707,101.09022617340088
เหนือฝายยโสธร,ต.แสนสุข อ.พนมไพร จ.ร้อยเอ็ด,21:00 น.,0.4,15.732541819055928,104.13179755210876
สะพานห้วยหลวง,ต.วัดหลวง อ.โพนพิสัย จ.หนองคาย,00:00 น.,0.4,18.016798589055057,103.08090269565582
ชุมชนบ้านควน 1,ต.พร่อน อ.เมืองยะลา จ.ยะลา,00:00 น.,1.2,6.576951396341405,101.16950154304504
ชุมชนม่วงชุม,ต.ครึ่ง อ.เชียงของ จ.เชียงราย,18:00 น.,0.4,20.101095347969203,100.40399372577667
ทต.ทุ่งเสลี่ยม,ต.ทุ่งเสลี่ยม อ.ทุ่งเสลี่ยม จ.สุโขทัย,00:00 น.,0.4,17.323770066900124,99.5675253868103
ทต.หนองขาหย่าง,ต.หนองขาหย่าง อ.หนองขาหย่าง จ.อุทัยธานี,00:00 น.,0.4,15.36230819537349,99.938485622406
หน่วยอนุรักษ์และจัดการต้นน้ำคลองอุดม,ต.วังทอง อ.วังสมบูรณ์ จ.สระแก้ว,00:00 น.,0.4,13.35167215032304,101.99859380722046
เขตรักษาพันธุ์สัตว์ป่าเขาสอยดาว,ต.ทรายขาว อ.สอยดาว จ.จันทบุรี,00:00 น.,0.4,13.10355505032165,102.1919596195221
สวี สกษ.,ต.วิสัยเหนือ อ.เมืองชุมพร จ.ชุมพร,22:00 น.,0.4,10.33333271381359,99.10000026226044
ทต.ศรีพนมมาศ,ต.ศรีพนมมาศ อ.ลับแล จ.อุตรดิตถ์,00:00 น.,0.4,17.65453723933944,100.03580689430237
โป่งน้ำร้อน,ต.หนองตาคง อ.โป่งน้ำร้อน จ.จันทบุรี,00:00 น.,6,13.036517764211583,102.38152742385864
ภูเก็ต (ศูนย์ฯ),ต.ไม้ขาว อ.ถลาง จ.ภูเก็ต,22:00 น.,0.4,8.145000215301025,98.31444561481476
โพธาราม,ต.เจ็ดเสมียน อ.โพธาราม จ.ราชบุรี,00:00 น.,0.4,13.633094735259267,99.81637001037598
อบต.หนองขนาก,ต.หนองขนาก อ.ท่าเรือ จ.พระนครศรีอยุธยา,00:00 น.,0.4,14.514187022803421,100.73523044586182
อุทยานแห่งชาติภูจองนายอย,ต.นาจะหลวย อ.นาจะหลวย จ.อุบลราชธานี,00:00 น.,0.4,14.435210111519881,105.25580942630768
หน่วยพิทักษ์อุทยานแห่งชาติที่ ศล.๕ (แม่ระงอง),ต.น้ำแพร่ อ.พร้าว จ.เชียงใหม่,23:00 น.,0.4,19.32973215639124,99.1340321302414
ท้ายกว๊านพะเยา,ต.เวียง อ.เมืองพะเยา จ.พะเยา,00:00 น.,0.6,19.159813243318244,99.91413116455078
หน่วยจัดการต้นน้ำดอยเปเปอร์,ต.แม่หละ อ.ท่าสองยาง จ.ตาก,00:00 น.,0.4,17.265078318227108,98.3586323261261
อบจ.น่าน,ต.ในเวียง อ.เมืองน่าน จ.น่าน,00:00 น.,0.4,18.799012210752903,100.73320806026459
สะพานมิตรภาพรับร่อ-หินแก้ว,ต.รับร่อ อ.ท่าแซะ จ.ชุมพร,00:00 น.,13,10.607479100186094,99.09539222717285
อุบลราชธานี (ศูนย์ฯ),ต.ไร่น้อย อ.เมืองอุบลราชธานี จ.อุบลราชธานี,22:00 น.,0.3,15.24999839435214,104.86666917800903
มุกดาหาร,ต.มุกดาหาร อ.เมืองมุกดาหาร จ.มุกดาหาร,22:00 น.,0.3,16.54138922090493,104.72888946533203
กาฬสินธุ์,ต.หลักเมือง อ.กมลาไสย จ.กาฬสินธุ์,16:00 น.,0.3,16.33250005128957,103.58833372592926
ดอยมูเซอร์ สกษ.,ต.แม่ท้อ อ.เมืองตาก จ.ตาก,22:00 น.,0.3,16.75000107985822,98.93333315849304
เมืองลำปาง,ต.ต้นธงชัย อ.เมืองลำปาง จ.ลำปาง,00:00 น.,0.2,18.342987781754378,99.53711450099945
เขตรักษาพันธุ์สัตว์ป่าฮาลา-บาลา,ต.โละจูด อ.แว้ง จ.นราธิวาส,00:00 น.,0.2,5.8074840957019775,101.84518218040466
คลองลาดพร้าว ท้ายปตร.คลอง2,ต.สายไหม อ.สายไหม จ.กรุงเทพมหานคร,00:00 น.,0.2,13.922503118351125,100.6343686580658
ที่ทำการอุทยานแห่งชาติทะเลบัน,ต.วังประจัน อ.ควนโดน จ.สตูล,00:00 น.,1,6.70904246603122,100.16908586025238
หน่วยจัดการต้นน้ำคลองป่าพรุพ้อ,ต.ทุ่งนารี อ.ป่าบอน จ.พัทลุง,00:00 น.,0.6,7.162175415979863,100.0845319032669
หน่วยจัดการต้นน้ำตาปี,ต.ตะกุกใต้ อ.วิภาวดี จ.สุราษฎร์ธานี,00:00 น.,0.2,9.162941985806267,98.8869845867157
หน่วยพิทักษ์อุทยานแห่งชาติที่ พล.๒ (บ้านอ่าง),ต.อ่างคีรี อ.มะขาม จ.จันทบุรี,22:00 น.,0.2,12.62518950269114,102.19488859176636
หน่วยจัดการต้นน้ำห้วยหลวง,ต.อูบมุง อ.หนองวัวซอ จ.อุดรธานี,00:00 น.,0.2,17.078497252095005,102.56073117256165
โครงการพัฒนาพื้นที่ภูผาหัก,ต.ผาสุก อ.วังสามหมอ จ.อุดรธานี,00:00 น.,0.2,17.1872479918389,103.45414817333221
หน่วยจัดการต้นน้ำห้วยอีมาย,ต.นาป่า อ.เมืองเพชรบูรณ์ จ.เพชรบูรณ์,00:00 น.,0.4,16.40933855153537,101.28303408622742
รร.ภูคาวิทยาคม,ต.ภูคา อ.ปัว จ.น่าน,00:00 น.,0.2,19.227994391235004,101.06259405612946
ท่าตูม,ต.ทุ่งกุลา อ.ท่าตูม จ.สุรินทร์,00:00 น.,0.2,15.329681130283811,103.68261337280273
สะพานห้วยน้ำใส,ต.เกาะขันธ์ อ.ชะอวด จ.นครศรีธรรมราช,00:00 น.,0.8,7.889541687744992,99.8742413520813
อบต.ไชยวัฒนา,ต.ไชยวัฒนา อ.ปัว จ.น่าน,00:00 น.,0.2,19.22249859247288,100.91778695583344
ที่ทำการอุทยานแห่งชาติน้ำตกโยง,ต.ถ้ำใหญ่ อ.ทุ่งสง จ.นครศรีธรรมราช,17:00 น.,0.2,8.172389832636899,99.74126815795898
