บ้านคลองลอย,ต.ร่อนทอง อ.บางสะพาน จ.ประจวบคีรีขันธ์,11:00 น.,4.5,11.294756591542175,99.3701308965683
บ้านปางไม้แดง,ต.บ้านช้าง อ.แม่แตง จ.เชียงใหม่,11:00 น.,4.5,19.14332860394366,98.86500120162964
บ้านหัวแม่คำ,ต.แม่สลองใน อ.แม่ฟ้าหลวง จ.เชียงราย,11:00 น.,4.5,20.367812476362644,99.46900248527527
บ้านควนใหม่,ต.โคกชะงาย อ.เมืองพัทลุง จ.พัทลุง,11:00 น.,4.5,7.631378437559678,99.99854564666748
แม่สะเรียง,ต.บ้านกาศ อ.แม่สะเรียง จ.แม่ฮ่องสอน,10:00 น.,4.5,18.166669245762503,97.93333053588867
บ้านควนนนท์,ต.ไม้เรียง อ.ฉวาง จ.นครศรีธรรมราช,11:00 น.,4.5,8.473396315217189,99.45000171661377
บ้านวัด,ต.ประกอบ อ.นาทวี จ.สงขลา,11:00 น.,4.5,6.487867301547453,100.67200005054474
อบต.บางครก,ต.บางครก อ.บ้านแหลม จ.เพชรบุรี,12:00 น.,4.4,13.198668668764427,99.95052874088287
อบต.แม่คง,ต.แม่คง อ.แม่สะเรียง จ.แม่ฮ่องสอน,12:00 น.,4.4,18.16087893288025,97.91760742664337
ทับมา,ต.ทับมา อ.เมืองระยอง จ.ระยอง,12:00 น.,4.4,12.737867922612816,101.2284404039383
ทต.ราไวย์,ต.ราไวย์ อ.เมืองภูเก็ต จ.ภูเก็ต,12:00 น.,4.4,7.770802038287509,98.31874787807465
สะพานแม่น้ำว้า บ้านบ่อหยวก,ต.บ่อเกลือเหนือ อ.บ่อเกลือ จ.น่าน,12:00 น.,4.2,19.270328662268543,101.17807388305664
อบต.ศีรษะจรเข้น้อย,ต.ศีรษะจรเข้น้อย อ.บางเสาธง จ.สมุทรปราการ,12:00 น.,4.2,13.677747429550672,100.79449117183685
สะพานคลองพาย,ต.น้ำหัก อ.คีรีรัฐนิคม จ.สุราษฎร์ธานี,12:00 น.,4.2,9.155654662599833,98.89499366283417
บ้านนาส้อง,ต.คลองใหญ่ อ.ตะโหมด จ.พัทลุง,11:00 น.,4,7.277878446450891,100.05299985408783
สะพานบ้าน กม.29 อ.เบตง จ.ยะลา,ต.อัยเยอร์เวง อ.เบตง จ.ยะลา,11:00 น.,4,5.9205772757963935,101.18208646774292
จุดวัดบึงหนองบอน,ต.หนองบอน อ.ประเวศ จ.กรุงเทพมหานคร,12:00 น.,4,13.695291339632558,100.65375030040741
บ้านเขาเหล็ก,ต.นบพิตำ อ.นบพิตำ จ.นครศรีธรรมราช,11:00 น.,4,8.768399169963601,99.72499787807465
บ้านบึงเหนือ,ต.บ้านคา อ.บ้านคา จ.ราชบุรี,11:00 น.,4,13.45423806400851,99.37399864196777
สะพานข้ามคลองห้วยกรวด,ต.เกาะขันธ์ อ.ชะอวด จ.นครศรีธรรมราช,12:00 น.,4,7.876820635003764,99.9333143234253
บ้านใหม่พัฒนา,ต.แม่อูคอ อ.ขุนยวม จ.แม่ฮ่องสอน,11:00 น.,4,18.842953664097216,97.99700081348419
บ้านเขาอ่าง,ต.มาบไพ อ.ขลุง จ.จันทบุรี,11:00 น.,4,12.606108271514946,102.24199891090393
บ้านผาฮี้ (อาข่า),ต.โป่งงาม อ.แม่สาย จ.เชียงราย,11:00 น.,4,20.351688588284134,99.82599914073944
รร.บ้านพูน,ต.กะปาง อ.ทุ่งสง จ.นครศรีธรรมราช,12:00 น.,4,8.038264841160766,99.64308857917786
บ้านบางหลาโอน,ต.คึกคัก อ.ตะกั่วป่า จ.พังงา,11:00 น.,4,8.647951119883022,98.26000213623047
ปะเหลียน,ต.ท่าพญา อ.ปะเหลียน จ.ตรัง,12:00 น.,3.8,7.371984583452164,99.67727601528168
บ้านขุนแม่ละอุปหมู่ที่ 3,ต.แจ่มหลวง อ.กัลยาณิวัฒนา จ.เชียงใหม่,12:00 น.,3.8,19.04022812437173,98.20028007030487
รร.กองม่องทะ สาขาไล่โว่,ต.ไล่โว่ อ.สังขละบุรี จ.กาญจนบุรี,12:00 น.,3.8,15.309311852149005,98.5098123550415
หน่วยจัดการต้นน้ำตาปี,ต.ตะกุกใต้ อ.วิภาวดี จ.สุราษฎร์ธานี,12:00 น.,3.8,9.162941985806267,98.8869845867157
สะพานเขานางบวช,ต.ศรีนาวา อ.เมืองนครนายก จ.นครนายก,12:00 น.,3.6,14.245821792965605,101.27430617809296
วัดวังตะเคียน,ต.ท่าสายลวด อ.แม่สอด จ.ตาก,12:00 น.,3.6,16.711486500252356,98.50664734840393
บางปะหัน,ต.โพธิ์สามต้น อ.บางปะหัน จ.พระนครศรีอยุธยา,12:00 น.,3.6,14.427308278670763,100.55606424808502
บ้านผาหมี,ต.เวียงพางคำ อ.แม่สาย จ.เชียงราย,11:00 น.,3.5,20.399300996873485,99.85099732875824
บ้านพญาไพรเล่ามา,ต.เทอดไทย อ.แม่ฟ้าหลวง จ.เชียงราย,11:00 น.,3.5,20.318615776965157,99.60599899291992
บ้านเขาพลู,ต.บางสัก อ.กันตัง จ.ตรัง,11:00 น.,3.5,7.4243310280873684,99.39700126647949
บ้านป่ากล้วย,ต.แม่สะเรียง อ.แม่สะเรียง จ.แม่ฮ่องสอน,11:00 น.,3.5,18.164141105174696,97.95499742031097
บ้านปูนะ,ต.เทอดไทย อ.แม่ฟ้าหลวง จ.เชียงราย,11:00 น.,3.5,20.30071578446536,99.6780002117157
บ้านทุ่งยาว,ต.แม่สาบ อ.สะเมิง จ.เชียงใหม่,11:00 น.,3.5,18.978457797902,98.67799758911133
บ้านกล้อทอ,ต.แม่จัน อ.อุ้มผาง จ.ตาก,11:00 น.,3.5,16.030454848000563,98.6659973859787
บ้านหมากปรก,ต.ไม้ขาว อ.ถลาง จ.ภูเก็ต,11:00 น.,3.5,8.120773869171678,98.33599984645844
บ้านวังรี,ต.เขาพระ อ.เมืองนครนายก จ.นครนายก,11:00 น.,3.5,14.333769013981707,101.19593739509583
บ้านบาโรย,ต.ปาดังเบซาร์ อ.สะเดา จ.สงขลา,11:00 น.,3.5,6.774552572314994,100.23100197315216
สะพานห้วยน้ำฮวย,ต.บ้านม่วง อ.สังคม จ.หนองคาย,12:00 น.,3.4,18.151168516900185,102.17911183834076
อบต.ยะรม,ต.ยะรม อ.เบตง จ.ยะลา,12:00 น.,3.2,5.775851491085242,101.09238266944885
เหนือปตร.บางระจัน,ต.เชิงกลัด อ.บางระจัน จ.สิงห์บุรี,12:00 น.,3.2,14.925918051210004,100.27582705020905
สะพานข้ามคลองวังเคียน,ต.วังอ่าง อ.ชะอวด จ.นครศรีธรรมราช,12:00 น.,3.2,7.954591467044247,99.89640176296234
รพ.สต.บ้านวังไทร,ต.แม่หวาด อ.ธารโต จ.ยะลา,12:00 น.,3.2,6.009299189702582,101.26802980899811
บ้านปางตอง,ต.แม่อูคอ อ.ขุนยวม จ.แม่ฮ่องสอน,11:00 น.,3,18.84358827853962,98.06400239467621
บ้านอ่าวกลาง,ต.วังมะปรางเหนือ อ.วังวิเศษ จ.ตรัง,11:00 น.,3,7.7690639783280915,99.36500251293182
หน่วยจัดการต้นน้ำดอยตุง,ต.แม่ฟ้าหลวง อ.แม่ฟ้าหลวง จ.เชียงราย,12:00 น.,3,20.323701653440978,99.78436052799225
บ้านวังขยาย,ต.ปรังเผล อ.สังขละบุรี จ.กาญจนบุรี,11:00 น.,3,14.941281160870552,98.61761033535004
บ้านขุนกลาง,ต.บ้านหลวง อ.จอมทอง จ.เชียงใหม่,11:00 น.,3,18.53855645003312,98.52400124073029
บ้านคลองกลาง,ต.พ่วงพรมคร อ.เคียนซา จ.สุราษฎร์ธานี,11:00 น.,3,8.664094412880944,99.08800005912781
สะพานห้วยน้ำใส,ต.เกาะขันธ์ อ.ชะอวด จ.นครศรีธรรมราช,12:00 น.,3,7.889541687744992,99.8742413520813
บ้านกอกหลวง,ต.แม่นาจาง อ.แม่ลาน้อย จ.แม่ฮ่องสอน,11:00 น.,3,18.529701393505903,98.13799917697906
ที่ว่าการอำเภอจะแนะ,ต.จะแนะ อ.จะแนะ จ.นราธิวาส,03:00 น.,3,6.098417366500117,101.69391632080078
บ้านห้วยหยวกป่าโซ,ต.แม่สลองใน อ.แม่ฟ้าหลวง จ.เชียงราย,11:00 น.,3,20.250908915976584,99.58100080490112
หน่วยพิทักษ์อุทยานแห่งชาติที่ ขญ.๔ (คลองปลากั้ง),ต.วังหมี อ.วังน้ำเขียว จ.นครราชสีมา,12:00 น.,3,14.356407847735943,101.72590434551239
ทต.ขุนยวม,ต.ขุนยวม อ.ขุนยวม จ.แม่ฮ่องสอน,12:00 น.,3,18.831220480827294,97.93512225151062
ทม.พัทลุง,ต.คูหาสวรรค์ อ.เมืองพัทลุง จ.พัทลุง,12:00 น.,2.8,7.618282700044703,100.07372260093689
บางตะบูน,ต.บางตะบูนออก อ.บ้านแหลม จ.เพชรบุรี,12:00 น.,2.8,13.265557221884588,99.94175255298615
ประโคนชัย,ต.ไพศาล อ.ประโคนชัย จ.บุรีรัมย์,12:00 น.,2.8,14.63301735124034,103.23046267032623
เมืองตราด,ต.ห้วยแร้ง อ.เมืองตราด จ.ตราด,12:00 น.,2.8,12.325197054747163,102.50044047832489
เมืองแกลง,ต.บ้านนา อ.แกลง จ.ระยอง,12:00 น.,2.8,12.803018542218112,101.65023922920227
ท้ายปตร.บางระจัน,ต.เชิงกลัด อ.บางระจัน จ.สิงห์บุรี,12:00 น.,2.8,14.925197554472183,100.27587532997131
เมืองตรัง,ต.บางรัก อ.เมืองตรัง จ.ตรัง,12:00 น.,2.6,7.555903648091325,99.57824349403381
อบต.แหลมฟ้าผ่า,ต.แหลมฟ้าผ่า อ.พระสมุทรเจดีย์ จ.สมุทรปราการ,12:00 น.,2.6,13.547106993795868,100.53763210773468
สตึก,ต.นิคม อ.สตึก จ.บุรีรัมย์,12:00 น.,2.6,15.299858632317608,103.29231441020966
บ้านนาพรุ,ต.นาคา อ.สุขสำราญ จ.ระนอง,11:00 น.,2.5,9.431408485746166,98.46690773963928
บ้านสะพานหิน,ต.สลุย อ.ท่าแซะ จ.ชุมพร,11:00 น.,2.5,10.835049955444164,99.25776779651642
บ้านคลองกรอย,ต.ท่าชะมวง อ.รัตภูมิ จ.สงขลา,11:00 น.,2.5,7.099370209814929,100.13000071048737
บ้านคลองตูกเหนือ,ต.กะปาง อ.ทุ่งสง จ.นครศรีธรรมราช,11:00 น.,2.5,8.018010777888575,99.72309350967407
บ้านดอน,ต.อัยเยอร์เวง อ.เบตง จ.ยะลา,11:00 น.,2.5,5.923976171775753,101.11786901950836
บ้านเกาะจง,ต.ทับช้าง อ.นาทวี จ.สงขลา,11:00 น.,2.5,6.524478173360233,100.65700113773346
บ้านนาบ่อ,ต.บ่อน้ำร้อน อ.กันตัง จ.ตรัง,11:00 น.,2.5,7.439985875555256,99.49499845504761
บ้านต้นกอ,ต.ร่อนพิบูลย์ อ.ร่อนพิบูลย์ จ.นครศรีธรรมราช,11:00 น.,2.5,8.143582361315486,99.80381190776825
ที่ว่าการอำเภอทุ่งช้าง,ต.ทุ่งช้าง อ.ทุ่งช้าง จ.น่าน,12:00 น.,2.4,19.386639608069014,100.87582647800446
แม่สอด,ต.แม่ตาว อ.แม่สอด จ.ตาก,10:00 น.,2.4,16.659165736222032,98.55083405971527
รร.ตชด.บ้านไอร์บือแต,ต.ช้างเผือก อ.จะแนะ จ.นราธิวาส,12:00 น.,2.4,6.048786980664947,101.5698105096817
ทต.บางสะพานน้อย,ต.บางสะพาน อ.บางสะพานน้อย จ.ประจวบคีรีขันธ์,12:00 น.,2.4,11.07616227133494,99.44528102874756
ปง,ต.ปง อ.ปง จ.พะเยา,12:00 น.,2.4,19.148188525950513,100.27747392654419
ตรัง,ต.โคกหล่อ อ.เมืองตรัง จ.ตรัง,10:00 น.,2.3,7.516666852969395,99.61666882038116
หน่วยจัดการต้นน้ำแม่กลาง,ต.บ้านหลวง อ.จอมทอง จ.เชียงใหม่,12:00 น.,2.2,18.533180402625185,98.52240800857544
ไร่ วงศ์ ทอง เมฆ ดี,ต.ที่วัง อ.ทุ่งสง จ.นครศรีธรรมราช,12:00 น.,2.2,8.090263163184026,99.73883271217346
ทต.ทัพทัน,ต.ทัพทัน อ.ทัพทัน จ.อุทัยธานี,12:00 น.,2.2,15.457609747080161,99.89484071731567
บ้านขุนพัง,ต.หินตก อ.ร่อนพิบูลย์ จ.นครศรีธรรมราช,11:00 น.,2,8.267771484935688,99.82200264930725
ท้ายปตร.ช่องแค,ต.พรหมนิมิต อ.ตาคลี จ.นครสวรรค์,12:00 น.,2,15.145540806462844,100.41323661804199
บ้านร่อนนา,ต.ร่อนพิบูลย์ อ.ร่อนพิบูลย์ จ.นครศรีธรรมราช,11:00 น.,2,8.180556439111768,99.83599841594696
หน่วยพิทักษ์ป่าเขาพัง,ต.เขาพัง อ.บ้านตาขุน จ.สุราษฎร์ธานี,11:00 น.,2,9.031821583025614,98.67944061756134
บ้านปลายระแนะ,ต.ละอาย อ.ฉวาง จ.นครศรีธรรมราช,11:00 น.,2,8.459961637962465,99.62999939918518
บ้านโรงกลวง,ต.นบปริง อ.เมืองพังงา จ.พังงา,11:00 น.,2,8.54707174492376,98.52799773216248
บ้านชายควน,ต.ปาดังเบซาร์ อ.สะเดา จ.สงขลา,11:00 น.,2,6.6902993147023455,100.30600190162659
บ้านคันเบ็ด,ต.เขาแก้ว อ.ลานสกา จ.นครศรีธรรมราช,11:00 น.,2,8.36572536706615,99.75799977779388
บ้านห้วยโป่งผาลาด,ต.แม่เจดีย์ใหม่ อ.เวียงป่าเป้า จ.เชียงราย,11:00 น.,2,19.137647534076017,99.41600203514099
บ้านป่ายางอาข่า,ต.แม่ฟ้าหลวง อ.แม่ฟ้าหลวง จ.เชียงราย,11:00 น.,2,20.296348636044467,99.77200090885162
บ้านขุนยวม,ต.ขุนยวม อ.ขุนยวม จ.แม่ฮ่องสอน,11:00 น.,2,18.81796318160443,97.93499886989594
บ้านเมืองปอน,ต.เมืองปอน อ.ขุนยวม จ.แม่ฮ่องสอน,11:00 น.,2,18.745997074908,97.92700052261353
บ้านนอก,ต.กงหรา อ.กงหรา จ.พัทลุง,11:00 น.,2,7.468714231177946,99.92200076580048
บ้านไทรห้อย*,ต.นาเมืองเพชร อ.สิเกา จ.ตรัง,11:00 น.,2,7.553845639092956,99.49482679367065
เหนือปตร.ช่องแค,ต.พรหมนิมิต อ.ตาคลี จ.นครสวรรค์,12:00 น.,2,15.146208779085983,100.41300058364868
บ้านหินลูกช้าง,ต.ทุ่งคาวัด อ.ละแม จ.ชุมพร,11:00 น.,2,9.778898731629297,98.95900189876556
บ้านคำแสนสุข,ต.ห้วยข่า อ.บุณฑริก จ.อุบลราชธานี,11:00 น.,2,14.553568864709908,105.33400118350983
บ้านห้วยทราย,ต.แม่เจดีย์ อ.เวียงป่าเป้า จ.เชียงราย,11:00 น.,2,19.163532574814763,99.34499859809875
บ้านแกน้อย,ต.แม่นะ อ.เชียงดาว จ.เชียงใหม่,11:00 น.,2,19.66520991806028,98.79500091075897
บ้านผาลาด,ต.แม่กุ อ.แม่สอด จ.ตาก,11:00 น.,2,16.627001563768815,98.6029976606369
โครงการจุฬาภรณ์พัฒนา 7 อ.ธารโต จ.ยะลา,ต.แม่หวาด อ.ธารโต จ.ยะลา,11:00 น.,2,6.063376782661174,101.36483609676361
บ้านปางอุ๋ง,ต.แม่ศึก อ.แม่แจ่ม จ.เชียงใหม่,11:00 น.,2,18.79355807984794,98.11500191688538
ปตร.คลองลาดกระบัง,ต.ลาดกระบัง อ.ลาดกระบัง จ.กรุงเทพมหานคร,12:00 น.,2,13.723861237681419,100.74978947639465
หน่วยพิทักษ์อุทยานแห่งชาติที่ มร. ๑ (ห้วยเต่า),ต.น้ำพาง อ.แม่จริม จ.น่าน,12:00 น.,2,18.586668863082263,101.06919229030609
บ้านห้วยโก๋น,ต.ห้วยโก๋น อ.เฉลิมพระเกียรติ จ.น่าน,11:00 น.,2,19.57890139667681,101.06399953365326
รร.บ้านเหมืองตะกั่ว,ต.หนองธง อ.ป่าบอน จ.พัทลุง,12:00 น.,2,7.2132638064643055,100.07940888404846
บ้านทับชัน,ต.คันธุลี อ.ท่าชนะ จ.สุราษฎร์ธานี,11:00 น.,2,9.659165017254088,99.11799788475037
บ้านช่องยูงทอง,ต.คันธุลี อ.ท่าชนะ จ.สุราษฎร์ธานี,11:00 น.,2,9.669746876068803,99.00599956512451
วัดท่าข้าม,ต.ท่าข้าม อ.พุนพิน จ.สุราษฎร์ธานี,11:00 น.,2,9.100338173233638,99.22920763492584
เมืองลพบุรี,ต.โพธิ์เก้าต้น อ.เมืองลพบุรี จ.ลพบุรี,12:00 น.,2,14.760477604498869,100.59960186481476
บ้านเมืองนะ,ต.แม่นะ อ.เชียงดาว จ.เชียงใหม่,11:00 น.,2,19.73432025766,98.89699995517731
บ้านอากู่,ต.เทอดไทย อ.แม่ฟ้าหลวง จ.เชียงราย,11:00 น.,2,20.251155523673205,99.67899799346924
พุนพิน 3,ต.ท่าสะท้อน อ.พุนพิน จ.สุราษฎร์ธานี,12:00 น.,2,8.986818363212702,99.21130120754242
เกาะลันตา,ต.เกาะลันตาใหญ่ อ.เกาะลันตา จ.กระบี่,10:00 น.,2,7.533334150038908,99.04999852180481
วังวิเศษ,ต.เขาวิเศษ อ.วังวิเศษ จ.ตรัง,12:00 น.,1.8,7.668914138249084,99.45938408374786
อบต.เทพราช,ต.เทพราช อ.สิชล จ.นครศรีธรรมราช,12:00 น.,1.8,8.858061635779965,99.86363589763641
ทม.ท่าข้าม,ต.ท่าข้าม อ.พุนพิน จ.สุราษฎร์ธานี,12:00 น.,1.6,9.106069368522395,99.2328017950058
ท่าสะบ้า,ต.ท่าสะบ้า อ.วังวิเศษ จ.ตรัง,12:00 น.,1.6,7.729373672629138,99.55148041248322
หน่วยพิทักษ์อุทยานแห่งชาติที ขป.๘ (น้ำตกหนานปลิว),ต.ลานข่อย อ.ป่าพะยอม จ.พัทลุง,12:00 น.,1.6,7.854698675595534,99.80874180793762
ที่ทำการอุทยานแห่งชาติดอยผ้าห่มปก,ต.โป่งน้ำร้อน อ.ฝาง จ.เชียงใหม่,12:00 น.,1.6,19.96860946220589,99.15387511253357
หน่วยอนุรักษ์และจัดการต้นน้ำคลองอุดม,ต.วังทอง อ.วังสมบูรณ์ จ.สระแก้ว,12:00 น.,1.6,13.35167215032304,101.99859380722046
สะพานทางเข้าชุมชนบ้านปากซวด,ต.พังกาญจน์ อ.พนม จ.สุราษฎร์ธานี,12:00 น.,1.6,8.88967207372546,98.82031559944153
หน่วยจัดการต้นน้ำซองกาเลีย,ต.หนองลู อ.สังขละบุรี จ.กาญจนบุรี,12:00 น.,1.6,15.215738820170666,98.38668286800385
เมืองพังงา,ต.ถ้ำน้ำผุด อ.เมืองพังงา จ.พังงา,12:00 น.,1.6,8.47732263303875,98.52831959724426
บ้านอมพาย,ต.ป่าแป๋ อ.แม่สะเรียง จ.แม่ฮ่องสอน,11:00 น.,1.5,18.298250094472394,98.17199885845184
บ้านแม่แอบ,ต.บ้านทับ อ.แม่แจ่ม จ.เชียงใหม่,11:00 น.,1.5,18.26233955114696,98.16800236701965
บ้านโล๊ะดุหยง,ต.ศาลาด่าน อ.เกาะลันตา จ.กระบี่,11:00 น.,1.5,7.633622165914977,99.04694616794586
บ้านแพมบก,ต.ทุ่งยาว อ.ปาย จ.แม่ฮ่องสอน,11:00 น.,1.5,19.3234450038356,98.39399993419647
บ้านวังยายมุก,ต.คลองพลู อ.เขาคิชฌกูฏ จ.จันทบุรี,11:00 น.,1.5,12.927167674091777,102.01600134372711
บ้านควนยาว,ต.ลานข่อย อ.ป่าพะยอม จ.พัทลุง,11:00 น.,1.5,7.852599605856777,99.79800224304199
บ้านหน้าวัด,ต.ในเตา อ.ห้วยยอด จ.ตรัง,11:00 น.,1.5,7.872840576320857,99.72699880599976
บ้านแม่หงานหลวง,ต.ปางหินฝน อ.แม่แจ่ม จ.เชียงใหม่,11:00 น.,1.5,18.597747898201,98.24400007724762
บ้านปาลอบาเต๊ะ,ต.ลุโบะบายะ อ.ยี่งอ จ.นราธิวาส,11:00 น.,1.5,6.422479187097014,101.6732257604599
บ้านทหารผ่านศึก,ต.รวมไทยพัฒนา อ.พบพระ จ.ตาก,11:00 น.,1.5,16.393833294911722,98.79500091075897
บ้านวังหอน,ต.วังอ่าง อ.ชะอวด จ.นครศรีธรรมราช,11:00 น.,1.5,7.891837174649691,99.79160785675049
บ้านดูลาเปอร์,ต.ห้วยห้อม อ.แม่ลาน้อย จ.แม่ฮ่องสอน,11:00 น.,1.5,18.40742838656546,98.07999908924103
บ้านน้ำหรา,ต.ทุ่งนุ้ย อ.ควนกาหลง จ.สตูล,11:00 น.,1.5,6.899783781385745,100.09400010108948
บ้านดอยสะโงะ,ต.ศรีดอนมูล อ.เชียงแสน จ.เชียงราย,11:00 น.,1.5,20.346085571712656,100.02100110054016
บ้านควนขวาง,ต.เขาวิเศษ อ.วังวิเศษ จ.ตรัง,11:00 น.,1.5,7.691035258048772,99.43600058555603
บ้านไมโครเวฟ,ต.ห้วยปูลิง อ.เมืองแม่ฮ่องสอน จ.แม่ฮ่องสอน,11:00 น.,1.5,19.098680566940143,98.0620014667511
รพสต.บ้านเขาปู่,ต.เขาปู่ อ.ศรีบรรพต จ.พัทลุง,12:00 น.,1.4,7.709508513720968,99.8380047082901
ทต.มายอ,ต.มายอ อ.มายอ จ.ปัตตานี,12:00 น.,1.4,6.718131409692922,101.41407608985901
