บ้านปูลาตีรี,ต.โกตาบารู อ.รามัน จ.ยะลา,23:00 น.,18,6.458311235398547,101.35447204113007
บ้านโนนเขวา,ต.โนนทอง อ.เกษตรสมบูรณ์ จ.ชัยภูมิ,23:00 น.,4,16.32160670334331,101.86999797821045
บ้านชายควน,ต.ปาดังเบซาร์ อ.สะเดา จ.สงขลา,23:00 น.,24,6.6902993147023455,100.30600190162659
บ้านดอนชัย,ต.เมืองปาน อ.เมืองปาน จ.ลำปาง,23:00 น.,1,18.819669272496288,99.45899784564972
บ้านดอยปุย,ต.สุเทพ อ.เมืองเชียงใหม่ จ.เชียงใหม่,17:00 น.,11.5,18.816612513420566,98.88349771499634
แก่งหางแมว,ต.แก่งหางแมว อ.แก่งหางแมว จ.จันทบุรี,00:00 น.,0.2,12.986785878437146,101.89962029457092
ท้ายปตร.มะขามเฒ่า-อู่ทอง,ต.มะขามเฒ่า อ.วัดสิงห์ จ.ชัยนาท,18:00 น.,0.2,15.222312701607844,100.06234467029572
ทต.เนินมะปราง,ต.เนินมะปราง อ.เนินมะปราง จ.พิษณุโลก,22:00 น.,0.8,16.570739850392123,100.64936220645905
หลังสวน,ต.ขันเงิน อ.หลังสวน จ.ชุมพร,23:00 น.,0.4,9.953406787685166,99.06440734863281
พุนพิน 3,ต.ท่าสะท้อน อ.พุนพิน จ.สุราษฎร์ธานี,00:00 น.,14.8,8.986818363212702,99.21130120754242
ทต.ท่าแร่,ต.ท่าแร่ อ.เมืองสกลนคร จ.สกลนคร,00:00 น.,4,17.251738305413667,104.1817456483841
บ้านเชี่ยวขวัญ,ต.ตะกุกเหนือ อ.วิภาวดี จ.สุราษฎร์ธานี,23:00 น.,3.5,9.213197133853413,98.94631505012512
บ้านเกาะแก้ว,ต.เขาตอก อ.เคียนซา จ.สุราษฎร์ธานี,23:00 น.,2.5,8.871301885703073,99.20757293701172
บ้านหน้าเหมน,ต.ช้างกลาง อ.ช้างกลาง จ.นครศรีธรรมราช,23:00 น.,11,8.324458631426674,99.63600218296051
เขตรักษาพันธุ์สัตว์ป่าน้ำตกสองแพรก,ต.สองแพรก อ.เมืองพังงา จ.พังงา,00:00 น.,8,8.612559675742036,98.54960024356842
บ้านควนเหมียง,ต.วังคีรี อ.ห้วยยอด จ.ตรัง,01:00 น.,11,7.8019158062418805,99.45099949836731
วัดปราการ,ต.ท่าขนอน อ.คีรีรัฐนิคม จ.สุราษฎร์ธานี,23:00 น.,20,9.030279889280804,98.96879196166992
บ้านสลักเพชรเหนือ,ต.เกาะช้างใต้ อ.เกาะช้าง จ.ตราด,23:00 น.,2,12.009582170221492,102.36700057983398
ทต.สุไหงโก-ลก,ต.สุไหงโก-ลก อ.สุไหงโก-ลก จ.นราธิวาส,00:00 น.,0.2,6.005105910544757,101.95808708667755
รพสต.บ้านลำกะ,ต.ชุมพล อ.ศรีนครินทร์ จ.พัทลุง,00:00 น.,4,7.583800128974899,99.97161090373993
หัวหิน,ต.ทับใต้ อ.หัวหิน จ.ประจวบคีรีขันธ์,14:00 น.,10.8,12.508496981570158,99.84200119972229
สรรคบุรี (แม่น้ำน้อย),ต.เที่ยงแท้ อ.สรรคบุรี จ.ชัยนาท,19:00 น.,0.2,15.064084222921183,100.16287922859192
สะพานห้วยน้ำใส,ต.เกาะขันธ์ อ.ชะอวด จ.นครศรีธรรมราช,00:00 น.,6,7.889541687744992,99.8742413520813
สะพานข้ามคลองห้วยกรวด,ต.เกาะขันธ์ อ.ชะอวด จ.นครศรีธรรมราช,00:00 น.,1,7.876820635003764,99.9333143234253
คลองปะแต,ต.ปะแต อ.ยะหา จ.ยะลา,00:00 น.,20.8,6.4125852162358346,101.13891363143921
รพสต.แก่นมะกรูด,ต.แก่นมะกรูด อ.บ้านไร่ จ.อุทัยธานี,00:00 น.,1.8,15.161830439301236,99.289031624794
ทต.จันดี,ต.จันดี อ.ฉวาง จ.นครศรีธรรมราช,00:00 น.,8.6,8.388254366079112,99.54066574573517
บ้านนาป่าแปก,ต.หมอกจำแป่ อ.เมืองแม่ฮ่องสอน จ.แม่ฮ่องสอน,23:00 น.,10.5,19.532466349445986,97.92900145053864
บ้านจำปาทอง,ต.บ้านทำเนียบ อ.คีรีรัฐนิคม จ.สุราษฎร์ธานี,23:00 น.,3.5,8.860430922812256,98.90576004981995
บ้านน้ำกิใต้,ต.ผาทอง อ.ท่าวังผา จ.น่าน,23:00 น.,8.5,19.220472446308232,100.64700186252594
บ้านหว้าหลัง,ต.สะท้อน อ.นาทวี จ.สงขลา,23:00 น.,8,6.6447117786870615,100.7342541217804
บ้านห้วยขอบ,ต.หาดคัมภีร์ อ.ปากชม จ.เลย,23:00 น.,5,18.198859060415888,102.06384658813477
บ้านเขาขุยพัฒนา,ต.หนองมะค่า อ.โคกเจริญ จ.ลพบุรี,18:00 น.,10.5,15.528147496672593,100.8430016040802
บ้านหนองปล้อง,ต.กุดตาเพชร อ.ลำสนธิ จ.ลพบุรี,23:00 น.,6,15.528483455935243,101.3379979133606
บางพระ,ต.หนองเสม็ด อ.เมืองตราด จ.ตราด,00:00 น.,1.2,12.238149045883691,102.50962972640991
ที่ว่าการอำเภอกรงปินัง,ต.สะเอะ อ.กรงปินัง จ.ยะลา,00:00 น.,5.2,6.410911325271148,101.27362489700317
เทศบาลตำบลปะแต,ต.ปะแต อ.ยะหา จ.ยะลา,00:00 น.,20,6.413976567495056,101.13616168498993
รร.บ้านเหมืองตะกั่ว,ต.หนองธง อ.ป่าบอน จ.พัทลุง,00:00 น.,7.6,7.2132638064643055,100.07940888404846
ศูนย์สาธิตการพัฒนาฯ การใช้หญ้าแฝกด้านป่าไม้ที่ ๑,ต.โป่งแยง อ.แม่ริม จ.เชียงใหม่,19:00 น.,0.4,18.872579982974656,98.79531741142273
สระแก้ว,ต.สระขวัญ อ.เมืองสระแก้ว จ.สระแก้ว,13:00 น.,9.2,13.788888811055795,102.03472316265106
บ้านท่าแพ,ต.ช้างกลาง อ.ช้างกลาง จ.นครศรีธรรมราช,23:00 น.,13,8.350063098036868,99.67700242996216
วัดท่าข้าม,ต.ท่าข้าม อ.พุนพิน จ.สุราษฎร์ธานี,23:00 น.,1,9.100338173233638,99.22920763492584
บ้านสันติสุข,ต.ท่าขุนราม อ.เมืองกำแพงเพชร จ.กำแพงเพชร,23:00 น.,6,16.447080168598724,99.42699909210205
ทม.ทับกวาง,ต.ทับกวาง อ.แก่งคอย จ.สระบุรี,21:00 น.,1.2,14.608813105953368,101.0764878988266
บ้านรวงผึ้งพัฒนา,ต.คลองน้ำไหล อ.คลองลาน จ.กำแพงเพชร,23:00 น.,9,16.197634233248895,99.29199814796448
บ้านพรุตู,ต.เกาะสะบ้า อ.เทพา จ.สงขลา,23:00 น.,5,6.800201219443361,100.88830947875977
วัดท่ายาง,ต.ท่ายาง อ.ทุ่งใหญ่ จ.นครศรีธรรมราช,23:00 น.,4,8.302058657577994,99.36824262142181
เขื่อนห้วยกุ่ม   ,ต.โนนทอง อ.เกษตรสมบูรณ์ จ.ชัยภูมิ,23:00 น.,10,16.41051181630957,101.79298639297485
บ้านร่องกล้า,ต.เนินเพิ่ม อ.นครไทย จ.พิษณุโลก,23:00 น.,9.5,16.98044726891171,101.02599799633026
บ้านนางหล่อ,ต.เกาะเต่า อ.ป่าพะยอม จ.พัทลุง,23:00 น.,0.5,7.799306250466719,99.83051061630249
เมืองชุมพร,ต.หาดพันไกร อ.เมืองชุมพร จ.ชุมพร,00:00 น.,2.6,10.574454103882385,99.14578557014465
บ้านทุ่งอินทนิน,ต.บางขัน อ.บางขัน จ.นครศรีธรรมราช,23:00 น.,21.5,8.077813918571325,99.42600131034851
บ้านกลุ่มตาขวัญ,ต.คลองไก่เถื่อน อ.คลองหาด จ.สระแก้ว,15:00 น.,2.5,13.339046035920902,102.31078147888184
หน่วยจัดการต้นน้ำขุนน่าน,ต.บ่อเกลือเหนือ อ.บ่อเกลือ จ.น่าน,00:00 น.,8.8,19.34819230734305,101.17510199546814
บ้านสามแยกอินทรีทอง,ต.คลองพา อ.ท่าชนะ จ.สุราษฎร์ธานี,23:00 น.,1,9.684294404382422,98.9409989118576
บ้านเขาจันทร์,ต.หนองธง อ.ป่าบอน จ.พัทลุง,23:00 น.,7,7.2016990354292885,100.09199917316437
บ้านทับชัน,ต.คันธุลี อ.ท่าชนะ จ.สุราษฎร์ธานี,13:00 น.,6.5,9.659165017254088,99.11799788475037
บ้านทัพป่าเส้า,ต.วังเหนือ อ.วังเหนือ จ.ลำปาง,13:00 น.,8.5,19.191429948664194,99.6150004863739
บ้านสงเปือย,ต.ธาตุ อ.เชียงคาน จ.เลย,21:00 น.,0.5,17.728162273388378,101.80100083351135
บ้านแม่แลบ,ต.แม่ลาน้อย อ.แม่ลาน้อย จ.แม่ฮ่องสอน,23:00 น.,0.5,18.37930921991803,97.8769987821579
ลำน้ำยัง,ต.แวง อ.โพนทอง จ.ร้อยเอ็ด,00:00 น.,26.2,16.32054101661247,104.02246534824371
เหนือฝายหนองหวาย,ต.น้ำพอง อ.น้ำพอง จ.ขอนแก่น,00:00 น.,26.6,16.724546470971276,102.80351400375366
อบต.ด่านม่วงคำ,ต.ด่านม่วงคำ อ.โคกศรีสุพรรณ จ.สกลนคร,00:00 น.,9.2,17.079245919564336,104.32588219642639
บ้านตะแบกโพรง,ต.อ่างทอง อ.ทับสะแก จ.ประจวบคีรีขันธ์,23:00 น.,5,11.444752573028023,99.47900176048279
บ้านหน้าเขา,ต.นาหลวงเสน อ.ทุ่งสง จ.นครศรีธรรมราช,23:00 น.,17,8.22619714368523,99.70099747180939
บ้านบ่อทอง,ต.นางแล อ.เมืองเชียงราย จ.เชียงราย,14:00 น.,0.5,20.097427888668104,99.87199902534485
บ้านผาหมี,ต.เวียงพางคำ อ.แม่สาย จ.เชียงราย,14:00 น.,1,20.399300996873485,99.85099732875824
บ้านนาเวียง,ต.วังชิ้น อ.วังชิ้น จ.แพร่,14:00 น.,7,17.900913363687984,99.60599899291992
บ้านห้วยทรายเหนือ,ต.ห้วยเฮี้ย อ.นครไทย จ.พิษณุโลก,07:00 น.,9.5,16.868552533048028,100.9769994020462
บ้านกกเชียง,ต.ห้วยขมิ้น อ.ด่านช้าง จ.สุพรรณบุรี,23:00 น.,2.5,14.92722945263731,99.50899958610535
บ้านไอร์กลูแป,ต.โคกสะตอ อ.รือเสาะ จ.นราธิวาส,23:00 น.,10.5,6.286857591745259,101.47938251495361
โรงเรียนนิคมสร้างตนเองพัฒนาภาคใต้ 1,ต.ตลิ่งชัน อ.บันนังสตา จ.ยะลา,00:00 น.,20,6.3125312931072655,101.36104881763458
เมืองสระแก้ว,ต.สระขวัญ อ.เมืองสระแก้ว จ.สระแก้ว,14:00 น.,0.2,13.80959170999193,102.05429255962372
ตะพานหิน,ต.งิ้วราย อ.ตะพานหิน จ.พิจิตร,14:00 น.,5.6,16.270406025957886,100.41391253471375
บ้านเหนือคลอง,ต.ทุ่งโพธิ์ อ.จุฬาภรณ์ จ.นครศรีธรรมราช,23:00 น.,1.5,8.076932260027483,99.77499961853027
บ้านควนใหม่,ต.โคกชะงาย อ.เมืองพัทลุง จ.พัทลุง,23:00 น.,3.5,7.631378437559678,99.99854564666748
ป่าพะยอม,ต.เกาะเต่า อ.ป่าพะยอม จ.พัทลุง,00:00 น.,1,7.807017945674877,99.84858334064484
บ้านท่าเรือ*,ต.บาตง อ.รือเสาะ จ.นราธิวาส,23:00 น.,3.5,6.351681901680621,101.49417221546173
บ้านโคกแมว,ต.โคกม่วง อ.เขาชัยสน จ.พัทลุง,23:00 น.,3.5,7.387151859597437,100.07200062274933
สะพานท่าผาก,ต.บางเดือน อ.พุนพิน จ.สุราษฎร์ธานี,23:00 น.,12,9.063326852748984,99.093257188797
รฟ.สุราษฎร์ธานี,ต.เขาหัวควาย อ.พุนพิน จ.สุราษฎร์ธานี,20:00 น.,1,9.069381778695114,99.22469079494476
บ้านจองอัว,ต.ปรังเผล อ.สังขละบุรี จ.กาญจนบุรี,23:00 น.,4,14.966800981922285,98.62352192401886
เคียนซา,ต.เคียนซา อ.เคียนซา จ.สุราษฎร์ธานี,23:00 น.,2,8.85069925644807,99.19711232185364
บ้านนาส้อง,ต.คลองใหญ่ อ.ตะโหมด จ.พัทลุง,23:00 น.,7,7.277878446450891,100.05299985408783
บ้านจันดีเมืองใหม่,ต.หลักช้าง อ.ช้างกลาง จ.นครศรีธรรมราช,23:00 น.,10.5,8.378075347180467,99.5520007610321
ทต.ห้องแซง,ต.ห้องแซง อ.เลิงนกทา จ.ยโสธร,00:00 น.,13.2,16.26809900310965,104.40586030483246
บ้านห้วยบอน,ต.บ้านโหนด อ.สะบ้าย้อย จ.สงขลา,23:00 น.,10.5,6.633047808123122,101.04900062084198
บ้านบ่อหยวกใต้,ต.บ่อเกลือเหนือ อ.บ่อเกลือ จ.น่าน,23:00 น.,6.5,19.283316949226844,101.17700099945068
สวี สกษ.,ต.วิสัยเหนือ อ.เมืองชุมพร จ.ชุมพร,22:00 น.,3,10.33333271381359,99.10000026226044
ทม.ท่าข้าม,ต.ท่าข้าม อ.พุนพิน จ.สุราษฎร์ธานี,00:00 น.,0.2,9.106069368522395,99.2328017950058
ทุ่งสง,ต.ปากแพรก อ.ทุ่งสง จ.นครศรีธรรมราช,00:00 น.,13.6,8.174986385731192,99.67888534069061
ยะลา สกษ.,ต.สะเตงนอก อ.เมืองยะลา จ.ยะลา,22:00 น.,10.5,6.516664809043021,101.28333449363708
ทต.ปากตะโก,ต.ปากตะโก อ.ทุ่งตะโก จ.ชุมพร,00:00 น.,0.2,10.100544978963013,99.13784086704254
อบต.คลองเฉลิม,ต.คลองเฉลิม อ.กงหรา จ.พัทลุง,00:00 น.,1.6,7.381901093381868,99.98011350631714
อบต.เขาพระ,ต.เขาพระ อ.รัตภูมิ จ.สงขลา,00:00 น.,2.8,7.080179347082024,100.18832266330719
ทต.สว่างอารมณ์,ต.สว่างอารมณ์ อ.สว่างอารมณ์ จ.อุทัยธานี,00:00 น.,16.6,15.58535091392613,99.86512184143066
รร.พนาสวรรค์,ต.ภูคา อ.ปัว จ.น่าน,00:00 น.,9.6,19.17976692808337,101.04175329208374
บ้านจันทรัตน์,ต.ยะรม อ.เบตง จ.ยะลา,23:00 น.,8.5,5.786995421443282,101.16164267063141
บ้านแซะ,ต.สะกอม อ.เทพา จ.สงขลา,23:00 น.,3.5,6.861720421123454,100.82499861717224
บ้านจันทิ,ต.ท่ากุ่ม อ.เมืองตราด จ.ตราด,23:00 น.,7,12.294520989268896,102.61564671993256
บ้านผาเดื่อ,ต.แม่สลองใน อ.แม่ฟ้าหลวง จ.เชียงราย,23:00 น.,8.5,20.169219879450445,99.7409999370575
บ้านกอก,ต.ภูคา อ.ปัว จ.น่าน,23:00 น.,8,19.262327567777945,101.05600118637085
บ้านพันวาล 4,ต.รับร่อ อ.ท่าแซะ จ.ชุมพร,23:00 น.,6.5,10.796095307338822,98.9769995212555
ศูนย์เรียนรู้ชุมชนบ้านนาซัว หมู่ที่ 2,ต.ถ้ำทะลุ อ.บันนังสตา จ.ยะลา,00:00 น.,17,6.272007322655247,101.15672886371613
ทต.ดอนอะราง,ต.ดอนอะราง อ.หนองกี่ จ.บุรีรัมย์,16:00 น.,1,14.586999489781698,102.49561250209808
แม่สะเรียง,ต.บ้านกาศ อ.แม่สะเรียง จ.แม่ฮ่องสอน,10:00 น.,8.4,18.166669245762503,97.93333053588867
ทต.บะยาว,ต.บะยาว อ.วังสามหมอ จ.อุดรธานี,00:00 น.,5,17.080835543967762,103.39910924434662
เกาะคา,ต.วังพร้าว อ.เกาะคา จ.ลำปาง,16:00 น.,2.6,18.159120394005207,99.3840891122818
บ้านแม่หลุ,ต.กองแขก อ.แม่แจ่ม จ.เชียงใหม่,14:00 น.,8,18.43295767237374,98.43700110912323
บ้านขุนต้า,ต.ตับเต่า อ.เทิง จ.เชียงราย,15:00 น.,8,19.794608291383287,100.29400169849396
บ้านควนไม้ไผ่,ต.นาหว้า อ.จะนะ จ.สงขลา,23:00 น.,5.5,6.919855420825275,100.64300000667572
บ้านคีรีรอบ,ต.ป่าร่อน อ.กาญจนดิษฐ์ จ.สุราษฎร์ธานี,23:00 น.,0.5,8.982563589381977,99.52771604061127
ที่ว่าการอำเภอเบตง จ.ยะลา,ต.เบตง อ.เบตง จ.ยะลา,22:00 น.,15,5.773044125251569,101.060711145401
บ้านเทพประทับ,ต.นางิ้ว อ.สังคม จ.หนองคาย,23:00 น.,0.5,18.016099698262856,102.15406000614166
ทต.เวียงพางคำ,ต.เวียงพางคำ อ.แม่สาย จ.เชียงราย,00:00 น.,9,20.40354959463141,99.88572657108307
บ้านขุนห้วยนกกก,ต.แม่หละ อ.ท่าสองยาง จ.ตาก,23:00 น.,11.5,17.249847880587037,98.35000097751617
บ้านกือลอง,ต.ตลิ่งชัน อ.บันนังสตา จ.ยะลา,23:00 น.,17,6.30837239964559,101.33558392524719
ทต.บางระกำเมืองใหม่,ต.บางระกำ อ.บางระกำ จ.พิษณุโลก,20:00 น.,0.2,16.748942893638333,100.0902771949768
เมืองเชียงราย,ต.ป่าอ้อดอนชัย อ.เมืองเชียงราย จ.เชียงราย,13:00 น.,7.6,19.826363670046934,99.77891027927399
บางกล่ำ,ต.ท่าช้าง อ.บางกล่ำ จ.สงขลา,00:00 น.,7,7.079412760616248,100.42787611484528
ชุมชนบ้านควน 1,ต.พร่อน อ.เมืองยะลา จ.ยะลา,00:00 น.,10.4,6.576951396341405,101.16950154304504
ที่ว่าการอำเภอเต่างอย,ต.นาตาล อ.เต่างอย จ.สกลนคร,00:00 น.,7.2,16.997423501661114,104.16752457618713
บ้านโพธิ์พนา,ต.ปากฉลุย อ.ท่าฉาง จ.สุราษฎร์ธานี,23:00 น.,3.5,9.207674182443936,99.00921285152435
บ้านโล๊ะจังกระ,ต.คลองเฉลิม อ.กงหรา จ.พัทลุง,23:00 น.,6,7.330097648791823,99.9839973449707
บ้านพรุเตาะนอก,ต.ทุ่งใหญ่ อ.หาดใหญ่ จ.สงขลา,23:00 น.,8,7.040102208068911,100.53699910640717
บ้านหนองยายเงิน,ต.หนองจอก อ.บ้านไร่ จ.อุทัยธานี,03:00 น.,7.5,14.982663823706945,99.6780002117157
บ้านลีมาปูโร๊ะ,ต.บาโงยซิแน อ.ยะหา จ.ยะลา,23:00 น.,8,6.518594178102322,101.16434097290039
บ้านปูโป,ต.สามัคคี อ.รือเสาะ จ.นราธิวาส,23:00 น.,7,6.4180333210023655,101.5499997138977
เชียงใหม่,ต.ศรีภูมิ อ.เมืองเชียงใหม่ จ.เชียงใหม่,16:00 น.,7.5,18.789998071827366,98.9769458770752
บ้านงิ้วเฒ่า,ต.ป่าหุ่ง อ.พาน จ.เชียงราย,11:00 น.,7.5,19.445990641235987,99.63799774646759
สุราษฎร์ธานี,ต.หัวเตย อ.พุนพิน จ.สุราษฎร์ธานี,22:00 น.,0.8,9.135555494842816,99.15194392204285
คลองนาท่อม,ต.ร่มเมือง อ.เมืองพัทลุง จ.พัทลุง,00:00 น.,8.8,7.558833767187677,99.98757004737854
อบต.บ้านแมด,ต.บ้านแมด อ.บุณฑริก จ.อุบลราชธานี,00:00 น.,1.2,14.854483847815494,105.32192587852478
สะพานห้วยมุก,ต.มุกดาหาร อ.เมืองมุกดาหาร จ.มุกดาหาร,00:00 น.,0.2,16.546860664989445,104.73038613796234
บ้านสลาแด,ต.ห้วยกระทิง อ.กรงปินัง จ.ยะลา,23:00 น.,23,6.3297583528765,101.26207530498505
บ้านดอยฮางใน,ต.ดอยฮาง อ.เมืองเชียงราย จ.เชียงราย,23:00 น.,3,19.91413736927032,99.73800122737885
บ้านโคกทัง,ต.พิจิตร อ.นาหม่อม จ.สงขลา,23:00 น.,12,6.981247281753932,100.59299826622009
โครงการจุฬาภรณ์พัฒนา 7 อ.ธารโต จ.ยะลา,ต.แม่หวาด อ.ธารโต จ.ยะลา,23:00 น.,8,6.063376782661174,101.36483609676361
บ้านปากช่อง,ต.จะโหนง อ.จะนะ จ.สงขลา,23:00 น.,36,6.9854111364631954,100.64500093460083
บ้านทุ่งยาง,ต.หัวเมือง อ.เมืองปาน จ.ลำปาง,13:00 น.,7,19.031810167615014,99.51600015163422
บ้านป่าไผ่,ต.ป่าไผ่ อ.ลี้ จ.ลำพูน,23:00 น.,7,17.877128861615603,98.92599999904633
บ้านหินลูกช้าง,ต.ทุ่งคาวัด อ.ละแม จ.ชุมพร,23:00 น.,7.5,9.778898731629297,98.95900189876556
บ้านเคี่ยมเพาะ,ต.ปากฉลุย อ.ท่าฉาง จ.สุราษฎร์ธานี,23:00 น.,4,9.409282323786824,98.87299954891205
บ้านช่องยูงทอง,ต.คันธุลี อ.ท่าชนะ จ.สุราษฎร์ธานี,23:00 น.,2.5,9.669746876068803,99.00599956512451
บ้านหน้าถ้ำ,ต.นาเหรง อ.นบพิตำ จ.นครศรีธรรมราช,11:00 น.,9,8.665483849172325,99.76500034332275
ชุมชนกุนุงจนอง,ต.เบตง อ.เบตง จ.ยะลา,23:00 น.,15.5,5.785340924659716,101.05644106864929
บ้านละแอ,ต.ละแอ อ.ยะหา จ.ยะลา,23:00 น.,9.5,6.4734172932525755,101.16557478904724
บ้านหนองเขียว,ต.แม่กรณ์ อ.เมืองเชียงราย จ.เชียงราย,23:00 น.,5,19.870468485525027,99.72600102424622
สวนสาธารณะ ทต.รือเสาะ,ต.รือเสาะ อ.รือเสาะ จ.นราธิวาส,00:00 น.,4.4,6.387924085044164,101.51715874671936
บ้านหินลับ,ต.มวกเหล็ก อ.มวกเหล็ก จ.สระบุรี,21:00 น.,1,14.672585515840304,101.12699925899506
