สถานีบ้านช่องเหรียง,ต.บ้านนิคม อ.บางขัน จ.นครศรีธรรมราช ,04:00 ,20
สถานีส.กรุงเกษม,ต.บางรัก อ.บางรัก จ.กรุงเทพมหานคร ,06:00 ,20
สถานีบ้านคลองตูกเหนือ,ต.กะปาง อ.ทุ่งสง จ.นครศรีธรรมราช ,05:00 ,19.5
สถานีอบต.นายม,ต.นายม อ.เมืองอำนาจเจริญ จ.อำนาจเจริญ ,06:00 ,19.4
สถานีสะพานห้วยน้ำใส,ต.เกาะขันธ์ อ.ชะอวด จ.นครศรีธรรมราช ,06:00 ,19.4
สถานีรัษฎา,ต.ควนเมา อ.รัษฎา จ.ตรัง ,06:00 ,19.2
สถานีบ้านท่าคลอง,ต.เทศบาลเมืองกระบี่ อ.เมืองกระบี่ จ.กระบี่ ,05:00 ,19
สถานีอบต.หนองมะค่า,ต.หนองมะค่า อ.โคกเจริญ จ.ลพบุรี ,06:00 ,19
สถานีบ้านโพธิ์ประสิทธิ์,ต.ถ้ำพรรณรา อ.ถ้ำพรรณรา จ.นครศรีธรรมราช ,05:00 ,19
สถานีตะกั่วป่า,ต.ตำตัว อ.ตะกั่วป่า จ.พังงา ,06:00 ,19
สถานีเขื่อนสิรินธร,ต.นิคมสร้างตนเอง อ.สิรินธร จ.อุบลราชธานี ,05:00 ,19
สถานีบ้านมะม่วง,ต.นนทรีย์ อ.บ่อไร่ จ.ตราด ,05:00 ,19
สถานีอบต.ป่าแดง,ต.ป่าแดง อ.ชาติตระการ จ.พิษณุโลก ,06:00 ,18.6
สถานีบ้านวังไทร,ต.แม่หวาด อ.ธารโต จ.ยะลา ,05:00 ,18.5
สถานีบ้านสองพี่น้อง*,ต.ท่าโพธิ์ อ.สะเดา จ.สงขลา ,05:00 ,18.5
สถานีโนนปูน,ต.สุขสวัสดิ์ อ.ไพรบึง จ.ศรีสะเกษ ,06:00 ,18.2
สถานีหน่วยจัดการต้นน้ำน้ำกอนฝั่งซ้าย,ต.พญาแก้ว อ.เชียงกลาง จ.น่าน ,06:00 ,18
สถานีน้ำตกปลิว,ต.ถ้ำใหญ่ อ.ทุ่งสง จ.นครศรีธรรมราช ,06:00 ,17.6
สถานีอบต.วังหมี,ต.วังหมี อ.วังน้ำเขียว จ.นครราชสีมา ,06:00 ,17.6
สถานีฝายคลองเปิก,ต.ถ้ำใหญ่ อ.ทุ่งสง จ.นครศรีธรรมราช ,06:00 ,17.6
สถานีอุทยานแห่งชาติตาดโตน,ต.นาฝาย อ.เมืองชัยภูมิ จ.ชัยภูมิ ,06:00 ,17.6
สถานีบ้านดง*,ต.สาริกา อ.เมืองนครนายก จ.นครนายก ,05:00 ,17.5
สถานีบ้านโรงกลวง,ต.นบปริง อ.เมืองพังงา จ.พังงา ,06:00 ,17.5
สถานีบ้านน้ำม้าเหนือ,ต.สถาน อ.เชียงของ จ.เชียงราย ,06:00 ,17.5
สถานีส.คลองสำเหร่,ต.สำเหร่ อ.ธนบุรี จ.กรุงเทพมหานคร ,06:00 ,17.5
สถานีบ้านทำเนียบ,ต.ลำพะยา อ.เมืองยะลา จ.ยะลา ,05:00 ,17.5
สถานีอบต.บางหิน,ต.บางหิน อ.กะเปอร์ จ.ระนอง ,06:00 ,17.4
สถานีอบต.ชัยบุรี,ต.ชัยบุรี อ.ชัยบุรี จ.สุราษฎร์ธานี ,06:00 ,17.4
สถานีสะพานกะลูบี บ้านสายปารี,ต.มาโมง อ.สุคิริน จ.นราธิวาส ,06:00 ,17
สถานีบ้านโคกหนองแห้ว,ต.เลยวังไสย์ อ.ภูหลวง จ.เลย ,06:00 ,17
สถานีบ้านเขาหลัก,ต.ปากแจ่ม อ.ห้วยยอด จ.ตรัง ,06:00 ,17
สถานีบ้านควนเหมียง,ต.วังคีรี อ.ห้วยยอด จ.ตรัง ,06:00 ,17
สถานีปะเหลียน,ต.ท่าพญา อ.ปะเหลียน จ.ตรัง ,06:00 ,16.8
สถานีทต.น้ำยืน,ต.สีวิเชียร อ.น้ำยืน จ.อุบลราชธานี ,06:00 ,16.6
สถานีร.ร.บ้านอังโกน-ห้วยทราย,ต.บ้านใหม่ อ.ครบุรี จ.นครราชสีมา ,06:00 ,16.6
สถานีบ้านซับเปิป,ต.ซับเปิบ อ.วังโป่ง จ.เพชรบูรณ์ ,06:00 ,16.5
สถานีบ้านห้วยโป่งผาลาด,ต.แม่เจดีย์ใหม่ อ.เวียงป่าเป้า จ.เชียงราย ,06:00 ,16.5
สถานีบ้านผาทอง,ต.วังทอง อ.ภักดีชุมพล จ.ชัยภูมิ ,06:00 ,16.5
สถานีบ้านเขาหินตั้ง,ต.สมเด็จเจริญ อ.หนองปรือ จ.กาญจนบุรี ,05:00 ,16.5
สถานีรร.บ้านเหมืองตะกั่ว,ต.หนองธง อ.ป่าบอน จ.พัทลุง ,06:00 ,16.2
สถานีทต.ดอนอะราง,ต.ดอนอะราง อ.หนองกี่ จ.บุรีรัมย์ ,06:00 ,16.2
สถานีบ้านนาฟองแดง,ต.นครชุม อ.นครไทย จ.พิษณุโลก ,06:00 ,16
สถานีชุมชนบ้านควน 1,ต.พร่อน อ.เมืองยะลา จ.ยะลา ,06:00 ,15.8
สถานีวัดบ้านน้ำเย็น,ต.เมือง อ.กันทรลักษ์ จ.ศรีสะเกษ ,06:00 ,15.6
สถานีบ้านเหนือคลอง,ต.ทุ่งโพธิ์ อ.จุฬาภรณ์ จ.นครศรีธรรมราช ,06:00 ,15.5
สถานีบ้านวังรี,ต.เขาพระ อ.เมืองนครนายก จ.นครนายก ,05:00 ,15.5
สถานีบ้านแก่งไฮ,ต.หนองกะท้าว อ.นครไทย จ.พิษณุโลก ,06:00 ,15.5
สถานีสุรินทร์ สกษ.,ต.คอโค อ.เมืองสุรินทร์ จ.สุรินทร์ ,04:00 ,15.4
สถานีห้วยยัง,ต.ไค้นุ่น อ.ห้วยผึ้ง จ.กาฬสินธุ์ ,06:00 ,15.4
สถานีศรีสะเกษ,ต.จานแสนไชย อ.ห้วยทับทัน จ.ศรีสะเกษ ,04:00 ,15.2
สถานีบ้านห้วยลาด,ต.หลักด่าน อ.น้ำหนาว จ.เพชรบูรณ์ ,05:00 ,15
สถานีบ้านน้ำจันทร์,ต.หนองงิ้ว อ.วังสะพุง จ.เลย ,06:00 ,15
สถานีหน่วยจัดการต้นน้ำขุนว้า,ต.ดงพญา อ.บ่อเกลือ จ.น่าน ,06:00 ,15
สถานีบ้านเทพนิมิตร,ต.โป่งตาลอง อ.ปากช่อง จ.นครราชสีมา ,04:00 ,15
สถานีบ้านปาลอบาเต๊ะ,ต.ลุโบะบายะ อ.ยี่งอ จ.นราธิวาส ,05:00 ,15
สถานีสตึก,ต.นิคม อ.สตึก จ.บุรีรัมย์ ,06:00 ,15
สถานีบ้านหนองหว้า,ต.ทุ่งยาว อ.ปะเหลียน จ.ตรัง ,06:00 ,15
สถานีทต.เนินมะปราง,ต.เนินมะปราง อ.เนินมะปราง จ.พิษณุโลก ,06:00 ,14.8
สถานีอบต.โคกเริงรมย์,ต.โคกเริงรมย์ อ.บำเหน็จณรงค์ จ.ชัยภูมิ ,06:00 ,14.8
สถานีคลองมหาสวัสดิ บางกรวย-สวนผัก,ต.ตลิ่งชัน อ.ตลิ่งชัน จ.กรุงเทพมหานคร ,06:00 ,14.6
สถานีหน่วยพิทักษ์อุทยานแห่งชาติที่ นค.๑ (บ้านคลองยน),ต.สำนักแต้ว อ.สะเดา จ.สงขลา ,06:00 ,14.6
สถานีบ้านตลาดเทพา*,ต.เทพา อ.เทพา จ.สงขลา ,05:00 ,14.5
สถานีบ้านชะรัด,ต.ชะรัด อ.กงหรา จ.พัทลุง ,06:00 ,14.5
สถานีบ้านวัดสวาด,ต.ป่าร่อน อ.กาญจนดิษฐ์ จ.สุราษฎร์ธานี ,05:00 ,14.5
สถานีเขตบางพลัด,ต.บางอ้อ อ.บางพลัด จ.กรุงเทพมหานคร ,06:00 ,14.5
สถานีมัสยิดกาวมินมูฮายีริน,ต.ปาล์มพัฒนา อ.มะนัง จ.สตูล ,06:00 ,14.4
สถานีอบต.จอมพระ,ต.จอมพระ อ.จอมพระ จ.สุรินทร์ ,06:00 ,14.2
สถานีพุนพิน 3,ต.ท่าสะท้อน อ.พุนพิน จ.สุราษฎร์ธานี ,06:00 ,14.2
สถานีอบต.นอกเมือง,ต.นอกเมือง อ.เมืองสุรินทร์ จ.สุรินทร์ ,06:00 ,14.2
สถานีบ้านหน้าเขา,ต.นาหลวงเสน อ.ทุ่งสง จ.นครศรีธรรมราช ,06:00 ,14
สถานีชุมชนบ้านควน 2,ต.พร่อน อ.เมืองยะลา จ.ยะลา ,06:00 ,14
สถานีส.คลองบางซื่อ,ต.ถนนนครไชยศรี อ.ดุสิต จ.กรุงเทพมหานคร ,06:00 ,14
สถานีส.คลองชักพระ,ต.คลองชักพระ อ.ตลิ่งชัน จ.กรุงเทพมหานคร ,06:00 ,14
สถานีอบต.นาคู,ต.นาคู อ.นาคู จ.กาฬสินธุ์ ,06:00 ,13.8
สถานีอบต.วังน้ำเขียว,ต.วังน้ำเขียว อ.วังน้ำเขียว จ.นครราชสีมา ,06:00 ,13.8
สถานีอบต.กังแอน,ต.กังแอน อ.ปราสาท จ.สุรินทร์ ,06:00 ,13.6
สถานีอบต.ตะปาน,ต.ตะปาน อ.พุนพิน จ.สุราษฎร์ธานี ,06:00 ,13.6
สถานีบ้านราษฎร์ผดุง,ต.สุคิริน อ.สุคิริน จ.นราธิวาส ,05:00 ,13.5
สถานีร้อยเอ็ด,ต.หนองไผ่ อ.ธวัชบุรี จ.ร้อยเอ็ด ,04:00 ,13.5
สถานีบ้านสระน้ำใส,ต.โป่งตาลอง อ.ปากช่อง จ.นครราชสีมา ,05:00 ,13.5
สถานีบ้านเมืองน้อย,ต.เวียงเหนือ อ.ปาย จ.แม่ฮ่องสอน ,06:00 ,13.5
สถานีอบต.อ่าวตง,ต.อ่าวตง อ.วังวิเศษ จ.ตรัง ,06:00 ,13.4
สถานีเมืองสุรินทร์,ต.ตระแสง อ.เมืองสุรินทร์ จ.สุรินทร์ ,06:00 ,13
สถานีบ้านน้ำยาง,ต.บ้านกลาง อ.วังทอง จ.พิษณุโลก ,06:00 ,13
สถานีน้ำพรม อ.เกษตรสมบูรณ์,ต.บ้านหัน อ.เกษตรสมบูรณ์ จ.ชัยภูมิ ,05:00 ,13
สถานีบ้านห้วยตึม,ต.บ้านพี้ อ.บ้านหลวง จ.น่าน ,06:00 ,13
สถานีส.คลองบางเขนใหม่,ต.บางซื่อ อ.บางซื่อ จ.กรุงเทพมหานคร ,06:00 ,13
สถานีบ้านคลองฉนวนจันทร์,ต.ดุสิต อ.ถ้ำพรรณรา จ.นครศรีธรรมราช ,05:00 ,13
สถานีบ้านแม่แวน,ต.บ่อสลี อ.ฮอด จ.เชียงใหม่ ,06:00 ,13
สถานีบ้านโป่งสอ,ต.น้ำกุ่ม อ.นครไทย จ.พิษณุโลก ,06:00 ,13
สถานีวัดเวฬุวัน,ต.เหนือเมือง อ.เมืองร้อยเอ็ด จ.ร้อยเอ็ด ,06:00 ,12.8
สถานีทต.นครไทย,ต.นครไทย อ.นครไทย จ.พิษณุโลก ,06:00 ,12.8
สถานีหน่วยพิทักษ์อุทยานแห่งชาติที่ ผท.๑ (ปากบอก),ต.บ้านร้อง อ.งาว จ.ลำปาง ,06:00 ,12.6
สถานีบ้านหินสอ,ต.ปลาบ่า อ.ภูเรือ จ.เลย ,06:00 ,12.5
สถานีหน่วยจัดการต้นน้ำน้ำพาง,ต.วังกวาง อ.น้ำหนาว จ.เพชรบูรณ์ ,06:00 ,12
สถานีรพ.สต.บ้านวังไทร,ต.แม่หวาด อ.ธารโต จ.ยะลา ,06:00 ,12
สถานีบ้านวังยายมุก,ต.คลองพลู อ.เขาคิชฌกูฏ จ.จันทบุรี ,06:00 ,12
สถานีอบต.นาน้อย,ต.นาน้อย อ.นาน้อย จ.น่าน ,06:00 ,12
สถานีทต.นาหนองไผ่,ต.นาหนองไผ่ อ.ชุมพลบุรี จ.สุรินทร์ ,06:00 ,12
สถานีหน่วยจัดการต้นน้ำคลองป่าพรุพ้อ,ต.ทุ่งนารี อ.ป่าบอน จ.พัทลุง ,06:00 ,12
สถานีบ้านเขาขุยพัฒนา,ต.หนองมะค่า อ.โคกเจริญ จ.ลพบุรี ,06:00 ,12
สถานีวังวิเศษ,ต.เขาวิเศษ อ.วังวิเศษ จ.ตรัง ,06:00 ,12
สถานีมูศ๊อลลา(มัสยิด)ชูฮาดา,ต.ควนกาหลง อ.ควนกาหลง จ.สตูล ,06:00 ,12
สถานีบ้านเขาหัวนา,ต.เขาเพิ่ม อ.บ้านนา จ.นครนายก ,05:00 ,12
สถานีบ้านในปง,ต.อ่าวตง อ.วังวิเศษ จ.ตรัง ,06:00 ,12
สถานีลำน้ำกูน,ต.ศิลาแลง อ.ปัว จ.น่าน ,06:00 ,11.8
สถานีกระบี่,ต.เหนือคลอง อ.เหนือคลอง จ.กระบี่ ,04:00 ,11.7
สถานีที่ทำการอุทยานแห่งชาติน้ำตกโยง,ต.ถ้ำใหญ่ อ.ทุ่งสง จ.นครศรีธรรมราช ,06:00 ,11.6
สถานีควนกาหลง,ต.อุใดเจริญ อ.ควนกาหลง จ.สตูล ,06:00 ,11.6
สถานีบ้านเมืองแพม,ต.ถ้ำลอด อ.ปางมะผ้า จ.แม่ฮ่องสอน ,06:00 ,11.5
สถานีบ้านฉลุง,ต.ทุ่งพอ อ.สะบ้าย้อย จ.สงขลา ,05:00 ,11.5
สถานีบ้านบางเหลียว,ต.คีรีวง อ.ปลายพระยา จ.กระบี่ ,05:00 ,11.5
สถานีบ้านมุงเหนือ,ต.บ้านมุง อ.เนินมะปราง จ.พิษณุโลก ,06:00 ,11.5
สถานีอบต.โบสถ์,ต.โบสถ์ อ.พิมาย จ.นครราชสีมา ,06:00 ,11.4
สถานีคลองนางน้อย,ต.นาโยงใต้ อ.เมืองตรัง จ.ตรัง ,06:00 ,11.4
สถานีทต.กันทรารมย์,ต.ดูน อ.กันทรารมย์ จ.ศรีสะเกษ ,06:00 ,11.2
สถานีบ้านใหม่สามัคคี,ต.โคกล่าม อ.ลำปลายมาศ จ.บุรีรัมย์ ,06:00 ,11.2
สถานีทต.บูเก๊ะตา,ต.โละจูด อ.แว้ง จ.นราธิวาส ,06:00 ,11.2
สถานีรร.บ้านลำปลอกเหนือ,ต.ในควน อ.ย่านตาขาว จ.ตรัง ,06:00 ,11.2
สถานีบ้านเขาหัวควาย,ต.เขาหัวควาย อ.พุนพิน จ.สุราษฎร์ธานี ,06:00 ,11
สถานีหน่วยอนุรักษ์และจัดการต้นน้ำลำพระเพลิง,ต.โป่งตาลอง อ.ปากช่อง จ.นครราชสีมา ,06:00 ,11
สถานีบ้านน้ำหรา,ต.ทุ่งนุ้ย อ.ควนกาหลง จ.สตูล ,06:00 ,11
สถานีจุดวัด ถ.เทศบาลสงเคราะห์,ต.ลาดยาว อ.จตุจักร จ.กรุงเทพมหานคร ,06:00 ,11
สถานีบ้านซับมงคล,ต.โป่งนก อ.เทพสถิต จ.ชัยภูมิ ,05:00 ,11
สถานีบ้านโนนสมบูรณ์,ต.ปากช่อง อ.ปากช่อง จ.นครราชสีมา ,05:00 ,11
สถานีสำนักสงฆ์เซปะหละ,ต.แม่ละมุ้ง อ.อุ้มผาง จ.ตาก ,06:00 ,11
สถานีบ้านหนองผักบุ้ง,ต.นายม อ.เมืองเพชรบูรณ์ จ.เพชรบูรณ์ ,06:00 ,11
สถานีเขตบางกอกน้อย,ต.ศิริราช อ.บางกอกน้อย จ.กรุงเทพมหานคร ,06:00 ,11
สถานีปตร.คลองบัว-ทางรถไฟ,ต.ฉิมพลี อ.ตลิ่งชัน จ.กรุงเทพมหานคร ,06:00 ,11
สถานีบ้านเมืองแปง,ต.เมืองแปง อ.ปาย จ.แม่ฮ่องสอน ,06:00 ,11
สถานีบ้านห้วยกลาง,ต.กะทูน อ.พิปูน จ.นครศรีธรรมราช ,06:00 ,11
สถานีกรุงเทพมหานคร,ต.คลองเตย อ.คลองเตย จ.กรุงเทพมหานคร ,04:00 ,10.8
สถานีอบต.โนนข่า,ต.โนนข่า อ.พล จ.ขอนแก่น ,06:00 ,10.6
สถานีบ้านขุนสถาน,ต.สันทะ อ.นาน้อย จ.น่าน ,04:00 ,10.5
สถานีบ้านหนองไผ่,ต.หนองหญ้าขาว อ.สีคิ้ว จ.นครราชสีมา ,06:00 ,10.5
สถานีบ้านระหัด,ต.กุดเลาะ อ.เกษตรสมบูรณ์ จ.ชัยภูมิ ,06:00 ,10.5
สถานีทต.ปากน้ำ,ต.ปากน้ำ อ.เมืองระนอง จ.ระนอง ,06:00 ,10.2
สถานีอโศก,ต.คลองเตยเหนือ อ.วัฒนา จ.กรุงเทพมหานคร ,06:00 ,10
สถานีเขตตลิ่งชัน,ต.คลองชักพระ อ.ตลิ่งชัน จ.กรุงเทพมหานคร ,06:00 ,10
สถานีบ้านน้ำหิน,ต.เชียงของ อ.นาน้อย จ.น่าน ,06:00 ,10
สถานีอ.อมก๋อย จ.เชียงใหม่,ต.อมก๋อย อ.อมก๋อย จ.เชียงใหม่ ,05:00 ,10
สถานีบ้านกุดจิก,ต.หนองข่า อ.เกษตรสมบูรณ์ จ.ชัยภูมิ ,06:00 ,10
สถานีบ้านกอก,ต.ภูคา อ.ปัว จ.น่าน ,05:00 ,10
สถานีทุ่งใหญ่,ต.บางรูป อ.ทุ่งใหญ่ จ.นครศรีธรรมราช ,06:00 ,9.6
สถานีท่าสะบ้า,ต.ท่าสะบ้า อ.วังวิเศษ จ.ตรัง ,06:00 ,9.6
สถานีอบต.ชนแดน,ต.ชนแดน อ.ชนแดน จ.เพชรบูรณ์ ,06:00 ,9.6
สถานีอบต.ธาตุ,ต.ธาตุ อ.รัตนบุรี จ.สุรินทร์ ,06:00 ,9.6
สถานีนครไทย,ต.นครไทย อ.นครไทย จ.พิษณุโลก ,06:00 ,9.6
สถานีบ้านห้วยชมภู (บ้านป่าคาหลวง),ต.ท่าก๊อ อ.แม่สรวย จ.เชียงราย ,06:00 ,9.5
สถานีบ้านห้วยคอม,ต.น้ำไผ่ อ.น้ำปาด จ.อุตรดิตถ์ ,06:00 ,9.5
สถานีบ้านขุนน้ำคับ,ต.บ่อภาค อ.ชาติตระการ จ.พิษณุโลก ,06:00 ,9.5
สถานีบ้านบางหยด,ต.อิปัน อ.พระแสง จ.สุราษฎร์ธานี ,06:00 ,9.5
สถานีซ.สะพานขวา ,ต.บางซื่อ อ.บางซื่อ จ.กรุงเทพมหานคร ,06:00 ,9.5
สถานีบ้านว่านเหลือง,ต.ชากไทย อ.เขาคิชฌกูฏ จ.จันทบุรี ,06:00 ,9.5
สถานีบ้านโคกนนทรี,ต.ลำพญากลาง อ.มวกเหล็ก จ.สระบุรี ,06:00 ,9.5
สถานีบ้านเลยวังไสย์,ต.เลยวังไสย์ อ.ภูหลวง จ.เลย ,06:00 ,9.5
สถานีบ้านหนองแดง,ต.บ้านจันทร์ อ.กัลยาณิวัฒนา จ.เชียงใหม่ ,06:00 ,9.4
สถานีอบต.หนองโพธิ์,ต.หนองโพธิ์ อ.นาเชือก จ.มหาสารคาม ,06:00 ,9.4
สถานีอบต.คลองหิน,ต.คลองหิน อ.อ่าวลึก จ.กระบี่ ,06:00 ,9.2
สถานีอบต.กะลาเส,ต.กะลาเส อ.สิเกา จ.ตรัง ,06:00 ,9.2
สถานีส.คลองสามเสน,ต.ถนนนครไชยศรี อ.ดุสิต จ.กรุงเทพมหานคร ,06:00 ,9
สถานีนครศรีธรรมราช,ต.ปากพูน อ.เมืองนครศรีธรรมราช จ.นครศรีธรรมราช ,04:00 ,9
สถานีบ้านบางกุ่ม,ต.กะปง อ.กะปง จ.พังงา ,06:00 ,9
สถานีบ้านตะเคียนงาม,ต.บางหิน อ.กะเปอร์ จ.ระนอง ,05:00 ,9
สถานีบ้านอ่าวกลาง,ต.วังมะปรางเหนือ อ.วังวิเศษ จ.ตรัง ,06:00 ,9
สถานีบ้านบางเตย,ต.คลองชะอุ่น อ.พนม จ.สุราษฎร์ธานี ,06:00 ,9
สถานีบ้านสะพานไทร,ต.บางดี อ.ห้วยยอด จ.ตรัง ,06:00 ,9
สถานีบ้านหนองขาหย่าง,ต.สวนเมี่ยง อ.ชาติตระการ จ.พิษณุโลก ,05:00 ,9
สถานีอบต.เทพราช,ต.เทพราช อ.สิชล จ.นครศรีธรรมราช ,06:00 ,8.8
สถานีที่ว่าการอำเภอกาบัง,ต.กาบัง อ.กาบัง จ.ยะลา ,06:00 ,8.6
สถานีเหนือฝายยางบ้านเขว้า,ต.ปะเคียบ อ.คูเมือง จ.บุรีรัมย์ ,06:00 ,8.6
สถานีบ้านห้วยน้ำอุ่น,ต.อ่ายนาไลย อ.เวียงสา จ.น่าน ,06:00 ,8.5
สถานีอบต.บ้านลำนาว,ต.บ้านลำนาว อ.บางขัน จ.นครศรีธรรมราช ,06:00 ,8.4
