สถานีเขื่องใน,ต.เขื่องใน อ.เขื่องใน จ.อุบลราชธานี ,06:00 ,10
สถานีบ้านแม่จอก,ต.แม่ป้าก อ.วังชิ้น จ.แพร่ ,06:00 ,10
สถานีบ้านกระบกเตี้ย,ต.วังเย็น อ.สนามชัยเขต จ.ฉะเชิงเทรา ,05:00 ,10
สถานีบ้านห้วยน้ำใส,ต.สบเมย อ.สบเมย จ.แม่ฮ่องสอน ,05:00 ,10
สถานีเลย สกษ.,ต.นาโป่ง อ.เมืองเลย จ.เลย ,04:00 ,9.8
สถานีนครป่าหมาก,ต.นครป่าหมาก อ.บางกระทุ่ม จ.พิษณุโลก ,06:00 ,9.6
สถานีพระนครศรีอยุธยา,ต.ท่าเจ้าสนุก อ.ท่าเรือ จ.พระนครศรีอยุธยา ,04:00 ,9.6
สถานีบ้านโป่งนก,ต.บ้านสหกรณ์ อ.แม่ออน จ.เชียงใหม่ ,06:00 ,9.5
สถานีบ้านวังหว้า-วังรู,ต.วังบาล อ.หล่มเก่า จ.เพชรบูรณ์ ,06:00 ,9.5
สถานีบ้านแม่เลียงพัฒนา,ต.เสริมขวา อ.เสริมงาม จ.ลำปาง ,06:00 ,9.5
สถานีบ้านอุ้มเปี้ยม,ต.คีรีราษฎร์ อ.พบพระ จ.ตาก ,18:00 ,9.5
สถานีนครสวรรค์,ต.กลางแดด อ.เมืองนครสวรรค์ จ.นครสวรรค์ ,04:00 ,9.5
สถานีบ้านแม่ตูบ,ต.โปงทุ่ง อ.ดอยเต่า จ.เชียงใหม่ ,06:00 ,9.5
สถานีบ้านวังขยาย,ต.ปรังเผล อ.สังขละบุรี จ.กาญจนบุรี ,05:00 ,9.5
สถานีบ้านแม่ป๋ามนอก,ต.ปิงโค้ง อ.เชียงดาว จ.เชียงใหม่ ,06:00 ,9.5
สถานีอุดรธานี,ต.หนองขอนกว้าง อ.เมืองอุดรธานี จ.อุดรธานี ,04:00 ,9.5
สถานีงาว,ต.หลวงใต้ อ.งาว จ.ลำปาง ,06:00 ,9.4
สถานีคลองพระยาบรรลือ,ต.สามเมือง อ.ลาดบัวหลวง จ.พระนครศรีอยุธยา ,06:00 ,9.4
สถานีทต.แม่ใจ,ต.แม่ใจ อ.แม่ใจ จ.พะเยา ,06:00 ,9.2
สถานีอบต.หนองพันทา,ต.หนองพันทา อ.โซ่พิสัย จ.บึงกาฬ ,06:00 ,9.2
สถานีอบต.เขาหลวง,ต.เขาหลวง อ.วังสะพุง จ.เลย ,06:00 ,9.2
สถานีศรีมหาโพธิ (KGT6),ต.บ้านทาม อ.ศรีมหาโพธิ จ.ปราจีนบุรี ,06:00 ,9.2
สถานีบ้านซำบุ่น,ต.ศิลา อ.หล่มเก่า จ.เพชรบูรณ์ ,03:00 ,9
สถานีบ้านโนนหัวช้าง,ต.โนนสมบูรณ์ อ.เขาสวนกวาง จ.ขอนแก่น ,06:00 ,9
สถานีสะพานห้วยบังฮวก,ต.ดอนนางหงส์ อ.ธาตุพนม จ.นครพนม ,06:00 ,9
สถานีบ้านจองอัว,ต.ปรังเผล อ.สังขละบุรี จ.กาญจนบุรี ,05:00 ,9
สถานีบ้านร้องธาร,ต.ศรีดงเย็น อ.ไชยปราการ จ.เชียงใหม่ ,06:00 ,9
สถานีบ้านน้ำพร้า,ต.นางพญา อ.ท่าปลา จ.อุตรดิตถ์ ,06:00 ,9
สถานีบ้านตีนตก,ต.นาคอเรือ อ.ฮอด จ.เชียงใหม่ ,05:00 ,9
สถานีบ้านใหม่สามัคคี,ต.ยกกระบัตร อ.สามเงา จ.ตาก ,05:00 ,9
สถานีบ้านคำแสนสุข,ต.ห้วยข่า อ.บุณฑริก จ.อุบลราชธานี ,06:00 ,9
สถานีบ้านขุนห้วยแม่ต้าน,ต.แม่ต้าน อ.ท่าสองยาง จ.ตาก ,06:00 ,9
สถานีบ้านห้วยกุ่ม,ต.ทรงธรรม อ.เมืองกำแพงเพชร จ.กำแพงเพชร ,06:00 ,9
สถานีบ้านโป่งนกสามัคคี,ต.โป่งนก อ.เทพสถิต จ.ชัยภูมิ ,05:00 ,9
สถานีบ้านท่าข้าม,ต.แก่งโสภา อ.วังทอง จ.พิษณุโลก ,06:00 ,9
สถานีบ้านระหัด,ต.กุดเลาะ อ.เกษตรสมบูรณ์ จ.ชัยภูมิ ,05:00 ,9
สถานีบ้านนาคันหัก,ต.พระเพลิง อ.เขาฉกรรจ์ จ.สระแก้ว ,06:00 ,9
สถานีวารินชำราบ,ต.คำน้ำแซบ อ.วารินชำราบ จ.อุบลราชธานี ,06:00 ,9
สถานีสะพานแม่น้ำว้า บ้านบ่อหยวก,ต.บ่อเกลือเหนือ อ.บ่อเกลือ จ.น่าน ,06:00 ,9
สถานีลำปาง สกษ.,ต.เวียงตาล อ.ห้างฉัตร จ.ลำปาง ,04:00 ,8.9
สถานีอบต.ท่าแยก,ต.ท่าแยก อ.เมืองสระแก้ว จ.สระแก้ว ,06:00 ,8.8
สถานีอบต.บ้านยา,ต.บ้านยา อ.หนองหาน จ.อุดรธานี ,06:00 ,8.8
สถานีอบต.สะแกกรัง,ต.สะแกกรัง อ.เมืองอุทัยธานี จ.อุทัยธานี ,06:00 ,8.8
สถานีชุมชนโกรกประดู่,ต.โคกกลาง อ.ลำปลายมาศ จ.บุรีรัมย์ ,06:00 ,8.8
สถานีอบต.ขะยูง,ต.ขะยูง อ.อุทุมพรพิสัย จ.ศรีสะเกษ ,06:00 ,8.6
สถานีบ้านปางริมกรณ์,ต.แม่กรณ์ อ.เมืองเชียงราย จ.เชียงราย ,06:00 ,8.5
สถานีบ้านมูเซอ,ต.ม่อนจอง อ.อมก๋อย จ.เชียงใหม่ ,06:00 ,8.5
สถานีบ้านห้วยหก,ต.เมืองแหง อ.เวียงแหง จ.เชียงใหม่ ,06:00 ,8.5
สถานีบ้านธรรมสถิตย์,ต.สำนักทอง อ.เมืองระยอง จ.ระยอง ,05:00 ,8.5
สถานีบ้านกองลม,ต.เมืองแหง อ.เวียงแหง จ.เชียงใหม่ ,06:00 ,8.5
สถานีบ้านเปียงหลวง,ต.เปียงหลวง อ.เวียงแหง จ.เชียงใหม่ ,06:00 ,8.5
สถานีบ้านป่าไผ่,ต.ป่าไผ่ อ.ลี้ จ.ลำพูน ,06:00 ,8.5
สถานีบ้านแม่ปูนหลวง,ต.เวียง อ.เวียงป่าเป้า จ.เชียงราย ,06:00 ,8.5
สถานีบ้านหนองมะค่า,ต.โป่งแดง อ.เมืองตาก จ.ตาก ,05:00 ,8.5
สถานีบ้านปงแท่น,ต.จางเหนือ อ.แม่เมาะ จ.ลำปาง ,06:00 ,8.5
สถานีบ้านลานสาง,ต.แม่ท้อ อ.เมืองตาก จ.ตาก ,06:00 ,8.5
สถานีบ้านซับสมบูรณ์,ต.แซร์ออ อ.วัฒนานคร จ.สระแก้ว ,06:00 ,8.5
สถานีบ้านเพชรนิยม,ต.สักงาม อ.คลองลาน จ.กำแพงเพชร ,06:00 ,8.5
สถานีบ้านกลาง,ต.ปลาบ่า อ.ภูเรือ จ.เลย ,06:00 ,8.5
สถานีบ้านแม่หงานหลวง,ต.ปางหินฝน อ.แม่แจ่ม จ.เชียงใหม่ ,21:00 ,8.5
สถานีบ้านพอนอคี,ต.ห้วยโป่ง อ.เมืองแม่ฮ่องสอน จ.แม่ฮ่องสอน ,06:00 ,8.5
สถานีบ้านหลังเขา,ต.หนองกะท้าว อ.นครไทย จ.พิษณุโลก ,05:00 ,8.5
สถานีบ้านแม่ปอน,ต.บ้านหลวง อ.จอมทอง จ.เชียงใหม่ ,06:00 ,8.5
สถานีบ้านโจะโหวะเหนือ,ต.บ้านเนิน อ.หล่มเก่า จ.เพชรบูรณ์ ,06:00 ,8.5
สถานีเมืองมหาสารคาม,ต.เกิ้ง อ.เมืองมหาสารคาม จ.มหาสารคาม ,06:00 ,8.2
สถานีทต.ทุ่งหัวช้าง,ต.ทุ่งหัวช้าง อ.ทุ่งหัวช้าง จ.ลำพูน ,06:00 ,8.2
สถานีหน่วยจัดการต้นน้ำแม่กลาง,ต.บ้านหลวง อ.จอมทอง จ.เชียงใหม่ ,06:00 ,8.2
สถานีคลองช่องสะเดา,ต.อุทัย อ.อุทัย จ.พระนครศรีอยุธยา ,06:00 ,8.2
สถานีกบินทร์บุรี,ต.กบินทร์ อ.กบินทร์บุรี จ.ปราจีนบุรี ,04:00 ,8.1
สถานีบ้านวังรี,ต.เขาพระ อ.เมืองนครนายก จ.นครนายก ,05:00 ,8
สถานีบ้านยาง,ต.แม่งอน อ.ฝาง จ.เชียงใหม่ ,06:00 ,8
สถานีบ้านห้วยไคร้ลานทอง,ต.เวียง อ.เทิง จ.เชียงราย ,05:00 ,8
สถานีบ้านใหม่ดอนแก้ว,ต.ทาเหนือ อ.แม่ออน จ.เชียงใหม่ ,06:00 ,8
สถานีเขตหนองจอก,ต.กระทุ่มราย อ.หนองจอก จ.กรุงเทพมหานคร ,06:00 ,8
สถานีลำน้ำก่ำ,ต.หนองบ่อ อ.นาแก จ.นครพนม ,06:00 ,8
สถานีบ้านทุ่งนาดี,ต.วังยาง อ.เนินมะปราง จ.พิษณุโลก ,06:00 ,8
สถานีเก้าเลี้ยว,ต.หัวดง อ.เก้าเลี้ยว จ.นครสวรรค์ ,06:00 ,8
สถานีบ้านดูลาเปอร์,ต.ห้วยห้อม อ.แม่ลาน้อย จ.แม่ฮ่องสอน ,06:00 ,8
สถานีบ้านซับใต้,ต.พญาเย็น อ.ปากช่อง จ.นครราชสีมา ,05:00 ,8
สถานีบ้านงิ้วงาม,ต.แม่ตีบ อ.งาว จ.ลำปาง ,05:00 ,8
สถานีอบต.ลำนางรอง,ต.ลำนางรอง อ.โนนดินแดง จ.บุรีรัมย์ ,06:00 ,8
สถานีบ้านสบป่อง,ต.ปางมะผ้า อ.ปางมะผ้า จ.แม่ฮ่องสอน ,06:00 ,8
สถานีบ้านพิทักษ์ไทย,ต.ตับเต่า อ.เทิง จ.เชียงราย ,06:00 ,8
สถานีบ้านคลองบน,ต.ลาดแค อ.ชนแดน จ.เพชรบูรณ์ ,05:00 ,8
สถานีห้วยแม่ระกาที่ อ.เมือง จ.ตาก จ.ตาก,ต.วังประจบ อ.เมืองตาก จ.ตาก ,05:00 ,8
สถานีสวนสาธารณะกู่ช้าง ทต.ลำพูน,ต.ในเมือง อ.เมืองลำพูน จ.ลำพูน ,06:00 ,7.8
สถานีทต.ศรีสงคราม,ต.ศรีสงคราม อ.ศรีสงคราม จ.นครพนม ,06:00 ,7.8
สถานีเมืองลำปาง,ต.ต้นธงชัย อ.เมืองลำปาง จ.ลำปาง ,06:00 ,7.8
สถานีชุมชนหนองใหญ่,ต.หนองใหญ่ อ.ปราสาท จ.สุรินทร์ ,06:00 ,7.6
สถานีหน่วยจัดการต้นน้ำดอยผาหลวง,ต.โป่งน้ำร้อน อ.ฝาง จ.เชียงใหม่ ,06:00 ,7.6
สถานีบ้านโกรกอีดก,ต.ชะอม อ.แก่งคอย จ.สระบุรี ,06:00 ,7.6
สถานีรร. บ้านหนองแอก,ต.บ้านผือ อ.โพนพิสัย จ.หนองคาย ,06:00 ,7.6
สถานีรร.วัดอู่ข้าว,ต.คลองเจ็ด อ.คลองหลวง จ.ปทุมธานี ,06:00 ,7.6
สถานีกบินทร์บุรี,ต.กบินทร์ อ.กบินทร์บุรี จ.ปราจีนบุรี ,06:00 ,7.6
สถานีบ้านห้วยตาดใต้,ต.นาดอกคำ อ.นาด้วง จ.เลย ,06:00 ,7.5
สถานีบ้านดงใหม่,ต.ห้วยห้อม อ.แม่ลาน้อย จ.แม่ฮ่องสอน ,06:00 ,7.5
สถานีบ้านดง,ต.ดงสุวรรณ อ.ดอกคำใต้ จ.พะเยา ,05:00 ,7.5
สถานีบ้านแม่กึ๊ด,ต.ทุ่งงาม อ.เสริมงาม จ.ลำปาง ,06:00 ,7.5
สถานีบ้านห้วยน้ำจาง,ต.บ่อแก้ว อ.สะเมิง จ.เชียงใหม่ ,06:00 ,7.5
สถานีบ้านยาบนาเลิม,ต.แม่ขะนิง อ.เวียงสา จ.น่าน ,06:00 ,7.5
สถานีบ้านสะพานหิน,ต.โป่งนก อ.เทพสถิต จ.ชัยภูมิ ,06:00 ,7.5
สถานีทต.โป่งน้ำร้อน,ต.โป่งน้ำร้อน อ.โป่งน้ำร้อน จ.จันทบุรี ,06:00 ,7.4
สถานีอบต.สวาท,ต.สวาท อ.เลิงนกทา จ.ยโสธร ,06:00 ,7.4
สถานีเครือข่ายลุ่มน้ำลาว,ต.แม่เจดีย์ใหม่ อ.เวียงป่าเป้า จ.เชียงราย ,06:00 ,7.4
สถานีทต.หนองฉาง,ต.หนองฉาง อ.หนองฉาง จ.อุทัยธานี ,06:00 ,7.2
สถานีทองผาภูมิ,ต.ท่าขนุน อ.ทองผาภูมิ จ.กาญจนบุรี ,04:00 ,7.1
สถานีสะพานเดชาติวงศ์,ต.ปากน้ำโพ อ.เมืองนครสวรรค์ จ.นครสวรรค์ ,06:00 ,7
สถานีบ้านร่มเกล้าสหมิตร,ต.คีรีราษฎร์ อ.พบพระ จ.ตาก ,06:00 ,7
สถานีอบต.ปังเผล,ต.ปรังเผล อ.สังขละบุรี จ.กาญจนบุรี ,06:00 ,7
สถานีบ้านกลาง,ต.เชียงม่วน อ.เชียงม่วน จ.พะเยา ,06:00 ,7
สถานีบ้านหัวแม่คำ,ต.แม่สลองใน อ.แม่ฟ้าหลวง จ.เชียงราย ,06:00 ,7
สถานีบ้านด่าน,ต.บ้านด่าน อ.อรัญประเทศ จ.สระแก้ว ,06:00 ,7
สถานีบ้านลานตาเกลี้ยง,ต.น้ำรึม อ.เมืองตาก จ.ตาก ,06:00 ,7
สถานีบ้านท่าฟ้าเหนือ*,ต.สระ อ.เชียงม่วน จ.พะเยา ,05:00 ,7
สถานีบ้านขุนห้วยแม่สอด,ต.พระธาตุผาแดง อ.แม่สอด จ.ตาก ,06:00 ,7
สถานีบ้านหนองม่วน (ดง),ต.ห้วยห้อม อ.แม่ลาน้อย จ.แม่ฮ่องสอน ,06:00 ,7
สถานีบ้านบ้องตี้บน,ต.บ้องตี้ อ.ไทรโยค จ.กาญจนบุรี ,05:00 ,7
สถานีทต.เชียงม่วน,ต.เชียงม่วน อ.เชียงม่วน จ.พะเยา ,06:00 ,7
สถานีบ้านห้วยฮ่อม,ต.บ้านจันทร์ อ.กัลยาณิวัฒนา จ.เชียงใหม่ ,06:00 ,7
สถานีบ้านกอกหลวง,ต.แม่นาจาง อ.แม่ลาน้อย จ.แม่ฮ่องสอน ,06:00 ,7
สถานีบ้านก่อก๋วง,ต.บ่อเกลือใต้ อ.บ่อเกลือ จ.น่าน ,05:00 ,7
สถานีคลองแม่น้ำใน,ต.หนองหมู อ.วิหารแดง จ.สระบุรี ,06:00 ,7
สถานีทต.ทาสบเส้า,ต.ทาสบเส้า อ.แม่ทา จ.ลำพูน ,06:00 ,6.8
สถานีรร.บ้านข้าวแป้ง,ต.วาใหญ่ อ.อากาศอำนวย จ.สกลนคร ,06:00 ,6.8
สถานีทต.ท่าขนุน,ต.ท่าขนุน อ.ทองผาภูมิ จ.กาญจนบุรี ,06:00 ,6.8
สถานีอบต.รอบเวียง,ต.รอบเวียง อ.เมืองเชียงราย จ.เชียงราย ,06:00 ,6.8
สถานีทม.ตะพานหิน,ต.ตะพานหิน อ.ตะพานหิน จ.พิจิตร ,06:00 ,6.6
สถานีที่ทำการอุทยานแห่งชาติดอยภูนาง,ต.บ้านมาง อ.เชียงม่วน จ.พะเยา ,06:00 ,6.6
สถานีสะพานแม่ฟ้าหลวง,ต.รอบเวียง อ.เมืองเชียงราย จ.เชียงราย ,06:00 ,6.6
สถานีบางระกำ,ต.บางระกำ อ.บางระกำ จ.พิษณุโลก ,06:00 ,6.6
สถานีสะพานวังแก่ง,ต.เขาเพิ่ม อ.บ้านนา จ.นครนายก ,06:00 ,6.6
สถานีอบต.พิกุล,ต.พิกุล อ.ชุมแสง จ.นครสวรรค์ ,06:00 ,6.6
สถานีบ้านน้ำพัน,ต.นาไร่หลวง อ.สองแคว จ.น่าน ,06:00 ,6.5
สถานีบ้านม่วงคำ,ต.นางแล อ.เมืองเชียงราย จ.เชียงราย ,06:00 ,6.5
สถานีบ้านขะเนจื้อ,ต.ขะเนจื้อ อ.แม่ระมาด จ.ตาก ,06:00 ,6.5
สถานีบ้านบ่อโพธิ์,ต.บ่อโพธิ์ อ.นครไทย จ.พิษณุโลก ,06:00 ,6.5
สถานีบ้านซับชมภู,ต.วังทอง อ.ภักดีชุมพล จ.ชัยภูมิ ,06:00 ,6.5
สถานีบ้านหัวฝาย,ต.ชัยพฤกษ์ อ.เมืองเลย จ.เลย ,06:00 ,6.5
สถานีบ้านห้วยส้าน,ต.แม่สลองใน อ.แม่ฟ้าหลวง จ.เชียงราย ,06:00 ,6.5
สถานีบ้านปางผักหม,ต.งิม อ.ปง จ.พะเยา ,06:00 ,6.5
สถานีปตร.คลองหลวงแพ่ง,ต.ศาลาแดง อ.บางน้ำเปรี้ยว จ.ฉะเชิงเทรา ,06:00 ,6.5
สถานีบ้านต้นลาน,ต.สบเปิง อ.แม่แตง จ.เชียงใหม่ ,06:00 ,6.5
สถานีบ้านแม่แอบ,ต.บ้านแซว อ.เชียงแสน จ.เชียงราย ,06:00 ,6.5
สถานีเหนือปตร.พระอินทราชา,ต.วังน้อย อ.วังน้อย จ.พระนครศรีอยุธยา ,06:00 ,6.4
สถานีอบต.ตาดกลอย,ต.ตาดกลอย อ.หล่มเก่า จ.เพชรบูรณ์ ,06:00 ,6.4
สถานีสระแก้ว,ต.สระขวัญ อ.เมืองสระแก้ว จ.สระแก้ว ,04:00 ,6.2
สถานีอบต.หนองลู,ต.หนองลู อ.สังขละบุรี จ.กาญจนบุรี ,06:00 ,6.2
สถานีอบต.ท่าเสา,ต.ท่าเสา อ.ไทรโยค จ.กาญจนบุรี ,06:00 ,6.2
สถานีบางไทร,ต.โพแตง อ.บางไทร จ.พระนครศรีอยุธยา ,06:00 ,6.2
สถานีชลบุรี,ต.บางปลาสร้อย อ.เมืองชลบุรี จ.ชลบุรี ,04:00 ,6.1
สถานีบ้านเขาหัวนา,ต.เขาเพิ่ม อ.บ้านนา จ.นครนายก ,05:00 ,6
สถานีบ้านสะพานลาว,ต.สหกรณ์นิคม อ.ทองผาภูมิ จ.กาญจนบุรี ,06:00 ,6
สถานีบ้านพุพรหม,ต.หนองกุ่ม อ.บ่อพลอย จ.กาญจนบุรี ,06:00 ,6
สถานีท้ายปตร.พระอินทราชา,ต.พยอม อ.วังน้อย จ.พระนครศรีอยุธยา ,06:00 ,6
สถานีที่ทำการอุทยานฯเขาใหญ่,ต.นาหินลาด อ.ปากพลี จ.นครนายก ,06:00 ,6
สถานีแม่น้ำปิงที่ อ.คลองขลุง (P.15) จ.กำแพงเพชร,ต.คลองขลุง อ.คลองขลุง จ.กำแพงเพชร ,05:00 ,6
สถานีบ้านหนองเฒ่า,ต.ลานหอย อ.บ้านด่านลานหอย จ.สุโขทัย ,06:00 ,6
สถานีบ้านห้วยกุ้ง,ต.ป่าโปง อ.สบเมย จ.แม่ฮ่องสอน ,06:00 ,6
สถานีบ้านทุ่งโห้ง,ต.เวียง อ.เทิง จ.เชียงราย ,05:00 ,6
สถานีบ้านนามน,ต.เมืองแหง อ.เวียงแหง จ.เชียงใหม่ ,06:00 ,6
สถานีบ้านห้วยทรายขาว,ต.แม่ลาน อ.ลี้ จ.ลำพูน ,06:00 ,6
สถานีบ้านห้วยปูด,ต.ภูคา อ.ปัว จ.น่าน ,05:00 ,6
สถานีทม.บ้านดุง,ต.ศรีสุทโธ อ.บ้านดุง จ.อุดรธานี ,06:00 ,6
สถานีบ้านต้าม,ต.บ่อสวก อ.เมืองน่าน จ.น่าน ,05:00 ,6
สถานีบ้านปางแปก,ต.แม่นาเติง อ.ปาย จ.แม่ฮ่องสอน ,06:00 ,6
สถานีบ้านทุ่งหลวง,ต.เมืองยาว อ.ห้างฉัตร จ.ลำปาง ,06:00 ,6
สถานีบ้านสันติสุข,ต.เวียงต้า อ.ลอง จ.แพร่ ,06:00 ,6
สถานีบ้านสองพี่น้อง,ต.ริมโขง อ.เชียงของ จ.เชียงราย ,06:00 ,6
สถานีทต.ทับคล้อ,ต.ทับคล้อ อ.ทับคล้อ จ.พิจิตร ,06:00 ,5.8
สถานีเกาะสีชัง,ต.ท่าเทววงษ์ อ.เกาะสีชัง จ.ชลบุรี ,04:00 ,5.8
สถานีอบต.วังทรายพูน,ต.วังทรายพูน อ.วังทรายพูน จ.พิจิตร ,06:00 ,5.8
สถานีหน่วยจัดการต้นน้ำขุนแม่แจ่ม,ต.แม่แดด อ.กัลยาณิวัฒนา จ.เชียงใหม่ ,06:00 ,5.8
สถานีอุทยานแห่งชาติเขาใหญ่,ต.หินตั้ง อ.เมืองนครนายก จ.นครนายก ,06:00 ,5.6
สถานีพยุหะคีรี,ต.ท่าน้ำอ้อย อ.พยุหะคีรี จ.นครสวรรค์ ,06:00 ,5.6
