บ้านทับคริสต์,ต.คลองชะอุ่น อ.พนม จ.สุราษฎร์ธานี,06:00 น.,22.2
ทต.ห้วยราช,ต.ห้วยราช อ.ห้วยราช จ.บุรีรัมย์,06:00 น.,22.2
ปทุมธานี สกษ.,ต.คลองหนึ่ง อ.คลองหลวง จ.ปทุมธานี,04:00 น.,22.2
หนองบัวระเหว,ต.หนองบัวระเหว อ.หนองบัวระเหว จ.ชัยภูมิ,06:00 น.,22
บ้านแม่หอย,ต.บ้านหลวง อ.จอมทอง จ.เชียงใหม่,05:00 น.,22
บ้านเทพพนม,ต.กระบี่น้อย อ.เมืองกระบี่ จ.กระบี่,05:00 น.,22
บ้านถ้ำพริก,ต.บ้านแยง อ.นครไทย จ.พิษณุโลก,05:00 น.,22
เขตคลองสามวา,ต.บางขัน อ.คลองสามวา จ.กรุงเทพมหานคร,06:00 น.,22
ทต.ตะเคียนทอง,ต.ตะเคียนทอง อ.เขาคิชฌกูฏ จ.จันทบุรี,06:00 น.,22
บ้านแจ้ซ้อน,ต.ห้วยยาบ อ.บ้านธิ จ.ลำพูน,05:00 น.,22
ศรีสะเกษ,ต.จานแสนไชย อ.ห้วยทับทัน จ.ศรีสะเกษ,04:00 น.,21.9
อบต.คำตากล้า,ต.คำตากล้า อ.คำตากล้า จ.สกลนคร,06:00 น.,21.8
วังกระแจะ,ต.เนินทราย อ.เมืองตราด จ.ตราด,06:00 น.,21.8
อุบลราชธานี สกษ.,ต.ท่าช้าง อ.สว่างวีระวงศ์ จ.อุบลราชธานี,04:00 น.,21.7
อบต.วังโรงใหญ่,ต.วังโรงใหญ่ อ.สีคิ้ว จ.นครราชสีมา,06:00 น.,21.6
บ้านโป่งป่าติ้ว,ต.กกดู่ อ.เมืองเลย จ.เลย,05:00 น.,21.5
บ้านปางกลาง,ต.วาวี อ.แม่สรวย จ.เชียงราย,05:00 น.,21.5
บ้านท่าทองแดง,ต.นาโบสถ์ อ.วังเจ้า จ.ตาก,05:00 น.,21.5
จุดวัด ค.แสนแสบ-เขตบางกะปิ,ต.หัวหมาก อ.บางกะปิ จ.กรุงเทพมหานคร,06:00 น.,21.5
บ้านขุนป๋วย,ต.แม่วิน อ.แม่วาง จ.เชียงใหม่,05:00 น.,21.5
บ้านก่อก๋วง,ต.บ่อเกลือใต้ อ.บ่อเกลือ จ.น่าน,05:00 น.,21.5
บ้านโป่งก้อนเส้า,ต.ท่ามะปราง อ.แก่งคอย จ.สระบุรี,05:00 น.,21.5
คลองมหาชัย วัดพันท้ายนรสิงห์,ต.พันท้ายนรสิงห์ อ.เมืองสมุทรสาคร จ.สมุทรสาคร,06:00 น.,21.4
ท้ายฝายธาตุน้อย,ต.สหธาตุ อ.เขื่องใน จ.อุบลราชธานี,04:00 น.,21.4
บ้านห้วยแห้ง,ต.ขะเนจื้อ อ.แม่ระมาด จ.ตาก,05:00 น.,21
บ้านขุนลาว,ต.แม่เจดีย์ใหม่ อ.เวียงป่าเป้า จ.เชียงราย,05:00 น.,21
บ้านวังยาวใหญ่,ต.นาหนองทุ่ม อ.ชุมแพ จ.ขอนแก่น,05:00 น.,21
บ้านทุ่งจ้อ,ต.ป่าแป๋ อ.แม่แตง จ.เชียงใหม่,05:00 น.,21
บ้านบางบ้าน,ต.คลองชะอุ่น อ.พนม จ.สุราษฎร์ธานี,05:00 น.,21
บ้านห้วยผึ้ง,ต.หมอกจำแป่ อ.เมืองแม่ฮ่องสอน จ.แม่ฮ่องสอน,01:00 น.,21
บ้านเชือกน้ำ,ต.ถ้ำ อ.ตะกั่วทุ่ง จ.พังงา,05:00 น.,21
บ้านกะเหรี่ยงน้ำตก,ต.คลองลานพัฒนา อ.คลองลาน จ.กำแพงเพชร,05:00 น.,21
ปตร.คลองสามวา,ต.บางขัน อ.คลองสามวา จ.กรุงเทพมหานคร,06:00 น.,21
บ้านด่านดู่,ต.โป่ง อ.ด่านซ้าย จ.เลย,05:00 น.,21
ลานกีฬา อบต.วังโป่ง,ต.วังโป่ง อ.วังโป่ง จ.เพชรบูรณ์,06:00 น.,21
อบต.ห้วยสัตว์ใหญ่,ต.ห้วยสัตว์ใหญ่ อ.หัวหิน จ.ประจวบคีรีขันธ์,06:00 น.,20.8
ทต.สันนาเม็ง,ต.สันนาเม็ง อ.สันทราย จ.เชียงใหม่,06:00 น.,20.8
อบต.โพธิ์ทอง,ต.โพธิ์ทอง อ.เสลภูมิ จ.ร้อยเอ็ด,06:00 น.,20.8
อบต.ปางมะผ้า,ต.ปางมะผ้า อ.ปางมะผ้า จ.แม่ฮ่องสอน,06:00 น.,20.8
ศูนย์พัฒนาเด็กเล็ก อบต.ท่านา,ต.ท่านา อ.กะปง จ.พังงา,06:00 น.,20.6
อินทร์บุรี,ต.อินทร์บุรี อ.อินทร์บุรี จ.สิงห์บุรี,06:00 น.,20.6
บางไทร,ต.โพแตง อ.บางไทร จ.พระนครศรีอยุธยา,06:00 น.,20.6
บ้านนาหนอง,ต.หนองกะท้าว อ.นครไทย จ.พิษณุโลก,05:00 น.,20.5
เขตประเวศ,ต.ประเวศ อ.ประเวศ จ.กรุงเทพมหานคร,06:00 น.,20.5
ส.คลองสามเสน-แสนแสบ,ต.บางกะปิ อ.ห้วยขวาง จ.กรุงเทพมหานคร,06:00 น.,20.5
บ้านโป่งสามขา,ต.ศิลา อ.หล่มเก่า จ.เพชรบูรณ์,05:00 น.,20.5
ส.เทเวศร์,ต.วัดสามพระยา อ.พระนคร จ.กรุงเทพมหานคร,06:00 น.,20.5
บ้านบางทอง,ต.บางทอง อ.ท้ายเหมือง จ.พังงา,05:00 น.,20.5
บ้านสองธาร,ต.บ้านทับ อ.แม่แจ่ม จ.เชียงใหม่,05:00 น.,20.5
อบต.ป่าแดง,ต.ป่าแดง อ.ชาติตระการ จ.พิษณุโลก,06:00 น.,20.4
บางปะหัน,ต.โพธิ์สามต้น อ.บางปะหัน จ.พระนครศรีอยุธยา,06:00 น.,20.2
ราชบุรี,ต.อ่างทอง อ.เมืองราชบุรี จ.ราชบุรี,04:00 น.,20.2
บ้านดอนชัย,ต.เมืองปาน อ.เมืองปาน จ.ลำปาง,05:00 น.,20
บ้านผาลาดเหนือ,ต.นาทราย อ.ลี้ จ.ลำพูน,05:00 น.,20
บ้านนาล้อม,ต.ป่าแดง อ.ชาติตระการ จ.พิษณุโลก,05:00 น.,20
บ้านห้วยทรายขาว,ต.แม่ลาน อ.ลี้ จ.ลำพูน,05:00 น.,20
บ้านเขาอ่าง,ต.มาบไพ อ.ขลุง จ.จันทบุรี,05:00 น.,20
บ้านประชาธิปไตย,ต.ชุมโค อ.ปะทิว จ.ชุมพร,05:00 น.,20
บ้านหนองสองห้อง,ต.ห้วยแห้ง อ.แก่งคอย จ.สระบุรี,05:00 น.,20
เขตพระโขนง,ต.บางจาก อ.พระโขนง จ.กรุงเทพมหานคร,06:00 น.,20
บ้านวังประดิษฐ์,ต.เขาค่าย อ.สวี จ.ชุมพร,05:00 น.,20
บ้านนากล่ำ,ต.น้ำไคร้ อ.น้ำปาด จ.อุตรดิตถ์,05:00 น.,20
ทต.คุ้งสำเภา,ต.คุ้งสำเภา อ.มโนรมย์ จ.ชัยนาท,06:00 น.,19.8
ดอยมูเซอร์ สกษ.,ต.แม่ท้อ อ.เมืองตาก จ.ตาก,04:00 น.,19.8
อบต.ราษฎร์นิยม,ต.ราษฎร์นิยม อ.ไทรน้อย จ.นนทบุรี,06:00 น.,19.6
บ้านตูบค้อ,ต.กกสะทอน อ.ด่านซ้าย จ.เลย,05:00 น.,19.5
บ้านน้ำพุง,ต.โป่ง อ.ด่านซ้าย จ.เลย,05:00 น.,19.5
ปากคลองตลาด,ต.พระบรมมหาราชวัง อ.พระนคร จ.กรุงเทพมหานคร,06:00 น.,19.5
ภูเก็ต (ศูนย์ฯ),ต.ไม้ขาว อ.ถลาง จ.ภูเก็ต,04:00 น.,19.5
บ้านผาคอ,ต.บ้านปิน อ.ลอง จ.แพร่,05:00 น.,19.5
อบต.โคกเริงรมย์,ต.โคกเริงรมย์ อ.บำเหน็จณรงค์ จ.ชัยภูมิ,06:00 น.,19.4
ท่าตูม,ต.ท่าตูม อ.ท่าตูม จ.สุรินทร์,04:00 น.,19.4
หน่วยจัดการต้นน้ำดอยผาหลวง,ต.โป่งน้ำร้อน อ.ฝาง จ.เชียงใหม่,06:00 น.,19.2
ทม.บ้านดุง,ต.ศรีสุทโธ อ.บ้านดุง จ.อุดรธานี,06:00 น.,19.2
ท้ายฝายชุมพวง,ต.ชุมพวง อ.ชุมพวง จ.นครราชสีมา,06:00 น.,19.2
กบินทร์บุรี,ต.กบินทร์ อ.กบินทร์บุรี จ.ปราจีนบุรี,04:00 น.,19.1
อบต.ท่าเสา,ต.ท่าเสา อ.โพทะเล จ.พิจิตร,06:00 น.,19
เขตจอมทอง,ต.บางมด อ.จอมทอง จ.กรุงเทพมหานคร,06:00 น.,19
บ้านบางกุ่ม,ต.กะปง อ.กะปง จ.พังงา,05:00 น.,19
บ้านขุนห้วยนกกก,ต.แม่หละ อ.ท่าสองยาง จ.ตาก,05:00 น.,19
ทต.หนองผือ,ต.หนองผือ อ.เขมราฐ จ.อุบลราชธานี,06:00 น.,18.8
อบต.เขาทอง,ต.เขาทอง อ.พยุหะคีรี จ.นครสวรรค์,06:00 น.,18.6
บ้านแม่ละเมา,ต.พะวอ อ.แม่สอด จ.ตาก,05:00 น.,18.5
ส.พระโขนง,ต.พระโขนง อ.คลองเตย จ.กรุงเทพมหานคร,06:00 น.,18.5
บ้านโพธิ์ประสิทธิ์,ต.ถ้ำพรรณรา อ.ถ้ำพรรณรา จ.นครศรีธรรมราช,05:00 น.,18.5
บ้านหนองป่าแขม,ต.แม่คง อ.แม่สะเรียง จ.แม่ฮ่องสอน,05:00 น.,18.5
บ้านห้วยโต้,ต.ทับปริก อ.เมืองกระบี่ จ.กระบี่,05:00 น.,18.5
บ้านคลองใหญ่,ต.จันทเขลม อ.เขาคิชฌกูฏ จ.จันทบุรี,05:00 น.,18.5
คลองสำโรง บางเสาธง,ต.บางเสาธง อ.บางเสาธง จ.สมุทรปราการ,06:00 น.,18.4
อบต.ชนแดน,ต.ชนแดน อ.ชนแดน จ.เพชรบูรณ์,06:00 น.,18.4
ที่ว่าการอำเภอเมืองยโสธร,ต.ในเมือง อ.เมืองยโสธร จ.ยโสธร,06:00 น.,18.2
บ้านปลายคลองวัน,ต.ปากจั่น อ.กระบุรี จ.ระนอง,05:00 น.,18
บ้านวังขยาย,ต.ปรังเผล อ.สังขละบุรี จ.กาญจนบุรี,05:00 น.,18
เขตดุสิต,ต.ดุสิต อ.ดุสิต จ.กรุงเทพมหานคร,06:00 น.,18
เขตคลองเตย,ต.คลองเตย อ.คลองเตย จ.กรุงเทพมหานคร,06:00 น.,18
บ้านผึ้ง,ต.วังยาว อ.ด่านซ้าย จ.เลย,05:00 น.,18
บ้านน้ำดั้น,ต.ภูคา อ.ปัว จ.น่าน,05:00 น.,18
บ้านแม่สูนน้อย,ต.แม่คะ อ.ฝาง จ.เชียงใหม่,05:00 น.,18
จุดวัด ค.ประเวศฯ-เขตลาดกระบัง,ต.ลาดกระบัง อ.ลาดกระบัง จ.กรุงเทพมหานคร,06:00 น.,18
ส.คลองเจ็ก,ต.บางจาก อ.พระโขนง จ.กรุงเทพมหานคร,06:00 น.,18
อบต.โนนข่า,ต.โนนข่า อ.พล จ.ขอนแก่น,06:00 น.,17.8
หนองคาย,ต.มีชัย อ.เมืองหนองคาย จ.หนองคาย,04:00 น.,17.8
หล่มสัก,ต.ตาลเดี่ยว อ.หล่มสัก จ.เพชรบูรณ์,04:00 น.,17.7
คลองแสนแสบ บางกะปิ,ต.หัวหมาก อ.บางกะปิ จ.กรุงเทพมหานคร,06:00 น.,17.6
บ้านหุบผึ้ง,ต.ห้วยทราย อ.เมืองประจวบคีรีขันธ์ จ.ประจวบคีรีขันธ์,05:00 น.,17.5
บ้านนาคันหัก,ต.พระเพลิง อ.เขาฉกรรจ์ จ.สระแก้ว,05:00 น.,17.5
บ้านแม่แปง,ต.นาพูน อ.วังชิ้น จ.แพร่,05:00 น.,17.5
บ้านคลองทราย,ต.วังน้ำเขียว อ.วังน้ำเขียว จ.นครราชสีมา,05:00 น.,17.5
บ้านวัฒนานคร,ต.วัฒนานคร อ.วัฒนานคร จ.สระแก้ว,05:00 น.,17.5
บ้านป่าเลา,ต.แม่หอพระ อ.แม่แตง จ.เชียงใหม่,05:00 น.,17.5
บ้าน กม.80,ต.บุพราหมณ์ อ.นาดี จ.ปราจีนบุรี,05:00 น.,17.5
บ้านท่าข้าม,ต.แม่ทา อ.แม่ออน จ.เชียงใหม่,05:00 น.,17.5
บ้านพรุสมภาร,ต.เทพกระษัตรี อ.ถลาง จ.ภูเก็ต,05:00 น.,17.5
บ้านหมาก,ต.มวกเหล็ก อ.มวกเหล็ก จ.สระบุรี,05:00 น.,17.5
บ้านขุนแม่ลาน้อย,ต.ขุนแม่ลาน้อย อ.แม่ลาน้อย จ.แม่ฮ่องสอน,01:00 น.,17.5
บ้านน้ำรีพัฒนา,ต.ขุนน่าน อ.เฉลิมพระเกียรติ จ.น่าน,05:00 น.,17.5
บ้านห้วยแหน,ต.ห้วยใหญ่ อ.เมืองเพชรบูรณ์ จ.เพชรบูรณ์,04:00 น.,17.5
บ้านยางแก้ว,ต.อมก๋อย อ.อมก๋อย จ.เชียงใหม่,05:00 น.,17.5
บ้านซับตะแบก,ต.ยางสาว อ.วิเชียรบุรี จ.เพชรบูรณ์,05:00 น.,17.5
อบต.ท่าแยก,ต.ท่าแยก อ.เมืองสระแก้ว จ.สระแก้ว,06:00 น.,17.4
อบต.ช่องสามหมอ,ต.ช่องสามหมอ อ.แก้งคร้อ จ.ชัยภูมิ,06:00 น.,17.4
กาฬสินธุ์,ต.หลักเมือง อ.กมลาไสย จ.กาฬสินธุ์,04:00 น.,17.3
ปตร.วัดบางกระเจ้านอก,ต.บางกระเจ้า อ.พระประแดง จ.สมุทรปราการ,06:00 น.,17.2
เทศบาลตำบลหอไกร,ต.หอไกร อ.บางมูลนาก จ.พิจิตร,06:00 น.,17.2
เหนือฝายพิมาย,ต.ในเมือง อ.พิมาย จ.นครราชสีมา,06:00 น.,17.2
ลำน้ำยัง,ต.แวง อ.โพนทอง จ.ร้อยเอ็ด,06:00 น.,17.2
สะพานข้ามคลองเกรียงไกร,ต.บางเคียน อ.ชุมแสง จ.นครสวรรค์,06:00 น.,17.2
ทต.ศรีสงคราม,ต.ศรีสงคราม อ.ศรีสงคราม จ.นครพนม,06:00 น.,17.2
ทต.เมืองคง,ต.เมืองคง อ.คง จ.นครราชสีมา,06:00 น.,17.2
บ้านมูเซอ,ต.ม่อนจอง อ.อมก๋อย จ.เชียงใหม่,05:00 น.,17
อบต.ป่าแฝก,ต.ป่าแฝก อ.พรเจริญ จ.บึงกาฬ,06:00 น.,17
บ้านวังท่าดี*,ต.วังท่าดี อ.หนองไผ่ จ.เพชรบูรณ์,05:00 น.,17
ทต.หนองม่วงไข่,ต.หนองม่วงไข่ อ.หนองม่วงไข่ จ.แพร่,06:00 น.,17
ฝายจิตรมานี,ต.ทรายขาว อ.สอยดาว จ.จันทบุรี,06:00 น.,17
ปตร. คลองแพ,ต.บางกอบัว อ.พระประแดง จ.สมุทรปราการ,06:00 น.,17
ส.คลองระหาญ,ต.แสมดำ อ.บางขุนเทียน จ.กรุงเทพมหานคร,06:00 น.,17
บ้านปางมะโอ,ต.ผาช้างน้อย อ.ปง จ.พะเยา,05:00 น.,17
บ้านแกน้อย,ต.แม่นะ อ.เชียงดาว จ.เชียงใหม่,05:00 น.,17
บ้านแม่มิงค์,ต.ช่างเคิ่ง อ.แม่แจ่ม จ.เชียงใหม่,05:00 น.,17
ชัยภูมิ,ต.ในเมือง อ.เมืองชัยภูมิ จ.ชัยภูมิ,04:00 น.,16.9
เหนือปตร.โพธิ์พระยา,ต.โพธิ์พระยา อ.เมืองสุพรรณบุรี จ.สุพรรณบุรี,06:00 น.,16.8
อบต.ปังเผล,ต.ปรังเผล อ.สังขละบุรี จ.กาญจนบุรี,06:00 น.,16.8
เหนือฝายชุมพวง,ต.ชุมพวง อ.ชุมพวง จ.นครราชสีมา,06:00 น.,16.8
สะพานแม่เล่ย์,ต.แม่เล่ย์ อ.แม่วงก์ จ.นครสวรรค์,06:00 น.,16.6
ปากคลองพระองค์เจ้าฯ (บางน้ำเปรี้ยว),ต.บางน้ำเปรี้ยว อ.บางน้ำเปรี้ยว จ.ฉะเชิงเทรา,06:00 น.,16.6
ยางตลาด,ต.ดอนสมบูรณ์ อ.ยางตลาด จ.กาฬสินธุ์,06:00 น.,16.6
บ้านโปร่งศรี,ต.บ้านฟ้า อ.บ้านหลวง จ.น่าน,05:00 น.,16.5
บ้านซำบุ่น,ต.ศิลา อ.หล่มเก่า จ.เพชรบูรณ์,05:00 น.,16.5
จุดวัด ค.บึงใหญ่-วัดทองสัมฤทธิ์,ต.แสนแสบ อ.มีนบุรี จ.กรุงเทพมหานคร,06:00 น.,16.5
บ้านไร่เนิน,ต.เขาใหญ่ อ.ชะอำ จ.เพชรบุรี,05:00 น.,16.5
บ้านหนองมะค่า,ต.โป่งแดง อ.เมืองตาก จ.ตาก,05:00 น.,16.5
บ้านห้วยห้า,ต.แม่สอย อ.จอมทอง จ.เชียงใหม่,05:00 น.,16.5
บ้านปางหก,ต.อินทขิล อ.แม่แตง จ.เชียงใหม่,05:00 น.,16.5
บ้านเค็ม,ต.หัวทุ่ง อ.ลอง จ.แพร่,05:00 น.,16.5
จุดวัด ค.ภาษีฯ-ราชมนตรี,ต.บางแค อ.บางแค จ.กรุงเทพมหานคร,06:00 น.,16.5
เขตวังทองหลาง,ต.วังทองหลาง อ.วังทองหลาง จ.กรุงเทพมหานคร,06:00 น.,16.5
บ้านหนองไผ่,ต.หนองหญ้าขาว อ.สีคิ้ว จ.นครราชสีมา,05:00 น.,16.5
บ้านเปียงกอก,ต.ม่อนปิ่น อ.ฝาง จ.เชียงใหม่,05:00 น.,16.5
บ้านปูโป,ต.สามัคคี อ.รือเสาะ จ.นราธิวาส,05:00 น.,16.5
เมืองชัยภูมิ,ต.บ้านค่าย อ.เมืองชัยภูมิ จ.ชัยภูมิ,06:00 น.,16.4
สุรินทร์ สกษ.,ต.คอโค อ.เมืองสุรินทร์ จ.สุรินทร์,04:00 น.,16.4
หน่วยพิทักษ์ป่าหินเรือ,ต.รับร่อ อ.ท่าแซะ จ.ชุมพร,22:00 น.,16.4
อบต.ตลาดไทร,ต.ตลาดไทร อ.ชุมพวง จ.นครราชสีมา,06:00 น.,16.4
ท้ายปตร.โพธิ์พระยา,ต.โพธิ์พระยา อ.เมืองสุพรรณบุรี จ.สุพรรณบุรี,06:00 น.,16.2
ทุ่งใหญ่,ต.บางรูป อ.ทุ่งใหญ่ จ.นครศรีธรรมราช,06:00 น.,16.2
บ้านควนนนท์,ต.ไม้เรียง อ.ฉวาง จ.นครศรีธรรมราช,05:00 น.,16
นครหลวง,ต.บ่อโพง อ.นครหลวง จ.พระนครศรีอยุธยา,06:00 น.,16
เขตปทุมวัน,ต.วังใหม่ อ.ปทุมวัน จ.กรุงเทพมหานคร,06:00 น.,16
อบต.โนนขวาง,ต.โนนขวาง อ.บ้านด่าน จ.บุรีรัมย์,06:00 น.,16
บ้านปางสุด,ต.แม่เล่ย์ อ.แม่วงก์ จ.นครสวรรค์,05:00 น.,16
บ้านรวมไทยพัฒนาที่ 8,ต.รวมไทยพัฒนา อ.พบพระ จ.ตาก,05:00 น.,16
บ้านด่านสิงขร,ต.คลองวาฬ อ.เมืองประจวบคีรีขันธ์ จ.ประจวบคีรีขันธ์,05:00 น.,16
ส.คลองบางจาก,ต.บางจาก อ.พระโขนง จ.กรุงเทพมหานคร,06:00 น.,16
บ้านคีรีรัตน์,ต.เข็กน้อย อ.เขาค้อ จ.เพชรบูรณ์,05:00 น.,16
บ้านป่าคา,ต.แม่พุง อ.วังชิ้น จ.แพร่,05:00 น.,16
บ้านสะพานลาว,ต.สหกรณ์นิคม อ.ทองผาภูมิ จ.กาญจนบุรี,05:00 น.,16
ทต.ตาลเดี่ยว,ต.ตาลเดี่ยว อ.หล่มสัก จ.เพชรบูรณ์,06:00 น.,16
บ้านโป่งสามสิบ,ต.ระบำ อ.ลานสัก จ.อุทัยธานี,05:00 น.,16
อบต.วังม่วง,ต.วังม่วง อ.วังม่วง จ.สระบุรี,06:00 น.,16
จุดวัด ค.แสนแสบ-วัดทรัพย์ฯ,ต.แสนแสบ อ.มีนบุรี จ.กรุงเทพมหานคร,06:00 น.,16
เขตห้ามล่าสัตว์ป่าเขาสมโภชน์,ต.นาโสม อ.ชัยบาดาล จ.ลพบุรี,06:00 น.,15.8
วารินชำราบ,ต.คำน้ำแซบ อ.วารินชำราบ จ.อุบลราชธานี,06:00 น.,15.8
ท่าพระ สกษ.,ต.ท่าพระ อ.เมืองขอนแก่น จ.ขอนแก่น,04:00 น.,15.7
กบินทร์บุรี,ต.กบินทร์ อ.กบินทร์บุรี จ.ปราจีนบุรี,06:00 น.,15.6
บ้านกองขากน้อย,ต.สะเมิงใต้ อ.สะเมิง จ.เชียงใหม่,05:00 น.,15.5
บ้านห้วยเฮี่ยน,ต.โป่งน้ำร้อน อ.ฝาง จ.เชียงใหม่,05:00 น.,15.5
