บ้านหวายหนิม*,ต.น้ำหัก อ.คีรีรัฐนิคม จ.สุราษฎร์ธานี,01:00 น.,0.5,9.137128514335346,98.95732283592224
บ้านโนนงิ้ว,ต.บ้านบัว อ.เกษตรสมบูรณ์ จ.ชัยภูมิ,14:00 น.,0.5,16.227031528438395,101.91000044345856
บ้านช่องลม,ต.ช้างแรก อ.บางสะพานน้อย จ.ประจวบคีรีขันธ์,13:00 น.,0.5,11.122707214100318,99.3669980764389
บ้านคลองกั่ว,ต.เขาพระ อ.รัตภูมิ จ.สงขลา,14:00 น.,4,6.941358660693677,100.13299942016602
บ้านลาดเหนือ,ต.หนองบัวแดง อ.หนองบัวแดง จ.ชัยภูมิ,14:00 น.,0.5,16.119841897361717,101.79699897766113
บ้านปางหก,ต.อินทขิล อ.แม่แตง จ.เชียงใหม่,00:00 น.,0.5,19.271888324067792,98.91899943351746
บ้านขาม,ต.หัวเมือง อ.เมืองปาน จ.ลำปาง,01:00 น.,0.5,18.983429080684534,99.52399849891663
บ้านขุนแจ๋,ต.แม่แวน อ.พร้าว จ.เชียงใหม่,01:00 น.,0.5,19.331088772615633,99.3209981918335
บ้านโคกแสมสาร,ต.โคกแสมสาร อ.โคกเจริญ จ.ลพบุรี,10:00 น.,0.5,15.3367687808151,100.83199918270111
บ้านห้วยสะแตง,ต.และ อ.ทุ่งช้าง จ.น่าน,14:00 น.,10.5,19.44239913060274,100.89400112628937
บ้านนาส้อง,ต.คลองใหญ่ อ.ตะโหมด จ.พัทลุง,14:00 น.,7,7.277878446450891,100.05299985408783
บ้านปางกุ่ม,ต.แม่ปะ อ.เถิน จ.ลำปาง,01:00 น.,0.5,17.707512899046613,99.36600029468536
บ้านขามป้อม,ต.ร่องจิก อ.ภูเรือ จ.เลย,13:00 น.,0.5,17.34509810080726,101.29500210285187
บ้านพญากองดี,ต.ศรีถ้อย อ.แม่สรวย จ.เชียงราย,14:00 น.,0.5,19.624469139659364,99.35999751091003
บ้านเชี่ยวหมอน,ต.พนม อ.พนม จ.สุราษฎร์ธานี,01:00 น.,0.5,8.83749537025456,98.7739884853363
บ้านคลองพร้าว,ต.เกาะช้าง อ.เกาะช้าง จ.ตราด,01:00 น.,0.5,12.060856272302658,102.30699956417084
บ้านช่องเหรียง,ต.บ้านนิคม อ.บางขัน จ.นครศรีธรรมราช,01:00 น.,0.5,7.9549580498339765,99.48799788951874
บ้านจำปาทอง,ต.บ้านทำเนียบ อ.คีรีรัฐนิคม จ.สุราษฎร์ธานี,01:00 น.,0.5,8.860430922812256,98.90576004981995
บ้านโคกไทร,ต.คลองเฉลิม อ.กงหรา จ.พัทลุง,14:00 น.,1,7.381539336586621,99.95600044727325
ที่ทำการน้ำตกนางรอง,ต.นาหินลาด อ.ปากพลี จ.นครนายก,14:00 น.,0.5,14.333358417064783,101.3209980726242
บ้านใหม่ไทยถาวร,ต.ทัพราช อ.ตาพระยา จ.สระแก้ว,14:00 น.,1,14.094722007302938,102.69465923309326
บ้านห้วยไผ่,ต.บ่อเบี้ย อ.บ้านโคก จ.อุตรดิตถ์,14:00 น.,0.5,18.30402564885227,101.10900163650513
ที่ทำการอุทยานฯเขาใหญ่,ต.นาหินลาด อ.ปากพลี จ.นครนายก,01:00 น.,0.5,14.294077977505841,101.37099981307983
บ้านโป่งคอม,ต.ด่านช้าง อ.ด่านช้าง จ.สุพรรณบุรี,01:00 น.,0.5,14.764331800550265,99.56600189208984
บ้านดอยมด,ต.แม่เจดีย์ใหม่ อ.เวียงป่าเป้า จ.เชียงราย,01:00 น.,0.5,19.053498215590984,99.46399748325348
บ้านห้วยโป่งผาลาด,ต.แม่เจดีย์ใหม่ อ.เวียงป่าเป้า จ.เชียงราย,14:00 น.,2,19.137647534076017,99.41600203514099
บ้านห้วยตง,ต.กรุงชิง อ.นบพิตำ จ.นครศรีธรรมราช,01:00 น.,0.5,8.91898508526589,99.61198568344116
บ้านขุนลาว,ต.แม่เจดีย์ใหม่ อ.เวียงป่าเป้า จ.เชียงราย,14:00 น.,22,19.0892162095161,99.37300086021423
บ้านแม่อิบ,ต.บ้านกิ่ว อ.แม่ทะ จ.ลำปาง,12:00 น.,0.5,18.02874051081513,99.55700039863586
บ้านหนองแวง,ต.ไทรเดี่ยว อ.คลองหาด จ.สระแก้ว,01:00 น.,0.5,13.591546492246145,102.25709438323975
บ้านตะบกเตี้ย,ต.ฉมัน อ.มะขาม จ.จันทบุรี,12:00 น.,0.5,12.822393592911787,102.23400056362152
บ้านควนใหม่,ต.โคกชะงาย อ.เมืองพัทลุง จ.พัทลุง,01:00 น.,0.5,7.631378437559678,99.99854564666748
บ้านห้วยไทร,ต.ชุมพล อ.ศรีนครินทร์ จ.พัทลุง,14:00 น.,16,7.629687658497234,99.92134094238281
บ้านห้วยฮ่อมพัฒนา,ต.บ้านเวียง อ.ร้องกวาง จ.แพร่,14:00 น.,0.5,18.2035168161806,100.42700171470642
บ้านแม่ทะบน,ต.ประสงค์ อ.ท่าชนะ จ.สุราษฎร์ธานี,01:00 น.,0.5,9.611513452365541,98.9409989118576
บ้านอมพาย,ต.ป่าแป๋ อ.แม่สะเรียง จ.แม่ฮ่องสอน,14:00 น.,0.5,18.298250094472394,98.17199885845184
บ้านเขาหลัก,ต.ปากแจ่ม อ.ห้วยยอด จ.ตรัง,14:00 น.,8,7.724499167281783,99.7299975156784
บ้านทับชัน,ต.คันธุลี อ.ท่าชนะ จ.สุราษฎร์ธานี,01:00 น.,0.5,9.659165017254088,99.11799788475037
บ้านห้วยกอก,ต.ห้วยเฮี้ย อ.นครไทย จ.พิษณุโลก,13:00 น.,0.5,16.911726332149588,100.87099850177765
บ้านสะโทย,ต.วังสรรพรส อ.ขลุง จ.จันทบุรี,10:00 น.,0.5,12.561464683682239,102.26500153541565
บ้านห้วยยาง,ต.บ่อเบี้ย อ.บ้านโคก จ.อุตรดิตถ์,14:00 น.,0.5,18.33238113342826,101.10900163650513
บ้านเมืองนะ,ต.แม่นะ อ.เชียงดาว จ.เชียงใหม่,10:00 น.,0.5,19.73432025766,98.89699995517731
บ้านห้วยน้ำอุ่น,ต.บ่อทอง อ.ทองแสนขัน จ.อุตรดิตถ์,01:00 น.,0.5,17.41133488006991,100.52100241184235
บ้านคลองลอย,ต.ร่อนทอง อ.บางสะพาน จ.ประจวบคีรีขันธ์,14:00 น.,0.5,11.294756591542175,99.3701308965683
บ้านนาหนอง,ต.หนองกะท้าว อ.นครไทย จ.พิษณุโลก,10:00 น.,0.5,17.085291549498148,100.76199889183044
บ้านปางไม้แดง,ต.บ้านช้าง อ.แม่แตง จ.เชียงใหม่,14:00 น.,1,19.14332860394366,98.86500120162964
บ้านลำโชค,ต.บ้านแก่ง อ.ศรีสัชนาลัย จ.สุโขทัย,01:00 น.,0.5,17.44963354499241,99.60899770259857
บ้านแม่หวาน,ต.ป่าเมี่ยง อ.ดอยสะเก็ด จ.เชียงใหม่,14:00 น.,0.5,18.95787612427548,99.23399806022644
บ้านดอยปุย,ต.สุเทพ อ.เมืองเชียงใหม่ จ.เชียงใหม่,14:00 น.,3,18.816612513420566,98.88349771499634
บ้านห้วยน้ำใส,ต.สบเมย อ.สบเมย จ.แม่ฮ่องสอน,14:00 น.,2,17.866228481753662,97.84502685070038
บ้านแม่ต๊อบเหนือ,ต.บ้านกาศ อ.แม่สะเรียง จ.แม่ฮ่องสอน,14:00 น.,0.5,18.268931348131296,97.89300084114075
บ้านโนนหัวช้าง,ต.โนนสมบูรณ์ อ.เขาสวนกวาง จ.ขอนแก่น,14:00 น.,0.5,17.03412056288666,102.7340018749237
บ้านห้วยหก,ต.เมืองแหง อ.เวียงแหง จ.เชียงใหม่,14:00 น.,1,19.54307287560017,98.64399790763855
บ้านดอกแดง,ต.บางไทร อ.ตะกั่วป่า จ.พังงา,14:00 น.,0.5,8.76229683729498,98.32100093364716
บ้านอุมุง,ต.บุฮม อ.เชียงคาน จ.เลย,01:00 น.,0.5,17.88591505201828,101.76099836826324
บ้านสำนักเอาะ,ต.เขาแดง อ.สะบ้าย้อย จ.สงขลา,14:00 น.,1,6.485847203927725,100.77905774116516
บ้านแป้น,ต.แป้น อ.สายบุรี จ.ปัตตานี,01:00 น.,0.5,6.7402190716615085,101.54667913913727
บ้านสลาแด,ต.ห้วยกระทิง อ.กรงปินัง จ.ยะลา,01:00 น.,0.5,6.3297583528765,101.26207530498505
บ้านอูตูม,ต.นาเกียน อ.อมก๋อย จ.เชียงใหม่,14:00 น.,0.5,17.86381345946238,98.2090026140213
บ้านละแอ,ต.ละแอ อ.ยะหา จ.ยะลา,01:00 น.,0.5,6.4734172932525755,101.16557478904724
บ้านม้งเก้าหลัง,ต.เทอดไทย อ.แม่ฟ้าหลวง จ.เชียงราย,14:00 น.,1,20.344088755427816,99.52099978923798
บ้านคลองกรอย,ต.ท่าชะมวง อ.รัตภูมิ จ.สงขลา,14:00 น.,23.5,7.099370209814929,100.13000071048737
บ้านโคกทัง,ต.พิจิตร อ.นาหม่อม จ.สงขลา,14:00 น.,17.5,6.981247281753932,100.59299826622009
บ้านม่วงคำ,ต.นางแล อ.เมืองเชียงราย จ.เชียงราย,14:00 น.,0.5,20.004816289003568,99.87600088119507
บ้านคลองตูกเหนือ,ต.กะปาง อ.ทุ่งสง จ.นครศรีธรรมราช,01:00 น.,0.5,8.018010777888575,99.72309350967407
บ้านห้วยหมากเอียก,ต.ป่าซาง อ.เวียงเชียงรุ้ง จ.เชียงราย,14:00 น.,1.5,20.04079808565685,100.10100066661835
บ้านก้อทุ่ง,ต.ก้อ อ.ลี้ จ.ลำพูน,14:00 น.,0.5,17.62727412248003,98.79000127315521
บ้านคลองเพล,ต.หมูสี อ.ปากช่อง จ.นครราชสีมา,12:00 น.,0.5,14.516399321393228,101.37700259685516
บ้านปลายคลองวัน,ต.ปากจั่น อ.กระบุรี จ.ระนอง,14:00 น.,0.5,10.510740579784967,98.85878384113312
บ้านย่านอุดม,ต.ทุ่งไทรทอง อ.ลำทับ จ.กระบี่,14:00 น.,0.5,8.010334899212314,99.32934522628784
บ้านบ่อภาค,ต.บ่อภาค อ.ชาติตระการ จ.พิษณุโลก,11:00 น.,0.5,17.53438606116244,100.83300232887268
บ้านสมัยเหนือ,ต.สมัย อ.สบปราบ จ.ลำปาง,14:00 น.,3,17.90468061004946,99.41600203514099
บ้านแม่สุกใน,ต.วังซ้าย อ.วังเหนือ จ.ลำปาง,14:00 น.,15.5,19.164130497069774,99.66399908065796
บ้านหนองเชียงคา,ต.ยกกระบัตร อ.สามเงา จ.ตาก,14:00 น.,0.5,17.345768882173314,99.04999852180481
บ้านเขาแงน,ต.วังตะกอ อ.หลังสวน จ.ชุมพร,14:00 น.,3,10.003618978784177,99.02999997138977
บ้านป่าไผ่,ต.กาหลง อ.ศรีสาคร จ.นราธิวาส,01:00 น.,0.5,6.244619865181592,101.4401525259018
บ้านเหล่ากอหก,ต.เหล่ากอหก อ.นาแห้ว จ.เลย,01:00 น.,0.5,17.496023367293102,100.87900221347809
บ้านโป่งแค,ต.วังประจบ อ.เมืองตาก จ.ตาก,14:00 น.,0.5,16.926296734041184,99.40999925136566
บ้านทุ่งจ้อ,ต.ป่าแป๋ อ.แม่แตง จ.เชียงใหม่,14:00 น.,3,19.14911589924398,98.64000141620636
บ้านส้อ,ต.เปือ อ.เชียงกลาง จ.น่าน,01:00 น.,0.5,19.30815639392614,100.84800124168396
บ้านขะเนจื้อ,ต.ขะเนจื้อ อ.แม่ระมาด จ.ตาก,11:00 น.,0.5,17.04137807525838,98.49200248718262
บ้านขุนห้วยแม่ต้าน,ต.แม่ต้าน อ.ท่าสองยาง จ.ตาก,14:00 น.,2,17.271742840279448,98.23699951171875
บ้านบ่อหยวกใต้,ต.บ่อเกลือเหนือ อ.บ่อเกลือ จ.น่าน,14:00 น.,0.5,19.283316949226844,101.17700099945068
บ้านริมอิง*,ต.เวียง อ.เทิง จ.เชียงราย,14:00 น.,2,19.613655737756773,100.18500208854675
บ้านแม่ปอน,ต.บ้านหลวง อ.จอมทอง จ.เชียงใหม่,14:00 น.,0.5,18.469667185798688,98.61100137233734
บ้านขุนน้ำพริก,ต.นาไร่หลวง อ.สองแคว จ.น่าน,14:00 น.,0.5,19.3327389698533,100.67299783229828
บ้านแม่ตะละม้ง,ต.แม่แดด อ.กัลยาณิวัฒนา จ.เชียงใหม่,14:00 น.,9.5,18.93459248610383,98.45499873161316
บ้านมหาโพธิ,ต.มหาโพธิ อ.สระโบสถ์ จ.ลพบุรี,10:00 น.,0.5,15.268293070572723,100.83800196647644
รร.บ้านเหมืองตะกั่ว,ต.หนองธง อ.ป่าบอน จ.พัทลุง,15:00 น.,0.2,7.2132638064643055,100.07940888404846
ปะเหลียน,ต.ท่าพญา อ.ปะเหลียน จ.ตรัง,15:00 น.,27.4,7.371984583452164,99.67727601528168
ทต.แม่ใจ,ต.แม่ใจ อ.แม่ใจ จ.พะเยา,15:00 น.,0.2,19.346101916337886,99.81359660625458
สถานีวิจัยต้นน้ำคีรีวง,ต.กำโลน อ.ลานสกา จ.นครศรีธรรมราช,15:00 น.,0.4,8.432135721676811,99.76882517337799
สันทราย,ต.แม่แฝก อ.สันทราย จ.เชียงใหม่,15:00 น.,1.6,19.009764257652616,98.9597636461258
เขื่องใน,ต.เขื่องใน อ.เขื่องใน จ.อุบลราชธานี,15:00 น.,0.4,15.322458722986289,104.54648852348328
อบต.โพธิ์ประทับช้าง,ต.โพธิ์ประทับช้าง อ.โพธิ์ประทับช้าง จ.พิจิตร,15:00 น.,0.2,16.310630371722077,100.29538571834564
ทต.น้ำยืน,ต.สีวิเชียร อ.น้ำยืน จ.อุบลราชธานี,15:00 น.,0.6,14.499624766575971,104.99804377555847
สะพานแม่น้ำน่าน บ้านเปียงก่อ,ต.ขุนน่าน อ.เฉลิมพระเกียรติ จ.น่าน,15:00 น.,0.2,19.432099655746182,101.15272164344788
ทต.ดอยสะเก็ด,ต.เชิงดอย อ.ดอยสะเก็ด จ.เชียงใหม่,15:00 น.,3.8,18.864793174598233,99.1323047876358
คอหงษ์ สกษ.,ต.คอหงส์ อ.หาดใหญ่ จ.สงขลา,01:00 น.,0.4,7.000000309662351,100.50000071525574
หน่วยจัดการต้นน้ำห้วยอีมาย,ต.นาป่า อ.เมืองเพชรบูรณ์ จ.เพชรบูรณ์,15:00 น.,0.2,16.40933855153537,101.28303408622742
ท่าตูม,ต.ทุ่งกุลา อ.ท่าตูม จ.สุรินทร์,15:00 น.,0.6,15.329681130283811,103.68261337280273
ป่าสักงาม,ต.ลวงเหนือ อ.ดอยสะเก็ด จ.เชียงใหม่,15:00 น.,2,18.99260020061515,99.12812054157257
อบต.นายม,ต.นายม อ.เมืองอำนาจเจริญ จ.อำนาจเจริญ,11:00 น.,0.2,15.86190707675945,104.51558411121368
สะพานตาบัว บ้านยาเด๊ะ,ต.ภูเขาทอง อ.สุคิริน จ.นราธิวาส,15:00 น.,1.4,5.827587782935213,101.75235092639923
สถานีพัฒนาการเกษตรที่สูง ฯ ภูพยัคฆ์,ต.ขุนน่าน อ.เฉลิมพระเกียรติ จ.น่าน,15:00 น.,2,19.504743526382768,101.21375262737274
สะพานนวลฉวี,ต.บ้านใหม่ อ.ปากเกร็ด จ.นนทบุรี,15:00 น.,0.4,13.947525752208934,100.53503572940826
คลองแม่พุง,ต.ป่าแงะ อ.ป่าแดด จ.เชียงราย,15:00 น.,0.2,19.566578658356704,99.98419046401978
แม่พริก,ต.แม่พริก อ.แม่พริก จ.ลำปาง,15:00 น.,0.6,17.445467809779277,99.12866771221161
อบต.ช่องสามหมอ,ต.ช่องสามหมอ อ.แก้งคร้อ จ.ชัยภูมิ,15:00 น.,0.4,16.116698233577686,102.23190307617188
อบต.ท่าเสา,ต.ท่าเสา อ.ไทรโยค จ.กาญจนบุรี,02:00 น.,0.2,14.21599574292342,99.0812087059021
ตะพานหิน,ต.งิ้วราย อ.ตะพานหิน จ.พิจิตร,11:00 น.,0.4,16.270406025957886,100.41391253471375
สะพานแม่เล่ย์,ต.แม่เล่ย์ อ.แม่วงก์ จ.นครสวรรค์,15:00 น.,0.8,15.841719527027593,99.41807270050049
อบต.วังท่าช้าง,ต.วังท่าช้าง อ.กบินทร์บุรี จ.ปราจีนบุรี,15:00 น.,0.4,13.759503588121627,101.88694417476654
อบต.ปากพนังฝั่งตะวันออก,ต.ปากพนังฝั่งตะวันออก อ.ปากพนัง จ.นครศรีธรรมราช,15:00 น.,0.2,8.388190681802545,100.23187637329102
ประจันตคาม (KGT7A),ต.ประจันตคาม อ.ประจันตคาม จ.ปราจีนบุรี,02:00 น.,0.2,14.070912207380376,101.5189129114151
รพสต.แก่นมะกรูด,ต.แก่นมะกรูด อ.บ้านไร่ จ.อุทัยธานี,15:00 น.,0.4,15.161830439301236,99.289031624794
อบต.ไชยวัฒนา,ต.ไชยวัฒนา อ.ปัว จ.น่าน,15:00 น.,0.4,19.22249859247288,100.91778695583344
อบต.นาสวน,ต.นาสวน อ.ศรีสวัสดิ์ จ.กาญจนบุรี,15:00 น.,0.4,14.611465685039695,99.1257494688034
ทต.หย่วน,ต.หย่วน อ.เชียงคำ จ.พะเยา,15:00 น.,0.6,19.530398551289178,100.29209196567535
โกสุมพิสัย,ต.หัวขวาง อ.โกสุมพิสัย จ.มหาสารคาม,02:00 น.,0.2,16.250986022836422,103.07402014732361
ลำน้ำก่ำ,ต.หนองบ่อ อ.นาแก จ.นครพนม,01:00 น.,0.4,17.030684045731913,104.41480815410614
ทต.ศรีนคร,ต.ศรีนคร อ.ศรีนคร จ.สุโขทัย,15:00 น.,0.4,17.355046921071686,99.99219417572021
คลองปะแต,ต.ปะแต อ.ยะหา จ.ยะลา,15:00 น.,0.2,6.4125852162358346,101.13891363143921
ทองผาภูมิ,ต.ท่าขนุน อ.ทองผาภูมิ จ.กาญจนบุรี,13:00 น.,0.4,14.742222416902438,98.63639116287231
คลองลาดพร้าว ปากคลอง2สายใต้,ต.ลาดพร้าว อ.ลาดพร้าว จ.กรุงเทพมหานคร,15:00 น.,4.6,13.931828349216348,100.63948631286621
ศูนย์อปพร.อบต.ลาดยาว,ต.ลาดยาว อ.ลาดยาว จ.นครสวรรค์,15:00 น.,0.2,15.762859369383925,99.74133253097534
อบต.หนองบอนแดง,ต.หนองบอนแดง อ.บ้านบึง จ.ชลบุรี,11:00 น.,0.4,13.35020548791017,101.15712583065033
สะพานท่าสำเภา,ต.ชัยบุรี อ.เมืองพัทลุง จ.พัทลุง,15:00 น.,0.2,7.729607562509329,100.10796368122101
ฮอด,ต.หางดง อ.ฮอด จ.เชียงใหม่,11:00 น.,0.4,18.178590770682636,98.63016307353973
เครือข่ายลุ่มน้ำลาว,ต.แม่เจดีย์ใหม่ อ.เวียงป่าเป้า จ.เชียงราย,15:00 น.,3,19.128824003088113,99.43992733955383
หน่วยจัดการต้นน้ำบ่อแก้ว,ต.แม่นาจร อ.แม่แจ่ม จ.เชียงใหม่,15:00 น.,4.6,18.868625710448022,98.50515067577362
ทต.ช้างเผือก,ต.ช้างเผือก อ.เมืองเชียงใหม่ จ.เชียงใหม่,15:00 น.,0.4,18.81010274919089,98.96994531154633
ทต.เขาโจด,ต.เขาโจด อ.ศรีสวัสดิ์ จ.กาญจนบุรี,15:00 น.,0.4,14.662372381532116,99.34231102466583
สุรินทร์ สกษ.,ต.คอโค อ.เมืองสุรินทร์ จ.สุรินทร์,13:00 น.,0.3,14.88333203516152,103.45000147819519
นครพนม สกษ.,ต.ในเมือง อ.เมืองนครพนม จ.นครพนม,13:00 น.,0.3,17.443057371476723,104.77361261844635
ที่ว่าการอำเภอกาบัง,ต.กาบัง อ.กาบัง จ.ยะลา,15:00 น.,4.6,6.42707427445721,101.01934611797333
ศรีมหาโพธิ (KGT6),ต.บ้านทาม อ.ศรีมหาโพธิ จ.ปราจีนบุรี,11:00 น.,0.2,13.973435843000589,101.51752889156342
อบต.บ้านไร่,ต.บ้านไร่ อ.บางกระทุ่ม จ.พิษณุโลก,02:00 น.,0.2,16.61077865827804,100.26578485965729
อบต.เหล่ากอหก,ต.เหล่ากอหก อ.นาแห้ว จ.เลย,02:00 น.,0.2,17.496422433508698,100.88751554489136
อบต.หนองโสน,ต.หนองโสน อ.สามง่าม จ.พิจิตร,15:00 น.,0.4,16.396735799916986,100.05493104457855
อบต.นาซ่าว,ต.นาซ่าว อ.เชียงคาน จ.เลย,02:00 น.,0.2,17.824249395430734,101.66912734508514
อบต.บ้านแมด,ต.บ้านแมด อ.บุณฑริก จ.อุบลราชธานี,02:00 น.,0.2,14.854483847815494,105.32192587852478
น้ำปาด,ต.บ้านฝาย อ.น้ำปาด จ.อุตรดิตถ์,15:00 น.,0.2,17.790887836770544,100.74902772903442
อบต.คลองศก,ต.คลองศก อ.พนม จ.สุราษฎร์ธานี,02:00 น.,0.2,8.890472370265089,98.661367893219
อบต.ลานกระบือ,ต.ลานกระบือ อ.ลานกระบือ จ.กำแพงเพชร,15:00 น.,0.2,16.618078107090785,99.88006174564362
เหนือฝายยางบ้านตะลุง,ต.หนองเรือ อ.ชุมพลบุรี จ.สุรินทร์,02:00 น.,0.2,15.293478632781735,103.54047238826752
อบต.เขาพระ,ต.เขาพระ อ.รัตภูมิ จ.สงขลา,15:00 น.,1.4,7.080179347082024,100.18832266330719
เมืองสระแก้ว,ต.สระขวัญ อ.เมืองสระแก้ว จ.สระแก้ว,15:00 น.,0.2,13.80959170999193,102.05429255962372
ที่ว่าการอำเภอกรงปินัง,ต.สะเอะ อ.กรงปินัง จ.ยะลา,15:00 น.,6.2,6.410911325271148,101.27362489700317
คลองหอยโข่ง,ต.ทุ่งลาน อ.คลองหอยโข่ง จ.สงขลา,15:00 น.,5.6,6.931240863876102,100.43984413146973
