สถานีชุมชนบ้านร้องแง,ต.วรนคร อ.ปัว จ.น่าน ,06:00 ,8.2
สถานีพระแสง,ต.ไทรขึง อ.พระแสง จ.สุราษฎร์ธานี ,06:00 ,8.2
สถานีบ้านแดนชุมพล,ต.แดนชุมพล อ.สอง จ.แพร่ ,06:00 ,8
สถานีบ้านปูโป,ต.สามัคคี อ.รือเสาะ จ.นราธิวาส ,05:00 ,8
สถานีบ้าน กม.80,ต.บุพราหมณ์ อ.นาดี จ.ปราจีนบุรี ,05:00 ,8
สถานีบ้านบางหอย,ต.เขาต่อ อ.ปลายพระยา จ.กระบี่ ,06:00 ,8
สถานีอบต.บานา,ต.บานา อ.เมืองปัตตานี จ.ปัตตานี ,06:00 ,8
สถานีบ้านสบป่อง,ต.ปางมะผ้า อ.ปางมะผ้า จ.แม่ฮ่องสอน ,06:00 ,8
สถานีบ้านในเพลา,ต.ขนอม อ.ขนอม จ.นครศรีธรรมราช ,06:00 ,8
สถานีบ้านคลองดินดำ,ต.หมูสี อ.ปากช่อง จ.นครราชสีมา ,06:00 ,8
สถานีเมืองตรัง,ต.บางรัก อ.เมืองตรัง จ.ตรัง ,06:00 ,7.6
สถานีฉวาง,ต.ไม้เรียง อ.ฉวาง จ.นครศรีธรรมราช ,04:00 ,7.6
สถานีบ้านเหนือคลอง,ต.ช้างซ้าย อ.กาญจนดิษฐ์ จ.สุราษฎร์ธานี ,02:00 ,7.5
สถานีบ้านทุ่งกร่าง,ต.ทับไทร อ.โป่งน้ำร้อน จ.จันทบุรี ,05:00 ,7.5
สถานีบ้านนาเปรื่อง,ต.บ่อเกลือใต้ อ.บ่อเกลือ จ.น่าน ,06:00 ,7.5
สถานีบ้านนอก,ต.กงหรา อ.กงหรา จ.พัทลุง ,06:00 ,7.5
สถานีบ้านร่มเกล้าสหมิตร,ต.คีรีราษฎร์ อ.พบพระ จ.ตาก ,06:00 ,7.5
สถานีบ้านนาพึง,ต.นาพึง อ.นาแห้ว จ.เลย ,06:00 ,7.5
สถานีบ้านนาหนอง,ต.หนองกะท้าว อ.นครไทย จ.พิษณุโลก ,06:00 ,7.5
สถานีทุ่งสง,ต.ปากแพรก อ.ทุ่งสง จ.นครศรีธรรมราช ,06:00 ,7.4
สถานีปตร.ตุยง,ต.ตุยง อ.หนองจิก จ.ปัตตานี ,06:00 ,7.2
สถานีท้ายฝายยางบ้านตะลุง,ต.หนองเรือ อ.ชุมพลบุรี จ.สุรินทร์ ,06:00 ,7.2
สถานีบ้านหาดถั่ว,ต.ปลายพระยา อ.ปลายพระยา จ.กระบี่ ,05:00 ,7
สถานีบ้านนาพรุ,ต.นาคา อ.สุขสำราญ จ.ระนอง ,05:00 ,7
สถานีจุดวัด ค.บางเชือกหนัง-ถ.พุทธมณฑลสาย 1,ต.คลองขวาง อ.ภาษีเจริญ จ.กรุงเทพมหานคร ,06:00 ,7
สถานีคลองสุงบบารู หมู่ที่ 4,ต.คลองใหม่ อ.ยะรัง จ.ปัตตานี ,06:00 ,7
สถานีบ้านห้วยไทร,ต.ชุมพล อ.ศรีนครินทร์ จ.พัทลุง ,05:00 ,7
สถานีบ้านโก๊ะไม้หลู่,ต.ป่าแป๋ อ.แม่สะเรียง จ.แม่ฮ่องสอน ,06:00 ,7
สถานีบ้านบางแป้น2,ต.วังมะปราง อ.วังวิเศษ จ.ตรัง ,06:00 ,7
สถานีบ้านไสใหญ่เหนือ,ต.ถ้ำใหญ่ อ.ทุ่งสง จ.นครศรีธรรมราช ,06:00 ,7
สถานีบ้านห้วยหินลับ,ต.วังกวาง อ.น้ำหนาว จ.เพชรบูรณ์ ,06:00 ,7
สถานีบ้านสวนป่า,ต.ห้วยโรง อ.ร้องกวาง จ.แพร่ ,06:00 ,7
สถานีบ้านโล๊ะจังกระ,ต.คลองเฉลิม อ.กงหรา จ.พัทลุง ,06:00 ,7
สถานีบ้านวังพา,ต.ทุ่งตำเสา อ.หาดใหญ่ จ.สงขลา ,06:00 ,7
สถานีจุดวัดสวนเบญจสิริ,ต.คลองตัน อ.คลองเตย จ.กรุงเทพมหานคร ,06:00 ,7
สถานีเขตสาทร,ต.ทุ่งวัดดอน อ.สาทร จ.กรุงเทพมหานคร ,06:00 ,7
สถานีบ้านธาราวงศ์อารีย์,ต.เพิ่มพูนทรัพย์ อ.บ้านนาสาร จ.สุราษฎร์ธานี ,06:00 ,7
สถานีบ้านคีรีรัตน์,ต.เข็กน้อย อ.เขาค้อ จ.เพชรบูรณ์ ,06:00 ,7
สถานีบ้านหนองบัว,ต.หนองบัว อ.ภูเรือ จ.เลย ,06:00 ,7
สถานีรร.ตชด.บ้านไอร์บือแต,ต.ช้างเผือก อ.จะแนะ จ.นราธิวาส ,06:00 ,6.6
สถานีสะพานกรุงเทพ,ต.ดาวคะนอง อ.ธนบุรี จ.กรุงเทพมหานคร ,06:00 ,6.6
สถานีบ้านไทรงาม,ต.ระเริง อ.วังน้ำเขียว จ.นครราชสีมา ,05:00 ,6.5
สถานีบ้านต้นหาร,ต.หน้าเขา อ.เขาพนม จ.กระบี่ ,06:00 ,6.5
สถานีบ้านนาปอ,ต.แสงภา อ.นาแห้ว จ.เลย ,06:00 ,6.5
สถานีจุดวัดบึงมักกะสัน,ต.มักกะสัน อ.ราชเทวี จ.กรุงเทพมหานคร ,06:00 ,6.5
สถานีชุมชนบ้านท่าด่าน,ต.ดอนรัก อ.หนองจิก จ.ปัตตานี ,06:00 ,6.4
สถานีเขตรักษาพันธุ์สัตว์ป่าเขาสอยดาว,ต.ทรายขาว อ.สอยดาว จ.จันทบุรี ,06:00 ,6.4
สถานีอบต.ศรีละกอ,ต.ศรีละกอ อ.จักราช จ.นครราชสีมา ,06:00 ,6.4
สถานีป่าพะยอม,ต.เกาะเต่า อ.ป่าพะยอม จ.พัทลุง ,06:00 ,6.2
สถานีรพ.สต.เวียงสระ,ต.เวียงสระ อ.เวียงสระ จ.สุราษฎร์ธานี ,06:00 ,6.2
สถานีสถานีพัฒนาการเกษตรที่สูง ฯ ภูพยัคฆ์,ต.ขุนน่าน อ.เฉลิมพระเกียรติ จ.น่าน ,06:00 ,6.2
สถานีที่ว่าการอำเภอยี่งอ,ต.ยี่งอ อ.ยี่งอ จ.นราธิวาส ,06:00 ,6.2
สถานีบ้านคลองกรอย,ต.ท่าชะมวง อ.รัตภูมิ จ.สงขลา ,06:00 ,6
สถานีบ้านเหล่ากอหก,ต.เหล่ากอหก อ.นาแห้ว จ.เลย ,05:00 ,6
สถานีบ้านแซะ,ต.สะกอม อ.เทพา จ.สงขลา ,06:00 ,6
สถานีเขตบางรัก,ต.สี่พระยา อ.บางรัก จ.กรุงเทพมหานคร ,06:00 ,6
สถานีรฟ.สุราษฎร์ธานี,ต.เขาหัวควาย อ.พุนพิน จ.สุราษฎร์ธานี ,05:00 ,6
สถานีชุมชนบ้านตูม,ต.กุดน้ำใส อ.ค้อวัง จ.ยโสธร ,06:00 ,6
สถานีอบต.บุพราหมณ์,ต.บุพราหมณ์ อ.นาดี จ.ปราจีนบุรี ,06:00 ,6
สถานีเหนือฝายยางบ้านตะลุง,ต.หนองเรือ อ.ชุมพลบุรี จ.สุรินทร์ ,06:00 ,6
สถานีบ้านระเริง,ต.ระเริง อ.วังน้ำเขียว จ.นครราชสีมา ,06:00 ,6
สถานีปตร.คลองอรชร,ต.ปทุมวัน อ.ปทุมวัน จ.กรุงเทพมหานคร ,06:00 ,6
สถานีบ้านต้นมะพร้าว,ต.ถ้ำสิงขร อ.คีรีรัฐนิคม จ.สุราษฎร์ธานี ,05:00 ,6
สถานีบ้านนาล้อม,ต.ป่าแดง อ.ชาติตระการ จ.พิษณุโลก ,06:00 ,6
สถานีบ้านกลาง,ต.ห้วยโป่ง อ.เมืองแม่ฮ่องสอน จ.แม่ฮ่องสอน ,06:00 ,6
สถานีแม่น้ำมูล บ้านคันไร่,ต.ทรายมูล อ.พิบูลมังสาหาร จ.อุบลราชธานี ,05:00 ,6
สถานีปตร. คลองลัดบางยอ 1,ต.บางยอ อ.พระประแดง จ.สมุทรปราการ ,06:00 ,6
สถานีบ้านแม่จอ,ต.แม่โถ อ.แม่ลาน้อย จ.แม่ฮ่องสอน ,06:00 ,6
สถานีสตูล,ต.คลองขุด อ.เมืองสตูล จ.สตูล ,04:00 ,5.9
สถานีสถานีชุมชนป่าภูถ้ำ,ต.แวงน้อย อ.แวงน้อย จ.ขอนแก่น ,06:00 ,5.8
สถานีทต.ลำแก่น,ต.ลำแก่น อ.ท้ายเหมือง จ.พังงา ,06:00 ,5.8
สถานีอุทยานแห่งชาติภูจองนายอย,ต.นาจะหลวย อ.นาจะหลวย จ.อุบลราชธานี ,06:00 ,5.8
สถานีบางปะหัน,ต.โพธิ์สามต้น อ.บางปะหัน จ.พระนครศรีอยุธยา ,06:00 ,5.8
สถานีประปาหมู่บ้านมหาราช,ต.แม่พูล อ.ลับแล จ.อุตรดิตถ์ ,06:00 ,5.6
สถานีถ้ำพรรณรา,ต.ถ้ำพรรณรา อ.ถ้ำพรรณรา จ.นครศรีธรรมราช ,06:00 ,5.6
สถานีลานกีฬา อบต.วังโป่ง,ต.วังโป่ง อ.วังโป่ง จ.เพชรบูรณ์ ,06:00 ,5.6
สถานีบ้านห้วยน้ำอุ่น,ต.บ่อทอง อ.ทองแสนขัน จ.อุตรดิตถ์ ,06:00 ,5.5
สถานีบ้านคลองเดื่อ,ต.หมูสี อ.ปากช่อง จ.นครราชสีมา ,05:00 ,5.5
สถานีบ้านตามูล,ต.ทรายขาว อ.สอยดาว จ.จันทบุรี ,06:00 ,5.5
สถานีเขตภาษีเจริญ,ต.บางหว้า อ.ภาษีเจริญ จ.กรุงเทพมหานคร ,06:00 ,5.5
สถานีบ้านเวียคะดี้,ต.หนองลู อ.สังขละบุรี จ.กาญจนบุรี ,05:00 ,5.5
สถานีบ้านควนโต๊ะเหลง,ต.ควนโดน อ.ควนโดน จ.สตูล ,05:00 ,5.5
สถานีบ้านห้วยโรงนอก,ต.ห้วยโรง อ.ร้องกวาง จ.แพร่ ,06:00 ,5.5
สถานีทต.ภูเรือ,ต.หนองบัว อ.ภูเรือ จ.เลย ,06:00 ,5.4
สถานีทม.พัทลุง,ต.คูหาสวรรค์ อ.เมืองพัทลุง จ.พัทลุง ,06:00 ,5.4
สถานีบ้านโกรกอีดก,ต.ชะอม อ.แก่งคอย จ.สระบุรี ,06:00 ,5.4
สถานีหาดใหญ่,ต.ทุ่งลาน อ.คลองหอยโข่ง จ.สงขลา ,04:00 ,5.4
สถานีหน่วยพิทักษ์อุทยานแห่งชาติที่ ทล.๑๑ (ไทยสามัคคี),ต.ไทยสามัคคี อ.วังน้ำเขียว จ.นครราชสีมา ,06:00 ,5.4
สถานีหน่วยพิทักษ์อุทยานแห่งชาติที่ ขป.๙  (น้ำตกเขาคราม),ต.ลำสินธุ์ อ.ศรีนครินทร์ จ.พัทลุง ,05:00 ,5.4
สถานีหน่วยพิทักษ์อุทยานฯ ที่ บล.๒ (น้ำตกฮาลาซะห์),ต.แม่หวาด อ.ธารโต จ.ยะลา ,06:00 ,5.2
สถานีอบต.แม่สวด,ต.แม่สวด อ.สบเมย จ.แม่ฮ่องสอน ,06:00 ,5.2
สถานีบ้านเวียคะดี้,ต.หนองลู อ.สังขละบุรี จ.กาญจนบุรี ,05:00 ,5
สถานีบ้านซับใต้,ต.พญาเย็น อ.ปากช่อง จ.นครราชสีมา ,04:00 ,5
สถานีบ้านแม่ละเมา,ต.พะวอ อ.แม่สอด จ.ตาก ,06:00 ,5
สถานีวัดคอกช้าง อ.ธารโต จ.ยะลา,ต.แม่หวาด อ.ธารโต จ.ยะลา ,05:00 ,5
สถานีบ้านเขาไว้ข้าว,ต.ดินแดง อ.ลำทับ จ.กระบี่ ,06:00 ,5
สถานีบ้านสกาดกลาง,ต.สกาด อ.ปัว จ.น่าน ,06:00 ,5
สถานีบ้านปาล์มทองพัฒนา,ต.ปาล์มพัฒนา อ.มะนัง จ.สตูล ,06:00 ,5
สถานีฝายละแอ อ.บันนังสตา จ.ยะลา,ต.เขื่อนบางลาง อ.บันนังสตา จ.ยะลา ,05:00 ,5
สถานีรร.ผังปาล์ม 4,ต.ปาล์มพัฒนา อ.มะนัง จ.สตูล ,06:00 ,5
สถานีบ้านวังยาว,ต.ปากช่อง อ.หล่มสัก จ.เพชรบูรณ์ ,06:00 ,5
สถานีบ้านปางแฟน,ต.ป่าเมี่ยง อ.ดอยสะเก็ด จ.เชียงใหม่ ,06:00 ,5
สถานีแม่จัน,ต.แม่จัน อ.แม่จัน จ.เชียงราย ,06:00 ,5
สถานีบ้านห้วยแห้ง,ต.ขะเนจื้อ อ.แม่ระมาด จ.ตาก ,06:00 ,5
สถานีบ้านปลายระแนะ,ต.ละอาย อ.ฉวาง จ.นครศรีธรรมราช ,06:00 ,5
สถานีอบต.วังโรงใหญ่,ต.วังโรงใหญ่ อ.สีคิ้ว จ.นครราชสีมา ,06:00 ,5
สถานีบ้านวังไผ่,ต.นาไร่หลวง อ.สองแคว จ.น่าน ,06:00 ,5
สถานีบ้านขนงพระใต้,ต.ขนงพระ อ.ปากช่อง จ.นครราชสีมา ,06:00 ,5
สถานีอบต.นาโส่,ต.นาโส่ อ.กุดชุม จ.ยโสธร ,06:00 ,4.8
สถานีอบต.โนนแดง,ต.โนนแดง อ.บรบือ จ.มหาสารคาม ,06:00 ,4.6
สถานีโรงเรียนนิคมสร้างตนเองพัฒนาภาคใต้ 1,ต.ตลิ่งชัน อ.บันนังสตา จ.ยะลา ,06:00 ,4.6
สถานีบ้านโป่งช้าง,ต.หนองปรือ อ.หนองปรือ จ.กาญจนบุรี ,06:00 ,4.5
สถานีบ้านห้วยกุ้ง,ต.ป่าโปง อ.สบเมย จ.แม่ฮ่องสอน ,06:00 ,4.5
สถานีบ้านคลองสอง,ต.วังน้ำเขียว อ.วังน้ำเขียว จ.นครราชสีมา ,06:00 ,4.5
สถานีบ้านกองลอย,ต.บ่อสลี อ.ฮอด จ.เชียงใหม่ ,06:00 ,4.5
สถานีบ้านช่องไม้ดำ,ต.คลองหิน อ.อ่าวลึก จ.กระบี่ ,06:00 ,4.5
สถานีบ้านชมภูเหนือ,ต.ชมพู อ.เนินมะปราง จ.พิษณุโลก ,06:00 ,4.5
สถานีบ้านน้ำแคะ,ต.ดงพญา อ.บ่อเกลือ จ.น่าน ,05:00 ,4.5
สถานีบ้านห้วยกอก,ต.ห้วยเฮี้ย อ.นครไทย จ.พิษณุโลก ,06:00 ,4.5
สถานีบ้านห้วยผักเน่า,ต.ลาดค่าง อ.ภูเรือ จ.เลย ,06:00 ,4.5
สถานีบ้านขามป้อม,ต.ร่องจิก อ.ภูเรือ จ.เลย ,06:00 ,4.5
สถานีบ้านใน,ต.ปากแพรก อ.ดอนสัก จ.สุราษฎร์ธานี ,05:00 ,4.5
สถานีอบต.หนองหมื่นถ่าน,ต.หนองหมื่นถ่าน อ.อาจสามารถ จ.ร้อยเอ็ด ,06:00 ,4.4
สถานีสะพานห้วยน้ำฮวย,ต.บ้านม่วง อ.สังคม จ.หนองคาย ,06:00 ,4.4
สถานีละงู,ต.ละงู อ.ละงู จ.สตูล ,06:00 ,4.4
สถานีรร. เทศบาล 1 (ทต.เกษตรวิสัย),ต.เกษตรวิสัย อ.เกษตรวิสัย จ.ร้อยเอ็ด ,06:00 ,4.4
สถานีหน่วยพิทักษ์อุทยานแห่งชาติ มว.๔ (แม่แสลม),ต.เวียงมอก อ.เถิน จ.ลำปาง ,06:00 ,4.2
สถานีสะพานน้ำยาว บ้านสองแคว,ต.นาไร่หลวง อ.สองแคว จ.น่าน ,06:00 ,4.2
สถานีหน่วยจัดการต้นน้ำห้วยอีมาย,ต.นาป่า อ.เมืองเพชรบูรณ์ จ.เพชรบูรณ์ ,06:00 ,4.2
สถานีอบต.บ้านกลาง,ต.บ้านกลาง อ.สอง จ.แพร่ ,06:00 ,4.2
สถานีอบต.ตลาดไทร,ต.ตลาดไทร อ.ชุมพวง จ.นครราชสีมา ,06:00 ,4.2
สถานีบ้านปลาบ่า,ต.ปลาบ่า อ.ภูเรือ จ.เลย ,06:00 ,4
สถานีบ้านกกโพธิ์ริมน้ำสาน,ต.ร่องจิก อ.ภูเรือ จ.เลย ,06:00 ,4
สถานีบ้านห้วยตาสิงห์,ต.บ้านควน อ.หลังสวน จ.ชุมพร ,06:00 ,4
สถานีอบต.ระเว,ต.ระเว อ.พิบูลมังสาหาร จ.อุบลราชธานี ,06:00 ,4
สถานีบ้านปากแคลง,ต.ปะเหลียน อ.ปะเหลียน จ.ตรัง ,06:00 ,4
สถานีบ้านหมากปรก,ต.ไม้ขาว อ.ถลาง จ.ภูเก็ต ,06:00 ,4
สถานีเขตราชเทวี,ต.ทุ่งพญาไท อ.ราชเทวี จ.กรุงเทพมหานคร ,06:00 ,4
สถานีท่าศาลา,ต.สระแก้ว อ.ท่าศาลา จ.นครศรีธรรมราช ,06:00 ,4
สถานีบ้านหางนา,ต.โพนสูง อ.ด่านซ้าย จ.เลย ,06:00 ,4
สถานีบ้านสามพัน*,ต.ไทรขึง อ.พระแสง จ.สุราษฎร์ธานี ,05:00 ,4
สถานีทต.ตันหยงมัส,ต.ตันหยงมัส อ.ระแงะ จ.นราธิวาส ,06:00 ,4
สถานีชัยภูมิ,ต.ในเมือง อ.เมืองชัยภูมิ จ.ชัยภูมิ ,04:00 ,4
สถานีบ้านห้วยโต้,ต.ทับปริก อ.เมืองกระบี่ จ.กระบี่ ,06:00 ,4
สถานีบ้านคลองไชยใต้,ต.กะเปียด อ.ฉวาง จ.นครศรีธรรมราช ,06:00 ,4
สถานีหน่วยศึกษาการพัฒนาการอนุรักษ์ต้นน้ำน้ำคาง (ดอยวาว),ต.ศรีภูมิ อ.ท่าวังผา จ.น่าน ,06:00 ,3.8
สถานีหน่วยจัดการต้นน้ำขุนน่าน,ต.บ่อเกลือเหนือ อ.บ่อเกลือ จ.น่าน ,06:00 ,3.8
สถานีอบต.สัมฤทธิ์,ต.สัมฤทธิ์ อ.พิมาย จ.นครราชสีมา ,06:00 ,3.8
สถานีประโคนชัย,ต.ไพศาล อ.ประโคนชัย จ.บุรีรัมย์ ,06:00 ,3.8
สถานีทต.ช้างเผือก,ต.ช้างเผือก อ.เมืองเชียงใหม่ จ.เชียงใหม่ ,06:00 ,3.8
สถานีอบต.หล่มเก่า,ต.หล่มเก่า อ.หล่มเก่า จ.เพชรบูรณ์ ,06:00 ,3.8
สถานีที่ว่าการอำเภอรามัน,ต.กายูบอเกาะ อ.รามัน จ.ยะลา ,06:00 ,3.6
สถานีสะพานแม่ตื่น,ต.แม่ตื่น อ.แม่ระมาด จ.ตาก ,06:00 ,3.6
สถานีสุคิริน,ต.สุคิริน อ.สุคิริน จ.นราธิวาส ,06:00 ,3.6
สถานีสถานีวิจัยต้นน้ำตาปี,ต.กะทูน อ.พิปูน จ.นครศรีธรรมราช ,06:00 ,3.6
สถานีสะพานน้ำว้า บ้านน้ำว้า,ต.น้ำพาง อ.แม่จริม จ.น่าน ,03:00 ,3.6
สถานีบ้านโคกสะอาด,ต.นายางกลัก อ.เทพสถิต จ.ชัยภูมิ ,05:00 ,3.5
สถานีบ้านซอย 8,ต.ควนกาหลง อ.ควนกาหลง จ.สตูล ,05:00 ,3.5
สถานีบ้านปางแก,ต.ทุ่งช้าง อ.ทุ่งช้าง จ.น่าน ,06:00 ,3.5
สถานีปตร.คลองขุนศรีฯ-ค.มหาสวัสดิ์,ต.ศาลาธรรมสพน์ อ.ทวีวัฒนา จ.กรุงเทพมหานคร ,06:00 ,3.5
สถานีบ้านโป่ง,ต.โป่ง อ.ด่านซ้าย จ.เลย ,06:00 ,3.5
สถานีบ้านฮูหยงบาโร๊ะ,ต.กายูบอเกาะ อ.รามัน จ.ยะลา ,05:00 ,3.5
สถานีส.รัชดา-วิภาวดี,ต.จตุจักร อ.จตุจักร จ.กรุงเทพมหานคร ,06:00 ,3.5
สถานีวัดพิเสกประดิษฐิ์,ต.ใหม่นาเพียง อ.แวงใหญ่ จ.ขอนแก่น ,06:00 ,3.4
สถานีฝายน้ำล้นคลองปะตง (ทน.),ต.ทรายขาว อ.สอยดาว จ.จันทบุรี ,06:00 ,3.4
สถานีเหนือฝายชุมพวง,ต.ชุมพวง อ.ชุมพวง จ.นครราชสีมา ,06:00 ,3.4
สถานีอุทยานแห่งชาติแม่เมย,ต.แม่สอง อ.ท่าสองยาง จ.ตาก ,06:00 ,3.4
สถานีรพสต.บ้านเขาปู่,ต.เขาปู่ อ.ศรีบรรพต จ.พัทลุง ,06:00 ,3.2
สถานีท้ายฝายหัวนา,ต.หนองแก้ว อ.กันทรารมย์ จ.ศรีสะเกษ ,06:00 ,3.2
สถานีบ้านคลองไทร,ต.หนองย่างเสือ อ.มวกเหล็ก จ.สระบุรี ,05:00 ,3
สถานีท้ายฝายชุมพวง,ต.ชุมพวง อ.ชุมพวง จ.นครราชสีมา ,06:00 ,3
สถานีคลองแม่รำพัน 1,ต.เมืองเก่า อ.เมืองสุโขทัย จ.สุโขทัย ,06:00 ,3
