บ้านหมอกจำแป๋,ต.หมอกจำแป่ อ.เมืองแม่ฮ่องสอน จ.แม่ฮ่องสอน,02:00 น.,2.5
บ้านกองลอย,ต.บ่อสลี อ.ฮอด จ.เชียงใหม่,05:00 น.,2.5
บ้านนาไคร้,ต.ยางเปียง อ.อมก๋อย จ.เชียงใหม่,05:00 น.,2.5
บ้านหนองบาง,ต.ลิ่นถิ่น อ.ทองผาภูมิ จ.กาญจนบุรี,05:00 น.,2.5
บ้านปางข้าวสาร,ต.แม่เล่ย์ อ.แม่วงก์ จ.นครสวรรค์,05:00 น.,2.5
บ้านริมอิง*,ต.เวียง อ.เทิง จ.เชียงราย,05:00 น.,2.5
บ้านปางสัก,ต.แม่เปิน อ.แม่เปิน จ.นครสวรรค์,05:00 น.,2.5
บ้านคลองไทร,ต.หนองย่างเสือ อ.มวกเหล็ก จ.สระบุรี,05:00 น.,2.5
บ้านเพชรนิยม,ต.สักงาม อ.คลองลาน จ.กำแพงเพชร,05:00 น.,2.5
บ้านศรีบุญเรือง,ต.แม่สุก อ.แจ้ห่ม จ.ลำปาง,05:00 น.,2.5
บ้านบางหยด,ต.อิปัน อ.พระแสง จ.สุราษฎร์ธานี,05:00 น.,2.5
บ้านแม่แขม,ต.บ่อเหล็กลอง อ.ลอง จ.แพร่,05:00 น.,2.5
น่าน,ต.ในเวียง อ.เมืองน่าน จ.น่าน,04:00 น.,2.5
บ้านศรีไกรลาศ,ต.นาบ่อคำ อ.เมืองกำแพงเพชร จ.กำแพงเพชร,05:00 น.,2.5
จุดวัด ค.บางเชือกหนัง-ถ.พุทธมณฑลสาย 1,ต.คลองขวาง อ.ภาษีเจริญ จ.กรุงเทพมหานคร,06:00 น.,2.5
บ้านบางเหลียว,ต.คีรีวง อ.ปลายพระยา จ.กระบี่,05:00 น.,2.5
บ้านบุญแจ่ม,ต.น้ำเลา อ.ร้องกวาง จ.แพร่,05:00 น.,2.5
บ้านไร่,ต.ห้วยเขย่ง อ.ทองผาภูมิ จ.กาญจนบุรี,05:00 น.,2.5
บ้านด่านห้วยใต้,ต.แม่พูล อ.ลับแล จ.อุตรดิตถ์,05:00 น.,2.5
บ้านพุน้อย,ต.ลาดหญ้า อ.เมืองกาญจนบุรี จ.กาญจนบุรี,05:00 น.,2.5
บ้านปางคอม,ต.บ่อเบี้ย อ.บ้านโคก จ.อุตรดิตถ์,05:00 น.,2.5
บ้านเขาน้อย,ต.ช่องสะเดา อ.เมืองกาญจนบุรี จ.กาญจนบุรี,05:00 น.,2.5
บ้านฝางแล้ง,ต.ขุนฝาง อ.เมืองอุตรดิตถ์ จ.อุตรดิตถ์,05:00 น.,2.5
บ้านนาวง,ต.บ้านนา อ.ศรีนครินทร์ จ.พัทลุง,05:00 น.,2.5
บ้านห้วยพลู,ต.ท้องฟ้า อ.บ้านตาก จ.ตาก,05:00 น.,2.5
บ้านกิ่วลม,ต.บ่อหลวง อ.ฮอด จ.เชียงใหม่,05:00 น.,2.5
บ้านห้วยน้ำใส,ต.บ้านบึง อ.บ้านคา จ.ราชบุรี,05:00 น.,2.5
บ้านเทพนิมิตร,ต.โป่งตาลอง อ.ปากช่อง จ.นครราชสีมา,05:00 น.,2.5
เขตทวีวัฒนา,ต.ทวีวัฒนา อ.ทวีวัฒนา จ.กรุงเทพมหานคร,06:00 น.,2.5
บ้านแม่ฮู้,ต.แม่สิน อ.ศรีสัชนาลัย จ.สุโขทัย,05:00 น.,2.5
บ้านดินดอน,ต.ท่าดี อ.ลานสกา จ.นครศรีธรรมราช,05:00 น.,2.5
บ้านปางปง-ปางทราย,ต.เวียงตาล อ.ห้างฉัตร จ.ลำปาง,05:00 น.,2.5
หน่วยพิทักษ์อุทยานฯ ที่ บล.๒ (น้ำตกฮาลาซะห์),ต.แม่หวาด อ.ธารโต จ.ยะลา,06:00 น.,2.4
อบต.สะแกกรัง,ต.สะแกกรัง อ.เมืองอุทัยธานี จ.อุทัยธานี,06:00 น.,2.4
เหนือปตร.บรมธาตุ,ต.ชัยนาท อ.เมืองชัยนาท จ.ชัยนาท,06:00 น.,2.4
หนองไผ่,ต.นาเฉลียง อ.หนองไผ่ จ.เพชรบูรณ์,06:00 น.,2.4
อบต.จุมพล,ต.จุมพล อ.โพนพิสัย จ.หนองคาย,06:00 น.,2.4
เหนือปตร.ช่องแค,ต.พรหมนิมิต อ.ตาคลี จ.นครสวรรค์,06:00 น.,2.4
อู่ทอง สกษ.,ต.จรเข้สามพัน อ.อู่ทอง จ.สุพรรณบุรี,04:00 น.,2.4
อบต.ทุ่งคาวัด,ต.ทุ่งคาวัด อ.ละแม จ.ชุมพร,06:00 น.,2.4
เมืองอ่างทอง,ต.บางแก้ว อ.เมืองอ่างทอง จ.อ่างทอง,06:00 น.,2.4
เครือข่ายลุ่มน้ำลาว,ต.แม่เจดีย์ใหม่ อ.เวียงป่าเป้า จ.เชียงราย,06:00 น.,2.4
อบต.หินดาด,ต.หินดาด อ.ทองผาภูมิ จ.กาญจนบุรี,06:00 น.,2.4
เมืองอุบลราชธานี,ต.หัวดอน อ.เขื่องใน จ.อุบลราชธานี,06:00 น.,2.4
อบต.คลองขลุง,ต.คลองขลุง อ.คลองขลุง จ.กำแพงเพชร,06:00 น.,2.4
อบต.คลองพา,ต.คลองพา อ.ท่าชนะ จ.สุราษฎร์ธานี,06:00 น.,2.4
ฮอด,ต.หางดง อ.ฮอด จ.เชียงใหม่,06:00 น.,2.4
สะพานลำน้ำเลย,ต.เชียงคาน อ.เชียงคาน จ.เลย,06:00 น.,2.4
ทม.ท่าข้าม,ต.ท่าข้าม อ.พุนพิน จ.สุราษฎร์ธานี,06:00 น.,2.4
คลองลาดพร้าว วัดบางบัว,ต.อนุสาวรีย์ อ.บางเขน จ.กรุงเทพมหานคร,23:00 น.,2.2
เมืองชุมพร,ต.หาดพันไกร อ.เมืองชุมพร จ.ชุมพร,06:00 น.,2.2
สะพานน้ำว้า บ้านน้ำว้า,ต.น้ำพาง อ.แม่จริม จ.น่าน,06:00 น.,2.2
ควนกาหลง,ต.อุใดเจริญ อ.ควนกาหลง จ.สตูล,06:00 น.,2.2
อบต.ทับใต้,ต.ทับใต้ อ.หัวหิน จ.ประจวบคีรีขันธ์,06:00 น.,2.2
วังทอง,ต.วังทอง อ.วังทอง จ.พิษณุโลก,06:00 น.,2.2
ลำน้ำอูน,ต.สว่าง อ.พรรณานิคม จ.สกลนคร,06:00 น.,2.2
หน่วยพิทักษ์อุทยานแห่งชาติที่ ขป.๙  (น้ำตกเขาคราม),ต.ลำสินธุ์ อ.ศรีนครินทร์ จ.พัทลุง,06:00 น.,2.2
นครพนม,ต.ในเมือง อ.เมืองนครพนม จ.นครพนม,04:00 น.,2.2
อบต.สองพี่น้อง,ต.สองพี่น้อง อ.แก่งกระจาน จ.เพชรบุรี,06:00 น.,2.2
ศูนย์สาธิตพัฒนาฯ การใช้หญ้าแฝกด้านป่าไม้ที่ ๒,ต.แม่สิน อ.ศรีสัชนาลัย จ.สุโขทัย,06:00 น.,2.2
ท้ายปตร.ช่องแค,ต.พรหมนิมิต อ.ตาคลี จ.นครสวรรค์,06:00 น.,2.2
อบต.ปางกู่,ต.ปางกู่ อ.โนนสัง จ.หนองบัวลำภู,06:00 น.,2.2
งาว,ต.หลวงใต้ อ.งาว จ.ลำปาง,06:00 น.,2.2
หน่วยจัดการต้นน้ำแม่นาไทร,ต.บ้านปง อ.หางดง จ.เชียงใหม่,06:00 น.,2
บ้านพรุเตย,ต.เพหลา อ.คลองท่อม จ.กระบี่,05:00 น.,2
บ้านโป่งไฮ,ต.แม่สาว อ.แม่อาย จ.เชียงใหม่,05:00 น.,2
บ้านหลุกใต้,ต.นาครัว อ.แม่ทะ จ.ลำปาง,05:00 น.,2
บ้านวังประจัน,ต.วังประจัน อ.ควนโดน จ.สตูล,05:00 น.,2
บ้านห้วยใหญ่,ต.ช่องไม้แก้ว อ.ทุ่งตะโก จ.ชุมพร,05:00 น.,2
บ้านต้นงิ้วเหนือ,ต.ป่าโปง อ.สบเมย จ.แม่ฮ่องสอน,23:00 น.,2
สะพานวัดมงคลร่วมใจ (บ้านวังสาร),ต.ท่าตาล อ.บางกระทุ่ม จ.พิษณุโลก,06:00 น.,2
บ้านนาน้อย,ต.ท่าศาลา อ.ภูเรือ จ.เลย,05:00 น.,2
บ้านจำปาทอง,ต.บ้านทำเนียบ อ.คีรีรัฐนิคม จ.สุราษฎร์ธานี,05:00 น.,2
บ้านแม่เทินเหนือ,ต.แม่สิน อ.ศรีสัชนาลัย จ.สุโขทัย,05:00 น.,2
บ้านเมืองน้อย,ต.เวียงเหนือ อ.ปาย จ.แม่ฮ่องสอน,05:00 น.,2
บ้านปากคะยาง,ต.บ้านแก่ง อ.ศรีสัชนาลัย จ.สุโขทัย,05:00 น.,2
ท่อทองแดง1,ต.หนองปลิง อ.เมืองกำแพงเพชร จ.กำแพงเพชร,06:00 น.,2
บ้านหลวง,ต.เมืองปาน อ.เมืองปาน จ.ลำปาง,05:00 น.,2
บ้านช่องช้าง,ต.พรุพี อ.บ้านนาสาร จ.สุราษฎร์ธานี,05:00 น.,2
บ้านประดู่งาม,ต.บ้านใหม่สามัคคี อ.ชัยบาดาล จ.ลพบุรี,05:00 น.,2
บ้านศรีดอนไชย*,ต.ทุ่งแล้ง อ.ลอง จ.แพร่,05:00 น.,2
ส.คลองบางจาก,ต.บางแคเหนือ อ.บางแค จ.กรุงเทพมหานคร,06:00 น.,2
จุดวัด ค.ทวีฯ-ค.บางเชือกหนัง,ต.บางไผ่ อ.บางแค จ.กรุงเทพมหานคร,06:00 น.,2
บ้านไสใหญ่เหนือ,ต.ถ้ำใหญ่ อ.ทุ่งสง จ.นครศรีธรรมราช,05:00 น.,2
บ้านทุ่งตอน,ต.วังเงิน อ.แม่ทะ จ.ลำปาง,05:00 น.,2
บ้านนาซ่าว,ต.นาซ่าว อ.เชียงคาน จ.เลย,05:00 น.,2
บ้านแม่แอบ,ต.บ้านทับ อ.แม่แจ่ม จ.เชียงใหม่,05:00 น.,2
บ้านหัวตาลแถว,ต.สามร้อยยอด อ.สามร้อยยอด จ.ประจวบคีรีขันธ์,05:00 น.,2
อบต.นาซ่าว,ต.นาซ่าว อ.เชียงคาน จ.เลย,06:00 น.,2
เขตหนองแขม,ต.หนองค้างพลู อ.หนองแขม จ.กรุงเทพมหานคร,06:00 น.,2
ทต.หันคา,ต.หันคา อ.หันคา จ.ชัยนาท,06:00 น.,2
บ้านวังดิน,ต.ลี้ อ.ลี้ จ.ลำพูน,05:00 น.,2
บ้านทุ่งยูง,ต.เขาปู่ อ.ศรีบรรพต จ.พัทลุง,05:00 น.,2
บ้านห้วยอ้อย,ต.ด่านซ้าย อ.ด่านซ้าย จ.เลย,05:00 น.,2
บ้านแม่แจ๋ม,ต.แจ้ซ้อน อ.เมืองปาน จ.ลำปาง,04:00 น.,2
บ้านสันต้นเปา,ต.แม่เงิน อ.เชียงแสน จ.เชียงราย,05:00 น.,2
บ้านถ้ำหิน,ต.สวนผึ้ง อ.สวนผึ้ง จ.ราชบุรี,05:00 น.,2
บ้านห้วยกุ่ม,ต.ทรงธรรม อ.เมืองกำแพงเพชร จ.กำแพงเพชร,05:00 น.,2
ทต.ท่ายาง,ต.ท่ายาง อ.ท่ายาง จ.เพชรบุรี,06:00 น.,2
บ้านท่าเรือ*,ต.บาตง อ.รือเสาะ จ.นราธิวาส,05:00 น.,2
บ้านห้วยชมภู (บ้านป่าคาหลวง),ต.ท่าก๊อ อ.แม่สรวย จ.เชียงราย,05:00 น.,2
บ้านแม่สิน,ต.นาพูน อ.วังชิ้น จ.แพร่,05:00 น.,2
พุนพิน 1,ต.ท่าข้าม อ.พุนพิน จ.สุราษฎร์ธานี,06:00 น.,2
บ้านต้นมะพร้าว,ต.ถ้ำสิงขร อ.คีรีรัฐนิคม จ.สุราษฎร์ธานี,05:00 น.,2
บ้านสันวิไล,ต.แม่ตืน อ.ลี้ จ.ลำพูน,05:00 น.,2
อบต.สะตอน,ต.สะตอน อ.สอยดาว จ.จันทบุรี,06:00 น.,2
บ้านหนองผักบุ้ง,ต.นายม อ.เมืองเพชรบูรณ์ จ.เพชรบูรณ์,05:00 น.,2
หน่วยจัดการต้นน้ำแม่ถา,ต.ยาบหัวนา อ.เวียงสา จ.น่าน,06:00 น.,2
บ้านอังคาย,ต.ยั้งเมิน อ.สะเมิง จ.เชียงใหม่,05:00 น.,2
บ้านห้วยสะแตง,ต.และ อ.ทุ่งช้าง จ.น่าน,05:00 น.,2
เถิน,ต.แม่ปะ อ.เถิน จ.ลำปาง,04:00 น.,1.9
บางกระทุ่ม,ต.โคกสลุด อ.บางกระทุ่ม จ.พิษณุโลก,06:00 น.,1.8
อบต.บ้านแลง,ต.บ้านแลง อ.เมืองระยอง จ.ระยอง,06:00 น.,1.8
สถานีวิจัยต้นน้ำตาปี,ต.กะทูน อ.พิปูน จ.นครศรีธรรมราช,06:00 น.,1.8
คลองผันน้ำยม-น่าน3,ต.คอรุม อ.พิชัย จ.อุตรดิตถ์,06:00 น.,1.8
คลองกาแลกูโบ หมู่ที่ 1,ต.คลองใหม่ อ.ยะรัง จ.ปัตตานี,06:00 น.,1.8
อบต.บ้านเจียง,ต.บ้านเจียง อ.ภักดีชุมพล จ.ชัยภูมิ,06:00 น.,1.8
เวียงสระ,ต.ทุ่งหลวง อ.เวียงสระ จ.สุราษฎร์ธานี,06:00 น.,1.8
ทต.กุยบุรี,ต.กุยบุรี อ.กุยบุรี จ.ประจวบคีรีขันธ์,06:00 น.,1.8
พระรามสอง,ต.แม่กลอง อ.เมืองสมุทรสงคราม จ.สมุทรสงคราม,06:00 น.,1.8
คลองนราภิรมย์ (บางเลน),ต.นราภิรมย์ อ.บางเลน จ.นครปฐม,06:00 น.,1.8
เชียงดาว,ต.เชียงดาว อ.เชียงดาว จ.เชียงใหม่,06:00 น.,1.8
อบต.เกาะสำโรง,ต.เกาะสำโรง อ.เมืองกาญจนบุรี จ.กาญจนบุรี,06:00 น.,1.8
ทต.สวนผึ้ง,ต.สวนผึ้ง อ.สวนผึ้ง จ.ราชบุรี,06:00 น.,1.8
อบต.วัดโบสถ์,ต.วัดโบสถ์ อ.วัดโบสถ์ จ.พิษณุโลก,06:00 น.,1.8
อบต.ตากฟ้า,ต.ตากฟ้า อ.ตากฟ้า จ.นครสวรรค์,06:00 น.,1.8
ท้ายปตร.บรมธาตุ,ต.ชัยนาท อ.เมืองชัยนาท จ.ชัยนาท,06:00 น.,1.8
อบต.แจ้ซ้อน,ต.แจ้ซ้อน อ.เมืองปาน จ.ลำปาง,06:00 น.,1.8
อบต.โคกชำแระ,ต.โคกชำแระ อ.ทุ่งศรีอุดม จ.อุบลราชธานี,02:00 น.,1.6
ทต.หนองเลิง,ต.หนองเลิง อ.บึงกาฬ จ.บึงกาฬ,06:00 น.,1.6
ศูนย์อปพร. ทต.บ้านธิ,ต.บ้านธิ อ.บ้านธิ จ.ลำพูน,06:00 น.,1.6
เหนือปตร.มหาราช,ต.บ้านกล้วย อ.เมืองชัยนาท จ.ชัยนาท,06:00 น.,1.6
อบต.พุ่มแก,ต.พุ่มแก อ.นาแก จ.นครพนม,06:00 น.,1.6
ที่ว่าการอำเภอสุคีริน,ต.สุคิริน อ.สุคิริน จ.นราธิวาส,06:00 น.,1.6
รร.บ้านดงไม้งาม,ต.ชัยเกษม อ.บางสะพาน จ.ประจวบคีรีขันธ์,06:00 น.,1.6
อบต.โนนกอก,ต.โนนกอก อ.เกษตรสมบูรณ์ จ.ชัยภูมิ,06:00 น.,1.6
ศูนย์ดูแลผู้สูงอายุ ทต.สามเงา,ต.สามเงา อ.สามเงา จ.ตาก,06:00 น.,1.6
ท้ายปตร.มหาราช,ต.บ้านกล้วย อ.เมืองชัยนาท จ.ชัยนาท,06:00 น.,1.6
โครงการชลประทานพิษณุโลก,ต.ในเมือง อ.เมืองพิษณุโลก จ.พิษณุโลก,06:00 น.,1.6
อบต.ชัยบุรี,ต.ชัยบุรี อ.ชัยบุรี จ.สุราษฎร์ธานี,06:00 น.,1.6
เมืองพิษณุโลก,ต.ปากโทก อ.เมืองพิษณุโลก จ.พิษณุโลก,06:00 น.,1.6
ลิ่นถิ่น,ต.ไทรโยค อ.ไทรโยค จ.กาญจนบุรี,06:00 น.,1.6
คลองผันน้ำยม-น่าน4,ต.งิ้วงาม อ.เมืองพิษณุโลก จ.พิษณุโลก,06:00 น.,1.6
หน่วยจัดการต้นน้ำขุนแม่แจ่ม,ต.แม่แดด อ.กัลยาณิวัฒนา จ.เชียงใหม่,06:00 น.,1.6
อบต.บ้านไร่,ต.บ้านไร่ อ.บางกระทุ่ม จ.พิษณุโลก,06:00 น.,1.6
บ้านกอก,ต.อวน อ.ปัว จ.น่าน,05:00 น.,1.5
บ้านเขาจอมแห,ต.มะขามคู่ อ.นิคมพัฒนา จ.ระยอง,05:00 น.,1.5
บ้านห้วยผาก,ต.สวนผึ้ง อ.สวนผึ้ง จ.ราชบุรี,05:00 น.,1.5
บ้านระเริง,ต.ระเริง อ.วังน้ำเขียว จ.นครราชสีมา,05:00 น.,1.5
บ้านป่าเวียง,ต.ทุ่งกว๋าว อ.เมืองปาน จ.ลำปาง,05:00 น.,1.5
บ้านหนองไม้แก่น,ต.เกาะหลัก อ.เมืองประจวบคีรีขันธ์ จ.ประจวบคีรีขันธ์,05:00 น.,1.5
บ้านพญาไพรเล่ามา,ต.เทอดไทย อ.แม่ฟ้าหลวง จ.เชียงราย,05:00 น.,1.5
บ้านปลาบ่า,ต.ปลาบ่า อ.ภูเรือ จ.เลย,05:00 น.,1.5
บ้านนาบ่อ,ต.บ่อน้ำร้อน อ.กันตัง จ.ตรัง,05:00 น.,1.5
บ้านนาเวียง,ต.วังชิ้น อ.วังชิ้น จ.แพร่,05:00 น.,1.5
บ้านบ่อหลวง,ต.บ่อเกลือใต้ อ.บ่อเกลือ จ.น่าน,05:00 น.,1.5
บ้านหนองแวง,ต.ไทรเดี่ยว อ.คลองหาด จ.สระแก้ว,05:00 น.,1.5
สนามบินดอนเมือง,ต.สีกัน อ.ดอนเมือง จ.กรุงเทพมหานคร,04:00 น.,1.5
บ้านมะนังบังแยง,ต.จะแนะ อ.จะแนะ จ.นราธิวาส,05:00 น.,1.5
บ้านห้วยไผ่,ต.บ่อเบี้ย อ.บ้านโคก จ.อุตรดิตถ์,05:00 น.,1.5
บ้านหนองจรเข้,ต.นาชะอัง อ.เมืองชุมพร จ.ชุมพร,05:00 น.,1.5
บ้านคลองตูกเหนือ,ต.กะปาง อ.ทุ่งสง จ.นครศรีธรรมราช,05:00 น.,1.5
บ้านแม่แก่ง,ต.แม่ถอด อ.เถิน จ.ลำปาง,05:00 น.,1.5
บ้านแก่งลาด,ต.ห้วยเฮี้ย อ.นครไทย จ.พิษณุโลก,18:00 น.,1.5
บ้านช่องลม,ต.ช้างแรก อ.บางสะพานน้อย จ.ประจวบคีรีขันธ์,05:00 น.,1.5
บ้านห้วยตาสิงห์,ต.บ้านควน อ.หลังสวน จ.ชุมพร,05:00 น.,1.5
บ้านหนองพรมหน่อ,ต.ห้วยคต อ.ห้วยคต จ.อุทัยธานี,05:00 น.,1.5
บ้านโป่งน้ำร้อน,ต.โป่งน้ำร้อน อ.คลองลาน จ.กำแพงเพชร,05:00 น.,1.5
บ้านดอยมด,ต.แม่เจดีย์ใหม่ อ.เวียงป่าเป้า จ.เชียงราย,05:00 น.,1.5
บ้านไอร์กลูแป,ต.โคกสะตอ อ.รือเสาะ จ.นราธิวาส,05:00 น.,1.5
บ้านห้วยป่าซาง,ต.กื้ดช้าง อ.แม่แตง จ.เชียงใหม่,05:00 น.,1.5
บ้านน้ำกิใต้,ต.ผาทอง อ.ท่าวังผา จ.น่าน,05:00 น.,1.5
บ้านแม่แสม,ต.ตะเคียนปม อ.ทุ่งหัวช้าง จ.ลำพูน,05:00 น.,1.5
บ้านหัวดง,ต.หงาว อ.เทิง จ.เชียงราย,05:00 น.,1.5
บ้านเกี๋ยงห้วยน่าน,ต.แม่ลอย อ.เทิง จ.เชียงราย,05:00 น.,1.5
บ้านไอร์เจี๊ยะ,ต.ซากอ อ.ศรีสาคร จ.นราธิวาส,05:00 น.,1.5
บ้านกองขากหลวง,ต.สะเมิงใต้ อ.สะเมิง จ.เชียงใหม่,05:00 น.,1.5
บ้านสามพัน*,ต.ไทรขึง อ.พระแสง จ.สุราษฎร์ธานี,05:00 น.,1.5
บ้านหล่ายทุ่ง,ต.วอแก้ว อ.ห้างฉัตร จ.ลำปาง,05:00 น.,1.5
บ้านผาปูนดง,ต.อมก๋อย อ.อมก๋อย จ.เชียงใหม่,05:00 น.,1.5
บ้านนาฟ่อน,ต.บ่อหลวง อ.ฮอด จ.เชียงใหม่,05:00 น.,1.5
บ้านผาลาด,ต.แม่ทะ อ.แม่ทะ จ.ลำปาง,05:00 น.,1.5
บ้านไสท้อน,ต.ช่อง อ.นาโยง จ.ตรัง,05:00 น.,1.5
บ้านคลองดินดำ,ต.หมูสี อ.ปากช่อง จ.นครราชสีมา,05:00 น.,1.5
บ้านกกงิ้ว,ต.สุขฤทัย อ.ห้วยคต จ.อุทัยธานี,05:00 น.,1.5
หนองบัวลำภู,ต.ลำภู อ.เมืองหนองบัวลำภู จ.หนองบัวลำภู,04:00 น.,1.5
บ้านไพรงาม,ต.บ้านกลาง อ.วังทอง จ.พิษณุโลก,05:00 น.,1.5
บ้านแม่ลอบ,ต.ป่าพลู อ.บ้านโฮ่ง จ.ลำพูน,05:00 น.,1.5
ฉะเชิงเทรา,ต.แปลงยาว อ.สนามชัยเขต จ.ฉะเชิงเทรา,04:00 น.,1.5
