ทต.บูเก๊ะตา,ต.โละจูด อ.แว้ง จ.นราธิวาส,12:00 น.,1.4,5.848726030708529,101.88031375408173
อบต.ตากฟ้า,ต.ตากฟ้า อ.ตากฟ้า จ.นครสวรรค์,12:00 น.,1.4,15.296459094195308,100.50284385681152
สะพานข้ามคลองหวาด,ต.คลองสระ อ.กาญจนดิษฐ์ จ.สุราษฎร์ธานี,12:00 น.,1.4,8.935932666086208,99.60874021053314
รร.บ้านหนองคล้า,ต.เขาวิเศษ อ.วังวิเศษ จ.ตรัง,12:00 น.,1.4,7.618532602250628,99.44906294345856
ดอยมูเซอร์ สกษ.,ต.แม่ท้อ อ.เมืองตาก จ.ตาก,10:00 น.,1.4,16.75000107985822,98.93333315849304
หน่วยพิทักษ์อุทยานแห่งชาติที่ นค.๑ (บ้านคลองยน),ต.สำนักแต้ว อ.สะเดา จ.สงขลา,12:00 น.,1.4,6.533922268207,100.53862452507019
สุคิริน,ต.สุคิริน อ.สุคิริน จ.นราธิวาส,12:00 น.,1.4,5.93930562749457,101.77468299865723
ชุมชนบ้านทับคริสต์,ต.คลองชะอุ่น อ.พนม จ.สุราษฎร์ธานี,12:00 น.,1.2,8.750261536090335,98.80191564559937
สะพานน้ำยาว บ้านสองแคว,ต.นาไร่หลวง อ.สองแคว จ.น่าน,12:00 น.,1.2,19.35672062775631,100.70646643638611
หน่วยพิทักษ์อุทยานแห่งชาติที่ ขป.๙  (น้ำตกเขาคราม),ต.ลำสินธุ์ อ.ศรีนครินทร์ จ.พัทลุง,12:00 น.,1.2,7.515879740688691,99.87862944602966
อบต.เทอดไทย,ต.เทอดไทย อ.แม่ฟ้าหลวง จ.เชียงราย,12:00 น.,1.2,20.243434996535814,99.66370940208435
อบต.บ้านกลาง,ต.บ้านกลาง อ.สอง จ.แพร่,12:00 น.,1.2,18.48202574792197,100.17752945423126
ภูเก็ต,ต.ตลาดใหญ่ อ.เมืองภูเก็ต จ.ภูเก็ต,10:00 น.,1.2,7.883335308018686,98.39999735355377
เทศบาลตำบลหอไกร,ต.หอไกร อ.บางมูลนาก จ.พิจิตร,12:00 น.,1.2,16.050149118617867,100.37378668785095
อบต.ทุ่งแล้ง,ต.ทุ่งแล้ง อ.ลอง จ.แพร่,12:00 น.,1.2,17.970415856705433,99.74664866924286
บ้านทับขอน,ต.ปากทรง อ.พะโต๊ะ จ.ชุมพร,11:00 น.,1,9.77497085698064,98.69300186634064
บ้านย่านอุดม,ต.ทุ่งไทรทอง อ.ลำทับ จ.กระบี่,11:00 น.,1,8.010334899212314,99.32934522628784
สถานีพัฒนาที่ดินยะลา,ต.ธารโต อ.ธารโต จ.ยะลา,12:00 น.,1,6.170363658162598,101.18082582950592
ตลาดเก่าตะกั่วป่า,ต.โคกเคียน อ.ตะกั่วป่า จ.พังงา,12:00 น.,1,8.829422267219035,98.36930751800537
จุดวัด ค.ประเวศฯ-เขตลาดกระบัง,ต.ลาดกระบัง อ.ลาดกระบัง จ.กรุงเทพมหานคร,12:00 น.,1,13.723981096707517,100.78406810760498
บ้านวังพา,ต.ทุ่งตำเสา อ.หาดใหญ่ จ.สงขลา,11:00 น.,1,6.898463038722121,100.26199758052826
อบต.วังหมี,ต.วังหมี อ.วังน้ำเขียว จ.นครราชสีมา,12:00 น.,1,14.415660227092047,101.68402433395386
กรุงเทพฯ บางนา สกษ.,ต.บางนา อ.บางนา จ.กรุงเทพมหานคร,10:00 น.,1,13.66638957850642,100.60610890388489
บ้านควน,ต.พะโต๊ะ อ.พะโต๊ะ จ.ชุมพร,11:00 น.,1,9.78706623642024,98.78801107406616
บ้านจอมกิตติ,ต.เวียง อ.เชียงแสน จ.เชียงราย,11:00 น.,1,20.283583583231827,100.07600247859955
แม่น้ำปิงที่ อ.ฮอด จ.เชียงใหม่,ต.หางดง อ.ฮอด จ.เชียงใหม่,10:00 น.,1,18.178901666776802,98.62909018993378
บ้านห้วยหลวง,ต.บ้านกาศ อ.แม่สะเรียง จ.แม่ฮ่องสอน,11:00 น.,1,18.22875519913082,97.92200088500977
บ้านแม่เหาะ,ต.แม่เหาะ อ.แม่สะเรียง จ.แม่ฮ่องสอน,11:00 น.,1,18.156276110806676,98.07299852371216
บ้านบางทอง,ต.บางทอง อ.ท้ายเหมือง จ.พังงา,11:00 น.,1,8.385255881970396,98.36069226264954
อบต.กะลาเส,ต.กะลาเส อ.สิเกา จ.ตรัง,12:00 น.,1,7.703953331556081,99.31808531284332
เชียงดาว,ต.เชียงดาว อ.เชียงดาว จ.เชียงใหม่,12:00 น.,1,19.367267796102457,98.96888315677643
บ้านธาราวงศ์อารีย์,ต.เพิ่มพูนทรัพย์ อ.บ้านนาสาร จ.สุราษฎร์ธานี,11:00 น.,1,8.771431742136516,99.43300187587738
ที่ทำการอุทยานฯเขาใหญ่,ต.นาหินลาด อ.ปากพลี จ.นครนายก,11:00 น.,1,14.294077977505841,101.37099981307983
บ้านต้นปริง,ต.คลองหรัง อ.นาหม่อม จ.สงขลา,11:00 น.,1,6.902963134856189,100.5739974975586
บ้านหนองหอย,ต.แม่แรม อ.แม่ริม จ.เชียงใหม่,11:00 น.,1,18.93018299350249,98.82400095462799
บ้านแม่ต๊อบเหนือ,ต.บ้านกาศ อ.แม่สะเรียง จ.แม่ฮ่องสอน,11:00 น.,1,18.268931348131296,97.89300084114075
บ้านห้วยกุ้ง,ต.ป่าโปง อ.สบเมย จ.แม่ฮ่องสอน,11:00 น.,1,18.14966475578415,98.12899768352509
บ้านไทยสามัคคี,ต.แม่กาษา อ.แม่สอด จ.ตาก,11:00 น.,1,16.791070603086514,98.59600245952606
บ้านขุนแม่ลาน้อย,ต.ขุนแม่ลาน้อย อ.แม่ลาน้อย จ.แม่ฮ่องสอน,11:00 น.,1,18.622216842036092,98.1119978427887
บ้านม้งเก้าหลัง,ต.เทอดไทย อ.แม่ฟ้าหลวง จ.เชียงราย,11:00 น.,1,20.344088755427816,99.52099978923798
วัดปากเตลิด,ต.ต้นยวน อ.พนม จ.สุราษฎร์ธานี,11:00 น.,1,8.844720196715253,98.83999228477478
บ้านทับคริสต์,ต.คลองชะอุ่น อ.พนม จ.สุราษฎร์ธานี,12:00 น.,1,8.725807999214425,98.8210129737854
บ้านป่าแขม,ต.บ้านหลวง อ.จอมทอง จ.เชียงใหม่,11:00 น.,1,18.50996532761861,98.58599781990051
ศูนย์อปพร.อบต.ลาดยาว,ต.ลาดยาว อ.ลาดยาว จ.นครสวรรค์,12:00 น.,1,15.762859369383925,99.74133253097534
บ้านบางหวาน,ต.กมลา อ.กะทู้ จ.ภูเก็ต,11:00 น.,1,7.942292146367634,98.29099774360657
บ้านห้วยหินฝน,ต.แม่ปะ อ.แม่สอด จ.ตาก,11:00 น.,1,16.762067071387065,98.64500105381012
พัทลุง สกษ.,ต.ลำปำ อ.เมืองพัทลุง จ.พัทลุง,10:00 น.,1,7.5833321893483925,100.16666650772095
บ้านแม่มิงค์,ต.ช่างเคิ่ง อ.แม่แจ่ม จ.เชียงใหม่,11:00 น.,1,18.55672288289006,98.40100049972534
บ้านแม่จอ,ต.แม่โถ อ.แม่ลาน้อย จ.แม่ฮ่องสอน,11:00 น.,1,18.6458283479258,98.03899884223938
บ้านมอล่อง,ต.แม่สลองใน อ.แม่ฟ้าหลวง จ.เชียงราย,11:00 น.,1,20.21090290555916,99.63900089263916
ทต.สรรพยา,ต.สรรพยา อ.สรรพยา จ.ชัยนาท,12:00 น.,1,15.132196457409316,100.25128483772278
สะพานแม่เล่ย์,ต.แม่เล่ย์ อ.แม่วงก์ จ.นครสวรรค์,12:00 น.,1,15.841719527027593,99.41807270050049
บ้านเขาจันทร์,ต.หนองธง อ.ป่าบอน จ.พัทลุง,11:00 น.,1,7.2016990354292885,100.09199917316437
บ้านห้วยเลา,ต.เชียงของ อ.นาน้อย จ.น่าน,11:00 น.,1,18.337228803158002,100.95700085163116
บ้านทุ่งยูง,ต.เขาปู่ อ.ศรีบรรพต จ.พัทลุง,11:00 น.,1,7.757109973464506,99.80699837207794
บ้านจำปาทอง,ต.บ้านทำเนียบ อ.คีรีรัฐนิคม จ.สุราษฎร์ธานี,11:00 น.,1,8.860430922812256,98.90576004981995
บ้านเขาไว้ข้าว,ต.ดินแดง อ.ลำทับ จ.กระบี่,11:00 น.,1,8.011052028529933,99.39000070095062
บ้านช่องไม้ดำ,ต.คลองหิน อ.อ่าวลึก จ.กระบี่,11:00 น.,1,8.306130027517616,98.88599753379822
บ้านต้นหาร,ต.หน้าเขา อ.เขาพนม จ.กระบี่,11:00 น.,1,8.309861637175134,98.96900117397308
บ้านท่าคลอง,ต.เทศบาลเมืองกระบี่ อ.เมืองกระบี่ จ.กระบี่,11:00 น.,1,8.11049767570278,98.90815258026123
บ้านเขาหลัก,ต.ปากแจ่ม อ.ห้วยยอด จ.ตรัง,11:00 น.,1,7.724499167281783,99.7299975156784
บ้านสะพานไทร,ต.บางดี อ.ห้วยยอด จ.ตรัง,11:00 น.,1,7.863844120546546,99.46399748325348
บ้านชานเมือง,ต.ปางหมู อ.เมืองแม่ฮ่องสอน จ.แม่ฮ่องสอน,11:00 น.,1,19.31277350248381,97.98500061035156
เมืองศรีสะเกษ,ต.เมืองเหนือ อ.เมืองศรีสะเกษ จ.ศรีสะเกษ,12:00 น.,1,15.118126243102001,104.31859731674194
บ้านห้วยตง,ต.กรุงชิง อ.นบพิตำ จ.นครศรีธรรมราช,11:00 น.,1,8.91898508526589,99.61198568344116
บ้านเหนือฟ้า,ต.พิปูน อ.พิปูน จ.นครศรีธรรมราช,11:00 น.,1,8.530292162267342,99.63799774646759
บ้านด่าน,ต.ปากแจ่ม อ.ห้วยยอด จ.ตรัง,11:00 น.,1,7.685097065610725,99.76223230361938
บ้านกิ่วจันทร์,ต.ขุนน่าน อ.เฉลิมพระเกียรติ จ.น่าน,11:00 น.,1,19.541202375050094,101.1430013179779
บ้านห้วยต่อ,ต.ไม้ฝาด อ.สิเกา จ.ตรัง,11:00 น.,1,7.5424173978897855,99.39799904823303
ป่าพะยอม,ต.เกาะเต่า อ.ป่าพะยอม จ.พัทลุง,12:00 น.,1,7.807017945674877,99.84858334064484
บ้านประดู่งาม,ต.บ้านใหม่สามัคคี อ.ชัยบาดาล จ.ลพบุรี,11:00 น.,1,15.239755785297989,101.00000202655792
บ้านขุนห้วยแม่สอด,ต.พระธาตุผาแดง อ.แม่สอด จ.ตาก,11:00 น.,1,16.716891442868988,98.66299867630005
บ้านห้วยไทร,ต.ชุมพล อ.ศรีนครินทร์ จ.พัทลุง,11:00 น.,1,7.629687658497234,99.92134094238281
บ้านแม่โถหลวง,ต.บ่อสลี อ.ฮอด จ.เชียงใหม่,11:00 น.,1,18.239867488653356,98.19399833679199
บ้านคลองใหญ่,ต.จันทเขลม อ.เขาคิชฌกูฏ จ.จันทบุรี,11:00 น.,1,12.972159724378912,102.05771505832672
บ้านร่มโพธิ์เงิน,ต.ปอ อ.เวียงแก่น จ.เชียงราย,11:00 น.,1,19.872663063374226,100.48899829387665
สะพานท้ายเขื่อนบางลาง อ.บันนังสตา จ.ยะลา,ต.บาเจาะ อ.บันนังสตา จ.ยะลา,10:00 น.,1,6.160475552846657,101.27610325813293
บ้านนางหล่อ,ต.เกาะเต่า อ.ป่าพะยอม จ.พัทลุง,11:00 น.,1,7.799306250466719,99.83051061630249
อบต.พระรักษ์,ต.พระรักษ์ อ.พะโต๊ะ จ.ชุมพร,12:00 น.,1,9.896232414854458,98.88710796833038
หน่วยจัดการต้นน้ำแม่ถา,ต.ยาบหัวนา อ.เวียงสา จ.น่าน,12:00 น.,1,18.516405232570804,100.40299594402313
แม่ฮ่องสอน,ต.จองคำ อ.เมืองแม่ฮ่องสอน จ.แม่ฮ่องสอน,10:00 น.,0.9,19.298972415593354,97.97577917575836
หน่วยจัดการต้นน้ำสวนป่าสิริกิติ์,ต.กองแขก อ.แม่แจ่ม จ.เชียงใหม่,12:00 น.,0.8,18.364209308182986,98.46655368804932
น้ำตกปลิว,ต.ถ้ำใหญ่ อ.ทุ่งสง จ.นครศรีธรรมราช,12:00 น.,0.8,8.16269376180684,99.75913166999817
ทต.เวียงพางคำ,ต.เวียงพางคำ อ.แม่สาย จ.เชียงราย,12:00 น.,0.8,20.40354959463141,99.88572657108307
ชุมชนบ้านแม่ละอุป,ต.แม่แดด อ.แม่แจ่ม จ.เชียงใหม่,12:00 น.,0.8,19.00122302817533,98.27116012573242
น้ำตกแม่พูล,ต.แม่พูล อ.ลับแล จ.อุตรดิตถ์,12:00 น.,0.8,17.729102451489894,99.97808039188385
อบต.คลองขนาน,ต.คลองขนาน อ.เหนือคลอง จ.กระบี่,12:00 น.,0.8,8.005304330681563,99.01387989521027
อบต.นาไร่หลวง,ต.นาไร่หลวง อ.สองแคว จ.น่าน,12:00 น.,0.8,19.3670552403937,100.70083916187286
สะพานน้ำว้า บ้านน้ำว้า,ต.น้ำพาง อ.แม่จริม จ.น่าน,12:00 น.,0.8,18.64321573996247,101.010822057724
ชุมชนบ้านโคกพะยอม,ต.ละงู อ.ละงู จ.สตูล,12:00 น.,0.8,6.818721728450893,99.8093318939209
ทต.ศรีสำโรง,ต.สามเรือน อ.ศรีสำโรง จ.สุโขทัย,12:00 น.,0.8,17.168274769760092,99.87264811992645
อบต.แม่สวด,ต.แม่สวด อ.สบเมย จ.แม่ฮ่องสอน,12:00 น.,0.8,17.96313412609247,97.93163537979126
ท้ายฝายหัวนา,ต.หนองแก้ว อ.กันทรารมย์ จ.ศรีสะเกษ,12:00 น.,0.8,15.134428342376692,104.7028398513794
สถานีพัฒนาการเกษตรที่สูง ฯ ภูพยัคฆ์,ต.ขุนน่าน อ.เฉลิมพระเกียรติ จ.น่าน,12:00 น.,0.8,19.504743526382768,101.21375262737274
สะพานแม่ตื่น,ต.แม่ตื่น อ.แม่ระมาด จ.ตาก,12:00 น.,0.8,17.1253497901782,98.63940060138702
อบต.บ้านเจียง,ต.บ้านเจียง อ.ภักดีชุมพล จ.ชัยภูมิ,12:00 น.,0.8,16.018776567199417,101.50008916854858
อุทยานแห่งชาติตาดโตน,ต.นาฝาย อ.เมืองชัยภูมิ จ.ชัยภูมิ,12:00 น.,0.8,15.984459609004578,102.03772723674774
ป่าต้นน้ำคลองมะเดื่อ อช.เขาใหญ่ (นางรอง),ต.สาริกา อ.เมืองนครนายก จ.นครนายก,12:00 น.,0.8,14.36930098143796,101.27120018005371
อบต.กกสะทอน,ต.กกสะทอน อ.ด่านซ้าย จ.เลย,12:00 น.,0.6,17.089501326236093,101.11007988452911
ที่ทำการอุทยานแห่งชาติทะเลบัน,ต.วังประจัน อ.ควนโดน จ.สตูล,12:00 น.,0.6,6.70904246603122,100.16908586025238
ที่ว่าการอำเภอสุคีริน,ต.สุคิริน อ.สุคิริน จ.นราธิวาส,12:00 น.,0.6,5.940164662058224,101.77136778831482
อบต.โพธิ์ประทับช้าง,ต.โพธิ์ประทับช้าง อ.โพธิ์ประทับช้าง จ.พิจิตร,12:00 น.,0.6,16.310630371722077,100.29538571834564
สะพานห้วยบังบาต,ต.หนองเดิ่น อ.บุ่งคล้า จ.บึงกาฬ,12:00 น.,0.6,18.28267449137665,103.88073205947876
อบต.ไล่โว่,ต.ไล่โว่ อ.สังขละบุรี จ.กาญจนบุรี,12:00 น.,0.6,15.187603397514238,98.47718596458435
มะนัง,ต.นิคมพัฒนา อ.มะนัง จ.สตูล,12:00 น.,0.6,6.940724973105533,99.87255156040192
เฉลิมพระเกียรติ,ต.หนองยาง อ.เฉลิมพระเกียรติ จ.นครราชสีมา,11:00 น.,0.6,14.968003303094836,102.23786294460297
อบต.อ่าวตง,ต.อ่าวตง อ.วังวิเศษ จ.ตรัง,12:00 น.,0.6,7.855777434070519,99.38441097736359
ทต.เจ๊ะบิลัง,ต.เจ๊ะบิลัง อ.เมืองสตูล จ.สตูล,12:00 น.,0.6,6.657254634590552,99.97033953666687
สงขลา,ต.บ่อยาง อ.เมืองสงขลา จ.สงขลา,10:00 น.,0.6,7.18211329154937,100.60769140720367
ท่าตูม,ต.ทุ่งกุลา อ.ท่าตูม จ.สุรินทร์,12:00 น.,0.6,15.329681130283811,103.68261337280273
อบต.หนองแหน,ต.หนองแหน อ.พนมสารคาม จ.ฉะเชิงเทรา,12:00 น.,0.6,13.683340149419667,101.32511258125305
พุนพิน 2,ต.หนองไทร อ.พุนพิน จ.สุราษฎร์ธานี,12:00 น.,0.6,9.085771414826286,99.17001128196716
อบต.บางใหญ่,ต.บางใหญ่ อ.กระบุรี จ.ระนอง,12:00 น.,0.6,10.306385095174132,98.77074837684631
คลองนางน้อย,ต.นาโยงใต้ อ.เมืองตรัง จ.ตรัง,12:00 น.,0.6,7.568325941005462,99.65096890926361
อุทยานแห่งชาติแม่เมย,ต.แม่สอง อ.ท่าสองยาง จ.ตาก,12:00 น.,0.6,17.48381047138537,98.07418406009674
ส.เทเวศร์,ต.วัดสามพระยา อ.พระนคร จ.กรุงเทพมหานคร,12:00 น.,0.5,13.771909395564625,100.50110042095184
บ้านขุนห้วย,ต.แม่พุง อ.วังชิ้น จ.แพร่,11:00 น.,0.5,17.903802613966423,99.54200148582458
บ้านห้วยกอก,ต.ห้วยเฮี้ย อ.นครไทย จ.พิษณุโลก,11:00 น.,0.5,16.911726332149588,100.87099850177765
บ้านบางแป้น2,ต.วังมะปราง อ.วังวิเศษ จ.ตรัง,11:00 น.,0.5,7.624588695775571,99.41400110721588
บ้านในปง,ต.อ่าวตง อ.วังวิเศษ จ.ตรัง,11:00 น.,0.5,7.89255982483915,99.38700199127197
บ้านฮากไม้เหนือ,ต.ป่าแป๋ อ.แม่สะเรียง จ.แม่ฮ่องสอน,11:00 น.,0.5,18.30261488322082,98.07900130748749
บ้านห้วยครก,ต.เขาปู่ อ.ศรีบรรพต จ.พัทลุง,11:00 น.,0.5,7.6613009315370615,99.83799934387207
บ้านแม่โถใต้,ต.แม่โถ อ.แม่ลาน้อย จ.แม่ฮ่องสอน,11:00 น.,0.5,18.608485587683262,97.98299968242645
บ้านผาแดงหลวง,ต.แม่โถ อ.แม่ลาน้อย จ.แม่ฮ่องสอน,11:00 น.,0.5,18.57510095082046,98.0180025100708
บ้านเมืองแพม,ต.ถ้ำลอด อ.ปางมะผ้า จ.แม่ฮ่องสอน,11:00 น.,0.5,19.583424888869317,98.30799758434296
บ้านแม่สูนน้อย,ต.แม่คะ อ.ฝาง จ.เชียงใหม่,11:00 น.,0.5,19.857456796182397,99.13499772548676
บ้านขุนแจ๋,ต.แม่แวน อ.พร้าว จ.เชียงใหม่,11:00 น.,0.5,19.331088772615633,99.3209981918335
บ้านเชิงผา,ต.กลางดง อ.ทุ่งเสลี่ยม จ.สุโขทัย,11:00 น.,0.5,17.31861307323008,99.51100051403046
บ้านจันตาแป๊ะ,ต.จันทเขลม อ.เขาคิชฌกูฏ จ.จันทบุรี,11:00 น.,0.5,13.03510147114457,102.10800111293793
บ้านมหาวัน,ต.มหาวัน อ.แม่สอด จ.ตาก,11:00 น.,0.5,16.577567806915333,98.59499931335449
บ้านหลวง,ต.ครึ่ง อ.เชียงของ จ.เชียงราย,11:00 น.,0.5,20.04458781653592,100.37999868392944
บ้านศรีดอนชัย,ต.ป่าแงะ อ.ป่าแดด จ.เชียงราย,11:00 น.,0.5,19.55293055588505,99.9530017375946
บ้านแม่ลาก,ต.ท่าข้าวเปลือก อ.แม่จัน จ.เชียงราย,11:00 น.,0.5,20.16905874415795,100.00900089740753
บ้านสามัคคีใหม่,ต.แม่ฟ้าหลวง อ.แม่ฟ้าหลวง จ.เชียงราย,11:00 น.,0.5,20.2443006817937,99.76400256156921
บ้านวังลาว,ต.เวียง อ.เชียงแสน จ.เชียงราย,11:00 น.,0.5,20.373037541542566,100.0600004196167
บ้านระเริง,ต.ระเริง อ.วังน้ำเขียว จ.นครราชสีมา,11:00 น.,0.5,14.581153779990164,101.71100199222565
บ้านแม่แอบ,ต.บ้านแซว อ.เชียงแสน จ.เชียงราย,11:00 น.,0.5,20.19184760874398,100.22099733352661
บ้านอุดมทรัพย์พัฒนา,ต.อุดมทรัพย์ อ.วังน้ำเขียว จ.นครราชสีมา,11:00 น.,0.5,14.533593219183855,101.97099924087524
บ้านแม่สาย (บ้านถ้ำผาจม),ต.เวียงพางคำ อ.แม่สาย จ.เชียงราย,11:00 น.,0.5,20.440283758843748,99.87300217151642
บ้านเชี่ยวหมอน,ต.พนม อ.พนม จ.สุราษฎร์ธานี,11:00 น.,0.5,8.83749537025456,98.7739884853363
บ้านหนองปลิง,ต.คลองพา อ.ท่าชนะ จ.สุราษฎร์ธานี,11:00 น.,0.5,9.58266538988923,99.12801861763
บ้านชโลดมพัฒนา,ต.นาใต้ อ.บ้านนาเดิม จ.สุราษฎร์ธานี,11:00 น.,0.5,8.890398170585918,99.32723701000214
บ้านหัวควน,ต.สำนักแต้ว อ.สะเดา จ.สงขลา,11:00 น.,0.5,6.526956466246325,100.51212966442108
บ้านซอย 8,ต.ควนกาหลง อ.ควนกาหลง จ.สตูล,11:00 น.,0.5,6.881953444932882,99.99722063541412
บ้านไร่,ต.ห้วยเขย่ง อ.ทองผาภูมิ จ.กาญจนบุรี,11:00 น.,0.5,14.707321130609419,98.52779924869537
บ้านห้วยกบ,ต.หนองลู อ.สังขละบุรี จ.กาญจนบุรี,11:00 น.,0.5,15.212612273165446,98.36849749088287
บ้านธรรมสถิตย์,ต.สำนักทอง อ.เมืองระยอง จ.ระยอง,11:00 น.,0.5,12.702965450474023,101.44468545913696
บ้านห้วยหินลับ,ต.ทุ่งใส อ.สิชล จ.นครศรีธรรมราช,11:00 น.,0.5,9.079250611675432,99.83200192451477
