สถานีบ้านแก่นอุดร,ต.น้ำแก่น อ.ภูเพียง จ.น่าน ,05:00 ,4
สถานีบ้านปลายระแนะ,ต.ละอาย อ.ฉวาง จ.นครศรีธรรมราช ,05:00 ,4
สถานีบ้านกงษีไร่ (หมู่ 6),ต.ซึ้ง อ.ขลุง จ.จันทบุรี ,05:00 ,4
สถานีบ้านมาบป่าแฝก,ต.ตลุกกลางทุ่ง อ.เมืองตาก จ.ตาก ,05:00 ,4
สถานีบ้านเวียงสา,ต.ทรายขาว อ.พาน จ.เชียงราย ,05:00 ,4
สถานีส.ช่องนนทรี,ต.ช่องนนทรี อ.ยานนาวา จ.กรุงเทพมหานคร ,06:00 ,4
สถานีบ้านสวนส้ม,ต.เขาล้าน อ.ทับสะแก จ.ประจวบคีรีขันธ์ ,05:00 ,4
สถานีบ้านต้นมะพร้าว,ต.ถ้ำสิงขร อ.คีรีรัฐนิคม จ.สุราษฎร์ธานี ,05:00 ,4
สถานีบ้านนาพูน,ต.นาพูน อ.วังชิ้น จ.แพร่ ,05:00 ,4
สถานีบ้านพนาสวรรค์,ต.แม่ยาว อ.เมืองเชียงราย จ.เชียงราย ,05:00 ,4
สถานีบ้านบางเหรียงใต้,ต.บางเหรียง อ.ทับปุด จ.พังงา ,05:00 ,4
สถานีบ้านสะพานไทร,ต.บางดี อ.ห้วยยอด จ.ตรัง ,05:00 ,4
สถานีบ้านแม่กาษาใหม่ไหล่ท่า,ต.แม่กาษา อ.แม่สอด จ.ตาก ,05:00 ,4
สถานีบ้านแม่สุกใน,ต.วังซ้าย อ.วังเหนือ จ.ลำปาง ,05:00 ,4
สถานีบ้านหินสอ,ต.ปลาบ่า อ.ภูเรือ จ.เลย ,05:00 ,4
สถานีบ้านบางเจริญ,ต.ไชยราช อ.บางสะพานน้อย จ.ประจวบคีรีขันธ์ ,05:00 ,4
สถานีบ้านแดนชุมพล,ต.แดนชุมพล อ.สอง จ.แพร่ ,05:00 ,4
สถานีบ้านห้วยท่าง,ต.ไชยวัฒนา อ.ปัว จ.น่าน ,05:00 ,4
สถานีบ้านหนองขาหย่าง,ต.สวนเมี่ยง อ.ชาติตระการ จ.พิษณุโลก ,05:00 ,4
สถานีอบต.ห้วยโก๋น,ต.ห้วยโก๋น อ.เฉลิมพระเกียรติ จ.น่าน ,06:00 ,4
สถานีบ้านน้ำดั้น,ต.ภูคา อ.ปัว จ.น่าน ,05:00 ,4
สถานีบ้านนาเวียง,ต.วังชิ้น อ.วังชิ้น จ.แพร่ ,05:00 ,4
สถานีอบต.ช่างเคิ่ง,ต.ช่างเคิ่ง อ.แม่แจ่ม จ.เชียงใหม่ ,06:00 ,4
สถานีบ้านสะพานลาว,ต.สหกรณ์นิคม อ.ทองผาภูมิ จ.กาญจนบุรี ,05:00 ,4
สถานีบ้านดงใหม่,ต.ห้วยห้อม อ.แม่ลาน้อย จ.แม่ฮ่องสอน ,05:00 ,4
สถานีบ้านแม่โถใต้,ต.แม่โถ อ.แม่ลาน้อย จ.แม่ฮ่องสอน ,05:00 ,4
สถานีบ้านป่าอ้อย,ต.จอมหมอกแก้ว อ.แม่ลาว จ.เชียงราย ,05:00 ,4
สถานีบ้านปลายคลองวัน,ต.ปากจั่น อ.กระบุรี จ.ระนอง ,05:00 ,4
สถานีบ้านห้วยฮ่อม,ต.บ้านจันทร์ อ.กัลยาณิวัฒนา จ.เชียงใหม่ ,05:00 ,4
สถานีลำปาง,ต.พระบาท อ.เมืองลำปาง จ.ลำปาง ,04:00 ,3.9
สถานีอุทยานแห่งชาติดอยภูคา,ต.ภูคา อ.ปัว จ.น่าน ,06:00 ,3.8
สถานีคลองจระเข้ใหญ่ บางเสาธง (วัดศรีวารีน้อย),ต.ศีรษะจรเข้ใหญ่ อ.บางเสาธง จ.สมุทรปราการ ,06:00 ,3.8
สถานีสตึก,ต.นิคม อ.สตึก จ.บุรีรัมย์ ,06:00 ,3.8
สถานีแม่พริก,ต.แม่พริก อ.แม่พริก จ.ลำปาง ,06:00 ,3.8
สถานีอบต.ขนงพระ,ต.ขนงพระ อ.ปากช่อง จ.นครราชสีมา ,06:00 ,3.8
สถานีหน่วยจัดการต้นน้ำแม่พริก (หน่วยย่อย ปางหลวง),ต.ท่าก๊อ อ.แม่สรวย จ.เชียงราย ,06:00 ,3.8
สถานีทต.เนินมะปราง,ต.เนินมะปราง อ.เนินมะปราง จ.พิษณุโลก ,06:00 ,3.8
สถานีมะนัง,ต.นิคมพัฒนา อ.มะนัง จ.สตูล ,06:00 ,3.6
สถานีอุทยานแห่งชาติภูเรือ,ต.หนองบัว อ.ภูเรือ จ.เลย ,06:00 ,3.6
สถานีลำน้ำขว้าง (ฝายจ้าว),ต.ศิลาแลง อ.ปัว จ.น่าน ,06:00 ,3.6
สถานีอบต.ไม้ขาว,ต.ไม้ขาว อ.ถลาง จ.ภูเก็ต ,06:00 ,3.6
สถานีลำน้ำอูน,ต.สว่าง อ.พรรณานิคม จ.สกลนคร ,06:00 ,3.6
สถานีเมืองตรัง,ต.บางรัก อ.เมืองตรัง จ.ตรัง ,06:00 ,3.6
สถานีอบต.ตากฟ้า,ต.ตากฟ้า อ.ตากฟ้า จ.นครสวรรค์ ,06:00 ,3.6
สถานีทต.ทุ่งสะโตก,ต.ทุ่งสะโตก อ.สันป่าตอง จ.เชียงใหม่ ,06:00 ,3.6
สถานีเปร็ดใน,ต.ห้วงน้ำขาว อ.เมืองตราด จ.ตราด ,06:00 ,3.6
สถานีบ้านดงจิก,ต.ทับไทร อ.โป่งน้ำร้อน จ.จันทบุรี ,05:00 ,3.5
สถานีบ้านทุ่ง,ต.อ่าวนาง อ.เมืองกระบี่ จ.กระบี่ ,05:00 ,3.5
สถานีบ้านท่าแพ,ต.ช้างกลาง อ.ช้างกลาง จ.นครศรีธรรมราช ,05:00 ,3.5
สถานีบ้านคลองดินดำ,ต.หมูสี อ.ปากช่อง จ.นครราชสีมา ,05:00 ,3.5
สถานีบ้านทัพป่าเส้า,ต.วังเหนือ อ.วังเหนือ จ.ลำปาง ,05:00 ,3.5
สถานีบ้านหมาก,ต.มวกเหล็ก อ.มวกเหล็ก จ.สระบุรี ,05:00 ,3.5
สถานีบ้านห้วยน้ำเค็ม,ต.อุดมทรัพย์ อ.วังน้ำเขียว จ.นครราชสีมา ,05:00 ,3.5
สถานีบ้านแม่ขะนิล,ต.บ้านปง อ.หางดง จ.เชียงใหม่ ,05:00 ,3.5
สถานีเขตยานนาวา,ต.ช่องนนทรี อ.ยานนาวา จ.กรุงเทพมหานคร ,06:00 ,3.5
สถานีบ้านรวงผึ้งพัฒนา,ต.คลองน้ำไหล อ.คลองลาน จ.กำแพงเพชร ,05:00 ,3.5
สถานีบ้านคลองสน,ต.เกาะช้าง อ.เกาะช้าง จ.ตราด ,05:00 ,3.5
สถานีบ้านห้วยโป้*,ต.แม่สิน อ.ศรีสัชนาลัย จ.สุโขทัย ,05:00 ,3.5
สถานีบ้านห้วยพลู,ต.ด่านแม่ละเมา อ.แม่สอด จ.ตาก ,05:00 ,3.5
สถานีบ้านแม่ฮี้,ต.แม่ฮี้ อ.ปาย จ.แม่ฮ่องสอน ,05:00 ,3.5
สถานีบ้านฟากท่า,ต.แม่สำ อ.ศรีสัชนาลัย จ.สุโขทัย ,05:00 ,3.5
สถานีบ้านขุนแม่ลาน้อย,ต.ขุนแม่ลาน้อย อ.แม่ลาน้อย จ.แม่ฮ่องสอน ,05:00 ,3.5
สถานีบ้านป่าแดง,ต.ยางฮอม อ.ขุนตาล จ.เชียงราย ,05:00 ,3.5
สถานีบ้านหนองม่วน (ดง),ต.ห้วยห้อม อ.แม่ลาน้อย จ.แม่ฮ่องสอน ,05:00 ,3.5
สถานีบ้านวังน้ำเย็น,ต.เมืองลี อ.นาหมื่น จ.น่าน ,05:00 ,3.5
สถานีบ้านดอยสะโงะ,ต.ศรีดอนมูล อ.เชียงแสน จ.เชียงราย ,05:00 ,3.5
สถานีบ้านป่าข้าวหลาม,ต.นาโป่ง อ.เมืองเลย จ.เลย ,05:00 ,3.5
สถานีบ้านขวากใต้,ต.ท่าข้าม อ.เวียงแก่น จ.เชียงราย ,05:00 ,3.5
สถานีบ้านโป่งน้ำร้อน,ต.เสริมกลาง อ.เสริมงาม จ.ลำปาง ,05:00 ,3.5
สถานีบ้านกุ่มเนิ้งใต้,ต.แม่มอก อ.เถิน จ.ลำปาง ,05:00 ,3.5
สถานีบ้านหนองเลา,ต.ภูซาง อ.ภูซาง จ.พะเยา ,05:00 ,3.5
สถานีบ้านปางตอง,ต.แม่อูคอ อ.ขุนยวม จ.แม่ฮ่องสอน ,05:00 ,3.5
สถานีบ้านเขาอ่าง,ต.มาบไพ อ.ขลุง จ.จันทบุรี ,05:00 ,3.5
สถานีบ้านแม่หล่วง,ต.นาสัก อ.แม่เมาะ จ.ลำปาง ,05:00 ,3.5
สถานีจุดวัด ค.ประเวศฯ-ถ.ร่วมพัฒนา,ต.ขุมทอง อ.ลาดกระบัง จ.กรุงเทพมหานคร ,06:00 ,3.5
สถานีบ้านแม่หงานหลวง,ต.ปางหินฝน อ.แม่แจ่ม จ.เชียงใหม่ ,18:00 ,3.5
สถานีส.คลองเลนเปน,ต.แสมดำ อ.บางขุนเทียน จ.กรุงเทพมหานคร ,06:00 ,3.5
สถานีส.คลองราชมนตรี,ต.แสมดำ อ.บางขุนเทียน จ.กรุงเทพมหานคร ,06:00 ,3.5
สถานีบ้านท่าล้อ,ต.แงง อ.ปัว จ.น่าน ,05:00 ,3.5
สถานีบ้านผาแดง,ต.ทุ่งฮั้ว อ.วังเหนือ จ.ลำปาง ,05:00 ,3.5
สถานีบ้านต้นงุ้น,ต.หัวเมือง อ.เมืองปาน จ.ลำปาง ,05:00 ,3.5
สถานีบ้านเขาเลื่อมใต้,ต.คลองหาด อ.คลองหาด จ.สระแก้ว ,05:00 ,3.5
สถานีบ้านสนามบิน,ต.เขากวางทอง อ.หนองฉาง จ.อุทัยธานี ,05:00 ,3.5
สถานีเหนือฝายหัวนา,ต.หนองแก้ว อ.กันทรารมย์ จ.ศรีสะเกษ ,06:00 ,3.4
สถานีคลองเปรมประชากร หลักหก,ต.หลักหก อ.เมืองปทุมธานี จ.ปทุมธานี ,06:00 ,3.4
สถานีทต.ร่อนทอง,ต.ร่อนทอง อ.บางสะพาน จ.ประจวบคีรีขันธ์ ,06:00 ,3.4
สถานีบ้านตาก,ต.ตากตก อ.บ้านตาก จ.ตาก ,06:00 ,3.4
สถานีสำนักงานเกษตรอำเภอบางสะพาน,ต.กำเนิดนพคุณ อ.บางสะพาน จ.ประจวบคีรีขันธ์ ,06:00 ,3.4
สถานีเมืองพังงา,ต.ถ้ำน้ำผุด อ.เมืองพังงา จ.พังงา ,06:00 ,3.4
สถานีบางกระทุ่ม,ต.โคกสลุด อ.บางกระทุ่ม จ.พิษณุโลก ,06:00 ,3.4
สถานีทต.สุไหงโก-ลก,ต.สุไหงโก-ลก อ.สุไหงโก-ลก จ.นราธิวาส ,06:00 ,3.4
สถานีร้อยเอ็ด,ต.หนองไผ่ อ.ธวัชบุรี จ.ร้อยเอ็ด ,04:00 ,3.4
สถานีเขตรักษาพันธุ์สัตว์ป่าฮาลา-บาลา,ต.โละจูด อ.แว้ง จ.นราธิวาส ,06:00 ,3.4
สถานีศาลากลางหมู่บ้านแพรกตะลุย,ต.เขาจ้าว อ.ปราณบุรี จ.ประจวบคีรีขันธ์ ,06:00 ,3.4
สถานีบ้านโนนศรีเจริญ,ต.ยอดแกง อ.นามน จ.กาฬสินธุ์ ,06:00 ,3.4
สถานีปตร.จุฬาลงกรณ์,ต.ประชาธิปัตย์ อ.ธัญบุรี จ.ปทุมธานี ,06:00 ,3.2
สถานีทต.ท่าขนุน,ต.ท่าขนุน อ.ทองผาภูมิ จ.กาญจนบุรี ,06:00 ,3.2
สถานีฉวาง,ต.ไม้เรียง อ.ฉวาง จ.นครศรีธรรมราช ,04:00 ,3.2
สถานีสะพานข้ามน้ำมูล,ต.โขงเจียม อ.โขงเจียม จ.อุบลราชธานี ,06:00 ,3.2
สถานีสะพานต้นน้ำ (เกาะแก้ว-ตลิ่งสูง),ต.ปางมะค่า อ.ขาณุวรลักษบุรี จ.กำแพงเพชร ,06:00 ,3.2
สถานีแม่จัน,ต.แม่จัน อ.แม่จัน จ.เชียงราย ,06:00 ,3.2
สถานีสวนเพชรล้านนา,ต.แม่สุก อ.แจ้ห่ม จ.ลำปาง ,06:00 ,3.2
สถานีตาพระยา,ต.ทัพเสด็จ อ.ตาพระยา จ.สระแก้ว ,06:00 ,3.2
สถานีทต.ดอยสะเก็ด,ต.เชิงดอย อ.ดอยสะเก็ด จ.เชียงใหม่ ,06:00 ,3.2
สถานีสำนักงานเกษตรอำเภอเจาะไอร้อง,ต.จวบ อ.เจาะไอร้อง จ.นราธิวาส ,06:00 ,3.2
สถานีปตร.พระศรีศิลป์,ต.หนองแค อ.หนองแค จ.สระบุรี ,06:00 ,3.2
สถานีท้ายฝายยางบ้านตะลุง,ต.หนองเรือ อ.ชุมพลบุรี จ.สุรินทร์ ,06:00 ,3
สถานีบ้านตลิ่งสูง,ต.แม่เล่ย์ อ.แม่วงก์ จ.นครสวรรค์ ,05:00 ,3
สถานีเขตคลองเตย,ต.คลองเตย อ.คลองเตย จ.กรุงเทพมหานคร ,06:00 ,3
สถานีบ้านนากึ๋น,ต.บ่อเกลือเหนือ อ.บ่อเกลือ จ.น่าน ,05:00 ,3
สถานีทต.ตะเคียนทอง,ต.ตะเคียนทอง อ.เขาคิชฌกูฏ จ.จันทบุรี ,06:00 ,3
สถานีบ้านหัวดง,ต.หงาว อ.เทิง จ.เชียงราย ,05:00 ,3
สถานีบ้านแม่แขม,ต.บ่อเหล็กลอง อ.ลอง จ.แพร่ ,05:00 ,3
สถานีบ้านท่าวังแคน,ต.ศรีสองรัก อ.เมืองเลย จ.เลย ,05:00 ,3
สถานีบ้านส้อ,ต.เปือ อ.เชียงกลาง จ.น่าน ,05:00 ,3
สถานีบ้านดอนมูล,ต.นาทะนุง อ.นาหมื่น จ.น่าน ,05:00 ,3
สถานีบ้านปลาบ่า,ต.ปลาบ่า อ.ภูเรือ จ.เลย ,05:00 ,3
สถานีบ้านปางน้ำฮ้าย,ต.ท่าก๊อ อ.แม่สรวย จ.เชียงราย ,21:00 ,3
สถานีรร.บ้านพูน,ต.กะปาง อ.ทุ่งสง จ.นครศรีธรรมราช ,06:00 ,3
สถานีบ้านนาไคร้,ต.ยางเปียง อ.อมก๋อย จ.เชียงใหม่ ,05:00 ,3
สถานีบ้านพอนอคี,ต.ห้วยโป่ง อ.เมืองแม่ฮ่องสอน จ.แม่ฮ่องสอน ,04:00 ,3
สถานีบ้านห้วยกบ,ต.หนองลู อ.สังขละบุรี จ.กาญจนบุรี ,05:00 ,3
สถานีทต.เกาะช้าง,ต.เกาะช้าง อ.เกาะช้าง จ.ตราด ,06:00 ,3
สถานีบ้านวังประดิษฐ์,ต.เขาค่าย อ.สวี จ.ชุมพร ,05:00 ,3
สถานีบ้านผาแตก,ต.ท่าข้าวเปลือก อ.แม่จัน จ.เชียงราย ,05:00 ,3
สถานีบ้านแม่เลียงพัฒนา,ต.เสริมขวา อ.เสริมงาม จ.ลำปาง ,05:00 ,3
สถานีบ้านห้วยไคร้,ต.ดงคู่ อ.ศรีสัชนาลัย จ.สุโขทัย ,05:00 ,3
สถานีบ้านดงโคร่ง,ต.หินดาด อ.ทองผาภูมิ จ.กาญจนบุรี ,05:00 ,3
สถานีบ้านพันวาล 4,ต.รับร่อ อ.ท่าแซะ จ.ชุมพร ,05:00 ,3
สถานีสตูล,ต.คลองขุด อ.เมืองสตูล จ.สตูล ,04:00 ,3
สถานีบ้านผางาม,ต.ปวนพุ อ.หนองหิน จ.เลย ,05:00 ,3
สถานีชุมชนบ้านร้องแง,ต.วรนคร อ.ปัว จ.น่าน ,06:00 ,3
สถานีบ้านหนองใหญ่,ต.ผาอินทร์แปลง อ.เอราวัณ จ.เลย ,05:00 ,3
สถานีบ้านปางยาง,ต.ศิลาเพชร อ.ปัว จ.น่าน ,05:00 ,3
สถานีบ้านแม่นาจร*,ต.แม่นาจร อ.แม่แจ่ม จ.เชียงใหม่ ,05:00 ,3
สถานีบ้านน้ำทบ,ต.เขาหลวง อ.วังสะพุง จ.เลย ,05:00 ,3
สถานีอบต.ทุ่งแล้ง,ต.ทุ่งแล้ง อ.ลอง จ.แพร่ ,06:00 ,3
สถานีบ้านปูนะ,ต.เทอดไทย อ.แม่ฟ้าหลวง จ.เชียงราย ,05:00 ,3
สถานีบ้านขุนยวม,ต.ขุนยวม อ.ขุนยวม จ.แม่ฮ่องสอน ,05:00 ,3
สถานีศูนย์สาธิตพัฒนาฯ การใช้หญ้าแฝกด้านป่าไม้ที่ ๒,ต.แม่สิน อ.ศรีสัชนาลัย จ.สุโขทัย ,06:00 ,3
สถานีบ้านห้วยสีเสียด,ต.น้ำหมาน อ.เมืองเลย จ.เลย ,05:00 ,3
สถานีบ้านหัวเมือง,ต.ศรีษะเกษ อ.นาน้อย จ.น่าน ,05:00 ,3
สถานีท่าวังผา,ต.ท่าวังผา อ.ท่าวังผา จ.น่าน ,06:00 ,3
สถานีบ้านปางผักหม,ต.งิม อ.ปง จ.พะเยา ,05:00 ,3
สถานีบ้านส้าน,ต.สันทะ อ.นาน้อย จ.น่าน ,05:00 ,3
สถานีบ้านดอยล้าน,ต.วาวี อ.แม่สรวย จ.เชียงราย ,05:00 ,3
สถานีบ้านห้วยยาง,ต.บ่อเบี้ย อ.บ้านโคก จ.อุตรดิตถ์ ,05:00 ,3
สถานีบ้านแม่แก้วเหนือ,ต.แม่อ้อ อ.พาน จ.เชียงราย ,05:00 ,3
สถานีส.พระโขนง,ต.พระโขนง อ.คลองเตย จ.กรุงเทพมหานคร ,06:00 ,3
สถานีบ้านโจะโหวะเหนือ,ต.บ้านเนิน อ.หล่มเก่า จ.เพชรบูรณ์ ,05:00 ,3
สถานีคลองผันน้ำยม-น่าน1,ต.ในเมือง อ.สวรรคโลก จ.สุโขทัย ,06:00 ,3
สถานีบ้านกลาง,ต.ละมอ อ.นาโยง จ.ตรัง ,05:00 ,3
สถานีบ้านหุบผึ้ง,ต.ห้วยทราย อ.เมืองประจวบคีรีขันธ์ จ.ประจวบคีรีขันธ์ ,05:00 ,3
สถานีบ้านคลองเดื่อ,ต.หมูสี อ.ปากช่อง จ.นครราชสีมา ,05:00 ,3
สถานีสะพานทางเข้าชุมชนบ้านปากซวด,ต.พังกาญจน์ อ.พนม จ.สุราษฎร์ธานี ,06:00 ,3
สถานีบ้านดอยมด,ต.แม่เจดีย์ใหม่ อ.เวียงป่าเป้า จ.เชียงราย ,05:00 ,3
สถานีที่ทำการเขตรักษาพันธุ์สัตว์ป่าดอยหลวง,ต.ห้วยหม้าย อ.สอง จ.แพร่ ,06:00 ,3
สถานีบ้านผากระเจ้อ,ต.พบพระ อ.พบพระ จ.ตาก ,05:00 ,3
สถานีบ้านฟากนา,ต.บ้านโคก อ.บ้านโคก จ.อุตรดิตถ์ ,05:00 ,3
สถานีสุรินทร์,ต.ในเมือง อ.เมืองสุรินทร์ จ.สุรินทร์ ,04:00 ,2.9
สถานีป่าสักงาม,ต.ลวงเหนือ อ.ดอยสะเก็ด จ.เชียงใหม่ ,06:00 ,2.8
สถานีคลองนราภิรมย์ (บางเลน),ต.นราภิรมย์ อ.บางเลน จ.นครปฐม ,06:00 ,2.8
สถานีอบต.ปังเผล,ต.ปรังเผล อ.สังขละบุรี จ.กาญจนบุรี ,06:00 ,2.8
สถานีหน่วยจัดการต้นน้ำขุนสถาน,ต.สันทะ อ.นาน้อย จ.น่าน ,06:00 ,2.8
สถานีลำน้ำกูน,ต.ศิลาแลง อ.ปัว จ.น่าน ,06:00 ,2.8
สถานีสะพานนวลฉวี,ต.บ้านใหม่ อ.ปากเกร็ด จ.นนทบุรี ,06:00 ,2.8
สถานีคลองลาดพร้าว ปากคลอง2สายใต้,ต.ลาดพร้าว อ.ลาดพร้าว จ.กรุงเทพมหานคร ,06:00 ,2.6
สถานีวัดเวฬุวัน,ต.เหนือเมือง อ.เมืองร้อยเอ็ด จ.ร้อยเอ็ด ,06:00 ,2.6
สถานีถ้ำพรรณรา,ต.ถ้ำพรรณรา อ.ถ้ำพรรณรา จ.นครศรีธรรมราช ,06:00 ,2.6
สถานีอบต.นอกเมือง,ต.นอกเมือง อ.เมืองสุรินทร์ จ.สุรินทร์ ,06:00 ,2.6
สถานีหน่วยพิทักษ์อุทยานแห่งชาติ มว.๔ (แม่แสลม),ต.เวียงมอก อ.เถิน จ.ลำปาง ,06:00 ,2.6
สถานีสะพานกะลูบี บ้านสายปารี,ต.มาโมง อ.สุคิริน จ.นราธิวาส ,06:00 ,2.6
สถานีทต.ขุนยวม,ต.ขุนยวม อ.ขุนยวม จ.แม่ฮ่องสอน ,06:00 ,2.6
สถานีทต.ปราณบุรี,ต.หนองตาแต้ม อ.ปราณบุรี จ.ประจวบคีรีขันธ์ ,06:00 ,2.6
สถานีบ้านน้ำใส,ต.ฝายแก้ว อ.ภูเพียง จ.น่าน ,05:00 ,2.5
