สถานีพัฒนาการเกษตรที่สูง ฯ ภูพยัคฆ์,ต.ขุนน่าน อ.เฉลิมพระเกียรติ จ.น่าน,00:00 น.,0.4,19.504743526382768,101.21375262737274
รร.อนุบาล ทต.สันกำแพง,ต.สันกำแพง อ.สันกำแพง จ.เชียงใหม่,17:00 น.,2.4,18.75289537062334,99.1277825832367
บ้านหัวพุ,ต.วังข่อย อ.ไพศาลี จ.นครสวรรค์,00:00 น.,12.5,15.564190241670211,100.70599973201752
บ้านคลองพนม,ต.คลองศก อ.พนม จ.สุราษฎร์ธานี,23:00 น.,22,8.79296123483613,98.70307087898254
หน่วยพิทักษ์ป่าเขาพัง,ต.เขาพัง อ.บ้านตาขุน จ.สุราษฎร์ธานี,23:00 น.,24,9.031821583025614,98.67944061756134
ศาลากลางหมู่บ้านแพรกตะลุย,ต.เขาจ้าว อ.ปราณบุรี จ.ประจวบคีรีขันธ์,00:00 น.,2,12.322471836022157,99.6234118938446
เขาพะเนินทุ่ง,ต.ห้วยแม่เพรียง อ.แก่งกระจาน จ.เพชรบุรี,00:00 น.,0.2,12.825301814126654,99.3655014038086
กระบี่,ต.เหนือคลอง อ.เหนือคลอง จ.กระบี่,22:00 น.,16.2,8.10360955811047,98.97527754306793
อบต.ดงพระรามณ์,ต.ดงพระราม อ.เมืองปราจีนบุรี จ.ปราจีนบุรี,00:00 น.,0.6,14.062763440998156,101.41368985176086
โครงการชลประทานยะลา,ต.สะเตง อ.เมืองยะลา จ.ยะลา,00:00 น.,1,6.537370490830673,101.25938773155212
อบต.โคคลาน,ต.โคคลาน อ.ตาพระยา จ.สระแก้ว,00:00 น.,8.2,13.991087603586761,102.65062808990479
เมืองแกลง,ต.บ้านนา อ.แกลง จ.ระยอง,00:00 น.,0.2,12.803018542218112,101.65023922920227
พลิ้ว สกษ.,ต.ตะปอน อ.ขลุง จ.จันทบุรี,22:00 น.,0.4,12.508612197580401,102.17305541038513
วารินชำราบ,ต.คำน้ำแซบ อ.วารินชำราบ จ.อุบลราชธานี,00:00 น.,1.8,15.205613606365743,104.81391549110413
ลำน้ำก่ำ,ต.หนองบ่อ อ.นาแก จ.นครพนม,00:00 น.,16,17.030684045731913,104.41480815410614
ทต.สันนาเม็ง,ต.สันนาเม็ง อ.สันทราย จ.เชียงใหม่,00:00 น.,0.2,18.83807466809414,99.05694544315338
ทต.ทุ่งสะโตก,ต.ทุ่งสะโตก อ.สันป่าตอง จ.เชียงใหม่,17:00 น.,2.6,18.57391614881357,98.86222779750824
ชุมชนโกรกประดู่,ต.โคกกลาง อ.ลำปลายมาศ จ.บุรีรัมย์,00:00 น.,1,14.935211723690317,102.88858294487
วัดขนอนใต้,ต.บ้านกรด อ.บางปะอิน จ.พระนครศรีอยุธยา,00:00 น.,8.8,14.288234965330444,100.61132848262787
บ้านปางตอง,ต.แม่อูคอ อ.ขุนยวม จ.แม่ฮ่องสอน,15:00 น.,2.5,18.84358827853962,98.06400239467621
บ้านร้องธาร,ต.ศรีดงเย็น อ.ไชยปราการ จ.เชียงใหม่,17:00 น.,1.5,19.671504011757023,99.14699792861938
บ้านตะเคียนงาม,ต.บางหิน อ.กะเปอร์ จ.ระนอง,00:00 น.,56.5,9.519417467150856,98.5732626914978
บ้านบางกุ่ม,ต.กะปง อ.กะปง จ.พังงา,00:00 น.,54,8.665886890599657,98.45299780368805
บ้านหนองคล้า,ต.ชำผักแพว อ.แก่งคอย จ.สระบุรี,15:00 น.,2.5,14.49043717325992,101.04100227355957
ส.รัชดา-วิภาวดี,ต.จตุจักร อ.จตุจักร จ.กรุงเทพมหานคร,10:00 น.,1.5,13.830219846846548,100.55722832679749
บ้านท่าหินโงม,ต.ท่าหินโงม อ.เมืองชัยภูมิ จ.ชัยภูมิ,18:00 น.,2.5,16.057943800125713,102.03297436237335
บ้านบ่อน้ำร้อน,ต.ตาเนาะแมเราะ อ.เบตง จ.ยะลา,01:00 น.,2.5,5.849921403973601,101.07286155223846
บ้านถ้ำเต่า,ต.ท่าคล้อ อ.แก่งคอย จ.สระบุรี,00:00 น.,0.5,14.704057442038248,100.96799790859222
บ้านบีกริม,ต.คลองทับจันทร์ อ.อรัญประเทศ จ.สระแก้ว,00:00 น.,18,13.638479987572856,102.39340960979462
บ้านซับชมภู,ต.วังทอง อ.ภักดีชุมพล จ.ชัยภูมิ,16:00 น.,2.5,15.76696366296788,101.37700259685516
บ้านศรีบัวบาน,ต.ศรีบัวบาน อ.เมืองลำพูน จ.ลำพูน,00:00 น.,3,18.526176536722584,99.09799933433533
บ้านปากห้วยแม่ปะ,ต.แม่ปะ อ.แม่สอด จ.ตาก,00:00 น.,1.5,16.76017683474296,98.52699995040894
บ้านขุนแจ๋,ต.แม่แวน อ.พร้าว จ.เชียงใหม่,00:00 น.,1,19.331088772615633,99.3209981918335
บ้านซำทองพัฒนา,ต.บ้านกลาง อ.วังทอง จ.พิษณุโลก,14:00 น.,2.5,17.088609127758005,100.59400141239166
บ้านอ่าวกลาง,ต.วังมะปรางเหนือ อ.วังวิเศษ จ.ตรัง,00:00 น.,37.5,7.7690639783280915,99.36500251293182
บ้านแม่ป้อกใน,ต.ศรีวิชัย อ.ลี้ จ.ลำพูน,14:00 น.,1,18.089529208701524,98.86500120162964
บ้านหัวฝาย,ต.ศรีดงเย็น อ.ไชยปราการ จ.เชียงใหม่,00:00 น.,1.5,19.598657257724508,99.17400240898132
บ้านหนองขาหยั่ง,ต.คลองตะเกรา อ.ท่าตะเกียบ จ.ฉะเชิงเทรา,00:00 น.,9.5,13.323689201932634,101.67521595954895
บ้านบางกา,ต.กะเปา อ.คีรีรัฐนิคม จ.สุราษฎร์ธานี,00:00 น.,5,9.011630697092807,98.91905307769775
บ้านป่ารวก,ต.บ่อโพธิ์ อ.นครไทย จ.พิษณุโลก,18:00 น.,0.5,17.17989878948776,101.00899815559387
บ้านควนเนียง*,ต.พะตง อ.หาดใหญ่ จ.สงขลา,00:00 น.,6.5,6.835281450256032,100.49864888191223
บ้านราชมงคล,ต.ทองมงคล อ.บางสะพาน จ.ประจวบคีรีขันธ์,00:00 น.,7,11.199167529638592,99.40362632274628
บ้านอูตูม,ต.นาเกียน อ.อมก๋อย จ.เชียงใหม่,00:00 น.,1,17.86381345946238,98.2090026140213
เมืองพังงา,ต.ถ้ำน้ำผุด อ.เมืองพังงา จ.พังงา,00:00 น.,51.4,8.47732263303875,98.52831959724426
สมุทรปราการ สกษ.,ต.บางปู อ.เมืองสมุทรปราการ จ.สมุทรปราการ,22:00 น.,3,13.516669330490046,100.7616662979126
ทต.ขุนยวม,ต.ขุนยวม อ.ขุนยวม จ.แม่ฮ่องสอน,00:00 น.,0.6,18.831220480827294,97.93512225151062
เกาะลันตา,ต.เกาะลันตาใหญ่ อ.เกาะลันตา จ.กระบี่,22:00 น.,5,7.533334150038908,99.04999852180481
เหนือฝายราษีไศล,ต.บัวหุ่ง อ.ราษีไศล จ.ศรีสะเกษ,00:00 น.,1.4,15.344420069157248,104.09878492355347
โรงปรับปรุงคุณภาพน้ำฯ ทน.นครสวรรค์,ต.ปากน้ำโพ อ.เมืองนครสวรรค์ จ.นครสวรรค์,12:00 น.,2.4,15.698615088127786,100.13689935207367
อบต.เขาค่าย,ต.เขาค่าย อ.สวี จ.ชุมพร,00:00 น.,20.6,10.121980970294628,98.89594316482544
องครักษ์,ต.องครักษ์ อ.องครักษ์ จ.นครนายก,00:00 น.,40.6,14.113654645109856,101.01957142353058
ชุมชนบ้านตูม,ต.กุดน้ำใส อ.ค้อวัง จ.ยโสธร,00:00 น.,1.8,15.418895529360414,104.3419486284256
อบต.ห้วยโก๋น,ต.ห้วยโก๋น อ.เฉลิมพระเกียรติ จ.น่าน,00:00 น.,1.2,19.595129782898013,101.08571469783783
อบต.บึงสามพัน,ต.บึงสามพัน อ.บึงสามพัน จ.เพชรบูรณ์,15:00 น.,0.8,15.778083557075831,101.02092862129211
คลองแม่รำพัน 1,ต.เมืองเก่า อ.เมืองสุโขทัย จ.สุโขทัย,00:00 น.,1.8,17.05047136636691,99.66440141201019
อบต.นายาง,ต.นายาง อ.สบปราบ จ.ลำปาง,00:00 น.,6.4,17.909780047790825,99.30968999862671
สกลนคร สกษ.,ต.ห้วยยาง อ.เมืองสกลนคร จ.สกลนคร,22:00 น.,0.4,17.125026816456536,104.06099796295166
จันทบุรี,ต.วัดใหม่ อ.เมืองจันทบุรี จ.จันทบุรี,22:00 น.,0.01,12.616667252034615,102.11333334445953
ลำน้ำอูน,ต.สว่าง อ.พรรณานิคม จ.สกลนคร,00:00 น.,1.4,17.32272024396539,103.9792388677597
สถานีศึกษาภูมิอากาศป่าไม้ลุ่มน้ำยม,ต.ในเวียง อ.เมืองแพร่ จ.แพร่,15:00 น.,2.2,18.139459228407738,100.1337879896164
เมืองสุรินทร์,ต.ตระแสง อ.เมืองสุรินทร์ จ.สุรินทร์,19:00 น.,2.2,14.875555225747867,103.37884247303009
สะพานเดชาติวงศ์,ต.ปากน้ำโพ อ.เมืองนครสวรรค์ จ.นครสวรรค์,12:00 น.,2.2,15.68842047290739,100.12378334999084
ยะลา สกษ.,ต.สะเตงนอก อ.เมืองยะลา จ.ยะลา,22:00 น.,4.5,6.516664809043021,101.28333449363708
อบต.วังโรงใหญ่,ต.วังโรงใหญ่ อ.สีคิ้ว จ.นครราชสีมา,16:00 น.,1,15.05057934186786,101.66220724582672
พระนครศรีอยุธยา,ต.ท่าเจ้าสนุก อ.ท่าเรือ จ.พระนครศรีอยุธยา,13:00 น.,2.2,14.534720045514385,100.72500050067902
สะพานข้ามคลองคดศอก,ต.หงษ์เจริญ อ.ท่าแซะ จ.ชุมพร,00:00 น.,6.4,10.755659962706158,99.17954385280609
สัตหีบ,ต.พลูตาหลวง อ.สัตหีบ จ.ชลบุรี,13:00 น.,2.1,12.68333528247037,100.98333477973938
ที่ทำการอุทยานแห่งชาติถ้ำสะเกิน,ต.ยอด อ.สองแคว จ.น่าน,00:00 น.,45.8,19.38371981512924,100.53888738155365
บ้านสะพานลาว,ต.สหกรณ์นิคม อ.ทองผาภูมิ จ.กาญจนบุรี,00:00 น.,1.5,14.72579195942342,98.78300070762634
บ้านไร่บน,ต.ช้างแรก อ.บางสะพานน้อย จ.ประจวบคีรีขันธ์,00:00 น.,3.5,11.051623440375861,99.32500004768372
บ้านช่องลม,ต.ช้างแรก อ.บางสะพานน้อย จ.ประจวบคีรีขันธ์,00:00 น.,4,11.122707214100318,99.3669980764389
อบต.บ้านไร่,ต.บ้านไร่ อ.บางกระทุ่ม จ.พิษณุโลก,14:00 น.,0.2,16.61077865827804,100.26578485965729
บ้านกองซาง,ต.ยางเปียง อ.อมก๋อย จ.เชียงใหม่,12:00 น.,1.5,17.734804723964263,98.35700154304504
บ้านปางยาง,ต.บ้านปง อ.หางดง จ.เชียงใหม่,16:00 น.,2,18.817216759893103,98.83100152015686
บ้านเขาเกตุ,ต.ทับกวาง อ.แก่งคอย จ.สระบุรี,15:00 น.,0.5,14.570401629340248,101.07699751853943
บ้านหนองธง,ต.หนองพันจันทร์ อ.บ้านคา จ.ราชบุรี,13:00 น.,1,13.45973170966435,99.44000244140625
บ้านไทรงาม,ต.หนองสาหร่าย อ.ปากช่อง จ.นครราชสีมา,17:00 น.,0.5,14.636178291742757,101.50800168514252
สวรรคโลก,ต.ท่าทอง อ.สวรรคโลก จ.สุโขทัย,00:00 น.,0.4,17.201873780064066,99.8639041185379
อบต.ศีรษะจรเข้น้อย,ต.ศีรษะจรเข้น้อย อ.บางเสาธง จ.สมุทรปราการ,00:00 น.,9,13.677747429550672,100.79449117183685
บ้านเขาเหล็ก,ต.นบพิตำ อ.นบพิตำ จ.นครศรีธรรมราช,14:00 น.,2,8.768399169963601,99.72499787807465
บ้านหาดทรายเปลือกหอย,ต.คลองเคียน อ.ตะกั่วทุ่ง จ.พังงา,23:00 น.,13.5,8.204365017556796,98.43900203704834
บ้านสบวาก,ต.แม่นาจร อ.แม่แจ่ม จ.เชียงใหม่,13:00 น.,2,18.64092840499247,98.37799787521362
บ้านบางลึก,ต.พลูเถื่อน อ.พนม จ.สุราษฎร์ธานี,21:00 น.,2,8.658504796772398,98.69499742984772
เมืองแพร่,ต.ป่าแมต อ.เมืองแพร่ จ.แพร่,15:00 น.,2,18.133642524395928,100.12457191944122
อบต.วังหมี,ต.วังหมี อ.วังน้ำเขียว จ.นครราชสีมา,16:00 น.,2,14.415660227092047,101.68402433395386
บ้านช่องแคบ,ต.ช่องแคบ อ.พบพระ จ.ตาก,00:00 น.,1,16.476815497982777,98.64700198173523
บ้านน้ำเลียง,ต.ปอน อ.ทุ่งช้าง จ.น่าน,14:00 น.,2,19.565183572249932,100.92199802398682
บ้านหนองหว้า,ต.ทุ่งยาว อ.ปะเหลียน จ.ตรัง,00:00 น.,9.5,7.235594208803282,99.77099776268005
บ้านสว่างคีรี,ต.โคกยาง อ.กันตัง จ.ตรัง,00:00 น.,2,7.496148287149224,99.45599913597107
ประโคนชัย,ต.ไพศาล อ.ประโคนชัย จ.บุรีรัมย์,00:00 น.,1.8,14.63301735124034,103.23046267032623
บ้านห้วยครก,ต.เขาปู่ อ.ศรีบรรพต จ.พัทลุง,00:00 น.,2,7.6613009315370615,99.83799934387207
วัดปราการ,ต.ท่าขนอน อ.คีรีรัฐนิคม จ.สุราษฎร์ธานี,23:00 น.,8,9.030279889280804,98.96879196166992
ตาพระยา,ต.ทัพเสด็จ อ.ตาพระยา จ.สระแก้ว,00:00 น.,0.4,14.051252684683957,102.88536429405212
ลำเชิญ อ.ชุมแพ (ท้ายฝายโครงการชลประทานน้ำเชิญ),ต.สามสวน อ.บ้านแท่น จ.ชัยภูมิ,15:00 น.,2,16.433332469910333,102.28333175182343
อ.อมก๋อย จ.เชียงใหม่,ต.อมก๋อย อ.อมก๋อย จ.เชียงใหม่,13:00 น.,1,17.79752795820445,98.36263954639435
ทต.บางสะพานน้อย,ต.บางสะพาน อ.บางสะพานน้อย จ.ประจวบคีรีขันธ์,00:00 น.,1.6,11.07616227133494,99.44528102874756
บ้านนาหลวง,ต.สะเอียบ อ.สอง จ.แพร่,19:00 น.,2,18.742004265871977,100.30900061130524
แม่น้ำชี อ.มหาชนะชัย (E.20A),ต.ฟ้าหยาด อ.มหาชนะชัย จ.ยโสธร,23:00 น.,2,15.52358873100181,104.24948215484619
อาคารสูบน้ำดิบ กปภ. อ.ยะหา จ.ยะลา,ต.บาโร๊ะ อ.ยะหา จ.ยะลา,23:00 น.,3,6.474808477725271,101.13951981067657
บ้านสมัยเหนือ,ต.สมัย อ.สบปราบ จ.ลำปาง,15:00 น.,1.5,17.90468061004946,99.41600203514099
บ้านวังวัด,ต.ยางราก อ.โคกเจริญ จ.ลพบุรี,00:00 น.,3.5,15.337534439656006,100.95999956130981
สะพานลำน้ำเลย,ต.เชียงคาน อ.เชียงคาน จ.เลย,00:00 น.,2,17.860984828776644,101.61144375801086
อบต.แม่สวด,ต.แม่สวด อ.สบเมย จ.แม่ฮ่องสอน,10:00 น.,2,17.96313412609247,97.93163537979126
อุบลราชธานี สกษ.,ต.ท่าช้าง อ.สว่างวีระวงศ์ จ.อุบลราชธานี,22:00 น.,39,15.23913986824347,105.0234979391098
บ้านวังชุมทอง,ต.วังใหม่ อ.วังสมบูรณ์ จ.สระแก้ว,00:00 น.,3.5,13.383701623877199,102.01691329479218
บ้านนอก,ต.ตาชี อ.ยะหา จ.ยะลา,00:00 น.,8,6.555165499808935,101.10628187656403
บ้านป่าเลา,ต.แม่หอพระ อ.แม่แตง จ.เชียงใหม่,15:00 น.,2,19.115093632500276,99.06899929046631
บ้านแก่งลาด,ต.ห้วยเฮี้ย อ.นครไทย จ.พิษณุโลก,15:00 น.,2,16.959092690473803,100.92800080776215
บ้านปากรอง*,ต.ชาติตระการ อ.ชาติตระการ จ.พิษณุโลก,23:00 น.,0.5,17.302649544968485,100.6710022687912
ศูนย์พัฒนาเด็กเล็ก อบต.ท่านา,ต.ท่านา อ.กะปง จ.พังงา,00:00 น.,58.2,8.678465815115747,98.41659486293793
เหนือปตร.พระนารายน์,ต.ท่าหลวง อ.ท่าเรือ จ.พระนครศรีอยุธยา,14:00 น.,0.2,14.558319760420343,100.76206862926483
บ้านหนักไทร*,ต.ช่อง อ.นาโยง จ.ตรัง,00:00 น.,13,7.539471213420921,99.75286602973938
อบต.เกาะหลัก,ต.เกาะหลัก อ.เมืองประจวบคีรีขันธ์ จ.ประจวบคีรีขันธ์,00:00 น.,1.6,11.802965508215811,99.75460946559906
ฝ่ายส่งน้ำและบำรุงรักษาที่ 2,ต.เมืองเล็น อ.สันทราย จ.เชียงใหม่,14:00 น.,1.8,18.88420368500694,99.08288776874542
ราษีไศล,ต.เมืองคง อ.ราษีไศล จ.ศรีสะเกษ,00:00 น.,2,15.339495134262997,104.15238618850708
เมืองจันทบุรี,ต.จันทนิมิต อ.เมืองจันทบุรี จ.จันทบุรี,22:00 น.,0.2,12.613568182153866,102.11406826972961
โชคชัย,ต.กระโทก อ.โชคชัย จ.นครราชสีมา,16:00 น.,1.8,14.718891523517827,102.16861367225647
ศรีสำโรง สกษ.,ต.คลองตาล อ.ศรีสำโรง จ.สุโขทัย,22:00 น.,0.2,17.161360488956273,99.86166715621948
อบต.วังม่วง,ต.วังม่วง อ.วังม่วง จ.สระบุรี,00:00 น.,20.8,14.848095661290634,101.14592492580414
เทศบาลตำบลหอไกร,ต.หอไกร อ.บางมูลนาก จ.พิจิตร,00:00 น.,0.8,16.050149118617867,100.37378668785095
ทต.ท่ายาง,ต.ท่ายาง อ.ท่ายาง จ.เพชรบุรี,00:00 น.,0.4,12.963345979531718,99.89839732646942
ชุมชนบ้านทับคริสต์,ต.คลองชะอุ่น อ.พนม จ.สุราษฎร์ธานี,00:00 น.,11.2,8.750261536090335,98.80191564559937
ทต.นาส่วง,ต.นาส่วง อ.เดชอุดม จ.อุบลราชธานี,00:00 น.,5.8,15.01145853674538,104.94819760322571
อบต.ทับใต้,ต.ทับใต้ อ.หัวหิน จ.ประจวบคีรีขันธ์,12:00 น.,1.6,12.490318411424646,99.9043196439743
หน่วยพิทักษ์อุทยานแห่งชาติที่ ขค.๓ (ผาซ่อนแก้ว),ต.แคมป์สน อ.เขาค้อ จ.เพชรบูรณ์,13:00 น.,0.2,16.777794345235698,101.06843590736389
บางตาเถร,ต.บางตาเถร อ.สองพี่น้อง จ.สุพรรณบุรี,14:00 น.,1.6,14.156623135247882,100.12740969657898
อบต.หนองโสน,ต.หนองโสน อ.สามง่าม จ.พิจิตร,00:00 น.,0.4,16.396735799916986,100.05493104457855
ชุมพร,ต.ท่าตะเภา อ.เมืองชุมพร จ.ชุมพร,22:00 น.,6.7,10.498751619826477,99.18847024440765
สันทราย,ต.แม่แฝก อ.สันทราย จ.เชียงใหม่,00:00 น.,0.2,19.009764257652616,98.9597636461258
นายายอาม,ต.วังใหม่ อ.นายายอาม จ.จันทบุรี,00:00 น.,11.6,12.72247375053303,101.95599496364594
วัดคะเมยกาญจนผลาราม,ต.แก่งกระจาน อ.แก่งกระจาน จ.เพชรบุรี,12:00 น.,1.6,13.001656835931133,99.58627939224243
หน่วยพิทักษ์อุทยานแห่งชาติแก่งกระจาน 10,ต.ห้วยแม่เพรียง อ.แก่งกระจาน จ.เพชรบุรี,00:00 น.,0.2,12.97822879398168,99.37311887741089
เมืองมหาสารคาม,ต.เกิ้ง อ.เมืองมหาสารคาม จ.มหาสารคาม,00:00 น.,0.2,16.232254279240625,103.27107667922974
ตราด,ต.คลองใหญ่ อ.คลองใหญ่ จ.ตราด,22:00 น.,23.5,11.766668216483176,102.88333117961884
ราชบุรี,ต.อ่างทอง อ.เมืองราชบุรี จ.ราชบุรี,22:00 น.,2.1,13.489305494345757,99.79239106178284
บ้านนาตอน,ต.บ่อภาค อ.ชาติตระการ จ.พิษณุโลก,16:00 น.,1.5,17.386594883630213,100.75800240039825
บ้านแก่นอุดร,ต.น้ำแก่น อ.ภูเพียง จ.น่าน,17:00 น.,0.5,18.70354452051879,100.84100067615509
บ้านม้งเก้าหลัง,ต.เทอดไทย อ.แม่ฟ้าหลวง จ.เชียงราย,00:00 น.,0.5,20.344088755427816,99.52099978923798
บ้านวังขอน,ต.ระเริง อ.วังน้ำเขียว จ.นครราชสีมา,22:00 น.,1,14.514877719240907,101.76099836826324
บ้านคลองกั่ว,ต.เขาพระ อ.รัตภูมิ จ.สงขลา,00:00 น.,5,6.941358660693677,100.13299942016602
บ้านน้ำพร้า,ต.นางพญา อ.ท่าปลา จ.อุตรดิตถ์,16:00 น.,1.5,17.96577742411112,100.39399981498718
จุดวัด ค.บางบัว,ต.เสนานิคม อ.จตุจักร จ.กรุงเทพมหานคร,00:00 น.,0.5,13.857960765103511,100.58681845664978
บ้านนาวง,ต.บ้านนา อ.ศรีนครินทร์ จ.พัทลุง,00:00 น.,16.5,7.587054423962113,99.85799789428711
บ้านวังหิน*,ต.นาท่ามใต้ อ.เมืองตรัง จ.ตรัง,00:00 น.,1,7.645499904679695,99.53236162662506
บ้านหนองน้ำเย็น*,ต.ทุ่งควายกิน อ.แกลง จ.ระยอง,00:00 น.,8.5,12.786534977662726,101.72631740570068
บ้านเขาพลู,ต.บางสัก อ.กันตัง จ.ตรัง,00:00 น.,4,7.4243310280873684,99.39700126647949
บ้านคลองไชยใต้,ต.กะเปียด อ.ฉวาง จ.นครศรีธรรมราช,00:00 น.,4,8.50984585807437,99.45899784564972
