ชื่อสถานี,ที่ตั้ง,เวลา,ฝนล่าสุด (มม.)
บ้านหน้าซึง,ต.ปากฉลุย อ.ท่าฉาง จ.สุราษฎร์ธานี,05:00 น.,245.5
หน่วยจัดการต้นน้ำเนินหอม,ต.เนินหอม อ.เมืองปราจีนบุรี จ.ปราจีนบุรี,06:00 น.,111.2
สะพานห้วยปากแซง,ต.สำโรง อ.โพธิ์ไทร จ.อุบลราชธานี,06:00 น.,109.6
วัดพิเสกประดิษฐิ์,ต.ใหม่นาเพียง อ.แวงใหญ่ จ.ขอนแก่น,06:00 น.,103.6
บ้านสันติสุข,ต.เวียงต้า อ.ลอง จ.แพร่,05:00 น.,92.5
อบต.ตาดกลอย,ต.ตาดกลอย อ.หล่มเก่า จ.เพชรบูรณ์,06:00 น.,91
อบต.ไม้รูด,ต.ไม้รูด อ.คลองใหญ่ จ.ตราด,06:00 น.,89.4
ร้อยเอ็ด สกษ.,ต.เหนือเมือง อ.เมืองร้อยเอ็ด จ.ร้อยเอ็ด,04:00 น.,86.7
บ้านทุ่งพล้อ,ต.ป่างิ้ว อ.ศรีสัชนาลัย จ.สุโขทัย,05:00 น.,86.5
อบต.นาหินลาด,ต.นาหินลาด อ.ปากพลี จ.นครนายก,06:00 น.,86.2
ท้ายฝายยางกะฮาด,ต.กะฮาด อ.เนินสง่า จ.ชัยภูมิ,06:00 น.,76.8
บุรีรัมย์,ต.ร่อนทอง อ.สตึก จ.บุรีรัมย์,04:00 น.,73
บ้านซับฟาน,ต.ยางงาม อ.หนองไผ่ จ.เพชรบูรณ์,05:00 น.,71.5
อบต.หล่มเก่า,ต.หล่มเก่า อ.หล่มเก่า จ.เพชรบูรณ์,06:00 น.,70.2
ตลาดเก่าตะกั่วป่า,ต.โคกเคียน อ.ตะกั่วป่า จ.พังงา,06:00 น.,70
บ้านสันโป่ง,ต.เสริมกลาง อ.เสริมงาม จ.ลำปาง,05:00 น.,69.5
ปราจีนบุรี,ต.หน้าเมือง อ.เมืองปราจีนบุรี จ.ปราจีนบุรี,04:00 น.,68
หน่วยศึกษาการพัฒนาการอนุรักษ์ต้นน้ำผาเวียง,ต.แม่สิน อ.ศรีสัชนาลัย จ.สุโขทัย,06:00 น.,67.2
ทต.โคกภู,ต.โคกภู อ.ภูพาน จ.สกลนคร,06:00 น.,67.2
ตราด,ต.คลองใหญ่ อ.คลองใหญ่ จ.ตราด,04:00 น.,67.1
บ้านบางติบ,ต.บางวัน อ.คุระบุรี จ.พังงา,05:00 น.,67
ทต.บึงโขงหลง,ต.บึงโขงหลง อ.บึงโขงหลง จ.บึงกาฬ,06:00 น.,65.6
บ้านสามสบ,ต.ท่าผา อ.แม่แจ่ม จ.เชียงใหม่,05:00 น.,65.5
ฝ่ายส่งน้ำและบำรุงรักษาที่ 2,ต.เมืองเล็น อ.สันทราย จ.เชียงใหม่,06:00 น.,65.4
บ้านทุ่งข้าวหาง,ต.ตะเคียนปม อ.ทุ่งหัวช้าง จ.ลำพูน,05:00 น.,64.5
ทต.ไพศาลี,ต.ไพศาลี อ.ไพศาลี จ.นครสวรรค์,06:00 น.,63.6
บ้านซับสมบูรณ์,ต.วังข่อย อ.ไพศาลี จ.นครสวรรค์,19:00 น.,63.5
บ้านนาหลวง,ต.สะเอียบ อ.สอง จ.แพร่,05:00 น.,63
บ้านเทพพนา,ต.นายางกลัก อ.เทพสถิต จ.ชัยภูมิ,20:00 น.,62.5
บ้านดอยปุย,ต.สุเทพ อ.เมืองเชียงใหม่ จ.เชียงใหม่,05:00 น.,62.5
จุดวัด ค.สนามชัย-ค.บางขุนเทียน,ต.บางขุนเทียน อ.จอมทอง จ.กรุงเทพมหานคร,06:00 น.,62.5
เหนือฝายยางกะฮาด,ต.กะฮาด อ.เนินสง่า จ.ชัยภูมิ,06:00 น.,61.8
สตึก,ต.นิคม อ.สตึก จ.บุรีรัมย์,06:00 น.,61.8
บ้านสะโทย,ต.วังสรรพรส อ.ขลุง จ.จันทบุรี,05:00 น.,61
ทม.ระนอง,ต.เขานิเวศน์ อ.เมืองระนอง จ.ระนอง,06:00 น.,60.8
บ้านตะเคียนงาม,ต.บางหิน อ.กะเปอร์ จ.ระนอง,05:00 น.,60
หน่วยจัดการต้นน้ำน้ำพาง,ต.วังกวาง อ.น้ำหนาว จ.เพชรบูรณ์,06:00 น.,60
สถานีชุมชนป่าภูถ้ำ,ต.แวงน้อย อ.แวงน้อย จ.ขอนแก่น,06:00 น.,59.4
องครักษ์,ต.องครักษ์ อ.องครักษ์ จ.นครนายก,06:00 น.,59.4
เหนือฝายร้อยเอ็ด,ต.พระธาตุ อ.เชียงขวัญ จ.ร้อยเอ็ด,06:00 น.,58.6
บ้านใหม่สามัคคี,ต.โคกล่าม อ.ลำปลายมาศ จ.บุรีรัมย์,06:00 น.,58.2
อบต.ด่านชุมพล,ต.ด่านชุมพล อ.บ่อไร่ จ.ตราด,06:00 น.,58.2
ระนอง,ต.บางนอน อ.เมืองระนอง จ.ระนอง,04:00 น.,58.1
บ้านทาทุ่งไผ่*,ต.ทาปลาดุก อ.แม่ทา จ.ลำพูน,05:00 น.,58
ทต.นาหนองไผ่,ต.นาหนองไผ่ อ.ชุมพลบุรี จ.สุรินทร์,06:00 น.,58
อุทยานแห่งชาติป่าหินงาม,ต.บ้านไร่ อ.เทพสถิต จ.ชัยภูมิ,06:00 น.,57.8
อบต.นายม,ต.นายม อ.เมืองอำนาจเจริญ จ.อำนาจเจริญ,06:00 น.,57.6
เมืองปราจีนบุรี,ต.หน้าเมือง อ.เมืองปราจีนบุรี จ.ปราจีนบุรี,06:00 น.,57.6
ป่าสักงาม,ต.ลวงเหนือ อ.ดอยสะเก็ด จ.เชียงใหม่,06:00 น.,56.6
หน่วยพิทักษ์อุทยานฯ ที่ นน.๖ (ถ้ำใหญ่น้ำหนาว),ต.หลักด่าน อ.น้ำหนาว จ.เพชรบูรณ์,06:00 น.,56
เขตราชเทวี,ต.ทุ่งพญาไท อ.ราชเทวี จ.กรุงเทพมหานคร,06:00 น.,56
เหนือฝายยางบ้านเขว้า,ต.ปะเคียบ อ.คูเมือง จ.บุรีรัมย์,06:00 น.,55.4
แก่งหางแมว,ต.แก่งหางแมว อ.แก่งหางแมว จ.จันทบุรี,06:00 น.,54.2
อบต.ด่านม่วงคำ,ต.ด่านม่วงคำ อ.โคกศรีสุพรรณ จ.สกลนคร,06:00 น.,54.2
อบต.ดงพระรามณ์,ต.ดงพระราม อ.เมืองปราจีนบุรี จ.ปราจีนบุรี,06:00 น.,53.8
บ้านนาพรุ,ต.นาคา อ.สุขสำราญ จ.ระนอง,05:00 น.,53.5
อบต.สะตอ,ต.สะตอ อ.เขาสมิง จ.ตราด,06:00 น.,53.4
ส.คลองบางไส้ไก่,ต.สำเหร่ อ.ธนบุรี จ.กรุงเทพมหานคร,06:00 น.,53
บ้านสลักเพชรเหนือ,ต.เกาะช้างใต้ อ.เกาะช้าง จ.ตราด,05:00 น.,53
ที่ทำการเขตรักษาพันธุ์สัตว์ป่าถ้ำเจ้าราม,ต.นาขุนไกร อ.ศรีสำโรง จ.สุโขทัย,06:00 น.,53
อบต.บางหิน,ต.บางหิน อ.กะเปอร์ จ.ระนอง,06:00 น.,52.8
อบต.วังทรายพูน,ต.วังทรายพูน อ.วังทรายพูน จ.พิจิตร,06:00 น.,51.8
นครพนม สกษ.,ต.ในเมือง อ.เมืองนครพนม จ.นครพนม,04:00 น.,51.8
อบต.หนองลู,ต.หนองลู อ.สังขละบุรี จ.กาญจนบุรี,06:00 น.,51.8
รพสต.บ้านโคกอุดม,ต.หนองกี่ อ.กบินทร์บุรี จ.ปราจีนบุรี,06:00 น.,51.4
อบต.หนองมะค่า,ต.หนองมะค่า อ.โคกเจริญ จ.ลพบุรี,06:00 น.,51.4
ลำน้ำก่ำ,ต.หนองบ่อ อ.นาแก จ.นครพนม,06:00 น.,51.4
ทม.ตะพานหิน,ต.ตะพานหิน อ.ตะพานหิน จ.พิจิตร,06:00 น.,51.2
หน่วยจัดการต้นน้ำห้วยอีมาย,ต.นาป่า อ.เมืองเพชรบูรณ์ จ.เพชรบูรณ์,06:00 น.,51.2
บ้านกงษีไร่ (หมู่ 6),ต.ซึ้ง อ.ขลุง จ.จันทบุรี,00:00 น.,50.5
ส.คลองสำเหร่,ต.สำเหร่ อ.ธนบุรี จ.กรุงเทพมหานคร,06:00 น.,50.5
รร.บ้านท่าหัน,ต.รมณีย์ อ.กะปง จ.พังงา,06:00 น.,50.2
บ้านดอนชัย,ต.แม่ทา อ.แม่ออน จ.เชียงใหม่,05:00 น.,50
ทต.ปากน้ำ,ต.ปากน้ำ อ.เมืองระนอง จ.ระนอง,06:00 น.,50
ชุมชนจุมจัง,ต.จุมจัง อ.กุฉินารายณ์ จ.กาฬสินธุ์,05:00 น.,49.6
บ้านซับอีปุก,ต.ซับพุทรา อ.ชนแดน จ.เพชรบูรณ์,19:00 น.,49.5
บ้านซำรู้,ต.ห้วยเฮี้ย อ.นครไทย จ.พิษณุโลก,22:00 น.,49.5
เหนือปตร.พระธรรมราชา,ต.บึงน้ำรักษ์ อ.ธัญบุรี จ.ปทุมธานี,06:00 น.,49.4
อบต.ดอนฉิมพลี,ต.ดอนฉิมพลี อ.บางน้ำเปรี้ยว จ.ฉะเชิงเทรา,06:00 น.,49.2
ตำบลซับสมบูรณ์,ต.ซับสมบูรณ์ อ.วิเชียรบุรี จ.เพชรบูรณ์,06:00 น.,49
สะพานห้วยมุก,ต.มุกดาหาร อ.เมืองมุกดาหาร จ.มุกดาหาร,06:00 น.,49
บ้านหินลาด,ต.คุระ อ.คุระบุรี จ.พังงา,05:00 น.,49
เหนือปตร.พระอินทราชา,ต.วังน้อย อ.วังน้อย จ.พระนครศรีอยุธยา,06:00 น.,48.6
เขตพญาไท,ต.สามเสนใน อ.พญาไท จ.กรุงเทพมหานคร,06:00 น.,48.5
บ้านห้วยหินลับ,ต.วังกวาง อ.น้ำหนาว จ.เพชรบูรณ์,05:00 น.,48.5
บ้านท่ามะปราง,ต.นาหินลาด อ.ปากพลี จ.นครนายก,21:00 น.,48.5
อบต.ศรีเทพ,ต.ศรีเทพ อ.ศรีเทพ จ.เพชรบูรณ์,06:00 น.,48.2
เปร็ดใน,ต.ห้วงน้ำขาว อ.เมืองตราด จ.ตราด,06:00 น.,48.2
บ้านปงป่าป๋อ,ต.เสริมขวา อ.เสริมงาม จ.ลำปาง,05:00 น.,48
ท้ายปตร.พระอินทราชา,ต.พยอม อ.วังน้อย จ.พระนครศรีอยุธยา,06:00 น.,47.8
โนนปูน,ต.สุขสวัสดิ์ อ.ไพรบึง จ.ศรีสะเกษ,06:00 น.,47.6
ทต.เสริมงาม,ต.ทุ่งงาม อ.เสริมงาม จ.ลำปาง,06:00 น.,47.6
อบต.บางวัน,ต.บางวัน อ.คุระบุรี จ.พังงา,06:00 น.,47.6
เมืองตราด,ต.ห้วยแร้ง อ.เมืองตราด จ.ตราด,06:00 น.,47.4
อบต.นาตาล,ต.นาตาล อ.นาตาล จ.อุบลราชธานี,06:00 น.,47.4
อบต.บ้านแมด,ต.บ้านแมด อ.บุณฑริก จ.อุบลราชธานี,06:00 น.,47.4
สะพานบังอี่,ต.โพธิ์ไทร อ.ดอนตาล จ.มุกดาหาร,06:00 น.,46.8
อบต.ห้วยมุ่น,ต.ห้วยมุ่น อ.น้ำปาด จ.อุตรดิตถ์,06:00 น.,46.8
หน่วยจัดการต้นน้ำดอยถ้วย,ต.เมืองนะ อ.เชียงดาว จ.เชียงใหม่,06:00 น.,46.4
อบต.นาคู,ต.นาคู อ.นาคู จ.กาฬสินธุ์,06:00 น.,46.2
บ้านหนองปล้อง,ต.กุดตาเพชร อ.ลำสนธิ จ.ลพบุรี,05:00 น.,46
บ้านจันทิ,ต.ท่ากุ่ม อ.เมืองตราด จ.ตราด,05:00 น.,46
ศูนย์ฯ (ดินแดง),ต.ดินแดง อ.ดินแดง จ.กรุงเทพมหานคร,06:00 น.,46
ทต.บ้านเต่า,ต.บ้านเต่า อ.บ้านแท่น จ.ชัยภูมิ,06:00 น.,45.6
บ้านขุนแปะ,ต.บ้านแปะ อ.จอมทอง จ.เชียงใหม่,05:00 น.,45.5
บ้านทับเบิก,ต.วังบาล อ.หล่มเก่า จ.เพชรบูรณ์,00:00 น.,45.5
ส.คลองภาษีเจริญ,ต.ปากคลองภาษีเจริญ อ.ภาษีเจริญ จ.กรุงเทพมหานคร,06:00 น.,45.5
บ้านเลยวังไสย์,ต.เลยวังไสย์ อ.ภูหลวง จ.เลย,05:00 น.,45
พยุหะคีรี,ต.ท่าน้ำอ้อย อ.พยุหะคีรี จ.นครสวรรค์,06:00 น.,45
หน่วยจัดการต้นน้ำแม่กลาง,ต.บ้านหลวง อ.จอมทอง จ.เชียงใหม่,06:00 น.,44.6
ท้ายปตร.พระธรรมราชา,ต.บึงน้ำรักษ์ อ.ธัญบุรี จ.ปทุมธานี,06:00 น.,44.4
ท้ายฝายร้อยเอ็ด,ต.พระธาตุ อ.เชียงขวัญ จ.ร้อยเอ็ด,06:00 น.,44.2
บ้านห้วยซ้อ,ต.ห้วยม่วง อ.ภูผาม่าน จ.ขอนแก่น,05:00 น.,44
บ้านหนองบอน,ต.หนองบอน อ.บ่อไร่ จ.ตราด,05:00 น.,44
รร.บ้านช้างเชื่อ,ต.เหล อ.กะปง จ.พังงา,06:00 น.,43.8
เทศบาลตำบลเหนือ,ต.เหนือ อ.เมืองกาฬสินธุ์ จ.กาฬสินธุ์,06:00 น.,43.6
บ้านเมืองแปง,ต.เมืองแปง อ.ปาย จ.แม่ฮ่องสอน,05:00 น.,43.5
บ้านนาป่าแปก,ต.หมอกจำแป่ อ.เมืองแม่ฮ่องสอน จ.แม่ฮ่องสอน,01:00 น.,43.5
แม่หาด,ต.บ้านหลวง อ.จอมทอง จ.เชียงใหม่,06:00 น.,43.2
นาดี,ต.สะพานหิน อ.นาดี จ.ปราจีนบุรี,06:00 น.,43.2
สะพานกรุงเทพ,ต.ดาวคะนอง อ.ธนบุรี จ.กรุงเทพมหานคร,06:00 น.,43
บ้านไร่พัฒนา,ต.วะตะแบก อ.เทพสถิต จ.ชัยภูมิ,05:00 น.,43
อุบลราชธานี (ศูนย์ฯ),ต.ไร่น้อย อ.เมืองอุบลราชธานี จ.อุบลราชธานี,04:00 น.,42.8
บ้านวังกอก,ต.น้ำตก อ.นาน้อย จ.น่าน,05:00 น.,42.5
เขตบางกอกใหญ่,ต.วัดท่าพระ อ.บางกอกใหญ่ จ.กรุงเทพมหานคร,06:00 น.,42.5
บ้านแม่หวาน,ต.ป่าเมี่ยง อ.ดอยสะเก็ด จ.เชียงใหม่,05:00 น.,42.5
ทต.หนองบอน,ต.หนองบอน อ.บ่อไร่ จ.ตราด,06:00 น.,42.2
บ้านปากแพรก,ต.ละอุ่นเหนือ อ.ละอุ่น จ.ระนอง,05:00 น.,42
เขตป้อมปราบฯ,ต.วัดโสมนัส อ.ป้อมปราบศัตรูพ่าย จ.กรุงเทพมหานคร,06:00 น.,42
ส.คลองดาวคะนอง,ต.บางปะกอก อ.ราษฎร์บูรณะ จ.กรุงเทพมหานคร,06:00 น.,42
บ้านห้วยไฟ,ต.แม่ขะนิง อ.เวียงสา จ.น่าน,05:00 น.,42
เมืองขอนแก่น,ต.ท่าพระ อ.เมืองขอนแก่น จ.ขอนแก่น,06:00 น.,41.6
บ้านบึงไม้,ต.ชะอม อ.แก่งคอย จ.สระบุรี,05:00 น.,41.5
บ้านร่มเกล้าสหมิตร,ต.คีรีราษฎร์ อ.พบพระ จ.ตาก,05:00 น.,41.5
บ้านเหนือ,ต.กำพวน อ.สุขสำราญ จ.ระนอง,05:00 น.,41.5
สวรรคโลก,ต.ท่าทอง อ.สวรรคโลก จ.สุโขทัย,06:00 น.,41
บ้านส่องสี,ต.ห้วยมุ่น อ.น้ำปาด จ.อุตรดิตถ์,18:00 น.,41
จุดวัดบึงมักกะสัน,ต.มักกะสัน อ.ราชเทวี จ.กรุงเทพมหานคร,06:00 น.,41
อุดรธานี,ต.หนองขอนกว้าง อ.เมืองอุดรธานี จ.อุดรธานี,04:00 น.,40.8
อบต.แก้ง,ต.แก้ง อ.เดชอุดม จ.อุบลราชธานี,06:00 น.,40.6
บ้านขะเนจื้อ,ต.ขะเนจื้อ อ.แม่ระมาด จ.ตาก,05:00 น.,40.5
เขตธนบุรี,ต.บางยี่เรือ อ.ธนบุรี จ.กรุงเทพมหานคร,06:00 น.,40.5
จุดวัดสวนเบญจสิริ,ต.คลองตัน อ.คลองเตย จ.กรุงเทพมหานคร,06:00 น.,40.5
รร.วัดอู่ข้าว,ต.คลองเจ็ด อ.คลองหลวง จ.ปทุมธานี,06:00 น.,40.2
อบต.ไล่โว่,ต.ไล่โว่ อ.สังขละบุรี จ.กาญจนบุรี,06:00 น.,40
อบต.ศรีจุฬา,ต.ศรีจุฬา อ.เมืองนครนายก จ.นครนายก,06:00 น.,39.8
อบต.บึงชำอ้อ,ต.บึงชำอ้อ อ.หนองเสือ จ.ปทุมธานี,06:00 น.,39.8
ทต.พลิ้ว,ต.พลิ้ว อ.แหลมสิงห์ จ.จันทบุรี,06:00 น.,39.6
กรุงเทพมหานคร,ต.คลองเตย อ.คลองเตย จ.กรุงเทพมหานคร,04:00 น.,39.6
บ้านห้วยลาด,ต.หลักด่าน อ.น้ำหนาว จ.เพชรบูรณ์,05:00 น.,39.5
บ้านซำม่วง,ต.วังกวาง อ.น้ำหนาว จ.เพชรบูรณ์,20:00 น.,39.5
บ้านห้วยสลัก,ต.ป่าแดด อ.แม่สรวย จ.เชียงราย,05:00 น.,39.5
เขตคลองสาน,ต.คลองสาน อ.คลองสาน จ.กรุงเทพมหานคร,06:00 น.,39.5
บ้านอีเลิศใหม่,ต.นาซำ อ.หล่มเก่า จ.เพชรบูรณ์,18:00 น.,39.5
จุดวัด ค.สามเสน-รพ.พระมงกุฎฯ,ต.สามเสนใน อ.พญาไท จ.กรุงเทพมหานคร,06:00 น.,39
ส.คลองสาทร,ต.ยานนาวา อ.สาทร จ.กรุงเทพมหานคร,06:00 น.,39
บ้านใน,ต.ปากแพรก อ.ดอนสัก จ.สุราษฎร์ธานี,05:00 น.,38.5
อบต.ศรีกะอาง,ต.ศรีกะอาง อ.บ้านนา จ.นครนายก,05:00 น.,38.4
อบต.ขี้เหล็ก,ต.ขี้เหล็ก อ.เมืองอุบลราชธานี จ.อุบลราชธานี,06:00 น.,38.2
บ้านห้วยมุ่น,ต.ห้วยมุ่น อ.น้ำปาด จ.อุตรดิตถ์,18:00 น.,38
แม่สะเรียง,ต.บ้านกาศ อ.แม่สะเรียง จ.แม่ฮ่องสอน,04:00 น.,37.6
เหนือฝายยางบ้านตะลุง,ต.หนองเรือ อ.ชุมพลบุรี จ.สุรินทร์,06:00 น.,37.6
อ่างเก็บน้ำแม่เกี๋ยง,ต.บ้านเอื้อม อ.เมืองลำปาง จ.ลำปาง,06:00 น.,37.6
บ้านโป่งนกสามัคคี,ต.โป่งนก อ.เทพสถิต จ.ชัยภูมิ,05:00 น.,37.5
บ้านพุฝรั่ง,ต.วังข่อย อ.ไพศาลี จ.นครสวรรค์,05:00 น.,37.5
ทต.บุ่งค้า,ต.บุ่งค้า อ.เลิงนกทา จ.ยโสธร,06:00 น.,37.4
อบต.คลองศก,ต.คลองศก อ.พนม จ.สุราษฎร์ธานี,06:00 น.,37.4
ท้ายฝายยางบ้านตะลุง,ต.หนองเรือ อ.ชุมพลบุรี จ.สุรินทร์,06:00 น.,37.4
สะพานข้ามน้ำมูล,ต.โขงเจียม อ.โขงเจียม จ.อุบลราชธานี,06:00 น.,37.2
มุกดาหาร,ต.มุกดาหาร อ.เมืองมุกดาหาร จ.มุกดาหาร,04:00 น.,37.1
บ้านดอกแดง,ต.บางไทร อ.ตะกั่วป่า จ.พังงา,05:00 น.,37
บ้านกกเต็น,ต.ห้วยขมิ้น อ.ด่านช้าง จ.สุพรรณบุรี,05:00 น.,37
สะพานห้วยบังฮวก,ต.ดอนนางหงส์ อ.ธาตุพนม จ.นครพนม,06:00 น.,37
ท้ายไซฟอน ปตร.พระธรรมราชา,ต.บึงน้ำรักษ์ อ.ธัญบุรี จ.ปทุมธานี,06:00 น.,37
ส.กรุงเกษม,ต.บางรัก อ.บางรัก จ.กรุงเทพมหานคร,06:00 น.,37
บ้านโรงกลวง,ต.นบปริง อ.เมืองพังงา จ.พังงา,05:00 น.,37
ทต.โป่งน้ำร้อน,ต.โป่งน้ำร้อน อ.โป่งน้ำร้อน จ.จันทบุรี,06:00 น.,36.8
เหนือฝายธาตุน้อย,ต.สหธาตุ อ.เขื่องใน จ.อุบลราชธานี,06:00 น.,36.6
บ้านแม่สุ,ต.แม่ลาหลวง อ.แม่ลาน้อย จ.แม่ฮ่องสอน,05:00 น.,36.5
ร้อยเอ็ด,ต.หนองไผ่ อ.ธวัชบุรี จ.ร้อยเอ็ด,04:00 น.,36.5
บ้านย่านยาว,ต.เชี่ยวเหลียง อ.กะเปอร์ จ.ระนอง,05:00 น.,36.5
สถานีศึกษาภูมิอากาศป่าไม้ลุ่มน้ำยม,ต.ในเวียง อ.เมืองแพร่ จ.แพร่,06:00 น.,36.4
บ้านโคกแสมสาร,ต.โคกแสมสาร อ.โคกเจริญ จ.ลพบุรี,05:00 น.,36
