ชื่อสถานี,ที่ตั้ง,เวลา,ฝนล่าสุด (มม.),lat,long
บ้านไตรสภาวคาม,ต.ปิงโค้ง อ.เชียงดาว จ.เชียงใหม่,09:00 น.,96,19.42965621679668,98.9790004491806
บ้านวังสมบูรณ์,ต.เขาปูน อ.ห้วยยอด จ.ตรัง,11:00 น.,63.5,7.77448010965501,99.7040069103241
ท้ายเขื่อนรัชชประภา,ต.เขาพัง อ.บ้านตาขุน จ.สุราษฎร์ธานี,11:00 น.,55,8.961749980069568,98.81437182426453
บ้านโคกแมว,ต.โคกม่วง อ.เขาชัยสน จ.พัทลุง,11:00 น.,51,7.387151859597437,100.07200062274933
อบต.ป่าแก่บ่อหิน,ต.ป่าแก่บ่อหิน อ.ทุ่งหว้า จ.สตูล,12:00 น.,47,7.056419899956487,99.80188071727753
อบต.บ้านเสด็จ,ต.บ้านเสด็จ อ.เคียนซา จ.สุราษฎร์ธานี,12:00 น.,46.4,8.763590476449355,99.0646380186081
อบต.คลองศก,ต.คลองศก อ.พนม จ.สุราษฎร์ธานี,12:00 น.,44.2,8.890472370265089,98.661367893219
บ้านบางบอน,ต.คลองศก อ.พนม จ.สุราษฎร์ธานี,11:00 น.,42,8.883524046532198,98.6518943309784
สะพานท่าสำเภา,ต.ชัยบุรี อ.เมืองพัทลุง จ.พัทลุง,12:00 น.,39,7.729607562509329,100.10796368122101
บ้านดอนกระจาย,ต.วังตะกอ อ.หลังสวน จ.ชุมพร,11:00 น.,37,9.974857807984526,99.04269754886627
อุทยานแห่งชาติภูผาม่าน,ต.นาหนองทุ่ม อ.ชุมแพ จ.ขอนแก่น,12:00 น.,35.6,16.758271169622347,101.96871936321259
บ้านห้วยตาสิงห์,ต.บ้านควน อ.หลังสวน จ.ชุมพร,11:00 น.,35,9.832652549965665,99.02099847793579
เขื่อนสิรินธร,ต.นิคมสร้างตนเอง อ.สิรินธร จ.อุบลราชธานี,11:00 น.,35,15.218301105532507,105.42277157306671
บ้านดินดอน,ต.ท่าดี อ.ลานสกา จ.นครศรีธรรมราช,11:00 น.,34.5,8.403846109348725,99.81800079345703
ทต.ตะเคียนทอง,ต.ตะเคียนทอง อ.เขาคิชฌกูฏ จ.จันทบุรี,12:00 น.,31.2,12.91309226798377,102.08152770996094
บ้านโล๊ะจังกระ,ต.คลองเฉลิม อ.กงหรา จ.พัทลุง,11:00 น.,29.5,7.330097648791823,99.9839973449707
มัสยิดกาวมินมูฮายีริน,ต.ปาล์มพัฒนา อ.มะนัง จ.สตูล,12:00 น.,28.4,7.088324249082689,100.00195741653442
รร.บ้านลำปลอกเหนือ,ต.ในควน อ.ย่านตาขาว จ.ตรัง,12:00 น.,27.8,7.354901490150456,99.81480896472931
ทต.ห้วยยอด,ต.ห้วยยอด อ.ห้วยยอด จ.ตรัง,12:00 น.,27.6,7.789128295093799,99.63350772857666
หน่วยจัดการต้นน้ำคลองป่าพรุพ้อ,ต.ทุ่งนารี อ.ป่าบอน จ.พัทลุง,12:00 น.,27,7.162175415979863,100.0845319032669
บ้านนบ,ต.กรุงชิง อ.นบพิตำ จ.นครศรีธรรมราช,11:00 น.,26.5,8.792717371820691,99.7029983997345
อบต.วังน้ำเขียว,ต.วังน้ำเขียว อ.วังน้ำเขียว จ.นครราชสีมา,12:00 น.,26.2,14.374445554998045,101.86512172222137
ชลบุรี,ต.บางปลาสร้อย อ.เมืองชลบุรี จ.ชลบุรี,10:00 น.,24.3,13.366667087657337,100.98333477973938
สะพานบ้านแหลมโตนด,ต.แหลมโตนด อ.ควนขนุน จ.พัทลุง,12:00 น.,24,7.8175993721464305,100.04754424095154
รร.บ้านช้างเชื่อ,ต.เหล อ.กะปง จ.พังงา,12:00 น.,23.6,8.744328572596828,98.48950266838074
บ้านพิตำ,ต.กรุงชิง อ.นบพิตำ จ.นครศรีธรรมราช,11:00 น.,23.5,8.740272470736423,99.65399980545044
บ้านลิพัง,ต.ลิพัง อ.ปะเหลียน จ.ตรัง,11:00 น.,23,7.163564602240865,99.78799760341644
บ้านทุ่งข่า,ต.ปะเหลียน อ.ปะเหลียน จ.ตรัง,11:00 น.,23,7.357221126789315,99.82599914073944
บ้านหนองหว้า,ต.ทุ่งยาว อ.ปะเหลียน จ.ตรัง,11:00 น.,22.5,7.235594208803282,99.77099776268005
ท่าขนอม,ต.ท่าขนอน อ.คีรีรัฐนิคม จ.สุราษฎร์ธานี,12:00 น.,22.2,9.029426921203424,98.96966636180878
บ้านท่ามะปราง,ต.ห้วยยอด อ.ห้วยยอด จ.ตรัง,11:00 น.,21.5,7.762345539800748,99.64540600776672
บ้านแม่ออกฮู,ต.วาเล่ย์ อ.พบพระ จ.ตาก,11:00 น.,21.5,16.315423582394242,98.72399747371674
บ้านหญ้าปล้อง,ต.คลองศก อ.พนม จ.สุราษฎร์ธานี,11:00 น.,21,8.902614394692183,98.5720020532608
บ้านท่างาม,ต.ท่างิ้ว อ.เมืองนครศรีธรรมราช จ.นครศรีธรรมราช,11:00 น.,21,8.442016167970205,99.83399748802185
อบต.ไม้ขาว,ต.ไม้ขาว อ.ถลาง จ.ภูเก็ต,12:00 น.,21,8.181979471710564,98.29884588718414
คลองท่าดี,ต.กำแพงเซา อ.เมืองนครศรีธรรมราช จ.นครศรีธรรมราช,12:00 น.,20.8,8.39973330380433,99.83318746089935
บ้านเขาแงน,ต.วังตะกอ อ.หลังสวน จ.ชุมพร,11:00 น.,20.5,10.003618978784177,99.02999997138977
บ้านเขาหลัก,ต.ปากฉลุย อ.ท่าฉาง จ.สุราษฎร์ธานี,11:00 น.,20,9.42309480346886,98.92899870872498
อบต.ขุนทะเล,ต.ขุนทะเล อ.ลานสกา จ.นครศรีธรรมราช,12:00 น.,19.8,8.338826849818888,99.85211312770844
บ้านจุฬาภรณ์พัฒนา,ต.เขาพระ อ.พิปูน จ.นครศรีธรรมราช,11:00 น.,19.5,8.594319032785025,99.57300245761871
บ้านดอกแดง,ต.บางไทร อ.ตะกั่วป่า จ.พังงา,11:00 น.,19,8.76229683729498,98.32100093364716
บ้านหน้าเขา,ต.บ้านเสด็จ อ.เคียนซา จ.สุราษฎร์ธานี,11:00 น.,18.5,8.768393868250856,99.05316352844238
หลังสวน,ต.ขันเงิน อ.หลังสวน จ.ชุมพร,12:00 น.,18.2,9.953406787685166,99.06440734863281
บ้านเทพนิมิตร,ต.ปากฉลุย อ.ท่าฉาง จ.สุราษฎร์ธานี,11:00 น.,18,9.37046154216107,98.86000156402588
บ้านใสเขือ,ต.เขาพระ อ.พิปูน จ.นครศรีธรรมราช,11:00 น.,18,8.620860229635408,99.59500193595886
บ้านวังนาใน,ต.ทุ่งหว้า อ.ทุ่งหว้า จ.สตูล,11:00 น.,18,7.135641679451501,99.93699967861176
บ้านสามแยกอินทรีทอง,ต.คลองพา อ.ท่าชนะ จ.สุราษฎร์ธานี,11:00 น.,17.5,9.684294404382422,98.9409989118576
บ้านละหาด,ต.แม่หวาด อ.ธารโต จ.ยะลา,11:00 น.,17.5,6.0073946125012645,101.19423687458038
ศูนย์พัฒนาเด็กเล็ก อบต.ท่านา,ต.ท่านา อ.กะปง จ.พังงา,12:00 น.,17,8.678465815115747,98.41659486293793
บ้านวังประจัน,ต.วังประจัน อ.ควนโดน จ.สตูล,11:00 น.,17,6.754096598545849,100.14900147914886
เขตรักษาพันธุ์สัตว์ป่าฮาลา-บาลา,ต.โละจูด อ.แว้ง จ.นราธิวาส,12:00 น.,16.8,5.8074840957019775,101.84518218040466
สะพานบางไตประชาบริรักษ์,ต.ตะกุกเหนือ อ.วิภาวดี จ.สุราษฎร์ธานี,12:00 น.,16.6,9.282494078205549,98.87694776058197
สะพานตาบัว บ้านยาเด๊ะ,ต.ภูเขาทอง อ.สุคิริน จ.นราธิวาส,12:00 น.,16,5.827587782935213,101.75235092639923
บ้านเชือกน้ำ,ต.ถ้ำ อ.ตะกั่วทุ่ง จ.พังงา,11:00 น.,16,8.413350503382208,98.42573046684265
ที่ว่าการอำเภอเบตง จ.ยะลา,ต.เบตง อ.เบตง จ.ยะลา,11:00 น.,16,5.773044125251569,101.060711145401
บ้านดง*,ต.สาริกา อ.เมืองนครนายก จ.นครนายก,02:00 น.,15,14.32156513166611,101.30607426166534
หน่วยพิทักษ์ป่าคลองมอญ,ต.เขาพัง อ.บ้านตาขุน จ.สุราษฎร์ธานี,11:00 น.,15,9.080310051749054,98.63234102725983
อบต.ทุ่งคาวัด,ต.ทุ่งคาวัด อ.ละแม จ.ชุมพร,12:00 น.,14.6,9.74113000592051,99.02646481990814
หมู่บ้านปิยะมิตร 3,ต.อัยเยอร์เวง อ.เบตง จ.ยะลา,12:00 น.,14.6,5.934226092018083,101.1087441444397
บ้านค่าย,ต.ตาขัน อ.บ้านค่าย จ.ระยอง,12:00 น.,14.4,12.706832692185786,101.30043625831604
บ้านห้วยน้ำใส,ต.สบเมย อ.สบเมย จ.แม่ฮ่องสอน,11:00 น.,14,17.866228481753662,97.84502685070038
บ้านแม่ทะบน,ต.ประสงค์ อ.ท่าชนะ จ.สุราษฎร์ธานี,11:00 น.,14,9.611513452365541,98.9409989118576
อบต.บ้านพราน,ต.บ้านพราน อ.แสวงหา จ.อ่างทอง,12:00 น.,13.2,14.702194679342027,100.29819667339325
ที่ทำการน้ำตกนางรอง,ต.นาหินลาด อ.ปากพลี จ.นครนายก,02:00 น.,13,14.333358417064783,101.3209980726242
อบต.นาหินลาด,ต.นาหินลาด อ.ปากพลี จ.นครนายก,12:00 น.,12.8,14.207243734365141,101.35063111782074
อบต.แก้ง,ต.แก้ง อ.เดชอุดม จ.อุบลราชธานี,12:00 น.,12.8,14.710294208956139,105.01801013946533
บ้านแม่สุริน,ต.ขุนยวม อ.ขุนยวม จ.แม่ฮ่องสอน,11:00 น.,12.5,18.91611649372713,97.94400036334991
สถานีวิจัยต้นน้ำตาปี,ต.กะทูน อ.พิปูน จ.นครศรีธรรมราช,12:00 น.,12.4,8.594048519215711,99.55768167972565
รร.ผังปาล์ม 4,ต.ปาล์มพัฒนา อ.มะนัง จ.สตูล,12:00 น.,12.2,7.022373037559082,99.93093252182007
เมืองสตูล,ต.ฉลุง อ.เมืองสตูล จ.สตูล,12:00 น.,12,6.7266661245663375,100.0625592470169
บ้านเขาวง,ต.ปากแพรก อ.ดอนสัก จ.สุราษฎร์ธานี,11:00 น.,12,9.089844870002732,99.7559666633606
บ้านไร่ยาว,ต.ประสงค์ อ.ท่าชนะ จ.สุราษฎร์ธานี,11:00 น.,12,9.541906845024918,98.91300201416016
ชุมชนกุนุงจนอง,ต.เบตง อ.เบตง จ.ยะลา,11:00 น.,11.5,5.785340924659716,101.05644106864929
บ้านปางขุม,ต.ยั้งเมิน อ.สะเมิง จ.เชียงใหม่,11:00 น.,11.5,19.04629791573568,98.64899754524231
ภูเก็ต (ศูนย์ฯ),ต.ไม้ขาว อ.ถลาง จ.ภูเก็ต,10:00 น.,11.5,8.145000215301025,98.31444561481476
หน่วยพิทักษ์อุทยานฯ ที่ บล.๒ (น้ำตกฮาลาซะห์),ต.แม่หวาด อ.ธารโต จ.ยะลา,12:00 น.,11.4,6.058383754154758,101.40902280807495
ตะกั่วป่า,ต.ตำตัว อ.ตะกั่วป่า จ.พังงา,12:00 น.,11.2,8.775848014071634,98.39027166366577
ทะเลหมอก อัยเยอร์เวง,ต.อัยเยอร์เวง อ.เบตง จ.ยะลา,12:00 น.,11.2,5.9985438444070445,101.17656111717224
อบต.เกาะหลัก,ต.เกาะหลัก อ.เมืองประจวบคีรีขันธ์ จ.ประจวบคีรีขันธ์,12:00 น.,10.6,11.802965508215811,99.75460946559906
โครงการพัฒนาราษฎรชาวไทยภูเขา ฯ บ้านปางคอง,ต.นาปู่ป้อม อ.ปางมะผ้า จ.แม่ฮ่องสอน,11:00 น.,10.6,19.77284725350245,98.04207801818848
ส.คลองสำโรง,ต.เทพารักษ์ อ.เมืองสมุทรปราการ จ.สมุทรปราการ,12:00 น.,10.5,13.648191898914314,100.59513866901398
จุดวัด ค.บางนา-ถ.ศรีนครินทร์,ต.บางนา อ.บางนา จ.กรุงเทพมหานคร,12:00 น.,10.5,13.661062302393612,100.63942193984985
บ้านโป่งไฮ,ต.แม่สลองใน อ.แม่ฟ้าหลวง จ.เชียงราย,11:00 น.,10,20.28771460470992,99.5440024137497
บ้านจันทรัตน์,ต.ยะรม อ.เบตง จ.ยะลา,11:00 น.,10,5.786995421443282,101.16164267063141
บ้านหุบเฉลา ,ต.เขากระปุก อ.ท่ายาง จ.เพชรบุรี,11:00 น.,10,12.66132215461291,99.65457916259766
บ้านควนโต๊ะเหลง,ต.ควนโดน อ.ควนโดน จ.สตูล,11:00 น.,10,6.80066464048702,100.07791221141815
บ้านกอบแก้ววัฒนาภิบาล,ต.ลำพูน อ.บ้านนาสาร จ.สุราษฎร์ธานี,11:00 น.,10,8.826411372844971,99.40797686576843
อบต.สองพี่น้อง,ต.สองพี่น้อง อ.แก่งกระจาน จ.เพชรบุรี,12:00 น.,10,12.8723151314092,99.68350946903229
ละงู,ต.ละงู อ.ละงู จ.สตูล,12:00 น.,9.6,6.885772005477622,99.80432689189911
สนามบินสุวรรณภูมิ,ต.หนองปรือ อ.บางพลี จ.สมุทรปราการ,10:00 น.,9.6,13.68638924535473,100.76749742031097
รัษฎา,ต.ควนเมา อ.รัษฎา จ.ตรัง,12:00 น.,9.6,7.964069396117323,99.59781289100647
บ้านมูเซอป่ากล้วย,ต.แม่ฟ้าหลวง อ.แม่ฟ้าหลวง จ.เชียงราย,11:00 น.,9,20.2987435387476,99.81100022792816
วัดปราการ,ต.ท่าขนอน อ.คีรีรัฐนิคม จ.สุราษฎร์ธานี,11:00 น.,9,9.030279889280804,98.96879196166992
อบต.บ้านแลง,ต.บ้านแลง อ.เมืองระยอง จ.ระยอง,12:00 น.,9,12.70019711796972,101.3347202539444
ทต.สว่างอารมณ์,ต.สว่างอารมณ์ อ.สว่างอารมณ์ จ.อุทัยธานี,12:00 น.,8.8,15.58535091392613,99.86512184143066
รร.วัดควนสีนวล,ต.นาข้าวเสีย อ.นาโยง จ.ตรัง,12:00 น.,8.6,7.527138500514921,99.73759353160858
บ้านเหนือคลองระแนะ,ต.เขาพระ อ.พิปูน จ.นครศรีธรรมราช,11:00 น.,8.5,8.589911231663603,99.62200105190277
บ้านใต้โตน,ต.บางสวรรค์ อ.พระแสง จ.สุราษฎร์ธานี,11:00 น.,8.5,8.62900149050225,98.98800194263458
ชุมพร,ต.ท่าตะเภา อ.เมืองชุมพร จ.ชุมพร,10:00 น.,8.2,10.498751619826477,99.18847024440765
พุนพิน 1,ต.ท่าข้าม อ.พุนพิน จ.สุราษฎร์ธานี,12:00 น.,8,9.131238924699506,99.25883531570435
หน่วยพิทักษ์อุทยานแห่งชาติที่ ทล.๑๑ (ไทยสามัคคี),ต.ไทยสามัคคี อ.วังน้ำเขียว จ.นครราชสีมา,12:00 น.,7.8,14.322968508030826,101.93308353424072
ผามออีแดง (อช.เขาพระวิหาร),ต.เสาธงชัย อ.กันทรลักษ์ จ.ศรีสะเกษ,12:00 น.,7.8,14.404422033884693,104.68800187110901
สะพานไอร์ปาโจ,ต.ภูเขาทอง อ.สุคิริน จ.นราธิวาส,12:00 น.,7.8,5.835683489812551,101.73494338989258
บ้านห้วยข้าวลีบ,ต.แม่วิน อ.แม่วาง จ.เชียงใหม่,11:00 น.,7.5,18.73900197725159,98.5399979352951
บ้านบางกา,ต.กะเปา อ.คีรีรัฐนิคม จ.สุราษฎร์ธานี,11:00 น.,7.5,9.011630697092807,98.91905307769775
สำนักงานเกษตรอำเภอบางสะพาน,ต.กำเนิดนพคุณ อ.บางสะพาน จ.ประจวบคีรีขันธ์,12:00 น.,7.4,11.241825593860401,99.48108315467834
อบต.คลองเฉลิม,ต.คลองเฉลิม อ.กงหรา จ.พัทลุง,12:00 น.,7.4,7.381901093381868,99.98011350631714
หน่วยพิทักษ์ป่าอ่าวท่ายาง,ต.เกาะหมาก อ.ปากพะยูน จ.พัทลุง,12:00 น.,7.4,7.420272272983743,100.33268988132477
อบต.ปากฉลุย,ต.ปากฉลุย อ.ท่าฉาง จ.สุราษฎร์ธานี,12:00 น.,7.2,9.300589087646006,99.02604103088379
ฝายคลองท่าเลา,ต.นาหลวงเสน อ.ทุ่งสง จ.นครศรีธรรมราช,12:00 น.,7.2,8.232626560423926,99.70778346061707
วัดคอกช้าง อ.ธารโต จ.ยะลา,ต.แม่หวาด อ.ธารโต จ.ยะลา,10:00 น.,7,6.0457889541143155,101.1600387096405
บางปะกง,ต.ท่าสะอ้าน อ.บางปะกง จ.ฉะเชิงเทรา,12:00 น.,7,13.548937509988422,101.00112855434418
บ้านท่ามะปราง,ต.นาหินลาด อ.ปากพลี จ.นครนายก,11:00 น.,7,14.222932627077714,101.35608673095703
บ้านห้วยโป่ง,ต.ห้วยโป่ง อ.เมืองแม่ฮ่องสอน จ.แม่ฮ่องสอน,11:00 น.,7,19.02632812448323,97.98399746417999
น้ำตกไทรคู่,ต.ทองมงคล อ.บางสะพาน จ.ประจวบคีรีขันธ์,12:00 น.,7,11.248086700351248,99.33547675609589
บ้านไสยาง,ต.เขาเจียก อ.เมืองพัทลุง จ.พัทลุง,11:00 น.,7,7.629326107773751,100.02501368522644
พิพิธภัณฑ์ธรรมชาติจัดการน้ำชุมชนฯ บ้านปากซวด,ต.พังกาญจน์ อ.พนม จ.สุราษฎร์ธานี,12:00 น.,6.6,8.900033387057677,98.80355715751648
บ้านคลองไชยใต้,ต.กะเปียด อ.ฉวาง จ.นครศรีธรรมราช,11:00 น.,6.5,8.50984585807437,99.45899784564972
บ้านหนักไทร*,ต.ช่อง อ.นาโยง จ.ตรัง,11:00 น.,6.5,7.539471213420921,99.75286602973938
คลองลำปลาทิว ลาดกระบัง,ต.ลาดกระบัง อ.ลาดกระบัง จ.กรุงเทพมหานคร,12:00 น.,6.4,13.740682601981208,100.79468429088593
สนามทับทุ่ม บ้านวังนาใน หมู่ที่ 10,ต.น้ำผุด อ.ละงู จ.สตูล,12:00 น.,6.2,7.13570555388969,99.93731081485748
บ้านโก๊ะไม้หลู่,ต.ป่าแป๋ อ.แม่สะเรียง จ.แม่ฮ่องสอน,11:00 น.,6,18.28337231579222,98.08400094509125
บ้านพรุตู,ต.เกาะสะบ้า อ.เทพา จ.สงขลา,11:00 น.,6,6.800201219443361,100.88830947875977
บ้านบ่อน้ำร้อน,ต.ตาเนาะแมเราะ อ.เบตง จ.ยะลา,11:00 น.,6,5.849921403973601,101.07286155223846
บ้านคลองกั่ว,ต.เขาพระ อ.รัตภูมิ จ.สงขลา,11:00 น.,6,6.941358660693677,100.13299942016602
บ้านหัวบุ่ง,ต.เนินหอม อ.เมืองปราจีนบุรี จ.ปราจีนบุรี,11:00 น.,5.5,14.199401479893606,101.402907371521
บ้านย่านยาว,ต.เชี่ยวเหลียง อ.กะเปอร์ จ.ระนอง,11:00 น.,5.5,9.577555631627357,98.66617441177368
บ้านหนองน้ำเย็น*,ต.ทุ่งควายกิน อ.แกลง จ.ระยอง,11:00 น.,5.5,12.786534977662726,101.72631740570068
บ้านเคี่ยมเพาะ,ต.ปากฉลุย อ.ท่าฉาง จ.สุราษฎร์ธานี,11:00 น.,5.5,9.409282323786824,98.87299954891205
บ้านปาล์มทองพัฒนา,ต.ปาล์มพัฒนา อ.มะนัง จ.สตูล,11:00 น.,5.5,7.004132051006968,99.93900060653687
บ้านบางอี,ต.โคกเคียน อ.ตะกั่วป่า จ.พังงา,11:00 น.,5.5,8.836122478098506,98.38800251483917
บ้านต้นมะพร้าว,ต.ถ้ำสิงขร อ.คีรีรัฐนิคม จ.สุราษฎร์ธานี,11:00 น.,5.5,9.014539398556671,99.04858767986298
สรรพยา,ต.โพนางดำออก อ.สรรพยา จ.ชัยนาท,12:00 น.,5.4,15.109026973202491,100.2679306268692
บ้านคลองทราย,ต.วังน้ำเขียว อ.วังน้ำเขียว จ.นครราชสีมา,11:00 น.,5,14.364400534846226,101.75700187683105
บ้านใน,ต.ปากแพรก อ.ดอนสัก จ.สุราษฎร์ธานี,11:00 น.,5,9.122918125049006,99.67876195907593
บ้านแม่ปะ,ต.สะเมิงเหนือ อ.สะเมิง จ.เชียงใหม่,11:00 น.,5,18.955121223667778,98.74700009822845
บ้านบูโล๊ะสะนีแย,ต.บ้านแหร อ.ธารโต จ.ยะลา,11:00 น.,5,6.078227569056002,101.18834137916565
บ้านหัวเตย,ต.ท่าอุแท อ.กาญจนดิษฐ์ จ.สุราษฎร์ธานี,11:00 น.,5,9.040796124417039,99.71161901950836
บ้านหน้าซึง,ต.ปากฉลุย อ.ท่าฉาง จ.สุราษฎร์ธานี,11:00 น.,5,9.305713543283282,98.94960880279541
บ้านบันนังบูโบ,ต.ถ้ำทะลุ อ.บันนังสตา จ.ยะลา,11:00 น.,5,6.237538139952972,101.17429196834564
ชุมชนบ้านเหมือง,ต.อัยเยอร์เวง อ.เบตง จ.ยะลา,12:00 น.,5,5.923805427155755,101.12602293491364
บ้านบางสาว,ต.เขาวง อ.บ้านตาขุน จ.สุราษฎร์ธานี,11:00 น.,5,8.924761553414536,98.90944004058838
ที่ทำการอุทยานแห่งชาติถ้ำสะเกิน,ต.ยอด อ.สองแคว จ.น่าน,12:00 น.,4.6,19.38371981512924,100.53888738155365
สะพานข้ามคลองเกรียงไกร,ต.บางเคียน อ.ชุมแสง จ.นครสวรรค์,12:00 น.,4.6,15.843174832021225,100.2114862203598
บ้านชะรัด,ต.ชะรัด อ.กงหรา จ.พัทลุง,11:00 น.,4.5,7.471182196444906,99.97899770736694
