บ้านด่านสิงขร,ต.คลองวาฬ อ.เมืองประจวบคีรีขันธ์ จ.ประจวบคีรีขันธ์,23:00 น.,2.5,11.778058898158667,99.67399835586548
บ้านตามูล,ต.ทรายขาว อ.สอยดาว จ.จันทบุรี,23:00 น.,0.5,13.081176476715976,102.26099967956543
บ้านมรสวบ,ต.ชัยเกษม อ.บางสะพาน จ.ประจวบคีรีขันธ์,23:00 น.,1,11.404028337347011,99.49699938297272
นราธิวาส,ต.บางนาค อ.เมืองนราธิวาส จ.นราธิวาส,22:00 น.,14.5,6.416668634867312,101.81666493415833
บ้านแก่งลาด,ต.ห้วยเฮี้ย อ.นครไทย จ.พิษณุโลก,23:00 น.,0.5,16.959092690473803,100.92800080776215
บ้านน้ำปุก,ต.ขุนควร อ.ปง จ.พะเยา,14:00 น.,2,19.197002778061744,100.4610013961792
บ้านป่าเลา,ต.แม่หอพระ อ.แม่แตง จ.เชียงใหม่,14:00 น.,2,19.115093632500276,99.06899929046631
บ้านมอล่อง,ต.แม่สลองใน อ.แม่ฟ้าหลวง จ.เชียงราย,23:00 น.,2.5,20.21090290555916,99.63900089263916
บ้านม้งเก้าหลัง,ต.เทอดไทย อ.แม่ฟ้าหลวง จ.เชียงราย,23:00 น.,2,20.344088755427816,99.52099978923798
บ้านแม่รากกลาง,ต.บ้านตึก อ.ศรีสัชนาลัย จ.สุโขทัย,17:00 น.,1.5,17.58734587677372,99.81126844882965
บ้านวังขยาย,ต.ปรังเผล อ.สังขละบุรี จ.กาญจนบุรี,13:00 น.,2,14.941281160870552,98.61761033535004
บ้านไร่,ต.ห้วยเขย่ง อ.ทองผาภูมิ จ.กาญจนบุรี,23:00 น.,1,14.707321130609419,98.52779924869537
อบต.แม่วงก์,ต.แม่วงก์ อ.แม่วงก์ จ.นครสวรรค์,00:00 น.,14,15.781015720859656,99.54587459564209
อรัญประเทศ,ต.ป่าไร่ อ.อรัญประเทศ จ.สระแก้ว,22:00 น.,2,13.699997637471801,102.58333146572113
เหนือฝายยางบ้านเขว้า,ต.ปะเคียบ อ.คูเมือง จ.บุรีรัมย์,00:00 น.,2.2,15.412002017665568,103.10234427452087
อุ้มผาง,ต.อุ้มผาง อ.อุ้มผาง จ.ตาก,19:00 น.,0.4,16.024721491458873,98.86444330215454
เพชรบูรณ์,ต.ในเมือง อ.เมืองเพชรบูรณ์ จ.เพชรบูรณ์,16:00 น.,2,16.433332469910333,101.15000188350677
บ้านใหม่สามัคคี,ต.โคกล่าม อ.ลำปลายมาศ จ.บุรีรัมย์,18:00 น.,1.2,15.09716160187303,102.8668087720871
บ้านขุนแหง,ต.ปงเตา อ.งาว จ.ลำปาง,13:00 น.,2,18.84599979117474,99.99900162220001
ที่ทำการอุทยานแห่งชาติดอยขุนตาล,ต.ทาปลาดุก อ.แม่ทา จ.ลำพูน,00:00 น.,1.2,18.495639994236488,99.27014350891113
สำนักงานเกษตรอำเภอทุ่งยางแดง,ต.ตะโละแมะนา อ.ทุ่งยางแดง จ.ปัตตานี,00:00 น.,7,6.617051360879377,101.426682472229
ศาลากลางหมู่บ้านในล๊อค,ต.ทองมงคล อ.บางสะพาน จ.ประจวบคีรีขันธ์,00:00 น.,0.6,11.181038447200688,99.35544312000275
เขาพะเนินทุ่ง,ต.ห้วยแม่เพรียง อ.แก่งกระจาน จ.เพชรบุรี,16:00 น.,1.2,12.825301814126654,99.3655014038086
อบต.บางครก,ต.บางครก อ.บ้านแหลม จ.เพชรบุรี,15:00 น.,1.8,13.198668668764427,99.95052874088287
สุรินทร์,ต.ในเมือง อ.เมืองสุรินทร์ จ.สุรินทร์,13:00 น.,1.8,14.88333203516152,103.49999785423279
อบจ.เพชรบูรณ์,ต.ในเมือง อ.เมืองเพชรบูรณ์ จ.เพชรบูรณ์,17:00 น.,1.8,16.441256038272495,101.1490523815155
อุทยานแห่งชาติตาดโตน,ต.นาฝาย อ.เมืองชัยภูมิ จ.ชัยภูมิ,00:00 น.,30.8,15.984459609004578,102.03772723674774
อบต.จุมพล,ต.จุมพล อ.โพนพิสัย จ.หนองคาย,11:00 น.,0.2,18.059083936413018,103.0817449092865
อบจ.กำแพงเพชร,ต.อ่างทอง อ.เมืองกำแพงเพชร จ.กำแพงเพชร,00:00 น.,1,16.41086688245821,99.52196002006531
คลองกาแลกูโบ หมู่ที่ 1,ต.คลองใหม่ อ.ยะรัง จ.ปัตตานี,00:00 น.,2,6.738524974150383,101.25218331813812
ที่ทำการอุทยานแห่งชาติแจ้ซ้อน,ต.แจ้ซ้อน อ.เมืองปาน จ.ลำปาง,00:00 น.,1.2,18.836414457571195,99.47019338607788
กบินทร์บุรี,ต.กบินทร์ อ.กบินทร์บุรี จ.ปราจีนบุรี,04:00 น.,1.7,13.98333161553016,101.70722007751465
ทต.บูเก๊ะตา,ต.โละจูด อ.แว้ง จ.นราธิวาส,00:00 น.,1,5.848726030708529,101.88031375408173
โป่งน้ำร้อน,ต.หนองตาคง อ.โป่งน้ำร้อน จ.จันทบุรี,02:00 น.,0.6,13.036517764211583,102.38152742385864
อุบลราชธานี (ศูนย์ฯ),ต.ไร่น้อย อ.เมืองอุบลราชธานี จ.อุบลราชธานี,13:00 น.,1.6,15.24999839435214,104.86666917800903
บ้านขุนแม่ละอุปหมู่ที่ 3,ต.แจ่มหลวง อ.กัลยาณิวัฒนา จ.เชียงใหม่,16:00 น.,1.6,19.04022812437173,98.20028007030487
อบต.ปางกู่,ต.ปางกู่ อ.โนนสัง จ.หนองบัวลำภู,00:00 น.,2.8,17.02002018166838,102.59122788906097
ที่ว่าการอำเภอไม้แก่น,ต.ไทรทอง อ.ไม้แก่น จ.ปัตตานี,00:00 น.,2.2,6.610475722059233,101.66754484176636
อบต.หนองพันทา,ต.หนองพันทา อ.โซ่พิสัย จ.บึงกาฬ,00:00 น.,0.4,18.10735534361925,103.41308355331421
หน่วยจัดการต้นน้ำแม่จริม,ต.แม่จริม อ.แม่จริม จ.น่าน,00:00 น.,2.4,18.82128902813903,100.99951922893524
ชุมชนลีเล็ด,ต.ลีเล็ด อ.พุนพิน จ.สุราษฎร์ธานี,00:00 น.,1,9.191750866950516,99.25392687320709
ปตร.ตุยง,ต.ตุยง อ.หนองจิก จ.ปัตตานี,00:00 น.,2.8,6.8360004986771,101.17196381092072
อ่างเก็บน้ำห้วยส้ม,ต.โคกตูม อ.เมืองลพบุรี จ.ลพบุรี,22:00 น.,0.2,14.865253113755765,100.86128354072571
อบต.ห้วยโก๋น,ต.ห้วยโก๋น อ.เฉลิมพระเกียรติ จ.น่าน,00:00 น.,35.6,19.595129782898013,101.08571469783783
อุทยานแห่งชาติภูผาเทิบ,ต.นาสีนวน อ.เมืองมุกดาหาร จ.มุกดาหาร,00:00 น.,1.2,16.433425085193072,104.80252683162689
ทต.ดอนตาล,ต.ดอนตาล อ.ดอนตาล จ.มุกดาหาร,00:00 น.,1.8,16.31839933007644,104.91894543170929
เขตบึงกุ่ม,ต.คลองกุ่ม อ.บึงกุ่ม จ.กรุงเทพมหานคร,15:00 น.,1.5,13.785502404060805,100.6694895029068
บ้านโป่งเกตุ,ต.ขุนซ่อง อ.แก่งหางแมว จ.จันทบุรี,13:00 น.,1.5,13.146921781268546,101.97899758815765
บ้านห้วยข่อยหล่อย,ต.บ้านแซว อ.เชียงแสน จ.เชียงราย,23:00 น.,1.5,20.195754512069573,100.24100124835968
บ้านร้อง,ต.แม่เจดีย์ใหม่ อ.เวียงป่าเป้า จ.เชียงราย,23:00 น.,2,19.162868776140947,99.52000200748444
บ้านรวมไทยพัฒนาที่ 8,ต.รวมไทยพัฒนา อ.พบพระ จ.ตาก,15:00 น.,1.5,16.43512301829699,98.81999909877777
บ้านบาหรา,ต.ท่าก๊อ อ.แม่สรวย จ.เชียงราย,23:00 น.,4,19.51458332243889,99.4299978017807
บ้านธารโต,ต.ธารโต อ.ธารโต จ.ยะลา,23:00 น.,2,6.167819648920374,101.18200063705444
บ้านลางา,ต.ลางา อ.มายอ จ.ปัตตานี,23:00 น.,5,6.75011717186938,101.46441578865051
บ้านปากห้วยแม่ปะ,ต.แม่ปะ อ.แม่สอด จ.ตาก,23:00 น.,1,16.76017683474296,98.52699995040894
ราชบุรี,ต.อ่างทอง อ.เมืองราชบุรี จ.ราชบุรี,22:00 น.,1.6,13.489305494345757,99.79239106178284
บ้านตาเรืองล่าง,ต.ปะตง อ.สอยดาว จ.จันทบุรี,02:00 น.,0.5,13.20751056098763,102.16862976551056
บ้านผาแดง,ต.ทุ่งฮั้ว อ.วังเหนือ จ.ลำปาง,14:00 น.,1.5,19.210305875641176,99.67500150203705
บ้านหัวฝาย,ต.ชัยพฤกษ์ อ.เมืองเลย จ.เลย,23:00 น.,1.5,17.519617972557242,101.74800038337708
บ้านหมาก,ต.มวกเหล็ก อ.มวกเหล็ก จ.สระบุรี,20:00 น.,1.5,14.689004411310385,101.19799733161926
บ้านปาลอบาเต๊ะ,ต.ลุโบะบายะ อ.ยี่งอ จ.นราธิวาส,23:00 น.,2.5,6.422479187097014,101.6732257604599
บ้านใหม่พัฒนา,ต.ศรีสองรัก อ.เมืองเลย จ.เลย,23:00 น.,6.5,17.59418272666381,101.70499920845032
บ้านห้วยซ้อ,ต.ห้วยม่วง อ.ภูผาม่าน จ.ขอนแก่น,23:00 น.,49,16.76548280483011,101.9109982252121
บ้านใหม่สามัคคี,ต.ห้วยแย้ อ.หนองบัวระเหว จ.ชัยภูมิ,23:00 น.,8.5,15.933042771435813,101.69900178909302
บ้านสระเกศ,ต.ตลิ่งงาม อ.เกาะสมุย จ.สุราษฎร์ธานี,16:00 น.,1.5,9.48071491989027,99.95309293270111
บ้านดอยช้าง,ต.วาวี อ.แม่สรวย จ.เชียงราย,23:00 น.,18.5,19.81957101550352,99.5579981803894
วัดยางชุม,ต.หาดขาม อ.กุยบุรี จ.ประจวบคีรีขันธ์,01:00 น.,1.4,12.09902348488344,99.7065281867981
คลองพระปรง,ต.ศาลาลำดวน อ.เมืองสระแก้ว จ.สระแก้ว,00:00 น.,1,13.937352498693727,101.92200064659119
เมืองยะลา,ต.ตาเซะ อ.เมืองยะลา จ.ยะลา,00:00 น.,5.6,6.675237142009569,101.28635466098785
อุทยานแห่งชาติภูผาม่าน,ต.นาหนองทุ่ม อ.ชุมแพ จ.ขอนแก่น,00:00 น.,0.4,16.758271169622347,101.96871936321259
อบต.บ้านพราน,ต.บ้านพราน อ.แสวงหา จ.อ่างทอง,00:00 น.,1.4,14.702194679342027,100.29819667339325
ศรีสาคร,ต.ศรีสาคร อ.ศรีสาคร จ.นราธิวาส,00:00 น.,3.2,6.22725666908869,101.49691343307495
ทต.บึงโขงหลง,ต.บึงโขงหลง อ.บึงโขงหลง จ.บึงกาฬ,00:00 น.,2.2,17.96806348758028,104.04946446418762
ทต.ท่าตะโก,ต.ท่าตะโก อ.ท่าตะโก จ.นครสวรรค์,00:00 น.,0.4,15.632454644939948,100.47480940818787
ทต.หนองขาหย่าง,ต.หนองขาหย่าง อ.หนองขาหย่าง จ.อุทัยธานี,19:00 น.,0.2,15.36230819537349,99.938485622406
ประโคนชัย,ต.ไพศาล อ.ประโคนชัย จ.บุรีรัมย์,00:00 น.,0.8,14.63301735124034,103.23046267032623
หน่วยพิทักษ์ป่าเขาช่องลม,ต.เขาคันทรง อ.ศรีราชา จ.ชลบุรี,00:00 น.,2.2,13.15716547262991,101.1146879196167
ทต.โคกภู,ต.โคกภู อ.ภูพาน จ.สกลนคร,00:00 น.,1.6,17.006288085400882,103.91594409942627
ทต.สังคม,ต.แก้งไก่ อ.สังคม จ.หนองคาย,01:00 น.,1.4,18.068590364079775,102.26268947124481
อบต.บานา,ต.บานา อ.เมืองปัตตานี จ.ปัตตานี,00:00 น.,2.8,6.89127877338097,101.26467704772949
ทต.โกสุมพิสัย,ต.หัวขวาง อ.โกสุมพิสัย จ.มหาสารคาม,00:00 น.,2.8,16.243028983701493,103.06309282779694
สถานีฟาร์มตัวอย่างฯ บ้านลุตง,ต.ปากล่อ อ.โคกโพธิ์ จ.ปัตตานี,00:00 น.,6.8,6.657872711307783,101.24634146690369
เชียรใหญ่,ต.การะเกด อ.เชียรใหญ่ จ.นครศรีธรรมราช,16:00 น.,0.4,8.089487752082738,100.12787640094757
อบต.ศรีมงคล,ต.ศรีมงคล อ.ไทรโยค จ.กาญจนบุรี,00:00 น.,0.2,14.02271787432041,99.19147968292236
อบต.พบพระ,ต.พบพระ อ.พบพระ จ.ตาก,00:00 น.,0.2,16.416182497605423,98.68692934513092
ทต.คลองลานพัฒนา,ต.คลองลานพัฒนา อ.คลองลาน จ.กำแพงเพชร,00:00 น.,4,16.12253200886646,99.32931303977966
อบต.แม่คง,ต.แม่คง อ.แม่สะเรียง จ.แม่ฮ่องสอน,00:00 น.,0.2,18.16087893288025,97.91760742664337
ทต.ช้างเผือก,ต.ช้างเผือก อ.เมืองเชียงใหม่ จ.เชียงใหม่,00:00 น.,1.4,18.81010274919089,98.96994531154633
อบต.ท่าแยก,ต.ท่าแยก อ.เมืองสระแก้ว จ.สระแก้ว,11:00 น.,1,13.907689234112915,102.09394633769989
ทต.ทับช้าง,ต.ทับช้าง อ.สอยดาว จ.จันทบุรี,02:00 น.,0.2,13.23460873162573,102.18733012676239
ทต.บ้านนา,ต.บ้านนา อ.แกลง จ.ระยอง,14:00 น.,1.2,12.826844831138816,101.66963696479797
เขื่อนน้ำพุง บ้านคำเพิ่ม ,ต.หลุบเลา อ.ภูพาน จ.สกลนคร,23:00 น.,7,16.97248961167977,103.98337483406067
บ้านเหล้า,ต.เกาะแต้ว อ.เมืองสงขลา จ.สงขลา,23:00 น.,7,7.129908912817271,100.62500238418579
ประปาหมู่บ้านมหาราช,ต.แม่พูล อ.ลับแล จ.อุตรดิตถ์,00:00 น.,5,17.744727065631768,100.00750958919525
รร.บ้านข้าวแป้ง,ต.วาใหญ่ อ.อากาศอำนวย จ.สกลนคร,00:00 น.,0.2,17.689247898792523,103.94655883312225
บ้านแม่กำปอง,ต.ห้วยแก้ว อ.แม่ออน จ.เชียงใหม่,17:00 น.,1,18.86589472021234,99.3530023097992
บ้านกลาง,ต.ห้วยโป่ง อ.เมืองแม่ฮ่องสอน จ.แม่ฮ่องสอน,13:00 น.,1,19.060571446082193,97.88199841976166
บ้านตะบกเตี้ย,ต.ฉมัน อ.มะขาม จ.จันทบุรี,23:00 น.,2,12.822393592911787,102.23400056362152
บ้านนอกด่าน,ต.แม่พูล อ.ลับแล จ.อุตรดิตถ์,23:00 น.,5,17.715699350013672,99.98700141906738
ท่อทองแดง1,ต.หนองปลิง อ.เมืองกำแพงเพชร จ.กำแพงเพชร,00:00 น.,5.2,16.497102867262555,99.51962113380432
บ้านเหนือคลอง,ต.บ้านส้อง อ.เวียงสระ จ.สุราษฎร์ธานี,23:00 น.,2,8.634188469621371,99.41799759864807
บ้านห้วยโป่ง,ต.ห้วยมุ่น อ.น้ำปาด จ.อุตรดิตถ์,17:00 น.,1,17.768478158414997,100.88200092315674
บ้านห้วยไคร้,ต.แม่คะ อ.ฝาง จ.เชียงใหม่,23:00 น.,13.5,19.81221281918131,99.21899914741516
วัดวังตะเคียน,ต.ท่าสายลวด อ.แม่สอด จ.ตาก,09:00 น.,0.8,16.711486500252356,98.50664734840393
เมืองเลย,ต.ชัยพฤกษ์ อ.เมืองเลย จ.เลย,00:00 น.,0.8,17.509360936877883,101.73663318157196
บ้านห้วยพัฒนา,ต.บ้านแปะ อ.จอมทอง จ.เชียงใหม่,13:00 น.,1,18.220816687601438,98.6790007352829
บ้านห้วยธนู,ต.ตาลชุม อ.ท่าวังผา จ.น่าน,21:00 น.,0.5,19.026307839079063,100.75199961662292
บ้านกองขากหลวง,ต.สะเมิงใต้ อ.สะเมิง จ.เชียงใหม่,23:00 น.,0.5,18.91536543638027,98.72200191020966
บ้านหนองหอย,ต.แม่แรม อ.แม่ริม จ.เชียงใหม่,23:00 น.,7.5,18.93018299350249,98.82400095462799
บ้านห้วยละเบ้ายา,ต.สะเนียน อ.เมืองน่าน จ.น่าน,23:00 น.,0.5,18.918658903277183,100.62199831008911
บ้านเหนือคลอง,ต.ช้างซ้าย อ.กาญจนดิษฐ์ จ.สุราษฎร์ธานี,11:00 น.,1,8.948523604886994,99.47099804878235
อ.ตระการพืชผล,ต.ขุหลุ อ.ตระการพืชผล จ.อุบลราชธานี,23:00 น.,22,15.614920528945607,105.01613795757294
บ้านหัวเตย,ต.ท่าอุแท อ.กาญจนดิษฐ์ จ.สุราษฎร์ธานี,23:00 น.,3.5,9.040796124417039,99.71161901950836
บ้านใหม่ราษฎร์บำรุง,ต.สันโค้ง อ.ดอกคำใต้ จ.พะเยา,14:00 น.,1,19.173879373438854,100.07099747657776
บ้านคอกช้าง,ต.ปากแพรก อ.ดอนสัก จ.สุราษฎร์ธานี,13:00 น.,1,9.218206370202212,99.68754887580872
เชียงราย สกษ.,ต.ป่าอ้อดอนชัย อ.เมืองเชียงราย จ.เชียงราย,22:00 น.,1.9,19.870831727792645,99.78277802467346
บ้านเขาวง,ต.ปากแพรก อ.ดอนสัก จ.สุราษฎร์ธานี,13:00 น.,0.5,9.089844870002732,99.7559666633606
บ้านบือจะ,ต.พิเทน อ.ทุ่งยางแดง จ.ปัตตานี,23:00 น.,15,6.656689840132462,101.45186305046082
เทศบาลตำบลหอไกร,ต.หอไกร อ.บางมูลนาก จ.พิจิตร,00:00 น.,0.6,16.050149118617867,100.37378668785095
บ้านสำนักเนียน,ต.เขาน้อย อ.สิชล จ.นครศรีธรรมราช,11:00 น.,1,8.934703224529219,99.69999969005585
บ้านน้ำฉา,ต.เทพราช อ.สิชล จ.นครศรีธรรมราช,23:00 น.,4.5,8.897314564569934,99.83000099658966
บ้านห้วยโป่ง,ต.ห้วยโป่ง อ.เมืองแม่ฮ่องสอน จ.แม่ฮ่องสอน,13:00 น.,1,19.02632812448323,97.98399746417999
บ้านมหาวัน,ต.มหาวัน อ.แม่สอด จ.ตาก,21:00 น.,0.5,16.577567806915333,98.59499931335449
อบต.ศรีเทพ,ต.ศรีเทพ อ.ศรีเทพ จ.เพชรบูรณ์,19:00 น.,1,15.437904508162791,101.16249024868011
บ้านห้วยบงใหม่,ต.แม่จะเรา อ.แม่ระมาด จ.ตาก,09:00 น.,0.5,16.879871788936622,98.5779994726181
บ้านบ่อหลวง,ต.บ่อเกลือใต้ อ.บ่อเกลือ จ.น่าน,23:00 น.,6,19.152095616902706,101.15500152111053
บ้านหัวพุ,ต.วังข่อย อ.ไพศาลี จ.นครสวรรค์,18:00 น.,1,15.564190241670211,100.70599973201752
บ้านห่างทางหลวง,ต.ภูฟ้า อ.บ่อเกลือ จ.น่าน,22:00 น.,1,19.02543556408463,101.20400011539459
บ้านคลองใหญ่,ต.จันทเขลม อ.เขาคิชฌกูฏ จ.จันทบุรี,15:00 น.,1,12.972159724378912,102.05771505832672
บ้านห้วยน้ำใส,ต.สบเมย อ.สบเมย จ.แม่ฮ่องสอน,23:00 น.,0.5,17.866228481753662,97.84502685070038
บ้านเปียงซ้อ,ต.ขุนน่าน อ.เฉลิมพระเกียรติ จ.น่าน,23:00 น.,4.5,19.38189807894673,101.1870002746582
บ้านดอยล้าน,ต.วาวี อ.แม่สรวย จ.เชียงราย,12:00 น.,0.5,19.763825975078014,99.56100225448608
บ้านสบก๋าย,ต.กื้ดช้าง อ.แม่แตง จ.เชียงใหม่,23:00 น.,13.5,19.23417377822231,98.78300070762634
บ้านโคกสว่าง,ต.ศรีสองรัก อ.เมืองเลย จ.เลย,23:00 น.,8,17.6581103282789,101.70299828052521
บ้านทุ่งรวงทอง,ต.แม่ลาน้อย อ.แม่ลาน้อย จ.แม่ฮ่องสอน,12:00 น.,1,18.338043524218733,97.91999995708466
บ้านขุนยวม,ต.ขุนยวม อ.ขุนยวม จ.แม่ฮ่องสอน,16:00 น.,1,18.81796318160443,97.93499886989594
บ้านบึงเหนือ,ต.บ้านคา อ.บ้านคา จ.ราชบุรี,11:00 น.,1,13.45423806400851,99.37399864196777
รร.วัดทายิการาม,ต.การะเกด อ.เชียรใหญ่ จ.นครศรีธรรมราช,17:00 น.,0.2,8.08212127333945,100.16427934169769
บ้านหนองผักบุ้ง,ต.นายม อ.เมืองเพชรบูรณ์ จ.เพชรบูรณ์,23:00 น.,1,16.250666717612084,101.12699925899506
บ้านไร่พัฒนา,ต.วะตะแบก อ.เทพสถิต จ.ชัยภูมิ,22:00 น.,0.5,15.538065823982933,101.41799747943878
บ้านท่าข้าม,ต.แก่งโสภา อ.วังทอง จ.พิษณุโลก,23:00 น.,0.5,16.854994200622432,100.66700041294098
ทต.ตะเคียนทอง,ต.ตะเคียนทอง อ.เขาคิชฌกูฏ จ.จันทบุรี,15:00 น.,1,12.91309226798377,102.08152770996094
นายายอาม,ต.วังใหม่ อ.นายายอาม จ.จันทบุรี,00:00 น.,0.2,12.72247375053303,101.95599496364594
บ้านร่มเกล้าสหมิตร,ต.คีรีราษฎร์ อ.พบพระ จ.ตาก,16:00 น.,0.5,16.481455443224544,98.83999764919281
บ้านเสรีราษฎร์,ต.ช่องแคบ อ.พบพระ จ.ตาก,13:00 น.,0.5,16.49686626253541,98.74700009822845
บ้านสันติสุข,ต.ดงรัก อ.ภูสิงห์ จ.ศรีสะเกษ,13:00 น.,1,14.500621926934414,104.21151280403137
ป่าต้นน้ำคลองมะเดื่อ อช.เขาใหญ่ (นางรอง),ต.สาริกา อ.เมืองนครนายก จ.นครนายก,21:00 น.,1,14.36930098143796,101.27120018005371
บ้านแม่น้ำ,ต.แม่น้ำ อ.เกาะสมุย จ.สุราษฎร์ธานี,17:00 น.,0.5,9.565865314931276,99.99514997005463
