ชื่อสถานี,ที่ตั้ง,เวลา,ฝนล่าสุด (มม.)
สถานีทต.วังใหม่,ต.วังใหม่ อ.เมืองชุมพร จ.ชุมพร ,06:00 ,82.2
สถานีเคียนซา,ต.เคียนซา อ.เคียนซา จ.สุราษฎร์ธานี ,05:00 ,72
สถานีสะพานกะลูบี บ้านสายปารี,ต.มาโมง อ.สุคิริน จ.นราธิวาส ,03:00 ,66.2
สถานีบ้านสามแยกอินทรีทอง,ต.คลองพา อ.ท่าชนะ จ.สุราษฎร์ธานี ,05:00 ,63
สถานีบ้านหัวเตย,ต.ท่าอุแท อ.กาญจนดิษฐ์ จ.สุราษฎร์ธานี ,05:00 ,61
สถานีอุทยานแห่งชาติแม่เมย,ต.แม่สอง อ.ท่าสองยาง จ.ตาก ,03:00 ,60.8
สถานีบ้านห้วยกุ้ง,ต.ป่าโปง อ.สบเมย จ.แม่ฮ่องสอน ,05:00 ,57.5
สถานีบ้านราษฎร์ผดุง,ต.สุคิริน อ.สุคิริน จ.นราธิวาส ,05:00 ,50.5
สถานีเขตห้ามล่าสัตว์ป่าเขาชีโอน,ต.นาจอมเทียน อ.สัตหีบ จ.ชลบุรี ,06:00 ,50.4
สถานีบ้านเหล่ากอหก,ต.เหล่ากอหก อ.นาแห้ว จ.เลย ,05:00 ,48
สถานีสะพานบ้านสวนปราง,ต.คลองสระ อ.กาญจนดิษฐ์ จ.สุราษฎร์ธานี ,03:00 ,46.6
สถานีบ้านแม่แมะ,ต.แม่แรม อ.แม่ริม จ.เชียงใหม่ ,05:00 ,46.5
สถานีบ้านท่าข้าม,ต.แก่งโสภา อ.วังทอง จ.พิษณุโลก ,05:00 ,46.5
สถานีอบต.ตะปาน,ต.ตะปาน อ.พุนพิน จ.สุราษฎร์ธานี ,06:00 ,45.6
สถานีบ้านห้วยคอม,ต.น้ำไผ่ อ.น้ำปาด จ.อุตรดิตถ์ ,02:00 ,44.5
สถานีสะพานทางเข้าชุมชนบ้านปากซวด,ต.พังกาญจน์ อ.พนม จ.สุราษฎร์ธานี ,03:00 ,44.4
สถานีที่ว่าการอำเภอสุคีริน,ต.สุคิริน อ.สุคิริน จ.นราธิวาส ,06:00 ,44.4
สถานีบ้านขุนวาง,ต.แม่วิน อ.แม่วาง จ.เชียงใหม่ ,05:00 ,43
สถานีสะพานท่าสำเภา,ต.ชัยบุรี อ.เมืองพัทลุง จ.พัทลุง ,03:00 ,43
สถานีรร.บ้านช้างเชื่อ,ต.เหล อ.กะปง จ.พังงา ,06:00 ,42.8
สถานีสุคิริน,ต.มาโมง อ.สุคิริน จ.นราธิวาส ,03:00 ,42.6
สถานีบ้านปลายคลองวัน,ต.ปากจั่น อ.กระบุรี จ.ระนอง ,05:00 ,42.5
สถานีสะพานตาบัว บ้านยาเด๊ะ,ต.ภูเขาทอง อ.สุคิริน จ.นราธิวาส ,03:00 ,41.8
สถานีบ้านซับชมพู่,ต.สระแก้ว อ.บึงสามพัน จ.เพชรบูรณ์ ,05:00 ,41.5
สถานีบ้านซับสมบูรณ์,ต.แซร์ออ อ.วัฒนานคร จ.สระแก้ว ,05:00 ,39.5
สถานีบ้านหนองผักกูด,ต.ห้วยใหญ่ อ.บางละมุง จ.ชลบุรี ,05:00 ,39.5
สถานีหน่วยจัดการต้นน้ำตาปี,ต.ตะกุกใต้ อ.วิภาวดี จ.สุราษฎร์ธานี ,06:00 ,39.2
สถานีที่ว่าการอำเภอเบตง จ.ยะลา,ต.เบตง อ.เบตง จ.ยะลา ,05:00 ,39
สถานีจุดวัด ค.บางเชือกหนัง-วัดปากน้ำฝั่งใต้,ต.บางแวก อ.ภาษีเจริญ จ.กรุงเทพมหานคร ,04:00 ,39
สถานีสะพานไอร์ปาโจ,ต.ภูเขาทอง อ.สุคิริน จ.นราธิวาส ,03:00 ,37.6
สถานีบ้านคลองพร้าว,ต.เกาะช้าง อ.เกาะช้าง จ.ตราด ,05:00 ,37
สถานีบ้านมะขาม ,ต.ท่าอุแท อ.กาญจนดิษฐ์ จ.สุราษฎร์ธานี ,05:00 ,37
สถานีอบต.โคคลาน,ต.โคคลาน อ.ตาพระยา จ.สระแก้ว ,06:00 ,36.8
สถานีบ้านใหม่สามัคคี,ต.นิคมพัฒนา อ.นิคมพัฒนา จ.ระยอง ,05:00 ,36.5
สถานีบ้านน้ำเย็น,ต.หินแก้ว อ.ท่าแซะ จ.ชุมพร ,06:00 ,35.4
สถานีบ้านโป่งช้าง,ต.หนองปรือ อ.หนองปรือ จ.กาญจนบุรี ,05:00 ,35
สถานีบ้านเขาจอมแห,ต.มะขามคู่ อ.นิคมพัฒนา จ.ระยอง ,05:00 ,35
สถานีบ้านห้วยแก้ว,ต.นาสัก อ.สวี จ.ชุมพร ,05:00 ,35
สถานีคลองพระปรง,ต.บ้านนา อ.กบินทร์บุรี จ.ปราจีนบุรี ,03:00 ,34.8
สถานีบ้านสวนปราง,ต.คลองสระ อ.กาญจนดิษฐ์ จ.สุราษฎร์ธานี ,05:00 ,34.5
สถานีบ้านขุนน้ำคับ,ต.บ่อภาค อ.ชาติตระการ จ.พิษณุโลก ,05:00 ,34
สถานีจุดวัด ค.ทวีฯ-ค.บางเชือกหนัง,ต.บางไผ่ อ.บางแค จ.กรุงเทพมหานคร ,04:00 ,33
สถานีลานกีฬา อบต.วังโป่ง,ต.วังโป่ง อ.วังโป่ง จ.เพชรบูรณ์ ,06:00 ,32.6
สถานีบ้านพละ,ต.เขาไชยราช อ.ปะทิว จ.ชุมพร ,05:00 ,32.5
สถานีสุราษฎร์ธานี สกษ.,ต.ท่าอุแท อ.กาญจนดิษฐ์ จ.สุราษฎร์ธานี ,04:00 ,32.5
สถานีบ้านแผ่นดินเย็น,ต.แซร์ออ อ.วัฒนานคร จ.สระแก้ว ,05:00 ,32
สถานีบ้านดอนชัย,ต.แม่ทา อ.แม่ออน จ.เชียงใหม่ ,18:00 ,32
สถานีบ้านจำปาทอง,ต.บ้านทำเนียบ อ.คีรีรัฐนิคม จ.สุราษฎร์ธานี ,05:00 ,31.5
สถานีสะพานคลองพาย,ต.น้ำหัก อ.คีรีรัฐนิคม จ.สุราษฎร์ธานี ,03:00 ,30
สถานีที่ทำการอุทยานฯเขาใหญ่,ต.นาหินลาด อ.ปากพลี จ.นครนายก ,05:00 ,30
สถานีลำน้ำสานบ้านทุ่งยาวเหนือ,ต.ศรีบัวบาน อ.เมืองลำพูน จ.ลำพูน ,03:00 ,30
สถานีอบต.เหล่ากอหก,ต.เหล่ากอหก อ.นาแห้ว จ.เลย ,06:00 ,29.8
สถานีบ้านทุ่งม่วง,ต.ทับไทร อ.โป่งน้ำร้อน จ.จันทบุรี ,05:00 ,29.5
สถานีอบต.เขาไชยราช,ต.เขาไชยราช อ.ปะทิว จ.ชุมพร ,06:00 ,28.8
สถานีภูเก็ต (ศูนย์ฯ),ต.ไม้ขาว อ.ถลาง จ.ภูเก็ต ,04:00 ,28.7
สถานีอบต.เขาค่าย,ต.เขาค่าย อ.สวี จ.ชุมพร ,06:00 ,28.6
สถานีบ้านห้วยตลาด,ต.ท่าด้วง อ.หนองไผ่ จ.เพชรบูรณ์ ,05:00 ,28.5
สถานีบ้านไร่ยาว,ต.ประสงค์ อ.ท่าชนะ จ.สุราษฎร์ธานี ,05:00 ,28
สถานีอ่างฯหนองกุดใหญ่,ต.หนองเต็ง อ.กระสัง จ.บุรีรัมย์ ,06:00 ,27.8
สถานีหน่วยศึกษาการพัฒนาการอนุรักษ์ต้นน้ำน้ำคาง (ดอยวาว),ต.ป่าคา อ.ท่าวังผา จ.น่าน ,03:00 ,26.8
สถานีบ้านหนองผักแว่น,ต.ทัพราช อ.ตาพระยา จ.สระแก้ว ,05:00 ,26.5
สถานีอบต.ทัพราช,ต.ทัพราช อ.ตาพระยา จ.สระแก้ว ,06:00 ,26.4
สถานีบ้านเทพนิมิตร,ต.ปากฉลุย อ.ท่าฉาง จ.สุราษฎร์ธานี ,05:00 ,25.5
สถานีอบต.น้ำมวบ,ต.น้ำมวบ อ.เวียงสา จ.น่าน ,06:00 ,25.4
สถานีบ้านหน้าถ้ำ,ต.นาเหรง อ.นบพิตำ จ.นครศรีธรรมราช ,05:00 ,25
สถานีบ้านวังรี,ต.เขาพระ อ.เมืองนครนายก จ.นครนายก ,05:00 ,25
สถานีบ้านงอมถ้ำ,ต.ท่าแฝก อ.ท่าปลา จ.อุตรดิตถ์ ,05:00 ,25
สถานีบ้านกอไพล,ต.ท่าเคย อ.ท่าฉาง จ.สุราษฎร์ธานี ,05:00 ,24
สถานีบ้านน้ำหิน,ต.เชียงของ อ.นาน้อย จ.น่าน ,05:00 ,24
สถานีบ้านเจดีย์โคะ,ต.มหาวัน อ.แม่สอด จ.ตาก ,05:00 ,22.5
สถานีบ้านบุ่งผำ,ต.น้ำกุ่ม อ.นครไทย จ.พิษณุโลก ,05:00 ,22.5
สถานีสะพานข้ามน้ำมูล,ต.โขงเจียม อ.โขงเจียม จ.อุบลราชธานี ,03:00 ,22.4
สถานีอบต.นาน้อย,ต.นาน้อย อ.นาน้อย จ.น่าน ,06:00 ,22.4
สถานีหน่วยพิทักษ์อุทยานแห่งชาติที่ ตย.๑ (ทัพไทย),ต.ทัพไทย อ.ตาพระยา จ.สระแก้ว ,06:00 ,22.2
สถานีบ้านลำพิกุล,ต.นาชุมเห็ด อ.ย่านตาขาว จ.ตรัง ,05:00 ,22
สถานีบ้านโล๊ะดุหยง,ต.ศาลาด่าน อ.เกาะลันตา จ.กระบี่ ,05:00 ,22
สถานีอบต.หนองกง,ต.หนองกง อ.นางรอง จ.บุรีรัมย์ ,06:00 ,21.6
สถานีบ้านด่าน,ต.บ้านด่าน อ.อรัญประเทศ จ.สระแก้ว ,05:00 ,21.5
สถานีทต.โป่งน้ำร้อน,ต.ทับไทร อ.โป่งน้ำร้อน จ.จันทบุรี ,06:00 ,21.4
สถานีส.คลองบางกอกใหญ่,ต.วัดอรุณ อ.บางกอกใหญ่ จ.กรุงเทพมหานคร ,04:00 ,21
สถานีบ้านอมพาย,ต.ป่าแป๋ อ.แม่สะเรียง จ.แม่ฮ่องสอน ,05:00 ,21
สถานีรร.พนาสวรรค์,ต.ภูคา อ.ปัว จ.น่าน ,06:00 ,20.8
สถานีอบต.ห้วยมุ่น,ต.ห้วยมุ่น อ.น้ำปาด จ.อุตรดิตถ์ ,06:00 ,20.6
สถานีสะพานข้ามคลองหวาด,ต.คลองสระ อ.กาญจนดิษฐ์ จ.สุราษฎร์ธานี ,03:00 ,20.2
สถานีบ้านหินสอ,ต.ปลาบ่า อ.ภูเรือ จ.เลย ,05:00 ,20
สถานีบ้านวัฒนานคร,ต.วัฒนานคร อ.วัฒนานคร จ.สระแก้ว ,05:00 ,20
สถานีบ้านโตนปาหนัน,ต.ทุ่งนุ้ย อ.ควนกาหลง จ.สตูล ,05:00 ,19.5
สถานีจุดวัด ค.บางเชือกหนัง-ถ.พุทธมณฑลสาย 1,ต.คลองขวาง อ.ภาษีเจริญ จ.กรุงเทพมหานคร ,04:00 ,19.5
สถานีบ้านห้วยมุ่น,ต.ห้วยมุ่น อ.น้ำปาด จ.อุตรดิตถ์ ,05:00 ,19
สถานีบ้านนาวัง,ต.ตะเคียนเตี้ย อ.บางละมุง จ.ชลบุรี ,05:00 ,19
สถานีอบต.โนนกอก,ต.โนนกอก อ.เกษตรสมบูรณ์ จ.ชัยภูมิ ,06:00 ,18.8
สถานีรร.ภูคาวิทยาคม,ต.ภูคา อ.ปัว จ.น่าน ,03:00 ,18.6
สถานีบ้านไร่พัฒนา,ต.วะตะแบก อ.เทพสถิต จ.ชัยภูมิ ,05:00 ,18.5
สถานีสะพานวังแก่ง,ต.เขาเพิ่ม อ.บ้านนา จ.นครนายก ,03:00 ,18.4
สถานีอบต.บุพราหมณ์,ต.บุพราหมณ์ อ.นาดี จ.ปราจีนบุรี ,06:00 ,18.4
สถานีบ้านจองอัว,ต.ปรังเผล อ.สังขละบุรี จ.กาญจนบุรี ,05:00 ,18
สถานีหมู่บ้านเศรษฐกิจ ซอย 26,ต.บางแคเหนือ อ.บางแค จ.กรุงเทพมหานคร ,04:00 ,18
สถานีบ้านเทพพนม,ต.กระบี่น้อย อ.เมืองกระบี่ จ.กระบี่ ,05:00 ,18
สถานีบ้านแม่เหาะ,ต.แม่เหาะ อ.แม่สะเรียง จ.แม่ฮ่องสอน ,05:00 ,17.5
สถานีส.คลองมอญ,ต.วัดอรุณ อ.บางกอกใหญ่ จ.กรุงเทพมหานคร ,04:00 ,17
สถานีบ้านบ่อโพธิ์,ต.บ่อโพธิ์ อ.นครไทย จ.พิษณุโลก ,05:00 ,17
สถานีชุมชนกุนุงจนอง,ต.เบตง อ.เบตง จ.ยะลา ,05:00 ,17
สถานีทต.พลิ้ว,ต.พลิ้ว อ.แหลมสิงห์ จ.จันทบุรี ,06:00 ,16.4
สถานีบ้านน้ำรีพัฒนา,ต.ขุนน่าน อ.เฉลิมพระเกียรติ จ.น่าน ,05:00 ,16
สถานีทต.ปัถวี,ต.ปัถวี อ.มะขาม จ.จันทบุรี ,06:00 ,16
สถานีอบต.บ้านแลง,ต.บ้านแลง อ.เมืองระยอง จ.ระยอง ,06:00 ,16
สถานีคลองอ้อมนนท์ บางใหญ่ (ถนนบางกรวย-ไทรน้อย),ต.บางรักใหญ่ อ.บางบัวทอง จ.นนทบุรี ,03:00 ,16
สถานีบ้านสะโทย,ต.วังสรรพรส อ.ขลุง จ.จันทบุรี ,05:00 ,16
สถานีบ้านปางมะกง,ต.ปิงโค้ง อ.เชียงดาว จ.เชียงใหม่ ,05:00 ,15.5
สถานีบ้านเขาเหล็ก,ต.นบพิตำ อ.นบพิตำ จ.นครศรีธรรมราช ,05:00 ,15.5
สถานีบ้านบ่อน้ำร้อน,ต.ตาเนาะแมเราะ อ.เบตง จ.ยะลา ,05:00 ,15.5
สถานีบ้านตะบกเตี้ย,ต.ฉมัน อ.มะขาม จ.จันทบุรี ,05:00 ,15.5
สถานีบ้านบีกริม,ต.คลองทับจันทร์ อ.อรัญประเทศ จ.สระแก้ว ,05:00 ,15
สถานีอบต.ยะรม,ต.ยะรม อ.เบตง จ.ยะลา ,06:00 ,15
สถานีเขตรักษาพันธุ์สัตว์ป่าฮาลา-บาลา,ต.โละจูด อ.แว้ง จ.นราธิวาส ,06:00 ,15
สถานีบ้านหนองตาจอน,ต.ทุ่งหลวง อ.ปากท่อ จ.ราชบุรี ,06:00 ,14.8
สถานีอ่างเก็บน้ำห้วยดินทราย,ต.หนองแวง อ.ละหานทราย จ.บุรีรัมย์ ,06:00 ,14.8
สถานีบ้านเบญจา,ต.พลูเถื่อน อ.พนม จ.สุราษฎร์ธานี ,05:00 ,14.5
สถานีบ้านบึงไม้,ต.ชะอม อ.แก่งคอย จ.สระบุรี ,05:00 ,14.5
สถานีบ้านวังประดิษฐ์,ต.เขาค่าย อ.สวี จ.ชุมพร ,05:00 ,14.5
สถานีอบต.ปากฉลุย,ต.ปากฉลุย อ.ท่าฉาง จ.สุราษฎร์ธานี ,03:00 ,14.4
สถานีดอยอ่างขาง,ต.ม่อนปิ่น อ.ฝาง จ.เชียงใหม่ ,19:00 ,14.1
สถานีอบต.ศรีละกอ,ต.ศรีละกอ อ.จักราช จ.นครราชสีมา ,06:00 ,14
สถานีหน่วยพิทักษ์อุทยานแห่งชาติที่ ตม.๓ (ปูแป้),ต.พะวอ อ.แม่สอด จ.ตาก ,06:00 ,14
สถานีหน่วยพิทักษ์อุทยานแห่งชาติที่ ขญ.๑๐ (ประจันตคาม),ต.บุฝ้าย อ.ประจันตคาม จ.ปราจีนบุรี ,06:00 ,14
สถานีสถานีวิจัยต้นน้ำคีรีวง,ต.กำโลน อ.ลานสกา จ.นครศรีธรรมราช ,06:00 ,14
สถานีบ้านตามูล,ต.ทรายขาว อ.สอยดาว จ.จันทบุรี ,05:00 ,14
สถานีบ้านน้ำกิใต้,ต.ผาทอง อ.ท่าวังผา จ.น่าน ,05:00 ,14
สถานีบ้านหินลับ,ต.มวกเหล็ก อ.มวกเหล็ก จ.สระบุรี ,05:00 ,14
สถานีอบต.บ่อทอง,ต.บ่อทอง อ.บ่อทอง จ.ชลบุรี ,06:00 ,14
สถานีอบต.นาสวน,ต.นาสวน อ.ศรีสวัสดิ์ จ.กาญจนบุรี ,06:00 ,14
สถานีทต.เขาโจด,ต.เขาโจด อ.ศรีสวัสดิ์ จ.กาญจนบุรี ,06:00 ,13.6
สถานีบ้านขามป้อม,ต.ร่องจิก อ.ภูเรือ จ.เลย ,05:00 ,13.5
สถานีบ้านโกรกอีดก,ต.ชะอม อ.แก่งคอย จ.สระบุรี ,06:00 ,13.4
สถานีบ้านคลองสน,ต.เกาะช้าง อ.เกาะช้าง จ.ตราด ,05:00 ,13
สถานีคลองทวีวัฒนา ท้ายปตร.ทวีวัฒนา,ต.ศาลาธรรมสพน์ อ.ทวีวัฒนา จ.กรุงเทพมหานคร ,03:00 ,13
สถานีบ้านพันวาล 4,ต.รับร่อ อ.ท่าแซะ จ.ชุมพร ,05:00 ,13
สถานีบ้านเชี่ยวขวัญ,ต.ตะกุกเหนือ อ.วิภาวดี จ.สุราษฎร์ธานี ,05:00 ,13
สถานีบ้านค่าย,ต.ตาขัน อ.บ้านค่าย จ.ระยอง ,03:00 ,12.8
สถานีทต.ท่าตะโก,ต.ท่าตะโก อ.ท่าตะโก จ.นครสวรรค์ ,03:00 ,12.6
สถานีบ้านหลวง,ต.ยางเปียง อ.อมก๋อย จ.เชียงใหม่ ,05:00 ,12.5
สถานีบ้านนบ,ต.กรุงชิง อ.นบพิตำ จ.นครศรีธรรมราช ,05:00 ,12.5
สถานีบ้านน้ำยาง,ต.บ้านกลาง อ.วังทอง จ.พิษณุโลก ,05:00 ,12.5
สถานีบ้านตาบาด,ต.บ่อพลอย อ.บ่อไร่ จ.ตราด ,05:00 ,12.5
สถานีทต.บูเก๊ะตา,ต.โละจูด อ.แว้ง จ.นราธิวาส ,06:00 ,12.4
สถานีปัตตานี,ต.บ่อทอง อ.หนองจิก จ.ปัตตานี ,22:00 ,12.3
สถานีชุมชนบ้านควน 2,ต.ลำใหม่ อ.เมืองยะลา จ.ยะลา ,03:00 ,12.2
สถานีสะเดา,ต.พังลา อ.สะเดา จ.สงขลา ,03:00 ,12
สถานีบ้านคลองบน,ต.ลาดแค อ.ชนแดน จ.เพชรบูรณ์ ,05:00 ,12
สถานีโรงสูบน้ำประปา,ต.เขาวง อ.บ้านตาขุน จ.สุราษฎร์ธานี ,05:00 ,12
สถานีอบต.ลำนางรอง,ต.ลำนางรอง อ.โนนดินแดง จ.บุรีรัมย์ ,06:00 ,12
สถานีบ้านปากรอง*,ต.ชาติตระการ อ.ชาติตระการ จ.พิษณุโลก ,05:00 ,12
สถานีสะพานบ้านแหลมโตนด,ต.แหลมโตนด อ.ควนขนุน จ.พัทลุง ,03:00 ,12
สถานีบ้านพิตำ,ต.กรุงชิง อ.นบพิตำ จ.นครศรีธรรมราช ,05:00 ,11.5
สถานีบ้านดงจิก,ต.ทับไทร อ.โป่งน้ำร้อน จ.จันทบุรี ,05:00 ,11.5
สถานีบ้านจันทรัตน์,ต.ยะรม อ.เบตง จ.ยะลา ,05:00 ,11.5
สถานีบ้านหนองยาง,ต.มิตรภาพ อ.มวกเหล็ก จ.สระบุรี ,05:00 ,11.5
สถานีวัดพิเสกประดิษฐิ์,ต.คอนฉิม อ.แวงใหญ่ จ.ขอนแก่น ,06:00 ,11.4
สถานีสำนักสงฆ์เซปะหละ,ต.แม่ละมุ้ง อ.อุ้มผาง จ.ตาก ,06:00 ,11.2
สถานีสำนักงานเกษตรอำเภอเจาะไอร้อง,ต.จวบ อ.เจาะไอร้อง จ.นราธิวาส ,06:00 ,11.2
สถานีห้วยตุงลุง อ.ศรีเมืองใหม่,ต.นาคำ อ.ศรีเมืองใหม่ จ.อุบลราชธานี ,05:00 ,11
สถานีเขตพญาไท,ต.สามเสนใน อ.พญาไท จ.กรุงเทพมหานคร ,04:00 ,11
สถานีบ้านชะรัด,ต.ชะรัด อ.กงหรา จ.พัทลุง ,05:00 ,11
สถานีเขตบางพลัด,ต.บางอ้อ อ.บางพลัด จ.กรุงเทพมหานคร ,04:00 ,11
สถานีบ้านแก่งลาด,ต.ห้วยเฮี้ย อ.นครไทย จ.พิษณุโลก ,05:00 ,11
สถานีบ้านน้ำดิบ,ต.แม่วะ อ.เถิน จ.ลำปาง ,05:00 ,10.5
สถานีบ้านร่องกล้า,ต.เนินเพิ่ม อ.นครไทย จ.พิษณุโลก ,05:00 ,10.5
สถานีบ้านกลุ่มตาขวัญ,ต.คลองไก่เถื่อน อ.คลองหาด จ.สระแก้ว ,05:00 ,10.5
สถานีบ้านใหม่ศรีจำปา,ต.หนองหมากฝ้าย อ.วัฒนานคร จ.สระแก้ว ,05:00 ,10.5
สถานีบ้านเทพพนา,ต.นายางกลัก อ.เทพสถิต จ.ชัยภูมิ ,05:00 ,10.5
สถานีบ้านโนนงิ้ว,ต.บ้านบัว อ.เกษตรสมบูรณ์ จ.ชัยภูมิ ,05:00 ,10.5
