ชื่อสถานี,ที่ตั้ง,เวลา,ฝนล่าสุด (มม.)
สถานีบ้านวังหาด,ต.ตลิ่งชัน อ.บ้านด่านลานหอย จ.สุโขทัย ,05:00 ,91
สถานีบ้านสันติคีรี,ต.แม่สลองนอก อ.แม่ฟ้าหลวง จ.เชียงราย ,05:00 ,76
สถานีบ้านเด่นฮ่อม,ต.บ่อแก้ว อ.สะเมิง จ.เชียงใหม่ ,05:00 ,75.5
สถานีบ้านใหม่เจริญผล,ต.หนองจิก อ.คีรีมาศ จ.สุโขทัย ,05:00 ,73
สถานีบ้านห้วยชมภู (บ้านป่าคาหลวง),ต.ท่าก๊อ อ.แม่สรวย จ.เชียงราย ,05:00 ,70.5
สถานีสะพานห้วยแม่ถาบ้านปาหุ่ง,ต.ยาบหัวนา อ.เวียงสา จ.น่าน ,06:00 ,66.2
สถานีบ้านนาหลวง,ต.สะเอียบ อ.สอง จ.แพร่ ,22:00 ,66
สถานีบ้านห้วยสลัก,ต.ป่าแดด อ.แม่สรวย จ.เชียงราย ,05:00 ,59.5
สถานีบ้านห้วยน้ำจาง,ต.บ่อแก้ว อ.สะเมิง จ.เชียงใหม่ ,05:00 ,57
สถานีบ้านเปียงกอก,ต.ม่อนปิ่น อ.ฝาง จ.เชียงใหม่ ,05:00 ,56.5
สถานีเกาะลันตา,ต.เกาะลันตาใหญ่ อ.เกาะลันตา จ.กระบี่ ,04:00 ,56
สถานียอดเขาหลวง (อุทยานแห่งชาติรามคำแหง),ต.ศรีคีรีมาศ อ.คีรีมาศ จ.สุโขทัย ,06:00 ,54.6
สถานีบ้านพญากองดี,ต.ศรีถ้อย อ.แม่สรวย จ.เชียงราย ,05:00 ,54.5
สถานีบ้านร้องธาร,ต.ศรีดงเย็น อ.ไชยปราการ จ.เชียงใหม่ ,05:00 ,52.5
สถานีบ้านสันติสุข (บ้านกิ่วสะไต),ต.ป่าตึง อ.แม่จัน จ.เชียงราย ,05:00 ,51.5
สถานีภูเก็ต,ต.ตลาดใหญ่ อ.เมืองภูเก็ต จ.ภูเก็ต ,04:00 ,48.9
สถานีทต.บุ่งค้า,ต.บุ่งค้า อ.เลิงนกทา จ.ยโสธร ,06:00 ,48.8
สถานีบ้านปางฮ่าง,ต.สบเปิง อ.แม่แตง จ.เชียงใหม่ ,05:00 ,47.5
สถานีบ้านแม่กระต๋อม,ต.ป่าสัก อ.วังชิ้น จ.แพร่ ,05:00 ,47
สถานีรร.บ้านช้างเชื่อ,ต.เหล อ.กะปง จ.พังงา ,06:00 ,46.2
สถานีทต.กลางเวียง,ต.กลางเวียง อ.เวียงสา จ.น่าน ,06:00 ,45.4
สถานีบ้านป่าสักงาม,ต.ดงมหาวัน อ.เวียงเชียงรุ้ง จ.เชียงราย ,22:00 ,44
สถานีทต.โพทะเล,ต.โพทะเล อ.โพทะเล จ.พิจิตร ,06:00 ,43.8
สถานีตะกั่วป่า,ต.ตำตัว อ.ตะกั่วป่า จ.พังงา ,06:00 ,43.6
สถานีบ้านห้วยม่วง,ต.นาดินดำ อ.เมืองเลย จ.เลย ,05:00 ,43.5
สถานีบ้านสหกรณ์แปลง 5,ต.ป่าตุ้ม อ.พร้าว จ.เชียงใหม่ ,05:00 ,43
สถานีทม.ระนอง,ต.เขานิเวศน์ อ.เมืองระนอง จ.ระนอง ,06:00 ,42.6
สถานีลำพูน,ต.เวียงยอง อ.เมืองลำพูน จ.ลำพูน ,04:00 ,42.3
สถานีบ้านแม่ดอกแดง,ต.เชิงดอย อ.ดอยสะเก็ด จ.เชียงใหม่ ,05:00 ,41.5
สถานีทต.ปากน้ำ,ต.ปากน้ำ อ.เมืองระนอง จ.ระนอง ,06:00 ,41
สถานีตลาดเก่าตะกั่วป่า,ต.โคกเคียน อ.ตะกั่วป่า จ.พังงา ,06:00 ,40.8
สถานีบ้านน้ำริน,ต.สบป่อง อ.ปางมะผ้า จ.แม่ฮ่องสอน ,05:00 ,40.5
สถานีบ้านรวมมิตร,ต.แม่ยาว อ.เมืองเชียงราย จ.เชียงราย ,05:00 ,39
สถานีบ้านสบป่อง,ต.ปางมะผ้า อ.ปางมะผ้า จ.แม่ฮ่องสอน ,05:00 ,39
สถานีบ้านโป่งน้ำร้อน,ต.ดอยฮาง อ.เมืองเชียงราย จ.เชียงราย ,05:00 ,38.5
สถานีบ้านแม่รากกลาง,ต.บ้านตึก อ.ศรีสัชนาลัย จ.สุโขทัย ,05:00 ,38.5
สถานีบ้านปันเจน,ต.แม่เกิ๋ง อ.วังชิ้น จ.แพร่ ,05:00 ,38
สถานีบ้านขุนห้วย,ต.แม่พุง อ.วังชิ้น จ.แพร่ ,05:00 ,37.5
สถานีบ้านอังคาย,ต.ยั้งเมิน อ.สะเมิง จ.เชียงใหม่ ,05:00 ,37
สถานีสะพานห้วยน้ำสาย,ต.ตาลชุม อ.ท่าวังผา จ.น่าน ,06:00 ,37
สถานีอบต.ด่านจาก,ต.ด่านจาก อ.โนนไทย จ.นครราชสีมา ,06:00 ,36
สถานีบ้านสามพวง 1*,ต.สามพวง อ.คีรีมาศ จ.สุโขทัย ,05:00 ,36
สถานีบ้านแม่ทุเลาใน,ต.กลางดง อ.ทุ่งเสลี่ยม จ.สุโขทัย ,05:00 ,36
สถานีบ้านปางกล้วยค้าว,ต.ป่าหุ่ง อ.พาน จ.เชียงราย ,05:00 ,35.5
สถานีหน่วยจัดการต้นน้ำแม่เผอะ (อ่างขาง),ต.แม่งอน อ.ฝาง จ.เชียงใหม่ ,06:00 ,35.4
สถานีบ้านปางแปก,ต.แม่นาเติง อ.ปาย จ.แม่ฮ่องสอน ,05:00 ,35
สถานีบ้านห้วยเฮี่ยน,ต.โป่งน้ำร้อน อ.ฝาง จ.เชียงใหม่ ,05:00 ,35
สถานีบ้านเชิงผา,ต.กลางดง อ.ทุ่งเสลี่ยม จ.สุโขทัย ,05:00 ,34.5
สถานีบ้านม่วงเจริญราษฎร์,ต.บ่อสวก อ.เมืองน่าน จ.น่าน ,05:00 ,34.5
สถานีอบต.โนนขวาง,ต.โนนขวาง อ.บ้านด่าน จ.บุรีรัมย์ ,06:00 ,34.4
สถานีบ้านแกน้อย,ต.แม่นะ อ.เชียงดาว จ.เชียงใหม่ ,05:00 ,34
สถานีหน่วยจัดการต้นน้ำดอยถ้วย,ต.เมืองนะ อ.เชียงดาว จ.เชียงใหม่ ,06:00 ,33.8
สถานีอบต.พิกุล,ต.พิกุล อ.ชุมแสง จ.นครสวรรค์ ,06:00 ,33.4
สถานีบ้านห้วยละเบ้ายา,ต.สะเนียน อ.เมืองน่าน จ.น่าน ,05:00 ,33
สถานีบ้านผาใต้,ต.ห้วยชมภู อ.เมืองเชียงราย จ.เชียงราย ,05:00 ,33
สถานีสะพานข้ามคลองเกรียงไกร,ต.บางเคียน อ.ชุมแสง จ.นครสวรรค์ ,06:00 ,32.8
สถานีที่ทำการเขตรักษาพันธุ์สัตว์ป่าดอยผาช้าง,ต.งิม อ.ปง จ.พะเยา ,06:00 ,32.6
สถานีบ้านนาหวาย,ต.แม่นะ อ.เชียงดาว จ.เชียงใหม่ ,05:00 ,32.5
สถานีบ้านมอล่อง,ต.แม่สลองใน อ.แม่ฟ้าหลวง จ.เชียงราย ,05:00 ,32.5
สถานีสุโขทัย,ต.วังใหญ่ อ.ศรีสำโรง จ.สุโขทัย ,04:00 ,32.5
สถานีชุมชนบ้านห้วยทราย,ต.เขื่อนผาก อ.พร้าว จ.เชียงใหม่ ,06:00 ,32.2
สถานีบ้านอากู่,ต.เทอดไทย อ.แม่ฟ้าหลวง จ.เชียงราย ,05:00 ,32
สถานีบ้านบางหวาน,ต.กมลา อ.กะทู้ จ.ภูเก็ต ,05:00 ,31.5
สถานีชุมแสง,ต.เกยไชย อ.ชุมแสง จ.นครสวรรค์ ,06:00 ,31.4
สถานีบ้านป่าสักงาม,ต.ลวงเหนือ อ.ดอยสะเก็ด จ.เชียงใหม่ ,05:00 ,31
สถานีหน่วยจัดการต้นน้ำบ่อแก้ว,ต.แม่นาจร อ.แม่แจ่ม จ.เชียงใหม่ ,06:00 ,30.8
สถานีบ้านขุนป๋วย,ต.แม่วิน อ.แม่วาง จ.เชียงใหม่ ,05:00 ,30.5
สถานีบ้านเขาน้ำเพชร,ต.คลองแม่ลาย อ.เมืองกำแพงเพชร จ.กำแพงเพชร ,05:00 ,30.5
สถานีบ้านเขาเกตุ,ต.ทับกวาง อ.แก่งคอย จ.สระบุรี ,05:00 ,30
สถานีบ้านหลวง,ต.แม่งอน อ.ฝาง จ.เชียงใหม่ ,05:00 ,30
สถานีบ้านไชยงาม,ต.แม่แวน อ.พร้าว จ.เชียงใหม่ ,05:00 ,30
สถานีดอยอ่างขาง,ต.ม่อนปิ่น อ.ฝาง จ.เชียงใหม่ ,19:00 ,29.3
สถานีบ้านโป่งไฮ,ต.แม่สาว อ.แม่อาย จ.เชียงใหม่ ,05:00 ,29
สถานีตะกั่วป่า,ต.คึกคัก อ.ตะกั่วป่า จ.พังงา ,04:00 ,29
สถานีฝาง,ต.แม่คะ อ.ฝาง จ.เชียงใหม่ ,06:00 ,28.8
สถานีบ้านปางขุม,ต.ยั้งเมิน อ.สะเมิง จ.เชียงใหม่ ,05:00 ,28.5
สถานีบ้านมนต์คีรี,ต.เมืองเก่า อ.เมืองสุโขทัย จ.สุโขทัย ,05:00 ,28.5
สถานีบ้านเขาพลู,ต.บางสัก อ.กันตัง จ.ตรัง ,05:00 ,28
สถานีบ้านแม่ป๋ามนอก,ต.ปิงโค้ง อ.เชียงดาว จ.เชียงใหม่ ,05:00 ,28
สถานีบ้านน้ำต้ม,ต.ผาช้างน้อย อ.ปง จ.พะเยา ,05:00 ,27.5
สถานีบ้านแม่แสลป,ต.แม่สลองใน อ.แม่ฟ้าหลวง จ.เชียงราย ,05:00 ,27.5
สถานีหน่วยพิทักษ์อุทยานฯ ที่ ดป.๔ (โครงการบ้านเล็กฯ),ต.แม่สาว อ.แม่อาย จ.เชียงใหม่ ,06:00 ,27.2
สถานีบ้านขุนแม่รวม,ต.แม่นาจร อ.แม่แจ่ม จ.เชียงใหม่ ,05:00 ,27
สถานีอบต.เวียง,ต.เวียง อ.ฝาง จ.เชียงใหม่ ,06:00 ,26.6
สถานีบ้านหัวฝาย,ต.ศรีดงเย็น อ.ไชยปราการ จ.เชียงใหม่ ,05:00 ,26.5
สถานีโรงฆ่าสัตว์ ทม.สวรรคโลก,ต.เมืองสวรรคโลก อ.สวรรคโลก จ.สุโขทัย ,06:00 ,26.4
สถานีเมืองระนอง,ต.เขานิเวศน์ อ.เมืองระนอง จ.ระนอง ,06:00 ,26.4
สถานีหน่วยจัดการต้นน้ำน้ำพาง,ต.วังกวาง อ.น้ำหนาว จ.เพชรบูรณ์ ,06:00 ,26.2
สถานีทต.บ้านโฮ่ง,ต.บ้านโฮ่ง อ.บ้านโฮ่ง จ.ลำพูน ,06:00 ,26
สถานีบ้านหาดส้มป่อย,ต.แม่สาบ อ.สะเมิง จ.เชียงใหม่ ,05:00 ,26
สถานีบ้านบึงไม้,ต.ชะอม อ.แก่งคอย จ.สระบุรี ,05:00 ,26
สถานีบ้านบางบอน,ต.คลองศก อ.พนม จ.สุราษฎร์ธานี ,05:00 ,26
สถานีบ้านพญาไพรเล่ามา,ต.เทอดไทย อ.แม่ฟ้าหลวง จ.เชียงราย ,05:00 ,26
สถานีบ้านนาฟ่อน,ต.บ่อหลวง อ.ฮอด จ.เชียงใหม่ ,05:00 ,25.5
สถานีบ้านทุ่งผง,ต.ทุ่งศรีทอง อ.เวียงสา จ.น่าน ,05:00 ,25.5
สถานีทม.ทับกวาง,ต.ทับกวาง อ.แก่งคอย จ.สระบุรี ,06:00 ,25.2
สถานีชุมชนหนองปิ้งไก่,ต.นาบ่อคำ อ.เมืองกำแพงเพชร จ.กำแพงเพชร ,06:00 ,25
สถานีลำน้ำกวงสะพานศรีดอนชัย,ต.บ้านธิ อ.บ้านธิ จ.ลำพูน ,06:00 ,25
สถานีบ้านห้วยขอบ,ต.หาดคัมภีร์ อ.ปากชม จ.เลย ,05:00 ,25
สถานีบ้านตอง,ต.แม่จริม อ.แม่จริม จ.น่าน ,06:00 ,24.8
สถานีสะพานวังแก่ง,ต.เขาเพิ่ม อ.บ้านนา จ.นครนายก ,06:00 ,24.8
สถานีบ้านบางติบ,ต.บางวัน อ.คุระบุรี จ.พังงา ,05:00 ,24.5
สถานีบ้านทุ่งข่า,ต.ปะเหลียน อ.ปะเหลียน จ.ตรัง ,05:00 ,24.5
สถานีบ้านดอกแดง,ต.บางไทร อ.ตะกั่วป่า จ.พังงา ,04:00 ,24.5
สถานีหน่วยจัดการต้นน้ำสวนป่าสิริกิติ์,ต.กองแขก อ.แม่แจ่ม จ.เชียงใหม่ ,06:00 ,24.2
สถานีบ้านแม่เทินเหนือ,ต.แม่สิน อ.ศรีสัชนาลัย จ.สุโขทัย ,05:00 ,24
สถานีอบต.คลองศก,ต.คลองศก อ.พนม จ.สุราษฎร์ธานี ,06:00 ,24
สถานีบ้านห้วยจะค่าน,ต.ปิงโค้ง อ.เชียงดาว จ.เชียงใหม่ ,05:00 ,24
สถานีบ้านผาเดื่อ,ต.แม่สลองใน อ.แม่ฟ้าหลวง จ.เชียงราย ,05:00 ,24
สถานีบ้านนาบ่อ,ต.บ่อน้ำร้อน อ.กันตัง จ.ตรัง ,05:00 ,24
สถานีบ้านอ่าวกลาง,ต.วังมะปรางเหนือ อ.วังวิเศษ จ.ตรัง ,05:00 ,24
สถานีบ้านแม่สาย (บ้านถ้ำผาจม),ต.เวียงพางคำ อ.แม่สาย จ.เชียงราย ,05:00 ,24
สถานีศูนย์พัฒนาเด็กเล็ก อบต.ท่านา,ต.ท่านา อ.กะปง จ.พังงา ,06:00 ,24
สถานีวังสะพุง,ต.วังสะพุง อ.วังสะพุง จ.เลย ,06:00 ,23.8
สถานีบ้านกิ่วลม,ต.บ่อหลวง อ.ฮอด จ.เชียงใหม่ ,05:00 ,23.5
สถานีบ้านแม่แฮด,ต.แม่พุง อ.วังชิ้น จ.แพร่ ,05:00 ,23.5
สถานีบ้านขาแหย่ง,ต.เทอดไทย อ.แม่ฟ้าหลวง จ.เชียงราย ,05:00 ,23.5
สถานีบ้านกะเหรี่ยงน้ำตก,ต.คลองลานพัฒนา อ.คลองลาน จ.กำแพงเพชร ,05:00 ,23.5
สถานีบ้านนาเคียน,ต.ตาลชุม อ.เวียงสา จ.น่าน ,05:00 ,23.5
สถานีบ้านท่าทองแดง,ต.นาโบสถ์ อ.วังเจ้า จ.ตาก ,05:00 ,23
สถานีบ้านท่าปู,ต.แม่นาวาง อ.แม่อาย จ.เชียงใหม่ ,05:00 ,23
สถานีบ้านปางสา,ต.ป่าตึง อ.แม่จัน จ.เชียงราย ,05:00 ,23
สถานีบ้านราษฎร์ภักดี,ต.ตับเต่า อ.เทิง จ.เชียงราย ,05:00 ,23
สถานีระนอง,ต.บางนอน อ.เมืองระนอง จ.ระนอง ,04:00 ,23
สถานีหน่วยจัดการต้นน้ำดอยตุง,ต.แม่ฟ้าหลวง อ.แม่ฟ้าหลวง จ.เชียงราย ,06:00 ,22.6
สถานีบ้านขุนแจ๋,ต.แม่แวน อ.พร้าว จ.เชียงใหม่ ,05:00 ,22.5
สถานีบ้านเขาหัวนา,ต.เขาเพิ่ม อ.บ้านนา จ.นครนายก ,05:00 ,22.5
สถานีบ้านห้วยมะแกง,ต.ป่าแดด อ.แม่สรวย จ.เชียงราย ,05:00 ,22.5
สถานีบ้านแม่มอญ,ต.ห้วยชมภู อ.เมืองเชียงราย จ.เชียงราย ,05:00 ,22.5
สถานีภูเก็ต (ศูนย์ฯ),ต.ไม้ขาว อ.ถลาง จ.ภูเก็ต ,04:00 ,22.4
สถานีทต.ท่าแร่,ต.ท่าแร่ อ.เมืองสกลนคร จ.สกลนคร ,06:00 ,22.4
สถานีเลย สกษ.,ต.นาโป่ง อ.เมืองเลย จ.เลย ,04:00 ,22.2
สถานีสวนสาธารณะกู่ช้าง ทต.ลำพูน,ต.ในเมือง อ.เมืองลำพูน จ.ลำพูน ,06:00 ,22.2
สถานีอบต.เขาหลวง,ต.เขาหลวง อ.วังสะพุง จ.เลย ,06:00 ,22.2
สถานีบ้านพรุสมภาร,ต.เทพกระษัตรี อ.ถลาง จ.ภูเก็ต ,05:00 ,22
สถานีบ้านวังรี,ต.เขาพระ อ.เมืองนครนายก จ.นครนายก ,05:00 ,22
สถานีอบต.สลกบาตร,ต.สลกบาตร อ.ขาณุวรลักษบุรี จ.กำแพงเพชร ,06:00 ,21.6
สถานีทต.ป่าซาง,ต.ป่าซาง อ.ป่าซาง จ.ลำพูน ,06:00 ,21.6
สถานีที่ทำการอุทยานแห่งชาติเวียงโกศัย,ต.แม่เกิ๋ง อ.วังชิ้น จ.แพร่ ,06:00 ,21.6
สถานีเขื่อนแควน้อยบำรุงแดน,ต.คันโช้ง อ.วัดโบสถ์ จ.พิษณุโลก ,06:00 ,21.6
สถานีบ้านไตรสภาวคาม,ต.ปิงโค้ง อ.เชียงดาว จ.เชียงใหม่ ,05:00 ,21.5
สถานีบ้านดอยชมภู,ต.โป่งแพร่ อ.แม่ลาว จ.เชียงราย ,05:00 ,21.5
สถานีบ้านยาง,ต.แม่งอน อ.ฝาง จ.เชียงใหม่ ,05:00 ,21.5
สถานีบ้านห้วยตม,ต.บ้านตึก อ.ศรีสัชนาลัย จ.สุโขทัย ,05:00 ,21.5
สถานีบ้านเขื่อนแก้ว,ต.ถืมตอง อ.เมืองน่าน จ.น่าน ,05:00 ,21.5
สถานีบ้านหนองคล้า,ต.ชำผักแพว อ.แก่งคอย จ.สระบุรี ,05:00 ,21.5
สถานีบ้านฮวก,ต.ภูซาง อ.ภูซาง จ.พะเยา ,05:00 ,21.5
สถานีบ้านทุ่งโป่งใต้,ต.บ้านปง อ.หางดง จ.เชียงใหม่ ,05:00 ,21.5
สถานีรร.บ้านท่าหัน,ต.รมณีย์ อ.กะปง จ.พังงา ,06:00 ,21.4
สถานีทต.น้ำยืน,ต.สีวิเชียร อ.น้ำยืน จ.อุบลราชธานี ,06:00 ,21.4
สถานีปะเหลียน,ต.ท่าพญา อ.ปะเหลียน จ.ตรัง ,06:00 ,21.4
สถานีชุมชนแม่ตาลน้อย,ต.เวียงตาล อ.ห้างฉัตร จ.ลำปาง ,06:00 ,21
สถานีบ้านปางมะกง,ต.ปิงโค้ง อ.เชียงดาว จ.เชียงใหม่ ,05:00 ,21
สถานีบ้านเมืองแพม,ต.ถ้ำลอด อ.ปางมะผ้า จ.แม่ฮ่องสอน ,05:00 ,21
สถานีบ้านห้วยส้าน,ต.แม่สลองใน อ.แม่ฟ้าหลวง จ.เชียงราย ,05:00 ,21
สถานีรพสต.บ้านหนองไคร้,ต.หนองตอง อ.หางดง จ.เชียงใหม่ ,06:00 ,20.6
สถานีเหนือฝายยางแก้งสนามนาง,ต.โนนสำราญ อ.แก้งสนามนาง จ.นครราชสีมา ,06:00 ,20.6
สถานีบ้านร่มไทย,ต.ท่าตอน อ.แม่อาย จ.เชียงใหม่ ,05:00 ,20.5
สถานีที่ทำการอุทยานฯเขาใหญ่,ต.นาหินลาด อ.ปากพลี จ.นครนายก ,05:00 ,20.5
สถานีบ้านตีนธาตุ,ต.ป่าไหน่ อ.พร้าว จ.เชียงใหม่ ,05:00 ,20.5
สถานีบ้านห้วยน้ำอุ่น,ต.วาวี อ.แม่สรวย จ.เชียงราย ,05:00 ,20.5
สถานีบ้านสันติสุข,ต.ท่าขุนราม อ.เมืองกำแพงเพชร จ.กำแพงเพชร ,05:00 ,20.5
สถานีบ้านแม่ตะละม้ง,ต.แม่แดด อ.กัลยาณิวัฒนา จ.เชียงใหม่ ,05:00 ,20.5
สถานีท้ายฝายยางแก้งสนามนาง,ต.โนนสำราญ อ.แก้งสนามนาง จ.นครราชสีมา ,06:00 ,20.4
สถานีเวียงสา,ต.ส้าน อ.เวียงสา จ.น่าน ,06:00 ,20.4
สถานีปง,ต.ปง อ.ปง จ.พะเยา ,06:00 ,20.2
สถานีบ้านบางกุ่ม,ต.กะปง อ.กะปง จ.พังงา ,05:00 ,20
สถานีบ้านเมืองนะ,ต.แม่นะ อ.เชียงดาว จ.เชียงใหม่ ,05:00 ,20
สถานีบ้านห้วยหลอด,ต.ยาบหัวนา อ.เวียงสา จ.น่าน ,05:00 ,20
สถานีบ้านปงถ้ำ,ต.วังทอง อ.วังเหนือ จ.ลำปาง ,05:00 ,20
สถานีเหนือฝายยางบ้านตะลุง,ต.หนองเรือ อ.ชุมพลบุรี จ.สุรินทร์ ,06:00 ,19.6
สถานีบ้านปางขนุน,ต.นาบ่อคำ อ.เมืองกำแพงเพชร จ.กำแพงเพชร ,05:00 ,19.5
สถานีบ้านแม่สุยะ,ต.หมอกจำแป่ อ.เมืองแม่ฮ่องสอน จ.แม่ฮ่องสอน ,05:00 ,19.5
สถานีอบต.เทอดไทย,ต.เทอดไทย อ.แม่ฟ้าหลวง จ.เชียงราย ,06:00 ,19.4
