บ้านหล่ายลาว*,ต.ป่าอ้อดอนชัย อ.เมืองเชียงราย จ.เชียงราย,14:00 น.,8.5,19.822079183896026,99.7659981250763
บ้านคลองมดแดง,ต.โป่งน้ำร้อน อ.คลองลาน จ.กำแพงเพชร,14:00 น.,11,16.406400212146735,99.23799991607666
เขตจอมทอง,ต.บางมด อ.จอมทอง จ.กรุงเทพมหานคร,02:00 น.,10,13.677439903995495,100.48427224159241
บ้านลุง,ต.ศรีดอนชัย อ.เชียงของ จ.เชียงราย,12:00 น.,7.5,20.136072940745677,100.43000042438507
จุดวัด ค.บึงใหญ่-วัดทองสัมฤทธิ์,ต.แสนแสบ อ.มีนบุรี จ.กรุงเทพมหานคร,15:00 น.,1,13.800449111269785,100.7882684469223
ตลาดน้ำบางน้ำผึ้ง,ต.บางน้ำผึ้ง อ.พระประแดง จ.สมุทรปราการ,15:00 น.,1,13.678649153421931,100.57360053062439
หน่วยพิทักษ์อุทยานฯ ที่ ดป.๔ (โครงการบ้านเล็กฯ),ต.แม่สาว อ.แม่อาย จ.เชียงใหม่,15:00 น.,3.8,20.08055042719043,99.181147813797
หน่วยจัดการต้นน้ำแม่ขะนิง,ต.แม่ขะนิง อ.เวียงสา จ.น่าน,23:00 น.,9.8,18.752798857063812,100.54124236106873
สุรินทร์,ต.ในเมือง อ.เมืองสุรินทร์ จ.สุรินทร์,13:00 น.,9.8,14.88333203516152,103.49999785423279
หน่วยจัดการต้นน้ำแม่จริม,ต.แม่จริม อ.แม่จริม จ.น่าน,15:00 น.,6.2,18.82128902813903,100.99951922893524
บ้านกอกหลวง,ต.แม่นาจาง อ.แม่ลาน้อย จ.แม่ฮ่องสอน,14:00 น.,11,18.529701393505903,98.13799917697906
บ้านในช่อง,ต.สองแพรก อ.ชัยบุรี จ.สุราษฎร์ธานี,14:00 น.,10,8.491637436378953,99.13899958133698
เขตบางบอน,ต.บางบอน อ.บางบอน จ.กรุงเทพมหานคร,02:00 น.,9.5,13.633918432065995,100.36884069442749
บ้านช่องช้าง,ต.พรุพี อ.บ้านนาสาร จ.สุราษฎร์ธานี,14:00 น.,11,8.699014373662225,99.38500106334686
บ้านผางาม,ต.ผางาม อ.เวียงชัย จ.เชียงราย,14:00 น.,9.5,19.86932830244773,100.04399836063385
ปตร.ประชาร่วมใจ,ต.แสนแสบ อ.มีนบุรี จ.กรุงเทพมหานคร,15:00 น.,0.5,13.821197866055746,100.74717164039612
บ้านป่าซางพัฒนา,ต.แม่เจดีย์ อ.เวียงป่าเป้า จ.เชียงราย,14:00 น.,9.5,19.22053829626513,99.49900031089783
บ้านน้ำกุ่ม,ต.น้ำกุ่ม อ.นครไทย จ.พิษณุโลก,11:00 น.,5,17.347781212220575,100.85800051689148
บ้านมอล่อง,ต.แม่สลองใน อ.แม่ฟ้าหลวง จ.เชียงราย,14:00 น.,1.5,20.21090290555916,99.63900089263916
ส.คลองราชมนตรี,ต.แสมดำ อ.บางขุนเทียน จ.กรุงเทพมหานคร,15:00 น.,2,13.627818841352257,100.43939888477325
บ้านซับฟาน,ต.ยางงาม อ.หนองไผ่ จ.เพชรบูรณ์,12:00 น.,6,16.083702224827242,100.96700012683868
บ้านขุนฝาง,ต.ขุนฝาง อ.เมืองอุตรดิตถ์ จ.อุตรดิตถ์,14:00 น.,10.5,17.787720922904718,100.2070015668869
บ้านทุ่งตอน,ต.วังเงิน อ.แม่ทะ จ.ลำปาง,14:00 น.,9.5,18.120581001247125,99.61299955844879
บ้านทุ่งผึ้ง,ต.ทุ่งผึ้ง อ.แจ้ห่ม จ.ลำปาง,14:00 น.,9.5,18.945968336509008,99.67199742794037
บ้านปางปง-ปางทราย,ต.เวียงตาล อ.ห้างฉัตร จ.ลำปาง,14:00 น.,18,18.42769536667659,99.26699995994568
บ้านห้วยโป่ง,ต.ห้วยมุ่น อ.น้ำปาด จ.อุตรดิตถ์,11:00 น.,8.5,17.768478158414997,100.88200092315674
บ้านซับแม็ก,ต.หนองน้ำใส อ.วัฒนานคร จ.สระแก้ว,14:00 น.,9.5,13.874663095567271,102.42264032363892
บ้านก้อ,ต.แม่จริม อ.แม่จริม จ.น่าน,14:00 น.,8.5,18.792999453352973,101.02999985218048
สะพานข้ามลำปะเทีย,ต.อีสานเขต อ.เฉลิมพระเกียรติ จ.บุรีรัมย์,15:00 น.,9.4,14.617066622070004,102.90032029151917
ทต.เวียง,ต.เวียง อ.เชียงของ จ.เชียงราย,15:00 น.,8.6,20.25741621713133,100.40288865566254
อบต.แม่ปะ,ต.แม่ปะ อ.เถิน จ.ลำปาง,15:00 น.,9.4,17.651807535029764,99.2676329612732
บ้านฟองใต้,ต.วังกวาง อ.น้ำหนาว จ.เพชรบูรณ์,14:00 น.,4.5,16.844284433359036,101.68700158596039
บ้านหลุกใต้,ต.นาครัว อ.แม่ทะ จ.ลำปาง,14:00 น.,9,18.130706060767782,99.53200221061707
บ้านปางข้าวสาร,ต.แม่เล่ย์ อ.แม่วงก์ จ.นครสวรรค์,14:00 น.,9,15.840501604123624,99.3229991197586
วัดท่ายาง,ต.ท่ายาง อ.ทุ่งใหญ่ จ.นครศรีธรรมราช,14:00 น.,8,8.302058657577994,99.36824262142181
เขตบางแค,ต.บางแค อ.บางแค จ.กรุงเทพมหานคร,02:00 น.,9,13.696219055319158,100.40919184684753
บ้านสันขี้เหล็ก,ต.แม่พริก อ.แม่พริก จ.ลำปาง,15:00 น.,9,17.48230107040073,99.08800005912781
จุดวัดบึงหนองบอน,ต.หนองบอน อ.ประเวศ จ.กรุงเทพมหานคร,09:00 น.,1.5,13.695291339632558,100.65375030040741
ปตร.คลองรางจาก-ถ.ประชาอุทิศ,ต.ทุ่งครุ อ.ทุ่งครุ จ.กรุงเทพมหานคร,15:00 น.,1.5,13.634940227719044,100.50217866897583
บ้านน้ำกิใต้,ต.ผาทอง อ.ท่าวังผา จ.น่าน,01:00 น.,3,19.220472446308232,100.64700186252594
บ้านน้ำพร้า,ต.นางพญา อ.ท่าปลา จ.อุตรดิตถ์,14:00 น.,9,17.96577742411112,100.39399981498718
บ้านเปียงกอก,ต.ม่อนปิ่น อ.ฝาง จ.เชียงใหม่,14:00 น.,2,19.945566257429046,99.16599869728088
บ้านแม่จอ,ต.แม่โถ อ.แม่ลาน้อย จ.แม่ฮ่องสอน,14:00 น.,3.5,18.6458283479258,98.03899884223938
บ้านป่าข้าวหลาม,ต.นาโป่ง อ.เมืองเลย จ.เลย,14:00 น.,8,17.420205245192882,101.62499964237213
บ้านชานเมือง,ต.ปางหมู อ.เมืองแม่ฮ่องสอน จ.แม่ฮ่องสอน,14:00 น.,18.5,19.31277350248381,97.98500061035156
บ้านน้ำฮอก,ต.บ้านเหล่า อ.สูงเม่น จ.แพร่,14:00 น.,11.5,18.051846672023853,100.15400111675262
อ่างเก็บน้ำห้วยซับเหล็ก,ต.โคกตูม อ.เมืองลพบุรี จ.ลพบุรี,14:00 น.,0.2,14.814824264577025,100.77580690383911
หน่วยพิทักษ์อุทยานแห่งชาติที่ ลย.๑ (วังกวาง),ต.ศรีฐาน อ.ภูกระดึง จ.เลย,15:00 น.,28.4,16.886986402604595,101.78821206092834
ที่ทำการอุทยานแห่งชาติแจ้ซ้อน,ต.แจ้ซ้อน อ.เมืองปาน จ.ลำปาง,15:00 น.,9.6,18.836414457571195,99.47019338607788
อบต.โคกเริงรมย์,ต.โคกเริงรมย์ อ.บำเหน็จณรงค์ จ.ชัยภูมิ,15:00 น.,9,15.39942452042092,101.60259246826172
เมืองแม่ฮ่องสอน,ต.ปางหมู อ.เมืองแม่ฮ่องสอน จ.แม่ฮ่องสอน,15:00 น.,18,19.366999571041408,97.96668112277985
หน่วยพิทักษ์อุทยานแห่งชาติแก่งกระจาน 10,ต.ห้วยแม่เพรียง อ.แก่งกระจาน จ.เพชรบุรี,15:00 น.,0.6,12.97822879398168,99.37311887741089
ทม.บ้านทุ่ม,ต.บ้านทุ่ม อ.เมืองขอนแก่น จ.ขอนแก่น,15:00 น.,8.6,16.444456244257072,102.72511303424835
สะพานห้วยแม่ถาบ้านปาหุ่ง,ต.ยาบหัวนา อ.เวียงสา จ.น่าน,15:00 น.,8.8,18.584360427816534,100.50956547260284
หน่วยจัดการต้นน้ำดอยผาหลวง,ต.โป่งน้ำร้อน อ.ฝาง จ.เชียงใหม่,15:00 น.,1.2,20.015749296055095,99.1611921787262
บ้านผาบ่อง,ต.ผาบ่อง อ.เมืองแม่ฮ่องสอน จ.แม่ฮ่องสอน,14:00 น.,33,19.206982734568367,97.98200190067291
บ้านร่องกล้า,ต.เนินเพิ่ม อ.นครไทย จ.พิษณุโลก,14:00 น.,18,16.98044726891171,101.02599799633026
บ้านสันติสุข (บ้านกิ่วสะไต),ต.ป่าตึง อ.แม่จัน จ.เชียงราย,14:00 น.,8,20.104384903441623,99.62499976158142
เขตคลองสามวา,ต.บางขัน อ.คลองสามวา จ.กรุงเทพมหานคร,11:00 น.,4,13.85989823405402,100.70424020290375
บ้านกิ่วเคียน,ต.จริม อ.ท่าปลา จ.อุตรดิตถ์,14:00 น.,18.5,17.88676760995314,100.3600001335144
ส.คลองแจงร้อน,ต.บางพึ่ง อ.พระประแดง จ.สมุทรปราการ,09:00 น.,0.5,13.67627234704129,100.52097022533417
บ้านแม่เตินเหนือ,ต.แม่ถอด อ.เถิน จ.ลำปาง,14:00 น.,8.5,17.738136076575383,99.19400095939636
บ้านผาลาด,ต.แม่ทะ อ.แม่ทะ จ.ลำปาง,14:00 น.,12.5,18.241115729996167,99.59699749946594
จุดวัด ค.เก้า-วัดศรีสุขฯ,ต.สามวาตะวันออก อ.คลองสามวา จ.กรุงเทพมหานคร,09:00 น.,8.5,13.92046203514674,100.79228103160858
บ้านห้วยเฮี่ยน,ต.โป่งน้ำร้อน อ.ฝาง จ.เชียงใหม่,14:00 น.,1,19.962276697890346,99.18700039386749
บ้านน้ำเลียง,ต.ปอน อ.ทุ่งช้าง จ.น่าน,01:00 น.,4.5,19.565183572249932,100.92199802398682
บ้านแม่จอก,ต.หัวทุ่ง อ.ลอง จ.แพร่,14:00 น.,11,18.081110114331302,99.77400183677673
บ้านวังกกแก้ว,ต.วังสวาบ อ.ภูผาม่าน จ.ขอนแก่น,14:00 น.,1.5,16.713819071181824,101.842001080513
บ้านสันหลวง,ต.แม่เปา อ.พญาเม็งราย จ.เชียงราย,14:00 น.,8.5,19.843853671779794,100.13200163841248
คลองอ้อมนนท์ บางใหญ่ (ถนนบางกรวย-ไทรน้อย),ต.บางม่วง อ.บางใหญ่ จ.นนทบุรี,02:00 น.,8.4,13.870939418421223,100.43628215789795
ภูเพียง,ต.เมืองจัง อ.ภูเพียง จ.น่าน,15:00 น.,11.4,18.85972698608367,100.81711292266846
บางปะอิน,ต.ขนอนหลวง อ.บางปะอิน จ.พระนครศรีอยุธยา,11:00 น.,8.2,14.304479620392506,100.56643903255463
ที่ว่าการอำเภอแม่วาง,ต.บ้านกาด อ.แม่วาง จ.เชียงใหม่,14:00 น.,0.2,18.61273065090677,98.77528131008148
อบต.เทอดไทย,ต.เทอดไทย อ.แม่ฟ้าหลวง จ.เชียงราย,15:00 น.,8.4,20.243434996535814,99.66370940208435
อบต.แจ้ซ้อน,ต.แจ้ซ้อน อ.เมืองปาน จ.ลำปาง,15:00 น.,8.6,18.8169882633427,99.50003027915955
บ้านราษฎร์ภักดี,ต.ตับเต่า อ.เทิง จ.เชียงราย,14:00 น.,6.5,19.866725022221054,100.40000259876251
บ้านผาสิงห์,ต.ผาสิงห์ อ.เมืองน่าน จ.น่าน,14:00 น.,6,18.89206064727126,100.75100183486938
ท่าเรือ,ต.ท่าเรือ อ.ท่าเรือ จ.พระนครศรีอยุธยา,13:00 น.,2.8,14.56014220676329,100.71987748146057
บ้านดอนชัย,ต.เมืองปาน อ.เมืองปาน จ.ลำปาง,14:00 น.,9,18.819669272496288,99.45899784564972
บ้านผาหมี,ต.เวียงพางคำ อ.แม่สาย จ.เชียงราย,13:00 น.,6,20.399300996873485,99.85099732875824
บ้านป่าแดง,ต.ป่าแดง อ.เมืองแพร่ จ.แพร่,14:00 น.,8,18.096948486434325,100.20099878311157
บ้านสันนาเคียน,ต.ส้านนาหนองใหม่ อ.เวียงสา จ.น่าน,14:00 น.,0.5,18.494754795729346,100.94500064849854
บ้านสวนปอ,ต.แก่งศรีภูมิ อ.ภูหลวง จ.เลย,14:00 น.,3,17.058641102673338,101.66100025177002
บ้านน้ำม้าเหนือ,ต.สถาน อ.เชียงของ จ.เชียงราย,14:00 น.,7,20.20574285081291,100.36999940872192
เขตมีนบุรี,ต.มีนบุรี อ.มีนบุรี จ.กรุงเทพมหานคร,11:00 น.,6,13.813597670298687,100.73121786117554
บ้านนาหนุน 3,ต.แสนทอง อ.ท่าวังผา จ.น่าน,14:00 น.,8,19.135899083469525,100.78800022602081
บ้านภูคำ,ต.งอบ อ.ทุ่งช้าง จ.น่าน,14:00 น.,29.5,19.484000127310885,100.86000144481659
บ้านใต้โตน,ต.บางสวรรค์ อ.พระแสง จ.สุราษฎร์ธานี,14:00 น.,9,8.62900149050225,98.98800194263458
บ้านเคี่ยมงาม,ต.บ้านลำนาว อ.บางขัน จ.นครศรีธรรมราช,14:00 น.,6.5,7.955903727087473,99.44100022315979
บ้านผาเวียง,ต.ภูคา อ.ปัว จ.น่าน,15:00 น.,6,19.157816728615103,101.02511286735535
บ้านทุ่ง,ต.บ้านแซว อ.เชียงแสน จ.เชียงราย,14:00 น.,18.5,20.291739854737155,100.22200047969818
บ้านหาดถั่ว,ต.ปลายพระยา อ.ปลายพระยา จ.กระบี่,14:00 น.,8.5,8.551978690982242,98.90836715698242
ยอดภูกระดึง,ต.ศรีฐาน อ.ภูกระดึง จ.เลย,14:00 น.,3,16.884999881772586,101.78932785987854
อบต.ราษฎร์นิยม,ต.ราษฎร์นิยม อ.ไทรน้อย จ.นนทบุรี,11:00 น.,1.8,14.103889366886829,100.32204151153564
บ้านคะแนง,ต.แม่ลาว อ.เชียงคำ จ.พะเยา,14:00 น.,8,19.429059264623078,100.46999752521515
บ้านนาพรุ,ต.นาคา อ.สุขสำราญ จ.ระนอง,14:00 น.,44.5,9.431408485746166,98.46690773963928
บ้านทุ่งน้ำใส,ต.โป่ง อ.ด่านซ้าย จ.เลย,13:00 น.,1,17.171042459725186,101.20400011539459
ส.คลองเจ็ก,ต.บางจาก อ.พระโขนง จ.กรุงเทพมหานคร,15:00 น.,2.5,13.69223193375227,100.58990836143494
ที่ทำการเขตรักษาพันธุ์สัตว์ป่าดอยหลวง,ต.ห้วยหม้าย อ.สอง จ.แพร่,15:00 น.,21,18.434082380803716,100.11434197425842
ทต.ทับคล้อ,ต.ทับคล้อ อ.ทับคล้อ จ.พิจิตร,15:00 น.,2.4,16.16959789538825,100.56600987911224
อบต.บ้านกลาง,ต.บ้านกลาง อ.สอง จ.แพร่,15:00 น.,17.8,18.48202574792197,100.17752945423126
บ้านม่วงชุม,ต.ครึ่ง อ.เชียงของ จ.เชียงราย,14:00 น.,5,20.101241439494185,100.4039990901947
บ้านแก่น,ต.นายาง อ.สบปราบ จ.ลำปาง,14:00 น.,7,17.9327894987897,99.27499830722809
บ้านใหม่เจริญไพร,ต.ฝายกวาง อ.เชียงคำ จ.พะเยา,14:00 น.,7.5,19.393136847075226,100.30100226402283
บ้านซำรู้,ต.ห้วยเฮี้ย อ.นครไทย จ.พิษณุโลก,12:00 น.,1,16.939049400964592,100.81700026988983
บ้านห้วยแม่เลี่ยม,ต.ห้วยชมภู อ.เมืองเชียงราย จ.เชียงราย,14:00 น.,5,19.919977805092575,99.62299883365631
ส.ช่องนนทรี,ต.ช่องนนทรี อ.ยานนาวา จ.กรุงเทพมหานคร,15:00 น.,2.5,13.694931717615138,100.54874181747437
บ้านทุ่งทราย,ต.เวียง อ.เชียงของ จ.เชียงราย,14:00 น.,7,20.261341603321085,100.36700069904327
บ้านขุนกลาง,ต.บ้านหลวง อ.จอมทอง จ.เชียงใหม่,14:00 น.,11,18.53855645003312,98.52400124073029
บ้านเจดีย์,ต.ป่าตาล อ.ขุนตาล จ.เชียงราย,14:00 น.,6.5,19.852784637659774,100.27200222015381
บ้านห้วยรวก,ต.หนองฝ้าย อ.เลาขวัญ จ.กาญจนบุรี,14:00 น.,7,14.66694447842582,99.61799919605255
บ้านอากู่,ต.เทอดไทย อ.แม่ฟ้าหลวง จ.เชียงราย,14:00 น.,13,20.251155523673205,99.67899799346924
บ้านวังดิน,ต.บ้านหนุน อ.สอง จ.แพร่,14:00 น.,7.5,18.50869359575572,100.13299942016602
เขตบางนา,ต.บางนา อ.บางนา จ.กรุงเทพมหานคร,15:00 น.,2.5,13.680947753034536,100.59183955192566
ทต.พังโคน,ต.พังโคน อ.พังโคน จ.สกลนคร,15:00 น.,7.4,17.39867607810202,103.71429026126862
พัทยา,ต.เขตการปกครองพิเศษพัทยา อ.บางละมุง จ.ชลบุรี,10:00 น.,7.4,12.919999355142153,100.86944282054901
หน่วยจัดการต้นน้ำลำเชิญ,ต.ทุ่งพระ อ.คอนสาร จ.ชัยภูมิ,15:00 น.,1.6,16.660635558270723,101.73714816570282
ทต.สวนผึ้ง,ต.สวนผึ้ง อ.สวนผึ้ง จ.ราชบุรี,13:00 น.,7.2,13.544890536882551,99.33835744857788
ทต.น้ำปาด,ต.แสนตอ อ.น้ำปาด จ.อุตรดิตถ์,15:00 น.,7,17.72531616387186,100.68140387535095
บ้านห้วยหยวกป่าโซ,ต.แม่สลองใน อ.แม่ฟ้าหลวง จ.เชียงราย,14:00 น.,12,20.250908915976584,99.58100080490112
สะพานอิงอุดม,ต.ศรีดอนชัย อ.เชียงของ จ.เชียงราย,15:00 น.,6,20.196383837510506,100.4417484998703
ปตร.คลองวัดด่าน,ต.ทรงคนอง อ.พระประแดง จ.สมุทรปราการ,15:00 น.,1.5,13.670710734383432,100.54018020629883
บ้านสะพานไทร,ต.บางดี อ.ห้วยยอด จ.ตรัง,14:00 น.,7,7.863844120546546,99.46399748325348
บ้านปางสัก,ต.แม่เปิน อ.แม่เปิน จ.นครสวรรค์,13:00 น.,6,15.751258484839838,99.31399762630463
ส.คลองชักพระ,ต.คลองชักพระ อ.ตลิ่งชัน จ.กรุงเทพมหานคร,02:00 น.,7,13.778922215490507,100.46499788761139
บ้านสบขาม,ต.ขุนควร อ.ปง จ.พะเยา,14:00 น.,7,19.1503929281618,100.38999795913696
บ้านหนองใหญ่ ,ต.หนองปรือ อ.หนองปรือ จ.กาญจนบุรี,12:00 น.,0.5,14.715638384921593,99.43063080310822
บ้านศรีบุญเรือง,ต.หนองป่าก่อ อ.ดอยหลวง จ.เชียงราย,14:00 น.,5.5,20.18179292376095,100.13700127601624
น้ำพอง บ้านผานกเค้า (E.29),ต.นาหนองทุ่ม อ.ชุมแพ จ.ขอนแก่น,14:00 น.,7,16.849387821366406,101.94667160511017
บ้านโป่ง,ต.โป่ง อ.ด่านซ้าย จ.เลย,13:00 น.,0.5,17.181651554855733,101.1600011587143
ทต.บะยาว,ต.บะยาว อ.วังสามหมอ จ.อุดรธานี,15:00 น.,7,17.080835543967762,103.39910924434662
เขื่อนอุบลรัตน์,ต.เขื่อนอุบลรัตน์ อ.อุบลรัตน์ จ.ขอนแก่น,14:00 น.,7,16.772498990998876,102.62082874774933
บ้านน้ำมี,ต.น้ำทูน อ.ท่าลี่ จ.เลย,14:00 น.,0.5,17.518405575066915,101.37300074100494
อบต.ดอยเต่า,ต.ดอยเต่า อ.ดอยเต่า จ.เชียงใหม่,15:00 น.,8.4,17.915486751567848,98.72794032096863
รร. บ้านเพ็กเฟื้อย-ห้วยเตย,ต.หนองหว้า อ.เมืองหนองบัวลำภู จ.หนองบัวลำภู,15:00 น.,1.8,17.14743376337194,102.33208894729614
บ้านห้วยน้ำเค็ม,ต.บ้านเสด็จ อ.เมืองลำปาง จ.ลำปาง,14:00 น.,7.5,18.3857540252356,99.61599826812744
น้ำพวย อ.ผาขาว,ต.ท่าช้างคล้อง อ.ผาขาว จ.เลย,14:00 น.,3,17.03362817004157,102.08351254463196
บ้านแม่แอบ,ต.บ้านแซว อ.เชียงแสน จ.เชียงราย,14:00 น.,6.5,20.19184760874398,100.22099733352661
บ้านกกเต็น,ต.ห้วยขมิ้น อ.ด่านช้าง จ.สุพรรณบุรี,13:00 น.,1,14.944707130365503,99.59500193595886
ส.คลองบางจาก,ต.บางจาก อ.พระโขนง จ.กรุงเทพมหานคร,15:00 น.,2,13.689099520279346,100.59068083763123
บ้านป่าหก,ต.ลี้ อ.ลี้ จ.ลำพูน,14:00 น.,7.5,17.776738446204213,98.9710021018982
ส.คลองสำโรง,ต.เทพารักษ์ อ.เมืองสมุทรปราการ จ.สมุทรปราการ,02:00 น.,7,13.648191898914314,100.59513866901398
บ้านน้ำพริก,ต.ยางโกลน อ.นครไทย จ.พิษณุโลก,12:00 น.,1,17.198389114784653,100.9119987487793
ศาลากลางหมู่บ้านแพรกตะลุย,ต.เขาจ้าว อ.ปราณบุรี จ.ประจวบคีรีขันธ์,14:00 น.,1.6,12.322471836022157,99.6234118938446
วังวิเศษ,ต.เขาวิเศษ อ.วังวิเศษ จ.ตรัง,15:00 น.,9.6,7.668914138249084,99.45938408374786
เทิง,ต.เวียง อ.เทิง จ.เชียงราย,15:00 น.,0.4,19.688263482397435,100.18752336502075
เมืองตรัง,ต.บางรัก อ.เมืองตรัง จ.ตรัง,15:00 น.,25.2,7.555903648091325,99.57824349403381
