สถานีบ้านบือจะ,ต.ผดุงมาตร อ.จะแนะ จ.นราธิวาส ,05:00 ,1
สถานีเก้าเลี้ยว,ต.หัวดง อ.เก้าเลี้ยว จ.นครสวรรค์ ,03:00 ,1
สถานีวังทอง,ต.ดินทอง อ.วังทอง จ.พิษณุโลก ,03:00 ,1
สถานีบ้านห้วยสลัก,ต.ป่าแดด อ.แม่สรวย จ.เชียงราย ,05:00 ,1
สถานีบ้านปูโป,ต.สามัคคี อ.รือเสาะ จ.นราธิวาส ,05:00 ,1
สถานีบ้านเขาหลัก,ต.ปากแจ่ม อ.ห้วยยอด จ.ตรัง ,05:00 ,1
สถานีบ้านจันทิ,ต.ท่ากุ่ม อ.เมืองตราด จ.ตราด ,05:00 ,1
สถานีบ้านพุน้อย,ต.ลาดหญ้า อ.เมืองกาญจนบุรี จ.กาญจนบุรี ,05:00 ,1
สถานีบ้านลาดเหนือ,ต.หนองบัวแดง อ.หนองบัวแดง จ.ชัยภูมิ ,05:00 ,1
สถานีบ้านมอเสือดุ,ต.เพชรชมภู อ.โกสัมพีนคร จ.กำแพงเพชร ,05:00 ,1
สถานีอบต.ตาดกลอย,ต.ตาดกลอย อ.หล่มเก่า จ.เพชรบูรณ์ ,06:00 ,1
สถานีบ้านในปง,ต.อ่าวตง อ.วังวิเศษ จ.ตรัง ,05:00 ,1
สถานีเขื่องใน,ต.เขื่องใน อ.เขื่องใน จ.อุบลราชธานี ,03:00 ,1
สถานีบ้านทรายงาม,ต.ห้วยปริก อ.ฉวาง จ.นครศรีธรรมราช ,05:00 ,1
สถานีบ้านกิ่วจันทร์,ต.ขุนน่าน อ.เฉลิมพระเกียรติ จ.น่าน ,05:00 ,1
สถานีสะพานมิตรภาพรับร่อ-หินแก้ว,ต.รับร่อ อ.ท่าแซะ จ.ชุมพร ,03:00 ,1
สถานีบ้านขุนสาใน,ต.โป่งสา อ.ปาย จ.แม่ฮ่องสอน ,05:00 ,1
สถานีบ้านท่าเรือ*,ต.บาตง อ.รือเสาะ จ.นราธิวาส ,05:00 ,1
สถานีมูศ๊อลลา(มัสยิด)ชูฮาดา,ต.ควนกาหลง อ.ควนกาหลง จ.สตูล ,06:00 ,1
สถานีบ้านแก่งแคบ,ต.ท่ากระดาน อ.ศรีสวัสดิ์ จ.กาญจนบุรี ,05:00 ,1
สถานีบ้านวังลุง,ต.ทอนหงส์ อ.พรหมคีรี จ.นครศรีธรรมราช ,05:00 ,1
สถานีลำโดมใหญ่ บ้านนาเยีย,ต.นาเยีย อ.นาเยีย จ.อุบลราชธานี ,05:00 ,1
สถานีสะพานวัดมงคลร่วมใจ (บ้านวังสาร),ต.ท่าตาล อ.บางกระทุ่ม จ.พิษณุโลก ,03:00 ,1
สถานีบ้านหัวบุ่ง,ต.เนินหอม อ.เมืองปราจีนบุรี จ.ปราจีนบุรี ,05:00 ,1
สถานีหน่วยบริการประปาศรีสาคร (กปภ.สาขารือเสาะ),ต.ซากอ อ.ศรีสาคร จ.นราธิวาส ,06:00 ,1
สถานีบ้านทุ่งน้ำใส,ต.โป่ง อ.ด่านซ้าย จ.เลย ,05:00 ,1
สถานีบ้านอุมุง,ต.บุฮม อ.เชียงคาน จ.เลย ,05:00 ,1
สถานีบ้านห้วยไผ่,ต.บ่อเบี้ย อ.บ้านโคก จ.อุตรดิตถ์ ,05:00 ,1
สถานีบ้านห้วยครก,ต.เขาปู่ อ.ศรีบรรพต จ.พัทลุง ,05:00 ,1
สถานีบ้านสงเปือย,ต.ธาตุ อ.เชียงคาน จ.เลย ,05:00 ,1
สถานีอบต.บางใหญ่,ต.บางใหญ่ อ.กระบุรี จ.ระนอง ,06:00 ,1
สถานีเชียงราย สกษ.,ต.ป่าอ้อดอนชัย อ.เมืองเชียงราย จ.เชียงราย ,04:00 ,1
สถานีทม.ทับกวาง,ต.ทับกวาง อ.แก่งคอย จ.สระบุรี ,06:00 ,1
สถานีบ้านปางข้าวสาร,ต.แม่เล่ย์ อ.แม่วงก์ จ.นครสวรรค์ ,05:00 ,1
สถานีเมืองระนอง,ต.เขานิเวศน์ อ.เมืองระนอง จ.ระนอง ,03:00 ,1
สถานีบ้านโป่งน้ำร้อน,ต.ดอยฮาง อ.เมืองเชียงราย จ.เชียงราย ,05:00 ,1
สถานีบ้านสันติชล,ต.เวียงใต้ อ.ปาย จ.แม่ฮ่องสอน ,06:00 ,1
สถานีบ้านสบป่อง,ต.ปางมะผ้า อ.ปางมะผ้า จ.แม่ฮ่องสอน ,05:00 ,1
สถานีบ้านทุ่งปรือ,ต.พะตง อ.หาดใหญ่ จ.สงขลา ,05:00 ,1
สถานีบ้านแม่มอญ,ต.ห้วยชมภู อ.เมืองเชียงราย จ.เชียงราย ,05:00 ,1
สถานีบ้านต้นงิ้วเหนือ,ต.ป่าโปง อ.สบเมย จ.แม่ฮ่องสอน ,05:00 ,1
สถานีบ้านต้นกอ,ต.ร่อนพิบูลย์ อ.ร่อนพิบูลย์ จ.นครศรีธรรมราช ,05:00 ,1
สถานีน้ำพรม อ.เกษตรสมบูรณ์,ต.บ้านหัน อ.เกษตรสมบูรณ์ จ.ชัยภูมิ ,05:00 ,1
สถานีบ้านห้วยส้าน,ต.ดงมะดะ อ.แม่ลาว จ.เชียงราย ,05:00 ,1
สถานีบ้านไอร์กลูแป,ต.โคกสะตอ อ.รือเสาะ จ.นราธิวาส ,05:00 ,1
สถานีฮอด,ต.บ้านตาล อ.ฮอด จ.เชียงใหม่ ,03:00 ,1
สถานีบ้านบางอี,ต.โคกเคียน อ.ตะกั่วป่า จ.พังงา ,05:00 ,1
สถานีบ้านห้วยน้ำอุ่น,ต.วาวี อ.แม่สรวย จ.เชียงราย ,05:00 ,1
สถานีบ้านปางขุม,ต.ยั้งเมิน อ.สะเมิง จ.เชียงใหม่ ,05:00 ,1
สถานีเขตห้วยขวาง,ต.ห้วยขวาง อ.ห้วยขวาง จ.กรุงเทพมหานคร ,04:00 ,1
สถานีบ้านคำแสนสุข,ต.ห้วยข่า อ.บุณฑริก จ.อุบลราชธานี ,05:00 ,1
สถานีบ้านห้วยชมภู (บ้านป่าคาหลวง),ต.ท่าก๊อ อ.แม่สรวย จ.เชียงราย ,05:00 ,1
สถานีบ้านบาหรา,ต.ท่าก๊อ อ.แม่สรวย จ.เชียงราย ,05:00 ,1
สถานีบ้านเหนือ,ต.กำพวน อ.สุขสำราญ จ.ระนอง ,05:00 ,1
สถานีเขตบางซื่อ,ต.บางซื่อ อ.บางซื่อ จ.กรุงเทพมหานคร ,04:00 ,1
สถานีระนอง,ต.บางนอน อ.เมืองระนอง จ.ระนอง ,04:00 ,0.9
สถานีอบต.หินดาด,ต.หินดาด อ.ทองผาภูมิ จ.กาญจนบุรี ,06:00 ,0.8
สถานีอบต.แจ้ซ้อน,ต.แจ้ซ้อน อ.เมืองปาน จ.ลำปาง ,06:00 ,0.8
สถานีคลองภาษีเจริญ เพชรเกษม69,ต.หนองแขม อ.หนองแขม จ.กรุงเทพมหานคร ,03:00 ,0.8
สถานีสวนสาธารณะกู่ช้าง ทต.ลำพูน,ต.ในเมือง อ.เมืองลำพูน จ.ลำพูน ,06:00 ,0.8
สถานีปตร. คลองตาสด,ต.บางกระสอบ อ.พระประแดง จ.สมุทรปราการ ,03:00 ,0.8
สถานีทต.หนองบัว,ต.หนองกลับ อ.หนองบัว จ.นครสวรรค์ ,06:00 ,0.8
สถานีชุมชนบ้านโคกพะยอม,ต.ละงู อ.ละงู จ.สตูล ,06:00 ,0.8
สถานีทต.ทุ่งสะโตก,ต.ทุ่งสะโตก อ.สันป่าตอง จ.เชียงใหม่ ,03:00 ,0.8
สถานีอโศก,ต.คลองเตยเหนือ อ.วัฒนา จ.กรุงเทพมหานคร ,03:00 ,0.8
สถานีคลองนางน้อย,ต.นาโยงใต้ อ.เมืองตรัง จ.ตรัง ,03:00 ,0.8
สถานีอบต.นาคู,ต.นาคู อ.นาคู จ.กาฬสินธุ์ ,06:00 ,0.8
สถานีอบต.พังทุย,ต.พังทุย อ.น้ำพอง จ.ขอนแก่น ,06:00 ,0.8
สถานีอุทยานแห่งชาติป่าหินงาม,ต.บ้านไร่ อ.เทพสถิต จ.ชัยภูมิ ,06:00 ,0.8
สถานีอบต.นครชัยศรี,ต.นครชัยศรี อ.นครชัยศรี จ.นครปฐม ,06:00 ,0.8
สถานีรร.บ้านท่าหัน,ต.รมณีย์ อ.กะปง จ.พังงา ,23:00 ,0.8
สถานีฝาง,ต.แม่คะ อ.ฝาง จ.เชียงใหม่ ,03:00 ,0.8
สถานีทต.สุไหงโก-ลก,ต.สุไหงโก-ลก อ.สุไหงโก-ลก จ.นราธิวาส ,06:00 ,0.8
สถานีอบต.บ้านเสด็จ,ต.บ้านเสด็จ อ.เคียนซา จ.สุราษฎร์ธานี ,06:00 ,0.8
สถานีอบต.ทุ่งสมอ,ต.ทุ่งสมอ อ.เขาค้อ จ.เพชรบูรณ์ ,06:00 ,0.8
สถานีท่อทองแดง1,ต.สระแก้ว อ.เมืองกำแพงเพชร จ.กำแพงเพชร ,03:00 ,0.8
สถานีทต.คุ้งตะเภา,ต.คุ้งตะเภา อ.เมืองอุตรดิตถ์ จ.อุตรดิตถ์ ,06:00 ,0.8
สถานีหน่วยพิทักษ์ป่าเขาช่องลม,ต.เขาคันทรง อ.ศรีราชา จ.ชลบุรี ,06:00 ,0.8
สถานีเชียงราย,ต.บ้านดู่ อ.เมืองเชียงราย จ.เชียงราย ,04:00 ,0.7
สถานีสะพานต้นน้ำ (เกาะแก้ว-ตลิ่งสูง),ต.ปางมะค่า อ.ขาณุวรลักษบุรี จ.กำแพงเพชร ,03:00 ,0.6
สถานีบ้านตาก,ต.ตากตก อ.บ้านตาก จ.ตาก ,03:00 ,0.6
สถานีเมืองตราด,ต.ห้วยแร้ง อ.เมืองตราด จ.ตราด ,03:00 ,0.6
สถานีสำนักงานเกษตรอำเภอบางสะพาน,ต.กำเนิดนพคุณ อ.บางสะพาน จ.ประจวบคีรีขันธ์ ,06:00 ,0.6
สถานีที่ทำการผู้ใหญ่บ้าน หมู่ 13 ต.วังทอง,ต.วังทอง อ.วังทอง จ.พิษณุโลก ,06:00 ,0.6
สถานีบันนังสตา,ต.บาเจาะ อ.บันนังสตา จ.ยะลา ,03:00 ,0.6
สถานีบ่อบำบัด ทม.พิจิตร,ต.คลองคะเชนทร์ อ.เมืองพิจิตร จ.พิจิตร ,03:00 ,0.6
สถานีอบต.ช่องสามหมอ,ต.ช่องสามหมอ อ.แก้งคร้อ จ.ชัยภูมิ ,06:00 ,0.6
สถานีทต.ขุนยวม,ต.ขุนยวม อ.ขุนยวม จ.แม่ฮ่องสอน ,06:00 ,0.6
สถานีคลองผันน้ำยม-น่าน4,ต.งิ้วงาม อ.เมืองพิษณุโลก จ.พิษณุโลก ,03:00 ,0.6
สถานีรร.ตชด.บ้านไอร์บือแต,ต.ช้างเผือก อ.จะแนะ จ.นราธิวาส ,06:00 ,0.6
สถานีปตร.วัดบางกระเจ้านอก,ต.บางยอ อ.พระประแดง จ.สมุทรปราการ ,03:00 ,0.6
สถานีแม่พริก,ต.แม่พริก อ.แม่พริก จ.ลำปาง ,03:00 ,0.6
สถานีอบต.นาแขม,ต.นาแขม อ.กบินทร์บุรี จ.ปราจีนบุรี ,06:00 ,0.6
สถานีอบต.ลานกระบือ,ต.ลานกระบือ อ.ลานกระบือ จ.กำแพงเพชร ,06:00 ,0.6
สถานีวัดบ้านน้ำเย็น,ต.เมือง อ.กันทรลักษ์ จ.ศรีสะเกษ ,06:00 ,0.6
สถานีโรงเรียนนิคมสร้างตนเองพัฒนาภาคใต้ 1,ต.ตลิ่งชัน อ.บันนังสตา จ.ยะลา ,06:00 ,0.6
สถานีอบต.เทอดไทย,ต.เทอดไทย อ.แม่ฟ้าหลวง จ.เชียงราย ,06:00 ,0.6
สถานีที่ว่าการอำเภอยี่งอ,ต.ยี่งอ อ.ยี่งอ จ.นราธิวาส ,06:00 ,0.6
สถานีเขตบางกอกใหญ่,ต.วัดท่าพระ อ.บางกอกใหญ่ จ.กรุงเทพมหานคร ,04:00 ,0.5
สถานีบ้านน้ำต้ม,ต.ผาช้างน้อย อ.ปง จ.พะเยา ,05:00 ,0.5
สถานีบ้านแม่ทัง,ต.หางดง อ.ฮอด จ.เชียงใหม่ ,05:00 ,0.5
สถานีบ้านแม่งาวใต้,ต.บ้านร้อง อ.งาว จ.ลำปาง ,05:00 ,0.5
สถานีบ้านคลองเดื่อ,ต.หมูสี อ.ปากช่อง จ.นครราชสีมา ,05:00 ,0.5
สถานีบ้านพนาสวรรค์,ต.แม่ยาว อ.เมืองเชียงราย จ.เชียงราย ,05:00 ,0.5
สถานีบ้านหนองเขียว,ต.แม่กรณ์ อ.เมืองเชียงราย จ.เชียงราย ,05:00 ,0.5
สถานีบ้านปางริมกรณ์,ต.แม่กรณ์ อ.เมืองเชียงราย จ.เชียงราย ,05:00 ,0.5
สถานีบ้านทาทุ่งไผ่*,ต.ทาปลาดุก อ.แม่ทา จ.ลำพูน ,05:00 ,0.5
สถานีบ้านเหนือคลองระแนะ,ต.เขาพระ อ.พิปูน จ.นครศรีธรรมราช ,05:00 ,0.5
สถานีบ้านจุฬาภรณ์พัฒนา,ต.เขาพระ อ.พิปูน จ.นครศรีธรรมราช ,05:00 ,0.5
สถานีบ้านเวียงสา,ต.ทรายขาว อ.พาน จ.เชียงราย ,05:00 ,0.5
สถานีบ้านตุงลอย,ต.อมก๋อย อ.อมก๋อย จ.เชียงใหม่ ,05:00 ,0.5
สถานีบ้านผาปูนดง,ต.อมก๋อย อ.อมก๋อย จ.เชียงใหม่ ,05:00 ,0.5
สถานีบ้านขุนแม่รวม,ต.แม่นาจร อ.แม่แจ่ม จ.เชียงใหม่ ,05:00 ,0.5
สถานีบ้านสันต้นม่วง,ต.ม่อนจอง อ.อมก๋อย จ.เชียงใหม่ ,05:00 ,0.5
สถานีบ้านห้วยหินลับ,ต.ทุ่งใส อ.สิชล จ.นครศรีธรรมราช ,05:00 ,0.5
สถานีบ้านคลองกระท้อน,ต.บางบุตร อ.บ้านค่าย จ.ระยอง ,05:00 ,0.5
สถานีบ้านเจ็ดลูกเนิน,ต.ชากบก อ.บ้านค่าย จ.ระยอง ,05:00 ,0.5
สถานีบ้านแม่เตาดิน,ต.ห้วยแก้ว อ.แม่ออน จ.เชียงใหม่ ,05:00 ,0.5
สถานีบ้านห้วยมะแกง,ต.ป่าแดด อ.แม่สรวย จ.เชียงราย ,05:00 ,0.5
สถานีบ้านปางกลาง,ต.แม่พริก อ.แม่สรวย จ.เชียงราย ,05:00 ,0.5
สถานีบ้านพญากองดี,ต.ศรีถ้อย อ.แม่สรวย จ.เชียงราย ,05:00 ,0.5
สถานีบ้านผาใต้,ต.ห้วยชมภู อ.เมืองเชียงราย จ.เชียงราย ,05:00 ,0.5
สถานีบ้านดอยล้าน,ต.วาวี อ.แม่สรวย จ.เชียงราย ,05:00 ,0.5
สถานีเขตประเวศ,ต.ประเวศ อ.ประเวศ จ.กรุงเทพมหานคร ,04:00 ,0.5
สถานีเขตคลองเตย,ต.คลองเตย อ.คลองเตย จ.กรุงเทพมหานคร ,04:00 ,0.5
สถานีเขตธนบุรี,ต.บางยี่เรือ อ.ธนบุรี จ.กรุงเทพมหานคร ,04:00 ,0.5
สถานีบ้านดอยมด,ต.แม่เจดีย์ใหม่ อ.เวียงป่าเป้า จ.เชียงราย ,05:00 ,0.5
สถานีเขตบางบอน,ต.บางบอน อ.บางบอน จ.กรุงเทพมหานคร ,04:00 ,0.5
สถานีเขตบางขุนเทียน,ต.แสมดำ อ.บางขุนเทียน จ.กรุงเทพมหานคร ,04:00 ,0.5
สถานีจุดวัด ถ.เทศบาลสงเคราะห์,ต.ลาดยาว อ.จตุจักร จ.กรุงเทพมหานคร ,04:00 ,0.5
สถานีบ้านถ้ำ,ต.เชียงดาว อ.เชียงดาว จ.เชียงใหม่ ,05:00 ,0.5
สถานีบ้านขุนลาว,ต.แม่เจดีย์ใหม่ อ.เวียงป่าเป้า จ.เชียงราย ,05:00 ,0.5
สถานีส.คลองเจ้าคุณสิงห์,ต.วังทองหลาง อ.วังทองหลาง จ.กรุงเทพมหานคร ,04:00 ,0.5
สถานีบ้านหนองกะโตวา,ต.ปากช่อง อ.ปากช่อง จ.นครราชสีมา ,05:00 ,0.5
สถานีจุดวัด ค.ประเวศฯ-วัดขจรศิริ,ต.สวนหลวง อ.สวนหลวง จ.กรุงเทพมหานคร ,04:00 ,0.5
สถานีบ้านราษฎร์ภักดี,ต.ตับเต่า อ.เทิง จ.เชียงราย ,05:00 ,0.5
สถานีปตร.คลองแสนแสบ,ต.หนองจอก อ.หนองจอก จ.กรุงเทพมหานคร ,04:00 ,0.5
สถานีส.รัชดา-วิภาวดี,ต.จตุจักร อ.จตุจักร จ.กรุงเทพมหานคร ,04:00 ,0.5
สถานีบ้านหัวแม่คำ,ต.แม่สลองใน อ.แม่ฟ้าหลวง จ.เชียงราย ,05:00 ,0.5
สถานีจุดวัดบึงหนองบอน,ต.หนองบอน อ.ประเวศ จ.กรุงเทพมหานคร ,04:00 ,0.5
สถานีส.คลองดาวคะนอง,ต.บางปะกอก อ.ราษฎร์บูรณะ จ.กรุงเทพมหานคร ,04:00 ,0.5
สถานีส.คลองเลนเปน,ต.แสมดำ อ.บางขุนเทียน จ.กรุงเทพมหานคร ,04:00 ,0.5
สถานีส.คลองราชมนตรี,ต.แสมดำ อ.บางขุนเทียน จ.กรุงเทพมหานคร ,04:00 ,0.5
สถานีส.คลองสนามชัย,ต.ท่าข้าม อ.บางขุนเทียน จ.กรุงเทพมหานคร ,04:00 ,0.5
สถานีบ้านห้วยกอก,ต.ห้วยเฮี้ย อ.นครไทย จ.พิษณุโลก ,05:00 ,0.5
สถานีบ้านนาล้อม,ต.ป่าแดง อ.ชาติตระการ จ.พิษณุโลก ,05:00 ,0.5
สถานีบ้านกลาง,ต.ห้วยโป่ง อ.เมืองแม่ฮ่องสอน จ.แม่ฮ่องสอน ,05:00 ,0.5
สถานีบ้านชายควน,ต.ปาดังเบซาร์ อ.สะเดา จ.สงขลา ,05:00 ,0.5
สถานีบ้านคลองต่อ,ต.กำแพงเพชร อ.รัตภูมิ จ.สงขลา ,05:00 ,0.5
สถานีบ้านมอล่อง,ต.แม่สลองใน อ.แม่ฟ้าหลวง จ.เชียงราย ,05:00 ,0.5
สถานีบ้านแม่ตืน,ต.แม่ตืน อ.ลี้ จ.ลำพูน ,05:00 ,0.5
สถานีบ้านกิ่วเคียน,ต.จริม อ.ท่าปลา จ.อุตรดิตถ์ ,05:00 ,0.5
สถานีบ้านแพมบก,ต.ทุ่งยาว อ.ปาย จ.แม่ฮ่องสอน ,05:00 ,0.5
สถานีบ้านดงขนุน,ต.ธารทอง อ.พาน จ.เชียงราย ,05:00 ,0.5
สถานีบ้านสวนปอ,ต.แก่งศรีภูมิ อ.ภูหลวง จ.เลย ,05:00 ,0.5
สถานีบ้านตาดรินทอง,ต.ธาตุทอง อ.ภูเขียว จ.ชัยภูมิ ,05:00 ,0.5
สถานีบ้านโก๊ะไม้หลู่,ต.ป่าแป๋ อ.แม่สะเรียง จ.แม่ฮ่องสอน ,05:00 ,0.5
สถานีบ้านฮากไม้เหนือ,ต.ป่าแป๋ อ.แม่สะเรียง จ.แม่ฮ่องสอน ,05:00 ,0.5
สถานีบ้านแม่สุ,ต.แม่ลาหลวง อ.แม่ลาน้อย จ.แม่ฮ่องสอน ,05:00 ,0.5
สถานีบ้านเมืองแพม,ต.ถ้ำลอด อ.ปางมะผ้า จ.แม่ฮ่องสอน ,05:00 ,0.5
สถานีบ้านสันติสุข,ต.เวียงต้า อ.ลอง จ.แพร่ ,05:00 ,0.5
สถานีบ้านปางเคาะ,ต.ไทรย้อย อ.เด่นชัย จ.แพร่ ,05:00 ,0.5
สถานีบ้านนาลานข้าว,ต.วังยาว อ.ด่านซ้าย จ.เลย ,05:00 ,0.5
สถานีบ้านแม่จอก,ต.แม่ป้าก อ.วังชิ้น จ.แพร่ ,05:00 ,0.5
สถานีบ้านท่าทองแดง,ต.นาโบสถ์ อ.วังเจ้า จ.ตาก ,05:00 ,0.5
สถานีบ้านบางบอน,ต.คลองศก อ.พนม จ.สุราษฎร์ธานี ,05:00 ,0.5
สถานีบ้านใหม่ไทยถาวร,ต.ทัพราช อ.ตาพระยา จ.สระแก้ว ,05:00 ,0.5
สถานีบ้านลานสาง,ต.แม่ท้อ อ.เมืองตาก จ.ตาก ,05:00 ,0.5
สถานีบ้านขุนสถาน,ต.สันทะ อ.นาน้อย จ.น่าน ,02:00 ,0.5
สถานีบ้านด่าน,ต.ปากแจ่ม อ.ห้วยยอด จ.ตรัง ,05:00 ,0.5
สถานีบ้านควนใหม่,ต.โคกชะงาย อ.เมืองพัทลุง จ.พัทลุง ,05:00 ,0.5
สถานีบ้านท้องฟ้า,ต.ท้องฟ้า อ.บ้านตาก จ.ตาก ,05:00 ,0.5
สถานีเถิน,ต.แม่ปะ อ.เถิน จ.ลำปาง ,04:00 ,0.5
