ชื่อสถานี,ที่ตั้ง,เวลา,ฝนล่าสุด (มม.)
สถานีบ้านแผ่นดินเย็น,ต.แซร์ออ อ.วัฒนานคร จ.สระแก้ว ,05:00 ,299.5
สถานีบ้านซำม่วง,ต.วังกวาง อ.น้ำหนาว จ.เพชรบูรณ์ ,05:00 ,101
สถานีบ้านมาแน,ต.ยะหา อ.ยะหา จ.ยะลา ,05:00 ,88.5
สถานีอาคารสูบน้ำดิบ กปภ. อ.ยะหา จ.ยะลา,ต.บาโร๊ะ อ.ยะหา จ.ยะลา ,05:00 ,81
สถานีเวียงสระ,ต.ทุ่งหลวง อ.เวียงสระ จ.สุราษฎร์ธานี ,06:00 ,78.8
สถานีบ้านละแอ,ต.ละแอ อ.ยะหา จ.ยะลา ,05:00 ,78
สถานีบ้านหนักไทร*,ต.ช่อง อ.นาโยง จ.ตรัง ,05:00 ,78
สถานีอบต.สินปุน,ต.สินปุน อ.เขาพนม จ.กระบี่ ,06:00 ,76.8
สถานีพระแสง สอท.,ต.ทุ่งหลวง อ.เวียงสระ จ.สุราษฎร์ธานี ,04:00 ,69
สถานีบ้านบันนังบูโบ,ต.ถ้ำทะลุ อ.บันนังสตา จ.ยะลา ,05:00 ,68
สถานีอ.พระแสง,ต.อิปัน อ.พระแสง จ.สุราษฎร์ธานี ,05:00 ,67
สถานีบ้านน้ำเชี่ยว,ต.เขาแดง อ.สะบ้าย้อย จ.สงขลา ,05:00 ,65.5
สถานีบ้านลีมาปูโร๊ะ,ต.บาโงยซิแน อ.ยะหา จ.ยะลา ,05:00 ,65.5
สถานีบ้านเปียงซ้อ,ต.ขุนน่าน อ.เฉลิมพระเกียรติ จ.น่าน ,04:00 ,64.5
สถานีบ้านหว้าหลัง,ต.สะท้อน อ.นาทวี จ.สงขลา ,05:00 ,63.5
สถานีบ้านไสท้อน,ต.ช่อง อ.นาโยง จ.ตรัง ,06:00 ,63
สถานีโครงการชลประทานยะลา,ต.สะเตง อ.เมืองยะลา จ.ยะลา ,06:00 ,62.4
สถานีบ้านกลาง,ต.ละมอ อ.นาโยง จ.ตรัง ,06:00 ,59
สถานีบ้านท่าเรือ*,ต.บาตง อ.รือเสาะ จ.นราธิวาส ,05:00 ,58.5
สถานีบ้านดงบัง,ต.มหาไชย อ.สมเด็จ จ.กาฬสินธุ์ ,06:00 ,58
สถานีบ้านวังสมบูรณ์,ต.เขาปูน อ.ห้วยยอด จ.ตรัง ,05:00 ,53.5
สถานีบุรีรัมย์,ต.ร่อนทอง อ.สตึก จ.บุรีรัมย์ ,04:00 ,53.4
สถานีสถานีฟาร์มตัวอย่างฯ บ้านลุตง,ต.ปากล่อ อ.โคกโพธิ์ จ.ปัตตานี ,06:00 ,52.8
สถานีส.คลองบางกอกใหญ่,ต.วัดอรุณ อ.บางกอกใหญ่ จ.กรุงเทพมหานคร ,06:00 ,52
สถานีบ้านควนขวาง,ต.เขาวิเศษ อ.วังวิเศษ จ.ตรัง ,06:00 ,50.5
สถานีสะพานท่าสาป,ต.สะเตง อ.เมืองยะลา จ.ยะลา ,05:00 ,50
สถานียะลา สกษ.,ต.สะเตงนอก อ.เมืองยะลา จ.ยะลา ,22:00 ,49.5
สถานีทต.สุไหงโก-ลก,ต.สุไหงโก-ลก อ.สุไหงโก-ลก จ.นราธิวาส ,06:00 ,49
สถานีเขตธนบุรี,ต.บางยี่เรือ อ.ธนบุรี จ.กรุงเทพมหานคร ,06:00 ,48
สถานีบ้านทุ่งลัง,ต.สะท้อน อ.นาทวี จ.สงขลา ,05:00 ,48
สถานีรร.บ้านพูน,ต.กะปาง อ.ทุ่งสง จ.นครศรีธรรมราช ,06:00 ,45.4
สถานีตรัง,ต.โคกหล่อ อ.เมืองตรัง จ.ตรัง ,04:00 ,45
สถานีเขตบางกอกใหญ่,ต.วัดท่าพระ อ.บางกอกใหญ่ จ.กรุงเทพมหานคร ,06:00 ,45
สถานีบ้านหินลับ,ต.มวกเหล็ก อ.มวกเหล็ก จ.สระบุรี ,06:00 ,44
สถานีบ้านวัด,ต.ประกอบ อ.นาทวี จ.สงขลา ,06:00 ,43.5
สถานีบ้านลูโบ๊ะปันยัง,ต.กาบัง อ.กาบัง จ.ยะลา ,05:00 ,43
สถานีบ้านคลองหิน,ต.เขาพระ อ.รัตภูมิ จ.สงขลา ,06:00 ,43
สถานีหน่วยพิทักษ์อุทยานฯ ที่ นน.๖ (ถ้ำใหญ่น้ำหนาว),ต.หลักด่าน อ.น้ำหนาว จ.เพชรบูรณ์ ,06:00 ,43
สถานีอบต.เขาตูม,ต.เขาตูม อ.ยะรัง จ.ปัตตานี ,06:00 ,43
สถานีเขตรักษาพันธุ์สัตว์ป่าฮาลา-บาลา,ต.โละจูด อ.แว้ง จ.นราธิวาส ,06:00 ,41
สถานีบ้านไอร์เจี๊ยะ,ต.ซากอ อ.ศรีสาคร จ.นราธิวาส ,05:00 ,41
สถานีบ้านคลองกั่ว,ต.เขาพระ อ.รัตภูมิ จ.สงขลา ,06:00 ,41
สถานีศูนย์เรียนรู้ชุมชนบ้านนาซัว หมู่ที่ 2,ต.ถ้ำทะลุ อ.บันนังสตา จ.ยะลา ,06:00 ,41
สถานีบ้านพอนอคี,ต.ห้วยโป่ง อ.เมืองแม่ฮ่องสอน จ.แม่ฮ่องสอน ,06:00 ,41
สถานีบ้านห้วยเงาะ,ต.ทุ่งพลา อ.โคกโพธิ์ จ.ปัตตานี ,05:00 ,41
สถานีทต.ห้วยยอด,ต.ห้วยยอด อ.ห้วยยอด จ.ตรัง ,06:00 ,40.2
สถานีบ้านทุ่งปรือ,ต.พะตง อ.หาดใหญ่ จ.สงขลา ,05:00 ,39.5
สถานีอบต.บูกิต,ต.บูกิต อ.เจาะไอร้อง จ.นราธิวาส ,06:00 ,38.6
สถานีบ้านน้ำกิใต้,ต.ผาทอง อ.ท่าวังผา จ.น่าน ,06:00 ,38.5
สถานีบ้านนาส้อง,ต.คลองใหญ่ อ.ตะโหมด จ.พัทลุง ,06:00 ,38
สถานีบ้านด่าน,ต.ปากแจ่ม อ.ห้วยยอด จ.ตรัง ,05:00 ,38
สถานีบ้านหน้าวัด,ต.ในเตา อ.ห้วยยอด จ.ตรัง ,18:00 ,37.5
สถานีอบต.โนนขวาง,ต.โนนขวาง อ.บ้านด่าน จ.บุรีรัมย์ ,06:00 ,37.4
สถานีอุทยานแห่งชาติเขาใหญ่,ต.หินตั้ง อ.เมืองนครนายก จ.นครนายก ,06:00 ,36.8
สถานีบ้านทรายขาวออก,ต.ทรายขาว อ.โคกโพธิ์ จ.ปัตตานี ,05:00 ,36
สถานีเขตคลองสาน,ต.คลองสาน อ.คลองสาน จ.กรุงเทพมหานคร ,06:00 ,36
สถานีบ้านห้วยต่อ,ต.ไม้ฝาด อ.สิเกา จ.ตรัง ,06:00 ,36
สถานีท่าน้ำสวัสดี,ต.สัมพันธวงศ์ อ.สัมพันธวงศ์ จ.กรุงเทพมหานคร ,06:00 ,36
สถานีบ้านทับยาง,ต.คูหา อ.สะบ้าย้อย จ.สงขลา ,05:00 ,35.5
สถานีทม.ระนอง,ต.เขานิเวศน์ อ.เมืองระนอง จ.ระนอง ,06:00 ,35.4
สถานีบ้านสำนักเอาะ,ต.เขาแดง อ.สะบ้าย้อย จ.สงขลา ,05:00 ,35
สถานีทต.จันดี,ต.จันดี อ.ฉวาง จ.นครศรีธรรมราช ,06:00 ,34.8
สถานีบ้านลาดเหนือ,ต.หนองบัวแดง อ.หนองบัวแดง จ.ชัยภูมิ ,06:00 ,34.5
สถานีปัตตานี,ต.บ่อทอง อ.หนองจิก จ.ปัตตานี ,22:00 ,34.5
สถานีบ้านห้วยปูด,ต.ภูคา อ.ปัว จ.น่าน ,05:00 ,34.5
สถานีบ้านโนนศรีเจริญ,ต.ยอดแกง อ.นามน จ.กาฬสินธุ์ ,06:00 ,34.2
สถานีบ้านตาบาด,ต.บ่อพลอย อ.บ่อไร่ จ.ตราด ,06:00 ,34
สถานีวัดท่ายาง,ต.ท่ายาง อ.ทุ่งใหญ่ จ.นครศรีธรรมราช ,05:00 ,34
สถานีเคียนซา,ต.เคียนซา อ.เคียนซา จ.สุราษฎร์ธานี ,05:00 ,34
สถานีทต.ห้วยราช,ต.ห้วยราช อ.ห้วยราช จ.บุรีรัมย์ ,06:00 ,33.8
สถานีบ้านทุ่งไพล,ต.เขาแดง อ.สะบ้าย้อย จ.สงขลา ,05:00 ,33.5
สถานีบ้านโตนปาหนัน,ต.ทุ่งนุ้ย อ.ควนกาหลง จ.สตูล ,06:00 ,33.5
สถานีส.คลองมอญ,ต.วัดอรุณ อ.บางกอกใหญ่ จ.กรุงเทพมหานคร ,06:00 ,33.5
สถานีบ้านตีนตก,ต.ศิลาแลง อ.ปัว จ.น่าน ,05:00 ,33.5
สถานีสะพานวังแก่ง,ต.เขาเพิ่ม อ.บ้านนา จ.นครนายก ,06:00 ,33.2
สถานีอ่างฯหนองกุดใหญ่,ต.หนองเต็ง อ.กระสัง จ.บุรีรัมย์ ,06:00 ,33.2
สถานีส.คลองสาทร,ต.ยานนาวา อ.สาทร จ.กรุงเทพมหานคร ,06:00 ,33
สถานีที่ว่าการอำเภอแม่วาง,ต.บ้านกาด อ.แม่วาง จ.เชียงใหม่ ,06:00 ,32
สถานีอบต.กาบัง,ต.กาบัง อ.กาบัง จ.ยะลา ,06:00 ,32
สถานีบ้านยุบตาเหน่ง,ต.ป่ายุบใน อ.วังจันทร์ จ.ระยอง ,05:00 ,32
สถานีหาดใหญ่,ต.คอหงส์ อ.หาดใหญ่ จ.สงขลา ,06:00 ,31.8
สถานีชุมชนโกรกประดู่,ต.โคกกลาง อ.ลำปลายมาศ จ.บุรีรัมย์ ,06:00 ,31.6
สถานีบ้านป่าไผ่,ต.กาหลง อ.ศรีสาคร จ.นราธิวาส ,05:00 ,31.5
สถานีบ้านท่ามะปราง,ต.ห้วยยอด อ.ห้วยยอด จ.ตรัง ,05:00 ,31.5
สถานีบ้านผึ้ง,ต.วังยาว อ.ด่านซ้าย จ.เลย ,06:00 ,31.5
สถานีบ้านเกาะแก้ว,ต.เขาตอก อ.เคียนซา จ.สุราษฎร์ธานี ,05:00 ,31.5
สถานีอบต.บ้านแมด,ต.บ้านแมด อ.บุณฑริก จ.อุบลราชธานี ,06:00 ,31.4
สถานีบ้านเกาะจง,ต.ทับช้าง อ.นาทวี จ.สงขลา ,06:00 ,31
สถานีรร.วัดควนสีนวล,ต.นาข้าวเสีย อ.นาโยง จ.ตรัง ,06:00 ,30.8
สถานีสะเดา,ต.ท่าโพธิ์ อ.สะเดา จ.สงขลา ,04:00 ,30.6
สถานีบ้านแก่งลาด,ต.ห้วยเฮี้ย อ.นครไทย จ.พิษณุโลก ,06:00 ,30.5
สถานีบ้านหนองกะโตวา,ต.ปากช่อง อ.ปากช่อง จ.นครราชสีมา ,05:00 ,30.5
สถานีทต.บะยาว,ต.บะยาว อ.วังสามหมอ จ.อุดรธานี ,06:00 ,29.8
สถานีทต.ปลายพระยา,ต.ปลายพระยา อ.ปลายพระยา จ.กระบี่ ,06:00 ,29.4
สถานีแม่น้ำมูล อ.ราษีไศล (M.5),ต.เมืองคง อ.ราษีไศล จ.ศรีสะเกษ ,05:00 ,29
สถานีอุทยานแห่งชาติภูแลนคา,ต.ห้วยต้อน อ.เมืองชัยภูมิ จ.ชัยภูมิ ,06:00 ,28.6
สถานีหนองบัวระเหว,ต.หนองบัวระเหว อ.หนองบัวระเหว จ.ชัยภูมิ ,06:00 ,28.6
สถานีบ้านย่านอุดม,ต.ทุ่งไทรทอง อ.ลำทับ จ.กระบี่ ,05:00 ,28.5
สถานีอุ้มผาง,ต.อุ้มผาง อ.อุ้มผาง จ.ตาก ,04:00 ,28.3
สถานีองค์การบริหารส่วนตำบลตาชี,ต.ตาชี อ.ยะหา จ.ยะลา ,06:00 ,28.2
สถานีที่ทำการอุทยานฯเขาใหญ่,ต.นาหินลาด อ.ปากพลี จ.นครนายก ,06:00 ,28
สถานีบ้านสว้านเหนือ,ต.ดงพญา อ.บ่อเกลือ จ.น่าน ,06:00 ,28
สถานีตาดโตน,ต.นาฝาย อ.เมืองชัยภูมิ จ.ชัยภูมิ ,06:00 ,27.8
สถานีชุมชนหนองใหญ่,ต.หนองใหญ่ อ.ปราสาท จ.สุรินทร์ ,06:00 ,27.8
สถานีมหาชนะชัย,ต.ฟ้าหยาด อ.มหาชนะชัย จ.ยโสธร ,06:00 ,27.6
สถานีบ้านวังหอน,ต.วังอ่าง อ.ชะอวด จ.นครศรีธรรมราช ,18:00 ,27.5
สถานีบ้านน้ำกุ่ม,ต.น้ำกุ่ม อ.นครไทย จ.พิษณุโลก ,06:00 ,27.5
สถานีสำนักงานเกษตรอำเภอเจาะไอร้อง,ต.จวบ อ.เจาะไอร้อง จ.นราธิวาส ,06:00 ,27.4
สถานีอบต.ขะยูง,ต.ขะยูง อ.อุทุมพรพิสัย จ.ศรีสะเกษ ,06:00 ,27.2
สถานีเมืองระนอง,ต.เขานิเวศน์ อ.เมืองระนอง จ.ระนอง ,06:00 ,27.2
สถานีบ้านคลองกลาง,ต.พ่วงพรมคร อ.เคียนซา จ.สุราษฎร์ธานี ,06:00 ,27
สถานีอบต.นากะซะ,ต.นากะชะ อ.ฉวาง จ.นครศรีธรรมราช ,06:00 ,27
สถานีบ้านกงรถ,ต.กงรถ อ.ห้วยแถลง จ.นครราชสีมา ,06:00 ,26.8
สถานีหน่วยพิทักษ์อุทยานแห่งชาติที ขป.๘ (น้ำตกหนานปลิว),ต.ลานข่อย อ.ป่าพะยอม จ.พัทลุง ,06:00 ,26.6
สถานีรร.ภูคาวิทยาคม,ต.ภูคา อ.ปัว จ.น่าน ,06:00 ,26.6
สถานีบ้านไอร์กลูแป,ต.โคกสะตอ อ.รือเสาะ จ.นราธิวาส ,05:00 ,26.5
สถานีจุดวัด ค.บางเชือกหนัง-วัดปากน้ำฝั่งใต้,ต.บางแวก อ.ภาษีเจริญ จ.กรุงเทพมหานคร ,06:00 ,26.5
สถานีบ้านปะตงล่าง (เขาสอยดาว),ต.ทรายขาว อ.สอยดาว จ.จันทบุรี ,06:00 ,26.5
สถานีหน่วยบริการประปาศรีสาคร (กปภ.สาขารือเสาะ),ต.ศรีสาคร อ.ศรีสาคร จ.นราธิวาส ,06:00 ,26
สถานีบ้านควนยาว,ต.ลานข่อย อ.ป่าพะยอม จ.พัทลุง ,06:00 ,26
สถานีบ้านพรุตู,ต.เกาะสะบ้า อ.เทพา จ.สงขลา ,05:00 ,25.5
สถานีอบต.บ้านจารย์,ต.บ้านจารย์ อ.สังขะ จ.สุรินทร์ ,06:00 ,25.4
สถานีบ้านนอก,ต.ตาชี อ.ยะหา จ.ยะลา ,05:00 ,25
สถานีบ้านคำแสนสุข,ต.ห้วยข่า อ.บุณฑริก จ.อุบลราชธานี ,06:00 ,25
สถานีสะพานตาบัว บ้านยาเด๊ะ,ต.ภูเขาทอง อ.สุคิริน จ.นราธิวาส ,06:00 ,24.8
สถานีร้อยเอ็ด สกษ.,ต.เหนือเมือง อ.เมืองร้อยเอ็ด จ.ร้อยเอ็ด ,04:00 ,24.6
สถานีอบต.คลองเฉลิม,ต.คลองเฉลิม อ.กงหรา จ.พัทลุง ,06:00 ,24.6
สถานีบ้านวังใหญ่,ต.วังใหญ่ อ.เทพา จ.สงขลา ,05:00 ,24.5
สถานีบ้านนาวง,ต.บ้านนา อ.ศรีนครินทร์ จ.พัทลุง ,06:00 ,24.5
สถานีบ้านเทอดชาติ,ต.บ่อภาค อ.ชาติตระการ จ.พิษณุโลก ,05:00 ,24.5
สถานีคลองกาแลกูโบ หมู่ที่ 1,ต.คลองใหม่ อ.ยะรัง จ.ปัตตานี ,06:00 ,24.4
สถานีอ่างเก็บน้ำห้วยส้ม,ต.โคกตูม อ.เมืองลพบุรี จ.ลพบุรี ,06:00 ,24.4
สถานีที่ว่าการอำเภอกรงปินัง,ต.สะเอะ อ.กรงปินัง จ.ยะลา ,06:00 ,24.2
สถานีรพสต.บ่อวิน,ต.บ่อวิน อ.ศรีราชา จ.ชลบุรี ,06:00 ,24.2
สถานีรร.บ้านหนองคล้า,ต.เขาวิเศษ อ.วังวิเศษ จ.ตรัง ,06:00 ,24
สถานีบ้านช่องช้าง,ต.พรุพี อ.บ้านนาสาร จ.สุราษฎร์ธานี ,06:00 ,24
สถานีบ้านห้วยบอน,ต.บ้านโหนด อ.สะบ้าย้อย จ.สงขลา ,06:00 ,24
สถานีสะเดา,ต.ท่าโพธิ์ อ.สะเดา จ.สงขลา ,06:00 ,23.8
สถานีศูนย์วิจัยข้าวปัตตานี,ต.มะกรูด อ.โคกโพธิ์ จ.ปัตตานี ,06:00 ,23.6
สถานีคลองปะแต,ต.ปะแต อ.ยะหา จ.ยะลา ,06:00 ,23.6
สถานีไร่ วงศ์ ทอง เมฆ ดี,ต.ที่วัง อ.ทุ่งสง จ.นครศรีธรรมราช ,06:00 ,23.6
สถานีอบต.ตาอุด,ต.ตาอุด อ.ขุขันธ์ จ.ศรีสะเกษ ,06:00 ,23.2
สถานีบ้านเขาจันทร์,ต.หนองธง อ.ป่าบอน จ.พัทลุง ,06:00 ,23
สถานีปากคลองตลาด,ต.พระบรมมหาราชวัง อ.พระนคร จ.กรุงเทพมหานคร ,06:00 ,23
สถานีแม่น้ำชี อ.มหาชนะชัย (E.20A),ต.ฟ้าหยาด อ.มหาชนะชัย จ.ยโสธร ,05:00 ,23
สถานีสะพานข้ามแม่น้ำปัตตานี,ต.ตลิ่งชัน อ.บันนังสตา จ.ยะลา ,06:00 ,22.8
สถานีปากช่อง สกษ.,ต.หนองน้ำแดง อ.ปากช่อง จ.นครราชสีมา ,04:00 ,22.8
สถานีอบต.เขาพระ,ต.เขาพระ อ.รัตภูมิ จ.สงขลา ,06:00 ,22.8
สถานีทม.ทับกวาง,ต.ทับกวาง อ.แก่งคอย จ.สระบุรี ,06:00 ,22.8
สถานีส.คลองบางไส้ไก่,ต.สำเหร่ อ.ธนบุรี จ.กรุงเทพมหานคร ,06:00 ,22.5
สถานีบ้านยางค้อม,ต.ยางค้อม อ.พิปูน จ.นครศรีธรรมราช ,06:00 ,22.5
สถานีบ้านบางเหรียงใต้,ต.บางเหรียง อ.ทับปุด จ.พังงา ,05:00 ,22.5
สถานีลำน้ำขว้าง (ฝายจ้าว),ต.ศิลาแลง อ.ปัว จ.น่าน ,06:00 ,22
สถานีสะพานไอร์ปาโจ,ต.ภูเขาทอง อ.สุคิริน จ.นราธิวาส ,06:00 ,22
สถานีบ้านซำรู้,ต.ห้วยเฮี้ย อ.นครไทย จ.พิษณุโลก ,06:00 ,22
สถานีบ้านห้วยครก,ต.เขาปู่ อ.ศรีบรรพต จ.พัทลุง ,06:00 ,22
สถานีบ้านทับคริสต์,ต.คลองชะอุ่น อ.พนม จ.สุราษฎร์ธานี ,06:00 ,21.6
สถานีบ้านผาแล,ต.ปอ อ.เวียงแก่น จ.เชียงราย ,06:00 ,21.5
สถานีบ้านคันเบ็ด,ต.เขาแก้ว อ.ลานสกา จ.นครศรีธรรมราช ,06:00 ,21.5
สถานีบ้านคลองสะท้อน,ต.วังหมี อ.วังน้ำเขียว จ.นครราชสีมา ,05:00 ,21.5
สถานีเทศบาลตำบลปะแต,ต.ปะแต อ.ยะหา จ.ยะลา ,06:00 ,21.4
สถานีบ้านทุ่งน้ำใส,ต.โป่ง อ.ด่านซ้าย จ.เลย ,06:00 ,21
สถานีบ้านท่านหญิง,ต.ตะกุกเหนือ อ.วิภาวดี จ.สุราษฎร์ธานี ,04:00 ,21
สถานีบ้านโคกไทร,ต.คลองเฉลิม อ.กงหรา จ.พัทลุง ,06:00 ,21
สถานีบ้านวังประจัน,ต.วังประจัน อ.ควนโดน จ.สตูล ,06:00 ,21
สถานีศรีสาคร,ต.ศรีสาคร อ.ศรีสาคร จ.นราธิวาส ,06:00 ,21
สถานีบ้านใหม่ดอนแก้ว,ต.ทาเหนือ อ.แม่ออน จ.เชียงใหม่ ,06:00 ,21
สถานีอบต.ขุนซ่อง,ต.ขุนซ่อง อ.แก่งหางแมว จ.จันทบุรี ,06:00 ,20.8
สถานีฝายคลองท่าเลา,ต.นาหลวงเสน อ.ทุ่งสง จ.นครศรีธรรมราช ,06:00 ,20.8
สถานีท่าตูม,ต.ท่าตูม อ.ท่าตูม จ.สุรินทร์ ,04:00 ,20.8
สถานีระนอง,ต.บางนอน อ.เมืองระนอง จ.ระนอง ,04:00 ,20.6
สถานีสวนสาธารณะ ทต.รือเสาะ,ต.รือเสาะ อ.รือเสาะ จ.นราธิวาส ,06:00 ,20.6
สถานีบ้านคูนายสังข์,ต.แค อ.จะนะ จ.สงขลา ,06:00 ,20.5
สถานีบ้านควนเนียง*,ต.พะตง อ.หาดใหญ่ จ.สงขลา ,05:00 ,20.5
สถานีชุมพวง,ต.ท่าลาด อ.ชุมพวง จ.นครราชสีมา ,06:00 ,20.4
สถานีฝายจิตรมานี,ต.ทรายขาว อ.สอยดาว จ.จันทบุรี ,06:00 ,20.4
สถานีทต.ไก่คำ,ต.ไก่คำ อ.เมืองอำนาจเจริญ จ.อำนาจเจริญ ,06:00 ,20
สถานีบ้านใหม่พัฒนา,ต.บ้านร้อง อ.งาว จ.ลำปาง ,06:00 ,20
