บ้านพุน้ำร้อน,ต.บ้านเก่า อ.เมืองกาญจนบุรี จ.กาญจนบุรี,00:00 น.,3.5,13.931161902148872,99.08300042152405
บ้านจำปาทอง,ต.บ้านทำเนียบ อ.คีรีรัฐนิคม จ.สุราษฎร์ธานี,00:00 น.,6,8.860430922812256,98.90576004981995
บ้านท่าจีน,ต.น้ำน้อย อ.หาดใหญ่ จ.สงขลา,00:00 น.,2.5,7.097187655281978,100.53699910640717
บ้านเปียงซ้อ,ต.ขุนน่าน อ.เฉลิมพระเกียรติ จ.น่าน,00:00 น.,4.5,19.38189807894673,101.1870002746582
น้ำพวย อ.ผาขาว,ต.ท่าช้างคล้อง อ.ผาขาว จ.เลย,23:00 น.,6,17.03362817004157,102.08351254463196
ทต.ยะรัง,ต.ยะรัง อ.ยะรัง จ.ปัตตานี,00:00 น.,1.4,6.764127592238241,101.30066692829132
พุนพิน 1,ต.ท่าข้าม อ.พุนพิน จ.สุราษฎร์ธานี,00:00 น.,1.2,9.131238924699506,99.25883531570435
สะพานแม่เล่ย์,ต.แม่เล่ย์ อ.แม่วงก์ จ.นครสวรรค์,00:00 น.,1.6,15.841719527027593,99.41807270050049
บ้านห้วยไฟ,ต.แม่ขะนิง อ.เวียงสา จ.น่าน,00:00 น.,1,18.763059427221858,100.53900003433228
บ้านห้วยสะแพด,ต.แม่สอย อ.จอมทอง จ.เชียงใหม่,00:00 น.,2,18.18811109514798,98.70199799537659
บ้านสำนักเนียน,ต.เขาน้อย อ.สิชล จ.นครศรีธรรมราช,00:00 น.,1,8.934703224529219,99.69999969005585
บ้านสันต้นม่วง,ต.ม่อนจอง อ.อมก๋อย จ.เชียงใหม่,00:00 น.,1.5,17.384004489767417,98.47699820995331
วัดท่ายาง,ต.ท่ายาง อ.ทุ่งใหญ่ จ.นครศรีธรรมราช,23:00 น.,4,8.302058657577994,99.36824262142181
อบต.อ่าวตง,ต.อ่าวตง อ.วังวิเศษ จ.ตรัง,00:00 น.,17.2,7.855777434070519,99.38441097736359
สะพานคลองพาย,ต.น้ำหัก อ.คีรีรัฐนิคม จ.สุราษฎร์ธานี,00:00 น.,4.4,9.155654662599833,98.89499366283417
อบต.บ้านลำนาว,ต.บ้านลำนาว อ.บางขัน จ.นครศรีธรรมราช,00:00 น.,8.4,8.029208271386919,99.47583138942719
สะพานแม่น้ำว้า บ้านบ่อหยวก,ต.บ่อเกลือเหนือ อ.บ่อเกลือ จ.น่าน,00:00 น.,6.6,19.270328662268543,101.17807388305664
หน่วยพิทักษ์ป่าเขาช่องลม,ต.เขาคันทรง อ.ศรีราชา จ.ชลบุรี,00:00 น.,2.6,13.15716547262991,101.1146879196167
รพสต.แก่นมะกรูด,ต.แก่นมะกรูด อ.บ้านไร่ จ.อุทัยธานี,00:00 น.,2.4,15.161830439301236,99.289031624794
บ้านขุนน้ำพริก,ต.นาไร่หลวง อ.สองแคว จ.น่าน,00:00 น.,0.5,19.3327389698533,100.67299783229828
บ้านป่าข้าวหลาม,ต.นาโป่ง อ.เมืองเลย จ.เลย,00:00 น.,2.5,17.420205245192882,101.62499964237213
บ้านนาคันหัก,ต.พระเพลิง อ.เขาฉกรรจ์ จ.สระแก้ว,00:00 น.,12,13.608059259838063,102.04922318458557
บ้านปางสุด,ต.แม่เล่ย์ อ.แม่วงก์ จ.นครสวรรค์,00:00 น.,0.5,15.850188016996924,99.4299978017807
วิภาวดี,ต.ตะกุกเหนือ อ.วิภาวดี จ.สุราษฎร์ธานี,00:00 น.,3,9.20642978571541,98.95248413085938
ทต.มายอ,ต.มายอ อ.มายอ จ.ปัตตานี,00:00 น.,0.6,6.718131409692922,101.41407608985901
ปตร.วัดบางกระเจ้านอก,ต.บางกระเจ้า อ.พระประแดง จ.สมุทรปราการ,00:00 น.,26.2,13.689594663278914,100.55496454238892
ทต.วังดิน,ต.ลี้ อ.ลี้ จ.ลำพูน,00:00 น.,1.4,17.801986916801614,98.9471572637558
อบต.นาไร่หลวง,ต.นาไร่หลวง อ.สองแคว จ.น่าน,00:00 น.,0.2,19.3670552403937,100.70083916187286
พุนพิน 2,ต.หนองไทร อ.พุนพิน จ.สุราษฎร์ธานี,00:00 น.,0.8,9.085771414826286,99.17001128196716
ทม.ท่าข้าม,ต.ท่าข้าม อ.พุนพิน จ.สุราษฎร์ธานี,00:00 น.,0.2,9.106069368522395,99.2328017950058
เวียงสระ,ต.ทุ่งหลวง อ.เวียงสระ จ.สุราษฎร์ธานี,00:00 น.,1.2,8.571075394942238,99.25392687320709
บ้านเขาวง,ต.ปากแพรก อ.ดอนสัก จ.สุราษฎร์ธานี,00:00 น.,9.5,9.089844870002732,99.7559666633606
บ้านหน้าวัด,ต.ในเตา อ.ห้วยยอด จ.ตรัง,00:00 น.,22,7.872840576320857,99.72699880599976
บ้านมะขาม ,ต.ท่าอุแท อ.กาญจนดิษฐ์ จ.สุราษฎร์ธานี,00:00 น.,8,9.149389352463697,99.62958633899689
บ้านเขื่อนแก้ว,ต.ถืมตอง อ.เมืองน่าน จ.น่าน,00:00 น.,4,18.785066753028172,100.70000231266022
รฟ.สุราษฎร์ธานี,ต.เขาหัวควาย อ.พุนพิน จ.สุราษฎร์ธานี,23:00 น.,4,9.069381778695114,99.22469079494476
อบต.นาสวน,ต.นาสวน อ.ศรีสวัสดิ์ จ.กาญจนบุรี,00:00 น.,4,14.611465685039695,99.1257494688034
บ้านห้วยยาโน,ต.ป่าตึง อ.แม่จัน จ.เชียงราย,00:00 น.,4,20.113099627698027,99.77999925613403
โรงสูบน้ำประปา,ต.เขาวง อ.บ้านตาขุน จ.สุราษฎร์ธานี,23:00 น.,6,8.90682770501497,98.88256967067719
คลองลำปลาทิว ลาดกระบัง,ต.ลาดกระบัง อ.ลาดกระบัง จ.กรุงเทพมหานคร,00:00 น.,16.2,13.740682601981208,100.79468429088593
ทต.แม่จัน,ต.แม่จัน อ.แม่จัน จ.เชียงราย,00:00 น.,2.4,20.139261032653557,99.85798180103302
วัดปากเตลิด,ต.ต้นยวน อ.พนม จ.สุราษฎร์ธานี,23:00 น.,8,8.844720196715253,98.83999228477478
อบต.แม่วงก์,ต.แม่วงก์ อ.แม่วงก์ จ.นครสวรรค์,00:00 น.,1.8,15.781015720859656,99.54587459564209
บ้านมาแน,ต.ยะหา อ.ยะหา จ.ยะลา,00:00 น.,2.5,6.492504435448167,101.11470937728882
บ้านโนนงิ้ว,ต.บ้านบัว อ.เกษตรสมบูรณ์ จ.ชัยภูมิ,23:00 น.,14.5,16.227031528438395,101.91000044345856
บ้านห้วยทรายทอง,ต.ทุ่งใส อ.สิชล จ.นครศรีธรรมราช,00:00 น.,1.5,9.053235083816313,99.88899886608124
นครศรีธรรมราช สกษ.,ต.ท่าเรือ อ.เมืองนครศรีธรรมราช จ.นครศรีธรรมราช,22:00 น.,1.3,8.359303435137559,99.99999940395355
บ้านห้วยหล่อดูก,ต.แม่ตื่น อ.อมก๋อย จ.เชียงใหม่,00:00 น.,1,17.41911502689837,98.45600187778473
จุดวัด ค.บางนา-ถ.ศรีนครินทร์,ต.บางนา อ.บางนา จ.กรุงเทพมหานคร,00:00 น.,13.5,13.661062302393612,100.63942193984985
บ้านวังลุง,ต.ทอนหงส์ อ.พรหมคีรี จ.นครศรีธรรมราช,00:00 น.,1,8.591056946601025,99.77799832820892
บ้านลูโบ๊ะปันยัง,ต.กาบัง อ.กาบัง จ.ยะลา,00:00 น.,11,6.479680257906645,100.98287343978882
ส.เทเวศร์,ต.วัดสามพระยา อ.พระนคร จ.กรุงเทพมหานคร,00:00 น.,3,13.771909395564625,100.50110042095184
บ้านคอกช้าง,ต.ปากแพรก อ.ดอนสัก จ.สุราษฎร์ธานี,00:00 น.,1,9.218206370202212,99.68754887580872
บ้านห้วยบงใหม่,ต.แม่จะเรา อ.แม่ระมาด จ.ตาก,00:00 น.,17,16.879871788936622,98.5779994726181
โครงการผลิตน้ำคลองหลวงแพ่ง,ต.บางเตย อ.เมืองฉะเชิงเทรา จ.ฉะเชิงเทรา,00:00 น.,8.8,13.78572642959132,100.93855798244476
อบต.กาบัง,ต.กาบัง อ.กาบัง จ.ยะลา,00:00 น.,7,6.4801972823669125,100.98261058330536
วัดบางแตน,ต.บางแตน อ.บ้านสร้าง จ.ปราจีนบุรี,00:00 น.,2.8,13.9023934958063,101.16799414157867
บ้านสะเนียน,ต.สะเนียน อ.เมืองน่าน จ.น่าน,00:00 น.,0.5,18.814657578273437,100.7019978761673
ฉวาง,ต.ไม้เรียง อ.ฉวาง จ.นครศรีธรรมราช,22:00 น.,3,8.431944690279009,99.5119446516037
บ้านทับศิลา,ต.ช่องสะเดา อ.เมืองกาญจนบุรี จ.กาญจนบุรี,00:00 น.,16,14.233618339579902,99.15554881095886
บ้านละแอ,ต.ละแอ อ.ยะหา จ.ยะลา,00:00 น.,1,6.4734172932525755,101.16557478904724
บ้านบ้องตี้บน,ต.บ้องตี้ อ.ไทรโยค จ.กาญจนบุรี,00:00 น.,0.5,14.073461889296164,98.99199843406677
บ้านหน้าเหมือง,ต.ควนทอง อ.ขนอม จ.นครศรีธรรมราช,00:00 น.,0.5,9.143690630727264,99.78900074958801
บ้านเขาเหล็ก,ต.ทุ่งปรัง อ.สิชล จ.นครศรีธรรมราช,00:00 น.,0.5,8.976835726681433,99.84799861907959
สุราษฎร์ธานี,ต.หัวเตย อ.พุนพิน จ.สุราษฎร์ธานี,22:00 น.,1,9.135555494842816,99.15194392204285
บ้านตอง,ต.แม่จริม อ.แม่จริม จ.น่าน,00:00 น.,0.2,18.846537935692822,101.02888405323029
อบต.โนนกอก,ต.โนนกอก อ.เกษตรสมบูรณ์ จ.ชัยภูมิ,00:00 น.,26,16.199287850272192,101.93237006664276
ทต.เด่นชัย,ต.เด่นชัย อ.เด่นชัย จ.แพร่,00:00 น.,0.2,17.983646714223404,100.05171775817871
หน่วยจัดการต้นน้ำดอยถ้วย,ต.เมืองนะ อ.เชียงดาว จ.เชียงใหม่,00:00 น.,0.2,19.69241519576906,98.80140602588654
สะพานกะลูบี บ้านสายปารี,ต.มาโมง อ.สุคิริน จ.นราธิวาส,00:00 น.,0.2,5.895701201160583,101.76636278629303
สะพานห้วยน้ำสาย,ต.ตาลชุม อ.ท่าวังผา จ.น่าน,00:00 น.,20.2,19.02635855258948,100.73508024215698
หน่วยจัดการต้นน้ำบ่อแก้ว,ต.แม่นาจร อ.แม่แจ่ม จ.เชียงใหม่,00:00 น.,0.4,18.868625710448022,98.50515067577362
อบต.ขัวก่าย,ต.ขัวก่าย อ.วานรนิวาส จ.สกลนคร,00:00 น.,30,17.60209310391029,103.80707859992981
บ้านห้วยพลู,ต.ด่านแม่ละเมา อ.แม่สอด จ.ตาก,00:00 น.,37,16.792852684256303,98.80400240421295
อบต.แม่ปะ,ต.แม่ปะ อ.เถิน จ.ลำปาง,00:00 น.,23.8,17.651807535029764,99.2676329612732
บ้านแม่ปะแพะ,ต.แม่ปะ อ.เถิน จ.ลำปาง,00:00 น.,20.5,17.63633331688084,99.26900088787079
เขตสวนหลวง,ต.สวนหลวง อ.สวนหลวง จ.กรุงเทพมหานคร,00:00 น.,35,13.73043255223035,100.65154016017914
บ้านห้วยไค้,ต.โคกใหญ่ อ.ท่าลี่ จ.เลย,00:00 น.,14,17.52774645256431,101.4659982919693
จุดวัด ค.ประเวศฯ-วัดขจรศิริ,ต.สวนหลวง อ.สวนหลวง จ.กรุงเทพมหานคร,00:00 น.,17.5,13.715450104194547,100.64149796962738
ปตร.วัดกระทุ่มฯ,ต.ประเวศ อ.ประเวศ จ.กรุงเทพมหานคร,00:00 น.,13.5,13.724100955733617,100.68956851959229
เขตประเวศ,ต.ประเวศ อ.ประเวศ จ.กรุงเทพมหานคร,00:00 น.,14,13.717008322963965,100.69471836090088
ปตร.คลองรางจาก-ถ.ประชาอุทิศ,ต.ทุ่งครุ อ.ทุ่งครุ จ.กรุงเทพมหานคร,00:00 น.,28.5,13.634940227719044,100.50217866897583
บ้านห้วยสีดา,ต.หาดทรายขาว อ.เชียงคาน จ.เลย,00:00 น.,7,17.734431732032373,101.62200093269348
อบต.หนองหญ้า,ต.หนองหญ้า อ.เมืองกาญจนบุรี จ.กาญจนบุรี,00:00 น.,12,13.983732434148525,99.45824146270752
บ้านทุ่งยูง,ต.เขาปู่ อ.ศรีบรรพต จ.พัทลุง,00:00 น.,9,7.757109973464506,99.80699837207794
ส.คลองเจ้าคุณสิงห์,ต.วังทองหลาง อ.วังทองหลาง จ.กรุงเทพมหานคร,00:00 น.,21.5,13.761598188456308,100.61524987220764
บ้านผาหมี,ต.เวียงพางคำ อ.แม่สาย จ.เชียงราย,00:00 น.,6,20.399300996873485,99.85099732875824
คลองแสนแสบ บางกะปิ,ต.หัวหมาก อ.บางกะปิ จ.กรุงเทพมหานคร,00:00 น.,20.8,13.761332456463677,100.61600089073181
เขตห้วยขวาง,ต.ห้วยขวาง อ.ห้วยขวาง จ.กรุงเทพมหานคร,00:00 น.,12,13.776780879730492,100.57906150817871
บ้านท่าอุดม,ต.แม่ปะ อ.เถิน จ.ลำปาง,00:00 น.,12,17.68015559045768,99.31200206279755
บ้านแสะ,ต.ควร อ.ปง จ.พะเยา,00:00 น.,5,19.1556174946806,100.30699968338013
สวนสาธารณะ ทต.รือเสาะ,ต.รือเสาะ อ.รือเสาะ จ.นราธิวาส,00:00 น.,4.8,6.387924085044164,101.51715874671936
จุดวัดบึงหนองบอน,ต.หนองบอน อ.ประเวศ จ.กรุงเทพมหานคร,00:00 น.,18,13.695291339632558,100.65375030040741
สรรคบุรี (แม่น้ำน้อย),ต.เที่ยงแท้ อ.สรรคบุรี จ.ชัยนาท,00:00 น.,6,15.064084222921183,100.16287922859192
จุดวัด ค.แสนแสบ-วัดทรัพย์ฯ,ต.แสนแสบ อ.มีนบุรี จ.กรุงเทพมหานคร,00:00 น.,6,13.8515024167173,100.80361068248749
ส.คลองสามเสน-แสนแสบ,ต.บางกะปิ อ.ห้วยขวาง จ.กรุงเทพมหานคร,00:00 น.,16.5,13.7484206485213,100.59919953346252
เขตป้อมปราบฯ,ต.วัดโสมนัส อ.ป้อมปราบศัตรูพ่าย จ.กรุงเทพมหานคร,00:00 น.,5,13.758258281482865,100.51304161548615
เขตวังทองหลาง,ต.วังทองหลาง อ.วังทองหลาง จ.กรุงเทพมหานคร,00:00 น.,13,13.76434927766517,100.60552954673767
บ้านท่าเรือ*,ต.บาตง อ.รือเสาะ จ.นราธิวาส,00:00 น.,3.5,6.351681901680621,101.49417221546173
โรงเรียนนิคมสร้างตนเองพัฒนาภาคใต้ 1,ต.ตลิ่งชัน อ.บันนังสตา จ.ยะลา,00:00 น.,5.8,6.3125312931072655,101.36104881763458
บ้านกือลอง,ต.ตลิ่งชัน อ.บันนังสตา จ.ยะลา,00:00 น.,7.5,6.30837239964559,101.33558392524719
ส.คลองแจงร้อน,ต.บางพึ่ง อ.พระประแดง จ.สมุทรปราการ,00:00 น.,48.5,13.67627234704129,100.52097022533417
บ้านแม่ละเมา,ต.พะวอ อ.แม่สอด จ.ตาก,00:00 น.,20.5,16.80560408788782,98.74299824237823
เขตราชเทวี,ต.ทุ่งพญาไท อ.ราชเทวี จ.กรุงเทพมหานคร,00:00 น.,5,13.759170117344558,100.53404867649078
เขตวัฒนา,ต.คลองตันเหนือ อ.วัฒนา จ.กรุงเทพมหานคร,00:00 น.,15.5,13.742480352164254,100.58570802211761
ท้ายปตร.ท่าโบสถ์,ต.สามง่ามท่าโบสถ์ อ.หันคา จ.ชัยนาท,00:00 น.,2,15.05348552825705,100.01179575920105
ปตร. คลองลัดบางยอ 2,ต.บางกระสอบ อ.พระประแดง จ.สมุทรปราการ,23:00 น.,25.2,13.661062302393612,100.56729197502136
บ้านโคกทัง,ต.พิจิตร อ.นาหม่อม จ.สงขลา,00:00 น.,2,6.981247281753932,100.59299826622009
เขตพญาไท,ต.สามเสนใน อ.พญาไท จ.กรุงเทพมหานคร,00:00 น.,3.5,13.780031951434559,100.54286777973175
จุดวัดบึงมักกะสัน,ต.มักกะสัน อ.ราชเทวี จ.กรุงเทพมหานคร,00:00 น.,5,13.756648231381169,100.5483877658844
ศูนย์ฯ (ดินแดง),ต.ดินแดง อ.ดินแดง จ.กรุงเทพมหานคร,00:00 น.,4,13.769017718622374,100.55451929569244
ปตร.คลองอรชร,ต.ปทุมวัน อ.ปทุมวัน จ.กรุงเทพมหานคร,00:00 น.,13.5,13.74807152973372,100.53617835044861
บ้านปากช่อง,ต.จะโหนง อ.จะนะ จ.สงขลา,00:00 น.,3,6.9854111364631954,100.64500093460083
บ้านสลาแด,ต.ห้วยกระทิง อ.กรงปินัง จ.ยะลา,00:00 น.,9,6.3297583528765,101.26207530498505
ทต.โคกสี,ต.โคกสี อ.สว่างแดนดิน จ.สกลนคร,00:00 น.,14.2,17.616031295168597,103.4270042181015
ศาลาดิน,ต.มหาสวัสดิ์ อ.พุทธมณฑล จ.นครปฐม,00:00 น.,1.4,13.807825731696855,100.27414262294769
เหนือปตร.ท่าโบสถ์,ต.สามง่ามท่าโบสถ์ อ.หันคา จ.ชัยนาท,00:00 น.,1.4,15.054190051370407,100.01159191131592
ปตร. คลองตาสด,ต.บางกระสอบ อ.พระประแดง จ.สมุทรปราการ,00:00 น.,25.2,13.66482059913717,100.57125091552734
จุดวัด ค.สามเสน-รพ.พระมงกุฎฯ,ต.สามเสนใน อ.พญาไท จ.กรุงเทพมหานคร,00:00 น.,2.5,13.768981246851839,100.53476750850677
เขตมีนบุรี,ต.มีนบุรี อ.มีนบุรี จ.กรุงเทพมหานคร,00:00 น.,17.5,13.813597670298687,100.73121786117554
เขตดุสิต,ต.ดุสิต อ.ดุสิต จ.กรุงเทพมหานคร,00:00 น.,3.5,13.776931971892264,100.52032113075256
สถานีฟาร์มตัวอย่างฯ บ้านลุตง,ต.ปากล่อ อ.โคกโพธิ์ จ.ปัตตานี,00:00 น.,1.8,6.657872711307783,101.24634146690369
ปตร.คลองทวีวัฒนา,ต.ศาลายา อ.พุทธมณฑล จ.นครปฐม,00:00 น.,1,13.800449111269785,100.32970190048218
ปตร.คลองวัดด่าน,ต.ทรงคนอง อ.พระประแดง จ.สมุทรปราการ,00:00 น.,35.5,13.670710734383432,100.54018020629883
ส.คลองสำโรง,ต.เทพารักษ์ อ.เมืองสมุทรปราการ จ.สมุทรปราการ,00:00 น.,19,13.648191898914314,100.59513866901398
ส.คลองแสนแสบ-คลองตัน,ต.คลองตันเหนือ อ.วัฒนา จ.กรุงเทพมหานคร,00:00 น.,13.5,13.741099472312527,100.59639930725098
สะพานคง-ศุข ศรีสวัสดิ์,ต.หาดท่าเสา อ.เมืองชัยนาท จ.ชัยนาท,00:00 น.,3.2,15.225014662574008,100.07823944091797
อโศก,ต.คลองเตยเหนือ อ.วัฒนา จ.กรุงเทพมหานคร,00:00 น.,13.2,13.743095232095673,100.56136429309845
คลองกาแลกูโบ หมู่ที่ 1,ต.คลองใหม่ อ.ยะรัง จ.ปัตตานี,00:00 น.,0.6,6.738524974150383,101.25218331813812
สถานีตำรวจภูธรกะพ้อ,ต.กะรุบี อ.กะพ้อ จ.ปัตตานี,00:00 น.,0.8,6.560148414794435,101.53407275676727
ที่ว่าการอำเภอกรงปินัง,ต.สะเอะ อ.กรงปินัง จ.ยะลา,00:00 น.,4.6,6.410911325271148,101.27362489700317
บ้านดุง,ต.นาคำ อ.บ้านดุง จ.อุดรธานี,00:00 น.,1.6,17.639354650503773,103.09840142726898
พยุหะคีรี,ต.ท่าน้ำอ้อย อ.พยุหะคีรี จ.นครสวรรค์,00:00 น.,0.6,15.426564485809697,100.1347267627716
บ้านห้วยสะแตง,ต.และ อ.ทุ่งช้าง จ.น่าน,00:00 น.,0.5,19.44239913060274,100.89400112628937
บ้านห้วยคลุม,ต.สวนผึ้ง อ.สวนผึ้ง จ.ราชบุรี,00:00 น.,0.5,13.58281256092853,99.32586371898651
บ้านแม่ปะ,ต.สะเมิงเหนือ อ.สะเมิง จ.เชียงใหม่,00:00 น.,0.5,18.955121223667778,98.74700009822845
ปตร.บึงขวาง,ต.แสนแสบ อ.มีนบุรี จ.กรุงเทพมหานคร,00:00 น.,35.5,13.799881268293781,100.74482202529907
ส.คลองสามเสน,ต.ถนนนครไชยศรี อ.ดุสิต จ.กรุงเทพมหานคร,00:00 น.,4.5,13.784830327469262,100.50825119018555
บ้านไร่,ต.ทุ่งหวัง อ.เมืองสงขลา จ.สงขลา,00:00 น.,0.5,7.047374699060156,100.63000202178955
ส.คลองสนามชัย,ต.ท่าข้าม อ.บางขุนเทียน จ.กรุงเทพมหานคร,00:00 น.,21.5,13.638021230100307,100.44762790203094
สะพานข้ามแม่น้ำปัตตานี,ต.ตลิ่งชัน อ.บันนังสตา จ.ยะลา,00:00 น.,6,6.411652315675297,101.2780237197876
คลองสุงบบารู หมู่ที่ 4,ต.คลองใหม่ อ.ยะรัง จ.ปัตตานี,00:00 น.,0.2,6.737091912120958,101.2730884552002
ทต.สวนผึ้ง,ต.สวนผึ้ง อ.สวนผึ้ง จ.ราชบุรี,00:00 น.,1,13.544890536882551,99.33835744857788
ส.คลองสี่บาท,ต.แสมดำ อ.บางขุนเทียน จ.กรุงเทพมหานคร,00:00 น.,72,13.6732491811468,100.44614732265472
เขตบางขุนเทียน,ต.แสมดำ อ.บางขุนเทียน จ.กรุงเทพมหานคร,00:00 น.,65,13.660827733060893,100.43531119823456
ชุมชนหนองปิ้งไก่,ต.นาบ่อคำ อ.เมืองกำแพงเพชร จ.กำแพงเพชร,00:00 น.,18,16.434783433532413,99.36731457710266
