ส.คลองดาวคะนอง,ต.บางปะกอก อ.ราษฎร์บูรณะ จ.กรุงเทพมหานคร,06:00 น.,17
บ้านท่าหินส้ม,ต.เมืองปอน อ.ขุนยวม จ.แม่ฮ่องสอน,05:00 น.,17
บ้านผาแตก,ต.ท่าข้าวเปลือก อ.แม่จัน จ.เชียงราย,05:00 น.,17
บ้านแสนทอง,ต.เวียงต้า อ.ลอง จ.แพร่,05:00 น.,17
บ้านวังหิน,ต.บุพราหมณ์ อ.นาดี จ.ปราจีนบุรี,05:00 น.,17
อบต.นาโพธิ์กลาง,ต.นาโพธิ์กลาง อ.โขงเจียม จ.อุบลราชธานี,06:00 น.,17
บ้านจำปาทอง,ต.บ้านทำเนียบ อ.คีรีรัฐนิคม จ.สุราษฎร์ธานี,05:00 น.,17
วัดยางชุม,ต.หาดขาม อ.กุยบุรี จ.ประจวบคีรีขันธ์,06:00 น.,17
พระแสง สอท.,ต.ทุ่งหลวง อ.เวียงสระ จ.สุราษฎร์ธานี,04:00 น.,16.8
ทม.ท่าข้าม,ต.ท่าข้าม อ.พุนพิน จ.สุราษฎร์ธานี,06:00 น.,16.8
เหนือฝายยางบ้านตะลุง,ต.หนองเรือ อ.ชุมพลบุรี จ.สุรินทร์,06:00 น.,16.8
อบต.คลองขนาน,ต.คลองขนาน อ.เหนือคลอง จ.กระบี่,06:00 น.,16.6
ส.คลองบางไส้ไก่,ต.สำเหร่ อ.ธนบุรี จ.กรุงเทพมหานคร,06:00 น.,16.5
บ้านม่วงเครือ,ต.เปียงหลวง อ.เวียงแหง จ.เชียงใหม่,05:00 น.,16.5
บ้านห้วยเลา,ต.ชนแดน อ.สองแคว จ.น่าน,05:00 น.,16.5
บ้านหนองสองห้อง,ต.ห้วยแห้ง อ.แก่งคอย จ.สระบุรี,05:00 น.,16.5
บ้านดงสุระ,ต.แม่จั๊วะ อ.เด่นชัย จ.แพร่,05:00 น.,16.5
บ้านมูเซอ,ต.ม่อนจอง อ.อมก๋อย จ.เชียงใหม่,05:00 น.,16.5
บ้านน้ำต้ม,ต.ผาช้างน้อย อ.ปง จ.พะเยา,05:00 น.,16.5
บ้านทุ่งหยีเพ็ง,ต.ศาลาด่าน อ.เกาะลันตา จ.กระบี่,05:00 น.,16.5
สะพานข้ามคลองหวาด,ต.คลองสระ อ.กาญจนดิษฐ์ จ.สุราษฎร์ธานี,06:00 น.,16.4
อบต.บ่อทอง,ต.บ่อทอง อ.บ่อทอง จ.ชลบุรี,06:00 น.,16.2
รร.กองม่องทะ สาขาสะละวะ,ต.ไล่โว่ อ.สังขละบุรี จ.กาญจนบุรี,06:00 น.,16.2
วิภาวดี,ต.ตะกุกเหนือ อ.วิภาวดี จ.สุราษฎร์ธานี,06:00 น.,16.2
สุราษฎร์ธานี สกษ.,ต.ท่าอุแท อ.กาญจนดิษฐ์ จ.สุราษฎร์ธานี,04:00 น.,16.1
บ้านหนักไทร*,ต.ช่อง อ.นาโยง จ.ตรัง,05:00 น.,16
ท้ายฝายร้อยเอ็ด,ต.พระธาตุ อ.เชียงขวัญ จ.ร้อยเอ็ด,06:00 น.,16
บ้านห้วยผึ้ง,ต.หมอกจำแป่ อ.เมืองแม่ฮ่องสอน จ.แม่ฮ่องสอน,05:00 น.,16
บ้านแม่ปะ,ต.สะเมิงเหนือ อ.สะเมิง จ.เชียงใหม่,05:00 น.,16
รร.บ้านดงไม้งาม,ต.ชัยเกษม อ.บางสะพาน จ.ประจวบคีรีขันธ์,06:00 น.,16
บ้านจำผักกูด,ต.แม่อ้อ อ.พาน จ.เชียงราย,05:00 น.,16
บ้านกอบแก้ววัฒนาภิบาล,ต.ลำพูน อ.บ้านนาสาร จ.สุราษฎร์ธานี,05:00 น.,16
หน่วยจัดการต้นน้ำดอยผาหลวง,ต.โป่งน้ำร้อน อ.ฝาง จ.เชียงใหม่,06:00 น.,16
บ้านไทรงาม,ต.ระเริง อ.วังน้ำเขียว จ.นครราชสีมา,05:00 น.,16
นราธิวาส,ต.บางนาค อ.เมืองนราธิวาส จ.นราธิวาส,22:00 น.,16
บ้านทับคริสต์,ต.คลองชะอุ่น อ.พนม จ.สุราษฎร์ธานี,06:00 น.,16
บ้านคันเบ็ด,ต.เขาแก้ว อ.ลานสกา จ.นครศรีธรรมราช,05:00 น.,16
คลองพระปรง,ต.ศาลาลำดวน อ.เมืองสระแก้ว จ.สระแก้ว,06:00 น.,15.8
เขาพะเนินทุ่ง,ต.ห้วยแม่เพรียง อ.แก่งกระจาน จ.เพชรบุรี,06:00 น.,15.8
กงไกรลาศ,ต.กง อ.กงไกรลาศ จ.สุโขทัย,06:00 น.,15.8
อบต.โคคลาน,ต.โคคลาน อ.ตาพระยา จ.สระแก้ว,06:00 น.,15.6
บ้านหัวดง,ต.หงาว อ.เทิง จ.เชียงราย,05:00 น.,15.5
บ้านปางปง-ปางทราย,ต.เวียงตาล อ.ห้างฉัตร จ.ลำปาง,05:00 น.,15.5
บ้านมะขาม ,ต.ท่าอุแท อ.กาญจนดิษฐ์ จ.สุราษฎร์ธานี,05:00 น.,15.5
ทต.เนินมะปราง,ต.เนินมะปราง อ.เนินมะปราง จ.พิษณุโลก,06:00 น.,15.4
รร. บ้านเพ็กเฟื้อย-ห้วยเตย,ต.หนองหว้า อ.เมืองหนองบัวลำภู จ.หนองบัวลำภู,06:00 น.,15.4
สะพานห้วยน้ำใส,ต.เกาะขันธ์ อ.ชะอวด จ.นครศรีธรรมราช,06:00 น.,15.2
เมืองมหาสารคาม,ต.เกิ้ง อ.เมืองมหาสารคาม จ.มหาสารคาม,06:00 น.,15.2
อบต.วังทรายพูน,ต.วังทรายพูน อ.วังทรายพูน จ.พิจิตร,06:00 น.,15.2
ศูนย์พัฒนาเด็กเล็ก อบต.สูงเม่น,ต.สูงเม่น อ.สูงเม่น จ.แพร่,06:00 น.,15.2
ทต.ห้วยยอด,ต.ห้วยยอด อ.ห้วยยอด จ.ตรัง,06:00 น.,15.2
รร.บ้านปางยาง,ต.ภูคา อ.ปัว จ.น่าน,06:00 น.,15
บ้านหล่ายทุ่ง,ต.วอแก้ว อ.ห้างฉัตร จ.ลำปาง,05:00 น.,15
บ้านแม่วังช้าง,ต.พระธาตุขิงแกง อ.จุน จ.พะเยา,05:00 น.,15
บ้านห้วยน้ำเค็ม,ต.บ้านเสด็จ อ.เมืองลำปาง จ.ลำปาง,05:00 น.,15
บ้านปลาบ่า,ต.ปลาบ่า อ.ภูเรือ จ.เลย,05:00 น.,15
บ้านสบก๋าย,ต.กื้ดช้าง อ.แม่แตง จ.เชียงใหม่,03:00 น.,15
บ้านห้วยคอม,ต.น้ำไผ่ อ.น้ำปาด จ.อุตรดิตถ์,05:00 น.,15
บ้านหินลูกช้าง,ต.ทุ่งคาวัด อ.ละแม จ.ชุมพร,05:00 น.,15
บ้านป่ารวก,ต.บ่อโพธิ์ อ.นครไทย จ.พิษณุโลก,05:00 น.,15
บ้านท่าวังแคน,ต.ศรีสองรัก อ.เมืองเลย จ.เลย,05:00 น.,15
อ่างเก็บน้ำห้วยซับเหล็ก,ต.โคกตูม อ.เมืองลพบุรี จ.ลพบุรี,06:00 น.,15
ส.คลองสาทร,ต.ยานนาวา อ.สาทร จ.กรุงเทพมหานคร,06:00 น.,15
สุโขทัย,ต.วังใหญ่ อ.ศรีสำโรง จ.สุโขทัย,04:00 น.,14.9
ทต.ทุ่งทราย,ต.ทุ่งทราย อ.ทรายทองวัฒนา จ.กำแพงเพชร,06:00 น.,14.8
อบต.หนองบัวละคร,ต.หนองบัวละคร อ.ด่านขุนทด จ.นครราชสีมา,06:00 น.,14.8
สวนสาธารณะหนองถิ่น ทม.หนองคาย,ต.มีชัย อ.เมืองหนองคาย จ.หนองคาย,06:00 น.,14.6
บ้านปางอุ๋ง,ต.แม่ศึก อ.แม่แจ่ม จ.เชียงใหม่,05:00 น.,14.5
นครราชสีมา,ต.หนองไผ่ล้อม อ.เมืองนครราชสีมา จ.นครราชสีมา,04:00 น.,14.5
บ้านนาเปรื่อง,ต.บ่อเกลือใต้ อ.บ่อเกลือ จ.น่าน,05:00 น.,14.5
บ้านห้วยสีเสียด,ต.น้ำหมาน อ.เมืองเลย จ.เลย,05:00 น.,14.5
บ้านน้ำฮอก,ต.บ้านเหล่า อ.สูงเม่น จ.แพร่,05:00 น.,14.5
บ้านซับสมบูรณ์,ต.วังข่อย อ.ไพศาลี จ.นครสวรรค์,05:00 น.,14.5
บ้านทุ่งทราย,ต.เวียง อ.เชียงของ จ.เชียงราย,05:00 น.,14.5
บ้านหัวแม่คำ,ต.แม่สลองใน อ.แม่ฟ้าหลวง จ.เชียงราย,05:00 น.,14.5
ส.ช่องนนทรี,ต.ช่องนนทรี อ.ยานนาวา จ.กรุงเทพมหานคร,06:00 น.,14.5
บ้านสันต้นม่วง,ต.ม่อนจอง อ.อมก๋อย จ.เชียงใหม่,05:00 น.,14.5
หน่วยพิทักษ์อุทยานแห่งชาติที่ ขป.๙  (น้ำตกเขาคราม),ต.ลำสินธุ์ อ.ศรีนครินทร์ จ.พัทลุง,06:00 น.,14.4
รัษฎา,ต.ควนเมา อ.รัษฎา จ.ตรัง,06:00 น.,14.4
สวี สกษ.,ต.วิสัยเหนือ อ.เมืองชุมพร จ.ชุมพร,04:00 น.,14.4
กรุงเทพมหานคร,ต.คลองเตย อ.คลองเตย จ.กรุงเทพมหานคร,04:00 น.,14.3
จันทบุรี,ต.วัดใหม่ อ.เมืองจันทบุรี จ.จันทบุรี,04:00 น.,14.2
หน่วยจัดการต้นน้ำขุนว้า,ต.ดงพญา อ.บ่อเกลือ จ.น่าน,06:00 น.,14.2
ทต.คุ้งตะเภา,ต.คุ้งตะเภา อ.เมืองอุตรดิตถ์ จ.อุตรดิตถ์,06:00 น.,14.2
บางปลา,ต.บางปลา อ.บางเลน จ.นครปฐม,06:00 น.,14.2
อบจ.น่าน,ต.ในเวียง อ.เมืองน่าน จ.น่าน,06:00 น.,14.2
บ้านควนขวาง,ต.เขาวิเศษ อ.วังวิเศษ จ.ตรัง,05:00 น.,14
บ้านท่าแพ,ต.เมือง อ.เมืองเลย จ.เลย,05:00 น.,14
อบต.วัดโบสถ์,ต.วัดโบสถ์ อ.วัดโบสถ์ จ.พิษณุโลก,06:00 น.,14
บ้านวังนาใน,ต.ทุ่งหว้า อ.ทุ่งหว้า จ.สตูล,05:00 น.,14
บ้านหญ้าปล้อง,ต.คลองศก อ.พนม จ.สุราษฎร์ธานี,05:00 น.,14
บ้านม่วงลีบ,ต.คลองสระ อ.กาญจนดิษฐ์ จ.สุราษฎร์ธานี,05:00 น.,14
บ้านปางขุม,ต.ยั้งเมิน อ.สะเมิง จ.เชียงใหม่,05:00 น.,14
บ้านขวากใต้,ต.ท่าข้าม อ.เวียงแก่น จ.เชียงราย,05:00 น.,14
บ้านดอนทราย*,ต.ออนเหนือ อ.แม่ออน จ.เชียงใหม่,05:00 น.,14
บ้านพุฝรั่ง,ต.วังข่อย อ.ไพศาลี จ.นครสวรรค์,05:00 น.,14
บ้านป่าแดง,ต.ป่าแดง อ.เมืองแพร่ จ.แพร่,05:00 น.,14
บ้านเปียงหลวง,ต.เปียงหลวง อ.เวียงแหง จ.เชียงใหม่,05:00 น.,14
บ้านสันหลวง,ต.แม่เปา อ.พญาเม็งราย จ.เชียงราย,05:00 น.,14
บ้านหน้าเขา,ต.บ้านเสด็จ อ.เคียนซา จ.สุราษฎร์ธานี,05:00 น.,14
บ้านคลองมดแดง,ต.โป่งน้ำร้อน อ.คลองลาน จ.กำแพงเพชร,05:00 น.,14
เทศบาลตำบลหอไกร,ต.หอไกร อ.บางมูลนาก จ.พิจิตร,06:00 น.,13.8
นครสวรรค์,ต.กลางแดด อ.เมืองนครสวรรค์ จ.นครสวรรค์,04:00 น.,13.8
ท้ายไซฟอน ปตร.พระธรรมราชา,ต.บึงน้ำรักษ์ อ.ธัญบุรี จ.ปทุมธานี,06:00 น.,13.8
หน่วยจัดการต้นน้ำตาปี,ต.ตะกุกใต้ อ.วิภาวดี จ.สุราษฎร์ธานี,06:00 น.,13.8
เมืองจันทบุรี,ต.จันทนิมิต อ.เมืองจันทบุรี จ.จันทบุรี,06:00 น.,13.6
ฮอด,ต.หางดง อ.ฮอด จ.เชียงใหม่,06:00 น.,13.6
ส.พระโขนง,ต.พระโขนง อ.คลองเตย จ.กรุงเทพมหานคร,06:00 น.,13.5
บ้านไร่พัฒนา,ต.วะตะแบก อ.เทพสถิต จ.ชัยภูมิ,22:00 น.,13.5
เขตสาทร,ต.ทุ่งวัดดอน อ.สาทร จ.กรุงเทพมหานคร,06:00 น.,13.5
เขตยานนาวา,ต.ช่องนนทรี อ.ยานนาวา จ.กรุงเทพมหานคร,06:00 น.,13.5
บ้านผาลาดเหนือ,ต.นาทราย อ.ลี้ จ.ลำพูน,05:00 น.,13.5
บ้านบึงไม้,ต.ชะอม อ.แก่งคอย จ.สระบุรี,05:00 น.,13.5
บ้านด่านสิงขร,ต.คลองวาฬ อ.เมืองประจวบคีรีขันธ์ จ.ประจวบคีรีขันธ์,05:00 น.,13.5
บ้านใหม่ดอนแก้ว,ต.ทาเหนือ อ.แม่ออน จ.เชียงใหม่,05:00 น.,13.5
บ้านสว้านเหนือ,ต.ดงพญา อ.บ่อเกลือ จ.น่าน,05:00 น.,13.5
บ้านสักพัฒนา,ต.หงส์หิน อ.จุน จ.พะเยา,05:00 น.,13.5
บ้านเขื่อนแก้ว,ต.ถืมตอง อ.เมืองน่าน จ.น่าน,05:00 น.,13.5
บ้านท่าวะ,ต.สะเอียบ อ.สอง จ.แพร่,05:00 น.,13.5
สุสานคริสเตียน,ต.เมืองพาน อ.พาน จ.เชียงราย,06:00 น.,13.4
โรงเรียนนิคมสร้างตนเองพัฒนาภาคใต้ 1,ต.ตลิ่งชัน อ.บันนังสตา จ.ยะลา,06:00 น.,13.4
สามพราน,ต.หอมเกร็ด อ.สามพราน จ.นครปฐม,06:00 น.,13.4
เมืองอุตรดิตถ์,ต.ป่าเซ่า อ.เมืองอุตรดิตถ์ จ.อุตรดิตถ์,06:00 น.,13.4
บ้านกงรถ,ต.กงรถ อ.ห้วยแถลง จ.นครราชสีมา,06:00 น.,13.4
ทต.ลำแก่น,ต.ลำแก่น อ.ท้ายเหมือง จ.พังงา,06:00 น.,13.2
ทม.ตะพานหิน,ต.ตะพานหิน อ.ตะพานหิน จ.พิจิตร,06:00 น.,13.2
อบต.ท่าเสา,ต.ท่าเสา อ.โพทะเล จ.พิจิตร,06:00 น.,13.2
เมืองชุมพร,ต.หาดพันไกร อ.เมืองชุมพร จ.ชุมพร,06:00 น.,13.2
โครงการฟาร์มตัวอย่างฯ บ้านป่าตาเขียว,ต.ท่าข้าม อ.ปะนาเระ จ.ปัตตานี,06:00 น.,13.2
อ่างฯหนองกุดใหญ่,ต.หนองเต็ง อ.กระสัง จ.บุรีรัมย์,06:00 น.,13.2
บ้านยุบตาเหน่ง,ต.ป่ายุบใน อ.วังจันทร์ จ.ระยอง,05:00 น.,13
บ้านช่องไม้ดำ,ต.คลองหิน อ.อ่าวลึก จ.กระบี่,05:00 น.,13
อบต.ขุนซ่อง,ต.ขุนซ่อง อ.แก่งหางแมว จ.จันทบุรี,06:00 น.,13
บ้านคลองตูกเหนือ,ต.กะปาง อ.ทุ่งสง จ.นครศรีธรรมราช,05:00 น.,13
บ้านเชี่ยวขวัญ,ต.ตะกุกเหนือ อ.วิภาวดี จ.สุราษฎร์ธานี,05:00 น.,13
บ้านซอย 8,ต.ควนกาหลง อ.ควนกาหลง จ.สตูล,05:00 น.,13
อบต.เปียงหลวง,ต.เปียงหลวง อ.เวียงแหง จ.เชียงใหม่,06:00 น.,13
ปตร.วัดบางกระเจ้านอก,ต.บางกระเจ้า อ.พระประแดง จ.สมุทรปราการ,06:00 น.,13
อบต.บ้านเสด็จ,ต.บ้านเสด็จ อ.เคียนซา จ.สุราษฎร์ธานี,06:00 น.,13
ที่ทำการอุทยานฯเขาใหญ่,ต.นาหินลาด อ.ปากพลี จ.นครนายก,05:00 น.,13
บ้านแม่หวาน,ต.ป่าเมี่ยง อ.ดอยสะเก็ด จ.เชียงใหม่,05:00 น.,13
บ้านห้วยธนู,ต.ตาลชุม อ.ท่าวังผา จ.น่าน,05:00 น.,13
บ้านปางมะโอ,ต.ผาช้างน้อย อ.ปง จ.พะเยา,05:00 น.,13
บ้านผาแล,ต.ปอ อ.เวียงแก่น จ.เชียงราย,05:00 น.,13
ทต.โป่งน้ำร้อน,ต.โป่งน้ำร้อน อ.โป่งน้ำร้อน จ.จันทบุรี,06:00 น.,12.8
คลองนางน้อย,ต.นาโยงใต้ อ.เมืองตรัง จ.ตรัง,06:00 น.,12.8
รร.วัดควนสีนวล,ต.นาข้าวเสีย อ.นาโยง จ.ตรัง,06:00 น.,12.8
อบต.ร้องกวาง,ต.ร้องกวาง อ.ร้องกวาง จ.แพร่,06:00 น.,12.8
ท้ายฝายมหาสารคาม,ต.หนองบัว อ.โกสุมพิสัย จ.มหาสารคาม,06:00 น.,12.6
บ้านโป่ง,ต.เบิกไพร อ.บ้านโป่ง จ.ราชบุรี,06:00 น.,12.6
บ้านหน้าวัด,ต.ในเตา อ.ห้วยยอด จ.ตรัง,05:00 น.,12.5
บ้านหนองผักแว่น,ต.ทัพราช อ.ตาพระยา จ.สระแก้ว,05:00 น.,12.5
บ้านในช่อง,ต.สองแพรก อ.ชัยบุรี จ.สุราษฎร์ธานี,05:00 น.,12.5
บ้านวัดสวาด,ต.ป่าร่อน อ.กาญจนดิษฐ์ จ.สุราษฎร์ธานี,05:00 น.,12.5
บ้านซำบุ่น,ต.ศิลา อ.หล่มเก่า จ.เพชรบูรณ์,05:00 น.,12.5
จุดวัดสวนเบญจสิริ,ต.คลองตัน อ.คลองเตย จ.กรุงเทพมหานคร,06:00 น.,12.5
บ้านหัวเขา,ต.ห้วยยาง อ.ทับสะแก จ.ประจวบคีรีขันธ์,05:00 น.,12.5
บ้านคลองพระยา,ต.ปลายพระยา อ.ปลายพระยา จ.กระบี่,05:00 น.,12.5
บ้านโป่งน้ำร้อน,ต.เสริมกลาง อ.เสริมงาม จ.ลำปาง,05:00 น.,12.5
เขตพระโขนง,ต.บางจาก อ.พระโขนง จ.กรุงเทพมหานคร,06:00 น.,12.5
ระยอง,ต.ตะพง อ.เมืองระยอง จ.ระยอง,04:00 น.,12.4
สะพานเดชาติวงศ์,ต.ปากน้ำโพ อ.เมืองนครสวรรค์ จ.นครสวรรค์,06:00 น.,12.4
ทต.ทาสบเส้า,ต.ทาสบเส้า อ.แม่ทา จ.ลำพูน,06:00 น.,12.4
ฝายคลองเปิก,ต.ถ้ำใหญ่ อ.ทุ่งสง จ.นครศรีธรรมราช,06:00 น.,12.4
นาดี,ต.สะพานหิน อ.นาดี จ.ปราจีนบุรี,06:00 น.,12.2
ศาลากลางหมู่บ้านแพรกตะลุย,ต.เขาจ้าว อ.ปราณบุรี จ.ประจวบคีรีขันธ์,06:00 น.,12.2
ทต.นาหนองไผ่,ต.นาหนองไผ่ อ.ชุมพลบุรี จ.สุรินทร์,06:00 น.,12.2
อบต.ตะปาน,ต.ตะปาน อ.พุนพิน จ.สุราษฎร์ธานี,06:00 น.,12.2
บางเลน,ต.บางเลน อ.บางเลน จ.นครปฐม,06:00 น.,12.2
พัทยา,ต.เขตการปกครองพิเศษพัทยา อ.บางละมุง จ.ชลบุรี,04:00 น.,12.2
อบต.ปากฉลุย,ต.ปากฉลุย อ.ท่าฉาง จ.สุราษฎร์ธานี,06:00 น.,12.2
รพสต.บ่อวิน,ต.บ่อวิน อ.ศรีราชา จ.ชลบุรี,06:00 น.,12.2
หน่วยจัดการต้นน้ำห้วยป่าเลา,ต.บ้านปง อ.หางดง จ.เชียงใหม่,06:00 น.,12.2
ไร่ วงศ์ ทอง เมฆ ดี,ต.ที่วัง อ.ทุ่งสง จ.นครศรีธรรมราช,06:00 น.,12.2
บ้านขุนแม่ละอุปหมู่ที่ 3,ต.แจ่มหลวง อ.กัลยาณิวัฒนา จ.เชียงใหม่,06:00 น.,12.2
สะพานข้ามคลองเกรียงไกร,ต.บางเคียน อ.ชุมแสง จ.นครสวรรค์,06:00 น.,12.2
บ้านวังหอน,ต.วังอ่าง อ.ชะอวด จ.นครศรีธรรมราช,05:00 น.,12
อุทยานแห่งชาติเขาใหญ่,ต.หินตั้ง อ.เมืองนครนายก จ.นครนายก,06:00 น.,12
ถ้ำพรรณรา,ต.ถ้ำพรรณรา อ.ถ้ำพรรณรา จ.นครศรีธรรมราช,06:00 น.,12
บ้านช่องเหรียง,ต.บ้านนิคม อ.บางขัน จ.นครศรีธรรมราช,05:00 น.,12
บ้านท่าเริงรมย์,ต.ทุ่งพระ อ.คอนสาร จ.ชัยภูมิ,05:00 น.,12
ทต.บ้านโคก,ต.บ้านโคก อ.บ้านโคก จ.อุตรดิตถ์,06:00 น.,12
ที่ทำการเขตรักษาพันธุ์สัตว์ป่าดอยผาช้าง,ต.งิม อ.ปง จ.พะเยา,06:00 น.,12
บ้านห้วยติ้ว,ต.ลาดค่าง อ.ภูเรือ จ.เลย,05:00 น.,12
