สถานีบ้านม้งเก้าหลัง,ต.เทอดไทย อ.แม่ฟ้าหลวง จ.เชียงราย ,05:00 ,10.5
สถานีบ้านห้วยใหญ่,ต.สองพี่น้อง อ.ท่าแซะ จ.ชุมพร ,05:00 ,10.5
สถานีบ้านดง*,ต.สาริกา อ.เมืองนครนายก จ.นครนายก ,05:00 ,10.5
สถานียะลา สกษ.,ต.สะเตงนอก อ.เมืองยะลา จ.ยะลา ,22:00 ,10.4
สถานีทต.กรอกสมบูรณ์,ต.กรอกสมบูรณ์ อ.ศรีมหาโพธิ จ.ปราจีนบุรี ,06:00 ,10.4
สถานีอบต.นอกเมือง,ต.นอกเมือง อ.เมืองสุรินทร์ จ.สุรินทร์ ,06:00 ,10.4
สถานีคลองกลาง,ต.ศาลเจ้าไก่ต่อ อ.ลาดยาว จ.นครสวรรค์ ,03:00 ,10.2
สถานีบ้านปากแคลง,ต.ปะเหลียน อ.ปะเหลียน จ.ตรัง ,05:00 ,10
สถานีเขตหนองแขม,ต.หนองค้างพลู อ.หนองแขม จ.กรุงเทพมหานคร ,04:00 ,10
สถานีเขตทวีวัฒนา,ต.ทวีวัฒนา อ.ทวีวัฒนา จ.กรุงเทพมหานคร ,04:00 ,10
สถานีบ้านวังหิน,ต.บุพราหมณ์ อ.นาดี จ.ปราจีนบุรี ,05:00 ,10
สถานีวัดปากเตลิด,ต.ต้นยวน อ.พนม จ.สุราษฎร์ธานี ,05:00 ,10
สถานีบ้านสองพี่น้อง*,ต.ท่าโพธิ์ อ.สะเดา จ.สงขลา ,05:00 ,10
สถานีทต.ร่อนทอง,ต.ร่อนทอง อ.บางสะพาน จ.ประจวบคีรีขันธ์ ,06:00 ,10
สถานีอบต.บางตาหงาย,ต.บางตาหงาย อ.บรรพตพิสัย จ.นครสวรรค์ ,03:00 ,9.6
สถานีคลองนราภิรมย์ (บางเลน),ต.หนองเพรางาย อ.ไทรน้อย จ.นนทบุรี ,03:00 ,9.6
สถานีบ้านเขาจันทร์,ต.หนองธง อ.ป่าบอน จ.พัทลุง ,05:00 ,9.5
สถานีบ้านน้ำริน,ต.สบป่อง อ.ปางมะผ้า จ.แม่ฮ่องสอน ,05:00 ,9.5
สถานีบ้านหนองปล้อง,ต.กุดตาเพชร อ.ลำสนธิ จ.ลพบุรี ,05:00 ,9.5
สถานีบ้านกงษีไร่ (หมู่ 6),ต.ซึ้ง อ.ขลุง จ.จันทบุรี ,05:00 ,9.5
สถานีรร.กองม่องทะ สาขาสะละวะ,ต.ไล่โว่ อ.สังขละบุรี จ.กาญจนบุรี ,06:00 ,9.4
สถานีศาลาดิน,ต.มหาสวัสดิ์ อ.พุทธมณฑล จ.นครปฐม ,03:00 ,9.4
สถานีสะพานเขานางบวช,ต.ศรีนาวา อ.เมืองนครนายก จ.นครนายก ,03:00 ,9.4
สถานีคลองสำโรง บางเสาธง,ต.บางเสาธง อ.บางเสาธง จ.สมุทรปราการ ,03:00 ,9.2
สถานีที่ทำการอุทยานแห่งชาติดอยขุนตาล,ต.ทาปลาดุก อ.แม่ทา จ.ลำพูน ,06:00 ,9.2
สถานีบ้านหินประกาย,ต.บ้านกลาง อ.วังทอง จ.พิษณุโลก ,05:00 ,9
สถานีปากคลองตลาด,ต.พระบรมมหาราชวัง อ.พระนคร จ.กรุงเทพมหานคร ,04:00 ,9
สถานีบ้านหินลูกช้าง,ต.ทุ่งคาวัด อ.ละแม จ.ชุมพร ,05:00 ,9
สถานีบ้านห้วยน้ำจาง,ต.บ่อแก้ว อ.สะเมิง จ.เชียงใหม่ ,05:00 ,9
สถานีจุดวัด ค.บางนา-ถ.ศรีนครินทร์,ต.บางนา อ.บางนา จ.กรุงเทพมหานคร ,04:00 ,9
สถานีสุรินทร์ สกษ.,ต.คอโค อ.เมืองสุรินทร์ จ.สุรินทร์ ,04:00 ,9
สถานีนราธิวาส,ต.บางนาค อ.เมืองนราธิวาส จ.นราธิวาส ,22:00 ,8.9
สถานีสวี สกษ.,ต.วิสัยเหนือ อ.เมืองชุมพร จ.ชุมพร ,04:00 ,8.8
สถานีรพ.สต.บ้านวังไทร,ต.แม่หวาด อ.ธารโต จ.ยะลา ,06:00 ,8.8
สถานีกรุงเทพฯ บางนา สกษ.,ต.บางนา อ.บางนา จ.กรุงเทพมหานคร ,04:00 ,8.7
สถานีอบต.สะตอ,ต.สะตอ อ.เขาสมิง จ.ตราด ,06:00 ,8.6
สถานีบ้านแม่แสลม,ต.เวียงมอก อ.เถิน จ.ลำปาง ,05:00 ,8.5
สถานีบ้านขาแหย่ง,ต.เทอดไทย อ.แม่ฟ้าหลวง จ.เชียงราย ,05:00 ,8.5
สถานีบ้านห้วยเอียด,ต.ไผ่โทน อ.ร้องกวาง จ.แพร่ ,05:00 ,8.5
สถานีบ้านสามสบ,ต.ท่าผา อ.แม่แจ่ม จ.เชียงใหม่ ,05:00 ,8.5
สถานีบ้านคีรีวง,ต.กำโลน อ.ลานสกา จ.นครศรีธรรมราช ,05:00 ,8.5
สถานีบ้านคลองมะนาว,ต.ท่าเกวียน อ.วัฒนานคร จ.สระแก้ว ,05:00 ,8.5
สถานีบ้านนาข่า,ต.ปากหมัน อ.ด่านซ้าย จ.เลย ,05:00 ,8.5
สถานีบ้านทุ่งมะเซอย่อ,ต.บ้องตี้ อ.ไทรโยค จ.กาญจนบุรี ,05:00 ,8.5
สถานีอุทยานแห่งชาติตาดโตน,ต.นาฝาย อ.เมืองชัยภูมิ จ.ชัยภูมิ ,06:00 ,8.4
สถานีอบต.ขะยูง,ต.ขะยูง อ.อุทุมพรพิสัย จ.ศรีสะเกษ ,06:00 ,8.2
สถานีชุมชนบ้านควน 1,ต.ลำพะยา อ.เมืองยะลา จ.ยะลา ,03:00 ,8.2
สถานีอุ้มผาง,ต.อุ้มผาง อ.อุ้มผาง จ.ตาก ,04:00 ,8.1
สถานีบ้านน้ำพริก,ต.ยางโกลน อ.นครไทย จ.พิษณุโลก ,05:00 ,8
สถานีคลองพระพิมล (ไทรน้อย),ต.ไทรน้อย อ.ไทรน้อย จ.นนทบุรี ,03:00 ,8
สถานีส.คลองสำโรง,ต.เทพารักษ์ อ.เมืองสมุทรปราการ จ.สมุทรปราการ ,04:00 ,8
สถานีบ้านดง,ต.บ้านแลง อ.เมืองลำปาง จ.ลำปาง ,05:00 ,8
สถานีบุรีรัมย์,ต.ร่อนทอง อ.สตึก จ.บุรีรัมย์ ,04:00 ,8
สถานีอบต.ปางกู่,ต.ปางกู่ อ.โนนสัง จ.หนองบัวลำภู ,06:00 ,8
สถานีบ้านหินดาดทอง,ต.หนองรี อ.บ่อพลอย จ.กาญจนบุรี ,05:00 ,8
สถานีบ้านปางแปก,ต.แม่นาเติง อ.ปาย จ.แม่ฮ่องสอน ,05:00 ,8
สถานีบ้านห้วยบง,ต.แจ่มหลวง อ.กัลยาณิวัฒนา จ.เชียงใหม่ ,05:00 ,8
สถานีบ้านนาพึง,ต.นาพึง อ.นาแห้ว จ.เลย ,05:00 ,8
สถานีบ้านวังกะทะ,ต.วังกะทะ อ.ปากช่อง จ.นครราชสีมา ,05:00 ,8
สถานีบ้านเขาเลื่อมใต้,ต.คลองหาด อ.คลองหาด จ.สระแก้ว ,05:00 ,8
สถานีอรัญประเทศ,ต.ป่าไร่ อ.อรัญประเทศ จ.สระแก้ว ,04:00 ,7.9
สถานีอบต.ตลาดไทร,ต.ตลาดไทร อ.ชุมพวง จ.นครราชสีมา ,03:00 ,7.8
สถานีบ้านวัดสวาด,ต.ป่าร่อน อ.กาญจนดิษฐ์ จ.สุราษฎร์ธานี ,05:00 ,7.5
สถานีจุดวัด ค.สามเสน-รพ.พระมงกุฎฯ,ต.สามเสนใน อ.พญาไท จ.กรุงเทพมหานคร ,04:00 ,7.5
สถานีบ้านบางสาว,ต.เขาวง อ.บ้านตาขุน จ.สุราษฎร์ธานี ,05:00 ,7.5
สถานีบ้านดูลาเปอร์,ต.ห้วยห้อม อ.แม่ลาน้อย จ.แม่ฮ่องสอน ,05:00 ,7.5
สถานีบ้านห้วยหยวกป่าโซ,ต.แม่สลองใน อ.แม่ฟ้าหลวง จ.เชียงราย ,05:00 ,7.5
สถานีบ้านบูเก็ตยามู,ต.ควนสตอ อ.ควนโดน จ.สตูล ,05:00 ,7.5
สถานีบ้านหลังเขา,ต.หนองกะท้าว อ.นครไทย จ.พิษณุโลก ,05:00 ,7.5
สถานีศูนย์ฯ (ดินแดง),ต.ดินแดง อ.ดินแดง จ.กรุงเทพมหานคร ,04:00 ,7.5
สถานีบ้านแม่โถหลวง,ต.บ่อสลี อ.ฮอด จ.เชียงใหม่ ,05:00 ,7.5
สถานีบ้านระเริง,ต.ระเริง อ.วังน้ำเขียว จ.นครราชสีมา ,05:00 ,7.5
สถานีบ้านเขาแงน,ต.วังตะกอ อ.หลังสวน จ.ชุมพร ,05:00 ,7.5
สถานีบ้านห้วยโป่ง,ต.ห้วยมุ่น อ.น้ำปาด จ.อุตรดิตถ์ ,05:00 ,7.5
สถานีเทศบาลตำบลหอไกร,ต.หอไกร อ.บางมูลนาก จ.พิจิตร ,06:00 ,7.4
สถานีหน่วยพิทักษ์อุทยานแห่งชาติที่ ขญ.๑๗ (กลางดง),ต.พญาเย็น อ.ปากช่อง จ.นครราชสีมา ,06:00 ,7.4
สถานีศรีสะเกษ,ต.จานแสนไชย อ.ห้วยทับทัน จ.ศรีสะเกษ ,04:00 ,7.3
สถานีอบต.ละหานทราย,ต.ละหานทราย อ.ละหานทราย จ.บุรีรัมย์ ,06:00 ,7
สถานีเขตพระนคร,ต.วัดสามพระยา อ.พระนคร จ.กรุงเทพมหานคร ,19:00 ,7
สถานีส.คลองสามเสน,ต.ถนนนครไชยศรี อ.ดุสิต จ.กรุงเทพมหานคร ,04:00 ,7
สถานีอบต.พุสวรรค์,ต.พุสวรรค์ อ.แก่งกระจาน จ.เพชรบุรี ,03:00 ,7
สถานีส.คลองบางซื่อ,ต.ถนนนครไชยศรี อ.ดุสิต จ.กรุงเทพมหานคร ,04:00 ,7
สถานีบ้านทำเนียบ,ต.ลำพะยา อ.เมืองยะลา จ.ยะลา ,05:00 ,7
สถานีส.คลองบางเขนใหม่,ต.บางซื่อ อ.บางซื่อ จ.กรุงเทพมหานคร ,04:00 ,7
สถานีเหนือฝายยางบ้านตะลุง,ต.หนองเมธี อ.ท่าตูม จ.สุรินทร์ ,03:00 ,7
สถานีบ้านม่วงลีบ,ต.คลองสระ อ.กาญจนดิษฐ์ จ.สุราษฎร์ธานี ,05:00 ,7
สถานีบ้านบางเจริญ,ต.ไชยราช อ.บางสะพานน้อย จ.ประจวบคีรีขันธ์ ,05:00 ,7
สถานีบ้านแม่ฮี้,ต.แม่ฮี้ อ.ปาย จ.แม่ฮ่องสอน ,05:00 ,7
สถานีหน่วยพิทักษ์ป่าหินเรือ,ต.รับร่อ อ.ท่าแซะ จ.ชุมพร ,19:00 ,7
สถานีบ้านน้ำตอน,ต.นาบัว อ.นครไทย จ.พิษณุโลก ,05:00 ,7
สถานีหน่วยจัดการต้นน้ำดอยผาหลวง,ต.แม่สาว อ.แม่อาย จ.เชียงใหม่ ,06:00 ,7
สถานีสมุทรปราการ สกษ.,ต.บางปู อ.เมืองสมุทรปราการ จ.สมุทรปราการ ,04:00 ,6.7
สถานีท้ายฝายยางบ้านตะลุง,ต.หนองเมธี อ.ท่าตูม จ.สุรินทร์ ,03:00 ,6.6
สถานีอบต.ท่าเกวียน,ต.ท่าเกวียน อ.วัฒนานคร จ.สระแก้ว ,06:00 ,6.6
สถานีอบต.เทพนิมิต,ต.เทพนิมิต อ.โป่งน้ำร้อน จ.จันทบุรี ,06:00 ,6.6
สถานีคลองขนาน,ต.ทองมงคล อ.บางสะพาน จ.ประจวบคีรีขันธ์ ,03:00 ,6.6
สถานีบ้านน้ำแพ,ต.บ้านโคก อ.บ้านโคก จ.อุตรดิตถ์ ,05:00 ,6.5
สถานีบ้านคลองสะท้อน,ต.วังหมี อ.วังน้ำเขียว จ.นครราชสีมา ,02:00 ,6.5
สถานีบ้านเคี่ยมเพาะ,ต.ปากฉลุย อ.ท่าฉาง จ.สุราษฎร์ธานี ,05:00 ,6.5
สถานีบ้านยุบตาเหน่ง,ต.ป่ายุบใน อ.วังจันทร์ จ.ระยอง ,05:00 ,6.5
สถานีบ้านเกาะแก้ว,ต.เขาตอก อ.เคียนซา จ.สุราษฎร์ธานี ,05:00 ,6.5
สถานีบ้านทหารผ่านศึก,ต.รวมไทยพัฒนา อ.พบพระ จ.ตาก ,05:00 ,6.5
สถานีบ้านกระบกเตี้ย,ต.วังเย็น อ.สนามชัยเขต จ.ฉะเชิงเทรา ,05:00 ,6.5
สถานีจุดชมวิว 1715,ต.ภูคา อ.ปัว จ.น่าน ,06:00 ,6.4
สถานีปตร. คลองลัดบางยอ 2,ต.สำโรงกลาง อ.พระประแดง จ.สมุทรปราการ ,03:00 ,6.4
สถานีทต.ตะเคียนทอง,ต.ตะเคียนทอง อ.เขาคิชฌกูฏ จ.จันทบุรี ,06:00 ,6.4
สถานีอบต.เขาตูม,ต.เขาตูม อ.ยะรัง จ.ปัตตานี ,06:00 ,6.4
สถานีห้วยโป่ง สกษ.,ต.มาบตาพุด อ.เมืองระยอง จ.ระยอง ,04:00 ,6.3
สถานีทต.ทับช้าง,ต.ทับช้าง อ.สอยดาว จ.จันทบุรี ,06:00 ,6.2
สถานีอบต.ท่าเสา,ต.ท่าเสา อ.โพทะเล จ.พิจิตร ,03:00 ,6.2
สถานีบ้านท่านหญิง,ต.ตะกุกเหนือ อ.วิภาวดี จ.สุราษฎร์ธานี ,03:00 ,6
สถานีบ้านนอก,ต.กงหรา อ.กงหรา จ.พัทลุง ,05:00 ,6
สถานีเขื่อนสิรินธร,ต.นิคมสร้างตนเอง อ.สิรินธร จ.อุบลราชธานี ,05:00 ,6
สถานีทต.ท่าขนุน,ต.ท่าขนุน อ.ทองผาภูมิ จ.กาญจนบุรี ,06:00 ,6
สถานีอบต.วังหมี,ต.วังหมี อ.วังน้ำเขียว จ.นครราชสีมา ,06:00 ,6
สถานีบ้านพญาไพรเล่ามา,ต.เทอดไทย อ.แม่ฟ้าหลวง จ.เชียงราย ,05:00 ,6
สถานีสะพานท่าสาป,ต.สะเตง อ.เมืองยะลา จ.ยะลา ,05:00 ,6
สถานีบ้านเขาอ่าง,ต.มาบไพ อ.ขลุง จ.จันทบุรี ,05:00 ,6
สถานีหน่วยจัดการต้นน้ำบ่อแก้ว,ต.แม่นาจร อ.แม่แจ่ม จ.เชียงใหม่ ,06:00 ,6
สถานีซ.สะพานขวา ,ต.บางซื่อ อ.บางซื่อ จ.กรุงเทพมหานคร ,04:00 ,6
สถานีบ้านหวายหนิม*,ต.น้ำหัก อ.คีรีรัฐนิคม จ.สุราษฎร์ธานี ,05:00 ,6
สถานีส.คลองบางจาก,ต.บางแคเหนือ อ.บางแค จ.กรุงเทพมหานคร ,04:00 ,6
สถานีบ้านหนองแวง,ต.ไทรเดี่ยว อ.คลองหาด จ.สระแก้ว ,05:00 ,6
สถานีอบต.วังน้ำเขียว,ต.วังน้ำเขียว อ.วังน้ำเขียว จ.นครราชสีมา ,06:00 ,5.8
สถานีรร.บ้านเหมืองตะกั่ว,ต.หนองธง อ.ป่าบอน จ.พัทลุง ,06:00 ,5.8
สถานีสะพานแม่น้ำว้า บ้านบ่อหยวก,ต.บ่อเกลือเหนือ อ.บ่อเกลือ จ.น่าน ,03:00 ,5.8
สถานีบางระกำ,ต.บางระกำ อ.บางระกำ จ.พิษณุโลก ,03:00 ,5.8
สถานีตาพระยา,ต.ทัพเสด็จ อ.ตาพระยา จ.สระแก้ว ,03:00 ,5.6
สถานีแม่จัน,ต.ป่าซาง อ.แม่จัน จ.เชียงราย ,03:00 ,5.6
สถานีพัทยา,ต.เขตการปกครองพิเศษพัทยา อ.บางละมุง จ.ชลบุรี ,04:00 ,5.6
สถานีเขตราชเทวี,ต.ทุ่งพญาไท อ.ราชเทวี จ.กรุงเทพมหานคร ,04:00 ,5.5
สถานีบ้านฝางแล้ง,ต.ขุนฝาง อ.เมืองอุตรดิตถ์ จ.อุตรดิตถ์ ,05:00 ,5.5
สถานีบ้านไพรงาม,ต.บ้านกลาง อ.วังทอง จ.พิษณุโลก ,05:00 ,5.5
สถานีบ้านมะม่วง,ต.นนทรีย์ อ.บ่อไร่ จ.ตราด ,05:00 ,5.5
สถานีบ้านแยง,ต.บ้านแยง อ.นครไทย จ.พิษณุโลก ,05:00 ,5.5
สถานีบ้านโป่งสอ,ต.น้ำกุ่ม อ.นครไทย จ.พิษณุโลก ,05:00 ,5.5
สถานีบ้านตาเรืองล่าง,ต.ปะตง อ.สอยดาว จ.จันทบุรี ,05:00 ,5.5
สถานีบ้านก่อก๋วง,ต.บ่อเกลือใต้ อ.บ่อเกลือ จ.น่าน ,05:00 ,5.5
สถานีบ้านทุ่งข่า,ต.ปะเหลียน อ.ปะเหลียน จ.ตรัง ,05:00 ,5.5
สถานีบ้านนาตอง,ต.ช่อแฮ อ.เมืองแพร่ จ.แพร่ ,05:00 ,5.5
สถานีทต.น้ำยืน,ต.สีวิเชียร อ.น้ำยืน จ.อุบลราชธานี ,06:00 ,5.4
สถานีอบต.โบสถ์,ต.โบสถ์ อ.พิมาย จ.นครราชสีมา ,06:00 ,5.4
สถานีหน่วยจัดการต้นน้ำแม่กลาง,ต.บ้านหลวง อ.จอมทอง จ.เชียงใหม่ ,06:00 ,5.4
สถานีหน่วยจัดการต้นน้ำห้วยอีมาย,ต.นาป่า อ.เมืองเพชรบูรณ์ จ.เพชรบูรณ์ ,06:00 ,5.4
สถานีอบต.ไม้รูด,ต.ไม้รูด อ.คลองใหญ่ จ.ตราด ,06:00 ,5.2
สถานีสะเดา,ต.ท่าโพธิ์ อ.สะเดา จ.สงขลา ,04:00 ,5.1
สถานีเขตบางนา,ต.บางนา อ.บางนา จ.กรุงเทพมหานคร ,04:00 ,5
สถานีปตร.คลองขุนศรีฯ-ค.มหาสวัสดิ์,ต.ศาลาธรรมสพน์ อ.ทวีวัฒนา จ.กรุงเทพมหานคร ,04:00 ,5
สถานีเขตดุสิต,ต.ดุสิต อ.ดุสิต จ.กรุงเทพมหานคร ,04:00 ,5
สถานีบ้านโคกแมว,ต.โคกม่วง อ.เขาชัยสน จ.พัทลุง ,05:00 ,5
สถานีศาลากลางหมู่บ้านในล๊อค,ต.ทองมงคล อ.บางสะพาน จ.ประจวบคีรีขันธ์ ,06:00 ,5
สถานีบ้านดุง,ต.เตาไห อ.เพ็ญ จ.อุดรธานี ,03:00 ,5
สถานีเหมืองปิล๊อก,ต.ปีล็อก อ.ทองผาภูมิ จ.กาญจนบุรี ,05:00 ,5
สถานีบ้านใน,ต.ปากแพรก อ.ดอนสัก จ.สุราษฎร์ธานี ,05:00 ,5
สถานีบ้านกลาง,ต.ปลาบ่า อ.ภูเรือ จ.เลย ,05:00 ,5
สถานีบ้านนาส้อง,ต.คลองใหญ่ อ.ตะโหมด จ.พัทลุง ,05:00 ,5
สถานีบ้านห้วยมะบวบ,ต.แม่ยวมน้อย อ.ขุนยวม จ.แม่ฮ่องสอน ,05:00 ,5
สถานีอบต.นาหินลาด,ต.นาหินลาด อ.ปากพลี จ.นครนายก ,06:00 ,5
สถานีบ้านวังใหญ่,ต.วังใหญ่ อ.เทพา จ.สงขลา ,05:00 ,5
สถานีบ้านใสเขือ,ต.เขาพระ อ.พิปูน จ.นครศรีธรรมราช ,05:00 ,5
สถานีนบพิตำ,ต.นบพิตำ อ.นบพิตำ จ.นครศรีธรรมราช ,03:00 ,5
สถานีท้ายเขื่อนรัชชประภา,ต.เขาพัง อ.บ้านตาขุน จ.สุราษฎร์ธานี ,05:00 ,5
สถานีบ้านโคกแสมสาร,ต.โคกแสมสาร อ.โคกเจริญ จ.ลพบุรี ,05:00 ,5
สถานีปตร.คลองทวีวัฒนา,ต.ศาลายา อ.พุทธมณฑล จ.นครปฐม ,04:00 ,5
สถานีบ้านห้วยฮ่อมพัฒนา,ต.บ้านเวียง อ.ร้องกวาง จ.แพร่ ,05:00 ,5
สถานีบ้านสันนาเคียน,ต.ส้านนาหนองใหม่ อ.เวียงสา จ.น่าน ,05:00 ,5
สถานีจุดวัดศูนย์ราชการ-ถ.แจ้งวัฒนะ,ต.ทุ่งสองห้อง อ.หลักสี่ จ.กรุงเทพมหานคร ,04:00 ,5
สถานีรร.กองม่องทะ สาขาไล่โว่,ต.ไล่โว่ อ.สังขละบุรี จ.กาญจนบุรี ,06:00 ,5
สถานีแหลมฉบัง,ต.ทุ่งสุขลา อ.ศรีราชา จ.ชลบุรี ,19:00 ,4.9
สถานีบ้านหนองแดง,ต.บ้านจันทร์ อ.กัลยาณิวัฒนา จ.เชียงใหม่ ,06:00 ,4.8
สถานีหน่วยพิทักษ์อุทยานแห่งชาติที่ ขญ.๔ (คลองปลากั้ง),ต.วังหมี อ.วังน้ำเขียว จ.นครราชสีมา ,03:00 ,4.8
