สถานีบ้านขุนกำลัง,ต.ขุนควร อ.ปง จ.พะเยา ,06:00 ,3
สถานีบ้านถ้ำมงกุฎ,ต.เขาวง อ.พระพุทธบาท จ.สระบุรี ,06:00 ,3
สถานีอบต.ปางกู่,ต.ปางกู่ อ.โนนสัง จ.หนองบัวลำภู ,06:00 ,3
สถานีบ้านแม่ตะละม้ง,ต.แม่แดด อ.กัลยาณิวัฒนา จ.เชียงใหม่ ,06:00 ,3
สถานีลำน้ำพอง (เหนือฝายหนองหวาย),ต.กุดน้ำใส อ.น้ำพอง จ.ขอนแก่น ,05:00 ,3
สถานีบ้านใหม่สุขสันต์,ต.แม่ลอย อ.เทิง จ.เชียงราย ,06:00 ,3
สถานีบ้านขุนห้วยนกกก,ต.แม่หละ อ.ท่าสองยาง จ.ตาก ,06:00 ,3
สถานีบ้านสระเกศ,ต.ตลิ่งงาม อ.เกาะสมุย จ.สุราษฎร์ธานี ,05:00 ,3
สถานีบ้านสว้านเหนือ,ต.ดงพญา อ.บ่อเกลือ จ.น่าน ,06:00 ,3
สถานีอบต.บางขวัญ,ต.บางขวัญ อ.เมืองฉะเชิงเทรา จ.ฉะเชิงเทรา ,06:00 ,3
สถานีบ้านใหม่รุ่งเจริญ,ต.บ้านเอื้อม อ.เมืองลำปาง จ.ลำปาง ,06:00 ,3
สถานีบ้านสวนป่า,ต.ห้วยโรง อ.ร้องกวาง จ.แพร่ ,06:00 ,3
สถานีด่านช้าง,ต.ด่านช้าง อ.ด่านช้าง จ.สุพรรณบุรี ,06:00 ,3
สถานีอบต.สะตอน,ต.สะตอน อ.สอยดาว จ.จันทบุรี ,06:00 ,3
สถานีเชียงราย,ต.บ้านดู่ อ.เมืองเชียงราย จ.เชียงราย ,04:00 ,3
สถานีบ้านหมอกจำแป๋,ต.หมอกจำแป่ อ.เมืองแม่ฮ่องสอน จ.แม่ฮ่องสอน ,06:00 ,3
สถานีบ้านไหล่ท่า,ต.แม่ระมาด อ.แม่ระมาด จ.ตาก ,06:00 ,3
สถานีบ้านปางขนุน,ต.นาบ่อคำ อ.เมืองกำแพงเพชร จ.กำแพงเพชร ,06:00 ,3
สถานีอบต.หินดาด,ต.หินดาด อ.ทองผาภูมิ จ.กาญจนบุรี ,06:00 ,2.8
สถานีน้ำปาด,ต.บ้านฝาย อ.น้ำปาด จ.อุตรดิตถ์ ,06:00 ,2.8
สถานีรร.บ้านดงไม้งาม,ต.ชัยเกษม อ.บางสะพาน จ.ประจวบคีรีขันธ์ ,06:00 ,2.8
สถานีทต.สิริเวียงชัย,ต.เวียงชัย อ.เวียงชัย จ.เชียงราย ,06:00 ,2.8
สถานีสตึก,ต.นิคม อ.สตึก จ.บุรีรัมย์ ,06:00 ,2.8
สถานีปตร.มโนรมย์,ต.วัดโคก อ.มโนรมย์ จ.ชัยนาท ,06:00 ,2.8
สถานีทต.โกสุมพิสัย,ต.หัวขวาง อ.โกสุมพิสัย จ.มหาสารคาม ,06:00 ,2.6
สถานีแหล่งท่องเที่ยวภูลังกา,ต.ผาช้างน้อย อ.ปง จ.พะเยา ,06:00 ,2.6
สถานีลำน้ำสานบ้านทุ่งยาวเหนือ,ต.ศรีบัวบาน อ.เมืองลำพูน จ.ลำพูน ,06:00 ,2.6
สถานีเมืองสุโขทัย,ต.ธานี อ.เมืองสุโขทัย จ.สุโขทัย ,06:00 ,2.6
สถานีอบต.เกาะหลัก,ต.เกาะหลัก อ.เมืองประจวบคีรีขันธ์ จ.ประจวบคีรีขันธ์ ,06:00 ,2.6
สถานีอบต.ขี้เหล็ก,ต.ขี้เหล็ก อ.เมืองอุบลราชธานี จ.อุบลราชธานี ,06:00 ,2.6
สถานีเหนือ ปตร.มโนรมย์,ต.วัดโคก อ.มโนรมย์ จ.ชัยนาท ,06:00 ,2.6
สถานีอบต.พุ่มแก,ต.พุ่มแก อ.นาแก จ.นครพนม ,06:00 ,2.6
สถานีอบต.บ้านเจียง,ต.บ้านเจียง อ.ภักดีชุมพล จ.ชัยภูมิ ,06:00 ,2.6
สถานีอบต.โคกเริงรมย์,ต.โคกเริงรมย์ อ.บำเหน็จณรงค์ จ.ชัยภูมิ ,06:00 ,2.6
สถานีทต.บุ่งค้า,ต.บุ่งค้า อ.เลิงนกทา จ.ยโสธร ,06:00 ,2.6
สถานีบ้านป่ารวก,ต.บ่อโพธิ์ อ.นครไทย จ.พิษณุโลก ,06:00 ,2.5
สถานีบ้านห้วยหล่อดูก,ต.แม่ตื่น อ.อมก๋อย จ.เชียงใหม่ ,06:00 ,2.5
สถานีบ้านบีกริม,ต.คลองทับจันทร์ อ.อรัญประเทศ จ.สระแก้ว ,06:00 ,2.5
สถานีบ้านเขาขาด,ต.ตะเบาะ อ.เมืองเพชรบูรณ์ จ.เพชรบูรณ์ ,06:00 ,2.5
สถานีบ้านกิ่วเสือ,ต.ยั้งเมิน อ.สะเมิง จ.เชียงใหม่ ,06:00 ,2.5
สถานีบ้านคลองมดแดง,ต.โป่งน้ำร้อน อ.คลองลาน จ.กำแพงเพชร ,02:00 ,2.5
สถานีบ้านไทยประจัน,ต.ยางหัก อ.ปากท่อ จ.ราชบุรี ,05:00 ,2.5
สถานีบ้านบุ่งผำ,ต.น้ำกุ่ม อ.นครไทย จ.พิษณุโลก ,05:00 ,2.5
สถานีบ้านโทกหัวช้าง,ต.พระบาท อ.เมืองลำปาง จ.ลำปาง ,04:00 ,2.5
สถานีบ้านซำทองพัฒนา,ต.บ้านกลาง อ.วังทอง จ.พิษณุโลก ,06:00 ,2.5
สถานีบ้านป่ากว้าว,ต.ป่าแดด อ.แม่สรวย จ.เชียงราย ,05:00 ,2.5
สถานีบ้านแม่เหมืองหลวง,ต.โป่งสา อ.ปาย จ.แม่ฮ่องสอน ,23:00 ,2.5
สถานีบ้านกองขากหลวง,ต.สะเมิงใต้ อ.สะเมิง จ.เชียงใหม่ ,06:00 ,2.5
สถานีบ้านสุเม่นเหนือ,ต.แม่สิน อ.ศรีสัชนาลัย จ.สุโขทัย ,06:00 ,2.5
สถานีบ้านมนต์คีรี,ต.เมืองเก่า อ.เมืองสุโขทัย จ.สุโขทัย ,00:00 ,2.5
สถานีบ้านห้วยผึ้ง,ต.หมอกจำแป่ อ.เมืองแม่ฮ่องสอน จ.แม่ฮ่องสอน ,05:00 ,2.5
สถานีดอยอ่างขาง,ต.ม่อนปิ่น อ.ฝาง จ.เชียงใหม่ ,19:00 ,2.5
สถานีบ้านแม่หาด,ต.ป่าพลู อ.บ้านโฮ่ง จ.ลำพูน ,04:00 ,2.5
สถานีบ้านแม่แสม,ต.ตะเคียนปม อ.ทุ่งหัวช้าง จ.ลำพูน ,05:00 ,2.5
สถานีบ้านตาแวน,ต.เรือง อ.เมืองน่าน จ.น่าน ,06:00 ,2.5
สถานีทต.ลำปางหลวง,ต.ลำปางหลวง อ.เกาะคา จ.ลำปาง ,06:00 ,2.4
สถานีเทศบาลตำบลบ้านผือ,ต.บ้านผือ อ.บ้านผือ จ.อุดรธานี ,06:00 ,2.4
สถานีอุทยานแห่งชาติแม่เมย,ต.แม่สอง อ.ท่าสองยาง จ.ตาก ,06:00 ,2.4
สถานีสว่างแดนดิน,ต.โพนสูง อ.สว่างแดนดิน จ.สกลนคร ,06:00 ,2.4
สถานีบางกระทุ่ม,ต.โคกสลุด อ.บางกระทุ่ม จ.พิษณุโลก ,06:00 ,2.4
สถานีรพสต.หมอเมือง,ต.หมอเมือง อ.แม่จริม จ.น่าน ,06:00 ,2.4
สถานีกรุงเทพมหานคร,ต.คลองเตย อ.คลองเตย จ.กรุงเทพมหานคร ,04:00 ,2.4
สถานีพรหมบุรี,ต.พรหมบุรี อ.พรหมบุรี จ.สิงห์บุรี ,06:00 ,2.4
สถานีทต.ปง,ต.ปง อ.ปง จ.พะเยา ,06:00 ,2.2
สถานีน้ำตกไทรคู่,ต.ทองมงคล อ.บางสะพาน จ.ประจวบคีรีขันธ์ ,06:00 ,2.2
สถานีทต.บ่อเกลือใต้,ต.บ่อเกลือใต้ อ.บ่อเกลือ จ.น่าน ,06:00 ,2.2
สถานีอ่างเก็บน้ำแม่เกี๋ยง,ต.บ้านเอื้อม อ.เมืองลำปาง จ.ลำปาง ,06:00 ,2.2
สถานีสุราษฎร์ธานี สกษ.,ต.ท่าอุแท อ.กาญจนดิษฐ์ จ.สุราษฎร์ธานี ,04:00 ,2.1
สถานีบ้านปากรอง*,ต.ชาติตระการ อ.ชาติตระการ จ.พิษณุโลก ,05:00 ,2
สถานีบ้านวังท่าดี*,ต.วังท่าดี อ.หนองไผ่ จ.เพชรบูรณ์ ,05:00 ,2
สถานีบ้านน้ำพริก,ต.ยางโกลน อ.นครไทย จ.พิษณุโลก ,06:00 ,2
สถานีบ้านขาม,ต.หัวเมือง อ.เมืองปาน จ.ลำปาง ,06:00 ,2
สถานีจุดวัด ค.แสนแสบ-วัดทรัพย์ฯ,ต.แสนแสบ อ.มีนบุรี จ.กรุงเทพมหานคร ,06:00 ,2
สถานีบ้านแม่สงเหนือ,ต.ร่องเคาะ อ.วังเหนือ จ.ลำปาง ,06:00 ,2
สถานีบ้านท่าทองแดง,ต.นาโบสถ์ อ.วังเจ้า จ.ตาก ,06:00 ,2
สถานีบ้านร้อง,ต.แม่เจดีย์ใหม่ อ.เวียงป่าเป้า จ.เชียงราย ,05:00 ,2
สถานีบ้านแม่โถหลวง,ต.บ่อสลี อ.ฮอด จ.เชียงใหม่ ,06:00 ,2
สถานีบ้านนาฟ่อน,ต.บ่อหลวง อ.ฮอด จ.เชียงใหม่ ,06:00 ,2
สถานีเขตสะพานสูง,ต.สะพานสูง อ.สะพานสูง จ.กรุงเทพมหานคร ,02:00 ,2
สถานีบ้านน้ำปุก,ต.ขุนควร อ.ปง จ.พะเยา ,06:00 ,2
สถานีบ้านงิ้วเฒ่า,ต.ป่าหุ่ง อ.พาน จ.เชียงราย ,06:00 ,2
สถานีทต.ขุนยวม,ต.ขุนยวม อ.ขุนยวม จ.แม่ฮ่องสอน ,06:00 ,2
สถานีบ้านม้งเก้าหลัง,ต.เทอดไทย อ.แม่ฟ้าหลวง จ.เชียงราย ,06:00 ,2
สถานีแม่น้ำเข็ก (ว้งทอง),ต.วังนกแอ่น อ.วังทอง จ.พิษณุโลก ,06:00 ,2
สถานีเขตบึงกุ่ม,ต.คลองกุ่ม อ.บึงกุ่ม จ.กรุงเทพมหานคร ,02:00 ,2
สถานีบ้านส้าน,ต.สันทะ อ.นาน้อย จ.น่าน ,06:00 ,2
สถานีคลองพระพิมล (ไทรน้อย),ต.ไทรน้อย อ.ไทรน้อย จ.นนทบุรี ,06:00 ,2
สถานีบ้านสบเติ๋น,ต.สบป้าด อ.แม่เมาะ จ.ลำปาง ,05:00 ,2
สถานีทต.ภูเรือ,ต.หนองบัว อ.ภูเรือ จ.เลย ,06:00 ,2
สถานีทต.บ้านโฮ่ง,ต.บ้านโฮ่ง อ.บ้านโฮ่ง จ.ลำพูน ,06:00 ,2
สถานีแม่น้ำชี บ้านหินกอง,ต.โนนสมบูรณ์ อ.บ้านแฮด จ.ขอนแก่น ,05:00 ,2
สถานีบ้านเขาเกตุ,ต.ทับกวาง อ.แก่งคอย จ.สระบุรี ,05:00 ,2
สถานีน้ำพวย อ.ผาขาว,ต.ท่าช้างคล้อง อ.ผาขาว จ.เลย ,05:00 ,2
สถานีแม่น้ำชี ฝายมหาสารคาม,ต.หนองบัว อ.โกสุมพิสัย จ.มหาสารคาม ,05:00 ,2
สถานีบ้านผึ้ง,ต.วังยาว อ.ด่านซ้าย จ.เลย ,06:00 ,2
สถานีบ้านซับป่าพลู,ต.ป่าอ้อ อ.ลานสัก จ.อุทัยธานี ,06:00 ,2
สถานีบ้านเนินพยอม*,ต.บ้านดง อ.ชาติตระการ จ.พิษณุโลก ,05:00 ,2
สถานีคลองกลาง,ต.ศาลเจ้าไก่ต่อ อ.ลาดยาว จ.นครสวรรค์ ,06:00 ,2
สถานีบ้านห้วยหลวง,ต.บ้านกาศ อ.แม่สะเรียง จ.แม่ฮ่องสอน ,06:00 ,2
สถานีบ้านผาลั้ง,ต.ห้วยชมภู อ.เมืองเชียงราย จ.เชียงราย ,05:00 ,2
สถานีขาณุวรลักษบุรี,ต.ป่าพุทรา อ.ขาณุวรลักษบุรี จ.กำแพงเพชร ,06:00 ,2
สถานีบ้านในทับ,ต.พรหมโลก อ.พรหมคีรี จ.นครศรีธรรมราช ,06:00 ,2
สถานีบ้านขุนสาใน,ต.โป่งสา อ.ปาย จ.แม่ฮ่องสอน ,00:00 ,2
สถานีสะพานน้ำยาว บ้านสองแคว,ต.นาไร่หลวง อ.สองแคว จ.น่าน ,06:00 ,2
สถานีบ้านอุมดาเหนือ,ต.แม่คะตวน อ.สบเมย จ.แม่ฮ่องสอน ,06:00 ,2
สถานีบ้านห้วยมะบวบ,ต.แม่ยวมน้อย อ.ขุนยวม จ.แม่ฮ่องสอน ,06:00 ,2
สถานีบ้านเมืองปอน,ต.เมืองปอน อ.ขุนยวม จ.แม่ฮ่องสอน ,06:00 ,2
สถานีสะพานลำน้ำเลย,ต.เชียงคาน อ.เชียงคาน จ.เลย ,06:00 ,2
สถานีบ้านห้วยหม้อ,ต.บ้านตุ่น อ.เมืองพะเยา จ.พะเยา ,05:00 ,2
สถานีสะพานน้ำว้า บ้านน้ำว้า,ต.น้ำพาง อ.แม่จริม จ.น่าน ,00:00 ,2
สถานีศรีสัชนาลัย,ต.หาดเสี้ยว อ.ศรีสัชนาลัย จ.สุโขทัย ,06:00 ,2
สถานีบ้านโนนโก,ต.บ้านโตก อ.เมืองเพชรบูรณ์ จ.เพชรบูรณ์ ,06:00 ,2
สถานีโครงการพัฒนาราษฎรชาวไทยภูเขา ฯ บ้านปางคอง,ต.นาปู่ป้อม อ.ปางมะผ้า จ.แม่ฮ่องสอน ,06:00 ,2
สถานีบ้านห้วยบงใหม่,ต.แม่จะเรา อ.แม่ระมาด จ.ตาก ,05:00 ,2
สถานีตะพานหิน,ต.งิ้วราย อ.ตะพานหิน จ.พิจิตร ,06:00 ,2
สถานีบ้านแม่กาษาใหม่ไหล่ท่า,ต.แม่กาษา อ.แม่สอด จ.ตาก ,06:00 ,2
สถานีอ.นากลาง,ต.นากลาง อ.นากลาง จ.หนองบัวลำภู ,05:00 ,2
สถานีบ้านน้ำจันทร์,ต.หนองงิ้ว อ.วังสะพุง จ.เลย ,06:00 ,2
สถานีสะพานเขานางบวช,ต.ศรีนาวา อ.เมืองนครนายก จ.นครนายก ,06:00 ,2
สถานีอบต.ปากพนังฝั่งตะวันออก,ต.ปากพนังฝั่งตะวันออก อ.ปากพนัง จ.นครศรีธรรมราช ,06:00 ,2
สถานีตาก,ต.น้ำรึม อ.เมืองตาก จ.ตาก ,04:00 ,1.9
สถานีอบต.กุมภวาปี,ต.กุมภวาปี อ.กุมภวาปี จ.อุดรธานี ,06:00 ,1.8
สถานีท้ายปตร.พระธรรมราชา,ต.บึงน้ำรักษ์ อ.ธัญบุรี จ.ปทุมธานี ,06:00 ,1.8
สถานีคลองระพีพัฒน์แยกใต้ หนองเสือ,ต.นพรัตน์ อ.หนองเสือ จ.ปทุมธานี ,06:00 ,1.8
สถานีอบต.หล่มเก่า,ต.หล่มเก่า อ.หล่มเก่า จ.เพชรบูรณ์ ,06:00 ,1.8
สถานีคลองหกวา ลำลูกกา คลอง8,ต.ลำลูกกา อ.ลำลูกกา จ.ปทุมธานี ,06:00 ,1.8
สถานีอบต.พบพระ,ต.พบพระ อ.พบพระ จ.ตาก ,06:00 ,1.8
สถานีสะพานนวลฉวี,ต.บ้านใหม่ อ.ปากเกร็ด จ.นนทบุรี ,06:00 ,1.8
สถานีปตร.กลางคลองข้าวเม่า (วัดกระสังข์),ต.หันตรา อ.พระนครศรีอยุธยา จ.พระนครศรีอยุธยา ,06:00 ,1.8
สถานีอบต.หนองบอนแดง,ต.หนองบอนแดง อ.บ้านบึง จ.ชลบุรี ,06:00 ,1.8
สถานีโกสุมพิสัย,ต.หัวขวาง อ.โกสุมพิสัย จ.มหาสารคาม ,06:00 ,1.8
สถานีอบต.ท่าเกวียน,ต.ท่าเกวียน อ.วัฒนานคร จ.สระแก้ว ,06:00 ,1.8
สถานีอบต.วังน้ำเขียว,ต.วังน้ำเขียว อ.วังน้ำเขียว จ.นครราชสีมา ,06:00 ,1.8
สถานีสะพานห้วยมุก,ต.มุกดาหาร อ.เมืองมุกดาหาร จ.มุกดาหาร ,06:00 ,1.8
สถานีอบต.ศรีกะอาง,ต.ศรีกะอาง อ.บ้านนา จ.นครนายก ,06:00 ,1.8
สถานีเขื่อนแควน้อยบำรุงแดน,ต.คันโช้ง อ.วัดโบสถ์ จ.พิษณุโลก ,06:00 ,1.8
สถานีหน่วยพิทักษ์ป่าอ่าวท่ายาง,ต.เกาะหมาก อ.ปากพะยูน จ.พัทลุง ,06:00 ,1.8
สถานีทต.ช้างเผือก,ต.ช้างเผือก อ.เมืองเชียงใหม่ จ.เชียงใหม่ ,06:00 ,1.8
สถานีเหนือปตร.บรมธาตุ,ต.ชัยนาท อ.เมืองชัยนาท จ.ชัยนาท ,06:00 ,1.8
สถานีท้ายปตร.บรมธาตุ,ต.ชัยนาท อ.เมืองชัยนาท จ.ชัยนาท ,06:00 ,1.6
สถานีบางปะกง,ต.ท่าสะอ้าน อ.บางปะกง จ.ฉะเชิงเทรา ,06:00 ,1.6
สถานีคลองลำปลาทิว ลาดกระบัง,ต.ลาดกระบัง อ.ลาดกระบัง จ.กรุงเทพมหานคร ,06:00 ,1.6
สถานีอบต.เขาล้าน,ต.เขาล้าน อ.ทับสะแก จ.ประจวบคีรีขันธ์ ,06:00 ,1.6
สถานีสะพานลานดอกไม้,ต.ลานดอกไม้ อ.เมืองกำแพงเพชร จ.กำแพงเพชร ,06:00 ,1.6
สถานีบ้านม่วง,ต.ห้วยหลัว อ.บ้านม่วง จ.สกลนคร ,06:00 ,1.6
สถานีหนองบัวระเหว,ต.หนองบัวระเหว อ.หนองบัวระเหว จ.ชัยภูมิ ,06:00 ,1.6
สถานีสะพานห้วยน้ำฮวย,ต.บ้านม่วง อ.สังคม จ.หนองคาย ,06:00 ,1.6
สถานีอบต.ป่าแดง,ต.ป่าแดง อ.ชาติตระการ จ.พิษณุโลก ,06:00 ,1.6
สถานีบ้านแม่จอ,ต.แม่โถ อ.แม่ลาน้อย จ.แม่ฮ่องสอน ,06:00 ,1.5
สถานีบ้านบางมะขาม,ต.อ่างทอง อ.เกาะสมุย จ.สุราษฎร์ธานี ,05:00 ,1.5
สถานีบ้านหินสี,ต.ยางหัก อ.ปากท่อ จ.ราชบุรี ,06:00 ,1.5
สถานีบ้านชมภูเหนือ,ต.ชมพู อ.เนินมะปราง จ.พิษณุโลก ,06:00 ,1.5
สถานีบ้านห้วยน้ำขาว,ต.บ้านเก่า อ.เมืองกาญจนบุรี จ.กาญจนบุรี ,06:00 ,1.5
สถานีบ้านบ่อทอง,ต.นางแล อ.เมืองเชียงราย จ.เชียงราย ,06:00 ,1.5
สถานีบ้านนาป่าแปก,ต.หมอกจำแป่ อ.เมืองแม่ฮ่องสอน จ.แม่ฮ่องสอน ,06:00 ,1.5
สถานีบ้านห้วยเอียด,ต.ไผ่โทน อ.ร้องกวาง จ.แพร่ ,05:00 ,1.5
สถานีบ้านหัวดอย,ต.กองแขก อ.แม่แจ่ม จ.เชียงใหม่ ,06:00 ,1.5
สถานีบ้านน้ำตกสาย 1,ต.ห้วยยาง อ.ทับสะแก จ.ประจวบคีรีขันธ์ ,06:00 ,1.5
สถานีเถิน,ต.แม่ปะ อ.เถิน จ.ลำปาง ,04:00 ,1.5
สถานีบ้านหนองใหญ่,ต.สามร้อยยอด อ.สามร้อยยอด จ.ประจวบคีรีขันธ์ ,06:00 ,1.5
สถานีบ้านห้วยโผ,ต.แม่ยวม อ.แม่สะเรียง จ.แม่ฮ่องสอน ,06:00 ,1.5
สถานีบ้านดินดอน,ต.ท่าดี อ.ลานสกา จ.นครศรีธรรมราช ,06:00 ,1.5
สถานีบ้านใหม่พรสวรรค์,ต.นาโบสถ์ อ.วังเจ้า จ.ตาก ,06:00 ,1.5
สถานีปตร.คลองสามวา,ต.บางขัน อ.คลองสามวา จ.กรุงเทพมหานคร ,02:00 ,1.5
สถานีบ้านหมื่นฤาชัย,ต.พบพระ อ.พบพระ จ.ตาก ,05:00 ,1.5
สถานีบ้านผากระเจ้อ,ต.พบพระ อ.พบพระ จ.ตาก ,05:00 ,1.5
สถานีบ้านดอยมด,ต.แม่เจดีย์ใหม่ อ.เวียงป่าเป้า จ.เชียงราย ,06:00 ,1.5
สถานีบ้านซับกระสังข์,ต.ดอนเมือง อ.สีคิ้ว จ.นครราชสีมา ,05:00 ,1.5
สถานีบ้านคลองเดื่อ,ต.หมูสี อ.ปากช่อง จ.นครราชสีมา ,05:00 ,1.5
สถานีบ้านแม่ปูนล่าง,ต.สันสลี อ.เวียงป่าเป้า จ.เชียงราย ,06:00 ,1.5
สถานีบ้านน้ำเคิม,ต.ปิงหลวง อ.นาหมื่น จ.น่าน ,05:00 ,1.5
