ชื่อสถานี,ที่ตั้ง,เวลา,ฝนล่าสุด (มม.)
สถานีโรงเรียนวัดโคกโพธิ์สถิตย์,ต.กำโลน อ.ลานสกา จ.นครศรีธรรมราช ,06:00 ,160.8
สถานีบ้านท่านหญิง,ต.ตะกุกเหนือ อ.วิภาวดี จ.สุราษฎร์ธานี ,01:00 ,108
สถานีฉวาง,ต.ไม้เรียง อ.ฉวาง จ.นครศรีธรรมราช ,04:00 ,101
สถานีบ้านหนองแวง,ต.ไทรเดี่ยว อ.คลองหาด จ.สระแก้ว ,06:00 ,95.5
สถานีบ้านเหนือคลอง,ต.ทุ่งโพธิ์ อ.จุฬาภรณ์ จ.นครศรีธรรมราช ,06:00 ,80
สถานีบ้านซับแม็ก,ต.หนองน้ำใส อ.วัฒนานคร จ.สระแก้ว ,06:00 ,77
สถานีทต.บูเก๊ะตา,ต.โละจูด อ.แว้ง จ.นราธิวาส ,06:00 ,71.8
สถานีพัทลุง สกษ.,ต.ลำปำ อ.เมืองพัทลุง จ.พัทลุง ,04:00 ,71.3
สถานีอบต.ตะปาน,ต.ตะปาน อ.พุนพิน จ.สุราษฎร์ธานี ,06:00 ,70.4
สถานีอบต.ยะรม,ต.ยะรม อ.เบตง จ.ยะลา ,06:00 ,67.8
สถานีหน่วยจัดการต้นน้ำตาปี,ต.ตะกุกใต้ อ.วิภาวดี จ.สุราษฎร์ธานี ,06:00 ,67.4
สถานีโป่งน้ำร้อน,ต.หนองตาคง อ.โป่งน้ำร้อน จ.จันทบุรี ,06:00 ,67.4
สถานีบ้านห้วยกลาง,ต.กะทูน อ.พิปูน จ.นครศรีธรรมราช ,06:00 ,66.5
สถานีบ้านกลาง,ต.ละมอ อ.นาโยง จ.ตรัง ,06:00 ,65.5
สถานีบ้านกอบแก้ววัฒนาภิบาล,ต.ลำพูน อ.บ้านนาสาร จ.สุราษฎร์ธานี ,05:00 ,65.5
สถานีบ้านปะตงล่าง (เขาสอยดาว),ต.ทรายขาว อ.สอยดาว จ.จันทบุรี ,06:00 ,61
สถานีไร่ วงศ์ ทอง เมฆ ดี,ต.ที่วัง อ.ทุ่งสง จ.นครศรีธรรมราช ,06:00 ,60.2
สถานีอบต.นายายอาม,ต.นายายอาม อ.นายายอาม จ.จันทบุรี ,06:00 ,56.6
สถานีเขตรักษาพันธุ์สัตว์ป่าเขาสอยดาว,ต.ทรายขาว อ.สอยดาว จ.จันทบุรี ,06:00 ,55.2
สถานีบ้านไสใหญ่เหนือ,ต.ถ้ำใหญ่ อ.ทุ่งสง จ.นครศรีธรรมราช ,06:00 ,55
สถานีบ้านวัด,ต.ประกอบ อ.นาทวี จ.สงขลา ,06:00 ,55
สถานีเทศบาลตำบลปะแต,ต.ปะแต อ.ยะหา จ.ยะลา ,06:00 ,54.6
สถานีบ้านย่านอุดม,ต.ทุ่งไทรทอง อ.ลำทับ จ.กระบี่ ,05:00 ,54.5
สถานีบ้านควนไม้ไผ่,ต.นาหว้า อ.จะนะ จ.สงขลา ,06:00 ,54
สถานีสะพานกะลูบี บ้านสายปารี,ต.มาโมง อ.สุคิริน จ.นราธิวาส ,06:00 ,52.6
สถานีบ้านหินลับ,ต.มวกเหล็ก อ.มวกเหล็ก จ.สระบุรี ,06:00 ,52.5
สถานีทม.วังน้ำเย็น,ต.วังน้ำเย็น อ.วังน้ำเย็น จ.สระแก้ว ,06:00 ,51.8
สถานีคลองปะแต,ต.ปะแต อ.ยะหา จ.ยะลา ,06:00 ,50.8
สถานีบ้านหน้าซึง,ต.ปากฉลุย อ.ท่าฉาง จ.สุราษฎร์ธานี ,05:00 ,50.5
สถานีคลองสุงบบารู หมู่ที่ 4,ต.คลองใหม่ อ.ยะรัง จ.ปัตตานี ,06:00 ,49.8
สถานีรพสต.บ้านลำกะ,ต.ชุมพล อ.ศรีนครินทร์ จ.พัทลุง ,06:00 ,49
สถานีบ้านหนองกะโตวา,ต.ปากช่อง อ.ปากช่อง จ.นครราชสีมา ,06:00 ,47.5
สถานีฉะเชิงเทรา,ต.แปลงยาว อ.สนามชัยเขต จ.ฉะเชิงเทรา ,04:00 ,47.3
สถานีสะพานทางเข้าชุมชนบ้านปากซวด,ต.พังกาญจน์ อ.พนม จ.สุราษฎร์ธานี ,06:00 ,47.2
สถานีบ้านเขาจันทร์,ต.หนองธง อ.ป่าบอน จ.พัทลุง ,06:00 ,47
สถานีบ้านช่องช้าง,ต.พรุพี อ.บ้านนาสาร จ.สุราษฎร์ธานี ,06:00 ,47
สถานีสะพานหัวสะพาน อ.บันนังสตา จ.ยะลา,ต.บาเจาะ อ.บันนังสตา จ.ยะลา ,05:00 ,47
สถานีบ้านเกาะจง,ต.ทับช้าง อ.นาทวี จ.สงขลา ,06:00 ,45.5
สถานีบ้านใหม่ศรีจำปา,ต.หนองหมากฝ้าย อ.วัฒนานคร จ.สระแก้ว ,05:00 ,45.5
สถานีบ้านลางา,ต.ลางา อ.มายอ จ.ปัตตานี ,05:00 ,45.5
สถานีสะพานเมืองปัตตานี อ.เมือง จ.ปัตตานี,ต.จะบังติกอ อ.เมืองปัตตานี จ.ปัตตานี ,05:00 ,45
สถานีสะพานคลองพาย,ต.น้ำหัก อ.คีรีรัฐนิคม จ.สุราษฎร์ธานี ,06:00 ,43.8
สถานีหน่วยพิทักษ์ป่าคลองหยา,ต.เขาพัง อ.บ้านตาขุน จ.สุราษฎร์ธานี ,05:00 ,43
สถานีหน่วยจัดการต้นน้ำขุนว้า,ต.ดงพญา อ.บ่อเกลือ จ.น่าน ,06:00 ,42.8
สถานีอบต.นาโพธิ์กลาง,ต.นาโพธิ์กลาง อ.โขงเจียม จ.อุบลราชธานี ,06:00 ,42.8
สถานีทม.พัทลุง,ต.คูหาสวรรค์ อ.เมืองพัทลุง จ.พัทลุง ,06:00 ,42.4
สถานีรร.บ้านเหมืองตะกั่ว,ต.หนองธง อ.ป่าบอน จ.พัทลุง ,06:00 ,42.4
สถานีบางกล่ำ,ต.ท่าช้าง อ.บางกล่ำ จ.สงขลา ,06:00 ,41.6
สถานีบ้านหนองบอน,ต.หนองบอน อ.บ่อไร่ จ.ตราด ,06:00 ,41.5
สถานีสตูล,ต.คลองขุด อ.เมืองสตูล จ.สตูล ,04:00 ,41.5
สถานีอบต.เทพนิมิต,ต.เทพนิมิต อ.โป่งน้ำร้อน จ.จันทบุรี ,06:00 ,41.2
สถานีหน่วยพิทักษ์อุทยานแห่งชาติที่ ขญ.๑๗ (กลางดง),ต.พญาเย็น อ.ปากช่อง จ.นครราชสีมา ,06:00 ,41
สถานีหน่วยพิทักษ์ป่าเขาพัง,ต.เขาพัง อ.บ้านตาขุน จ.สุราษฎร์ธานี ,05:00 ,41
สถานีบ้านโคกนนทรี,ต.ลำพญากลาง อ.มวกเหล็ก จ.สระบุรี ,00:00 ,40
สถานีบ้านบางสาว,ต.เขาวง อ.บ้านตาขุน จ.สุราษฎร์ธานี ,05:00 ,40
สถานีบ้านน้ำจวง,ต.บ่อภาค อ.ชาติตระการ จ.พิษณุโลก ,06:00 ,39
สถานีอบต.ขุนทะเล,ต.ขุนทะเล อ.ลานสกา จ.นครศรีธรรมราช ,06:00 ,39
สถานีบ้านโนนสมบูรณ์,ต.ปากช่อง อ.ปากช่อง จ.นครราชสีมา ,05:00 ,39
สถานีบ้านซำรู้,ต.ห้วยเฮี้ย อ.นครไทย จ.พิษณุโลก ,05:00 ,39
สถานีเกาะลันตา,ต.เกาะลันตาใหญ่ อ.เกาะลันตา จ.กระบี่ ,04:00 ,38.8
สถานีเขตรักษาพันธุ์สัตว์ป่าฮาลา-บาลา,ต.โละจูด อ.แว้ง จ.นราธิวาส ,06:00 ,38.6
สถานีทต.หนองบอน,ต.หนองบอน อ.บ่อไร่ จ.ตราด ,06:00 ,38.2
สถานีชุมชนบ้านเหมือง,ต.อัยเยอร์เวง อ.เบตง จ.ยะลา ,06:00 ,38
สถานีบ้านบางทอง,ต.บางทอง อ.ท้ายเหมือง จ.พังงา ,05:00 ,38
สถานีบ้านท่าแพ,ต.ช้างกลาง อ.ช้างกลาง จ.นครศรีธรรมราช ,06:00 ,38
สถานีบ้านทุ่งลัง,ต.สะท้อน อ.นาทวี จ.สงขลา ,05:00 ,38
สถานีบันนังสตา,ต.บันนังสตา อ.บันนังสตา จ.ยะลา ,06:00 ,37.6
สถานีสะพานข้ามคลองหวาด,ต.คลองสระ อ.กาญจนดิษฐ์ จ.สุราษฎร์ธานี ,06:00 ,36.8
สถานีอบต.คลองตะเกรา,ต.คลองตะเกรา อ.ท่าตะเกียบ จ.ฉะเชิงเทรา ,06:00 ,36.8
สถานีอรัญประเทศ,ต.ป่าไร่ อ.อรัญประเทศ จ.สระแก้ว ,04:00 ,36.7
สถานีบ้านลูโบ๊ะปันยัง,ต.กาบัง อ.กาบัง จ.ยะลา ,05:00 ,36.5
สถานีที่ว่าการอำเภอกาบัง,ต.กาบัง อ.กาบัง จ.ยะลา ,06:00 ,35.6
สถานีบ้านปูโป,ต.สามัคคี อ.รือเสาะ จ.นราธิวาส ,05:00 ,35.5
สถานีบ้านคีรีวง,ต.กำโลน อ.ลานสกา จ.นครศรีธรรมราช ,06:00 ,35.5
สถานีที่ทำการอุทยานแห่งชาติน้ำตกโยง,ต.ถ้ำใหญ่ อ.ทุ่งสง จ.นครศรีธรรมราช ,06:00 ,35
สถานีหน่วยพิทักษ์ป่าเขาช่องลม,ต.เขาคันทรง อ.ศรีราชา จ.ชลบุรี ,06:00 ,35
สถานีบ้านเงาะกาโป,ต.บันนังสตา อ.บันนังสตา จ.ยะลา ,05:00 ,35
สถานีบ้านนบ,ต.กรุงชิง อ.นบพิตำ จ.นครศรีธรรมราช ,06:00 ,35
สถานีสุคิริน,ต.สุคิริน อ.สุคิริน จ.นราธิวาส ,06:00 ,34.2
สถานีทุ่งสง,ต.ปากแพรก อ.ทุ่งสง จ.นครศรีธรรมราช ,06:00 ,33.8
สถานีสวนสาธารณะ ทต.รือเสาะ,ต.รือเสาะ อ.รือเสาะ จ.นราธิวาส ,06:00 ,33.8
สถานีคลองพระพิมล (ไทรน้อย),ต.ไทรน้อย อ.ไทรน้อย จ.นนทบุรี ,06:00 ,33.6
สถานีบ้านม่วงลีบ,ต.คลองสระ อ.กาญจนดิษฐ์ จ.สุราษฎร์ธานี ,05:00 ,33.5
สถานีบ้านขุนพัง,ต.หินตก อ.ร่อนพิบูลย์ จ.นครศรีธรรมราช ,06:00 ,33.5
สถานีบ้านอูแบ,ต.ยะต๊ะ อ.รามัน จ.ยะลา ,05:00 ,33.5
สถานีคลองท่าดี,ต.กำแพงเซา อ.เมืองนครศรีธรรมราช จ.นครศรีธรรมราช ,06:00 ,33.4
สถานีที่ว่าการอำเภอสุคีริน,ต.สุคิริน อ.สุคิริน จ.นราธิวาส ,06:00 ,33.4
สถานีบ้านแม่โมงเย้า,ต.วาวี อ.แม่สรวย จ.เชียงราย ,06:00 ,33
สถานีบ้านสวนปราง,ต.คลองสระ อ.กาญจนดิษฐ์ จ.สุราษฎร์ธานี ,06:00 ,33
สถานีบ้านธาราวงศ์อารีย์,ต.เพิ่มพูนทรัพย์ อ.บ้านนาสาร จ.สุราษฎร์ธานี ,06:00 ,33
สถานีชุมชนกุนุงจนอง,ต.เบตง อ.เบตง จ.ยะลา ,05:00 ,33
สถานีบ้านบีกริม,ต.คลองทับจันทร์ อ.อรัญประเทศ จ.สระแก้ว ,06:00 ,32.5
สถานีบ้านลีมาปูโร๊ะ,ต.บาโงยซิแน อ.ยะหา จ.ยะลา ,05:00 ,32.5
สถานีบ้านบางบอน,ต.คลองศก อ.พนม จ.สุราษฎร์ธานี ,05:00 ,32.5
สถานีสะพานบ้านสวนปราง,ต.คลองสระ อ.กาญจนดิษฐ์ จ.สุราษฎร์ธานี ,06:00 ,32.2
สถานีบ้านคลองไทร,ต.หนองย่างเสือ อ.มวกเหล็ก จ.สระบุรี ,05:00 ,32
สถานีบ้านทุ่งม่วง,ต.ทับไทร อ.โป่งน้ำร้อน จ.จันทบุรี ,05:00 ,32
สถานีบ้านมะม่วง,ต.นนทรีย์ อ.บ่อไร่ จ.ตราด ,05:00 ,32
สถานีบ้านสระเกศ,ต.ตลิ่งงาม อ.เกาะสมุย จ.สุราษฎร์ธานี ,05:00 ,32
สถานีทต.โคกตูม,ต.โคกตูม อ.เมืองลพบุรี จ.ลพบุรี ,06:00 ,31.8
สถานีบ้านตะเคียนงาม,ต.บางหิน อ.กะเปอร์ จ.ระนอง ,05:00 ,31.5
สถานีบ้านจันทรัตน์,ต.ยะรม อ.เบตง จ.ยะลา ,05:00 ,31.5
สถานีทต.แว้ง,ต.แว้ง อ.แว้ง จ.นราธิวาส ,06:00 ,31.2
สถานีผาชนะได (อช.ผาแต้ม),ต.นาโพธิ์กลาง อ.โขงเจียม จ.อุบลราชธานี ,06:00 ,31
สถานีบ้านว่านเหลือง,ต.ชากไทย อ.เขาคิชฌกูฏ จ.จันทบุรี ,06:00 ,31
สถานีวิภาวดี,ต.ตะกุกเหนือ อ.วิภาวดี จ.สุราษฎร์ธานี ,06:00 ,30.6
สถานีส.คลองเจ้าคุณสิงห์,ต.วังทองหลาง อ.วังทองหลาง จ.กรุงเทพมหานคร ,06:00 ,30
สถานีบ้านเขาไว้ข้าว,ต.ดินแดง อ.ลำทับ จ.กระบี่ ,06:00 ,29.5
สถานีบ้านตาเรืองล่าง,ต.ปะตง อ.สอยดาว จ.จันทบุรี ,05:00 ,29
สถานีอบต.คลองศก,ต.คลองศก อ.พนม จ.สุราษฎร์ธานี ,06:00 ,28.6
สถานีบ้านแก่งไฮ,ต.หนองกะท้าว อ.นครไทย จ.พิษณุโลก ,03:00 ,28.5
สถานีหมู่บ้านปิยะมิตร 3,ต.อัยเยอร์เวง อ.เบตง จ.ยะลา ,06:00 ,28.2
สถานีบ้านบางหวาน,ต.กมลา อ.กะทู้ จ.ภูเก็ต ,06:00 ,28
สถานีบ้านยางค้อม,ต.ยางค้อม อ.พิปูน จ.นครศรีธรรมราช ,06:00 ,28
สถานีบ้านดินดอน,ต.ท่าดี อ.ลานสกา จ.นครศรีธรรมราช ,06:00 ,27.5
สถานีสะพานบางไตประชาบริรักษ์,ต.ตะกุกเหนือ อ.วิภาวดี จ.สุราษฎร์ธานี ,06:00 ,27.2
สถานีคลองแสนแสบ บางกะปิ,ต.หัวหมาก อ.บางกะปิ จ.กรุงเทพมหานคร ,06:00 ,27.2
สถานีสถานีวิจัยต้นน้ำตาปี,ต.กะทูน อ.พิปูน จ.นครศรีธรรมราช ,05:00 ,27
สถานีวัดท่ายาง,ต.ท่ายาง อ.ทุ่งใหญ่ จ.นครศรีธรรมราช ,05:00 ,27
สถานีบ้านเขาเกตุ,ต.ทับกวาง อ.แก่งคอย จ.สระบุรี ,06:00 ,27
สถานีฝายคลองท่าเลา,ต.นาหลวงเสน อ.ทุ่งสง จ.นครศรีธรรมราช ,06:00 ,27
สถานีบ้านควนยาว,ต.ลานข่อย อ.ป่าพะยอม จ.พัทลุง ,06:00 ,26.5
สถานีหน่วยจัดการต้นน้ำดอยถ้วย,ต.เมืองนะ อ.เชียงดาว จ.เชียงใหม่ ,06:00 ,26.2
สถานีทต.ยะรัง,ต.ยะรัง อ.ยะรัง จ.ปัตตานี ,06:00 ,26.2
สถานีบ้านหนองยาง,ต.มิตรภาพ อ.มวกเหล็ก จ.สระบุรี ,05:00 ,26
สถานีที่ว่าการอำเภอรามัน,ต.กายูบอเกาะ อ.รามัน จ.ยะลา ,06:00 ,26
สถานีบ้านเขาอ่าง,ต.มาบไพ อ.ขลุง จ.จันทบุรี ,06:00 ,26
สถานีรพสต.บ่อวิน,ต.บ่อวิน อ.ศรีราชา จ.ชลบุรี ,06:00 ,26
สถานีบ้านบือจะ,ต.พิเทน อ.ทุ่งยางแดง จ.ปัตตานี ,05:00 ,26
สถานีมัสยิดกาวมินมูฮายีริน,ต.ปาล์มพัฒนา อ.มะนัง จ.สตูล ,06:00 ,26
สถานีบ้านอังคาย,ต.ยั้งเมิน อ.สะเมิง จ.เชียงใหม่ ,06:00 ,26
สถานีพุนพิน 1,ต.ท่าข้าม อ.พุนพิน จ.สุราษฎร์ธานี ,06:00 ,25.8
สถานีตะกั่วป่า,ต.ตำตัว อ.ตะกั่วป่า จ.พังงา ,06:00 ,25.8
สถานีฝายคลองเปิก,ต.ถ้ำใหญ่ อ.ทุ่งสง จ.นครศรีธรรมราช ,06:00 ,25.6
สถานีบ้านป่าไผ่,ต.กาหลง อ.ศรีสาคร จ.นราธิวาส ,05:00 ,25.5
สถานีอบต.กาบัง,ต.กาบัง อ.กาบัง จ.ยะลา ,06:00 ,25.4
สถานีบ้านหน้าถ้ำ,ต.นาเหรง อ.นบพิตำ จ.นครศรีธรรมราช ,06:00 ,25
สถานีเกาะสมุย,ต.มะเร็ต อ.เกาะสมุย จ.สุราษฎร์ธานี ,04:00 ,24.8
สถานีชุมชนประแส,ต.ปากน้ำกระแส อ.แกลง จ.ระยอง ,06:00 ,24.8
สถานีรร.วัดควนสีนวล,ต.นาข้าวเสีย อ.นาโยง จ.ตรัง ,06:00 ,24.6
สถานีบ้านบันนังบูโบ,ต.ถ้ำทะลุ อ.บันนังสตา จ.ยะลา ,05:00 ,24.5
สถานีบ้านไอร์เจี๊ยะ,ต.ซากอ อ.ศรีสาคร จ.นราธิวาส ,05:00 ,24.5
สถานีบ้านฮูหยงบาโร๊ะ,ต.กายูบอเกาะ อ.รามัน จ.ยะลา ,05:00 ,24.5
สถานีที่ว่าการอำเภอยี่งอ,ต.ยี่งอ อ.ยี่งอ จ.นราธิวาส ,06:00 ,24.4
สถานีบ้านพอนอคี,ต.ห้วยโป่ง อ.เมืองแม่ฮ่องสอน จ.แม่ฮ่องสอน ,06:00 ,24
สถานีบ้านพรุสมภาร,ต.เทพกระษัตรี อ.ถลาง จ.ภูเก็ต ,04:00 ,24
สถานีบ้านเขานมนาง,ต.ลำพญากลาง อ.มวกเหล็ก จ.สระบุรี ,06:00 ,24
สถานีนราธิวาส,ต.บางนาค อ.เมืองนราธิวาส จ.นราธิวาส ,22:00 ,23.8
สถานีเขตวังทองหลาง,ต.วังทองหลาง อ.วังทองหลาง จ.กรุงเทพมหานคร ,06:00 ,23.5
สถานีสะพานข้ามแม่น้ำปัตตานี,ต.ตลิ่งชัน อ.บันนังสตา จ.ยะลา ,06:00 ,23.4
สถานีรร.บ้านลำปลอกเหนือ,ต.ในควน อ.ย่านตาขาว จ.ตรัง ,06:00 ,23.2
สถานีบ้านแยง,ต.บ้านแยง อ.นครไทย จ.พิษณุโลก ,06:00 ,23
สถานีบ้านห้วยไทร,ต.ชุมพล อ.ศรีนครินทร์ จ.พัทลุง ,05:00 ,22.5
สถานีบ้านห้วยโต้,ต.ทับปริก อ.เมืองกระบี่ จ.กระบี่ ,06:00 ,22.5
สถานีบ้านห้วยลาด,ต.หลักด่าน อ.น้ำหนาว จ.เพชรบูรณ์ ,06:00 ,22.5
สถานีบ้านซับกระสังข์,ต.ดอนเมือง อ.สีคิ้ว จ.นครราชสีมา ,05:00 ,22.5
สถานีบ้านซับปลากั้ง,ต.ลำสมพุง อ.มวกเหล็ก จ.สระบุรี ,06:00 ,22.5
สถานีอบต.นากะซะ,ต.นากะชะ อ.ฉวาง จ.นครศรีธรรมราช ,06:00 ,22.4
สถานีโรงสูบน้ำประปา,ต.เขาวง อ.บ้านตาขุน จ.สุราษฎร์ธานี ,05:00 ,22
สถานีบ้านหนองปลิง,ต.คลองพา อ.ท่าชนะ จ.สุราษฎร์ธานี ,05:00 ,22
สถานีจุดวัด ค.ทวีฯ-ค.บางเชือกหนัง,ต.บางไผ่ อ.บางแค จ.กรุงเทพมหานคร ,06:00 ,22
สถานีบ้านเขาเหล็ก,ต.นบพิตำ อ.นบพิตำ จ.นครศรีธรรมราช ,06:00 ,22
สถานีบ้านปลายระแนะ,ต.ละอาย อ.ฉวาง จ.นครศรีธรรมราช ,06:00 ,22
สถานีบ้านดงจิก,ต.ทับไทร อ.โป่งน้ำร้อน จ.จันทบุรี ,06:00 ,22
สถานีอบต.หนองแหน,ต.หนองแหน อ.พนมสารคาม จ.ฉะเชิงเทรา ,06:00 ,22
สถานีกระบี่,ต.เหนือคลอง อ.เหนือคลอง จ.กระบี่ ,04:00 ,21.6
สถานีบ้านวังลุง,ต.ทอนหงส์ อ.พรหมคีรี จ.นครศรีธรรมราช ,06:00 ,21.5
สถานีบ้านเชี่ยวขวัญ,ต.ตะกุกเหนือ อ.วิภาวดี จ.สุราษฎร์ธานี ,05:00 ,21.5
สถานีบ้านป่าคลอก,ต.ป่าคลอก อ.ถลาง จ.ภูเก็ต ,05:00 ,21.5
สถานีบ้านห้วยคอม,ต.น้ำไผ่ อ.น้ำปาด จ.อุตรดิตถ์ ,06:00 ,21.5
