สถานีบ้านวังสมบูรณ์,ต.เขาปูน อ.ห้วยยอด จ.ตรัง ,05:00 ,1
สถานีบ้านแก่งแคบ,ต.ท่ากระดาน อ.ศรีสวัสดิ์ จ.กาญจนบุรี ,05:00 ,1
สถานีบ้านหนองใหญ่ ,ต.หนองปรือ อ.หนองปรือ จ.กาญจนบุรี ,05:00 ,1
สถานีบ้านหนองผือ,ต.ด่านช้าง อ.ด่านช้าง จ.สุพรรณบุรี ,05:00 ,1
สถานีบ้านมูเซอป่ากล้วย,ต.แม่ฟ้าหลวง อ.แม่ฟ้าหลวง จ.เชียงราย ,06:00 ,1
สถานีบ้านห้วยชมภู (บ้านป่าคาหลวง),ต.ท่าก๊อ อ.แม่สรวย จ.เชียงราย ,06:00 ,1
สถานีอบต.จอมพระ,ต.จอมพระ อ.จอมพระ จ.สุรินทร์ ,06:00 ,1
สถานีบ้านป่าซางพัฒนา,ต.แม่เจดีย์ อ.เวียงป่าเป้า จ.เชียงราย ,06:00 ,1
สถานีบ้านผาตั้ง,ต.ปอ อ.เวียงแก่น จ.เชียงราย ,06:00 ,1
สถานีบ้านแม่แสลป,ต.แม่สลองใน อ.แม่ฟ้าหลวง จ.เชียงราย ,06:00 ,1
สถานีบ้านวังหอน,ต.วังอ่าง อ.ชะอวด จ.นครศรีธรรมราช ,05:00 ,1
สถานีบ้านหินใหญ่,ต.น้ำจืด อ.กระบุรี จ.ระนอง ,05:00 ,1
สถานีบ้านทบศอก,ต.หมอกจำแป่ อ.เมืองแม่ฮ่องสอน จ.แม่ฮ่องสอน ,06:00 ,1
สถานีบ้านทุ่งมะส้าน,ต.หมอกจำแป่ อ.เมืองแม่ฮ่องสอน จ.แม่ฮ่องสอน ,06:00 ,1
สถานีบ้านท่าคลอง,ต.เทศบาลเมืองกระบี่ อ.เมืองกระบี่ จ.กระบี่ ,05:00 ,1
สถานีบ้านแม่น้ำ,ต.แม่น้ำ อ.เกาะสมุย จ.สุราษฎร์ธานี ,05:00 ,1
สถานีบ้านแม่อุมลองน้อย,ต.ป่าแป๋ อ.แม่สะเรียง จ.แม่ฮ่องสอน ,06:00 ,1
สถานีบ้านผาแดงหลวง,ต.แม่โถ อ.แม่ลาน้อย จ.แม่ฮ่องสอน ,05:00 ,1
สถานีทม.ทับกวาง,ต.ทับกวาง อ.แก่งคอย จ.สระบุรี ,06:00 ,1
สถานีหนองไผ่,ต.นาเฉลียง อ.หนองไผ่ จ.เพชรบูรณ์ ,06:00 ,1
สถานีบ้านห้วยน้ำนัก,ต.พบพระ อ.พบพระ จ.ตาก ,06:00 ,1
สถานีเหนือฝายธาตุน้อย,ต.สหธาตุ อ.เขื่องใน จ.อุบลราชธานี ,06:00 ,1
สถานีบ้านแม่เทินเหนือ,ต.แม่สิน อ.ศรีสัชนาลัย จ.สุโขทัย ,06:00 ,1
สถานีบ้านพุน้ำร้อน,ต.บ้านบึง อ.บ้านคา จ.ราชบุรี ,06:00 ,1
สถานีบ้านดงโคร่ง,ต.หินดาด อ.ทองผาภูมิ จ.กาญจนบุรี ,06:00 ,1
สถานีบ้านหนองบาง,ต.ลิ่นถิ่น อ.ทองผาภูมิ จ.กาญจนบุรี ,06:00 ,1
สถานีบ้านวังโหรา,ต.องค์พระ อ.ด่านช้าง จ.สุพรรณบุรี ,06:00 ,1
สถานีบ้านคีรีวง,ต.กำโลน อ.ลานสกา จ.นครศรีธรรมราช ,06:00 ,1
สถานีบ้านปลายระแนะ,ต.ละอาย อ.ฉวาง จ.นครศรีธรรมราช ,06:00 ,1
สถานีบ้านขุนพัง,ต.หินตก อ.ร่อนพิบูลย์ จ.นครศรีธรรมราช ,06:00 ,1
สถานีบ้านในเพลา,ต.ขนอม อ.ขนอม จ.นครศรีธรรมราช ,06:00 ,1
สถานีบ้านปากลง,ต.กรุงชิง อ.นบพิตำ จ.นครศรีธรรมราช ,06:00 ,1
สถานีบ้านหน้าเหมน,ต.ช้างกลาง อ.ช้างกลาง จ.นครศรีธรรมราช ,06:00 ,1
สถานีบ้านสวนปราง,ต.คลองสระ อ.กาญจนดิษฐ์ จ.สุราษฎร์ธานี ,06:00 ,1
สถานีบ้านไร่ยาว,ต.ประสงค์ อ.ท่าชนะ จ.สุราษฎร์ธานี ,06:00 ,1
สถานีบ้านคลองกลาง,ต.พ่วงพรมคร อ.เคียนซา จ.สุราษฎร์ธานี ,06:00 ,1
สถานีบ้านเขาแงน,ต.วังตะกอ อ.หลังสวน จ.ชุมพร ,06:00 ,1
สถานีบ้านโตนดห้าต้น,ต.นาพญา อ.หลังสวน จ.ชุมพร ,06:00 ,1
สถานีฟิวเจอร์ฯรังสิต,ต.รังสิต อ.ธัญบุรี จ.ปทุมธานี ,06:00 ,1
สถานีอบต.บางใหญ่,ต.บางใหญ่ อ.กระบุรี จ.ระนอง ,06:00 ,1
สถานีบ้านลิพัง,ต.ลิพัง อ.ปะเหลียน จ.ตรัง ,06:00 ,1
สถานีบ้านสว่างคีรี,ต.โคกยาง อ.กันตัง จ.ตรัง ,06:00 ,1
สถานีบ้านสะพานไทร,ต.บางดี อ.ห้วยยอด จ.ตรัง ,06:00 ,1
สถานีบ้านเขาหลัก,ต.ปากแจ่ม อ.ห้วยยอด จ.ตรัง ,06:00 ,1
สถานีบ้านหน้าวัด,ต.ในเตา อ.ห้วยยอด จ.ตรัง ,06:00 ,1
สถานีบ้านห้วยครก,ต.เขาปู่ อ.ศรีบรรพต จ.พัทลุง ,06:00 ,1
สถานีบ้านควนยาว,ต.ลานข่อย อ.ป่าพะยอม จ.พัทลุง ,06:00 ,1
สถานีแม่สะเรียง,ต.บ้านกาศ อ.แม่สะเรียง จ.แม่ฮ่องสอน ,04:00 ,0.9
สถานีกรุงเทพฯ บางนา สกษ.,ต.บางนา อ.บางนา จ.กรุงเทพมหานคร ,04:00 ,0.9
สถานีตรัง,ต.โคกหล่อ อ.เมืองตรัง จ.ตรัง ,04:00 ,0.9
สถานีแพร่,ต.ทุ่งโฮ้ง อ.เมืองแพร่ จ.แพร่ ,04:00 ,0.9
สถานีหน่วยจัดการต้นน้ำน้ำพาง,ต.วังกวาง อ.น้ำหนาว จ.เพชรบูรณ์ ,06:00 ,0.8
สถานีทต.ท่าแร่,ต.ท่าแร่ อ.เมืองสกลนคร จ.สกลนคร ,06:00 ,0.8
สถานีอบจ.กำแพงเพชร,ต.อ่างทอง อ.เมืองกำแพงเพชร จ.กำแพงเพชร ,06:00 ,0.8
สถานีอบต.เกาะสำโรง,ต.เกาะสำโรง อ.เมืองกาญจนบุรี จ.กาญจนบุรี ,06:00 ,0.8
สถานีท้ายปตร.ช่องแค,ต.พรหมนิมิต อ.ตาคลี จ.นครสวรรค์ ,06:00 ,0.8
สถานีลำน้ำกวงสะพานศรีดอนชัย,ต.บ้านธิ อ.บ้านธิ จ.ลำพูน ,06:00 ,0.8
สถานีมหาสารคาม,ต.หัวขวาง อ.โกสุมพิสัย จ.มหาสารคาม ,04:00 ,0.8
สถานีอบต.เวียง,ต.เวียง อ.ฝาง จ.เชียงใหม่ ,06:00 ,0.8
สถานีฝาง,ต.แม่คะ อ.ฝาง จ.เชียงใหม่ ,06:00 ,0.8
สถานีพนมสารคาม,ต.เกาะขนุน อ.พนมสารคาม จ.ฉะเชิงเทรา ,06:00 ,0.8
สถานีอบต.บ้านแหง,ต.บ้านแหง อ.งาว จ.ลำปาง ,06:00 ,0.8
สถานีเลย,ต.นาอาน อ.เมืองเลย จ.เลย ,04:00 ,0.8
สถานีสถานีศึกษาภูมิอากาศป่าไม้ลุ่มน้ำยม,ต.ในเวียง อ.เมืองแพร่ จ.แพร่ ,02:00 ,0.8
สถานีวัดเวฬุวัน,ต.เหนือเมือง อ.เมืองร้อยเอ็ด จ.ร้อยเอ็ด ,06:00 ,0.8
สถานีเหนือฝายวังยาง,ต.โนนศิลาเลิง อ.ฆ้องชัย จ.กาฬสินธุ์ ,06:00 ,0.8
สถานีอบต.นายม,ต.นายม อ.เมืองอำนาจเจริญ จ.อำนาจเจริญ ,06:00 ,0.8
สถานีเทศบาลเมืองเกาะสมุย,ต.อ่างทอง อ.เกาะสมุย จ.สุราษฎร์ธานี ,06:00 ,0.8
สถานีอ่างเก็บน้ำห้วยยาง,ต.ป่าแลวหลวง อ.สันติสุข จ.น่าน ,05:00 ,0.8
สถานีหน่วยพิทักษ์อุทยานแห่งชาติที่ มร. ๑ (ห้วยเต่า),ต.น้ำพาง อ.แม่จริม จ.น่าน ,06:00 ,0.8
สถานีทต.ปราณบุรี,ต.หนองตาแต้ม อ.ปราณบุรี จ.ประจวบคีรีขันธ์ ,06:00 ,0.8
สถานีสะพานกรุงเทพ,ต.ดาวคะนอง อ.ธนบุรี จ.กรุงเทพมหานคร ,06:00 ,0.8
สถานีเมืองตรัง,ต.บางรัก อ.เมืองตรัง จ.ตรัง ,06:00 ,0.8
สถานีอบต.อ่าวตง,ต.อ่าวตง อ.วังวิเศษ จ.ตรัง ,06:00 ,0.8
สถานีรพสต.บ้านเขาปู่,ต.เขาปู่ อ.ศรีบรรพต จ.พัทลุง ,06:00 ,0.8
สถานีหน่วยพิทักษ์อุทยานแห่งชาติที ขป.๘ (น้ำตกหนานปลิว),ต.ลานข่อย อ.ป่าพะยอม จ.พัทลุง ,06:00 ,0.8
สถานีหน่วยพิทักษ์ป่าเขาช่องลม,ต.เขาคันทรง อ.ศรีราชา จ.ชลบุรี ,06:00 ,0.8
สถานีทต.ห้องแซง,ต.ห้องแซง อ.เลิงนกทา จ.ยโสธร ,06:00 ,0.8
สถานีสะพานข้ามคลองห้วยกรวด,ต.เกาะขันธ์ อ.ชะอวด จ.นครศรีธรรมราช ,06:00 ,0.8
สถานีหน่วยอนุรักษ์และจัดการต้นน้ำลำพระเพลิง,ต.โป่งตาลอง อ.ปากช่อง จ.นครราชสีมา ,06:00 ,0.8
สถานีนบพิตำ,ต.สระแก้ว อ.ท่าศาลา จ.นครศรีธรรมราช ,06:00 ,0.8
สถานีไทรโยค,ต.ลุ่มสุ่ม อ.ไทรโยค จ.กาญจนบุรี ,06:00 ,0.8
สถานีที่ทำการเขตรักษาพันธุ์สัตว์ป่าดอยหลวง,ต.ห้วยหม้าย อ.สอง จ.แพร่ ,06:00 ,0.8
สถานีลำน้ำอูน,ต.สว่าง อ.พรรณานิคม จ.สกลนคร ,06:00 ,0.8
สถานีแม่สอด,ต.แม่ตาว อ.แม่สอด จ.ตาก ,04:00 ,0.7
สถานีทุ่งช้าง,ต.และ อ.ทุ่งช้าง จ.น่าน ,04:00 ,0.7
สถานีลพบุรี,ต.ทะเลชุบศร อ.เมืองลพบุรี จ.ลพบุรี ,04:00 ,0.7
สถานีสะพานข้ามคลองวังเคียน,ต.วังอ่าง อ.ชะอวด จ.นครศรีธรรมราช ,06:00 ,0.6
สถานีท่าตูม,ต.ทุ่งกุลา อ.ท่าตูม จ.สุรินทร์ ,06:00 ,0.6
สถานีสุรินทร์ สกษ.,ต.คอโค อ.เมืองสุรินทร์ จ.สุรินทร์ ,04:00 ,0.6
สถานีคลองหอยโข่ง,ต.ทุ่งลาน อ.คลองหอยโข่ง จ.สงขลา ,06:00 ,0.6
สถานีวัดเนินสวรรค์มงคลธรรม,ต.หนองตาแต้ม อ.ปราณบุรี จ.ประจวบคีรีขันธ์ ,06:00 ,0.6
สถานีปราณบุรี,ต.วังก์พง อ.ปราณบุรี จ.ประจวบคีรีขันธ์ ,06:00 ,0.6
สถานีอบต.ห้วยสัตว์ใหญ่,ต.ห้วยสัตว์ใหญ่ อ.หัวหิน จ.ประจวบคีรีขันธ์ ,06:00 ,0.6
สถานีคลองท่าดี,ต.กำแพงเซา อ.เมืองนครศรีธรรมราช จ.นครศรีธรรมราช ,06:00 ,0.6
สถานีอบต.นากะซะ,ต.นากะชะ อ.ฉวาง จ.นครศรีธรรมราช ,06:00 ,0.6
สถานีวังสะพุง,ต.วังสะพุง อ.วังสะพุง จ.เลย ,06:00 ,0.6
สถานีร้อยเอ็ด,ต.หนองไผ่ อ.ธวัชบุรี จ.ร้อยเอ็ด ,04:00 ,0.6
สถานีอบต.เทพราช,ต.เทพราช อ.สิชล จ.นครศรีธรรมราช ,06:00 ,0.6
สถานีทต.บัวสว่าง,ต.สว่าง อ.พรรณานิคม จ.สกลนคร ,06:00 ,0.6
สถานีเมืองพังงา,ต.ถ้ำน้ำผุด อ.เมืองพังงา จ.พังงา ,06:00 ,0.6
สถานีบ้านทับคริสต์,ต.คลองชะอุ่น อ.พนม จ.สุราษฎร์ธานี ,06:00 ,0.6
สถานีสะพานห้วยน้ำใส,ต.เกาะขันธ์ อ.ชะอวด จ.นครศรีธรรมราช ,06:00 ,0.6
สถานีเมืองกำแพงเพชร (P7A),ต.นครชุม อ.เมืองกำแพงเพชร จ.กำแพงเพชร ,06:00 ,0.6
สถานีสะพานข้ามคลองหวาด,ต.คลองสระ อ.กาญจนดิษฐ์ จ.สุราษฎร์ธานี ,06:00 ,0.6
สถานีสะพานบ้านสวนปราง,ต.คลองสระ อ.กาญจนดิษฐ์ จ.สุราษฎร์ธานี ,06:00 ,0.6
สถานีนครหลวง,ต.บ่อโพง อ.นครหลวง จ.พระนครศรีอยุธยา ,06:00 ,0.6
สถานีตาพระยา,ต.ทัพเสด็จ อ.ตาพระยา จ.สระแก้ว ,06:00 ,0.6
สถานีองครักษ์,ต.องครักษ์ อ.องครักษ์ จ.นครนายก ,06:00 ,0.6
สถานีอบจ.เพชรบูรณ์,ต.ในเมือง อ.เมืองเพชรบูรณ์ จ.เพชรบูรณ์ ,06:00 ,0.6
สถานีพระนครศรีอยุธยา,ต.ภูเขาทอง อ.พระนครศรีอยุธยา จ.พระนครศรีอยุธยา ,06:00 ,0.6
สถานีอบต.หนองแหน,ต.หนองแหน อ.พนมสารคาม จ.ฉะเชิงเทรา ,06:00 ,0.6
สถานีตลาดน้ำบางน้ำผึ้ง,ต.บางน้ำผึ้ง อ.พระประแดง จ.สมุทรปราการ ,06:00 ,0.6
สถานีแม่อาย,ต.ท่าตอน อ.แม่อาย จ.เชียงใหม่ ,06:00 ,0.6
สถานีทต.แม่นะ,ต.แม่นะ อ.เชียงดาว จ.เชียงใหม่ ,06:00 ,0.6
สถานีเหนือปตร.ช่องแค,ต.พรหมนิมิต อ.ตาคลี จ.นครสวรรค์ ,06:00 ,0.6
สถานีปตร.หันตรา,ต.บ้านเกาะ อ.พระนครศรีอยุธยา จ.พระนครศรีอยุธยา ,06:00 ,0.6
สถานีคลองปาว,ต.เหล่าอ้อย อ.ร่องคำ จ.กาฬสินธุ์ ,06:00 ,0.6
สถานีสนามทับทุ่ม บ้านวังนาใน หมู่ที่ 10,ต.น้ำผุด อ.ละงู จ.สตูล ,06:00 ,0.6
สถานีรพสต.บ้านลำกะ,ต.ชุมพล อ.ศรีนครินทร์ จ.พัทลุง ,06:00 ,0.6
สถานีอบต.เทอดไทย,ต.เทอดไทย อ.แม่ฟ้าหลวง จ.เชียงราย ,06:00 ,0.6
สถานีหน่วยพิทักษ์อุทยานแห่งชาติแก่งกระจาน 10,ต.ห้วยแม่เพรียง อ.แก่งกระจาน จ.เพชรบุรี ,05:00 ,0.6
สถานีอบต.ศีรษะจรเข้น้อย,ต.ศีรษะจรเข้น้อย อ.บางเสาธง จ.สมุทรปราการ ,06:00 ,0.6
สถานีปากรอ,ต.ปากรอ อ.สิงหนคร จ.สงขลา ,06:00 ,0.6
สถานีคลองนางน้อย,ต.นาโยงใต้ อ.เมืองตรัง จ.ตรัง ,06:00 ,0.6
สถานีมะนัง,ต.นิคมพัฒนา อ.มะนัง จ.สตูล ,06:00 ,0.6
สถานีควนกาหลง,ต.อุใดเจริญ อ.ควนกาหลง จ.สตูล ,06:00 ,0.6
สถานีฉวาง,ต.ไม้เรียง อ.ฉวาง จ.นครศรีธรรมราช ,04:00 ,0.6
สถานีฉะเชิงเทรา,ต.แปลงยาว อ.สนามชัยเขต จ.ฉะเชิงเทรา ,04:00 ,0.6
สถานีสนามบินดอนเมือง,ต.สีกัน อ.ดอนเมือง จ.กรุงเทพมหานคร ,04:00 ,0.6
สถานีบ้านดอน,ต.ปอ อ.เวียงแก่น จ.เชียงราย ,06:00 ,0.5
สถานีปตร.คลองสองสายใต้,ต.สายไหม อ.สายไหม จ.กรุงเทพมหานคร ,06:00 ,0.5
สถานีส.คลองสี่บาท,ต.แสมดำ อ.บางขุนเทียน จ.กรุงเทพมหานคร ,06:00 ,0.5
สถานีบ้านห้วยตม,ต.บ้านตึก อ.ศรีสัชนาลัย จ.สุโขทัย ,06:00 ,0.5
สถานีบ้านแม่ทุเลาใน,ต.กลางดง อ.ทุ่งเสลี่ยม จ.สุโขทัย ,06:00 ,0.5
สถานีบ้านน้ำกุ่ม,ต.น้ำกุ่ม อ.นครไทย จ.พิษณุโลก ,06:00 ,0.5
สถานีบ้านโป่งสอ,ต.น้ำกุ่ม อ.นครไทย จ.พิษณุโลก ,06:00 ,0.5
สถานีสุราษฎร์ธานี,ต.หัวเตย อ.พุนพิน จ.สุราษฎร์ธานี ,04:00 ,0.5
สถานีบ้านหุบเฉลา ,ต.เขากระปุก อ.ท่ายาง จ.เพชรบุรี ,05:00 ,0.5
สถานีจุดวัด ค.ทวีฯ-ค.ภาษีฯ,ต.หนองแขม อ.หนองแขม จ.กรุงเทพมหานคร ,06:00 ,0.5
สถานีส.คลองดาวคะนอง,ต.บางปะกอก อ.ราษฎร์บูรณะ จ.กรุงเทพมหานคร ,06:00 ,0.5
สถานีบ้านเขาจันทร์,ต.หนองธง อ.ป่าบอน จ.พัทลุง ,06:00 ,0.5
สถานีบ้านเกาะแก้ว,ต.เขาตอก อ.เคียนซา จ.สุราษฎร์ธานี ,05:00 ,0.5
สถานีบ้านจันตาแป๊ะ,ต.จันทเขลม อ.เขาคิชฌกูฏ จ.จันทบุรี ,06:00 ,0.5
สถานีบ้านโป่งเกตุ,ต.ขุนซ่อง อ.แก่งหางแมว จ.จันทบุรี ,06:00 ,0.5
สถานีบ้านหนองน้ำดำ,ต.ห้วยแม่เพรียง อ.แก่งกระจาน จ.เพชรบุรี ,05:00 ,0.5
สถานีบ้านพุไทร,ต.ห้วยแม่เพรียง อ.แก่งกระจาน จ.เพชรบุรี ,05:00 ,0.5
สถานีบ้านห้วยหินลับ,ต.ทุ่งใส อ.สิชล จ.นครศรีธรรมราช ,06:00 ,0.5
สถานีส.คลองบางจาก,ต.บางจาก อ.พระโขนง จ.กรุงเทพมหานคร ,06:00 ,0.5
สถานีจุดวัด ค.สนามชัย-ค.บางขุนเทียน,ต.บางขุนเทียน อ.จอมทอง จ.กรุงเทพมหานคร ,06:00 ,0.5
สถานีบ้านห้วยผาก,ต.สวนผึ้ง อ.สวนผึ้ง จ.ราชบุรี ,06:00 ,0.5
สถานีบ้านห้วยรางโพธิ์,ต.ยางน้ำกลัดใต้ อ.หนองหญ้าปล้อง จ.เพชรบุรี ,05:00 ,0.5
สถานีระยอง,ต.ตะพง อ.เมืองระยอง จ.ระยอง ,04:00 ,0.5
สถานีบ้านตะโกล่าง,ต.สวนผึ้ง อ.สวนผึ้ง จ.ราชบุรี ,06:00 ,0.5
สถานีบ้านห้วยทรายทอง,ต.ทุ่งใส อ.สิชล จ.นครศรีธรรมราช ,06:00 ,0.5
สถานีส.คลองเจ็ก,ต.บางจาก อ.พระโขนง จ.กรุงเทพมหานคร ,06:00 ,0.5
สถานีส.คลองสำเหร่,ต.สำเหร่ อ.ธนบุรี จ.กรุงเทพมหานคร ,06:00 ,0.5
สถานีจุดวัด ค.ภาษีฯ-ราชมนตรี,ต.บางแค อ.บางแค จ.กรุงเทพมหานคร ,06:00 ,0.5
สถานีบ้านวังน้ำเขียว,ต.ร่อนทอง อ.บางสะพาน จ.ประจวบคีรีขันธ์ ,05:00 ,0.5
สถานีบ้านพุน้ำร้อน,ต.บ้านเก่า อ.เมืองกาญจนบุรี จ.กาญจนบุรี ,06:00 ,0.5
สถานีบ้านคลองลอย,ต.ร่อนทอง อ.บางสะพาน จ.ประจวบคีรีขันธ์ ,05:00 ,0.5
สถานีบ้านน้ำฉา,ต.เทพราช อ.สิชล จ.นครศรีธรรมราช ,06:00 ,0.5
สถานีส.คลองภาษีเจริญ,ต.ปากคลองภาษีเจริญ อ.ภาษีเจริญ จ.กรุงเทพมหานคร ,06:00 ,0.5
สถานีส.คลองบางกอกใหญ่,ต.วัดอรุณ อ.บางกอกใหญ่ จ.กรุงเทพมหานคร ,06:00 ,0.5
สถานีบ้านเครือหวาย,ต.โป่งน้ำร้อน อ.โป่งน้ำร้อน จ.จันทบุรี ,05:00 ,0.5
สถานีบ้านทุ่งยูง,ต.เขาปู่ อ.ศรีบรรพต จ.พัทลุง ,06:00 ,0.5
สถานีบ้านคลองป่าหวาย,ต.หนองไร่ อ.ปลวกแดง จ.ระยอง ,06:00 ,0.5
สถานีบ้านมะขาม ,ต.ท่าอุแท อ.กาญจนดิษฐ์ จ.สุราษฎร์ธานี ,05:00 ,0.5
