สถานีเหนือฝายร้อยเอ็ด,ต.พระธาตุ อ.เชียงขวัญ จ.ร้อยเอ็ด ,06:00 ,1
สถานีบ้านห้วยไฟ,ต.แม่ขะนิง อ.เวียงสา จ.น่าน ,06:00 ,1
สถานีสถานีควบคุมไฟป่าภูสิงห์ภูผาผึ้ง-ภูสระดอกบัว,ต.หนองมะแซว อ.เมืองอำนาจเจริญ จ.อำนาจเจริญ ,06:00 ,1
สถานีบ้านนาตอน,ต.บ่อภาค อ.ชาติตระการ จ.พิษณุโลก ,06:00 ,1
สถานีบ้านซับชมพู่,ต.สระแก้ว อ.บึงสามพัน จ.เพชรบูรณ์ ,06:00 ,1
สถานีบ้านห้วยหาน,ต.ปอ อ.เวียงแก่น จ.เชียงราย ,06:00 ,1
สถานีบ้านซับฟาน,ต.ยางงาม อ.หนองไผ่ จ.เพชรบูรณ์ ,06:00 ,1
สถานีบ้านห้วยพลู,ต.ด่านแม่ละเมา อ.แม่สอด จ.ตาก ,06:00 ,1
สถานีหน่วยพิทักษ์ป่าคลองหยา,ต.เขาพัง อ.บ้านตาขุน จ.สุราษฎร์ธานี ,05:00 ,1
สถานีบ้านจำวาย,ต.ไผ่โทน อ.ร้องกวาง จ.แพร่ ,05:00 ,1
สถานีบ้านเกวต,ต.พญาแก้ว อ.เชียงกลาง จ.น่าน ,06:00 ,1
สถานีทต.โคกตูม,ต.โคกตูม อ.เมืองลพบุรี จ.ลพบุรี ,06:00 ,1
สถานีหมู่บ้านเศรษฐกิจ ซอย 26,ต.บางแคเหนือ อ.บางแค จ.กรุงเทพมหานคร ,06:00 ,1
สถานีบ้านวังหิน,ต.บุพราหมณ์ อ.นาดี จ.ปราจีนบุรี ,06:00 ,1
สถานีรร.บ้านวาน้อย,ต.วาใหญ่ อ.อากาศอำนวย จ.สกลนคร ,06:00 ,1
สถานีคลองหอยโข่ง,ต.ทุ่งลาน อ.คลองหอยโข่ง จ.สงขลา ,06:00 ,1
สถานีบ้านนาไหม้,ต.เมืองมาย อ.แจ้ห่ม จ.ลำปาง ,06:00 ,1
สถานีบ้านดอกแดง,ต.บางไทร อ.ตะกั่วป่า จ.พังงา ,06:00 ,1
สถานีบ้านหนองผือ,ต.ด่านช้าง อ.ด่านช้าง จ.สุพรรณบุรี ,05:00 ,1
สถานีบ้านพรุเตย,ต.เพหลา อ.คลองท่อม จ.กระบี่ ,05:00 ,1
สถานีสะพานบ้าน กม.29 อ.เบตง จ.ยะลา,ต.อัยเยอร์เวง อ.เบตง จ.ยะลา ,05:00 ,1
สถานีบ้านหลวง,ต.ยางเปียง อ.อมก๋อย จ.เชียงใหม่ ,06:00 ,1
สถานีวัดท่าข้าม,ต.ท่าข้าม อ.พุนพิน จ.สุราษฎร์ธานี ,05:00 ,1
สถานีบ้านพร้าว,ต.บ้านพร้าว อ.นครไทย จ.พิษณุโลก ,05:00 ,1
สถานีบ้านน้ำโจน,ต.คันโช้ง อ.วัดโบสถ์ จ.พิษณุโลก ,06:00 ,1
สถานีบ้านบูโล๊ะสะนีแย,ต.บ้านแหร อ.ธารโต จ.ยะลา ,05:00 ,1
สถานีบ้านฝางแล้ง,ต.ขุนฝาง อ.เมืองอุตรดิตถ์ จ.อุตรดิตถ์ ,06:00 ,1
สถานีบ้านยางครก,ต.ยางเปียง อ.อมก๋อย จ.เชียงใหม่ ,06:00 ,1
สถานีบ้านไร่พัฒนา,ต.วะตะแบก อ.เทพสถิต จ.ชัยภูมิ ,06:00 ,1
สถานีบ้านน้ำรีพัฒนา,ต.ขุนน่าน อ.เฉลิมพระเกียรติ จ.น่าน ,05:00 ,1
สถานีสะพานท่าผาก,ต.บางเดือน อ.พุนพิน จ.สุราษฎร์ธานี ,05:00 ,1
สถานีหมู่บ้านปิยะมิตร 3,ต.อัยเยอร์เวง อ.เบตง จ.ยะลา ,06:00 ,1
สถานีบ้านห้วยห้า,ต.แม่สอย อ.จอมทอง จ.เชียงใหม่ ,06:00 ,1
สถานีบ้านหลักเขต,ต.หนองสาหร่าย อ.ปากช่อง จ.นครราชสีมา ,06:00 ,1
สถานีทะเลหมอก อัยเยอร์เวง,ต.อัยเยอร์เวง อ.เบตง จ.ยะลา ,06:00 ,1
สถานีบ้านกอไพล,ต.ท่าเคย อ.ท่าฉาง จ.สุราษฎร์ธานี ,05:00 ,1
สถานีบ้านดอนเมา,ต.ตะโก อ.ทุ่งตะโก จ.ชุมพร ,05:00 ,1
สถานีบ้านหลังเขา,ต.หนองกะท้าว อ.นครไทย จ.พิษณุโลก ,05:00 ,1
สถานีสนามกีฬา อบต.ป่าคาหลวง,ต.ป่าคาหลวง อ.บ้านหลวง จ.น่าน ,06:00 ,1
สถานีสะพานหัวสะพาน อ.บันนังสตา จ.ยะลา,ต.บาเจาะ อ.บันนังสตา จ.ยะลา ,05:00 ,1
สถานีอบต.ละหานทราย,ต.ละหานทราย อ.ละหานทราย จ.บุรีรัมย์ ,06:00 ,1
สถานีบ้านตลิ่งชัน,ต.ตลิ่งชัน อ.บ้านด่านลานหอย จ.สุโขทัย ,06:00 ,1
สถานีคลองกลาง,ต.ศาลเจ้าไก่ต่อ อ.ลาดยาว จ.นครสวรรค์ ,06:00 ,1
สถานีเมืองชัยภูมิ,ต.บ้านค่าย อ.เมืองชัยภูมิ จ.ชัยภูมิ ,06:00 ,1
สถานีส.คลองบางจาก,ต.บางแคเหนือ อ.บางแค จ.กรุงเทพมหานคร ,06:00 ,1
สถานีบ้านหนองเต่า,ต.แม่วิน อ.แม่วาง จ.เชียงใหม่ ,06:00 ,1
สถานีบ้านคลองป่าหวาย,ต.หนองไร่ อ.ปลวกแดง จ.ระยอง ,06:00 ,1
สถานีจุดวัด ค.บางบัว,ต.เสนานิคม อ.จตุจักร จ.กรุงเทพมหานคร ,06:00 ,1
สถานีบ้านบึงหล่ม,ต.หนองปลิง อ.เลาขวัญ จ.กาญจนบุรี ,06:00 ,1
สถานีบ้านหน้าเหมือง,ต.ควนทอง อ.ขนอม จ.นครศรีธรรมราช ,06:00 ,1
สถานีอบต.พังทุย,ต.พังทุย อ.น้ำพอง จ.ขอนแก่น ,06:00 ,1
สถานีบ้านละหาด,ต.แม่หวาด อ.ธารโต จ.ยะลา ,05:00 ,1
สถานีบ้านใหม่สามัคคี,ต.ห้วยแย้ อ.หนองบัวระเหว จ.ชัยภูมิ ,06:00 ,1
สถานีบ้านแม่มุ,ต.แม่นาจร อ.แม่แจ่ม จ.เชียงใหม่ ,05:00 ,1
สถานีอุทยานแห่งชาติดอยภูคา,ต.ภูคา อ.ปัว จ.น่าน ,06:00 ,1
สถานีบ้านขุนยวม,ต.ขุนยวม อ.ขุนยวม จ.แม่ฮ่องสอน ,05:00 ,1
สถานีจุดวัด ค.เก้า-วัดศรีสุขฯ,ต.สามวาตะวันออก อ.คลองสามวา จ.กรุงเทพมหานคร ,06:00 ,1
สถานีเชียรใหญ่,ต.การะเกด อ.เชียรใหญ่ จ.นครศรีธรรมราช ,06:00 ,1
สถานีสะพานเมืองปัตตานี อ.เมือง จ.ปัตตานี,ต.จะบังติกอ อ.เมืองปัตตานี จ.ปัตตานี ,05:00 ,1
สถานีบ้านแม่น้ำ,ต.แม่น้ำ อ.เกาะสมุย จ.สุราษฎร์ธานี ,05:00 ,1
สถานีเขตบางซื่อ,ต.บางซื่อ อ.บางซื่อ จ.กรุงเทพมหานคร ,06:00 ,1
สถานีบ้านซับไทรทอง,ต.วังน้ำเขียว อ.วังน้ำเขียว จ.นครราชสีมา ,06:00 ,1
สถานีบ้านวังลุง,ต.ทอนหงส์ อ.พรหมคีรี จ.นครศรีธรรมราช ,05:00 ,1
สถานีชุมชนบ้านเหมือง,ต.อัยเยอร์เวง อ.เบตง จ.ยะลา ,06:00 ,0.8
สถานีเหนือฝายพิมาย,ต.ในเมือง อ.พิมาย จ.นครราชสีมา ,06:00 ,0.8
สถานีที่ทำการอุทยานแห่งชาติถ้ำสะเกิน,ต.ยอด อ.สองแคว จ.น่าน ,06:00 ,0.8
สถานีหน่วยศึกษาการพัฒนาการอนุรักษ์ต้นน้ำแม่สูง,ต.นาพูน อ.วังชิ้น จ.แพร่ ,06:00 ,0.8
สถานีเมืองอุตรดิตถ์,ต.ป่าเซ่า อ.เมืองอุตรดิตถ์ จ.อุตรดิตถ์ ,06:00 ,0.8
สถานีชุมชนบ้านโคกพะยอม,ต.ละงู อ.ละงู จ.สตูล ,06:00 ,0.8
สถานีคลองผันน้ำยม-น่าน3,ต.คอรุม อ.พิชัย จ.อุตรดิตถ์ ,06:00 ,0.8
สถานีท่อทองแดง1,ต.หนองปลิง อ.เมืองกำแพงเพชร จ.กำแพงเพชร ,06:00 ,0.8
สถานีสถานีวิจัยต้นน้ำคีรีวง,ต.กำโลน อ.ลานสกา จ.นครศรีธรรมราช ,06:00 ,0.8
สถานีอบต.สวาท,ต.สวาท อ.เลิงนกทา จ.ยโสธร ,06:00 ,0.8
สถานีท่าตูม,ต.ทุ่งกุลา อ.ท่าตูม จ.สุรินทร์ ,06:00 ,0.8
สถานีบ้านเขว้า,ต.ภูแลนคา อ.บ้านเขว้า จ.ชัยภูมิ ,06:00 ,0.8
สถานีสะพานห้วยหลวง,ต.วัดหลวง อ.โพนพิสัย จ.หนองคาย ,06:00 ,0.8
สถานีอบต.ห้วยคต,ต.ห้วยคต อ.ห้วยคต จ.อุทัยธานี ,06:00 ,0.8
สถานีอ่างเก็บน้ำห้วยยาง,ต.ป่าแลวหลวง อ.สันติสุข จ.น่าน ,05:00 ,0.8
สถานีรร.บ้านปางช้าง,ต.ป่าแลวหลวง อ.สันติสุข จ.น่าน ,06:00 ,0.8
สถานีมะนัง,ต.นิคมพัฒนา อ.มะนัง จ.สตูล ,06:00 ,0.8
สถานีแก่งหางแมว,ต.แก่งหางแมว อ.แก่งหางแมว จ.จันทบุรี ,06:00 ,0.8
สถานีอบต.วังชิ้น,ต.วังชิ้น อ.วังชิ้น จ.แพร่ ,06:00 ,0.8
สถานีที่ว่าการอำเภอทุ่งช้าง,ต.ทุ่งช้าง อ.ทุ่งช้าง จ.น่าน ,06:00 ,0.8
สถานีเมืองพังงา,ต.ถ้ำน้ำผุด อ.เมืองพังงา จ.พังงา ,06:00 ,0.8
สถานีโกสุมพิสัย,ต.หัวขวาง อ.โกสุมพิสัย จ.มหาสารคาม ,06:00 ,0.6
สถานีโครงการพัฒนาพื้นที่ภูผาหัก,ต.ผาสุก อ.วังสามหมอ จ.อุดรธานี ,06:00 ,0.6
สถานีที่ทำการผู้ใหญ่บ้าน หมู่ 13 ต.วังทอง,ต.วังทอง อ.วังทอง จ.พิษณุโลก ,06:00 ,0.6
สถานีอบต.ศรีเทพ,ต.ศรีเทพ อ.ศรีเทพ จ.เพชรบูรณ์ ,06:00 ,0.6
สถานีหน่วยพิทักษ์ป่าเขาช่องลม,ต.เขาคันทรง อ.ศรีราชา จ.ชลบุรี ,06:00 ,0.6
สถานีอบต.โพธิ์ประทับช้าง,ต.โพธิ์ประทับช้าง อ.โพธิ์ประทับช้าง จ.พิจิตร ,06:00 ,0.6
สถานีอบต.คลองศก,ต.คลองศก อ.พนม จ.สุราษฎร์ธานี ,06:00 ,0.6
สถานีอบต.คลองพา,ต.คลองพา อ.ท่าชนะ จ.สุราษฎร์ธานี ,06:00 ,0.6
สถานีอบต.คลองขนาน,ต.คลองขนาน อ.เหนือคลอง จ.กระบี่ ,06:00 ,0.6
สถานีทต.นาส่วง,ต.นาส่วง อ.เดชอุดม จ.อุบลราชธานี ,06:00 ,0.6
สถานีวัดบ้านดงผาปูน,ต.บ่อเกลือใต้ อ.บ่อเกลือ จ.น่าน ,06:00 ,0.6
สถานีคลองพระปรง,ต.ศาลาลำดวน อ.เมืองสระแก้ว จ.สระแก้ว ,06:00 ,0.6
สถานีสะพานห้วยมุก,ต.มุกดาหาร อ.เมืองมุกดาหาร จ.มุกดาหาร ,06:00 ,0.6
สถานีสถานีศึกษาภูมิอากาศป่าไม้ลุ่มน้ำยม,ต.ในเวียง อ.เมืองแพร่ จ.แพร่ ,06:00 ,0.6
สถานีหน่วยจัดการต้นน้ำขุนแม่แจ่ม,ต.แม่แดด อ.กัลยาณิวัฒนา จ.เชียงใหม่ ,06:00 ,0.6
สถานีหน่วยจัดการต้นน้ำแม่พริก (หน่วยย่อย ปางหลวง),ต.ท่าก๊อ อ.แม่สรวย จ.เชียงราย ,06:00 ,0.6
สถานีพัทลุง สกษ.,ต.ลำปำ อ.เมืองพัทลุง จ.พัทลุง ,04:00 ,0.6
สถานีตะกั่วป่า,ต.คึกคัก อ.ตะกั่วป่า จ.พังงา ,04:00 ,0.6
สถานีหน่วยพิทักษ์ป่าน้ำสาว,ต.ขุนควร อ.ปง จ.พะเยา ,06:00 ,0.6
สถานีบ้านจันทรัตน์,ต.ยะรม อ.เบตง จ.ยะลา ,05:00 ,0.5
สถานีบ้านชัยมงคล,ต.สมอโคน อ.บ้านตาก จ.ตาก ,06:00 ,0.5
สถานีส.เทเวศร์,ต.วัดสามพระยา อ.พระนคร จ.กรุงเทพมหานคร ,06:00 ,0.5
สถานีบ้านหนองสองห้อง,ต.ห้วยแห้ง อ.แก่งคอย จ.สระบุรี ,06:00 ,0.5
สถานีบ้านไร่,ต.ห้วยเขย่ง อ.ทองผาภูมิ จ.กาญจนบุรี ,05:00 ,0.5
สถานีบ้านหนองแวง,ต.ไทรเดี่ยว อ.คลองหาด จ.สระแก้ว ,06:00 ,0.5
สถานีบ้านม่วงคำ,ต.นางแล อ.เมืองเชียงราย จ.เชียงราย ,06:00 ,0.5
สถานีบ้านท่าหินโงม,ต.ท่าหินโงม อ.เมืองชัยภูมิ จ.ชัยภูมิ ,05:00 ,0.5
สถานีบ้านควนดินดำ,ต.หนองธง อ.ป่าบอน จ.พัทลุง ,05:00 ,0.5
สถานีบ้านปากรอง*,ต.ชาติตระการ อ.ชาติตระการ จ.พิษณุโลก ,05:00 ,0.5
สถานีบ้านแม่หาร,ต.บ้านกาศ อ.แม่สะเรียง จ.แม่ฮ่องสอน ,06:00 ,0.5
สถานีบ้านปางยาง,ต.ศิลาเพชร อ.ปัว จ.น่าน ,06:00 ,0.5
สถานีบ้านหนองป่าแขม,ต.แม่คง อ.แม่สะเรียง จ.แม่ฮ่องสอน ,06:00 ,0.5
สถานีบ้านปางยาง,ต.บ้านปง อ.หางดง จ.เชียงใหม่ ,06:00 ,0.5
สถานีบ้านท่าปู,ต.แม่นาวาง อ.แม่อาย จ.เชียงใหม่ ,06:00 ,0.5
สถานีบ้านนาคำ (หมู่ 6),ต.บ้านก้อง อ.นายูง จ.อุดรธานี ,06:00 ,0.5
สถานีบ้านเหวปลากั้ง,ต.หมูสี อ.ปากช่อง จ.นครราชสีมา ,05:00 ,0.5
สถานีบ้านฮากไม้เหนือ,ต.ป่าแป๋ อ.แม่สะเรียง จ.แม่ฮ่องสอน ,05:00 ,0.5
สถานีบ้านแม่แลบ,ต.แม่ลาน้อย อ.แม่ลาน้อย จ.แม่ฮ่องสอน ,06:00 ,0.5
สถานีบ้านสงเปือย,ต.ธาตุ อ.เชียงคาน จ.เลย ,06:00 ,0.5
สถานีส.พระราม 4,ต.คลองเตย อ.คลองเตย จ.กรุงเทพมหานคร ,06:00 ,0.5
สถานีบ้านปู,ต.ลี้ อ.ลี้ จ.ลำพูน ,06:00 ,0.5
สถานีบ้านท้องฟ้า,ต.ท้องฟ้า อ.บ้านตาก จ.ตาก ,06:00 ,0.5
สถานีบ้านม้งเก้าหลัง,ต.เทอดไทย อ.แม่ฟ้าหลวง จ.เชียงราย ,06:00 ,0.5
สถานีเขตบางเขน,ต.อนุสาวรีย์ อ.บางเขน จ.กรุงเทพมหานคร ,06:00 ,0.5
สถานีบ้านดงโคร่ง,ต.หินดาด อ.ทองผาภูมิ จ.กาญจนบุรี ,06:00 ,0.5
สถานีบ้านใหม่ไทยถาวร,ต.ทัพราช อ.ตาพระยา จ.สระแก้ว ,05:00 ,0.5
สถานีบ้านห้วยน้ำใส,ต.สบเมย อ.สบเมย จ.แม่ฮ่องสอน ,05:00 ,0.5
สถานีบ้านหินกอง,ต.ทุ่งเบญจา อ.ท่าใหม่ จ.จันทบุรี ,06:00 ,0.5
สถานีบ้านคลองทราย,ต.วังน้ำเขียว อ.วังน้ำเขียว จ.นครราชสีมา ,06:00 ,0.5
สถานีบ้านซำบุ่น,ต.ศิลา อ.หล่มเก่า จ.เพชรบูรณ์ ,06:00 ,0.5
สถานีบ้านวังขอน,ต.ระเริง อ.วังน้ำเขียว จ.นครราชสีมา ,06:00 ,0.5
สถานีบ้านเชี่ยวขวัญ,ต.ตะกุกเหนือ อ.วิภาวดี จ.สุราษฎร์ธานี ,05:00 ,0.5
สถานีบ้านสลาแด,ต.ห้วยกระทิง อ.กรงปินัง จ.ยะลา ,05:00 ,0.5
สถานีบ้านกอบแก้ววัฒนาภิบาล,ต.ลำพูน อ.บ้านนาสาร จ.สุราษฎร์ธานี ,05:00 ,0.5
สถานีบ้านคอกช้าง,ต.ปากแพรก อ.ดอนสัก จ.สุราษฎร์ธานี ,05:00 ,0.5
สถานีบ้านปางกลาง,ต.แม่พริก อ.แม่สรวย จ.เชียงราย ,06:00 ,0.5
สถานีบ้านน้ำตอน,ต.นาบัว อ.นครไทย จ.พิษณุโลก ,06:00 ,0.5
สถานีบ้านอูแบ,ต.ยะต๊ะ อ.รามัน จ.ยะลา ,05:00 ,0.5
สถานีบ้านแม่ทุเลาใน,ต.กลางดง อ.ทุ่งเสลี่ยม จ.สุโขทัย ,06:00 ,0.5
สถานีบ้านเจ็ดลูกเนิน,ต.ชากบก อ.บ้านค่าย จ.ระยอง ,06:00 ,0.5
สถานีปตร.คลองทวีวัฒนา,ต.ศาลายา อ.พุทธมณฑล จ.นครปฐม ,06:00 ,0.5
สถานีบ้านหญ้าปล้อง,ต.คลองศก อ.พนม จ.สุราษฎร์ธานี ,06:00 ,0.5
สถานีบ้านสันต้นม่วง,ต.ม่อนจอง อ.อมก๋อย จ.เชียงใหม่ ,06:00 ,0.5
สถานีบ้านโป่งก้อนเส้า,ต.ท่ามะปราง อ.แก่งคอย จ.สระบุรี ,06:00 ,0.5
สถานีบ้านซับกระสังข์,ต.ดอนเมือง อ.สีคิ้ว จ.นครราชสีมา ,05:00 ,0.5
สถานีส.คลองภาษีเจริญ,ต.ปากคลองภาษีเจริญ อ.ภาษีเจริญ จ.กรุงเทพมหานคร ,06:00 ,0.5
สถานีบ้านแก่งหิน*,ต.วังประจบ อ.เมืองตาก จ.ตาก ,05:00 ,0.5
สถานีบ้านห้วยท่าง,ต.ไชยวัฒนา อ.ปัว จ.น่าน ,06:00 ,0.5
สถานีบ้านร่องกล้า,ต.เนินเพิ่ม อ.นครไทย จ.พิษณุโลก ,05:00 ,0.5
สถานีบ้านปากแพรก,ต.ละอุ่นเหนือ อ.ละอุ่น จ.ระนอง ,05:00 ,0.5
สถานีบ้านแม่ฮู้,ต.แม่สิน อ.ศรีสัชนาลัย จ.สุโขทัย ,06:00 ,0.5
สถานีบ้านเงาะกาโป,ต.บันนังสตา อ.บันนังสตา จ.ยะลา ,05:00 ,0.5
สถานีบ้านซับสมบูรณ์,ต.วังข่อย อ.ไพศาลี จ.นครสวรรค์ ,05:00 ,0.5
สถานีบ้านคลองทรายขาว,ต.คลองยา อ.อ่าวลึก จ.กระบี่ ,05:00 ,0.5
สถานีบ้านกอตง,ต.เขาดิน อ.เขาพนม จ.กระบี่ ,05:00 ,0.5
สถานีบ้านหลวง,ต.แม่เงา อ.ขุนยวม จ.แม่ฮ่องสอน ,05:00 ,0.5
สถานีบ้านปางน้ำฮ้าย,ต.ท่าก๊อ อ.แม่สรวย จ.เชียงราย ,22:00 ,0.5
สถานีบ้านทุ่งจ้อ,ต.ป่าแป๋ อ.แม่แตง จ.เชียงใหม่ ,05:00 ,0.5
สถานีบ้านกิ่วเคียน,ต.จริม อ.ท่าปลา จ.อุตรดิตถ์ ,06:00 ,0.5
สถานีบ้านหนองทุ่ม,ต.นาดี อ.ด่านซ้าย จ.เลย ,06:00 ,0.5
สถานีบ้านเขาเหล็ก,ต.นบพิตำ อ.นบพิตำ จ.นครศรีธรรมราช ,06:00 ,0.5
สถานีบ้านนากึ๋น,ต.บ่อเกลือเหนือ อ.บ่อเกลือ จ.น่าน ,06:00 ,0.5
สถานีบ้านไร่รวงทอง,ต.ปัว อ.ปัว จ.น่าน ,06:00 ,0.5
สถานีบ้านย่านตะเคียน*,ต.ไทรโสภา อ.พระแสง จ.สุราษฎร์ธานี ,05:00 ,0.5
สถานีบ้านซำทองพัฒนา,ต.บ้านกลาง อ.วังทอง จ.พิษณุโลก ,06:00 ,0.5
สถานีบ้านเขาพลู,ต.บางสัก อ.กันตัง จ.ตรัง ,05:00 ,0.5
สถานีบ้านพระเลียบ*,ต.ไทยบุรี อ.ท่าศาลา จ.นครศรีธรรมราช ,05:00 ,0.5
สถานีจุดวัด ค.ทวีฯ-ค.บางเชือกหนัง,ต.บางไผ่ อ.บางแค จ.กรุงเทพมหานคร ,06:00 ,0.5
