บ้านแผ่นดินทอง,ต.ตับเต่า อ.เทิง จ.เชียงราย,05:00 น.,3
บ้านขุนฝาง,ต.ขุนฝาง อ.เมืองอุตรดิตถ์ จ.อุตรดิตถ์,05:00 น.,3
บ้านห้วยทรายทอง,ต.ทุ่งใส อ.สิชล จ.นครศรีธรรมราช,05:00 น.,3
บ้านดงสามหมื่น,ต.บ้านจันทร์ อ.กัลยาณิวัฒนา จ.เชียงใหม่,05:00 น.,3
บ้านโคกสว่าง,ต.ศรีสองรัก อ.เมืองเลย จ.เลย,05:00 น.,3
บ้านสบงาย,ต.เมืองงาย อ.เชียงดาว จ.เชียงใหม่,05:00 น.,3
คลองสำโรง บางเสาธง,ต.บางเสาธง อ.บางเสาธง จ.สมุทรปราการ,06:00 น.,3
รร.บ้านลำปลอกเหนือ,ต.ในควน อ.ย่านตาขาว จ.ตรัง,06:00 น.,3
บ้านภูคำ,ต.งอบ อ.ทุ่งช้าง จ.น่าน,05:00 น.,3
บ้านป่าเวียง,ต.ทุ่งกว๋าว อ.เมืองปาน จ.ลำปาง,05:00 น.,3
บ้านบางแป้น2,ต.วังมะปราง อ.วังวิเศษ จ.ตรัง,05:00 น.,3
บ้านอุ้มเปี้ยม,ต.คีรีราษฎร์ อ.พบพระ จ.ตาก,05:00 น.,3
บ้านอ่าวกลาง,ต.วังมะปรางเหนือ อ.วังวิเศษ จ.ตรัง,05:00 น.,3
เขตบางแค,ต.บางแค อ.บางแค จ.กรุงเทพมหานคร,06:00 น.,3
บ้านปางกลาง,ต.วาวี อ.แม่สรวย จ.เชียงราย,05:00 น.,3
เขตทวีวัฒนา,ต.ทวีวัฒนา อ.ทวีวัฒนา จ.กรุงเทพมหานคร,06:00 น.,3
บ้านนอก,ต.กงหรา อ.กงหรา จ.พัทลุง,05:00 น.,3
บ้านคลองสะท้อน,ต.วังหมี อ.วังน้ำเขียว จ.นครราชสีมา,05:00 น.,3
บ้านขะเนจื้อ,ต.ขะเนจื้อ อ.แม่ระมาด จ.ตาก,05:00 น.,3
บ้านไหล่ท่า,ต.แม่ระมาด อ.แม่ระมาด จ.ตาก,05:00 น.,3
ทต.โพทะเล,ต.โพทะเล อ.โพทะเล จ.พิจิตร,06:00 น.,3
บ้านหนองนกปีกกา,ต.โป่งแดง อ.เมืองตาก จ.ตาก,05:00 น.,3
อบต.ระเว,ต.ระเว อ.พิบูลมังสาหาร จ.อุบลราชธานี,06:00 น.,3
บ้านขุนต้า,ต.ตับเต่า อ.เทิง จ.เชียงราย,05:00 น.,3
บ้านโป่งไฮ,ต.แม่สลองใน อ.แม่ฟ้าหลวง จ.เชียงราย,05:00 น.,3
คลองมหาสวัสดิ บางกรวย-สวนผัก,ต.ตลิ่งชัน อ.ตลิ่งชัน จ.กรุงเทพมหานคร,06:00 น.,3
บ้านวังขอน,ต.ระเริง อ.วังน้ำเขียว จ.นครราชสีมา,05:00 น.,3
เขตประเวศ,ต.ประเวศ อ.ประเวศ จ.กรุงเทพมหานคร,06:00 น.,3
ป่าสักงาม,ต.ลวงเหนือ อ.ดอยสะเก็ด จ.เชียงใหม่,06:00 น.,3
บ้านชานเมือง,ต.ปางหมู อ.เมืองแม่ฮ่องสอน จ.แม่ฮ่องสอน,05:00 น.,3
เชียงดาว,ต.เชียงดาว อ.เชียงดาว จ.เชียงใหม่,06:00 น.,3
เขตคลองสามวา,ต.บางขัน อ.คลองสามวา จ.กรุงเทพมหานคร,06:00 น.,3
เขตดอนเมือง,ต.สีกัน อ.ดอนเมือง จ.กรุงเทพมหานคร,06:00 น.,3
เขตหลักสี่,ต.ทุ่งสองห้อง อ.หลักสี่ จ.กรุงเทพมหานคร,06:00 น.,3
บ้านคลองทราย,ต.วังน้ำเขียว อ.วังน้ำเขียว จ.นครราชสีมา,05:00 น.,3
บ้านดงลาน,ต.วังจันทร์ อ.สามเงา จ.ตาก,05:00 น.,3
ท่าน้ำสวัสดี,ต.สัมพันธวงศ์ อ.สัมพันธวงศ์ จ.กรุงเทพมหานคร,06:00 น.,3
โกสุมพิสัย,ต.หัวขวาง อ.โกสุมพิสัย จ.มหาสารคาม,06:00 น.,3
บ้านยางแก้ว,ต.อมก๋อย อ.อมก๋อย จ.เชียงใหม่,05:00 น.,3
อบต.หินดาด,ต.หินดาด อ.ทองผาภูมิ จ.กาญจนบุรี,06:00 น.,3
บ้านแม่เชียงรายบน,ต.พระบาทวังตวง อ.แม่พริก จ.ลำปาง,05:00 น.,3
ชุมชนบ้านแม่ละอุป,ต.แม่แดด อ.แม่แจ่ม จ.เชียงใหม่,06:00 น.,2.8
หน่วยอนุรักษ์และจัดการต้นน้ำคลองอุดม,ต.วังทอง อ.วังสมบูรณ์ จ.สระแก้ว,06:00 น.,2.8
อบต.แม่อิง,ต.แม่อิง อ.ภูกามยาว จ.พะเยา,06:00 น.,2.8
สนามบินสุวรรณภูมิ,ต.หนองปรือ อ.บางพลี จ.สมุทรปราการ,04:00 น.,2.8
สถานีควบคุมไฟป่าภูสิงห์ภูผาผึ้ง-ภูสระดอกบัว,ต.หนองมะแซว อ.เมืองอำนาจเจริญ จ.อำนาจเจริญ,06:00 น.,2.8
ท่อทองแดง1,ต.หนองปลิง อ.เมืองกำแพงเพชร จ.กำแพงเพชร,06:00 น.,2.8
ลำปาง,ต.พระบาท อ.เมืองลำปาง จ.ลำปาง,04:00 น.,2.8
บางน้ำเปรี้ยว,ต.บางขนาก อ.บางน้ำเปรี้ยว จ.ฉะเชิงเทรา,06:00 น.,2.8
ทต.บางระกำเมืองใหม่,ต.บางระกำ อ.บางระกำ จ.พิษณุโลก,06:00 น.,2.8
ทต.ป่าแดด,ต.ป่าแดด อ.ป่าแดด จ.เชียงราย,06:00 น.,2.8
ทต.ยางฮอม,ต.ยางฮอม อ.ขุนตาล จ.เชียงราย,06:00 น.,2.8
ทต.คลองลานพัฒนา,ต.คลองลานพัฒนา อ.คลองลาน จ.กำแพงเพชร,06:00 น.,2.8
พัทลุง สกษ.,ต.ลำปำ อ.เมืองพัทลุง จ.พัทลุง,04:00 น.,2.7
ตาพระยา,ต.ทัพเสด็จ อ.ตาพระยา จ.สระแก้ว,06:00 น.,2.6
ทต.ท่าแร่,ต.ท่าแร่ อ.เมืองสกลนคร จ.สกลนคร,06:00 น.,2.6
ทต.ท่าขนุน,ต.ท่าขนุน อ.ทองผาภูมิ จ.กาญจนบุรี,06:00 น.,2.6
รร.บ้านปางช้าง,ต.ป่าแลวหลวง อ.สันติสุข จ.น่าน,06:00 น.,2.6
อบต.ขนงพระ,ต.ขนงพระ อ.ปากช่อง จ.นครราชสีมา,06:00 น.,2.6
พระนครศรีอยุธยา,ต.ท่าเจ้าสนุก อ.ท่าเรือ จ.พระนครศรีอยุธยา,04:00 น.,2.6
อบต.นอกเมือง,ต.นอกเมือง อ.เมืองสุรินทร์ จ.สุรินทร์,06:00 น.,2.6
รร.บ้านหนองคล้า,ต.เขาวิเศษ อ.วังวิเศษ จ.ตรัง,06:00 น.,2.6
สวนเพชรล้านนา,ต.แม่สุก อ.แจ้ห่ม จ.ลำปาง,06:00 น.,2.6
อบต.ปังเผล,ต.ปรังเผล อ.สังขละบุรี จ.กาญจนบุรี,06:00 น.,2.6
ฟิวเจอร์ฯรังสิต,ต.รังสิต อ.ธัญบุรี จ.ปทุมธานี,06:00 น.,2.6
ที่ว่าการอำเภอไม้แก่น,ต.ไทรทอง อ.ไม้แก่น จ.ปัตตานี,06:00 น.,2.6
รร.ผังปาล์ม 4,ต.ปาล์มพัฒนา อ.มะนัง จ.สตูล,06:00 น.,2.6
หัวหิน,ต.หัวหิน อ.หัวหิน จ.ประจวบคีรีขันธ์,04:00 น.,2.6
บ้านดินดอน,ต.ท่าดี อ.ลานสกา จ.นครศรีธรรมราช,05:00 น.,2.5
บ้านม่วงเจริญราษฎร์,ต.บ่อสวก อ.เมืองน่าน จ.น่าน,05:00 น.,2.5
บ้านหนองบัวคำ,ต.เม็งราย อ.พญาเม็งราย จ.เชียงราย,05:00 น.,2.5
บ้านพระเลียบ*,ต.ไทยบุรี อ.ท่าศาลา จ.นครศรีธรรมราช,05:00 น.,2.5
บ้านห้วยกุ้ง,ต.ป่าโปง อ.สบเมย จ.แม่ฮ่องสอน,05:00 น.,2.5
บ้านนาเจริญ,ต.แม่เปา อ.พญาเม็งราย จ.เชียงราย,05:00 น.,2.5
บ้านขุนกลาง,ต.บ้านหลวง อ.จอมทอง จ.เชียงใหม่,05:00 น.,2.5
บ้านผาลาด,ต.แม่ทะ อ.แม่ทะ จ.ลำปาง,05:00 น.,2.5
บ้านแม่ถอด,ต.แม่ถอด อ.เถิน จ.ลำปาง,05:00 น.,2.5
บ้านทหารผ่านศึก,ต.รวมไทยพัฒนา อ.พบพระ จ.ตาก,05:00 น.,2.5
บ้านหลู้,ต.ม่วงยาย อ.เวียงแก่น จ.เชียงราย,05:00 น.,2.5
บ้านน้ำพิ,ต.ทุ่งช้าง อ.ทุ่งช้าง จ.น่าน,04:00 น.,2.5
บ้านปางกล้วยค้าว,ต.ป่าหุ่ง อ.พาน จ.เชียงราย,05:00 น.,2.5
บ้านห้วยกลาง,ต.กะทูน อ.พิปูน จ.นครศรีธรรมราช,05:00 น.,2.5
บ้านนาท้อน,ต.ตลิ่งชัน อ.ท่าศาลา จ.นครศรีธรรมราช,05:00 น.,2.5
จุดวัดศูนย์ราชการ-ถ.แจ้งวัฒนะ,ต.ทุ่งสองห้อง อ.หลักสี่ จ.กรุงเทพมหานคร,06:00 น.,2.5
บ้านแม่ลาก,ต.ท่าข้าวเปลือก อ.แม่จัน จ.เชียงราย,05:00 น.,2.5
บ้านแจ้ซ้อน,ต.ห้วยยาบ อ.บ้านธิ จ.ลำพูน,05:00 น.,2.5
บ้านนาฝ่า,ต.จอมพระ อ.ท่าวังผา จ.น่าน,05:00 น.,2.5
บ้านโตนปาหนัน,ต.ทุ่งนุ้ย อ.ควนกาหลง จ.สตูล,05:00 น.,2.5
ปตร.คลองบัว-ทางรถไฟ,ต.ฉิมพลี อ.ตลิ่งชัน จ.กรุงเทพมหานคร,06:00 น.,2.5
บ้านเขาควง,ต.หนองแก อ.หัวหิน จ.ประจวบคีรีขันธ์,05:00 น.,2.5
บ้านแม่ตืน,ต.แม่ตืน อ.ลี้ จ.ลำพูน,05:00 น.,2.5
บ้านห้วยเฮี้ย,ต.ศรีถ้อย อ.แม่สรวย จ.เชียงราย,05:00 น.,2.5
บ้านทุ่งจ้อ,ต.ป่าแป๋ อ.แม่แตง จ.เชียงใหม่,05:00 น.,2.5
บ้านห้วยหมี,ต.มหาวัน อ.แม่สอด จ.ตาก,05:00 น.,2.5
บ้านห้วยไผ่,ต.ห้วยแม่เพรียง อ.แก่งกระจาน จ.เพชรบุรี,05:00 น.,2.5
บ้านแม่กองปิน,ต.บ้านขอ อ.เมืองปาน จ.ลำปาง,05:00 น.,2.5
บ้านควนเหมียง,ต.วังคีรี อ.ห้วยยอด จ.ตรัง,05:00 น.,2.5
บ้านหนองน้ำดำ,ต.ห้วยแม่เพรียง อ.แก่งกระจาน จ.เพชรบุรี,05:00 น.,2.5
บ้านยุปอีปูน,ต.วังหมี อ.วังน้ำเขียว จ.นครราชสีมา,05:00 น.,2.5
บ้านส้อ,ต.เปือ อ.เชียงกลาง จ.น่าน,05:00 น.,2.5
บ้านหลวง,ต.แม่งอน อ.ฝาง จ.เชียงใหม่,05:00 น.,2.5
บ้านตาดซ้อ,ต.เขาแก้ว อ.เชียงคาน จ.เลย,05:00 น.,2.5
ส.คลองตาอูฐ,ต.ทุ่งสองห้อง อ.หลักสี่ จ.กรุงเทพมหานคร,06:00 น.,2.5
บ้านรังเตี้ย,ต.นิยมชัย อ.สระโบสถ์ จ.ลพบุรี,05:00 น.,2.5
บ้านแม่แขม,ต.บ่อเหล็กลอง อ.ลอง จ.แพร่,05:00 น.,2.5
บ้านไร่รวงทอง,ต.ปัว อ.ปัว จ.น่าน,05:00 น.,2.5
บ้านปางหก,ต.อินทขิล อ.แม่แตง จ.เชียงใหม่,05:00 น.,2.5
ปตร.คลองขุนศรีฯ-ค.มหาสวัสดิ์,ต.ศาลาธรรมสพน์ อ.ทวีวัฒนา จ.กรุงเทพมหานคร,06:00 น.,2.5
บ้านเมืองน้อย,ต.เวียงเหนือ อ.ปาย จ.แม่ฮ่องสอน,05:00 น.,2.5
บ้านแม่สุ,ต.แม่ลาหลวง อ.แม่ลาน้อย จ.แม่ฮ่องสอน,05:00 น.,2.5
บ้านนาส้อง,ต.คลองใหญ่ อ.ตะโหมด จ.พัทลุง,05:00 น.,2.5
ปตร.คลองสองสายใต้,ต.สายไหม อ.สายไหม จ.กรุงเทพมหานคร,06:00 น.,2.5
ศูนย์ฯ (ดินแดง),ต.ดินแดง อ.ดินแดง จ.กรุงเทพมหานคร,06:00 น.,2.5
บ้านบ้องตี้บน,ต.บ้องตี้ อ.ไทรโยค จ.กาญจนบุรี,05:00 น.,2.5
จุดวัดบึงมักกะสัน,ต.มักกะสัน อ.ราชเทวี จ.กรุงเทพมหานคร,06:00 น.,2.5
บ้านวังผา,ต.ห้วยบ่อซืน อ.ปากชม จ.เลย,05:00 น.,2.5
บ้านเจดีย์,ต.ป่าตาล อ.ขุนตาล จ.เชียงราย,05:00 น.,2.5
บ้านตอง,ต.แม่จริม อ.แม่จริม จ.น่าน,06:00 น.,2.4
เหนือฝายยางบ้านเขว้า,ต.ปะเคียบ อ.คูเมือง จ.บุรีรัมย์,06:00 น.,2.4
เมืองสตูล,ต.ฉลุง อ.เมืองสตูล จ.สตูล,06:00 น.,2.4
ปากรอ,ต.ปากรอ อ.สิงหนคร จ.สงขลา,06:00 น.,2.4
พิบูลมังสาหาร,ต.โพธิ์ศรี อ.พิบูลมังสาหาร จ.อุบลราชธานี,06:00 น.,2.4
ร้อยเอ็ด,ต.หนองไผ่ อ.ธวัชบุรี จ.ร้อยเอ็ด,04:00 น.,2.4
ภูเก็ต,ต.ตลาดใหญ่ อ.เมืองภูเก็ต จ.ภูเก็ต,04:00 น.,2.4
ทต.เสริมงาม,ต.ทุ่งงาม อ.เสริมงาม จ.ลำปาง,06:00 น.,2.4
คลองลาดพร้าว ปากคลอง2สายใต้,ต.ลาดพร้าว อ.ลาดพร้าว จ.กรุงเทพมหานคร,06:00 น.,2.4
หน่วยพิทักษ์อุทยานฯ ที่ ผก.๒ (ถ้ำเอราวัณ-แก่งหลวง),ต.บ้านปิน อ.ลอง จ.แพร่,06:00 น.,2.4
สะพานน้ำยาว บ้านสองแคว,ต.นาไร่หลวง อ.สองแคว จ.น่าน,06:00 น.,2.4
วัดบ้านดงผาปูน,ต.บ่อเกลือใต้ อ.บ่อเกลือ จ.น่าน,06:00 น.,2.4
หน่วยจัดการต้นน้ำแม่พริก (หน่วยย่อย ปางหลวง),ต.ท่าก๊อ อ.แม่สรวย จ.เชียงราย,06:00 น.,2.4
อบต.แม่สวด,ต.แม่สวด อ.สบเมย จ.แม่ฮ่องสอน,06:00 น.,2.4
สวรรคโลก,ต.ท่าทอง อ.สวรรคโลก จ.สุโขทัย,06:00 น.,2.4
หนองพลับ สกษ.,ต.หนองพลับ อ.หัวหิน จ.ประจวบคีรีขันธ์,04:00 น.,2.3
ปตร.ตุยง,ต.ตุยง อ.หนองจิก จ.ปัตตานี,06:00 น.,2.2
คลองปาว,ต.เหล่าอ้อย อ.ร่องคำ จ.กาฬสินธุ์,06:00 น.,2.2
อบต.บ้านแมด,ต.บ้านแมด อ.บุณฑริก จ.อุบลราชธานี,06:00 น.,2.2
วัดเวฬุวัน,ต.เหนือเมือง อ.เมืองร้อยเอ็ด จ.ร้อยเอ็ด,06:00 น.,2.2
ทต.ปราณบุรี,ต.หนองตาแต้ม อ.ปราณบุรี จ.ประจวบคีรีขันธ์,06:00 น.,2.2
ทต.ศรีสำโรง,ต.สามเรือน อ.ศรีสำโรง จ.สุโขทัย,06:00 น.,2.2
นครหลวง,ต.บ่อโพง อ.นครหลวง จ.พระนครศรีอยุธยา,06:00 น.,2.2
สะพานข้ามคลองคดศอก,ต.หงษ์เจริญ อ.ท่าแซะ จ.ชุมพร,06:00 น.,2.2
บ้านห่างทางหลวง,ต.ภูฟ้า อ.บ่อเกลือ จ.น่าน,05:00 น.,2
บ้านใหม่พัฒนา,ต.ศรีสองรัก อ.เมืองเลย จ.เลย,05:00 น.,2
หมู่บ้านเศรษฐกิจ ซอย 26,ต.บางแคเหนือ อ.บางแค จ.กรุงเทพมหานคร,06:00 น.,2
บ้านแสนขัน*,ต.บ่อทอง อ.ทองแสนขัน จ.อุตรดิตถ์,05:00 น.,2
บ้านเหนือคลอง,ต.บ้านส้อง อ.เวียงสระ จ.สุราษฎร์ธานี,02:00 น.,2
คลองระพีพัฒน์แยกใต้ หนองเสือ,ต.นพรัตน์ อ.หนองเสือ จ.ปทุมธานี,06:00 น.,2
บ้านห้วยท่าง,ต.ไชยวัฒนา อ.ปัว จ.น่าน,05:00 น.,2
บ้านมหาโพธิ,ต.มหาโพธิ อ.สระโบสถ์ จ.ลพบุรี,05:00 น.,2
บ้านอมลาน,ต.กองแขก อ.แม่แจ่ม จ.เชียงใหม่,05:00 น.,2
บ้านพุไทร,ต.ห้วยแม่เพรียง อ.แก่งกระจาน จ.เพชรบุรี,05:00 น.,2
บ้านป่ากว้าว,ต.ป่าแดด อ.แม่สรวย จ.เชียงราย,05:00 น.,2
บ้านเกี๋ยงห้วยน่าน,ต.แม่ลอย อ.เทิง จ.เชียงราย,05:00 น.,2
บ้านคลองไทร,ต.หนองย่างเสือ อ.มวกเหล็ก จ.สระบุรี,05:00 น.,2
บ้านมะค่าสี่ซอง,ต.หนองพลับ อ.หัวหิน จ.ประจวบคีรีขันธ์,05:00 น.,2
บ้านเนินสะอาด,ต.บุ่งน้ำเต้า อ.หล่มสัก จ.เพชรบูรณ์,05:00 น.,2
บ้านเจ้าพ่อเขาตก,ต.พุกร่าง อ.พระพุทธบาท จ.สระบุรี,05:00 น.,2
คอหงษ์ สกษ.,ต.คอหงส์ อ.หาดใหญ่ จ.สงขลา,04:00 น.,2
จุดวัด ค.ประเวศฯ-เขตลาดกระบัง,ต.ลาดกระบัง อ.ลาดกระบัง จ.กรุงเทพมหานคร,06:00 น.,2
รร.บ้านข้าวแป้ง,ต.วาใหญ่ อ.อากาศอำนวย จ.สกลนคร,06:00 น.,2
ส.คลองบางจาก,ต.บางแคเหนือ อ.บางแค จ.กรุงเทพมหานคร,06:00 น.,2
เขตบางกอกใหญ่,ต.วัดท่าพระ อ.บางกอกใหญ่ จ.กรุงเทพมหานคร,06:00 น.,2
มะนัง,ต.นิคมพัฒนา อ.มะนัง จ.สตูล,06:00 น.,2
บ้านโป่งกระทิงล่าง,ต.บ้านบึง อ.บ้านคา จ.ราชบุรี,05:00 น.,2
ปตร.คลองลาดพร้าว,ต.วังทองหลาง อ.วังทองหลาง จ.กรุงเทพมหานคร,06:00 น.,2
บ้านหนองเอี่ยวใน,ต.ลำพญากลาง อ.มวกเหล็ก จ.สระบุรี,05:00 น.,2
บ้านวังว้า*,ต.ริม อ.ท่าวังผา จ.น่าน,05:00 น.,2
บ้านทุ่งผง,ต.ทุ่งศรีทอง อ.เวียงสา จ.น่าน,05:00 น.,2
อบต.ดู่พงษ์,ต.ดู่พงษ์ อ.สันติสุข จ.น่าน,06:00 น.,2
บ้านห้วยหิน,ต.เขาแหลม อ.ชัยบาดาล จ.ลพบุรี,05:00 น.,2
บ้านกิ่วม่วง,ต.ดู่พงษ์ อ.สันติสุข จ.น่าน,05:00 น.,2
บ้านปางเคาะ,ต.ไทรย้อย อ.เด่นชัย จ.แพร่,05:00 น.,2
บ้านแม่ฉางข้าว,ต.ป่างิ้ว อ.เวียงป่าเป้า จ.เชียงราย,05:00 น.,2
บ้านร้องธาร,ต.ศรีดงเย็น อ.ไชยปราการ จ.เชียงใหม่,05:00 น.,2
บ้านแม่ละเมา,ต.พะวอ อ.แม่สอด จ.ตาก,05:00 น.,2
บ้านแม่ปูนล่าง,ต.สันสลี อ.เวียงป่าเป้า จ.เชียงราย,05:00 น.,2
บ้านแม่ออกฮู,ต.วาเล่ย์ อ.พบพระ จ.ตาก,05:00 น.,2
บ้านแม่จอก,ต.หัวทุ่ง อ.ลอง จ.แพร่,05:00 น.,2
บ้านพอนอคี,ต.ห้วยโป่ง อ.เมืองแม่ฮ่องสอน จ.แม่ฮ่องสอน,05:00 น.,2
จุดวัด ค.ทวีฯ-ค.ภาษีฯ,ต.หนองแขม อ.หนองแขม จ.กรุงเทพมหานคร,06:00 น.,2
ส.คลองเลนเปน,ต.แสมดำ อ.บางขุนเทียน จ.กรุงเทพมหานคร,06:00 น.,2
บ้านห้วยหมากเอียก,ต.ป่าซาง อ.เวียงเชียงรุ้ง จ.เชียงราย,05:00 น.,2
บ้านกิ่วจันทร์,ต.ขุนน่าน อ.เฉลิมพระเกียรติ จ.น่าน,05:00 น.,2
บ้านโค้งสง่า,ต.ลำพยนต์ อ.ตากฟ้า จ.นครสวรรค์,05:00 น.,2
จุดวัด ค.บางบอน-ค.สะแกงาม,ต.บางบอน อ.บางบอน จ.กรุงเทพมหานคร,06:00 น.,2
สะพานลำน้ำยาม,ต.อากาศ อ.อากาศอำนวย จ.สกลนคร,06:00 น.,2
บ้านบุ่งกุ่ม,ต.นาหอ อ.ด่านซ้าย จ.เลย,05:00 น.,2
ทต.โคกภู,ต.โคกภู อ.ภูพาน จ.สกลนคร,06:00 น.,2
