สถานีบ้านไร่,ต.ห้วยเขย่ง อ.ทองผาภูมิ จ.กาญจนบุรี ,05:00 ,21
สถานีบ้านหาดทรายเปลือกหอย,ต.คลองเคียน อ.ตะกั่วทุ่ง จ.พังงา ,06:00 ,21
สถานีอ่างเก็บน้ำห้วยซับเหล็ก,ต.โคกตูม อ.เมืองลพบุรี จ.ลพบุรี ,06:00 ,21
สถานีบ้านพรุเตาะนอก,ต.ทุ่งใหญ่ อ.หาดใหญ่ จ.สงขลา ,06:00 ,21
สถานีบ้านในปง,ต.อ่าวตง อ.วังวิเศษ จ.ตรัง ,06:00 ,20.5
สถานีบ้านซับใต้,ต.พญาเย็น อ.ปากช่อง จ.นครราชสีมา ,05:00 ,20.5
สถานีบ้านหนองไข่น้ำ,ต.จันทึก อ.ปากช่อง จ.นครราชสีมา ,06:00 ,20.5
สถานีอบต.พิจิตร,ต.พิจิตร อ.นาหม่อม จ.สงขลา ,06:00 ,20.4
สถานีรพ.สต.เวียงสระ,ต.เวียงสระ อ.เวียงสระ จ.สุราษฎร์ธานี ,06:00 ,20.4
สถานีน้ำตกปลิว,ต.ถ้ำใหญ่ อ.ทุ่งสง จ.นครศรีธรรมราช ,06:00 ,20.2
สถานีบ้านคลองสะท้อน,ต.วังหมี อ.วังน้ำเขียว จ.นครราชสีมา ,06:00 ,20
สถานีบ้านหนักไทร*,ต.ช่อง อ.นาโยง จ.ตรัง ,05:00 ,20
สถานีบ้านพันวาล 4,ต.รับร่อ อ.ท่าแซะ จ.ชุมพร ,06:00 ,20
สถานีบ้านโล๊ะดุหยง,ต.ศาลาด่าน อ.เกาะลันตา จ.กระบี่ ,05:00 ,20
สถานีบ้านกอตง,ต.เขาดิน อ.เขาพนม จ.กระบี่ ,05:00 ,20
สถานีบ้านเตราะบอน,ต.เตราะบอน อ.สายบุรี จ.ปัตตานี ,05:00 ,20
สถานีเขตบางคอแหลม,ต.บางคอแหลม อ.บางคอแหลม จ.กรุงเทพมหานคร ,06:00 ,20
สถานีตะกั่วป่า,ต.คึกคัก อ.ตะกั่วป่า จ.พังงา ,04:00 ,19.8
สถานีคลองพรหมโหด,ต.บ้านใหม่หนองไทร อ.อรัญประเทศ จ.สระแก้ว ,06:00 ,19.6
สถานีบ้านนากึ๋น,ต.บ่อเกลือเหนือ อ.บ่อเกลือ จ.น่าน ,06:00 ,19.5
สถานีบ้านทุ่งปรือ,ต.พะตง อ.หาดใหญ่ จ.สงขลา ,05:00 ,19.5
สถานีบ้านคีรีรัตน์,ต.เข็กน้อย อ.เขาค้อ จ.เพชรบูรณ์ ,06:00 ,19.5
สถานีบ้านตาบาด,ต.บ่อพลอย อ.บ่อไร่ จ.ตราด ,06:00 ,19.5
สถานีเมืองตราด,ต.ห้วยแร้ง อ.เมืองตราด จ.ตราด ,06:00 ,19.4
สถานีทต.มายอ,ต.มายอ อ.มายอ จ.ปัตตานี ,06:00 ,19.4
สถานีวัดคอกช้าง อ.ธารโต จ.ยะลา,ต.แม่หวาด อ.ธารโต จ.ยะลา ,05:00 ,19
สถานีบ้านคันเบ็ด,ต.เขาแก้ว อ.ลานสกา จ.นครศรีธรรมราช ,06:00 ,19
สถานีบ้านวัดสวาด,ต.ป่าร่อน อ.กาญจนดิษฐ์ จ.สุราษฎร์ธานี ,05:00 ,19
สถานีบ้านห้วยโป่งผาลาด,ต.แม่เจดีย์ใหม่ อ.เวียงป่าเป้า จ.เชียงราย ,06:00 ,19
สถานีท้ายเขื่อนรัชชประภา,ต.เขาพัง อ.บ้านตาขุน จ.สุราษฎร์ธานี ,05:00 ,19
สถานีเขตสาทร,ต.ทุ่งวัดดอน อ.สาทร จ.กรุงเทพมหานคร ,06:00 ,19
สถานีทต.จันดี,ต.จันดี อ.ฉวาง จ.นครศรีธรรมราช ,06:00 ,19
สถานีศูนย์พัฒนาเด็กเล็ก อบต.ท่านา,ต.ท่านา อ.กะปง จ.พังงา ,06:00 ,18.6
สถานีบ้านจุฬาภรณ์พัฒนา,ต.เขาพระ อ.พิปูน จ.นครศรีธรรมราช ,06:00 ,18.5
สถานีบ้านดอน,ต.อัยเยอร์เวง อ.เบตง จ.ยะลา ,05:00 ,18.5
สถานีบ้านท่าเรือ*,ต.บาตง อ.รือเสาะ จ.นราธิวาส ,05:00 ,18.5
สถานีอบต.บานา,ต.บานา อ.เมืองปัตตานี จ.ปัตตานี ,06:00 ,18.4
สถานีนครศรีธรรมราช สกษ.,ต.ท่าเรือ อ.เมืองนครศรีธรรมราช จ.นครศรีธรรมราช ,04:00 ,18.2
สถานีภูเก็ต (ศูนย์ฯ),ต.ไม้ขาว อ.ถลาง จ.ภูเก็ต ,04:00 ,18.1
สถานีอบต.สินปุน,ต.สินปุน อ.เขาพนม จ.กระบี่ ,06:00 ,18
สถานีทะเลหมอก อัยเยอร์เวง,ต.อัยเยอร์เวง อ.เบตง จ.ยะลา ,06:00 ,18
สถานีสะพานไอร์ปาโจ,ต.ภูเขาทอง อ.สุคิริน จ.นราธิวาส ,06:00 ,17.6
สถานีจุดวัดบึงมักกะสัน,ต.มักกะสัน อ.ราชเทวี จ.กรุงเทพมหานคร ,06:00 ,17.5
สถานีบ้านปาลอบาเต๊ะ,ต.ลุโบะบายะ อ.ยี่งอ จ.นราธิวาส ,05:00 ,17.5
สถานีบ้านเขาพลู,ต.บางสัก อ.กันตัง จ.ตรัง ,06:00 ,17.5
สถานีส.คลองสามเสน-แสนแสบ,ต.บางกะปิ อ.ห้วยขวาง จ.กรุงเทพมหานคร ,06:00 ,17.5
สถานีบ้านจำปาทอง,ต.บ้านทำเนียบ อ.คีรีรัฐนิคม จ.สุราษฎร์ธานี ,05:00 ,17
สถานีบ้านเขาหลัก,ต.ปากแจ่ม อ.ห้วยยอด จ.ตรัง ,06:00 ,17
สถานีบ้านปากลง,ต.กรุงชิง อ.นบพิตำ จ.นครศรีธรรมราช ,06:00 ,17
สถานีบ้านหลวง,ต.แม่งอน อ.ฝาง จ.เชียงใหม่ ,06:00 ,17
สถานีพรุเฉวง,ต.บ่อผุด อ.เกาะสมุย จ.สุราษฎร์ธานี ,06:00 ,16.6
สถานีบ้านเครือหวาย,ต.โป่งน้ำร้อน อ.โป่งน้ำร้อน จ.จันทบุรี ,05:00 ,16.5
สถานีเขตลาดพร้าว,ต.ลาดพร้าว อ.ลาดพร้าว จ.กรุงเทพมหานคร ,06:00 ,16.5
สถานีบ้านบางกุ่ม,ต.กะปง อ.กะปง จ.พังงา ,06:00 ,16.5
สถานีบ้านสว้านเหนือ,ต.ดงพญา อ.บ่อเกลือ จ.น่าน ,06:00 ,16.5
สถานีหน่วยจัดการต้นน้ำขุนน่าน,ต.บ่อเกลือเหนือ อ.บ่อเกลือ จ.น่าน ,06:00 ,16.4
สถานีสำนักงานเกษตรอำเภอทุ่งยางแดง,ต.ตะโละแมะนา อ.ทุ่งยางแดง จ.ปัตตานี ,06:00 ,16.2
สถานีทต.น้ำยืน,ต.สีวิเชียร อ.น้ำยืน จ.อุบลราชธานี ,06:00 ,16.2
สถานีอบต.บ้านเจียง,ต.บ้านเจียง อ.ภักดีชุมพล จ.ชัยภูมิ ,06:00 ,16.2
สถานีบ้านหินกอง,ต.ทุ่งเบญจา อ.ท่าใหม่ จ.จันทบุรี ,06:00 ,16
สถานีบ้านโคกไทร,ต.คลองเฉลิม อ.กงหรา จ.พัทลุง ,04:00 ,16
สถานีบ้านควนเหมียง,ต.วังคีรี อ.ห้วยยอด จ.ตรัง ,04:00 ,16
สถานีบ้านน้ำน้อยเหนือ,ต.ช้างกลาง อ.ช้างกลาง จ.นครศรีธรรมราช ,05:00 ,16
สถานีสะพานบ้าน กม.29 อ.เบตง จ.ยะลา,ต.อัยเยอร์เวง อ.เบตง จ.ยะลา ,05:00 ,16
สถานีบ้านโคกสง่า,ต.หนองสาหร่าย อ.ปากช่อง จ.นครราชสีมา ,06:00 ,16
สถานีซ.สะพานขวา ,ต.บางซื่อ อ.บางซื่อ จ.กรุงเทพมหานคร ,06:00 ,16
สถานีบ้านใหม่พัฒนา,ต.บ้านร้อง อ.งาว จ.ลำปาง ,06:00 ,16
สถานีอบต.ป่าแดง,ต.ป่าแดง อ.ชาติตระการ จ.พิษณุโลก ,06:00 ,15.6
สถานีพัทยา,ต.เขตการปกครองพิเศษพัทยา อ.บางละมุง จ.ชลบุรี ,04:00 ,15.6
สถานีสำนักงานเกษตรอำเภอเจาะไอร้อง,ต.จวบ อ.เจาะไอร้อง จ.นราธิวาส ,06:00 ,15.6
สถานีที่ว่าการอำเภอกรงปินัง,ต.สะเอะ อ.กรงปินัง จ.ยะลา ,06:00 ,15.6
สถานีส.คลองบางเขนใหม่,ต.บางซื่อ อ.บางซื่อ จ.กรุงเทพมหานคร ,06:00 ,15.5
สถานีบ้านวังรี,ต.เขาพระ อ.เมืองนครนายก จ.นครนายก ,05:00 ,15.5
สถานีบ้านน้ำตกสาย 1,ต.ห้วยยาง อ.ทับสะแก จ.ประจวบคีรีขันธ์ ,06:00 ,15.5
สถานีบ้านท่าคลอง,ต.เทศบาลเมืองกระบี่ อ.เมืองกระบี่ จ.กระบี่ ,05:00 ,15.5
สถานีทม.ทับกวาง,ต.ทับกวาง อ.แก่งคอย จ.สระบุรี ,06:00 ,15.4
สถานีสนามทับทุ่ม บ้านวังนาใน หมู่ที่ 10,ต.น้ำผุด อ.ละงู จ.สตูล ,06:00 ,15.2
สถานีเขตห้ามล่าสัตว์ป่าเขาสมโภชน์,ต.นาโสม อ.ชัยบาดาล จ.ลพบุรี ,06:00 ,15.2
สถานีส.คลองสาทร,ต.ยานนาวา อ.สาทร จ.กรุงเทพมหานคร ,06:00 ,15
สถานีบ้านวังนาใน,ต.ทุ่งหว้า อ.ทุ่งหว้า จ.สตูล ,06:00 ,15
สถานีบ้านบางแป้น2,ต.วังมะปราง อ.วังวิเศษ จ.ตรัง ,06:00 ,15
สถานีบ้านตามูล,ต.ทรายขาว อ.สอยดาว จ.จันทบุรี ,06:00 ,15
สถานีบ้านทุ่งกร่าง,ต.ทับไทร อ.โป่งน้ำร้อน จ.จันทบุรี ,05:00 ,15
สถานีบ้านทรายงาม,ต.ห้วยปริก อ.ฉวาง จ.นครศรีธรรมราช ,05:00 ,15
สถานีนครศรีธรรมราช,ต.ปากพูน อ.เมืองนครศรีธรรมราช จ.นครศรีธรรมราช ,04:00 ,14.9
สถานีนายายอาม,ต.วังใหม่ อ.นายายอาม จ.จันทบุรี ,06:00 ,14.8
สถานีอุทยานแห่งชาติตาดโตน,ต.นาฝาย อ.เมืองชัยภูมิ จ.ชัยภูมิ ,06:00 ,14.8
สถานีบ้านวังไทร,ต.แม่หวาด อ.ธารโต จ.ยะลา ,05:00 ,14.5
สถานีบ้านนาวัง,ต.ตะเคียนเตี้ย อ.บางละมุง จ.ชลบุรี ,05:00 ,14.5
สถานีบ้านผาตั้ง,ต.ปอ อ.เวียงแก่น จ.เชียงราย ,06:00 ,14.5
สถานีบ้านห้วยทราย,ต.แม่เจดีย์ อ.เวียงป่าเป้า จ.เชียงราย ,06:00 ,14.5
สถานีจุดวัด ซ.แอนเน็กซ์,ต.สายไหม อ.สายไหม จ.กรุงเทพมหานคร ,06:00 ,14.5
สถานีแหลมฉบัง,ต.ทุ่งสุขลา อ.ศรีราชา จ.ชลบุรี ,19:00 ,14.4
สถานีรัษฎา,ต.ควนเมา อ.รัษฎา จ.ตรัง ,06:00 ,14.4
สถานีปตร.คลองบัว-ทางรถไฟ,ต.ฉิมพลี อ.ตลิ่งชัน จ.กรุงเทพมหานคร ,06:00 ,14
สถานีเขตราชเทวี,ต.ทุ่งพญาไท อ.ราชเทวี จ.กรุงเทพมหานคร ,06:00 ,14
สถานีบ้านโตนดห้าต้น,ต.นาพญา อ.หลังสวน จ.ชุมพร ,06:00 ,14
สถานีที่ว่าการอำเภอเบตง จ.ยะลา,ต.เบตง อ.เบตง จ.ยะลา ,05:00 ,14
สถานีบ้านปูลาตีรี,ต.โกตาบารู อ.รามัน จ.ยะลา ,05:00 ,14
สถานีบ้านโป่งเกตุ,ต.ขุนซ่อง อ.แก่งหางแมว จ.จันทบุรี ,06:00 ,14
สถานีองค์การบริหารส่วนตำบลตาชี,ต.ตาชี อ.ยะหา จ.ยะลา ,06:00 ,13.8
สถานีอบต.เหล่ากอหก,ต.เหล่ากอหก อ.นาแห้ว จ.เลย ,06:00 ,13.8
สถานีบ้านบ่อน้ำร้อน,ต.ตาเนาะแมเราะ อ.เบตง จ.ยะลา ,05:00 ,13.5
สถานียะลา สกษ.,ต.สะเตงนอก อ.เมืองยะลา จ.ยะลา ,22:00 ,13.5
สถานีบ้านห้วยกอก,ต.ห้วยเฮี้ย อ.นครไทย จ.พิษณุโลก ,06:00 ,13.5
สถานีบ้านคลองพร้าว,ต.เกาะช้าง อ.เกาะช้าง จ.ตราด ,06:00 ,13.5
สถานีบ้านหลังเขา,ต.หนองกะท้าว อ.นครไทย จ.พิษณุโลก ,05:00 ,13
สถานีฝายละแอ อ.บันนังสตา จ.ยะลา,ต.เขื่อนบางลาง อ.บันนังสตา จ.ยะลา ,05:00 ,13
สถานีบ้านนอก,ต.ตาชี อ.ยะหา จ.ยะลา ,05:00 ,13
สถานีบ้านควนขวาง,ต.เขาวิเศษ อ.วังวิเศษ จ.ตรัง ,06:00 ,13
สถานีบ้านมะนังบังแยง,ต.จะแนะ อ.จะแนะ จ.นราธิวาส ,05:00 ,13
สถานีบ้านปากแคลง,ต.ปะเหลียน อ.ปะเหลียน จ.ตรัง ,06:00 ,13
สถานีบ้านตะบกเตี้ย,ต.ฉมัน อ.มะขาม จ.จันทบุรี ,06:00 ,13
สถานีหน่วยพิทักษ์ป่าอ่าวท่ายาง,ต.เกาะหมาก อ.ปากพะยูน จ.พัทลุง ,06:00 ,13
สถานีบ้านน้ำรอบ,ต.ลานสกา อ.ลานสกา จ.นครศรีธรรมราช ,06:00 ,13
สถานีสะพานท้ายเขื่อนบางลาง อ.บันนังสตา จ.ยะลา,ต.บาเจาะ อ.บันนังสตา จ.ยะลา ,05:00 ,13
สถานีเมืองสตูล,ต.ฉลุง อ.เมืองสตูล จ.สตูล ,06:00 ,12.8
สถานีอบต.บางหิน,ต.บางหิน อ.กะเปอร์ จ.ระนอง ,06:00 ,12.6
สถานีบ้านราษฎร์ผดุง,ต.สุคิริน อ.สุคิริน จ.นราธิวาส ,05:00 ,12.5
สถานีบ้านทุ่งหยีเพ็ง,ต.ศาลาด่าน อ.เกาะลันตา จ.กระบี่ ,05:00 ,12.5
สถานีหลังสวน,ต.ขันเงิน อ.หลังสวน จ.ชุมพร ,06:00 ,12.2
สถานีโครงการฟาร์มตัวอย่างฯ บ้านป่าตาเขียว,ต.ท่าข้าม อ.ปะนาเระ จ.ปัตตานี ,06:00 ,12.2
สถานีเครือข่ายลุ่มน้ำลาว,ต.แม่เจดีย์ใหม่ อ.เวียงป่าเป้า จ.เชียงราย ,06:00 ,12.2
สถานีสะพานบ้านตรังพัฒนา,ต.พะโต๊ะ อ.พะโต๊ะ จ.ชุมพร ,06:00 ,12.2
สถานีส.คลองบางซื่อ,ต.ถนนนครไชยศรี อ.ดุสิต จ.กรุงเทพมหานคร ,06:00 ,12
สถานีสถานีฟาร์มตัวอย่างฯ บ้านลุตง,ต.ปากล่อ อ.โคกโพธิ์ จ.ปัตตานี ,06:00 ,11.8
สถานีอบต.คลองเฉลิม,ต.คลองเฉลิม อ.กงหรา จ.พัทลุง ,06:00 ,11.6
สถานีบ้านทุ่งคาโงก,ต.ทุ่งคาโงก อ.เมืองพังงา จ.พังงา ,05:00 ,11.5
สถานีบ้านโรงกลวง,ต.นบปริง อ.เมืองพังงา จ.พังงา ,06:00 ,11.5
สถานีบ้านนาคันหัก,ต.พระเพลิง อ.เขาฉกรรจ์ จ.สระแก้ว ,06:00 ,11.5
สถานีบ้านทับยาง,ต.คูหา อ.สะบ้าย้อย จ.สงขลา ,05:00 ,11.5
สถานีบ้านแม่น้ำ,ต.แม่น้ำ อ.เกาะสมุย จ.สุราษฎร์ธานี ,05:00 ,11.5
สถานีบ้านถ้ำมงกุฎ,ต.เขาวง อ.พระพุทธบาท จ.สระบุรี ,06:00 ,11.5
สถานีสะพานแม่น้ำว้า บ้านบ่อหยวก,ต.บ่อเกลือเหนือ อ.บ่อเกลือ จ.น่าน ,06:00 ,11.4
สถานีสะพานตาบัว บ้านยาเด๊ะ,ต.ภูเขาทอง อ.สุคิริน จ.นราธิวาส ,06:00 ,11.4
สถานีสถานีตำรวจภูธรกะพ้อ,ต.กะรุบี อ.กะพ้อ จ.ปัตตานี ,06:00 ,11.4
สถานีโครงการชลประทานยะลา,ต.สะเตง อ.เมืองยะลา จ.ยะลา ,06:00 ,11.4
สถานีหน่วยพิทักษ์อุทยานฯ ที่ บล.๒ (น้ำตกฮาลาซะห์),ต.แม่หวาด อ.ธารโต จ.ยะลา ,06:00 ,11.2
สถานีอบต.สะตอน,ต.สะตอน อ.สอยดาว จ.จันทบุรี ,06:00 ,11.2
สถานีบ้านไอร์กลูแป,ต.โคกสะตอ อ.รือเสาะ จ.นราธิวาส ,05:00 ,11
สถานีทต.เจ๊ะบิลัง,ต.เจ๊ะบิลัง อ.เมืองสตูล จ.สตูล ,06:00 ,11
สถานีบ้านนาส้อง,ต.คลองใหญ่ อ.ตะโหมด จ.พัทลุง ,06:00 ,11
สถานีส.คลองแสนแสบ-คลองตัน,ต.คลองตันเหนือ อ.วัฒนา จ.กรุงเทพมหานคร ,06:00 ,11
สถานีบ้านวังอ้ายโพธิ์,ต.บ้านไร่ อ.เทพสถิต จ.ชัยภูมิ ,06:00 ,11
สถานีบ้านช่องไม้ดำ,ต.คลองหิน อ.อ่าวลึก จ.กระบี่ ,06:00 ,11
สถานีรพ.สต.บ้านวังไทร,ต.แม่หวาด อ.ธารโต จ.ยะลา ,06:00 ,11
สถานีบ้านละหาด,ต.แม่หวาด อ.ธารโต จ.ยะลา ,05:00 ,11
สถานีบ้านท่างาม,ต.ท่างิ้ว อ.เมืองนครศรีธรรมราช จ.นครศรีธรรมราช ,06:00 ,11
สถานีอบต.เทอดไทย,ต.เทอดไทย อ.แม่ฟ้าหลวง จ.เชียงราย ,06:00 ,10.8
สถานีอบต.ท่าข้าม,ต.ท่าข้าม อ.ท่าแซะ จ.ชุมพร ,06:00 ,10.6
สถานีรร.บ้านหนองคล้า,ต.เขาวิเศษ อ.วังวิเศษ จ.ตรัง ,06:00 ,10.6
สถานีคลองลาดพร้าว ปากคลอง2สายใต้,ต.ลาดพร้าว อ.ลาดพร้าว จ.กรุงเทพมหานคร ,06:00 ,10.6
สถานีบ้านก่อก๋วง,ต.บ่อเกลือใต้ อ.บ่อเกลือ จ.น่าน ,05:00 ,10.5
สถานีบ้านพิตำ,ต.กรุงชิง อ.นบพิตำ จ.นครศรีธรรมราช ,06:00 ,10.5
สถานีบ้านเหวปลากั้ง,ต.หมูสี อ.ปากช่อง จ.นครราชสีมา ,05:00 ,10.5
สถานีบ้านคลองไข่มุก,ต.คลองกวาง อ.นาทวี จ.สงขลา ,05:00 ,10.5
สถานีปตร.คลองอรชร,ต.ปทุมวัน อ.ปทุมวัน จ.กรุงเทพมหานคร ,06:00 ,10.5
สถานีบ้านต้นกอ,ต.ร่อนพิบูลย์ อ.ร่อนพิบูลย์ จ.นครศรีธรรมราช ,05:00 ,10.5
สถานีอบต.เขาล้าน,ต.เขาล้าน อ.ทับสะแก จ.ประจวบคีรีขันธ์ ,06:00 ,10.4
สถานีรร.กองม่องทะ สาขาสะละวะ,ต.ไล่โว่ อ.สังขละบุรี จ.กาญจนบุรี ,06:00 ,10.4
สถานีตลาดเก่าตะกั่วป่า,ต.โคกเคียน อ.ตะกั่วป่า จ.พังงา ,06:00 ,10.4
สถานีคลองกาแลกูโบ หมู่ที่ 1,ต.คลองใหม่ อ.ยะรัง จ.ปัตตานี ,06:00 ,10.4
สถานีทม.ตากใบ,ต.เจ๊ะเห อ.ตากใบ จ.นราธิวาส ,06:00 ,10.2
สถานีปตร.พรุสนอ,ต.ยามู อ.ยะหริ่ง จ.ปัตตานี ,06:00 ,10.2
สถานีสนามบินดอนเมือง,ต.สีกัน อ.ดอนเมือง จ.กรุงเทพมหานคร ,04:00 ,10.2
สถานีอ่างเก็บน้ำห้วยส้ม,ต.โคกตูม อ.เมืองลพบุรี จ.ลพบุรี ,06:00 ,10
สถานีอบต.วังหมี,ต.วังหมี อ.วังน้ำเขียว จ.นครราชสีมา ,06:00 ,10
สถานีบ้านไสท้อน,ต.ช่อง อ.นาโยง จ.ตรัง ,06:00 ,10
สถานีบ้านเทพพนม,ต.กระบี่น้อย อ.เมืองกระบี่ จ.กระบี่ ,06:00 ,10
สถานีชุมชนเขาสามยอด (บ้านน้ำจั้น หมู่ 2),ต.เขาสามยอด อ.เมืองลพบุรี จ.ลพบุรี ,03:00 ,10
