สถานีสะพานท่าสาป,ต.สะเตง อ.เมืองยะลา จ.ยะลา ,05:00 ,10
สถานีเขตวัฒนา,ต.คลองตันเหนือ อ.วัฒนา จ.กรุงเทพมหานคร ,06:00 ,10
สถานีอบต.หนองบอนแดง,ต.หนองบอนแดง อ.บ้านบึง จ.ชลบุรี ,06:00 ,9.8
สถานีสะพานท่าสำเภา,ต.ชัยบุรี อ.เมืองพัทลุง จ.พัทลุง ,06:00 ,9.6
สถานีส.คลองสำเหร่,ต.สำเหร่ อ.ธนบุรี จ.กรุงเทพมหานคร ,06:00 ,9.5
สถานีบ้านเขาหลัก,ต.ปากฉลุย อ.ท่าฉาง จ.สุราษฎร์ธานี ,06:00 ,9.5
สถานีส.วัดไทร,ต.บางโคล่ อ.บางคอแหลม จ.กรุงเทพมหานคร ,06:00 ,9.5
สถานีบ้านพระเลียบ*,ต.ไทยบุรี อ.ท่าศาลา จ.นครศรีธรรมราช ,05:00 ,9.5
สถานีบ้านฉลุง,ต.ทุ่งพอ อ.สะบ้าย้อย จ.สงขลา ,05:00 ,9.5
สถานีบ้านร่มเกล้าสหมิตร,ต.คีรีราษฎร์ อ.พบพระ จ.ตาก ,06:00 ,9.5
สถานีบ้านต้นหาร,ต.หน้าเขา อ.เขาพนม จ.กระบี่ ,06:00 ,9.5
สถานีบ้านช่องยูงทอง,ต.คันธุลี อ.ท่าชนะ จ.สุราษฎร์ธานี ,06:00 ,9.5
สถานีส.คลองบางไส้ไก่,ต.สำเหร่ อ.ธนบุรี จ.กรุงเทพมหานคร ,06:00 ,9.5
สถานีเขตป้อมปราบฯ,ต.วัดโสมนัส อ.ป้อมปราบศัตรูพ่าย จ.กรุงเทพมหานคร ,06:00 ,9.5
สถานีบ้านคลองไชยใต้,ต.กะเปียด อ.ฉวาง จ.นครศรีธรรมราช ,06:00 ,9.5
สถานีบ้านน้ำรีพัฒนา,ต.ขุนน่าน อ.เฉลิมพระเกียรติ จ.น่าน ,06:00 ,9.5
สถานีศูนย์เรียนรู้ชุมชนบ้านนาซัว หมู่ที่ 2,ต.ถ้ำทะลุ อ.บันนังสตา จ.ยะลา ,06:00 ,9.4
สถานีปากรอ,ต.ปากรอ อ.สิงหนคร จ.สงขลา ,06:00 ,9.4
สถานีรพสต.บ้านเขาปู่,ต.เขาปู่ อ.ศรีบรรพต จ.พัทลุง ,06:00 ,9.4
สถานีหนองบัว,ต.หนองบัว อ.บ้านค่าย จ.ระยอง ,06:00 ,9.4
สถานีอบต.เขาตูม,ต.เขาตูม อ.ยะรัง จ.ปัตตานี ,06:00 ,9.2
สถานีเขตบางซื่อ,ต.บางซื่อ อ.บางซื่อ จ.กรุงเทพมหานคร ,06:00 ,9
สถานีบ้านหางนา,ต.โพนสูง อ.ด่านซ้าย จ.เลย ,06:00 ,9
สถานีบ้านห้วยต่อ,ต.ไม้ฝาด อ.สิเกา จ.ตรัง ,06:00 ,9
สถานีส.คลองดาวคะนอง,ต.บางปะกอก อ.ราษฎร์บูรณะ จ.กรุงเทพมหานคร ,06:00 ,9
สถานีอบต.สะตอ,ต.สะตอ อ.เขาสมิง จ.ตราด ,06:00 ,9
สถานีบ้านนาลานข้าว,ต.วังยาว อ.ด่านซ้าย จ.เลย ,06:00 ,9
สถานีบ้านหนองเอี่ยวใน,ต.ลำพญากลาง อ.มวกเหล็ก จ.สระบุรี ,06:00 ,9
สถานีบ้านแป้น,ต.แป้น อ.สายบุรี จ.ปัตตานี ,05:00 ,9
สถานีบ้านคลองตูกเหนือ,ต.กะปาง อ.ทุ่งสง จ.นครศรีธรรมราช ,05:00 ,9
สถานีฝายจิตรมานี,ต.ทรายขาว อ.สอยดาว จ.จันทบุรี ,06:00 ,9
สถานีเมืองพังงา,ต.ถ้ำน้ำผุด อ.เมืองพังงา จ.พังงา ,06:00 ,9
สถานีรร.ผังปาล์ม 4,ต.ปาล์มพัฒนา อ.มะนัง จ.สตูล ,06:00 ,9
สถานีหน่วยพิทักษ์อุทยานแห่งชาติที่ ผท.๑ (ปากบอก),ต.บ้านร้อง อ.งาว จ.ลำปาง ,06:00 ,8.8
สถานีสะพานกรุงเทพ,ต.ดาวคะนอง อ.ธนบุรี จ.กรุงเทพมหานคร ,06:00 ,8.8
สถานีที่ทำการอุทยานแห่งชาติถ้ำสะเกิน,ต.ยอด อ.สองแคว จ.น่าน ,06:00 ,8.6
สถานีบ้านน้ำเย็น,ต.หินแก้ว อ.ท่าแซะ จ.ชุมพร ,06:00 ,8.6
สถานีอุทยานแห่งชาติภูจองนายอย,ต.นาจะหลวย อ.นาจะหลวย จ.อุบลราชธานี ,06:00 ,8.6
สถานีบ้านเสรีราษฎร์,ต.ช่องแคบ อ.พบพระ จ.ตาก ,06:00 ,8.5
สถานีบ้านม่อนหัวฝาย,ต.บ้านด่านนาขาม อ.เมืองอุตรดิตถ์ จ.อุตรดิตถ์ ,06:00 ,8.5
สถานีเขตดุสิต,ต.ดุสิต อ.ดุสิต จ.กรุงเทพมหานคร ,06:00 ,8.5
สถานีบ้านปากรอง*,ต.ชาติตระการ อ.ชาติตระการ จ.พิษณุโลก ,05:00 ,8.5
สถานีบ้านมรสวบ,ต.ชัยเกษม อ.บางสะพาน จ.ประจวบคีรีขันธ์ ,06:00 ,8.5
สถานีบ้านโกรกอีดก,ต.ชะอม อ.แก่งคอย จ.สระบุรี ,06:00 ,8.4
สถานีเมืองชุมพร,ต.หาดพันไกร อ.เมืองชุมพร จ.ชุมพร ,06:00 ,8.4
สถานีสถานีพัฒนาการเกษตรที่สูง ฯ ภูพยัคฆ์,ต.ขุนน่าน อ.เฉลิมพระเกียรติ จ.น่าน ,06:00 ,8.4
สถานีทต.ตันหยงมัส,ต.ตันหยงมัส อ.ระแงะ จ.นราธิวาส ,06:00 ,8.4
สถานีคลองภาษีเจริญ เพชรเกษม69,ต.หลักสอง อ.บางแค จ.กรุงเทพมหานคร ,06:00 ,8
สถานีบ้านดูลาเปอร์,ต.ห้วยห้อม อ.แม่ลาน้อย จ.แม่ฮ่องสอน ,06:00 ,8
สถานีบ้านห้วยบอน,ต.บ้านโหนด อ.สะบ้าย้อย จ.สงขลา ,06:00 ,8
สถานีจุดวัด ค.แสนแสบ-เขตบางกะปิ,ต.หัวหมาก อ.บางกะปิ จ.กรุงเทพมหานคร ,06:00 ,8
สถานีบ่อสูบศาลอาญารัชดา,ต.จอมพล อ.จตุจักร จ.กรุงเทพมหานคร ,06:00 ,8
สถานีบ้านห้วยกล้า,ต.วาวี อ.แม่สรวย จ.เชียงราย ,06:00 ,8
สถานีเมืองสมุทรสาคร,ต.ท่าจีน อ.เมืองสมุทรสาคร จ.สมุทรสาคร ,06:00 ,8
สถานีบ้านคลองมะนาว,ต.ท่าเกวียน อ.วัฒนานคร จ.สระแก้ว ,05:00 ,8
สถานีบ้านโคกสะอาด,ต.นายางกลัก อ.เทพสถิต จ.ชัยภูมิ ,06:00 ,8
สถานีทต.กรอกสมบูรณ์,ต.กรอกสมบูรณ์ อ.ศรีมหาโพธิ จ.ปราจีนบุรี ,06:00 ,8
สถานีบ้านใสเขือ,ต.เขาพระ อ.พิปูน จ.นครศรีธรรมราช ,06:00 ,8
สถานีบ้านบางกา,ต.กะเปา อ.คีรีรัฐนิคม จ.สุราษฎร์ธานี ,05:00 ,8
สถานีศูนย์อปพร. ทต.บ้านธิ,ต.บ้านธิ อ.บ้านธิ จ.ลำพูน ,06:00 ,7.8
สถานีคลองอ้อมนนท์ บางใหญ่ (ถนนบางกรวย-ไทรน้อย),ต.บางม่วง อ.บางใหญ่ จ.นนทบุรี ,06:00 ,7.8
สถานีบ้านโพธิ์ประสิทธิ์,ต.ถ้ำพรรณรา อ.ถ้ำพรรณรา จ.นครศรีธรรมราช ,05:00 ,7.5
สถานีบ้านวังกะทะ,ต.วังกะทะ อ.ปากช่อง จ.นครราชสีมา ,06:00 ,7.5
สถานีบ้านห้วยมะบวบ,ต.แม่ยวมน้อย อ.ขุนยวม จ.แม่ฮ่องสอน ,06:00 ,7.5
สถานีทต.สุไหงโก-ลก,ต.สุไหงโก-ลก อ.สุไหงโก-ลก จ.นราธิวาส ,06:00 ,7.2
สถานีอบต.ด่านชุมพล,ต.ด่านชุมพล อ.บ่อไร่ จ.ตราด ,06:00 ,7.2
สถานีสัตหีบ,ต.พลูตาหลวง อ.สัตหีบ จ.ชลบุรี ,04:00 ,7.1
สถานีบ้านโคกแมว,ต.โคกม่วง อ.เขาชัยสน จ.พัทลุง ,05:00 ,7
สถานีบ้านโป่งน้ำร้อน,ต.แม่เจดีย์ใหม่ อ.เวียงป่าเป้า จ.เชียงราย ,06:00 ,7
สถานีบ้านนาพรุ,ต.นาคา อ.สุขสำราญ จ.ระนอง ,05:00 ,7
สถานีบ้านโป่งสอ,ต.น้ำกุ่ม อ.นครไทย จ.พิษณุโลก ,06:00 ,7
สถานีบ้านนาเปรื่อง,ต.บ่อเกลือใต้ อ.บ่อเกลือ จ.น่าน ,06:00 ,7
สถานีบ้านเผี่ยนบน,ต.เทพราช อ.สิชล จ.นครศรีธรรมราช ,06:00 ,7
สถานีบ้านช่องเหรียง,ต.บ้านนิคม อ.บางขัน จ.นครศรีธรรมราช ,06:00 ,7
สถานีจุดวัด ค.ทวีฯ-ค.ภาษีฯ,ต.หนองแขม อ.หนองแขม จ.กรุงเทพมหานคร ,06:00 ,7
สถานีจุดวัดสวนเบญจสิริ,ต.คลองตัน อ.คลองเตย จ.กรุงเทพมหานคร ,06:00 ,7
สถานีบ้านแซะ,ต.สะกอม อ.เทพา จ.สงขลา ,06:00 ,7
สถานีบ้านบางมะขาม,ต.อ่างทอง อ.เกาะสมุย จ.สุราษฎร์ธานี ,05:00 ,7
สถานีบ้านห้วยครก,ต.เขาปู่ อ.ศรีบรรพต จ.พัทลุง ,06:00 ,7
สถานีอบต.คลองพา,ต.คลองพา อ.ท่าชนะ จ.สุราษฎร์ธานี ,06:00 ,7
สถานีบ้านเทพพนา,ต.นายางกลัก อ.เทพสถิต จ.ชัยภูมิ ,06:00 ,7
สถานีบ้านด่าน,ต.บ้านด่าน อ.อรัญประเทศ จ.สระแก้ว ,06:00 ,7
สถานีคลองนาท่อม,ต.ร่มเมือง อ.เมืองพัทลุง จ.พัทลุง ,06:00 ,6.8
สถานีลพบุรี,ต.ทะเลชุบศร อ.เมืองลพบุรี จ.ลพบุรี ,04:00 ,6.7
สถานีปากช่อง สกษ.,ต.หนองน้ำแดง อ.ปากช่อง จ.นครราชสีมา ,04:00 ,6.7
สถานีบางปะหัน,ต.โพธิ์สามต้น อ.บางปะหัน จ.พระนครศรีอยุธยา ,06:00 ,6.6
สถานีบ้านบางเหรียงใต้,ต.บางเหรียง อ.ทับปุด จ.พังงา ,05:00 ,6.5
สถานีบ้านมาบตอง,ต.หนองละลอก อ.บ้านค่าย จ.ระยอง ,05:00 ,6.5
สถานีเขตราษฎร์บูรณะ,ต.ราษฎร์บูรณะ อ.ราษฎร์บูรณะ จ.กรุงเทพมหานคร ,06:00 ,6.5
สถานีเขตบางพลัด,ต.บางอ้อ อ.บางพลัด จ.กรุงเทพมหานคร ,06:00 ,6.5
สถานีปตร.คลองสองสายใต้,ต.สายไหม อ.สายไหม จ.กรุงเทพมหานคร ,06:00 ,6.5
สถานีบ้านวังโป่ง,ต.วังใต้ อ.วังเหนือ จ.ลำปาง ,06:00 ,6.5
สถานีบ้านแม่โถหลวง,ต.บ่อสลี อ.ฮอด จ.เชียงใหม่ ,06:00 ,6.5
สถานีบ้านนอก,ต.กงหรา อ.กงหรา จ.พัทลุง ,06:00 ,6.5
สถานีเขตบางบอน,ต.บางบอน อ.บางบอน จ.กรุงเทพมหานคร ,06:00 ,6.5
สถานีบ้านกองลอย,ต.บ่อสลี อ.ฮอด จ.เชียงใหม่ ,06:00 ,6.5
สถานีบ้านบึงไม้,ต.ชะอม อ.แก่งคอย จ.สระบุรี ,05:00 ,6.5
สถานีเขตปทุมวัน,ต.วังใหม่ อ.ปทุมวัน จ.กรุงเทพมหานคร ,06:00 ,6.5
สถานีบ้านน้ำริน,ต.สบป่อง อ.ปางมะผ้า จ.แม่ฮ่องสอน ,06:00 ,6.5
สถานีบ้านสลาแด,ต.ห้วยกระทิง อ.กรงปินัง จ.ยะลา ,05:00 ,6.5
สถานีบ้านดงโคร่ง,ต.หินดาด อ.ทองผาภูมิ จ.กาญจนบุรี ,06:00 ,6.5
สถานีบ้านชมภูเหนือ,ต.ชมพู อ.เนินมะปราง จ.พิษณุโลก ,06:00 ,6.5
สถานีบ้านวังยาว,ต.ปากช่อง อ.หล่มสัก จ.เพชรบูรณ์ ,06:00 ,6.5
สถานีสะพานแม่น้ำน่าน บ้านเปียงก่อ,ต.ขุนน่าน อ.เฉลิมพระเกียรติ จ.น่าน ,06:00 ,6.4
สถานีอบต.ทุ่งคาวัด,ต.ทุ่งคาวัด อ.ละแม จ.ชุมพร ,06:00 ,6.4
สถานีอบต.คลองขนาน,ต.คลองขนาน อ.เหนือคลอง จ.กระบี่ ,06:00 ,6.4
สถานีอบต.มะนังดาลำ,ต.มะนังดาลำ อ.สายบุรี จ.ปัตตานี ,06:00 ,6.2
สถานีสะพานข้ามคลองห้วยกรวด,ต.เกาะขันธ์ อ.ชะอวด จ.นครศรีธรรมราช ,06:00 ,6.2
สถานีทต.โป่งน้ำร้อน,ต.โป่งน้ำร้อน อ.โป่งน้ำร้อน จ.จันทบุรี ,06:00 ,6.2
สถานีปากคลองตลาด,ต.พระบรมมหาราชวัง อ.พระนคร จ.กรุงเทพมหานคร ,06:00 ,6
สถานีชุมชนบ้านท่าด่าน,ต.ดอนรัก อ.หนองจิก จ.ปัตตานี ,06:00 ,6
สถานีชุมชนบ้านควน 2,ต.พร่อน อ.เมืองยะลา จ.ยะลา ,06:00 ,6
สถานีวัดปากเตลิด,ต.ต้นยวน อ.พนม จ.สุราษฎร์ธานี ,05:00 ,6
สถานีรร.บ้านช้างเชื่อ,ต.เหล อ.กะปง จ.พังงา ,06:00 ,6
สถานีเขตทวีวัฒนา,ต.ทวีวัฒนา อ.ทวีวัฒนา จ.กรุงเทพมหานคร ,06:00 ,6
สถานีจุดวัด ถ.เทศบาลสงเคราะห์,ต.ลาดยาว อ.จตุจักร จ.กรุงเทพมหานคร ,06:00 ,6
สถานีส.คลองสามเสน,ต.ถนนนครไชยศรี อ.ดุสิต จ.กรุงเทพมหานคร ,06:00 ,6
สถานีส.คลองบางกอกใหญ่,ต.วัดอรุณ อ.บางกอกใหญ่ จ.กรุงเทพมหานคร ,06:00 ,6
สถานีโครงการจุฬาภรณ์พัฒนา 7 อ.ธารโต จ.ยะลา,ต.แม่หวาด อ.ธารโต จ.ยะลา ,02:00 ,6
สถานีบ้านทุ่ง,ต.อ่าวนาง อ.เมืองกระบี่ จ.กระบี่ ,05:00 ,6
สถานีรร.ตชด.บ้านไอร์บือแต,ต.ช้างเผือก อ.จะแนะ จ.นราธิวาส ,06:00 ,5.8
สถานีทต.ปากตะโก,ต.ปากตะโก อ.ทุ่งตะโก จ.ชุมพร ,06:00 ,5.8
สถานีอโศก,ต.คลองเตยเหนือ อ.วัฒนา จ.กรุงเทพมหานคร ,06:00 ,5.6
สถานีคลองนราภิรมย์ (บางเลน),ต.นราภิรมย์ อ.บางเลน จ.นครปฐม ,06:00 ,5.6
สถานีสะพานข้ามน้ำมูล,ต.โขงเจียม อ.โขงเจียม จ.อุบลราชธานี ,06:00 ,5.6
สถานีอบต.หินดาด,ต.หินดาด อ.ทองผาภูมิ จ.กาญจนบุรี ,06:00 ,5.6
สถานีบ้านชะรัด,ต.ชะรัด อ.กงหรา จ.พัทลุง ,06:00 ,5.5
สถานีบ้านหลักเขต,ต.หนองสาหร่าย อ.ปากช่อง จ.นครราชสีมา ,06:00 ,5.5
สถานีบ้านไร่,ต.ทุ่งหวัง อ.เมืองสงขลา จ.สงขลา ,06:00 ,5.5
สถานีบ้านยุปอีปูน,ต.วังหมี อ.วังน้ำเขียว จ.นครราชสีมา ,06:00 ,5.5
สถานีบ้านน้ำแคะ,ต.ดงพญา อ.บ่อเกลือ จ.น่าน ,05:00 ,5.5
สถานีบ้านห้วยแหน,ต.ห้วยใหญ่ อ.เมืองเพชรบูรณ์ จ.เพชรบูรณ์ ,19:00 ,5.5
สถานีปตร.คลองลาดพร้าว,ต.วังทองหลาง อ.วังทองหลาง จ.กรุงเทพมหานคร ,06:00 ,5.5
สถานีบ้านป่าเลา,ต.แม่หอพระ อ.แม่แตง จ.เชียงใหม่ ,06:00 ,5.5
สถานีหมู่บ้านเศรษฐกิจ ซอย 26,ต.บางแคเหนือ อ.บางแค จ.กรุงเทพมหานคร ,06:00 ,5.5
สถานีบ้านเชี่ยวหมอน,ต.พนม อ.พนม จ.สุราษฎร์ธานี ,05:00 ,5.5
สถานีบ้านหัวเตย,ต.ท่าอุแท อ.กาญจนดิษฐ์ จ.สุราษฎร์ธานี ,05:00 ,5.5
สถานีบ้านเหล่ากอหก,ต.เหล่ากอหก อ.นาแห้ว จ.เลย ,05:00 ,5.5
สถานีสงขลา,ต.บ่อยาง อ.เมืองสงขลา จ.สงขลา ,04:00 ,5.4
สถานีอบต.อ่าวตง,ต.อ่าวตง อ.วังวิเศษ จ.ตรัง ,06:00 ,5.2
สถานีเทศบาลเมืองเกาะสมุย,ต.อ่างทอง อ.เกาะสมุย จ.สุราษฎร์ธานี ,06:00 ,5.2
สถานีหน่วยจัดการต้นน้ำแม่เผอะ (อ่างขาง),ต.แม่งอน อ.ฝาง จ.เชียงใหม่ ,06:00 ,5.2
สถานีอบต.ทับปุด,ต.ทับปุด อ.ทับปุด จ.พังงา ,06:00 ,5.2
สถานีสะเดา,ต.ท่าโพธิ์ อ.สะเดา จ.สงขลา ,06:00 ,5.2
สถานีอบต.พลูตาหลวง,ต.พลูตาหลวง อ.สัตหีบ จ.ชลบุรี ,06:00 ,5
สถานีบ้านคลองฉนวนจันทร์,ต.ดุสิต อ.ถ้ำพรรณรา จ.นครศรีธรรมราช ,05:00 ,5
สถานีประปาหมู่บ้านมหาราช,ต.แม่พูล อ.ลับแล จ.อุตรดิตถ์ ,06:00 ,5
สถานีบ้านบูโล๊ะสะนีแย,ต.บ้านแหร อ.ธารโต จ.ยะลา ,05:00 ,5
สถานีบ้านหนองหว้า,ต.ทุ่งยาว อ.ปะเหลียน จ.ตรัง ,06:00 ,5
สถานีบ้านแกน้อย,ต.แม่นะ อ.เชียงดาว จ.เชียงใหม่ ,06:00 ,5
สถานีสะพานน้ำยาว บ้านสองแคว,ต.นาไร่หลวง อ.สองแคว จ.น่าน ,06:00 ,5
สถานีบ้านทำเนียบ,ต.ลำพะยา อ.เมืองยะลา จ.ยะลา ,05:00 ,5
สถานีส.เทเวศร์,ต.วัดสามพระยา อ.พระนคร จ.กรุงเทพมหานคร ,06:00 ,5
สถานีบ้านคลองทราย,ต.วังน้ำเขียว อ.วังน้ำเขียว จ.นครราชสีมา ,06:00 ,5
สถานีบ้านเจ้าพ่อเขาตก,ต.พุกร่าง อ.พระพุทธบาท จ.สระบุรี ,06:00 ,5
สถานีอบต.บ้านแมด,ต.บ้านแมด อ.บุณฑริก จ.อุบลราชธานี ,06:00 ,4.8
สถานีทม.ระนอง,ต.เขานิเวศน์ อ.เมืองระนอง จ.ระนอง ,06:00 ,4.8
สถานีหน่วยพิทักษ์อุทยานแห่งชาติที่ นค.๑ (บ้านคลองยน),ต.สำนักแต้ว อ.สะเดา จ.สงขลา ,05:00 ,4.8
สถานีระนอง,ต.บางนอน อ.เมืองระนอง จ.ระนอง ,04:00 ,4.7
สถานีสามพราน,ต.หอมเกร็ด อ.สามพราน จ.นครปฐม ,06:00 ,4.6
สถานีเขตห้ามล่าสัตว์ป่าเขาชีโอน,ต.นาจอมเทียน อ.สัตหีบ จ.ชลบุรี ,06:00 ,4.6
สถานีศรีสาคร,ต.ศรีสาคร อ.ศรีสาคร จ.นราธิวาส ,06:00 ,4.6
สถานีทต.ตะเคียนทอง,ต.ตะเคียนทอง อ.เขาคิชฌกูฏ จ.จันทบุรี ,06:00 ,4.6
สถานีคลองนางน้อย,ต.นาโยงใต้ อ.เมืองตรัง จ.ตรัง ,06:00 ,4.6
สถานีบ้านหว้าหลัง,ต.สะท้อน อ.นาทวี จ.สงขลา ,05:00 ,4.5
สถานีบ้านหมากปรก,ต.ไม้ขาว อ.ถลาง จ.ภูเก็ต ,06:00 ,4.5
สถานีบ้านถ้ำพริก,ต.บ้านแยง อ.นครไทย จ.พิษณุโลก ,06:00 ,4.5
สถานีปตร.คลองทวีวัฒนา,ต.ศาลายา อ.พุทธมณฑล จ.นครปฐม ,06:00 ,4.5
สถานีบ้านสบเติ๋น,ต.สบป้าด อ.แม่เมาะ จ.ลำปาง ,06:00 ,4.5
สถานีบ้านเหนือ,ต.กำพวน อ.สุขสำราญ จ.ระนอง ,05:00 ,4.5
สถานีบ้านประจำไม้,ต.ห้วยเขย่ง อ.ทองผาภูมิ จ.กาญจนบุรี ,06:00 ,4.5
