ชื่อสถานี,ที่ตั้ง,เวลา,ฝนล่าสุด (มม.)
สถานีอบต.ไม้รูด,ต.ไม้รูด อ.คลองใหญ่ จ.ตราด ,06:00 ,131.4
สถานีนครพนม,ต.ในเมือง อ.เมืองนครพนม จ.นครพนม ,04:00 ,99.3
สถานีบางพระ,ต.หนองเสม็ด อ.เมืองตราด จ.ตราด ,06:00 ,83.8
สถานีวังกระแจะ,ต.เนินทราย อ.เมืองตราด จ.ตราด ,06:00 ,80
สถานีเปร็ดใน,ต.ห้วงน้ำขาว อ.เมืองตราด จ.ตราด ,06:00 ,79.8
สถานีสะพานข้ามน้ำมูล,ต.โขงเจียม อ.โขงเจียม จ.อุบลราชธานี ,06:00 ,66
สถานีบ้านน้ำมี,ต.น้ำทูน อ.ท่าลี่ จ.เลย ,06:00 ,66
สถานีบ้านขุนห้วยแม่เปา,ต.แม่เปา อ.พญาเม็งราย จ.เชียงราย ,06:00 ,65.5
สถานีอบต.แก้ง,ต.แก้ง อ.เดชอุดม จ.อุบลราชธานี ,06:00 ,62.4
สถานีสะพานห้วยบังบาต,ต.หนองเดิ่น อ.บุ่งคล้า จ.บึงกาฬ ,06:00 ,59
สถานีทต.หนองเลิง,ต.หนองเลิง อ.บึงกาฬ จ.บึงกาฬ ,06:00 ,57.8
สถานีบ้านน้ำริน,ต.สบป่อง อ.ปางมะผ้า จ.แม่ฮ่องสอน ,06:00 ,56
สถานีบ้านปะตงล่าง (เขาสอยดาว),ต.ทรายขาว อ.สอยดาว จ.จันทบุรี ,06:00 ,54.5
สถานีอบต.วังงิ้ว,ต.วังงิ้ว อ.ดงเจริญ จ.พิจิตร ,06:00 ,52
สถานีทต.เนินมะปราง,ต.เนินมะปราง อ.เนินมะปราง จ.พิษณุโลก ,06:00 ,51.6
สถานีบ้านสลักเพชรเหนือ,ต.เกาะช้างใต้ อ.เกาะช้าง จ.ตราด ,04:00 ,50
สถานีบ้านกงษีไร่ (หมู่ 6),ต.ซึ้ง อ.ขลุง จ.จันทบุรี ,03:00 ,49.5
สถานีบ้านมุงเหนือ,ต.บ้านมุง อ.เนินมะปราง จ.พิษณุโลก ,06:00 ,49
สถานีเหนือฝายหัวนา,ต.หนองแก้ว อ.กันทรารมย์ จ.ศรีสะเกษ ,06:00 ,48.8
สถานีบ้านห้วยทรายเหนือ,ต.ห้วยเฮี้ย อ.นครไทย จ.พิษณุโลก ,05:00 ,47.5
สถานีทต.แม่เมาะ,ต.แม่เมาะ อ.แม่เมาะ จ.ลำปาง ,06:00 ,47
สถานีบ้านกอก,ต.ภูคา อ.ปัว จ.น่าน ,00:00 ,46.5
สถานีห้วยแร้ง,ต.ห้วยแร้ง อ.เมืองตราด จ.ตราด ,06:00 ,46.4
สถานีบ้านตาบาด,ต.บ่อพลอย อ.บ่อไร่ จ.ตราด ,06:00 ,46
สถานีบ้านโคกสะอาด,ต.นายางกลัก อ.เทพสถิต จ.ชัยภูมิ ,05:00 ,46
สถานีท้ายฝายหัวนา,ต.หนองแก้ว อ.กันทรารมย์ จ.ศรีสะเกษ ,06:00 ,46
สถานีทต.หนองบอน,ต.หนองบอน อ.บ่อไร่ จ.ตราด ,06:00 ,46
สถานีอบต.บ้านผึ้ง,ต.บ้านผึ้ง อ.เมืองนครพนม จ.นครพนม ,06:00 ,45.2
สถานีอุทยานแห่งชาติภูจองนายอย,ต.นาจะหลวย อ.นาจะหลวย จ.อุบลราชธานี ,06:00 ,41.4
สถานีอบต.สะตอ,ต.สะตอ อ.เขาสมิง จ.ตราด ,06:00 ,41.2
สถานีอ่างเก็บน้ำห้วยดินทราย,ต.หนองแวง อ.ละหานทราย จ.บุรีรัมย์ ,06:00 ,40.6
สถานีบ้านพญากองดี,ต.ศรีถ้อย อ.แม่สรวย จ.เชียงราย ,06:00 ,40.5
สถานีบ้านหนองบอน,ต.หนองบอน อ.บ่อไร่ จ.ตราด ,06:00 ,40.5
สถานีบ้านหัวฝาย,ต.บ้านดู่ อ.เมืองเชียงราย จ.เชียงราย ,06:00 ,40
สถานีบ้านขุนต้า,ต.ตับเต่า อ.เทิง จ.เชียงราย ,06:00 ,39.5
สถานีบ้านแม่มอญ,ต.ห้วยชมภู อ.เมืองเชียงราย จ.เชียงราย ,06:00 ,38.5
สถานีลำน้ำยัง,ต.แวง อ.โพนทอง จ.ร้อยเอ็ด ,06:00 ,37.8
สถานีสถานีควบคุมไฟป่าภูสิงห์ภูผาผึ้ง-ภูสระดอกบัว,ต.หนองมะแซว อ.เมืองอำนาจเจริญ จ.อำนาจเจริญ ,06:00 ,37.4
สถานีทต.เกาะช้าง,ต.เกาะช้าง อ.เกาะช้าง จ.ตราด ,06:00 ,36.8
สถานีฝายจิตรมานี,ต.ทรายขาว อ.สอยดาว จ.จันทบุรี ,06:00 ,36.6
สถานีเขตรักษาพันธุ์สัตว์ป่าเขาสอยดาว,ต.ทรายขาว อ.สอยดาว จ.จันทบุรี ,06:00 ,36.4
สถานีเหมืองปิล๊อก,ต.ปีล็อก อ.ทองผาภูมิ จ.กาญจนบุรี ,05:00 ,36
สถานีพลิ้ว สกษ.,ต.ตะปอน อ.ขลุง จ.จันทบุรี ,04:00 ,35.7
สถานีหนองบัวลำภู,ต.ลำภู อ.เมืองหนองบัวลำภู จ.หนองบัวลำภู ,04:00 ,35.3
สถานีลำโดมใหญ่ บ้านนาเยีย,ต.นาเยีย อ.นาเยีย จ.อุบลราชธานี ,05:00 ,35
สถานีทต.ไพศาลี,ต.ไพศาลี อ.ไพศาลี จ.นครสวรรค์ ,06:00 ,34.6
สถานีบ้านแม่กาไร่เดียว,ต.แม่กา อ.เมืองพะเยา จ.พะเยา ,05:00 ,34.5
สถานีเมืองตาก,ต.ประดาง อ.วังเจ้า จ.ตาก ,06:00 ,33.4
สถานีเมืองตราด,ต.ห้วยแร้ง อ.เมืองตราด จ.ตราด ,06:00 ,33.2
สถานีทต.กันทรารมย์,ต.ดูน อ.กันทรารมย์ จ.ศรีสะเกษ ,06:00 ,33
สถานีอบต.ละหานทราย,ต.ละหานทราย อ.ละหานทราย จ.บุรีรัมย์ ,06:00 ,33
สถานีอบต.กังแอน,ต.กังแอน อ.ปราสาท จ.สุรินทร์ ,06:00 ,32.8
สถานีบ้านดอนชัย,ต.แม่ทา อ.แม่ออน จ.เชียงใหม่ ,06:00 ,32.5
สถานีบ้านปงป่าป๋อ,ต.เสริมขวา อ.เสริมงาม จ.ลำปาง ,05:00 ,32
สถานีบ้านสะโทย,ต.วังสรรพรส อ.ขลุง จ.จันทบุรี ,06:00 ,31.5
สถานีอบต.บางปิด,ต.บางปิด อ.แหลมงอบ จ.ตราด ,06:00 ,31.2
สถานีอบต.นาคำไฮ,ต.นาคำไฮ อ.เมืองหนองบัวลำภู จ.หนองบัวลำภู ,06:00 ,31.2
สถานีหน่วยพิทักษ์อุทยานฯ ที่ นน.๖ (ถ้ำใหญ่น้ำหนาว),ต.หลักด่าน อ.น้ำหนาว จ.เพชรบูรณ์ ,06:00 ,31.2
สถานีบ้านซับสมบูรณ์,ต.วังข่อย อ.ไพศาลี จ.นครสวรรค์ ,05:00 ,31
สถานีบ้านขุนป๋วย,ต.แม่วิน อ.แม่วาง จ.เชียงใหม่ ,23:00 ,31
สถานีบ้านสามัคคีใหม่,ต.แม่ฟ้าหลวง อ.แม่ฟ้าหลวง จ.เชียงราย ,06:00 ,30
สถานีทต.พลิ้ว,ต.พลิ้ว อ.แหลมสิงห์ จ.จันทบุรี ,06:00 ,29.8
สถานีบ้านเสาแดง,ต.แจ่มหลวง อ.กัลยาณิวัฒนา จ.เชียงใหม่ ,06:00 ,29.5
สถานีทต.สังคม,ต.แก้งไก่ อ.สังคม จ.หนองคาย ,06:00 ,29.4
สถานีรพสต.บ้านโคกอุดม,ต.หนองกี่ อ.กบินทร์บุรี จ.ปราจีนบุรี ,06:00 ,29.4
สถานีบ้านมะม่วง,ต.นนทรีย์ อ.บ่อไร่ จ.ตราด ,05:00 ,29
สถานีอบต.บ้านหนองตางู,ต.หนองตางู อ.บรรพตพิสัย จ.นครสวรรค์ ,06:00 ,28.8
สถานีทต.ลานหอย,ต.ลานหอย อ.บ้านด่านลานหอย จ.สุโขทัย ,06:00 ,28.4
สถานีจันทบุรี,ต.วัดใหม่ อ.เมืองจันทบุรี จ.จันทบุรี ,04:00 ,28.3
สถานีอบต.บ้านกาด,ต.บ้านกาด อ.แม่วาง จ.เชียงใหม่ ,06:00 ,28.2
สถานีบ้านใหม่,ต.เวียงเหนือ อ.ปาย จ.แม่ฮ่องสอน ,06:00 ,28
สถานีเขื่อนสิรินธร,ต.นิคมสร้างตนเอง อ.สิรินธร จ.อุบลราชธานี ,05:00 ,28
สถานีอ.ตระการพืชผล,ต.ขุหลุ อ.ตระการพืชผล จ.อุบลราชธานี ,05:00 ,28
สถานีบ้านแม่ช่อฟ้า,ต.ทุ่งผึ้ง อ.แจ้ห่ม จ.ลำปาง ,05:00 ,28
สถานีบ้านเขาอ่าง,ต.มาบไพ อ.ขลุง จ.จันทบุรี ,06:00 ,28
สถานีอบต.ดงพระรามณ์,ต.ดงพระราม อ.เมืองปราจีนบุรี จ.ปราจีนบุรี ,06:00 ,28
สถานีบ้านปางต้นฆ้อง,ต.แม่อาย อ.แม่อาย จ.เชียงใหม่ ,06:00 ,27.5
สถานีบ้านท่าแพ,ต.เมือง อ.เมืองเลย จ.เลย ,06:00 ,27.5
สถานีอบต.ท่าเสา,ต.ท่าเสา อ.โพทะเล จ.พิจิตร ,06:00 ,27.2
สถานีบ้านแม่ตืน,ต.แม่ตืน อ.ลี้ จ.ลำพูน ,06:00 ,27
สถานีเทศบาลตำบลหอไกร,ต.หอไกร อ.บางมูลนาก จ.พิจิตร ,06:00 ,27
สถานีเขื่อนอุบลรัตน์,ต.เขื่อนอุบลรัตน์ อ.อุบลรัตน์ จ.ขอนแก่น ,05:00 ,27
สถานีนครพนม สกษ.,ต.ในเมือง อ.เมืองนครพนม จ.นครพนม ,04:00 ,27
สถานีอบต.หนองนาง,ต.หนองนาง อ.ท่าบ่อ จ.หนองคาย ,06:00 ,27
สถานีอุทยานแห่งชาติป่าหินงาม,ต.บ้านไร่ อ.เทพสถิต จ.ชัยภูมิ ,06:00 ,26.6
สถานีอบต.ป่าแฝก,ต.ป่าแฝก อ.พรเจริญ จ.บึงกาฬ ,06:00 ,26.6
สถานีบ้านเทพพนา,ต.นายางกลัก อ.เทพสถิต จ.ชัยภูมิ ,00:00 ,26.5
สถานีบ้านฝางแล้ง,ต.ขุนฝาง อ.เมืองอุตรดิตถ์ จ.อุตรดิตถ์ ,06:00 ,26.5
สถานีทต.ไชยปราการ,ต.ปงตำ อ.ไชยปราการ จ.เชียงใหม่ ,06:00 ,26.4
สถานีอบต.ด่านชุมพล,ต.ด่านชุมพล อ.บ่อไร่ จ.ตราด ,06:00 ,26.2
สถานีบ้านห้วยลาด,ต.หลักด่าน อ.น้ำหนาว จ.เพชรบูรณ์ ,05:00 ,26
สถานีบ้านนาหนุน 3,ต.แสนทอง อ.ท่าวังผา จ.น่าน ,06:00 ,26
สถานีบ้านเลยวังไสย์,ต.เลยวังไสย์ อ.ภูหลวง จ.เลย ,05:00 ,26
สถานีบ้านแม่ฮวก,ต.ไหล่หิน อ.เกาะคา จ.ลำปาง ,05:00 ,26
สถานีบ้านป่าเห่ว,ต.บ้านขอ อ.เมืองปาน จ.ลำปาง ,06:00 ,26
สถานีบ้านหนองคล้า,ต.ชำผักแพว อ.แก่งคอย จ.สระบุรี ,06:00 ,25.5
สถานีบ้านแม่นาจร*,ต.แม่นาจร อ.แม่แจ่ม จ.เชียงใหม่ ,05:00 ,25.5
สถานีบ้านตะบกเตี้ย,ต.ฉมัน อ.มะขาม จ.จันทบุรี ,06:00 ,25.5
สถานีที่ทำการอุทยานแห่งชาติเวียงโกศัย,ต.แม่เกิ๋ง อ.วังชิ้น จ.แพร่ ,06:00 ,25.4
สถานีอบต.เวียงตาล,ต.เวียงตาล อ.ห้างฉัตร จ.ลำปาง ,06:00 ,25.4
สถานีอบต.บึงสามพัน,ต.บึงสามพัน อ.บึงสามพัน จ.เพชรบูรณ์ ,06:00 ,25.2
สถานีบ้านในปง,ต.อ่าวตง อ.วังวิเศษ จ.ตรัง ,06:00 ,25
สถานีอบต.ทุ่งสมอ,ต.ทุ่งสมอ อ.เขาค้อ จ.เพชรบูรณ์ ,06:00 ,25
สถานีบ้านร่องกล้า,ต.เนินเพิ่ม อ.นครไทย จ.พิษณุโลก ,05:00 ,25
สถานีมุกดาหาร,ต.มุกดาหาร อ.เมืองมุกดาหาร จ.มุกดาหาร ,04:00 ,24.7
สถานีเมืองเลย,ต.ชัยพฤกษ์ อ.เมืองเลย จ.เลย ,06:00 ,24.6
สถานีชุมชนบ้านแม่ละอุป,ต.แม่แดด อ.แม่แจ่ม จ.เชียงใหม่ ,06:00 ,24.6
สถานีบ้านดอยล้าน,ต.วาวี อ.แม่สรวย จ.เชียงราย ,06:00 ,24.5
สถานีบ้านคลองสน,ต.เกาะช้าง อ.เกาะช้าง จ.ตราด ,05:00 ,24.5
สถานีตราด,ต.คลองใหญ่ อ.คลองใหญ่ จ.ตราด ,04:00 ,24.3
สถานีบ้านทุ่งขาม,ต.ใหม่พัฒนา อ.เกาะคา จ.ลำปาง ,05:00 ,24
สถานีบ้านปางป่าคา,ต.แม่แรม อ.แม่ริม จ.เชียงใหม่ ,06:00 ,24
สถานีลำพะเนียง อ.เมือง,ต.หนองบัว อ.เมืองหนองบัวลำภู จ.หนองบัวลำภู ,05:00 ,24
สถานีบ้านท่าเดื่อ,ต.นิคมกระเสียว อ.ด่านช้าง จ.สุพรรณบุรี ,05:00 ,23.5
สถานีบ้านแพมบก,ต.ทุ่งยาว อ.ปาย จ.แม่ฮ่องสอน ,06:00 ,23.5
สถานีเมืองจันทบุรี,ต.จันทนิมิต อ.เมืองจันทบุรี จ.จันทบุรี ,06:00 ,23.2
สถานีทต.ปัถวี,ต.ปัถวี อ.มะขาม จ.จันทบุรี ,06:00 ,23.2
สถานีบ้านปางไม้แดง,ต.บ้านช้าง อ.แม่แตง จ.เชียงใหม่ ,06:00 ,23
สถานีบ้านห้วยติ้ว,ต.ลาดค่าง อ.ภูเรือ จ.เลย ,06:00 ,23
สถานีห้วยยัง,ต.ไค้นุ่น อ.ห้วยผึ้ง จ.กาฬสินธุ์ ,06:00 ,22.8
สถานีบ้านเมืองนะ,ต.แม่นะ อ.เชียงดาว จ.เชียงใหม่ ,06:00 ,22.5
สถานีปราจีนบุรี,ต.หน้าเมือง อ.เมืองปราจีนบุรี จ.ปราจีนบุรี ,04:00 ,22.5
สถานีบ้านทาทุ่งไผ่*,ต.ทาปลาดุก อ.แม่ทา จ.ลำพูน ,05:00 ,22.5
สถานีบ้านสวนป่าทุ่งเกวียน,ต.เวียงตาล อ.ห้างฉัตร จ.ลำปาง ,06:00 ,22.5
สถานีบ้านดุง,ต.นาคำ อ.บ้านดุง จ.อุดรธานี ,06:00 ,22.2
สถานีดอยมูเซอร์ สกษ.,ต.แม่ท้อ อ.เมืองตาก จ.ตาก ,04:00 ,22.1
สถานีบ้านเมืองน้อย,ต.เวียงเหนือ อ.ปาย จ.แม่ฮ่องสอน ,06:00 ,22
สถานีบ้านซับแม็ก,ต.หนองน้ำใส อ.วัฒนานคร จ.สระแก้ว ,06:00 ,22
สถานีบ้านมาบป่าแฝก,ต.ตลุกกลางทุ่ง อ.เมืองตาก จ.ตาก ,06:00 ,22
สถานีอบต.คำตากล้า,ต.คำตากล้า อ.คำตากล้า จ.สกลนคร ,06:00 ,21.6
สถานีบ้านวังอ้ายโพธิ์,ต.บ้านไร่ อ.เทพสถิต จ.ชัยภูมิ ,05:00 ,21.5
สถานีบ้านท่าวังแคน,ต.ศรีสองรัก อ.เมืองเลย จ.เลย ,06:00 ,21.5
สถานีรร. คำอาฮวนศรีสุราษฎร์วิทยา,ต.คำอาฮวน อ.เมืองมุกดาหาร จ.มุกดาหาร ,06:00 ,21
สถานีชุมชนแม่ตาลน้อย,ต.เวียงตาล อ.ห้างฉัตร จ.ลำปาง ,06:00 ,20.8
สถานีบ้านโนนเขวา,ต.โนนทอง อ.เกษตรสมบูรณ์ จ.ชัยภูมิ ,05:00 ,20.5
สถานีบ้านบ่อหอย,ต.ยาบหัวนา อ.เวียงสา จ.น่าน ,06:00 ,20.5
สถานีวัดบ้านน้ำเย็น,ต.เมือง อ.กันทรลักษ์ จ.ศรีสะเกษ ,06:00 ,20.2
สถานีอุบลราชธานี สกษ.,ต.ท่าช้าง อ.สว่างวีระวงศ์ จ.อุบลราชธานี ,04:00 ,20.1
สถานีบ้านไผ่โทน,ต.ไผ่โทน อ.ร้องกวาง จ.แพร่ ,06:00 ,20
สถานีชุมชนบ้านบุ่งคล้า,ต.บุ่งคล้า อ.บุ่งคล้า จ.บึงกาฬ ,06:00 ,20
สถานีสะพานห้วยหลวง,ต.วัดหลวง อ.โพนพิสัย จ.หนองคาย ,06:00 ,19.8
สถานีรพสต.บ้านหนองไคร้,ต.หนองตอง อ.หางดง จ.เชียงใหม่ ,06:00 ,19.8
สถานีอบต.บึงชำอ้อ,ต.บึงชำอ้อ อ.หนองเสือ จ.ปทุมธานี ,06:00 ,19.8
สถานีบ้านนาลานข้าว,ต.วังยาว อ.ด่านซ้าย จ.เลย ,06:00 ,19.5
สถานีบ้านห้วยน้ำเค็ม,ต.บ้านเสด็จ อ.เมืองลำปาง จ.ลำปาง ,05:00 ,19.5
สถานีบ้านห้วยธนู,ต.ตาลชุม อ.ท่าวังผา จ.น่าน ,06:00 ,19.5
สถานีบ้านใหม่ศรีจำปา,ต.หนองหมากฝ้าย อ.วัฒนานคร จ.สระแก้ว ,05:00 ,19
สถานีเมืองปราจีนบุรี,ต.หน้าเมือง อ.เมืองปราจีนบุรี จ.ปราจีนบุรี ,06:00 ,19
สถานีบ้านป่าข้าวหลาม,ต.นาโป่ง อ.เมืองเลย จ.เลย ,05:00 ,19
สถานีบ้านหุบผึ้ง,ต.ห้วยทราย อ.เมืองประจวบคีรีขันธ์ จ.ประจวบคีรีขันธ์ ,06:00 ,19
สถานีอบต.พังทุย,ต.พังทุย อ.น้ำพอง จ.ขอนแก่น ,06:00 ,19
สถานีปาย,ต.เวียงเหนือ อ.ปาย จ.แม่ฮ่องสอน ,06:00 ,18.8
สถานีบ้านนางแลใน (บ้านลิไข่),ต.บ้านดู่ อ.เมืองเชียงราย จ.เชียงราย ,06:00 ,18.5
สถานีบ้านแม่ฮี้,ต.แม่ฮี้ อ.ปาย จ.แม่ฮ่องสอน ,05:00 ,18.5
สถานีเหนือปตร.พระนารายน์,ต.ท่าหลวง อ.ท่าเรือ จ.พระนครศรีอยุธยา ,06:00 ,18.4
สถานีบ้านห้วยป่าซาง,ต.กื้ดช้าง อ.แม่แตง จ.เชียงใหม่ ,02:00 ,18
สถานีท่อทองแดง1,ต.หนองปลิง อ.เมืองกำแพงเพชร จ.กำแพงเพชร ,06:00 ,18
สถานีท้ายปตร.พระนารายน์,ต.ท่าหลวง อ.ท่าเรือ จ.พระนครศรีอยุธยา ,06:00 ,18
สถานีบ้านแม่ฉางข้าว,ต.ป่างิ้ว อ.เวียงป่าเป้า จ.เชียงราย ,06:00 ,18
สถานีบ้านปางหก,ต.อินทขิล อ.แม่แตง จ.เชียงใหม่ ,06:00 ,18
สถานีบ้านนาหลวง,ต.สะเอียบ อ.สอง จ.แพร่ ,06:00 ,18
สถานีทต.นาส่วง,ต.นาส่วง อ.เดชอุดม จ.อุบลราชธานี ,06:00 ,17.8
สถานีอบต.หนองขนาก,ต.หนองขนาก อ.ท่าเรือ จ.พระนครศรีอยุธยา ,06:00 ,17.8
สถานีบ้านโป่งก้อนเส้า,ต.ท่ามะปราง อ.แก่งคอย จ.สระบุรี ,06:00 ,17.5
สถานีบ้านเมืองแพม,ต.ถ้ำลอด อ.ปางมะผ้า จ.แม่ฮ่องสอน ,06:00 ,17.5
สถานีบ้านห้วยไค้,ต.โคกใหญ่ อ.ท่าลี่ จ.เลย ,06:00 ,17.5
สถานีบ้านห้วยบง,ต.แจ่มหลวง อ.กัลยาณิวัฒนา จ.เชียงใหม่ ,06:00 ,17.5
สถานีบ้านห้วยกบ,ต.หนองลู อ.สังขละบุรี จ.กาญจนบุรี ,05:00 ,17.5
สถานีบ้านห้วยมะแกง,ต.ป่าแดด อ.แม่สรวย จ.เชียงราย ,06:00 ,17.5
สถานีบ้านไร่รวงทอง,ต.ปัว อ.ปัว จ.น่าน ,05:00 ,17.5
สถานีแม่หาด,ต.บ้านหลวง อ.จอมทอง จ.เชียงใหม่ ,06:00 ,17.4
สถานีทต.ตระการพืชผล,ต.กระเดียน อ.ตระการพืชผล จ.อุบลราชธานี ,06:00 ,17.2
สถานีอบต.นากอก,ต.นากอก อ.ศรีบุญเรือง จ.หนองบัวลำภู ,06:00 ,17.2
สถานีบ้านปางฮ่าง,ต.สบเปิง อ.แม่แตง จ.เชียงใหม่ ,06:00 ,17
