ชื่อสถานี,ที่ตั้ง,เวลา,ฝนล่าสุด (มม.),lat,long
รร.บ้านช้างเชื่อ,ต.เหล อ.กะปง จ.พังงา,00:00 น.,84.4,8.744328572596828,98.48950266838074
ตลาดเก่าตะกั่วป่า,ต.โคกเคียน อ.ตะกั่วป่า จ.พังงา,00:00 น.,80.4,8.829422267219035,98.36930751800537
รร.บ้านท่าหัน,ต.รมณีย์ อ.กะปง จ.พังงา,00:00 น.,63.2,8.82907241062152,98.49199175834656
ศูนย์พัฒนาเด็กเล็ก อบต.ท่านา,ต.ท่านา อ.กะปง จ.พังงา,00:00 น.,45.6,8.678465815115747,98.41659486293793
บ้านหญ้าปล้อง,ต.คลองศก อ.พนม จ.สุราษฎร์ธานี,18:00 น.,87.5,8.902614394692183,98.5720020532608
อบต.ทับปุด,ต.ทับปุด อ.ทับปุด จ.พังงา,00:00 น.,22,8.503283073904996,98.63018453121185
ทต.ลำแก่น,ต.ลำแก่น อ.ท้ายเหมือง จ.พังงา,00:00 น.,12.2,8.596785469242757,98.2572340965271
ตะกั่วป่า,ต.ตำตัว อ.ตะกั่วป่า จ.พังงา,00:00 น.,92.6,8.775848014071634,98.39027166366577
บ้านบางบอน,ต.คลองศก อ.พนม จ.สุราษฎร์ธานี,23:00 น.,39.5,8.883524046532198,98.6518943309784
ทต.ปลายพระยา,ต.ปลายพระยา อ.ปลายพระยา จ.กระบี่,00:00 น.,9.2,8.532817369367988,98.86408925056458
บ้านท่าคลอง,ต.เทศบาลเมืองกระบี่ อ.เมืองกระบี่ จ.กระบี่,23:00 น.,15.5,8.11049767570278,98.90815258026123
เขตรักษาพันธุ์สัตว์ป่าเขาสอยดาว,ต.ทรายขาว อ.สอยดาว จ.จันทบุรี,00:00 น.,5.2,13.10355505032165,102.1919596195221
ทม.ระนอง,ต.เขานิเวศน์ อ.เมืองระนอง จ.ระนอง,00:00 น.,33.2,9.96039173308519,98.63778591156006
เมืองพังงา,ต.ถ้ำน้ำผุด อ.เมืองพังงา จ.พังงา,00:00 น.,16.6,8.47732263303875,98.52831959724426
ทต.ปากน้ำ,ต.ปากน้ำ อ.เมืองระนอง จ.ระนอง,00:00 น.,24.6,9.946522084959314,98.59519243240356
หน่วยจัดการต้นน้ำขุนว้า,ต.ดงพญา อ.บ่อเกลือ จ.น่าน,00:00 น.,9.2,19.23685312903414,101.18393182754517
อบต.กะลาเส,ต.กะลาเส อ.สิเกา จ.ตรัง,00:00 น.,15.2,7.703953331556081,99.31808531284332
ทต.ชุมพร,ต.ชุมพร อ.เมยวดี จ.ร้อยเอ็ด,00:00 น.,31.2,16.368166885214062,104.05778467655182
อบต.คลองศก,ต.คลองศก อ.พนม จ.สุราษฎร์ธานี,00:00 น.,36.4,8.890472370265089,98.661367893219
ท่าสะบ้า,ต.ท่าสะบ้า อ.วังวิเศษ จ.ตรัง,00:00 น.,7.8,7.729373672629138,99.55148041248322
บ้านอ่าวกลาง,ต.วังมะปรางเหนือ อ.วังวิเศษ จ.ตรัง,23:00 น.,13,7.7690639783280915,99.36500251293182
บ้านบางเหรียงใต้,ต.บางเหรียง อ.ทับปุด จ.พังงา,23:00 น.,10.5,8.57841676184994,98.66092264652252
บ้านสะโทย,ต.วังสรรพรส อ.ขลุง จ.จันทบุรี,23:00 น.,11.5,12.561464683682239,102.26500153541565
ระนอง,ต.บางนอน อ.เมืองระนอง จ.ระนอง,22:00 น.,27.1,9.983332157111594,98.6166661977768
บ้านปลายคลองวัน,ต.ปากจั่น อ.กระบุรี จ.ระนอง,23:00 น.,2.5,10.510740579784967,98.85878384113312
หน่วยจัดการต้นน้ำลำพะยัง,ต.ภูแล่นช้าง อ.นาคู จ.กาฬสินธุ์,00:00 น.,17.2,16.682789445243674,103.9574646949768
บ้านเทพพนม,ต.กระบี่น้อย อ.เมืองกระบี่ จ.กระบี่,23:00 น.,25.5,8.253119298226189,98.96900117397308
สะพานห้วยบังบาต,ต.หนองเดิ่น อ.บุ่งคล้า จ.บึงกาฬ,00:00 น.,0.4,18.28267449137665,103.88073205947876
หน่วยพิทักษ์ป่าคลองมอญ,ต.เขาพัง อ.บ้านตาขุน จ.สุราษฎร์ธานี,22:00 น.,26,9.080310051749054,98.63234102725983
ตะกั่วป่า,ต.คึกคัก อ.ตะกั่วป่า จ.พังงา,22:00 น.,41,8.68416649612894,98.25222373008728
อบต.บางหิน,ต.บางหิน อ.กะเปอร์ จ.ระนอง,00:00 น.,42.4,9.536912860680799,98.57948005199432
บ้านบางแป้น2,ต.วังมะปราง อ.วังวิเศษ จ.ตรัง,23:00 น.,14.5,7.624588695775571,99.41400110721588
บ้านบางเหลียว,ต.คีรีวง อ.ปลายพระยา จ.กระบี่,23:00 น.,7.5,8.450033895239834,98.84243309497833
บ้านห้วยต่อ,ต.ไม้ฝาด อ.สิเกา จ.ตรัง,23:00 น.,22.5,7.5424173978897855,99.39799904823303
บ้านดงบัง,ต.มหาไชย อ.สมเด็จ จ.กาฬสินธุ์,23:00 น.,41,16.79374115022801,103.79499793052673
วังวิเศษ,ต.เขาวิเศษ อ.วังวิเศษ จ.ตรัง,00:00 น.,13.4,7.668914138249084,99.45938408374786
บ้านไทรห้อย*,ต.นาเมืองเพชร อ.สิเกา จ.ตรัง,23:00 น.,23,7.553845639092956,99.49482679367065
บ้านย่านตะเคียน*,ต.ไทรโสภา อ.พระแสง จ.สุราษฎร์ธานี,23:00 น.,14,8.576098729686892,99.05148446559906
หน่วยพิทักษ์ป่าคลองหยา,ต.เขาพัง อ.บ้านตาขุน จ.สุราษฎร์ธานี,11:00 น.,47,9.224761691082803,98.60640943050385
จุดชมวิว 1715,ต.ภูคา อ.ปัว จ.น่าน,00:00 น.,16.8,19.17482180172219,101.10614240169525
อบต.ไม้รูด,ต.ไม้รูด อ.คลองใหญ่ จ.ตราด,00:00 น.,0.6,11.927422543017489,102.77906835079193
หน่วยพิทักษ์ป่าเขาพัง,ต.เขาพัง อ.บ้านตาขุน จ.สุราษฎร์ธานี,20:00 น.,29,9.031821583025614,98.67944061756134
บ้านบางหอย,ต.เขาต่อ อ.ปลายพระยา จ.กระบี่,23:00 น.,10,8.641120240987867,98.77699792385101
ทต.อัคคะคำ,ต.อัคคะคำ อ.โพธิ์ชัย จ.ร้อยเอ็ด,00:00 น.,3.6,16.38087441958714,103.75480234622955
กระบี่,ต.เหนือคลอง อ.เหนือคลอง จ.กระบี่,22:00 น.,10.4,8.10360955811047,98.97527754306793
บ้านย่านยาว,ต.เชี่ยวเหลียง อ.กะเปอร์ จ.ระนอง,23:00 น.,31.5,9.577555631627357,98.66617441177368
บ้านบางทอง,ต.บางทอง อ.ท้ายเหมือง จ.พังงา,23:00 น.,46,8.385255881970396,98.36069226264954
อบต.บางใหญ่,ต.บางใหญ่ อ.กระบุรี จ.ระนอง,00:00 น.,7.6,10.306385095174132,98.77074837684631
บ้านช่องไม้ดำ,ต.คลองหิน อ.อ่าวลึก จ.กระบี่,23:00 น.,15,8.306130027517616,98.88599753379822
สะพานลำน้ำเลย,ต.เชียงคาน อ.เชียงคาน จ.เลย,00:00 น.,13.4,17.860984828776644,101.61144375801086
ห้วยยัง,ต.ไค้นุ่น อ.ห้วยผึ้ง จ.กาฬสินธุ์,00:00 น.,9.2,16.604435109734034,103.96214783191681
มะนัง,ต.นิคมพัฒนา อ.มะนัง จ.สตูล,00:00 น.,9.2,6.940724973105533,99.87255156040192
พระแสง,ต.ไทรขึง อ.พระแสง จ.สุราษฎร์ธานี,00:00 น.,0.6,8.537438031212913,99.18096005916595
บ้านช่องเหรียง,ต.บ้านนิคม อ.บางขัน จ.นครศรีธรรมราช,23:00 น.,35,7.9549580498339765,99.48799788951874
มูศ๊อลลา(มัสยิด)ชูฮาดา,ต.ควนกาหลง อ.ควนกาหลง จ.สตูล,00:00 น.,36.8,6.964240053044196,100.02702534198761
ทต.บ่อเกลือใต้,ต.บ่อเกลือใต้ อ.บ่อเกลือ จ.น่าน,00:00 น.,22,19.079867913814528,101.15381062030792
บ้านทุ่ง,ต.อ่าวนาง อ.เมืองกระบี่ จ.กระบี่,23:00 น.,22,8.050455037175501,98.80316019058228
รร.ผังปาล์ม 4,ต.ปาล์มพัฒนา อ.มะนัง จ.สตูล,00:00 น.,18.8,7.022373037559082,99.93093252182007
เมืองตรัง,ต.บางรัก อ.เมืองตรัง จ.ตรัง,00:00 น.,18.2,7.555903648091325,99.57824349403381
รร.บ้านหนองคล้า,ต.เขาวิเศษ อ.วังวิเศษ จ.ตรัง,00:00 น.,14.8,7.618532602250628,99.44906294345856
บ้านวังสมบูรณ์,ต.เขาปูน อ.ห้วยยอด จ.ตรัง,23:00 น.,20.5,7.77448010965501,99.7040069103241
ทต.หันคา,ต.หันคา อ.หันคา จ.ชัยนาท,17:00 น.,6,14.969656483991646,100.0103634595871
เมืองระนอง,ต.เขานิเวศน์ อ.เมืองระนอง จ.ระนอง,00:00 น.,18.8,9.961654502157119,98.64457190036774
ภูเก็ต (ศูนย์ฯ),ต.ไม้ขาว อ.ถลาง จ.ภูเก็ต,22:00 น.,7.2,8.145000215301025,98.31444561481476
บ้านปากแพรก,ต.ละอุ่นเหนือ อ.ละอุ่น จ.ระนอง,23:00 น.,17,10.083470155482825,98.80165815353394
อบต.ช่องสามหมอ,ต.ช่องสามหมอ อ.แก้งคร้อ จ.ชัยภูมิ,00:00 น.,5.8,16.116698233577686,102.23190307617188
บ้านซอย 8,ต.ควนกาหลง อ.ควนกาหลง จ.สตูล,23:00 น.,29,6.881953444932882,99.99722063541412
เวียงสระ,ต.ทุ่งหลวง อ.เวียงสระ จ.สุราษฎร์ธานี,00:00 น.,1.8,8.571075394942238,99.25392687320709
บ้านกลาง,ต.ละมอ อ.นาโยง จ.ตรัง,23:00 น.,11.5,7.62349339462261,99.78299796581268
บ้านวังประดิษฐ์,ต.เขาค่าย อ.สวี จ.ชุมพร,23:00 น.,6,10.092955693627337,98.8890016078949
บ้านคลองทรายขาว,ต.คลองยา อ.อ่าวลึก จ.กระบี่,23:00 น.,11.5,8.379025329510311,98.87924909591675
บ้านควนขวาง,ต.เขาวิเศษ อ.วังวิเศษ จ.ตรัง,23:00 น.,11,7.691035258048772,99.43600058555603
อบต.เขาค่าย,ต.เขาค่าย อ.สวี จ.ชุมพร,00:00 น.,1.4,10.121980970294628,98.89594316482544
อบต.คลองหิน,ต.คลองหิน อ.อ่าวลึก จ.กระบี่,00:00 น.,16.8,8.284190842832158,98.79711449146271
บ้านกอตง,ต.เขาดิน อ.เขาพนม จ.กระบี่,23:00 น.,6,8.352292262736324,99.06564652919769
บ้านบางหวาน,ต.กมลา อ.กะทู้ จ.ภูเก็ต,23:00 น.,16,7.942292146367634,98.29099774360657
บ้านต้นหาร,ต.หน้าเขา อ.เขาพนม จ.กระบี่,23:00 น.,9,8.309861637175134,98.96900117397308
แม่น้ำชี บ้านหินกอง,ต.โนนสมบูรณ์ อ.บ้านแฮด จ.ขอนแก่น,23:00 น.,3,16.248730274046427,102.74730026721954
อบต.คำตากล้า,ต.คำตากล้า อ.คำตากล้า จ.สกลนคร,03:00 น.,19,17.831087438291508,103.75676572322845
พระแสง สอท.,ต.ทุ่งหลวง อ.เวียงสระ จ.สุราษฎร์ธานี,22:00 น.,1.5,8.57022136880463,99.2582505941391
บ้านหน้าวัด,ต.ในเตา อ.ห้วยยอด จ.ตรัง,23:00 น.,3.5,7.872840576320857,99.72699880599976
หน่วยจัดการต้นน้ำภูเวียง,ต.สงเปือย อ.ภูเวียง จ.ขอนแก่น,00:00 น.,27.2,16.678000188878332,102.35429227352142
บ้านหินลาด,ต.คุระ อ.คุระบุรี จ.พังงา,23:00 น.,85.5,9.224830526602089,98.38440835475922
สกลนคร สกษ.,ต.ห้วยยาง อ.เมืองสกลนคร จ.สกลนคร,19:00 น.,14.6,17.125026816456536,104.06099796295166
บ้านกกเต็น,ต.ห้วยขมิ้น อ.ด่านช้าง จ.สุพรรณบุรี,23:00 น.,10.5,14.944707130365503,99.59500193595886
บ้านเขาหลัก,ต.ปากแจ่ม อ.ห้วยยอด จ.ตรัง,23:00 น.,0.5,7.724499167281783,99.7299975156784
บ้านโพนทอง,ต.เชียงกลม อ.ปากชม จ.เลย,23:00 น.,1.5,17.83072996601891,101.97700202465057
บ้านคกไผ่,ต.ปากชม อ.ปากชม จ.เลย,23:00 น.,23,18.041278402742414,101.85600221157074
บ้านเต๋ยกิ๋วเห็น,ต.ภูคา อ.ปัว จ.น่าน,23:00 น.,4.5,19.219611325292117,101.06199860572815
บ้านเวียคะดี้,ต.หนองลู อ.สังขละบุรี จ.กาญจนบุรี,23:00 น.,2.5,15.18440912927912,98.32573771476746
คลองนางน้อย,ต.นาโยงใต้ อ.เมืองตรัง จ.ตรัง,00:00 น.,9.4,7.568325941005462,99.65096890926361
บ้านบางพรวด,ต.ลำเลียง อ.กระบุรี จ.ระนอง,23:00 น.,2,10.246892688027577,98.85000228881836
อบต.อ่าวตง,ต.อ่าวตง อ.วังวิเศษ จ.ตรัง,00:00 น.,2.4,7.855777434070519,99.38441097736359
ชุมชนบ้านบุ่งคล้า,ต.บุ่งคล้า อ.บุ่งคล้า จ.บึงกาฬ,00:00 น.,0.6,18.29479179980859,103.99483323097229
บ้านคลองพนม,ต.คลองศก อ.พนม จ.สุราษฎร์ธานี,23:00 น.,23,8.79296123483613,98.70307087898254
บ้านห้วยตม,ต.บ้านตึก อ.ศรีสัชนาลัย จ.สุโขทัย,23:00 น.,36.5,17.669156298409597,99.92999911308289
บ้านย่านอุดม,ต.ทุ่งไทรทอง อ.ลำทับ จ.กระบี่,23:00 น.,17.5,8.010334899212314,99.32934522628784
บ้านตะเคียนงาม,ต.บางหิน อ.กะเปอร์ จ.ระนอง,23:00 น.,53,9.519417467150856,98.5732626914978
ปะเหลียน,ต.ท่าพญา อ.ปะเหลียน จ.ตรัง,00:00 น.,31,7.371984583452164,99.67727601528168
ทต.วังใหม่,ต.วังใหม่ อ.เมืองชุมพร จ.ชุมพร,00:00 น.,2.6,10.503825754504339,98.98582398891449
สตูล,ต.คลองขุด อ.เมืองสตูล จ.สตูล,22:00 น.,9.4,6.649997507273774,100.08333563804626
ตรัง,ต.โคกหล่อ อ.เมืองตรัง จ.ตรัง,22:00 น.,23.8,7.516666852969395,99.61666882038116
บ้านในช่อง,ต.สองแพรก อ.ชัยบุรี จ.สุราษฎร์ธานี,23:00 น.,2.5,8.491637436378953,99.13899958133698
บ้านเบญจา,ต.พลูเถื่อน อ.พนม จ.สุราษฎร์ธานี,23:00 น.,14,8.764656134965433,98.76092076301575
บ้านห้วยหลักลาย,ต.อวน อ.ปัว จ.น่าน,23:00 น.,21.5,18.985863940765253,101.06500267982483
บ้านปาล์มทองพัฒนา,ต.ปาล์มพัฒนา อ.มะนัง จ.สตูล,23:00 น.,15,7.004132051006968,99.93900060653687
บ้านแม่แสลป,ต.แม่สลองใน อ.แม่ฟ้าหลวง จ.เชียงราย,23:00 น.,1.5,20.184078823012726,99.70799803733826
แม่น้ำชี ฝายมหาสารคาม,ต.หนองบัว อ.โกสุมพิสัย จ.มหาสารคาม,23:00 น.,4,16.370271998542666,102.95232832431793
วัดปากเตลิด,ต.ต้นยวน อ.พนม จ.สุราษฎร์ธานี,23:00 น.,7,8.844720196715253,98.83999228477478
บ้านหน้าเขา,ต.บ้านเสด็จ อ.เคียนซา จ.สุราษฎร์ธานี,23:00 น.,2.5,8.768393868250856,99.05316352844238
บ้านลิพัง,ต.ลิพัง อ.ปะเหลียน จ.ตรัง,23:00 น.,33,7.163564602240865,99.78799760341644
ทต.ห้วยยอด,ต.ห้วยยอด อ.ห้วยยอด จ.ตรัง,00:00 น.,11.4,7.789128295093799,99.63350772857666
สะเดา,ต.ท่าโพธิ์ อ.สะเดา จ.สงขลา,22:00 น.,9.6,6.796685598103971,100.44238686561584
สะพานธรรมจักร(วัดธรรมามูล),ต.ธรรมามูล อ.เมืองชัยนาท จ.ชัยนาท,17:00 น.,8.2,15.250288223058444,100.08346438407898
อบต.ชัยบุรี,ต.ชัยบุรี อ.ชัยบุรี จ.สุราษฎร์ธานี,00:00 น.,2,8.450633494145993,99.08304333686829
บ้านทุ่งปรือ,ต.พะตง อ.หาดใหญ่ จ.สงขลา,23:00 น.,7,6.815909341697662,100.55419206619263
บ้านก่อก๋วง,ต.บ่อเกลือใต้ อ.บ่อเกลือ จ.น่าน,23:00 น.,11,19.181043719488734,101.12100183963776
อบต.หนองไผ่,ต.หนองไผ่ อ.หนองไผ่ จ.เพชรบูรณ์,00:00 น.,0.2,15.98167996109794,101.07371985912323
บ้านท่าโต้,ต.เขามีเกียรติ อ.สะเดา จ.สงขลา,23:00 น.,14,6.756744204333447,100.53400039672852
บ้านม่วง,ต.ห้วยหลัว อ.บ้านม่วง จ.สกลนคร,02:00 น.,0.6,17.821563132196786,103.38696420192719
บ้านเขาไว้ข้าว,ต.ดินแดง อ.ลำทับ จ.กระบี่,23:00 น.,7.5,8.011052028529933,99.39000070095062
บ้านน้ำหรา,ต.ทุ่งนุ้ย อ.ควนกาหลง จ.สตูล,23:00 น.,17.5,6.899783781385745,100.09400010108948
บ้านสว้านเหนือ,ต.ดงพญา อ.บ่อเกลือ จ.น่าน,23:00 น.,13.5,19.23526274448346,101.19100213050842
อบต.ไม้ขาว,ต.ไม้ขาว อ.ถลาง จ.ภูเก็ต,00:00 น.,24,8.181979471710564,98.29884588718414
บ้านหนักไทร*,ต.ช่อง อ.นาโยง จ.ตรัง,23:00 น.,13.5,7.539471213420921,99.75286602973938
อบต.คลองขนาน,ต.คลองขนาน อ.เหนือคลอง จ.กระบี่,00:00 น.,15,8.005304330681563,99.01387989521027
เกาะลันตา,ต.เกาะลันตาใหญ่ อ.เกาะลันตา จ.กระบี่,22:00 น.,11.6,7.533334150038908,99.04999852180481
ภูเก็ต,ต.ตลาดใหญ่ อ.เมืองภูเก็ต จ.ภูเก็ต,22:00 น.,22.2,7.883335308018686,98.39999735355377
บ้านนาพรุ,ต.นาคา อ.สุขสำราญ จ.ระนอง,23:00 น.,46,9.431408485746166,98.46690773963928
ทต.เสริมงาม,ต.ทุ่งงาม อ.เสริมงาม จ.ลำปาง,16:00 น.,0.2,18.066259705652264,99.24944221973419
บ้านด่าน,ต.ปากแจ่ม อ.ห้วยยอด จ.ตรัง,23:00 น.,11.5,7.685097065610725,99.76223230361938
บ้านหัวควน,ต.สำนักแต้ว อ.สะเดา จ.สงขลา,23:00 น.,24,6.526956466246325,100.51212966442108
บ้านคูนายสังข์,ต.แค อ.จะนะ จ.สงขลา,23:00 น.,2.5,6.8337847605912945,100.61800181865692
บ้านดอกแดง,ต.บางไทร อ.ตะกั่วป่า จ.พังงา,23:00 น.,83.5,8.76229683729498,98.32100093364716
บ้านทุ่งลัง,ต.สะท้อน อ.นาทวี จ.สงขลา,23:00 น.,24,6.547064825729004,100.734001994133
เขตบางรัก,ต.สี่พระยา อ.บางรัก จ.กรุงเทพมหานคร,15:00 น.,36.5,13.73067226346534,100.52381873130798
บ้านเหนือ,ต.กำพวน อ.สุขสำราญ จ.ระนอง,23:00 น.,44,9.372710989812806,98.41488897800446
บ้านนาซ่าว,ต.นาซ่าว อ.เชียงคาน จ.เลย,23:00 น.,1.5,17.833870583642028,101.670001745224
บ้านควน,ต.พะโต๊ะ อ.พะโต๊ะ จ.ชุมพร,23:00 น.,10.5,9.78706623642024,98.78801107406616
บ้านใต้โตน,ต.บางสวรรค์ อ.พระแสง จ.สุราษฎร์ธานี,23:00 น.,11,8.62900149050225,98.98800194263458
สะเดา,ต.ท่าโพธิ์ อ.สะเดา จ.สงขลา,22:00 น.,35.9,6.796685598103971,100.44238686561584
บ้านทับคริสต์,ต.คลองชะอุ่น อ.พนม จ.สุราษฎร์ธานี,00:00 น.,15.4,8.725807999214425,98.8210129737854
ยางตลาด,ต.ดอนสมบูรณ์ อ.ยางตลาด จ.กาฬสินธุ์,00:00 น.,2.8,16.411046988475636,103.467076420784
บ้านทุ่งข่า,ต.ปะเหลียน อ.ปะเหลียน จ.ตรัง,23:00 น.,15.5,7.357221126789315,99.82599914073944
ฝายน้ำล้นคลองปะตง (ทน.),ต.ทรายขาว อ.สอยดาว จ.จันทบุรี,08:00 น.,0.6,13.120722942492842,102.21833109855652
รร.บ้านพูน,ต.กะปาง อ.ทุ่งสง จ.นครศรีธรรมราช,00:00 น.,9.4,8.038264841160766,99.64308857917786
บ้านควนโต๊ะเหลง,ต.ควนโดน อ.ควนโดน จ.สตูล,23:00 น.,17.5,6.80066464048702,100.07791221141815
บ้านผาลาด,ต.แม่กุ อ.แม่สอด จ.ตาก,23:00 น.,4,16.627001563768815,98.6029976606369
บ้านนางิ้ว,ต.นางิ้ว อ.สังคม จ.หนองคาย,23:00 น.,11.5,18.133775072129804,102.13358938694
อบต.ป่าแก่บ่อหิน,ต.ป่าแก่บ่อหิน อ.ทุ่งหว้า จ.สตูล,00:00 น.,27.2,7.056419899956487,99.80188071727753
ชุมชนจุมจัง,ต.จุมจัง อ.กุฉินารายณ์ จ.กาฬสินธุ์,00:00 น.,9.2,16.43070835983672,104.07318592071533
ทต.คุ้งสำเภา,ต.คุ้งสำเภา อ.มโนรมย์ จ.ชัยนาท,00:00 น.,0.2,15.31001034803882,100.08172631263733
เทศบาลตำบลเหนือ,ต.เหนือ อ.เมืองกาฬสินธุ์ จ.กาฬสินธุ์,00:00 น.,1.2,16.42524392225359,103.55971992015839
บ้านประตูเมือง,ต.แม่เงา อ.ขุนยวม จ.แม่ฮ่องสอน,17:00 น.,4.5,18.809016070755472,97.84900188446045
บ้านเชี่ยวหมอน,ต.พนม อ.พนม จ.สุราษฎร์ธานี,23:00 น.,8.5,8.83749537025456,98.7739884853363
อบต.บ้านลำนาว,ต.บ้านลำนาว อ.บางขัน จ.นครศรีธรรมราช,00:00 น.,6.8,8.029208271386919,99.47583138942719
รัษฎา,ต.ควนเมา อ.รัษฎา จ.ตรัง,00:00 น.,6.2,7.964069396117323,99.59781289100647
