ชื่อสถานี,ที่ตั้ง,เวลา,ฝนล่าสุด (มม.),lat,long
บ้านในแจะ,ต.พะโต๊ะ อ.พะโต๊ะ จ.ชุมพร,22:00 น.,45.5,9.745428370703605,98.75800251960754
บ้านทุ่งรวงทอง,ต.แม่ลาน้อย อ.แม่ลาน้อย จ.แม่ฮ่องสอน,00:00 น.,4,18.338043524218733,97.91999995708466
บ้านไตรสภาวคาม,ต.ปิงโค้ง อ.เชียงดาว จ.เชียงใหม่,07:00 น.,147,19.42965621679668,98.9790004491806
บ้านตาบาด,ต.บ่อพลอย อ.บ่อไร่ จ.ตราด,00:00 น.,0.5,12.601218641146362,102.567999958992
ผาชนะได (อช.ผาแต้ม),ต.นาโพธิ์กลาง อ.โขงเจียม จ.อุบลราชธานี,00:00 น.,37.8,15.6210839876549,105.61680257320404
อบต.ด่านชุมพล,ต.ด่านชุมพล อ.บ่อไร่ จ.ตราด,23:00 น.,0.6,12.444727581496986,102.63006627559662
บ้านจันทิ,ต.ท่ากุ่ม อ.เมืองตราด จ.ตราด,00:00 น.,3,12.294520989268896,102.61564671993256
บ้านคลองใหญ่,ต.จันทเขลม อ.เขาคิชฌกูฏ จ.จันทบุรี,00:00 น.,30,12.972159724378912,102.05771505832672
อบต.ขี้เหล็ก,ต.ขี้เหล็ก อ.เมืองอุบลราชธานี จ.อุบลราชธานี,00:00 น.,4.8,15.34234043702063,104.82157051563263
นครพนม,ต.ในเมือง อ.เมืองนครพนม จ.นครพนม,22:00 น.,0.9,17.410833254680195,104.7825014591217
นางรอง,ต.สะเดา อ.นางรอง จ.บุรีรัมย์,19:00 น.,1.4,14.583334258384767,102.80000030994415
ห้วยแร้ง,ต.ห้วยแร้ง อ.เมืองตราด จ.ตราด,00:00 น.,1.2,12.36929448720601,102.54332363605499
สะพานข้ามคลองเกรียงไกร,ต.บางเคียน อ.ชุมแสง จ.นครสวรรค์,14:00 น.,3,15.843174832021225,100.2114862203598
อบต.ขุนซ่อง,ต.ขุนซ่อง อ.แก่งหางแมว จ.จันทบุรี,00:00 น.,29.6,13.07400215476953,101.93758964538574
บ้านวังยายมุก,ต.คลองพลู อ.เขาคิชฌกูฏ จ.จันทบุรี,00:00 น.,39.5,12.927167674091777,102.01600134372711
แก่งหางแมว,ต.แก่งหางแมว อ.แก่งหางแมว จ.จันทบุรี,00:00 น.,1.2,12.986785878437146,101.89962029457092
บ้านน้ำหรา,ต.ทุ่งนุ้ย อ.ควนกาหลง จ.สตูล,00:00 น.,16,6.899783781385745,100.09400010108948
ทต.ปัถวี,ต.ปัถวี อ.มะขาม จ.จันทบุรี,00:00 น.,10.6,12.742613659767224,102.23267555236816
เมืองตราด,ต.ห้วยแร้ง อ.เมืองตราด จ.ตราด,00:00 น.,0.8,12.325197054747163,102.50044047832489
อบต.บางใหญ่,ต.บางใหญ่ อ.กระบุรี จ.ระนอง,00:00 น.,102.2,10.306385095174132,98.77074837684631
ทต.ตระการพืชผล,ต.กระเดียน อ.ตระการพืชผล จ.อุบลราชธานี,00:00 น.,13.8,15.621574783895413,105.02304196357727
อ่างเก็บน้ำคูขาด,ต.ประทัดบุ อ.ประโคนชัย จ.บุรีรัมย์,21:00 น.,0.8,14.559950097892262,102.95146465301514
ทต.ตะเคียนทอง,ต.ตะเคียนทอง อ.เขาคิชฌกูฏ จ.จันทบุรี,00:00 น.,44.2,12.91309226798377,102.08152770996094
สะพานข้ามลำปะเทีย,ต.อีสานเขต อ.เฉลิมพระเกียรติ จ.บุรีรัมย์,21:00 น.,0.6,14.617066622070004,102.90032029151917
อบต.แจ้ซ้อน,ต.แจ้ซ้อน อ.เมืองปาน จ.ลำปาง,00:00 น.,0.2,18.8169882633427,99.50003027915955
บ้านดงใหม่,ต.ห้วยห้อม อ.แม่ลาน้อย จ.แม่ฮ่องสอน,19:00 น.,28.5,18.34523327306563,98.10899913311005
พิบูลมังสาหาร,ต.โพธิ์ศรี อ.พิบูลมังสาหาร จ.อุบลราชธานี,00:00 น.,39.2,15.249656809997656,105.23926556110382
ทต.กันทรารมย์,ต.ดูน อ.กันทรารมย์ จ.ศรีสะเกษ,00:00 น.,1.8,15.105261822942218,104.5686274766922
บ้านนอกด่าน,ต.แม่พูล อ.ลับแล จ.อุตรดิตถ์,00:00 น.,16,17.715699350013672,99.98700141906738
บ้านปะตงล่าง (เขาสอยดาว),ต.ทรายขาว อ.สอยดาว จ.จันทบุรี,22:00 น.,40.5,13.09965213923344,102.19599902629852
รพสต.บ่อวิน,ต.บ่อวิน อ.ศรีราชา จ.ชลบุรี,16:00 น.,26.6,13.055022897626808,101.09784364700317
บ้านตะแบกโพรง,ต.อ่างทอง อ.ทับสะแก จ.ประจวบคีรีขันธ์,00:00 น.,7.5,11.444752573028023,99.47900176048279
บ้านโป่งเกตุ,ต.ขุนซ่อง อ.แก่งหางแมว จ.จันทบุรี,21:00 น.,20,13.146921781268546,101.97899758815765
บ้านโคกพลวง,ต.หนองโบสถ์ อ.นางรอง จ.บุรีรัมย์,21:00 น.,0.4,14.592325907636331,102.6676869392395
อบต.บ้านจารย์,ต.บ้านจารย์ อ.สังขะ จ.สุรินทร์,00:00 น.,13,14.566497290010979,103.74276995658875
บางปะกง,ต.ท่าสะอ้าน อ.บางปะกง จ.ฉะเชิงเทรา,00:00 น.,0.2,13.548937509988422,101.00112855434418
สะพานห้วยปากแซง,ต.สำโรง อ.โพธิ์ไทร จ.อุบลราชธานี,00:00 น.,30.2,15.931227030004395,105.33724665641785
บ้านทุ่งพล้อ,ต.ป่างิ้ว อ.ศรีสัชนาลัย จ.สุโขทัย,00:00 น.,8,17.541265830462546,99.78200018405914
บ้านห้วยน้ำอุ่น,ต.บ่อทอง อ.ทองแสนขัน จ.อุตรดิตถ์,17:00 น.,0.5,17.41133488006991,100.52100241184235
พิษณุโลก,ต.อรัญญิก อ.เมืองพิษณุโลก จ.พิษณุโลก,13:00 น.,25.4,16.79480422260323,100.27930855751038
ทต.ชุมพร,ต.ชุมพร อ.เมยวดี จ.ร้อยเอ็ด,00:00 น.,0.2,16.368166885214062,104.05778467655182
อ.ตระการพืชผล,ต.ขุหลุ อ.ตระการพืชผล จ.อุบลราชธานี,23:00 น.,52,15.614920528945607,105.01613795757294
บ้านอมพาย,ต.ป่าแป๋ อ.แม่สะเรียง จ.แม่ฮ่องสอน,19:00 น.,24,18.298250094472394,98.17199885845184
อบต.บ่อทอง,ต.บ่อทอง อ.บ่อทอง จ.ชลบุรี,00:00 น.,11,13.2416791395524,101.48822844028473
ทต.ศรีสงคราม,ต.ศรีสงคราม อ.ศรีสงคราม จ.นครพนม,19:00 น.,0.2,17.626998045813888,104.2614072561264
บ้านข่วงบุก,ต.ห้วยไร่ อ.เด่นชัย จ.แพร่,00:00 น.,2,17.88634898887624,100.04000186920166
อบต.ด่านม่วงคำ,ต.ด่านม่วงคำ อ.โคกศรีสุพรรณ จ.สกลนคร,23:00 น.,0.2,17.079245919564336,104.32588219642639
อบต.นาโพธิ์กลาง,ต.นาโพธิ์กลาง อ.โขงเจียม จ.อุบลราชธานี,00:00 น.,9.4,15.560386774053205,105.50188601016998
อบต.หนองกง,ต.หนองกง อ.นางรอง จ.บุรีรัมย์,20:00 น.,0.2,14.694603367299644,102.8882771730423
บ้านทาทุ่งไผ่*,ต.ทาปลาดุก อ.แม่ทา จ.ลำพูน,19:00 น.,0.5,18.52809919508312,99.23399806022644
แม่น้ำมูล ท้ายแก่งสะพือ (M.11B),ต.กุดชมภู อ.พิบูลมังสาหาร จ.อุบลราชธานี,23:00 น.,28,15.237349036372368,105.24523079395294
ทต.วังใหม่,ต.วังใหม่ อ.เมืองชุมพร จ.ชุมพร,00:00 น.,21,10.503825754504339,98.98582398891449
บ้านปลายคลองวัน,ต.ปากจั่น อ.กระบุรี จ.ระนอง,00:00 น.,32,10.510740579784967,98.85878384113312
บ้านชมภูเหนือ,ต.ชมพู อ.เนินมะปราง จ.พิษณุโลก,15:00 น.,11,16.695949005896747,100.65299928188324
ภูเก็ต,ต.ตลาดใหญ่ อ.เมืองภูเก็ต จ.ภูเก็ต,22:00 น.,20.4,7.883335308018686,98.39999735355377
อบต.ขะยูง,ต.ขะยูง อ.อุทุมพรพิสัย จ.ศรีสะเกษ,00:00 น.,1.8,15.121927416109157,104.24140334129333
บ้านกลุ่มตาขวัญ,ต.คลองไก่เถื่อน อ.คลองหาด จ.สระแก้ว,00:00 น.,8,13.339046035920902,102.31078147888184
สะพานข้ามน้ำมูล,ต.โขงเจียม อ.โขงเจียม จ.อุบลราชธานี,00:00 น.,33,15.310496707957482,105.49311518669128
บ้านหมาก,ต.มวกเหล็ก อ.มวกเหล็ก จ.สระบุรี,15:00 น.,20,14.689004411310385,101.19799733161926
อบต.นาตาล,ต.นาตาล อ.นาตาล จ.อุบลราชธานี,00:00 น.,22,15.901677652004713,105.27872622013092
ทต.บ้านนา,ต.บ้านนา อ.แกลง จ.ระยอง,00:00 น.,7.6,12.826844831138816,101.66963696479797
บ้านเหวปลากั้ง,ต.หมูสี อ.ปากช่อง จ.นครราชสีมา,16:00 น.,1,14.550141926737101,101.3129997253418
บ้านสุเม่นเหนือ,ต.แม่สิน อ.ศรีสัชนาลัย จ.สุโขทัย,00:00 น.,2,17.73185652874667,99.64600145816803
เมืองศรีสะเกษ,ต.เมืองเหนือ อ.เมืองศรีสะเกษ จ.ศรีสะเกษ,00:00 น.,2,15.118126243102001,104.31859731674194
บ้านว่านเหลือง,ต.ชากไทย อ.เขาคิชฌกูฏ จ.จันทบุรี,22:00 น.,1,12.809269565401573,102.07200050354004
วังทอง,ต.วังทอง อ.วังทอง จ.พิษณุโลก,17:00 น.,0.2,16.822169874937703,100.431609749794
อบต.ท่าเกวียน,ต.ท่าเกวียน อ.วัฒนานคร จ.สระแก้ว,00:00 น.,7.4,13.678299931465686,102.28500008583069
อรัญประเทศ,ต.ป่าไร่ อ.อรัญประเทศ จ.สระแก้ว,22:00 น.,0.4,13.699997637471801,102.58333146572113
บ้านปากคะยาง,ต.บ้านแก่ง อ.ศรีสัชนาลัย จ.สุโขทัย,00:00 น.,5.5,17.46932482276264,99.65100109577179
บ้านแม่แลบ,ต.แม่ลาน้อย อ.แม่ลาน้อย จ.แม่ฮ่องสอน,19:00 น.,0.5,18.37930921991803,97.8769987821579
อบต.ท่าแยก,ต.ท่าแยก อ.เมืองสระแก้ว จ.สระแก้ว,00:00 น.,21.6,13.907689234112915,102.09394633769989
ทต.โพทะเล,ต.โพทะเล อ.โพทะเล จ.พิจิตร,00:00 น.,17,16.093773752961166,100.26008784770966
เกาะสีชัง,ต.ท่าเทววงษ์ อ.เกาะสีชัง จ.ชลบุรี,22:00 น.,3.2,13.161668172600585,100.80194234848022
บ้านลำโชค,ต.บ้านแก่ง อ.ศรีสัชนาลัย จ.สุโขทัย,00:00 น.,0.5,17.44963354499241,99.60899770259857
บ้านแม่สุ,ต.แม่ลาหลวง อ.แม่ลาน้อย จ.แม่ฮ่องสอน,19:00 น.,0.5,18.481649254274878,97.90700197219849
บ้านบางหวาน,ต.กมลา อ.กะทู้ จ.ภูเก็ต,00:00 น.,55,7.942292146367634,98.29099774360657
บ้านร่องกล้า,ต.เนินเพิ่ม อ.นครไทย จ.พิษณุโลก,15:00 น.,16,16.98044726891171,101.02599799633026
บ้านเทพพนา,ต.นายางกลัก อ.เทพสถิต จ.ชัยภูมิ,15:00 น.,17,15.681303566302512,101.41100227832794
ฉะเชิงเทรา,ต.แปลงยาว อ.สนามชัยเขต จ.ฉะเชิงเทรา,16:00 น.,5.6,13.515558354856113,101.45833253860474
หน่วยศึกษาการพัฒนาการอนุรักษ์ต้นน้ำน้ำคาง (ดอยวาว),ต.ศรีภูมิ อ.ท่าวังผา จ.น่าน,00:00 น.,0.6,19.13900573802194,100.64089179039001
ศรีสัชนาลัย,ต.หาดเสี้ยว อ.ศรีสัชนาลัย จ.สุโขทัย,00:00 น.,9.8,17.517121550338416,99.75878298282623
บ้านหินลับ,ต.มวกเหล็ก อ.มวกเหล็ก จ.สระบุรี,15:00 น.,16,14.672585515840304,101.12699925899506
สะพานแม่น้ำน่าน บ้านเปียงก่อ,ต.ขุนน่าน อ.เฉลิมพระเกียรติ จ.น่าน,00:00 น.,10,19.432099655746182,101.15272164344788
บ้านวังประจัน,ต.วังประจัน อ.ควนโดน จ.สตูล,00:00 น.,23.5,6.754096598545849,100.14900147914886
คลองสำโรง บางเสาธง,ต.บางเสาธง อ.บางเสาธง จ.สมุทรปราการ,00:00 น.,13.6,13.589132309161357,100.80248951911926
บ้านน้ำจวง,ต.บ่อภาค อ.ชาติตระการ จ.พิษณุโลก,00:00 น.,1,17.438261989434718,100.67499876022339
บ้านหญ้าปล้อง,ต.คลองศก อ.พนม จ.สุราษฎร์ธานี,21:00 น.,59.5,8.902614394692183,98.5720020532608
ฝายจิตรมานี,ต.ทรายขาว อ.สอยดาว จ.จันทบุรี,00:00 น.,66.4,13.115493288601286,102.20316052436829
สุรินทร์,ต.ในเมือง อ.เมืองสุรินทร์ จ.สุรินทร์,19:00 น.,15.4,14.88333203516152,103.49999785423279
บ้านควนโต๊ะเหลง,ต.ควนโดน อ.ควนโดน จ.สตูล,00:00 น.,33,6.80066464048702,100.07791221141815
คลองพรหมโหด,ต.บ้านใหม่หนองไทร อ.อรัญประเทศ จ.สระแก้ว,00:00 น.,2.4,13.705839988268957,102.48168110847473
บ้านวังขอนงุ้น,ต.แม่สำ อ.ศรีสัชนาลัย จ.สุโขทัย,00:00 น.,22,17.639784074917838,99.68200206756592
บ้านควน,ต.พะโต๊ะ อ.พะโต๊ะ จ.ชุมพร,00:00 น.,27.5,9.78706623642024,98.78801107406616
อบต.ดอนยาง,ต.ดอนยาง อ.เมืองเพชรบุรี จ.เพชรบุรี,00:00 น.,0.4,13.01462964583763,99.97036099433899
เขื่อนน้ำพุง บ้านคำเพิ่ม ,ต.หลุบเลา อ.ภูพาน จ.สกลนคร,13:00 น.,14,16.97248961167977,103.98337483406067
อบต.หนองไผ่,ต.หนองไผ่ อ.หนองไผ่ จ.เพชรบูรณ์,00:00 น.,0.6,15.98167996109794,101.07371985912323
ทต.ราไวย์,ต.ราไวย์ อ.เมืองภูเก็ต จ.ภูเก็ต,00:00 น.,9.8,7.770802038287509,98.31874787807465
ลำน้ำยัง,ต.แวง อ.โพนทอง จ.ร้อยเอ็ด,00:00 น.,0.2,16.32054101661247,104.02246534824371
ทต.หนองบอน,ต.หนองบอน อ.บ่อไร่ จ.ตราด,00:00 น.,1.8,12.677049749346349,102.4595582485199
ศาลากลางหมู่บ้านในล๊อค,ต.ทองมงคล อ.บางสะพาน จ.ประจวบคีรีขันธ์,00:00 น.,12.2,11.181038447200688,99.35544312000275
บ้านหินลูกช้าง,ต.ทุ่งคาวัด อ.ละแม จ.ชุมพร,00:00 น.,63,9.778898731629297,98.95900189876556
บ้านโตนปาหนัน,ต.ทุ่งนุ้ย อ.ควนกาหลง จ.สตูล,14:00 น.,1.5,6.856985588604464,100.14900147914886
บ้านคลองมะนาว,ต.ท่าเกวียน อ.วัฒนานคร จ.สระแก้ว,00:00 น.,17.5,13.635336433923845,102.28066563606262
ทต.บางระกำเมืองใหม่,ต.บางระกำ อ.บางระกำ จ.พิษณุโลก,13:00 น.,13.4,16.748942893638333,100.0902771949768
บ้านโก๊ะไม้หลู่,ต.ป่าแป๋ อ.แม่สะเรียง จ.แม่ฮ่องสอน,20:00 น.,0.5,18.28337231579222,98.08400094509125
บ้านใหม่พัฒนา,ต.แม่อูคอ อ.ขุนยวม จ.แม่ฮ่องสอน,15:00 น.,13,18.842953664097216,97.99700081348419
สะพานมิตรภาพรับร่อ-หินแก้ว,ต.รับร่อ อ.ท่าแซะ จ.ชุมพร,00:00 น.,4.8,10.607479100186094,99.09539222717285
ปากช่อง สกษ.,ต.หนองน้ำแดง อ.ปากช่อง จ.นครราชสีมา,16:00 น.,0.5,14.64389100388953,101.33194148540497
อบต.ท่าข้าม,ต.ท่าข้าม อ.ท่าแซะ จ.ชุมพร,00:00 น.,4.2,10.620317970548133,99.12824392318726
อบต.วังน้ำเขียว,ต.วังน้ำเขียว อ.วังน้ำเขียว จ.นครราชสีมา,23:00 น.,0.2,14.374445554998045,101.86512172222137
บ้านตะบกเตี้ย,ต.ฉมัน อ.มะขาม จ.จันทบุรี,00:00 น.,30.5,12.822393592911787,102.23400056362152
สระแก้ว,ต.สระขวัญ อ.เมืองสระแก้ว จ.สระแก้ว,22:00 น.,19.4,13.788888811055795,102.03472316265106
หน่วยศึกษาการพัฒนาการอนุรักษ์ต้นน้ำแม่สูง,ต.นาพูน อ.วังชิ้น จ.แพร่,00:00 น.,18.4,17.80432616510933,99.82809126377106
อบต.หนองไร่,ต.หนองไร่ อ.ปลวกแดง จ.ระยอง,00:00 น.,2.8,13.001912953999406,101.356440782547
บ้านนากล่ำ,ต.น้ำไคร้ อ.น้ำปาด จ.อุตรดิตถ์,15:00 น.,12,17.584753226862645,100.49200236797333
บ้านห้วยกบ,ต.หนองลู อ.สังขละบุรี จ.กาญจนบุรี,00:00 น.,35.5,15.212612273165446,98.36849749088287
ทต.ช้างเผือก,ต.ช้างเผือก อ.เมืองเชียงใหม่ จ.เชียงใหม่,00:00 น.,0.6,18.81010274919089,98.96994531154633
หน่วยพิทักษ์ป่าคลองหยา,ต.เขาพัง อ.บ้านตาขุน จ.สุราษฎร์ธานี,23:00 น.,37,9.224761691082803,98.60640943050385
ทต.ทับช้าง,ต.ทับช้าง อ.สอยดาว จ.จันทบุรี,00:00 น.,11.8,13.23460873162573,102.18733012676239
เขตทุ่งครุ,ต.ทุ่งครุ อ.ทุ่งครุ จ.กรุงเทพมหานคร,00:00 น.,10,13.611349162956408,100.5087822675705
บ้านด่าน,ต.บ้านด่าน อ.อรัญประเทศ จ.สระแก้ว,00:00 น.,3,13.721552635457119,102.46502459049225
น้ำตกไทรคู่,ต.ทองมงคล อ.บางสะพาน จ.ประจวบคีรีขันธ์,00:00 น.,12,11.248086700351248,99.33547675609589
บ้านเวียคะดี้,ต.หนองลู อ.สังขละบุรี จ.กาญจนบุรี,00:00 น.,26.5,15.18440912927912,98.32573771476746
บ้านตึงเหนือ,ต.วังทอง อ.วังเหนือ จ.ลำปาง,17:00 น.,11,19.039208863872638,99.70799803733826
บ้านพันวาล 4,ต.รับร่อ อ.ท่าแซะ จ.ชุมพร,00:00 น.,20,10.796095307338822,98.9769995212555
บ้านตามูล,ต.ทรายขาว อ.สอยดาว จ.จันทบุรี,00:00 น.,10.5,13.081176476715976,102.26099967956543
หน่วยพิทักษ์อุทยานแห่งชาติที่ ผท.๑ (ปากบอก),ต.บ้านร้อง อ.งาว จ.ลำปาง,17:00 น.,11,19.058700491582382,99.77549850940704
เมืองสระแก้ว,ต.สระขวัญ อ.เมืองสระแก้ว จ.สระแก้ว,00:00 น.,6.4,13.80959170999193,102.05429255962372
ทต.ดอนตาล,ต.ดอนตาล อ.ดอนตาล จ.มุกดาหาร,00:00 น.,2.2,16.31839933007644,104.91894543170929
เขื่องใน,ต.เขื่องใน อ.เขื่องใน จ.อุบลราชธานี,00:00 น.,2,15.322458722986289,104.54648852348328
นาดี,ต.สะพานหิน อ.นาดี จ.ปราจีนบุรี,00:00 น.,12.2,14.133516875496335,101.72764241695404
ศูนย์พัฒนาเด็กเล็ก อบต.สูงเม่น,ต.สูงเม่น อ.สูงเม่น จ.แพร่,16:00 น.,0.4,18.062643807141527,100.09523928165436
ตรอน,ต.หาดสองแคว อ.ตรอน จ.อุตรดิตถ์,14:00 น.,10.6,17.418352382270644,100.13078927993774
บ้านป่ากล้วย,ต.แม่สะเรียง อ.แม่สะเรียง จ.แม่ฮ่องสอน,00:00 น.,10.5,18.164141105174696,97.95499742031097
บ้านสะโทย,ต.วังสรรพรส อ.ขลุง จ.จันทบุรี,00:00 น.,52,12.561464683682239,102.26500153541565
นครพนม สกษ.,ต.ในเมือง อ.เมืองนครพนม จ.นครพนม,22:00 น.,2.5,17.443057371476723,104.77361261844635
บ้านแม่สิน,ต.นาพูน อ.วังชิ้น จ.แพร่,00:00 น.,28.5,17.802293371173157,99.85799789428711
บ้านหัวเขา,ต.ห้วยยาง อ.ทับสะแก จ.ประจวบคีรีขันธ์,00:00 น.,2.5,11.662391939717557,99.63699996471405
อบต.หงษ์เจริญ,ต.หงษ์เจริญ อ.ท่าแซะ จ.ชุมพร,00:00 น.,11,10.779722624768084,99.19106662273407
บ้านกงรถ,ต.กงรถ อ.ห้วยแถลง จ.นครราชสีมา,00:00 น.,0.4,14.999401190402011,102.74900078773499
สะพานบังอี่,ต.โพธิ์ไทร อ.ดอนตาล จ.มุกดาหาร,00:00 น.,1.8,16.345832766161653,104.88988637924194
มัสยิดกาวมินมูฮายีริน,ต.ปาล์มพัฒนา อ.มะนัง จ.สตูล,00:00 น.,29.2,7.088324249082689,100.00195741653442
อบต.คลองศก,ต.คลองศก อ.พนม จ.สุราษฎร์ธานี,00:00 น.,45.8,8.890472370265089,98.661367893219
อบต.ละหานทราย,ต.ละหานทราย อ.ละหานทราย จ.บุรีรัมย์,22:00 น.,0.6,14.39569814527182,102.84723401069641
หน่วยพิทักษ์อุทยานแห่งชาติที่ ขญ.๑๗ (กลางดง),ต.พญาเย็น อ.ปากช่อง จ.นครราชสีมา,16:00 น.,0.4,14.549607111406168,101.26519203186035
บ้านมหาวัน,ต.มหาวัน อ.แม่สอด จ.ตาก,00:00 น.,3.5,16.577567806915333,98.59499931335449
บ้านเสียบญวน,ต.วังใหม่ อ.เมืองชุมพร จ.ชุมพร,23:00 น.,6,10.507211980713164,99.06499743461609
