สถานีทต.บ้านนา,ต.บ้านนา อ.แกลง จ.ระยอง ,06:00 ,4.8
สถานีสะพานแม่ตื่น,ต.แม่ตื่น อ.แม่ระมาด จ.ตาก ,06:00 ,4.6
สถานีทม.วังน้ำเย็น,ต.วังน้ำเย็น อ.วังน้ำเย็น จ.สระแก้ว ,06:00 ,4.6
สถานีส.คลองบางนา,ต.บางนา อ.บางนา จ.กรุงเทพมหานคร ,04:00 ,4.5
สถานีปตร.คลองรางจาก-ถ.ประชาอุทิศ,ต.ทุ่งครุ อ.ทุ่งครุ จ.กรุงเทพมหานคร ,04:00 ,4.5
สถานีบ้านนาไคร้,ต.ยางเปียง อ.อมก๋อย จ.เชียงใหม่ ,05:00 ,4.5
สถานีบ้านท่าข้าม,ต.แม่ทา อ.แม่ออน จ.เชียงใหม่ ,05:00 ,4.5
สถานีบ้านกลาง,ต.ละมอ อ.นาโยง จ.ตรัง ,05:00 ,4.5
สถานีบ้านปางน้ำฮ้าย,ต.ท่าก๊อ อ.แม่สรวย จ.เชียงราย ,05:00 ,4.5
สถานีบ้านน้ำพุ,ต.พุทธบาท อ.ชนแดน จ.เพชรบูรณ์ ,05:00 ,4.5
สถานีบ้านแม่แอบ,ต.บ้านทับ อ.แม่แจ่ม จ.เชียงใหม่ ,05:00 ,4.5
สถานีบ้านแม่ปะแพะ,ต.แม่ปะ อ.เถิน จ.ลำปาง ,05:00 ,4.5
สถานีบ้านหนองขาหยั่ง,ต.คลองตะเกรา อ.ท่าตะเกียบ จ.ฉะเชิงเทรา ,05:00 ,4.5
สถานีบ้านทอนผักกูด,ต.นบพิตำ อ.นบพิตำ จ.นครศรีธรรมราช ,05:00 ,4.5
สถานีบ้านเขาหินตั้ง,ต.สมเด็จเจริญ อ.หนองปรือ จ.กาญจนบุรี ,05:00 ,4.5
สถานีบ้านรวมไทยพัฒนาที่ 8,ต.รวมไทยพัฒนา อ.พบพระ จ.ตาก ,05:00 ,4.5
สถานีบ้านห้วยน้ำอุ่น,ต.บ่อทอง อ.ทองแสนขัน จ.อุตรดิตถ์ ,05:00 ,4.5
สถานีบ้านห้วยบอน,ต.บ้านโหนด อ.สะบ้าย้อย จ.สงขลา ,05:00 ,4.5
สถานีบ้านห้วยตาดใต้,ต.นาดอกคำ อ.นาด้วง จ.เลย ,05:00 ,4.5
สถานีน้ำตกไทรคู่,ต.ร่อนทอง อ.บางสะพาน จ.ประจวบคีรีขันธ์ ,06:00 ,4.4
สถานีอบต.บ้านจารย์,ต.บ้านจารย์ อ.สังขะ จ.สุรินทร์ ,06:00 ,4.4
สถานีหน่วยจัดการต้นน้ำขุนน่าน,ต.บ่อเกลือเหนือ อ.บ่อเกลือ จ.น่าน ,06:00 ,4.4
สถานีตลาดเก่าตะกั่วป่า,ต.โคกเคียน อ.ตะกั่วป่า จ.พังงา ,03:00 ,4.2
สถานีอบต.แก้ง,ต.แก้ง อ.เดชอุดม จ.อุบลราชธานี ,06:00 ,4.2
สถานีหน่วยพิทักษ์อุทยานแห่งชาติที่ ศล.๕ (แม่ระงอง),ต.น้ำแพร่ อ.พร้าว จ.เชียงใหม่ ,06:00 ,4.2
สถานีคลองลาดพร้าว ท้ายปตร.คลอง2,ต.สายไหม อ.สายไหม จ.กรุงเทพมหานคร ,03:00 ,4.2
สถานีหน่วยพิทักษ์ป่าเขาพัง,ต.เขาพัง อ.บ้านตาขุน จ.สุราษฎร์ธานี ,05:00 ,4
สถานีวัดคอกช้าง อ.ธารโต จ.ยะลา,ต.แม่หวาด อ.ธารโต จ.ยะลา ,05:00 ,4
สถานีบ้านม่วงคำ,ต.นางแล อ.เมืองเชียงราย จ.เชียงราย ,05:00 ,4
สถานีคลองมหาสวัสดิ บางกรวย-สวนผัก,ต.ตลิ่งชัน อ.ตลิ่งชัน จ.กรุงเทพมหานคร ,03:00 ,4
สถานีปตร.คลองบัว-ทางรถไฟ,ต.ฉิมพลี อ.ตลิ่งชัน จ.กรุงเทพมหานคร ,04:00 ,4
สถานีส.คลองบางจาก,ต.บางจาก อ.พระโขนง จ.กรุงเทพมหานคร ,04:00 ,4
สถานีบ้านห้วยน้ำเค็ม,ต.อุดมทรัพย์ อ.วังน้ำเขียว จ.นครราชสีมา ,05:00 ,4
สถานีบ้านจันตาแป๊ะ,ต.จันทเขลม อ.เขาคิชฌกูฏ จ.จันทบุรี ,05:00 ,4
สถานีส.คลองบางอ้อ,ต.บางจาก อ.พระโขนง จ.กรุงเทพมหานคร ,04:00 ,4
สถานีสะพานน้ำมวบ บ้านน้ำมวบ,ต.น้ำมวบ อ.เวียงสา จ.น่าน ,03:00 ,4
สถานีส.เทเวศร์,ต.วัดสามพระยา อ.พระนคร จ.กรุงเทพมหานคร ,04:00 ,4
สถานีบ้านนาโพธิ์,ต.นาแห้ว อ.นาแห้ว จ.เลย ,05:00 ,4
สถานีบ้านเขาหัวนา,ต.เขาเพิ่ม อ.บ้านนา จ.นครนายก ,05:00 ,4
สถานีบ้านห้วยทรายเหนือ,ต.ห้วยเฮี้ย อ.นครไทย จ.พิษณุโลก ,05:00 ,4
สถานีบ้านรวมมิตร,ต.แม่ยาว อ.เมืองเชียงราย จ.เชียงราย ,05:00 ,4
สถานีบางปะหัน,ต.ขยาย อ.บางปะหัน จ.พระนครศรีอยุธยา ,03:00 ,4
สถานีสะพานน้ำว้า บ้านน้ำว้า,ต.น้ำพาง อ.แม่จริม จ.น่าน ,22:00 ,4
สถานีเมืองชัยภูมิ,ต.กะฮาด อ.เนินสง่า จ.ชัยภูมิ ,03:00 ,3.8
สถานีเกาะลันตา,ต.เกาะลันตาใหญ่ อ.เกาะลันตา จ.กระบี่ ,04:00 ,3.6
สถานีชุมชนลีเล็ด,ต.ลีเล็ด อ.พุนพิน จ.สุราษฎร์ธานี ,03:00 ,3.6
สถานีสนามทับทุ่ม บ้านวังนาใน หมู่ที่ 10,ต.ทุ่งหว้า อ.ทุ่งหว้า จ.สตูล ,06:00 ,3.6
สถานีเขตห้ามล่าสัตว์ป่าเขาสมโภชน์,ต.นาโสม อ.ชัยบาดาล จ.ลพบุรี ,06:00 ,3.6
สถานีบ้านควนเนียง*,ต.พะตง อ.หาดใหญ่ จ.สงขลา ,05:00 ,3.5
สถานีบ้านหนองสองห้อง,ต.ห้วยแห้ง อ.แก่งคอย จ.สระบุรี ,05:00 ,3.5
สถานีจุดวัดบึงมักกะสัน,ต.มักกะสัน อ.ราชเทวี จ.กรุงเทพมหานคร ,04:00 ,3.5
สถานีบ้านห้วยโต้,ต.ทับปริก อ.เมืองกระบี่ จ.กระบี่ ,05:00 ,3.5
สถานีบ้านซำทองพัฒนา,ต.บ้านกลาง อ.วังทอง จ.พิษณุโลก ,05:00 ,3.5
สถานีบ้านควนโต๊ะเหลง,ต.ควนโดน อ.ควนโดน จ.สตูล ,05:00 ,3.5
สถานีหนองบัวลำภู,ต.ลำภู อ.เมืองหนองบัวลำภู จ.หนองบัวลำภู ,04:00 ,3.5
สถานีบ้านแม่สิน,ต.นาพูน อ.วังชิ้น จ.แพร่ ,05:00 ,3.5
สถานีบ้านห้วยน้ำดัง,ต.กื้ดช้าง อ.แม่แตง จ.เชียงใหม่ ,05:00 ,3.5
สถานีบ้านบูโล๊ะสะนีแย,ต.บ้านแหร อ.ธารโต จ.ยะลา ,05:00 ,3.5
สถานีบ้านหนองตำเสา,ต.ถ้ำสิงห์ อ.เมืองชุมพร จ.ชุมพร ,05:00 ,3.5
สถานีบ้านห้วยติ้ว,ต.ลาดค่าง อ.ภูเรือ จ.เลย ,05:00 ,3.5
สถานีบ้านวังน้ำเขียว,ต.ร่อนทอง อ.บางสะพาน จ.ประจวบคีรีขันธ์ ,05:00 ,3.5
สถานีบ้านลาดเรือ,ต.บ่อภาค อ.ชาติตระการ จ.พิษณุโลก ,05:00 ,3.5
สถานีบ้านกุดจิก,ต.หนองข่า อ.เกษตรสมบูรณ์ จ.ชัยภูมิ ,05:00 ,3.5
สถานีบ้านบางทอง,ต.บางทอง อ.ท้ายเหมือง จ.พังงา ,05:00 ,3.5
สถานีบ้านเด่นฮ่อม,ต.บ่อแก้ว อ.สะเมิง จ.เชียงใหม่ ,05:00 ,3.5
สถานีบ้านเขว้า,ต.ห้วยแย้ อ.หนองบัวระเหว จ.ชัยภูมิ ,03:00 ,3.4
สถานีคลองหอยโข่ง,ต.บ้านพรุ อ.หาดใหญ่ จ.สงขลา ,03:00 ,3.4
สถานีสะพานข้ามแม่น้ำปัตตานี,ต.กรงปินัง อ.กรงปินัง จ.ยะลา ,21:00 ,3.4
สถานีสะพานลำน้ำเลย,ต.เชียงคาน อ.เชียงคาน จ.เลย ,03:00 ,3.4
สถานีภูเก็ต,ต.ตลาดใหญ่ อ.เมืองภูเก็ต จ.ภูเก็ต ,04:00 ,3.2
สถานีสะพานห้วยน้ำสาย,ต.ตาลชุม อ.ท่าวังผา จ.น่าน ,03:00 ,3.2
สถานีนายายอาม,ต.ทุ่งเบญจา อ.ท่าใหม่ จ.จันทบุรี ,03:00 ,3.2
สถานีทต.ลำแก่น,ต.ลำแก่น อ.ท้ายเหมือง จ.พังงา ,06:00 ,3.2
สถานีชุมชนแม่ตาลน้อย,ต.เวียงตาล อ.ห้างฉัตร จ.ลำปาง ,06:00 ,3.2
สถานีบ้าน กม.80,ต.บุพราหมณ์ อ.นาดี จ.ปราจีนบุรี ,05:00 ,3
สถานีพุนพิน 1,ต.ท่าข้าม อ.พุนพิน จ.สุราษฎร์ธานี ,03:00 ,3
สถานีแม่น้ำมูล บ้านคันไร่,ต.ทรายมูล อ.พิบูลมังสาหาร จ.อุบลราชธานี ,05:00 ,3
สถานีลำพะเนียง อ.เมือง,ต.หนองบัว อ.เมืองหนองบัวลำภู จ.หนองบัวลำภู ,05:00 ,3
สถานีบ้านวังยายมุก,ต.คลองพลู อ.เขาคิชฌกูฏ จ.จันทบุรี ,05:00 ,3
สถานีบ้านวังขอน,ต.ระเริง อ.วังน้ำเขียว จ.นครราชสีมา ,05:00 ,3
สถานีวัดท่ายาง,ต.ท่ายาง อ.ทุ่งใหญ่ จ.นครศรีธรรมราช ,05:00 ,3
สถานีบ้านมหาโพธิ,ต.มหาโพธิ อ.สระโบสถ์ จ.ลพบุรี ,05:00 ,3
สถานีบ้านโคกสง่า,ต.หนองสาหร่าย อ.ปากช่อง จ.นครราชสีมา ,05:00 ,3
สถานีคลองมหาชัย วัดพันท้ายนรสิงห์,ต.พันท้ายนรสิงห์ อ.เมืองสมุทรสาคร จ.สมุทรสาคร ,03:00 ,3
สถานีบ้านห้วยหมี,ต.มหาวัน อ.แม่สอด จ.ตาก ,05:00 ,3
สถานีสะพานบ้าน กม.29 อ.เบตง จ.ยะลา,ต.อัยเยอร์เวง อ.เบตง จ.ยะลา ,05:00 ,3
สถานีบ้านหน้าเขา,ต.นาหลวงเสน อ.ทุ่งสง จ.นครศรีธรรมราช ,05:00 ,3
สถานีชุมชนบ้านแม่ละอุป,ต.แจ่มหลวง อ.กัลยาณิวัฒนา จ.เชียงใหม่ ,06:00 ,3
สถานีบ้านทุ่งหยีเพ็ง,ต.ศาลาด่าน อ.เกาะลันตา จ.กระบี่ ,05:00 ,3
สถานีบ้านพุบอนบน,ต.บ้านบึง อ.บ้านคา จ.ราชบุรี ,05:00 ,3
สถานีอบต.ปังเผล,ต.ปรังเผล อ.สังขละบุรี จ.กาญจนบุรี ,06:00 ,3
สถานีสถานีตำรวจภูธรกะพ้อ,ต.กะรุบี อ.กะพ้อ จ.ปัตตานี ,03:00 ,3
สถานีบ้านเทอดชาติ,ต.บ่อภาค อ.ชาติตระการ จ.พิษณุโลก ,05:00 ,3
สถานีหน่วยจัดการต้นน้ำคลองป่าพรุพ้อ,ต.ทุ่งนารี อ.ป่าบอน จ.พัทลุง ,06:00 ,3
สถานีบ้านดอกแดง,ต.บางไทร อ.ตะกั่วป่า จ.พังงา ,02:00 ,3
สถานีบ้านวังชุมทอง,ต.วังใหม่ อ.วังสมบูรณ์ จ.สระแก้ว ,05:00 ,3
สถานีบ้านโป่งไฮ,ต.แม่สาว อ.แม่อาย จ.เชียงใหม่ ,05:00 ,3
สถานีบ้านควน,ต.พะโต๊ะ อ.พะโต๊ะ จ.ชุมพร ,05:00 ,3
สถานีบ้านสหกรณ์แปลง 5,ต.ป่าตุ้ม อ.พร้าว จ.เชียงใหม่ ,05:00 ,3
สถานีบ้านบ่อแก้ว,ต.ไทรย้อย อ.เด่นชัย จ.แพร่ ,05:00 ,3
สถานีบ้านคลองไทร,ต.หนองย่างเสือ อ.มวกเหล็ก จ.สระบุรี ,05:00 ,3
สถานีองค์การบริหารส่วนตำบลตาชี,ต.ตาชี อ.ยะหา จ.ยะลา ,06:00 ,3
สถานีบ้านระหัด,ต.กุดเลาะ อ.เกษตรสมบูรณ์ จ.ชัยภูมิ ,05:00 ,3
สถานีบ้านหนองม่วน (ดง),ต.ห้วยห้อม อ.แม่ลาน้อย จ.แม่ฮ่องสอน ,05:00 ,3
สถานีบ้านนอก,ต.ตาชี อ.ยะหา จ.ยะลา ,05:00 ,3
สถานีบ้านหลวง,ต.แม่งอน อ.ฝาง จ.เชียงใหม่ ,05:00 ,3
สถานีอบต.บ้านแมด,ต.บ้านแมด อ.บุณฑริก จ.อุบลราชธานี ,06:00 ,3
สถานีส.คลองเจ็ก,ต.บางจาก อ.พระโขนง จ.กรุงเทพมหานคร ,04:00 ,3
สถานีบ้านถ้ำพริก,ต.บ้านแยง อ.นครไทย จ.พิษณุโลก ,05:00 ,3
สถานีสะพานห้วยน้ำฮวย,ต.บ้านม่วง อ.สังคม จ.หนองคาย ,03:00 ,3
สถานีคลองแม่รำพัน 1,ต.เมืองเก่า อ.เมืองสุโขทัย จ.สุโขทัย ,03:00 ,2.8
สถานีหมู่บ้านปิยะมิตร 3,ต.อัยเยอร์เวง อ.เบตง จ.ยะลา ,06:00 ,2.8
สถานีอบต.ระเว,ต.ระเว อ.พิบูลมังสาหาร จ.อุบลราชธานี ,06:00 ,2.8
สถานีเชียงดาว,ต.เชียงดาว อ.เชียงดาว จ.เชียงใหม่ ,03:00 ,2.8
สถานีหน่วยพิทักษ์อุทยานแห่งชาติที่ ทล.๑๑ (ไทยสามัคคี),ต.ไทยสามัคคี อ.วังน้ำเขียว จ.นครราชสีมา ,06:00 ,2.8
สถานีอบต.ไม้ขาว,ต.ไม้ขาว อ.ถลาง จ.ภูเก็ต ,06:00 ,2.8
สถานีทม.ตากใบ,ต.เจ๊ะเห อ.ตากใบ จ.นราธิวาส ,06:00 ,2.8
สถานีท้ายปตร.ช่องแค,ต.พรหมนิมิต อ.ตาคลี จ.นครสวรรค์ ,03:00 ,2.8
สถานีเหนือปตร.ช่องแค,ต.พรหมนิมิต อ.ตาคลี จ.นครสวรรค์ ,03:00 ,2.8
สถานีปากช่อง สกษ.,ต.หนองน้ำแดง อ.ปากช่อง จ.นครราชสีมา ,04:00 ,2.7
สถานีสะพานน้ำยาว บ้านสองแคว,ต.นาไร่หลวง อ.สองแคว จ.น่าน ,03:00 ,2.6
สถานีฝายคลองท่าเลา,ต.นาหลวงเสน อ.ทุ่งสง จ.นครศรีธรรมราช ,03:00 ,2.6
สถานีสะพานบางไตประชาบริรักษ์,ต.ตะกุกเหนือ อ.วิภาวดี จ.สุราษฎร์ธานี ,03:00 ,2.6
สถานีอบต.คลองศก,ต.คลองศก อ.พนม จ.สุราษฎร์ธานี ,06:00 ,2.6
สถานีป้อมพระจุลจอมเกล้า,ต.แหลมฟ้าผ่า อ.พระสมุทรเจดีย์ จ.สมุทรปราการ ,01:00 ,2.6
สถานีแม่สรวย,ต.แม่สรวย อ.แม่สรวย จ.เชียงราย ,03:00 ,2.6
สถานีที่ทำการอุทยานแห่งชาติดอยผ้าห่มปก,ต.ม่อนปิ่น อ.ฝาง จ.เชียงใหม่ ,06:00 ,2.6
สถานีอบต.คลองตะเกรา,ต.คลองตะเกรา อ.ท่าตะเกียบ จ.ฉะเชิงเทรา ,06:00 ,2.6
สถานีปตร. คลองบางน้ำผึ้ง,ต.บางน้ำผึ้ง อ.พระประแดง จ.สมุทรปราการ ,03:00 ,2.6
สถานีบ้านดงโคร่ง,ต.หินดาด อ.ทองผาภูมิ จ.กาญจนบุรี ,05:00 ,2.5
สถานีบ้านบ้องตี้บน,ต.บ้องตี้ อ.ไทรโยค จ.กาญจนบุรี ,05:00 ,2.5
สถานีบ้านสระน้ำใส,ต.โป่งตาลอง อ.ปากช่อง จ.นครราชสีมา ,05:00 ,2.5
สถานีบ้านเสรีราษฎร์,ต.ช่องแคบ อ.พบพระ จ.ตาก ,05:00 ,2.5
สถานีบ้านธรรมสถิตย์,ต.สำนักทอง อ.เมืองระยอง จ.ระยอง ,05:00 ,2.5
สถานีปตร.คลองอรชร,ต.ปทุมวัน อ.ปทุมวัน จ.กรุงเทพมหานคร ,04:00 ,2.5
สถานีบ้านไทยสามัคคี,ต.แม่กาษา อ.แม่สอด จ.ตาก ,05:00 ,2.5
สถานีบ้านน้ำหรา,ต.ทุ่งนุ้ย อ.ควนกาหลง จ.สตูล ,05:00 ,2.5
สถานีบ้านห้วยฮ่อม,ต.บ้านจันทร์ อ.กัลยาณิวัฒนา จ.เชียงใหม่ ,05:00 ,2.5
สถานีบ้านผาลาด,ต.แม่กุ อ.แม่สอด จ.ตาก ,05:00 ,2.5
สถานีบ้านบ่อภาค,ต.บ่อภาค อ.ชาติตระการ จ.พิษณุโลก ,05:00 ,2.5
สถานีบ้านห้วยทราย,ต.แม่เจดีย์ อ.เวียงป่าเป้า จ.เชียงราย ,05:00 ,2.5
สถานีเขตภาษีเจริญ,ต.บางหว้า อ.ภาษีเจริญ จ.กรุงเทพมหานคร ,04:00 ,2.5
สถานีเขตบางกอกน้อย,ต.ศิริราช อ.บางกอกน้อย จ.กรุงเทพมหานคร ,04:00 ,2.5
สถานีบ้านวังไทร,ต.แม่หวาด อ.ธารโต จ.ยะลา ,05:00 ,2.5
สถานีบ้านพรุตู,ต.เกาะสะบ้า อ.เทพา จ.สงขลา ,05:00 ,2.5
สถานีบ้านใหม่ดอนแก้ว,ต.ทาเหนือ อ.แม่ออน จ.เชียงใหม่ ,05:00 ,2.5
สถานีบ้านทรายขาวออก,ต.ทรายขาว อ.โคกโพธิ์ จ.ปัตตานี ,05:00 ,2.5
สถานีบ้านป่าฮิ้น,ต.บ้านโป่ง อ.พร้าว จ.เชียงใหม่ ,05:00 ,2.5
สถานีบ้านหาดทรายเปลือกหอย,ต.คลองเคียน อ.ตะกั่วทุ่ง จ.พังงา ,05:00 ,2.5
สถานีบ้านปางตอง,ต.แม่อูคอ อ.ขุนยวม จ.แม่ฮ่องสอน ,05:00 ,2.5
สถานีบ้านวังนาใน,ต.ทุ่งหว้า อ.ทุ่งหว้า จ.สตูล ,05:00 ,2.5
สถานีบ้านวังท่าดี*,ต.วังท่าดี อ.หนองไผ่ จ.เพชรบูรณ์ ,05:00 ,2.5
สถานีสถานีศึกษาภูมิอากาศป่าไม้ลุ่มน้ำยม,ต.ในเวียง อ.เมืองแพร่ จ.แพร่ ,06:00 ,2.4
สถานีตะกั่วป่า,ต.ตำตัว อ.ตะกั่วป่า จ.พังงา ,03:00 ,2.4
สถานีอุทยานแห่งชาติภูแลนคา,ต.ห้วยต้อน อ.เมืองชัยภูมิ จ.ชัยภูมิ ,03:00 ,2.4
สถานีอบต.บึงชำอ้อ,ต.บึงชำอ้อ อ.หนองเสือ จ.ปทุมธานี ,06:00 ,2.4
สถานีหน่วยพิทักษ์อุทยานแห่งชาติที่ ผท.๑ (ปากบอก),ต.บ้านร้อง อ.งาว จ.ลำปาง ,06:00 ,2.4
สถานีทองผาภูมิ,ต.ท่าขนุน อ.ทองผาภูมิ จ.กาญจนบุรี ,04:00 ,2.4
สถานีรพสต.บ้านทุ่งเสือโทน,ต.เนินขาม อ.เนินขาม จ.ชัยนาท ,18:00 ,2.2
สถานีทต.ไชยปราการ,ต.ปงตำ อ.ไชยปราการ จ.เชียงใหม่ ,03:00 ,2.2
สถานีสะพานแม่ฟ้าหลวง,ต.ริมกก อ.เมืองเชียงราย จ.เชียงราย ,03:00 ,2.2
สถานีทต.หนองบอน,ต.หนองบอน อ.บ่อไร่ จ.ตราด ,06:00 ,2.2
สถานีสะพานห้วยหลวง,ต.วัดหลวง อ.โพนพิสัย จ.หนองคาย ,03:00 ,2.2
สถานีทับมา,ต.ทับมา อ.เมืองระยอง จ.ระยอง ,03:00 ,2.2
สถานีอบต.บางปิด,ต.บางปิด อ.แหลมงอบ จ.ตราด ,03:00 ,2.2
สถานีเมืองสุรินทร์,ต.หนองเต็ง อ.กระสัง จ.บุรีรัมย์ ,03:00 ,2.2
สถานีสะพานบ้านตรังพัฒนา,ต.พะโต๊ะ อ.พะโต๊ะ จ.ชุมพร ,03:00 ,2.2
สถานีสตึก,ต.กระเบื้อง อ.ชุมพลบุรี จ.สุรินทร์ ,03:00 ,2.2
สถานีประปาหมู่บ้านคลองเพลิน,ต.ร่อนทอง อ.บางสะพาน จ.ประจวบคีรีขันธ์ ,06:00 ,2.2
